question;answer;answer_ab
"Монета е глава нагоре. Гас не хвърля монетата. Брок хвърля монетата. Ейва не хвърля монетата. Джена хвърля монетата. Монетата все още ли е нагоре? Забележете, че ""обърнете"" тук означава ""обратно"". ";Да, да ;A
"Монета е глава нагоре. Карън не хвърля монетата. Хектор хвърля монетата. Май хвърля монетата. Стивън хвърля монетата. Монетата все още ли е нагоре? Забележете, че ""обърнете"" тук означава ""обратно"". ";Не, не ;B
"Монета е глава нагоре. Александър не хвърля монета. Марина не хвърля монета. Валентина не хвърля монетата. Мила не хвърля монета. Монетата все още ли е нагоре? Забележете, че ""обърнете"" тук означава ""обратно"". ";Да, да ;A
"Монета е глава нагоре. Кристин не хвърля монетата. Ван хвърля монетата. Марисол хвърля монетата. Престън не хвърля монета. Монетата все още ли е нагоре? Забележете, че ""обърнете"" тук означава ""обратно"". ";Да, да ;A
"Монета е глава нагоре. Евън не хвърля монетата. Рей хвърля монетата. София хвърля монетата. Алонсо не хвърля монетата. Монетата все още ли е нагоре? Забележете, че ""обърнете"" тук означава ""обратно"". ";Да, да ;A
"Монета е глава нагоре. Алфонсо не хвърля монетата. Колин не хвърля монетата. Амадо не хвърля монетата. Дик хвърля монетата. Монетата все още ли е нагоре? Забележете, че ""обърнете"" тук означава ""обратно"". ";Не, не ;B
"Монета е глава нагоре. Лес не хвърля монетата. Джун хвърля монетата. Ное хвърля монетата. Джулиана хвърля монетата. Монетата все още ли е нагоре? Забележете, че ""обърнете"" тук означава ""обратно"". ";Не, не ;B
"Монета е глава нагоре. Дамиън хвърля монетата. Кристал хвърля монетата. Ниша хвърля монетата. Хернан не хвърля монета. Монетата все още ли е нагоре? Забележете, че ""обърнете"" тук означава ""обратно"". ";Не, не ;B
"Монета е глава нагоре. Розарио не хвърля монетата. Манодж не хвърля монетата. Адолфо хвърля монетата. Рейна не хвърля монетата. Монетата все още ли е нагоре? Забележете, че ""обърнете"" тук означава ""обратно"". ";Не, не ;B
"Монета е глава нагоре. Марсия не хвърля монета. Белен не хвърля монета. Рейна хвърля монетата. Бритни хвърля монетата. Монетата все още ли е нагоре? Забележете, че ""обърнете"" тук означава ""обратно"". ";Да, да ;A
"Монета е глава нагоре. Идалия хвърля монетата. Арнолдо не хвърля монетата. Марла не хвърля монета. Дуейн не хвърля монетата. Монетата все още ли е нагоре? Забележете, че ""обърнете"" тук означава ""обратно"". ";Не, не ;B
"Монета е глава нагоре. Катя не хвърля монетата. Мина не хвърля монетата. Кам не хвърля монетата. Ронда не хвърля монетата. Монетата все още ли е нагоре? Забележете, че ""обърнете"" тук означава ""обратно"". ";Да, да ;A
"Монета е глава нагоре. Рашад не хвърля монетата. Савана хвърля монетата. Флавио не хвърля монетата. Бърт не хвърля монетата. Монетата все още ли е нагоре? Забележете, че ""обърнете"" тук означава ""обратно"". ";Не, не ;B
"Монета е глава нагоре. Лиан хвърля монетата. Лулу не хвърля монетата. Лопез не хвърля монета. Джей Пи не хвърля монета. Монетата все още ли е нагоре? Забележете, че ""обърнете"" тук означава ""обратно"". ";Не, не ;B
"Монета е глава нагоре. Лора не хвърля монетата. Алберто не хвърля монета. Кати не хвърля монета. Кара не хвърля монетата. Монетата все още ли е нагоре? Забележете, че ""обърнете"" тук означава ""обратно"". ";Да, да ;A
"Монета е глава нагоре. Рони хвърля монетата. Никита не хвърля монетата. Хана хвърля монетата. Киана не хвърля монетата. Монетата все още ли е нагоре? Забележете, че ""обърнете"" тук означава ""обратно"". ";Да, да ;A
"Монета е глава нагоре. Едуин хвърля монетата. Красивата не хвърля монетата. Кърт хвърля монетата. Деймън хвърля монетата. Монетата все още ли е нагоре? Забележете, че ""обърнете"" тук означава ""обратно"". ";Не, не ;B
"Монета е глава нагоре. Миси хвърля монетата. Ерин хвърля монетата. Лорна хвърля монетата. Лени хвърля монетата. Монетата все още ли е нагоре? Забележете, че ""обърнете"" тук означава ""обратно"". ";Да, да ;A
"Монета е глава нагоре. Виджай хвърля монетата. Шери не хвърля монета. Дъг не хвърля монетата. Сузи хвърля монетата. Монетата все още ли е нагоре? Забележете, че ""обърнете"" тук означава ""обратно"". ";Да, да ;A
"Монета е глава нагоре. Клаудия хвърля монетата. Коул не хвърля монетата. Матю не хвърля монетата. Хуан Пабло не хвърля монета. Монетата все още ли е нагоре? Забележете, че ""обърнете"" тук означава ""обратно"". ";Не, не ;B
"Монета е глава нагоре. Артуро не хвърля монетата. Доминик хвърля монетата. Криста не хвърля монетата. Майлс не хвърля монетата. Монетата все още ли е нагоре? Забележете, че ""обърнете"" тук означава ""обратно"". ";Не, не ;B
"Монета е глава нагоре. Марк хвърля монетата. Дорис хвърля монетата. Ърни не хвърля монета. Гари хвърля монетата. Монетата все още ли е нагоре? Забележете, че ""обърнете"" тук означава ""обратно"". ";Не, не ;B
"Монета е глава нагоре. Тереза хвърля монетата. Рийд не хвърля монетата. Карин не хвърля монетата. Грейси не хвърля монета. Монетата все още ли е нагоре? Забележете, че ""обърнете"" тук означава ""обратно"". ";Не, не ;B
"Монета е глава нагоре. Рахул хвърля монетата. Правин хвърля монетата. Исая хвърля монетата. Елзи не хвърля монетата. Монетата все още ли е нагоре? Забележете, че ""обърнете"" тук означава ""обратно"". ";Не, не ;B
"Монета е глава нагоре. Миранда не хвърля монетата. Жак не хвърля монета. Кларънс хвърля монетата. Чандра хвърля монетата. Монетата все още ли е нагоре? Забележете, че ""обърнете"" тук означава ""обратно"". ";Да, да ;A
"Монета е глава нагоре. Джун хвърля монетата. Робин не хвърля монетата. Джоузи хвърля монетата. Бо не хвърля монетата. Монетата все още ли е нагоре? Забележете, че ""обърнете"" тук означава ""обратно"". ";Да, да ;A
"Монета е глава нагоре. Луиза не хвърля монетата. Татьяна не хвърля монетата. Дрейк не хвърля монета. Хилари не хвърля монета. Монетата все още ли е нагоре? Забележете, че ""обърнете"" тук означава ""обратно"". ";Да, да ;A
"Монета е глава нагоре. Луиз хвърля монетата. Мариано не хвърля монетата. Лора не хвърля монета. Джерадо хвърля монетата. Монетата все още ли е нагоре? Забележете, че ""обърнете"" тук означава ""обратно"". ";Да, да ;A
"Монета е глава нагоре. Звездата хвърля монетата. Джуд не хвърля монетата. Розмари не хвърля монетата. Ракел не хвърля монетата. Монетата все още ли е нагоре? Забележете, че ""обърнете"" тук означава ""обратно"". ";Не, не ;B
"Монета е глава нагоре. Кларк не хвърля монетата. Джен хвърля монетата. Даян хвърля монетата. Блеър не хвърля монета. Монетата все още ли е нагоре? Забележете, че ""обърнете"" тук означава ""обратно"". ";Да, да ;A
"Монета е глава нагоре. Лало не хвърля монетата. Йоланда хвърля монетата. Елида не хвърля монетата. Естер хвърля монетата. Монетата все още ли е нагоре? Забележете, че ""обърнете"" тук означава ""обратно"". ";Да, да ;A
"Монета е глава нагоре. Бетани не хвърля монетата. Ракеш не хвърля монетата. Кристин не хвърля монетата. Динеш хвърля монетата. Монетата все още ли е нагоре? Забележете, че ""обърнете"" тук означава ""обратно"". ";Не, не ;B
"Монета е глава нагоре. Нери хвърля монетата. Синди хвърля монетата. Джес хвърля монетата. Крис хвърля монетата. Монетата все още ли е нагоре? Забележете, че ""обърнете"" тук означава ""обратно"". ";Да, да ;A
"Монета е глава нагоре. Мириам не хвърля монетата. Бранди хвърля монетата. Берта хвърля монетата. Ренато хвърля монетата. Монетата все още ли е нагоре? Забележете, че ""обърнете"" тук означава ""обратно"". ";Не, не ;B
"Монета е глава нагоре. Абел хвърля монетата. Малори хвърля монетата. Тереза не хвърля монета. Куин хвърля монетата. Монетата все още ли е нагоре? Забележете, че ""обърнете"" тук означава ""обратно"". ";Не, не ;B
"Монета е глава нагоре. Селсо не хвърля монетата. Трейси не хвърля монетата. Уинстън хвърля монетата. Антон не хвърля монетата. Монетата все още ли е нагоре? Забележете, че ""обърнете"" тук означава ""обратно"". ";Не, не ;B
"Монета е глава нагоре. Лор не хвърля монетата. Еразмо хвърля монетата. Луис хвърля монетата. Давид не хвърля монетата. Монетата все още ли е нагоре? Забележете, че ""обърнете"" тук означава ""обратно"". ";Да, да ;A
"Монета е глава нагоре. Кристобал хвърля монетата. Дания не хвърля монетата. Ли не хвърля монетата. Ана хвърля монетата. Монетата все още ли е нагоре? Забележете, че ""обърнете"" тук означава ""обратно"". ";Да, да ;A
"Монета е глава нагоре. Уоли хвърля монетата. Клеър не хвърля монетата. Хелън хвърля монетата. Начо не хвърля монетата. Монетата все още ли е нагоре? Забележете, че ""обърнете"" тук означава ""обратно"". ";Да, да ;A
"Монета е глава нагоре. Роза хвърля монетата. Лана хвърля монетата. Къртис не хвърля монета. Рей не хвърля монетата. Монетата все още ли е нагоре? Забележете, че ""обърнете"" тук означава ""обратно"". ";Да, да ;A
"Монета е глава нагоре. Анджелис хвърля монетата. Ричард хвърля монетата. Лучиана хвърля монетата. Дарлийн не хвърля монетата. Монетата все още ли е нагоре? Забележете, че ""обърнете"" тук означава ""обратно"". ";Не, не ;B
"Монета е глава нагоре. Джоди хвърля монетата. Джуди хвърля монетата. Ния не хвърля монетата. Радж хвърля монетата. Монетата все още ли е нагоре? Забележете, че ""обърнете"" тук означава ""обратно"". ";Не, не ;B
"Монета е глава нагоре. Ървин не хвърля монета. Бритни хвърля монетата. Винс хвърля монетата. Лукас не хвърля монетата. Монетата все още ли е нагоре? Забележете, че ""обърнете"" тук означава ""обратно"". ";Да, да ;A
"Монета е глава нагоре. Гийл не хвърля монета. Лиса хвърля монетата. Харви не хвърля монета. Джина не хвърля монета. Монетата все още ли е нагоре? Забележете, че ""обърнете"" тук означава ""обратно"". ";Не, не ;B
"Монета е глава нагоре. Рената хвърля монетата. Мариела не хвърля монета. Мона не хвърля монетата. Кристин хвърля монетата. Монетата все още ли е нагоре? Забележете, че ""обърнете"" тук означава ""обратно"". ";Да, да ;A
"Монета е глава нагоре. Йохан хвърля монетата. Деймиън хвърля монетата. Серина хвърля монетата. Грейс хвърля монетата. Монетата все още ли е нагоре? Забележете, че ""обърнете"" тук означава ""обратно"". ";Да, да ;A
"Монета е глава нагоре. Адж не хвърля монетата. Джей Ди хвърля монетата. Мади не хвърля монета. Франсиска не хвърля монетата. Монетата все още ли е нагоре? Забележете, че ""обърнете"" тук означава ""обратно"". ";Не, не ;B
"Монета е глава нагоре. Дарил не хвърля монетата. Оуен не хвърля монетата. Майра хвърля монетата. Аарон не хвърля монетата. Монетата все още ли е нагоре? Забележете, че ""обърнете"" тук означава ""обратно"". ";Не, не ;B
"Монета е глава нагоре. Ник хвърля монетата. Ада хвърля монетата. Стефани не хвърля монетата. Сузи хвърля монетата. Монетата все още ли е нагоре? Забележете, че ""обърнете"" тук означава ""обратно"". ";Не, не ;B
"Монета е глава нагоре. Ел хвърля монетата. Алекс не хвърля монетата. Ирма хвърля монетата. Стефан хвърля монетата. Монетата все още ли е нагоре? Забележете, че ""обърнете"" тук означава ""обратно"". ";Не, не ;B
"Монета е глава нагоре. Арнолд не хвърля монетата. Ейдън не хвърля монетата. Али хвърля монетата. Ами не хвърля монетата. Монетата все още ли е нагоре? Забележете, че ""обърнете"" тук означава ""обратно"". ";Не, не ;B
"Монета е глава нагоре. Габино не хвърля монетата. Кайла хвърля монетата. Лори не хвърля монетата. Familia хвърля монетата. Монетата все още ли е нагоре? Забележете, че ""обърнете"" тук означава ""обратно"". ";Да, да ;A
"Монета е глава нагоре. Логан не хвърля монета. Ели не хвърля монета. Аби не хвърля монета. Колийн не хвърля монета. Монетата все още ли е нагоре? Забележете, че ""обърнете"" тук означава ""обратно"". ";Да, да ;A
"Монета е глава нагоре. Кристи хвърля монетата. Бранди не хвърля монетата. Лизет не хвърля монета. Петра хвърля монетата. Монетата все още ли е нагоре? Забележете, че ""обърнете"" тук означава ""обратно"". ";Да, да ;A
"Монета е глава нагоре. Хейзъл не хвърля монетата. Габриел хвърля монетата. Тре не хвърля монетата. Далтън не хвърля монетата. Монетата все още ли е нагоре? Забележете, че ""обърнете"" тук означава ""обратно"". ";Не, не ;B
"Монета е глава нагоре. Конрад хвърля монетата. Марцела не хвърля монетата. Анет хвърля монетата. Естебан хвърля монетата. Монетата все още ли е нагоре? Забележете, че ""обърнете"" тук означава ""обратно"". ";Не, не ;B
"Монета е глава нагоре. Исак не хвърля монетата. Рейес не хвърля монетата. Карли хвърля монетата. Таня хвърля монетата. Монетата все още ли е нагоре? Забележете, че ""обърнете"" тук означава ""обратно"". ";Да, да ;A
"Монета е глава нагоре. Уилма хвърля монетата. Марджи хвърля монетата. Амбър хвърля монетата. Серджо хвърля монетата. Монетата все още ли е нагоре? Забележете, че ""обърнете"" тук означава ""обратно"". ";Да, да ;A
"Монета е глава нагоре. Соня хвърля монетата. Еди не хвърля монетата. Карол не хвърля монета. Юнг хвърля монетата. Монетата все още ли е нагоре? Забележете, че ""обърнете"" тук означава ""обратно"". ";Да, да ;A
"Монета е глава нагоре. Леандро хвърля монетата. Марисела не хвърля монетата. Женевив хвърля монетата. Лесли не хвърля монетата. Монетата все още ли е нагоре? Забележете, че ""обърнете"" тук означава ""обратно"". ";Да, да ;A
"Монета е глава нагоре. Анди не хвърля монета. Сесилия хвърля монетата. Гречън хвърля монетата. Санди хвърля монетата. Монетата все още ли е нагоре? Забележете, че ""обърнете"" тук означава ""обратно"". ";Не, не ;B
"Монета е глава нагоре. Дарвин хвърля монетата. Колин хвърля монетата. Джей хвърля монетата. Абишек хвърля монетата. Монетата все още ли е нагоре? Забележете, че ""обърнете"" тук означава ""обратно"". ";Да, да ;A
"Монета е глава нагоре. Лупита хвърля монетата. Синди хвърля монетата. Кей не хвърля монетата. Дерик хвърля монетата. Монетата все още ли е нагоре? Забележете, че ""обърнете"" тук означава ""обратно"". ";Не, не ;B
"Монета е глава нагоре. Фелипе не хвърля монетата. Хайди хвърля монетата. Нино не хвърля монетата. Брадли не хвърля монетата. Монетата все още ли е нагоре? Забележете, че ""обърнете"" тук означава ""обратно"". ";Не, не ;B
"Монета е глава нагоре. Дориан хвърля монетата. Майра хвърля монетата. Фреди не хвърля монета. Магали хвърля монетата. Монетата все още ли е нагоре? Забележете, че ""обърнете"" тук означава ""обратно"". ";Не, не ;B
"Монета е глава нагоре. Флора хвърля монетата. Уорън хвърля монетата. Гвендолин не хвърля монетата. Алиса не хвърля монетата. Монетата все още ли е нагоре? Забележете, че ""обърнете"" тук означава ""обратно"". ";Да, да ;A
"Монета е глава нагоре. Асото хвърля монетата. Роузи не хвърля монета. Кимбърли не хвърля монета. Жан не хвърля монета. Монетата все още ли е нагоре? Забележете, че ""обърнете"" тук означава ""обратно"". ";Не, не ;B
"Монета е глава нагоре. Джереми не хвърля монета. Симон хвърля монетата. Алондра не хвърля монета. Уайът не хвърля монета. Монетата все още ли е нагоре? Забележете, че ""обърнете"" тук означава ""обратно"". ";Не, не ;B
