question;answer;answer_ab
"Mince je hlavou vzhůru. Angelica hodí mincí. Tariq hodí mincí. Uršula neháže mincí. Nena neháže mincí. Je mince stále hlavou vzhůru? Všimněte si, že ""převrat"" zde znamená ""obrat"". ";Ano, ano, ano ;A
"Mince je hlavou vzhůru. Luz neháže mincí. Terence hodí mincí. Elder nehraje s mincí. Jazmin neháže mincí. Je mince stále hlavou vzhůru? Všimněte si, že ""převrat"" zde znamená ""obrat"". ";Ne, ne, ne. ;B
"Mince je hlavou vzhůru. Roberta nehraje mincí. Mauro hodí mincí. Clint hodí mincí. Marcela hodí mincí. Je mince stále hlavou vzhůru? Všimněte si, že ""převrat"" zde znamená ""obrat"". ";Ne, ne, ne. ;B
"Mince je hlavou vzhůru. Adrian hodí mincí. Marlon hodí mincí. Karla hodí mincí. Florence hodí mincí. Je mince stále hlavou vzhůru? Všimněte si, že ""převrat"" zde znamená ""obrat"". ";Ano, ano, ano ;A
"Mince je hlavou vzhůru. Skyler neháže mincí. Oliver neháže mincí. Cristy neháže mincí. Sierra hodí mincí. Je mince stále hlavou vzhůru? Všimněte si, že ""převrat"" zde znamená ""obrat"". ";Ne, ne, ne. ;B
"Mince je hlavou vzhůru. Barbie neháže mincí. Desiree neháže mincí. Yaneth neháže mincí. Dre neháže mincí. Je mince stále hlavou vzhůru? Všimněte si, že ""převrat"" zde znamená ""obrat"". ";Ano, ano, ano ;A
"Mince je hlavou vzhůru. Dan neháže mincí. Ruth nehraje s mincí. Xavier hodí mincí. Isidro neháže mincí. Je mince stále hlavou vzhůru? Všimněte si, že ""převrat"" zde znamená ""obrat"". ";Ne, ne, ne. ;B
"Mince je hlavou vzhůru. Filip hodí mincí. Antonius hodí mincí. Iris hodí mincí. Alicia hodí mincí. Je mince stále hlavou vzhůru? Všimněte si, že ""převrat"" zde znamená ""obrat"". ";Ano, ano, ano ;A
"Mince je hlavou vzhůru. Corey hodí mincí. Elf nehraje mincí. Tino hodí mincí. Melvin hodí mincí. Je mince stále hlavou vzhůru? Všimněte si, že ""převrat"" zde znamená ""obrat"". ";Ne, ne, ne. ;B
"Mince je hlavou vzhůru. Russell nehraje s mincí. Mitchell neháže mincí. Bee hodí mincí. Víra neháže mincí. Je mince stále hlavou vzhůru? Všimněte si, že ""převrat"" zde znamená ""obrat"". ";Ne, ne, ne. ;B
"Mince je hlavou vzhůru. Bri neháže mincí. Roger hodí mincí. Eve neháže mincí. Diana hodí mincí. Je mince stále hlavou vzhůru? Všimněte si, že ""převrat"" zde znamená ""obrat"". ";Ano, ano, ano ;A
"Mince je hlavou vzhůru. Gisela hodí mincí. Gerald nehraje mincí. Mackenzie hodí mincí. Ashley hodí mincí. Je mince stále hlavou vzhůru? Všimněte si, že ""převrat"" zde znamená ""obrat"". ";Ne, ne, ne. ;B
"Mince je hlavou vzhůru. Vinny neháže mincí. Landon hodí mincí. Miguel hodí mincí. Caitlyn neháže mincí. Je mince stále hlavou vzhůru? Všimněte si, že ""převrat"" zde znamená ""obrat"". ";Ano, ano, ano ;A
"Mince je hlavou vzhůru. Constance hodí mincí. Nicholas neháže mincí. Will hodí mincí. Láska hodí mincí. Je mince stále hlavou vzhůru? Všimněte si, že ""převrat"" zde znamená ""obrat"". ";Ne, ne, ne. ;B
"Mince je hlavou vzhůru. Jeannie neháže mincí. Kenneth nehraje s mincí. Porfirio neháže mincí. Ezequiel hodí mincí. Je mince stále hlavou vzhůru? Všimněte si, že ""převrat"" zde znamená ""obrat"". ";Ne, ne, ne. ;B
"Mince je hlavou vzhůru. Mario hodí mincí. Pierre nehraje s mincí. Amit hodí mincí. Nelson neháže mincí. Je mince stále hlavou vzhůru? Všimněte si, že ""převrat"" zde znamená ""obrat"". ";Ano, ano, ano ;A
"Mince je hlavou vzhůru. Mercedes neháže mincí. Adela hodí mincí. Susana hodí mincí. Rose neháže mincí. Je mince stále hlavou vzhůru? Všimněte si, že ""převrat"" zde znamená ""obrat"". ";Ano, ano, ano ;A
"Mince je hlavou vzhůru. Fred hodí mincí. Nolan hodí mincí. Jonathan hodí mincí. Carson neháže mincí. Je mince stále hlavou vzhůru? Všimněte si, že ""převrat"" zde znamená ""obrat"". ";Ne, ne, ne. ;B
"Mince je hlavou vzhůru. Caroline hodí mincí. Demetrius hodí mincí. Fidel neháže mincí. Šalomoun hodí mincí. Je mince stále hlavou vzhůru? Všimněte si, že ""převrat"" zde znamená ""obrat"". ";Ne, ne, ne. ;B
"Mince je hlavou vzhůru. Julio neháže mincí. Sidney hodí mincí. Aiden hodí mincí. Shay neháže mincí. Je mince stále hlavou vzhůru? Všimněte si, že ""převrat"" zde znamená ""obrat"". ";Ano, ano, ano ;A
"Mince je hlavou vzhůru. Mabel neháže mincí. Estela hodí mincí. Irene hodí mincí. May hodí mincí. Je mince stále hlavou vzhůru? Všimněte si, že ""převrat"" zde znamená ""obrat"". ";Ne, ne, ne. ;B
"Mince je hlavou vzhůru. Marcus hodí mincí. Ramirez neháže mincí. Junior hodí mincí. Arely neháže mincí. Je mince stále hlavou vzhůru? Všimněte si, že ""převrat"" zde znamená ""obrat"". ";Ano, ano, ano ;A
"Mince je hlavou vzhůru. Todd hodí mincí. Joni hodí mincí. Gil hodí mincí. Fran neháže mincí. Je mince stále hlavou vzhůru? Všimněte si, že ""převrat"" zde znamená ""obrat"". ";Ne, ne, ne. ;B
"Mince je hlavou vzhůru. Gerson hodí mincí. Roxanne neháže mincí. Deborah nehraje s mincí. Nathaniel nehraje s mincí. Je mince stále hlavou vzhůru? Všimněte si, že ""převrat"" zde znamená ""obrat"". ";Ne, ne, ne. ;B
"Mince je hlavou vzhůru. Colton hodí mincí. Dexter neháže mincí. Katy hodí mincí. Brayden neháže mincí. Je mince stále hlavou vzhůru? Všimněte si, že ""převrat"" zde znamená ""obrat"". ";Ano, ano, ano ;A
"Mince je hlavou vzhůru. Tori neháže mincí. Mariam neháže mincí. Gaby neháže mincí. Brayan neháže mincí. Je mince stále hlavou vzhůru? Všimněte si, že ""převrat"" zde znamená ""obrat"". ";Ano, ano, ano ;A
"Mince je hlavou vzhůru. Michel nehraje mincí. Roy neháže mincí. Sergey neháže mincí. Jessie neháže mincí. Je mince stále hlavou vzhůru? Všimněte si, že ""převrat"" zde znamená ""obrat"". ";Ano, ano, ano ;A
"Mince je hlavou vzhůru. Anil neháže mincí. Enrique hodí mincí. Jimmy hodí mincí. Johnny neháže mincí. Je mince stále hlavou vzhůru? Všimněte si, že ""převrat"" zde znamená ""obrat"". ";Ano, ano, ano ;A
"Mince je hlavou vzhůru. Ángel hodí mincí. Carlton neháže mincí. Sameer neháže mincí. Martinez hodí mincí. Je mince stále hlavou vzhůru? Všimněte si, že ""převrat"" zde znamená ""obrat"". ";Ano, ano, ano ;A
"Mince je hlavou vzhůru. Maritza mincí neháže. Nana neháže mincí. Loretta hodí mincí. Eric nehraje s mincí. Je mince stále hlavou vzhůru? Všimněte si, že ""převrat"" zde znamená ""obrat"". ";Ne, ne, ne. ;B
"Mince je hlavou vzhůru. Thomas hodí mincí. Cara hodí mincí. Nita neháže mincí. Frances hodí mincí. Je mince stále hlavou vzhůru? Všimněte si, že ""převrat"" zde znamená ""obrat"". ";Ne, ne, ne. ;B
"Mince je hlavou vzhůru. Chuy neháže mincí. Shane neháže mincí. Jaden neháže mincí. Maynor hodí mincí. Je mince stále hlavou vzhůru? Všimněte si, že ""převrat"" zde znamená ""obrat"". ";Ne, ne, ne. ;B
"Mince je hlavou vzhůru. Violeta neháže mincí. Clay hodí mincí. Janelle neháže mincí. Mac neháže mincí. Je mince stále hlavou vzhůru? Všimněte si, že ""převrat"" zde znamená ""obrat"". ";Ne, ne, ne. ;B
"Mince je hlavou vzhůru. Guadalupe nehraje mincí. Ebony hodí mincí. Wil hodí mincí. Luke hodí mincí. Je mince stále hlavou vzhůru? Všimněte si, že ""převrat"" zde znamená ""obrat"". ";Ne, ne, ne. ;B
"Mince je hlavou vzhůru. Jenni hodí mincí. Leonel hodí mincí. Michael neháže mincí. Kat neháže mincí. Je mince stále hlavou vzhůru? Všimněte si, že ""převrat"" zde znamená ""obrat"". ";Ano, ano, ano ;A
"Mince je hlavou vzhůru. Yazmin hodí mincí. Lea neháže mincí. Rodrigo neháže mincí. Sammy hodí mincí. Je mince stále hlavou vzhůru? Všimněte si, že ""převrat"" zde znamená ""obrat"". ";Ano, ano, ano ;A
"Mince je hlavou vzhůru. Emely hodí mincí. Chelsea neháže mincí. Vladimir hodí mincí. Tyrone neháže mincí. Je mince stále hlavou vzhůru? Všimněte si, že ""převrat"" zde znamená ""obrat"". ";Ano, ano, ano ;A
"Mince je hlavou vzhůru. Bill hodí mincí. Santos neháže mincí. Roxy hodí mincí. Randi hodí mincí. Je mince stále hlavou vzhůru? Všimněte si, že ""převrat"" zde znamená ""obrat"". ";Ne, ne, ne. ;B
"Mince je hlavou vzhůru. Daphne neháže mincí. Lola hodí mincí. Joanna nehraje mincí. Sheena neháže mincí. Je mince stále hlavou vzhůru? Všimněte si, že ""převrat"" zde znamená ""obrat"". ";Ne, ne, ne. ;B
"Mince je hlavou vzhůru. Lara neháže mincí. Greg neháže mincí. Ethan hodí mincí. Terrence hodí mincí. Je mince stále hlavou vzhůru? Všimněte si, že ""převrat"" zde znamená ""obrat"". ";Ano, ano, ano ;A
"Mince je hlavou vzhůru. Otto neháže mincí. Marjorie hodí mincí. Leonor hodí mincí. Esther hodí mincí. Je mince stále hlavou vzhůru? Všimněte si, že ""převrat"" zde znamená ""obrat"". ";Ne, ne, ne. ;B
"Mince je hlavou vzhůru. Malcolm hodí mincí. Hussein neháže mincí. Franco hodí mincí. Hugo neháže mincí. Je mince stále hlavou vzhůru? Všimněte si, že ""převrat"" zde znamená ""obrat"". ";Ano, ano, ano ;A
"Mince je hlavou vzhůru. Joyce hodí mincí. Leroy hodí mincí. Alyssa nehraje s mincí. Maggie neháže mincí. Je mince stále hlavou vzhůru? Všimněte si, že ""převrat"" zde znamená ""obrat"". ";Ano, ano, ano ;A
"Mince je hlavou vzhůru. Maryam neháže mincí. Susy neháže mincí. Trinity hodí mincí. Pearl hodí mincí. Je mince stále hlavou vzhůru? Všimněte si, že ""převrat"" zde znamená ""obrat"". ";Ano, ano, ano ;A
"Mince je hlavou vzhůru. Dustin hodí mincí. Luiz neháže mincí. Rolando hodí mincí. Connor neháže mincí. Je mince stále hlavou vzhůru? Všimněte si, že ""převrat"" zde znamená ""obrat"". ";Ano, ano, ano ;A
"Mince je hlavou vzhůru. Juan Manuel hodí mincí. Benjamin hodí mincí. Rory neháže mincí. Rafael hodí mincí. Je mince stále hlavou vzhůru? Všimněte si, že ""převrat"" zde znamená ""obrat"". ";Ne, ne, ne. ;B
"Mince je hlavou vzhůru. Fermin neháže mincí. Berenice mincí neháže. Marianne neháže mincí. Eleanor hodí mincí. Je mince stále hlavou vzhůru? Všimněte si, že ""převrat"" zde znamená ""obrat"". ";Ne, ne, ne. ;B
"Mince je hlavou vzhůru. Sabrina hodí mincí. Pete neháže mincí. Mary nehraje mincí. La hodí mincí. Je mince stále hlavou vzhůru? Všimněte si, že ""převrat"" zde znamená ""obrat"". ";Ano, ano, ano ;A
"Mince je hlavou vzhůru. Estrella neháže mincí. Madison neháže mincí. Paco neháže mincí. RJ hodí mincí. Je mince stále hlavou vzhůru? Všimněte si, že ""převrat"" zde znamená ""obrat"". ";Ne, ne, ne. ;B
"Mince je hlavou vzhůru. Niki hodí mincí. Graham hodí mincí. Vernon hodí mincí. Beau hodí mincí. Je mince stále hlavou vzhůru? Všimněte si, že ""převrat"" zde znamená ""obrat"". ";Ano, ano, ano ;A
"Mince je hlavou vzhůru. Bernie neháže mincí. Melina neháže mincí. Kelsey neháže mincí. Rusty hodí mincí. Je mince stále hlavou vzhůru? Všimněte si, že ""převrat"" zde znamená ""obrat"". ";Ne, ne, ne. ;B
"Mince je hlavou vzhůru. Latoya hodí mincí. Eliseo neháže mincí. Trina hodí mincí. Melisa mincí neháže. Je mince stále hlavou vzhůru? Všimněte si, že ""převrat"" zde znamená ""obrat"". ";Ano, ano, ano ;A
"Mince je hlavou vzhůru. Wesley neháže mincí. Marcelo nehraje s mincí. Rodolfo hodí mincí. Erick neháže mincí. Je mince stále hlavou vzhůru? Všimněte si, že ""převrat"" zde znamená ""obrat"". ";Ne, ne, ne. ;B
"Mince je hlavou vzhůru. Sean neháže mincí. Rebeca hodí mincí. Marco hodí mincí. Sami hodí mincí. Je mince stále hlavou vzhůru? Všimněte si, že ""převrat"" zde znamená ""obrat"". ";Ne, ne, ne. ;B
"Mince je hlavou vzhůru. Blanca mincí neháže. Monika mincí neháže. Ervin neháže mincí. Lori hodí mincí. Je mince stále hlavou vzhůru? Všimněte si, že ""převrat"" zde znamená ""obrat"". ";Ne, ne, ne. ;B
"Mince je hlavou vzhůru. Lorraine hodí mincí. Corinne hodí mincí. Kate hodí mincí. Floyd hodí mincí. Je mince stále hlavou vzhůru? Všimněte si, že ""převrat"" zde znamená ""obrat"". ";Ano, ano, ano ;A
"Mince je hlavou vzhůru. Bruce hodí mincí. Dena hodí mincí. Kyla hodí mincí. Robbie hodí mincí. Je mince stále hlavou vzhůru? Všimněte si, že ""převrat"" zde znamená ""obrat"". ";Ano, ano, ano ;A
"Mince je hlavou vzhůru. Gee neháže mincí. Joseluis hodí mincí. Cory neháže mincí. Stefanie hodí mincí. Je mince stále hlavou vzhůru? Všimněte si, že ""převrat"" zde znamená ""obrat"". ";Ano, ano, ano ;A
"Mince je hlavou vzhůru. Kristen hodí mincí. Herbert hodí mincí. Benny neháže mincí. El neháže mincí. Je mince stále hlavou vzhůru? Všimněte si, že ""převrat"" zde znamená ""obrat"". ";Ano, ano, ano ;A
"Mince je hlavou vzhůru. Justin neháže mincí. Neal neháže mincí. JT neháže mincí. Lucie hodí mincí. Je mince stále hlavou vzhůru? Všimněte si, že ""převrat"" zde znamená ""obrat"". ";Ne, ne, ne. ;B
"Mince je hlavou vzhůru. Carmelo hodí mincí. Tony hodí mincí. Susan hodí mincí. Sara nehraje mincí. Je mince stále hlavou vzhůru? Všimněte si, že ""převrat"" zde znamená ""obrat"". ";Ne, ne, ne. ;B
"Mince je hlavou vzhůru. Boris neháže mincí. Sabina hodí mincí. Kaitlyn neháže mincí. Cameron neháže mincí. Je mince stále hlavou vzhůru? Všimněte si, že ""převrat"" zde znamená ""obrat"". ";Ne, ne, ne. ;B
"Mince je hlavou vzhůru. Elizabeth hodí mincí. Mitch hodí mincí. Brooke hodí mincí. Jordyn nehraje mincí. Je mince stále hlavou vzhůru? Všimněte si, že ""převrat"" zde znamená ""obrat"". ";Ne, ne, ne. ;B
"Mince je hlavou vzhůru. Delia hodí mincí. Kathleen neháže mincí. Mateo hodí mincí. Marvin nehraje mincí. Je mince stále hlavou vzhůru? Všimněte si, že ""převrat"" zde znamená ""obrat"". ";Ano, ano, ano ;A
"Mince je hlavou vzhůru. Bj hodí mincí. Rigo neháže mincí. Nigel hodí mincí. Christian hodí mincí. Je mince stále hlavou vzhůru? Všimněte si, že ""převrat"" zde znamená ""obrat"". ";Ne, ne, ne. ;B
"Mince je hlavou vzhůru. Kathy neháže mincí. Elsa hodí mincí. Alba hodí mincí. Ivette hodí mincí. Je mince stále hlavou vzhůru? Všimněte si, že ""převrat"" zde znamená ""obrat"". ";Ne, ne, ne. ;B
"Mince je hlavou vzhůru. Cruz neháže mincí. Wilber hodí mincí. Marilu hodí mincí. Malik hodí mincí. Je mince stále hlavou vzhůru? Všimněte si, že ""převrat"" zde znamená ""obrat"". ";Ne, ne, ne. ;B
"Mince je hlavou vzhůru. Sherry neháže mincí. Ben hodí mincí. Allison neháže mincí. Anthony hodí mincí. Je mince stále hlavou vzhůru? Všimněte si, že ""převrat"" zde znamená ""obrat"". ";Ano, ano, ano ;A
"Mince je hlavou vzhůru. Seth hodí mincí. Dario hodí mincí. Anne hodí mincí. Jodie hodí mincí. Je mince stále hlavou vzhůru? Všimněte si, že ""převrat"" zde znamená ""obrat"". ";Ano, ano, ano ;A
"Mince je hlavou vzhůru. Leon nehraje mincí. Payton hodí mincí. Stefan hodí mincí. Javi hodí mincí. Je mince stále hlavou vzhůru? Všimněte si, že ""převrat"" zde znamená ""obrat"". ";Ne, ne, ne. ;B
"Mince je hlavou vzhůru. Marcos neháže mincí. Kerri hodí mincí. Fabio hodí mincí. Stephen hodí mincí. Je mince stále hlavou vzhůru? Všimněte si, že ""převrat"" zde znamená ""obrat"". ";Ne, ne, ne. ;B
"Mince je hlavou vzhůru. Earl hodí mincí. Rudy neháže mincí. Harrison hodí mincí. Nadine mincí neháže. Je mince stále hlavou vzhůru? Všimněte si, že ""převrat"" zde znamená ""obrat"". ";Ano, ano, ano ;A
"Mince je hlavou vzhůru. Andres neháže mincí. Mary Ann neháže mincí. Sydney hodí mincí. Dina neháže mincí. Je mince stále hlavou vzhůru? Všimněte si, že ""převrat"" zde znamená ""obrat"". ";Ne, ne, ne. ;B
"Mince je hlavou vzhůru. Rohan hodí mincí. Antoinette neháže mincí. Nikki hodí mincí. Aida neháže mincí. Je mince stále hlavou vzhůru? Všimněte si, že ""převrat"" zde znamená ""obrat"". ";Ano, ano, ano ;A
"Mince je hlavou vzhůru. Braulio hodí mincí. Staci mincí neháže. Jocelyn nehraje mincí. Brittany hodí mincí. Je mince stále hlavou vzhůru? Všimněte si, že ""převrat"" zde znamená ""obrat"". ";Ano, ano, ano ;A
"Mince je hlavou vzhůru. Clayton neháže mincí. Edison hodí mincí. Debbie hodí mincí. Elvira nehraje s mincí. Je mince stále hlavou vzhůru? Všimněte si, že ""převrat"" zde znamená ""obrat"". ";Ano, ano, ano ;A
"Mince je hlavou vzhůru. Britt neháže mincí. Tamara mincí neháže. Elvis hodí mincí. Nayeli neháže mincí. Je mince stále hlavou vzhůru? Všimněte si, že ""převrat"" zde znamená ""obrat"". ";Ne, ne, ne. ;B
"Mince je hlavou vzhůru. Cristina hodí mincí. Saad neháže mincí. Bridget neháže mincí. Katie hodí mincí. Je mince stále hlavou vzhůru? Všimněte si, že ""převrat"" zde znamená ""obrat"". ";Ano, ano, ano ;A
"Mince je hlavou vzhůru. Stella neháže mincí. Janis hodí mincí. Darren hodí mincí. Lena neháže mincí. Je mince stále hlavou vzhůru? Všimněte si, že ""převrat"" zde znamená ""obrat"". ";Ano, ano, ano ;A
"Mince je hlavou vzhůru. Charles neháže mincí. Emilio neháže mincí. Vivek hodí mincí. Steve hodí mincí. Je mince stále hlavou vzhůru? Všimněte si, že ""převrat"" zde znamená ""obrat"". ";Ano, ano, ano ;A
"Mince je hlavou vzhůru. Sal neháže mincí. Scott hodí mincí. Myrna hodí mincí. Maximo hodí mincí. Je mince stále hlavou vzhůru? Všimněte si, že ""převrat"" zde znamená ""obrat"". ";Ne, ne, ne. ;B
"Mince je hlavou vzhůru. Mia neháže mincí. Umění neháže mincí. Samantha hodí mincí. Lety hodí mincí. Je mince stále hlavou vzhůru? Všimněte si, že ""převrat"" zde znamená ""obrat"". ";Ano, ano, ano ;A
"Mince je hlavou vzhůru. Miguel Angel hodí mincí. Saul nehraje s mincí. Brady neháže mincí. Darryl hodí mincí. Je mince stále hlavou vzhůru? Všimněte si, že ""převrat"" zde znamená ""obrat"". ";Ano, ano, ano ;A
"Mince je hlavou vzhůru. Maria Elena hodí mincí. Dewayne neháže mincí. Mj neháže mincí. Elliott hodí mincí. Je mince stále hlavou vzhůru? Všimněte si, že ""převrat"" zde znamená ""obrat"". ";Ano, ano, ano ;A
"Mince je hlavou vzhůru. Antoine neháže mincí. Javier hodí mincí. Brett hodí mincí. Stewart nehraje mincí. Je mince stále hlavou vzhůru? Všimněte si, že ""převrat"" zde znamená ""obrat"". ";Ano, ano, ano ;A
"Mince je hlavou vzhůru. Amanda hodí mincí. Geoff neháže mincí. Belinda hodí mincí. Gaurav neháže mincí. Je mince stále hlavou vzhůru? Všimněte si, že ""převrat"" zde znamená ""obrat"". ";Ano, ano, ano ;A
"Mince je hlavou vzhůru. Krishna hodí mincí. Catalina nehraje s mincí. Eileen nehraje s mincí. Teddy hodí mincí. Je mince stále hlavou vzhůru? Všimněte si, že ""převrat"" zde znamená ""obrat"". ";Ano, ano, ano ;A
"Mince je hlavou vzhůru. María hodí mincí. Fredy hodí mincí. Bridgette hodí mincí. Keňa minci neháže. Je mince stále hlavou vzhůru? Všimněte si, že ""převrat"" zde znamená ""obrat"". ";Ne, ne, ne. ;B
"Mince je hlavou vzhůru. Neil hodí mincí. Dani neháže mincí. Eddie hodí mincí. Marcelino neháže mincí. Je mince stále hlavou vzhůru? Všimněte si, že ""převrat"" zde znamená ""obrat"". ";Ano, ano, ano ;A
"Mince je hlavou vzhůru. Alain hodí mincí. Jerome neháže mincí. Kristina mincí neháže. Ida neháže mincí. Je mince stále hlavou vzhůru? Všimněte si, že ""převrat"" zde znamená ""obrat"". ";Ne, ne, ne. ;B
"Mince je hlavou vzhůru. Drew hodí mincí. Jhon nehraje mincí. Jayden hodí mincí. Cliff neháže mincí. Je mince stále hlavou vzhůru? Všimněte si, že ""převrat"" zde znamená ""obrat"". ";Ano, ano, ano ;A
"Mince je hlavou vzhůru. Trish hodí mincí. Vero hodí mincí. Victor neháže mincí. Clemente hodí mincí. Je mince stále hlavou vzhůru? Všimněte si, že ""převrat"" zde znamená ""obrat"". ";Ne, ne, ne. ;B
"Mince je hlavou vzhůru. Antonio neháže mincí. Ronald nehraje s mincí. Ken neháže mincí. Rachael mincí neháže. Je mince stále hlavou vzhůru? Všimněte si, že ""převrat"" zde znamená ""obrat"". ";Ano, ano, ano ;A
"Mince je hlavou vzhůru. Juliet hodí mincí. Ricardo nehraje s mincí. Tita neháže mincí. Dianna hodí mincí. Je mince stále hlavou vzhůru? Všimněte si, že ""převrat"" zde znamená ""obrat"". ";Ano, ano, ano ;A
"Mince je hlavou vzhůru. Larissa neháže mincí. Shawna neháže mincí. Alma hodí mincí. Paulette neháže mincí. Je mince stále hlavou vzhůru? Všimněte si, že ""převrat"" zde znamená ""obrat"". ";Ne, ne, ne. ;B
"Mince je hlavou vzhůru. Donald neháže mincí. Lia hodí mincí. Gonzalo hodí mincí. Lily neháže mincí. Je mince stále hlavou vzhůru? Všimněte si, že ""převrat"" zde znamená ""obrat"". ";Ano, ano, ano ;A
"Mince je hlavou vzhůru. Evelyn nehraje mincí. Mason neháže mincí. Shelby neháže mincí. Aldo hodí mincí. Je mince stále hlavou vzhůru? Všimněte si, že ""převrat"" zde znamená ""obrat"". ";Ne, ne, ne. ;B
"Mince je hlavou vzhůru. Georgina hodí mincí. Joshua hodí mincí. Lindsey neháže mincí. César hodí mincí. Je mince stále hlavou vzhůru? Všimněte si, že ""převrat"" zde znamená ""obrat"". ";Ne, ne, ne. ;B
"Mince je hlavou vzhůru. Král hodí mincí. Edith nehraje mincí. Traci hodí mincí. Flor hodí mincí. Je mince stále hlavou vzhůru? Všimněte si, že ""převrat"" zde znamená ""obrat"". ";Ne, ne, ne. ;B
"Mince je hlavou vzhůru. Courtney neháže mincí. Ann hodí mincí. John hodí mincí. Fer hodí mincí. Je mince stále hlavou vzhůru? Všimněte si, že ""převrat"" zde znamená ""obrat"". ";Ne, ne, ne. ;B
"Mince je hlavou vzhůru. Debby neháže mincí. Geoffrey neháže mincí. Alana neháže mincí. Silvestre neháže mincí. Je mince stále hlavou vzhůru? Všimněte si, že ""převrat"" zde znamená ""obrat"". ";Ano, ano, ano ;A
"Mince je hlavou vzhůru. Stevie neháže mincí. Julie hodí mincí. Leonard neháže mincí. Karina hodí mincí. Je mince stále hlavou vzhůru? Všimněte si, že ""převrat"" zde znamená ""obrat"". ";Ano, ano, ano ;A
"Mince je hlavou vzhůru. Juana nehraje s mincí. Chip nevyhodí minci. Lila neháže mincí. Jayme neháže mincí. Je mince stále hlavou vzhůru? Všimněte si, že ""převrat"" zde znamená ""obrat"". ";Ano, ano, ano ;A
"Mince je hlavou vzhůru. Jon hodí mincí. Heath hodí mincí. Reynaldo hodí mincí. Catherine neháže mincí. Je mince stále hlavou vzhůru? Všimněte si, že ""převrat"" zde znamená ""obrat"". ";Ne, ne, ne. ;B
"Mince je hlavou vzhůru. Beatrice hodí mincí. Taylor hodí mincí. Juan Carlos neháže mincí. Kaitlin neháže mincí. Je mince stále hlavou vzhůru? Všimněte si, že ""převrat"" zde znamená ""obrat"". ";Ano, ano, ano ;A
"Mince je hlavou vzhůru. Christina mincí neháže. Edna hodí mincí. Ileana hodí mincí. Lynette hodí mincí. Je mince stále hlavou vzhůru? Všimněte si, že ""převrat"" zde znamená ""obrat"". ";Ne, ne, ne. ;B
"Mince je hlavou vzhůru. Eugenia hodí mincí. Kellie hodí mincí. Quentin hodí mincí. Mike neháže mincí. Je mince stále hlavou vzhůru? Všimněte si, že ""převrat"" zde znamená ""obrat"". ";Ne, ne, ne. ;B
"Mince je hlavou vzhůru. Yasmin hodí mincí. Yesenia hodí mincí. Carmela hodí mincí. Susie hodí mincí. Je mince stále hlavou vzhůru? Všimněte si, že ""převrat"" zde znamená ""obrat"". ";Ano, ano, ano ;A
"Mince je hlavou vzhůru. Oswaldo neháže mincí. José Luis hodí mincí. Sheldon neháže mincí. Tara hodí mincí. Je mince stále hlavou vzhůru? Všimněte si, že ""převrat"" zde znamená ""obrat"". ";Ano, ano, ano ;A
"Mince je hlavou vzhůru. Debora nehraje s mincí. Jayson neháže mincí. Donna hodí mincí. Sai neháže mincí. Je mince stále hlavou vzhůru? Všimněte si, že ""převrat"" zde znamená ""obrat"". ";Ne, ne, ne. ;B
"Mince je hlavou vzhůru. Jermaine hodí mincí. Pat neháže mincí. Tammie hodí mincí. Olivia hodí mincí. Je mince stále hlavou vzhůru? Všimněte si, že ""převrat"" zde znamená ""obrat"". ";Ne, ne, ne. ;B
"Mince je hlavou vzhůru. Sunny neháže mincí. Trisha hodí mincí. Paul hodí mincí. Ten chlap neháže mincí. Je mince stále hlavou vzhůru? Všimněte si, že ""převrat"" zde znamená ""obrat"". ";Ano, ano, ano ;A
"Mince je hlavou vzhůru. Martha hodí mincí. Elijah hodí mincí. Dominic hodí mincí. Tonya hodí mincí. Je mince stále hlavou vzhůru? Všimněte si, že ""převrat"" zde znamená ""obrat"". ";Ano, ano, ano ;A
"Mince je hlavou vzhůru. Theo hodí mincí. Sheila hodí mincí. Mariana nehraje s mincí. Esmeralda hodí mincí. Je mince stále hlavou vzhůru? Všimněte si, že ""převrat"" zde znamená ""obrat"". ";Ne, ne, ne. ;B
"Mince je hlavou vzhůru. Cristal hodí mincí. Roxana hodí mincí. Rajesh neháže mincí. Danny neháže mincí. Je mince stále hlavou vzhůru? Všimněte si, že ""převrat"" zde znamená ""obrat"". ";Ano, ano, ano ;A
"Mince je hlavou vzhůru. Geovanny neháže mincí. Tom hodí mincí. Katelyn hodí mincí. Jennifer hodí mincí. Je mince stále hlavou vzhůru? Všimněte si, že ""převrat"" zde znamená ""obrat"". ";Ne, ne, ne. ;B
"Mince je hlavou vzhůru. Buddy hodí mincí. Violet neháže mincí. Johana hodí mincí. Tina neháže mincí. Je mince stále hlavou vzhůru? Všimněte si, že ""převrat"" zde znamená ""obrat"". ";Ano, ano, ano ;A
