question;answer;answer_ab
"Монета е глава нагоре. Уитни хвърля монетата. Ерика не хвърля монетата. Ти Джей не хвърля монетата. Бенито хвърля монетата. Монетата все още ли е нагоре? Забележете, че ""обърнете"" тук означава ""обратно"". ";Да, да ;A
"Монета е глава нагоре. Лъки не хвърля монета. Мирея хвърля монетата. Джей Джей хвърля монетата. К.К. хвърля монетата. Монетата все още ли е нагоре? Забележете, че ""обърнете"" тук означава ""обратно"". ";Не, не ;B
"Монета е глава нагоре. Кейлъб хвърля монетата. Чейс хвърля монетата. Елиазар хвърля монетата. Шанел не хвърля монета. Монетата все още ли е нагоре? Забележете, че ""обърнете"" тук означава ""обратно"". ";Не, не ;B
"Монета е глава нагоре. Силвия хвърля монетата. Каролина не хвърля монета. Стан хвърля монетата. Чък хвърля монетата. Монетата все още ли е нагоре? Забележете, че ""обърнете"" тук означава ""обратно"". ";Не, не ;B
"Монета е глава нагоре. Бриана хвърля монетата. Трей не хвърля монетата. Омар хвърля монетата. Патрис не хвърля монетата. Монетата все още ли е нагоре? Забележете, че ""обърнете"" тук означава ""обратно"". ";Да, да ;A
"Монета е глава нагоре. Лилиан хвърля монетата. Иън хвърля монетата. Брайс хвърля монетата. Арасели не хвърля монета. Монетата все още ли е нагоре? Забележете, че ""обърнете"" тук означава ""обратно"". ";Не, не ;B
"Монета е глава нагоре. Уолтър не хвърля монета. Микайла не хвърля монетата. Лари не хвърля монета. Райън не хвърля монета. Монетата все още ли е нагоре? Забележете, че ""обърнете"" тук означава ""обратно"". ";Да, да ;A
"Монета е глава нагоре. Анджелина хвърля монетата. Лейла хвърля монетата. Джени хвърля монетата. Зейн не хвърля монетата. Монетата все още ли е нагоре? Забележете, че ""обърнете"" тук означава ""обратно"". ";Не, не ;B
"Монета е глава нагоре. Лиззи хвърля монетата. Хуани не хвърля монетата. Аиша хвърля монетата. Бренда не хвърля монета. Монетата все още ли е нагоре? Забележете, че ""обърнете"" тук означава ""обратно"". ";Да, да ;A
"Монета е глава нагоре. Елиз хвърля монетата. Лупе хвърля монетата. Рене не хвърля монетата. Ноеми не хвърля монетата. Монетата все още ли е нагоре? Забележете, че ""обърнете"" тук означава ""обратно"". ";Да, да ;A
"Монета е глава нагоре. Джеси хвърля монетата. Родерик хвърля монетата. Травис не хвърля монета. Рита не хвърля монетата. Монетата все още ли е нагоре? Забележете, че ""обърнете"" тук означава ""обратно"". ";Да, да ;A
"Монета е глава нагоре. Синтия не хвърля монетата. Ллойд не хвърля монетата. Жаклин хвърля монетата. Джей Си хвърля монетата. Монетата все още ли е нагоре? Забележете, че ""обърнете"" тук означава ""обратно"". ";Да, да ;A
"Монета е глава нагоре. Стерлинг хвърля монетата. Дженифър хвърля монетата. Пътси хвърля монетата. Денис хвърля монетата. Монетата все още ли е нагоре? Забележете, че ""обърнете"" тук означава ""обратно"". ";Да, да ;A
"Монета е глава нагоре. Беатрис хвърля монетата. Джилиан не хвърля монетата. Коко не хвърля монетата. Вивиан не хвърля монета. Монетата все още ли е нагоре? Забележете, че ""обърнете"" тук означава ""обратно"". ";Не, не ;B
"Монета е глава нагоре. Принц хвърля монетата. Рене хвърля монетата. Вишал хвърля монетата. Патрик не хвърля монета. Монетата все още ли е нагоре? Забележете, че ""обърнете"" тук означава ""обратно"". ";Не, не ;B
"Монета е глава нагоре. Дже не хвърля монета. Денис не хвърля монетата. Крис хвърля монетата. Бернадет хвърля монетата. Монетата все още ли е нагоре? Забележете, че ""обърнете"" тук означава ""обратно"". ";Да, да ;A
"Монета е глава нагоре. Ханк не хвърля монета. Джанин не хвърля монетата. Франки хвърля монетата. Иса хвърля монетата. Монетата все още ли е нагоре? Забележете, че ""обърнете"" тук означава ""обратно"". ";Да, да ;A
"Монета е глава нагоре. Макс не хвърля монета. Майки не хвърля монетата. Синтия не хвърля монетата. Холи хвърля монетата. Монетата все още ли е нагоре? Забележете, че ""обърнете"" тук означава ""обратно"". ";Не, не ;B
"Монета е глава нагоре. Кристи хвърля монетата. Рей не хвърля монетата. Мишел хвърля монетата. Доли не хвърля монетата. Монетата все още ли е нагоре? Забележете, че ""обърнете"" тук означава ""обратно"". ";Да, да ;A
"Монета е глава нагоре. Ани не хвърля монета. Тоно хвърля монетата. Шарън хвърля монетата. Делорес хвърля монетата. Монетата все още ли е нагоре? Забележете, че ""обърнете"" тук означава ""обратно"". ";Не, не ;B
"Монета е глава нагоре. Джеси не хвърля монета. Либи не хвърля монета. Даниел хвърля монетата. Червен хвърля монетата. Монетата все още ли е нагоре? Забележете, че ""обърнете"" тук означава ""обратно"". ";Да, да ;A
"Монета е глава нагоре. Хорхе не хвърля монетата. Наталия не хвърля монетата. Браян хвърля монетата. Киран хвърля монетата. Монетата все още ли е нагоре? Забележете, че ""обърнете"" тук означава ""обратно"". ";Да, да ;A
"Монета е глава нагоре. Ян не хвърля монетата. Юнис не хвърля монетата. Джоузеф хвърля монетата. Хю не хвърля монетата. Монетата все още ли е нагоре? Забележете, че ""обърнете"" тук означава ""обратно"". ";Не, не ;B
"Монета е глава нагоре. Мелоди не хвърля монетата. Рамиро не хвърля монета. Хумберто не хвърля монета. Джейкъб не хвърля монетата. Монетата все още ли е нагоре? Забележете, че ""обърнете"" тук означава ""обратно"". ";Да, да ;A
"Монета е глава нагоре. Доминго не хвърля монета. Бриана хвърля монетата. Майкъл хвърля монетата. Джоан не хвърля монетата. Монетата все още ли е нагоре? Забележете, че ""обърнете"" тук означава ""обратно"". ";Да, да ;A
"Монета е глава нагоре. Кристофър не хвърля монета. Деб хвърля монетата. Джейк хвърля монетата. Тами хвърля монетата. Монетата все още ли е нагоре? Забележете, че ""обърнете"" тук означава ""обратно"". ";Не, не ;B
"Монета е глава нагоре. Морган хвърля монетата. Перла не хвърля монетата. Джоао не хвърля монета. Марта не хвърля монетата. Монетата все още ли е нагоре? Забележете, че ""обърнете"" тук означава ""обратно"". ";Не, не ;B
"Монета е глава нагоре. Пени хвърля монетата. Хари не хвърля монета. Джесика не хвърля монета. Хорасио хвърля монетата. Монетата все още ли е нагоре? Забележете, че ""обърнете"" тук означава ""обратно"". ";Да, да ;A
"Монета е глава нагоре. Били не хвърля монета. Палома не хвърля монетата. Танър не хвърля монетата. Раул не хвърля монетата. Монетата все още ли е нагоре? Забележете, че ""обърнете"" тук означава ""обратно"". ";Да, да ;A
"Монета е глава нагоре. Рене не хвърля монетата. Девон не хвърля монетата. Розалинда не хвърля монетата. Полина не хвърля монетата. Монетата все още ли е нагоре? Забележете, че ""обърнете"" тук означава ""обратно"". ";Да, да ;A
"Монета е глава нагоре. Аксел хвърля монетата. Освалдо хвърля монетата. Милдред не хвърля монетата. Силвия хвърля монетата. Монетата все още ли е нагоре? Забележете, че ""обърнете"" тук означава ""обратно"". ";Не, не ;B
"Монета е глава нагоре. Емилиано хвърля монетата. Жасмин хвърля монетата. Уейд хвърля монетата. Вилма не хвърля монетата. Монетата все още ли е нагоре? Забележете, че ""обърнете"" тук означава ""обратно"". ";Не, не ;B
"Монета е глава нагоре. Лино не хвърля монетата. Мариел не хвърля монетата. Адитя не хвърля монета. Елизабет хвърля монетата. Монетата все още ли е нагоре? Забележете, че ""обърнете"" тук означава ""обратно"". ";Не, не ;B
"Монета е глава нагоре. Джаки хвърля монетата. Сокоро хвърля монетата. Марк хвърля монетата. Уанда не хвърля монетата. Монетата все още ли е нагоре? Забележете, че ""обърнете"" тук означава ""обратно"". ";Не, не ;B
"Монета е глава нагоре. Маурисио хвърля монетата. Лий не хвърля монета. Мади не хвърля монетата. Лиззи хвърля монетата. Монетата все още ли е нагоре? Забележете, че ""обърнете"" тук означава ""обратно"". ";Да, да ;A
"Монета е глава нагоре. Рубен хвърля монетата. Бернардо хвърля монетата. Ариел не хвърля монетата. Шели хвърля монетата. Монетата все още ли е нагоре? Забележете, че ""обърнете"" тук означава ""обратно"". ";Не, не ;B
"Монета е глава нагоре. Филип не хвърля монетата. Аджай хвърля монетата. Джени хвърля монетата. Аугусто хвърля монетата. Монетата все още ли е нагоре? Забележете, че ""обърнете"" тук означава ""обратно"". ";Не, не ;B
"Монета е глава нагоре. Ари хвърля монетата. Жасмин не хвърля монетата. Елиът хвърля монетата. Кендрик хвърля монетата. Монетата все още ли е нагоре? Забележете, че ""обърнете"" тук означава ""обратно"". ";Не, не ;B
"Монета е глава нагоре. Маргарита хвърля монетата. Анабел хвърля монетата. Шон хвърля монетата. Селина хвърля монетата. Монетата все още ли е нагоре? Забележете, че ""обърнете"" тук означава ""обратно"". ";Да, да ;A
"Монета е глава нагоре. Гео не хвърля монетата. Коди не хвърля монетата. Исаяс хвърля монетата. Джовани хвърля монетата. Монетата все още ли е нагоре? Забележете, че ""обърнете"" тук означава ""обратно"". ";Да, да ;A
"Монета е глава нагоре. Кенеди хвърля монетата. Джини не хвърля монетата. Илиана хвърля монетата. Небето не хвърля монета. Монетата все още ли е нагоре? Забележете, че ""обърнете"" тук означава ""обратно"". ";Да, да ;A
"Монета е глава нагоре. Били хвърля монетата. Касандра хвърля монетата. Радостта не хвърля монетата. Ейб хвърля монетата. Монетата все още ли е нагоре? Забележете, че ""обърнете"" тук означава ""обратно"". ";Не, не ;B
"Монета е глава нагоре. Нубия хвърля монетата. Сара не хвърля монетата. Джален не хвърля монета. Крис хвърля монетата. Монетата все още ли е нагоре? Забележете, че ""обърнете"" тук означава ""обратно"". ";Да, да ;A
"Монета е глава нагоре. Але не хвърля монета. Гаспар хвърля монетата. Сони не хвърля монета. Саймън хвърля монетата. Монетата все още ли е нагоре? Забележете, че ""обърнете"" тук означава ""обратно"". ";Да, да ;A
"Монета е глава нагоре. Скайлър хвърля монетата. Крис не хвърля монета. Мисти хвърля монетата. Кийк хвърля монетата. Монетата все още ли е нагоре? Забележете, че ""обърнете"" тук означава ""обратно"". ";Не, не ;B
"Монета е глава нагоре. Гавин хвърля монетата. Неха не хвърля монетата. Аша не хвърля монетата. Балтазар не хвърля монетата. Монетата все още ли е нагоре? Забележете, че ""обърнете"" тук означава ""обратно"". ";Не, не ;B
"Монета е глава нагоре. Камило хвърля монетата. Беки не хвърля монетата. Елиза не хвърля монетата. Ребека не хвърля монета. Монетата все още ли е нагоре? Забележете, че ""обърнете"" тук означава ""обратно"". ";Не, не ;B
"Монета е глава нагоре. Исела хвърля монетата. Лесли хвърля монетата. Стейси хвърля монетата. Ингрид не хвърля монетата. Монетата все още ли е нагоре? Забележете, че ""обърнете"" тук означава ""обратно"". ";Не, не ;B
"Монета е глава нагоре. Мег не хвърля монетата. Андрей не хвърля монетата. Джерард хвърля монетата. Лилия хвърля монетата. Монетата все още ли е нагоре? Забележете, че ""обърнете"" тук означава ""обратно"". ";Да, да ;A
"Монета е глава нагоре. Дени хвърля монетата. Карло хвърля монетата. Реналдо хвърля монетата. Джеси хвърля монетата. Монетата все още ли е нагоре? Забележете, че ""обърнете"" тук означава ""обратно"". ";Да, да ;A
"Монета е глава нагоре. Шери не хвърля монетата. Рико не хвърля монета. Тео хвърля монетата. Исус не хвърля монетата. Монетата все още ли е нагоре? Забележете, че ""обърнете"" тук означава ""обратно"". ";Не, не ;B
"Монета е глава нагоре. Александрия не хвърля монета. Меган не хвърля монета. Есента не хвърля монетата. Робърт не хвърля монета. Монетата все още ли е нагоре? Забележете, че ""обърнете"" тук означава ""обратно"". ";Да, да ;A
"Монета е глава нагоре. Младши хвърля монетата. Мередит хвърля монетата. Зоуи не хвърля монета. Роби не хвърля монетата. Монетата все още ли е нагоре? Забележете, че ""обърнете"" тук означава ""обратно"". ";Да, да ;A
"Монета е глава нагоре. Красивата хвърля монетата. Джада хвърля монетата. Сарита не хвърля монетата. Алън хвърля монетата. Монетата все още ли е нагоре? Забележете, че ""обърнете"" тук означава ""обратно"". ";Не, не ;B
"Монета е глава нагоре. Шари хвърля монетата. Бела хвърля монетата. Лиза не хвърля монетата. Майра не хвърля монетата. Монетата все още ли е нагоре? Забележете, че ""обърнете"" тук означава ""обратно"". ";Да, да ;A
"Монета е глава нагоре. Лазаро не хвърля монетата. Ана хвърля монетата. Шарлот хвърля монетата. Прешъс хвърля монетата. Монетата все още ли е нагоре? Забележете, че ""обърнете"" тук означава ""обратно"". ";Не, не ;B
"Монета е глава нагоре. Имелда хвърля монетата. Анди хвърля монетата. Мак не хвърля монетата. Ригоберто хвърля монетата. Монетата все още ли е нагоре? Забележете, че ""обърнете"" тук означава ""обратно"". ";Не, не ;B
"Монета е глава нагоре. Ашиш хвърля монетата. Трейси хвърля монетата. Варун не хвърля монета. Емил хвърля монетата. Монетата все още ли е нагоре? Забележете, че ""обърнете"" тук означава ""обратно"". ";Не, не ;B
"Монета е глава нагоре. Мариан не хвърля монетата. Джоан хвърля монетата. Дарън не хвърля монета. Рохит не хвърля монетата. Монетата все още ли е нагоре? Забележете, че ""обърнете"" тук означава ""обратно"". ";Не, не ;B
"Монета е глава нагоре. Джулиета хвърля монетата. Закари хвърля монетата. Джаред хвърля монетата. Тайсън не хвърля монета. Монетата все още ли е нагоре? Забележете, че ""обърнете"" тук означава ""обратно"". ";Не, не ;B
"Монета е глава нагоре. Висенте не хвърля монетата. Даяна не хвърля монетата. Кейси не хвърля монетата. Лин не хвърля монетата. Монетата все още ли е нагоре? Забележете, че ""обърнете"" тук означава ""обратно"". ";Да, да ;A
"Монета е глава нагоре. Крейг хвърля монетата. Дилън не хвърля монетата. Трой не хвърля монетата. Гризелда не хвърля монетата. Монетата все още ли е нагоре? Забележете, че ""обърнете"" тук означава ""обратно"". ";Не, не ;B
"Монета е глава нагоре. Руби не хвърля монетата. Дейзи не хвърля монетата. Ядира хвърля монетата. Дядо Коледа не хвърля монета. Монетата все още ли е нагоре? Забележете, че ""обърнете"" тук означава ""обратно"". ";Не, не ;B
"Монета е глава нагоре. Дейв не хвърля монетата. Ернесто не хвърля монетата. Лиъм не хвърля монета. Марша не хвърля монетата. Монетата все още ли е нагоре? Забележете, че ""обърнете"" тук означава ""обратно"". ";Да, да ;A
"Монета е глава нагоре. Айра хвърля монетата. Паола хвърля монетата. Хосе Антонио не хвърля монетата. Мария не хвърля монетата. Монетата все още ли е нагоре? Забележете, че ""обърнете"" тук означава ""обратно"". ";Да, да ;A
"Монета е глава нагоре. Маниш не хвърля монетата. Лу хвърля монетата. Карл не хвърля монета. Дон хвърля монетата. Монетата все още ли е нагоре? Забележете, че ""обърнете"" тук означава ""обратно"". ";Да, да ;A
"Монета е глава нагоре. Ървинг хвърля монетата. Ханс хвърля монетата. Моисей не хвърля монетата. Никол не хвърля монета. Монетата все още ли е нагоре? Забележете, че ""обърнете"" тук означава ""обратно"". ";Да, да ;A
"Монета е глава нагоре. Микела не хвърля монетата. Кевин хвърля монетата. Диамантът не хвърля монетата. Тай не хвърля монетата. Монетата все още ли е нагоре? Забележете, че ""обърнете"" тук означава ""обратно"". ";Не, не ;B
