question;answer;answer_ab
"Монета е глава нагоре. Диана не хвърля монетата. Тери не хвърля монетата. Габриела хвърля монетата. Джона хвърля монетата. Монетата все още ли е нагоре? Забележете, че ""обърнете"" тук означава ""обратно"". ";Да, да ;A
"Монета е глава нагоре. Конор не хвърля монетата. Рандал не хвърля монетата. Олег хвърля монетата. Стефани не хвърля монетата. Монетата все още ли е нагоре? Забележете, че ""обърнете"" тук означава ""обратно"". ";Не, не ;B
"Монета е глава нагоре. Шансът хвърля монетата. Валентин не хвърля монета. Мика хвърля монетата. Клара хвърля монетата. Монетата все още ли е нагоре? Забележете, че ""обърнете"" тук означава ""обратно"". ";Не, не ;B
"Монета е глава нагоре. Дъсти не хвърля монета. Янет хвърля монетата. Хортенция хвърля монетата. Лили хвърля монетата. Монетата все още ли е нагоре? Забележете, че ""обърнете"" тук означава ""обратно"". ";Не, не ;B
"Монета е глава нагоре. Натали хвърля монетата. Гилбърт хвърля монетата. Браян не хвърля монетата. Санчес не хвърля монета. Монетата все още ли е нагоре? Забележете, че ""обърнете"" тук означава ""обратно"". ";Да, да ;A
"Монета е глава нагоре. Улисес хвърля монетата. Дерек хвърля монетата. Адриана хвърля монетата. Юджийн хвърля монетата. Монетата все още ли е нагоре? Забележете, че ""обърнете"" тук означава ""обратно"". ";Да, да ;A
"Монета е глава нагоре. Карлитос хвърля монетата. Дамарис хвърля монетата. Никил не хвърля монета. Джени не хвърля монетата. Монетата все още ли е нагоре? Забележете, че ""обърнете"" тук означава ""обратно"". ";Да, да ;A
"Монета е глава нагоре. Есения не хвърля монетата. Джералдън хвърля монетата. Минерва хвърля монетата. Таня хвърля монетата. Монетата все още ли е нагоре? Забележете, че ""обърнете"" тук означава ""обратно"". ";Не, не ;B
"Монета е глава нагоре. Никола не хвърля монета. Алия хвърля монетата. Паскуал не хвърля монетата. Роб не хвърля монетата. Монетата все още ли е нагоре? Забележете, че ""обърнете"" тук означава ""обратно"". ";Не, не ;B
"Монета е глава нагоре. Брандън не хвърля монета. Ивон не хвърля монета. Джеферсън хвърля монетата. Изабела не хвърля монета. Монетата все още ли е нагоре? Забележете, че ""обърнете"" тук означава ""обратно"". ";Не, не ;B
"Монета е глава нагоре. Педро хвърля монетата. Леополдо не хвърля монетата. Ти не хвърля монетата. Мар хвърля монетата. Монетата все още ли е нагоре? Забележете, че ""обърнете"" тук означава ""обратно"". ";Да, да ;A
"Монета е глава нагоре. Париж не хвърля монета. Джими не хвърля монета. Андрю хвърля монетата. Рамон хвърля монетата. Монетата все още ли е нагоре? Забележете, че ""обърнете"" тук означава ""обратно"". ";Да, да ;A
"Монета е глава нагоре. Анжелика хвърля монетата. Тарик хвърля монетата. Урсула не хвърля монетата. Нена не хвърля монетата. Монетата все още ли е нагоре? Забележете, че ""обърнете"" тук означава ""обратно"". ";Да, да ;A
"Монета е глава нагоре. Луз не хвърля монетата. Терънс хвърля монетата. Старейшината не хвърля монета. Джазмин не хвърля монета. Монетата все още ли е нагоре? Забележете, че ""обърнете"" тук означава ""обратно"". ";Не, не ;B
"Монета е глава нагоре. Роберта не хвърля монета. Мауро хвърля монетата. Клинт хвърля монетата. Марсела хвърля монетата. Монетата все още ли е нагоре? Забележете, че ""обърнете"" тук означава ""обратно"". ";Не, не ;B
"Монета е глава нагоре. Ейдриън хвърля монетата. Марлон хвърля монетата. Карла хвърля монетата. Флоренс хвърля монетата. Монетата все още ли е нагоре? Забележете, че ""обърнете"" тук означава ""обратно"". ";Да, да ;A
"Монета е глава нагоре. Скайлър не хвърля монета. Оливър не хвърля монета. Кристи не хвърля монетата. Сиера хвърля монетата. Монетата все още ли е нагоре? Забележете, че ""обърнете"" тук означава ""обратно"". ";Не, не ;B
"Монета е глава нагоре. Барби не хвърля монетата. Дезире не хвърля монета. Янет не хвърля монетата. Дре не хвърля монета. Монетата все още ли е нагоре? Забележете, че ""обърнете"" тук означава ""обратно"". ";Да, да ;A
"Монета е глава нагоре. Дан не хвърля монета. Рут не хвърля монетата. Ксавие хвърля монетата. Исидро не хвърля монетата. Монетата все още ли е нагоре? Забележете, че ""обърнете"" тук означава ""обратно"". ";Не, не ;B
"Монета е глава нагоре. Филип хвърля монетата. Антоний хвърля монетата. Айрис хвърля монетата. Алиша хвърля монетата. Монетата все още ли е нагоре? Забележете, че ""обърнете"" тук означава ""обратно"". ";Да, да ;A
"Монета е глава нагоре. Кори хвърля монетата. Елфинът не хвърля монета. Тино хвърля монетата. Мелвин хвърля монетата. Монетата все още ли е нагоре? Забележете, че ""обърнете"" тук означава ""обратно"". ";Не, не ;B
"Монета е глава нагоре. Ръсел не хвърля монетата. Мичъл не хвърля монета. Би хвърля монетата. Вярата не хвърля монетата. Монетата все още ли е нагоре? Забележете, че ""обърнете"" тук означава ""обратно"". ";Не, не ;B
"Монета е глава нагоре. Бри не хвърля монетата. Роджър хвърля монетата. Ева не хвърля монетата. Даяна хвърля монетата. Монетата все още ли е нагоре? Забележете, че ""обърнете"" тук означава ""обратно"". ";Да, да ;A
"Монета е глава нагоре. Жизела хвърля монетата. Джералд не хвърля монетата. Макензи хвърля монетата. Ашли хвърля монетата. Монетата все още ли е нагоре? Забележете, че ""обърнете"" тук означава ""обратно"". ";Не, не ;B
"Монета е глава нагоре. Винни не хвърля монетата. Ландън хвърля монетата. Мигел хвърля монетата. Кейтлин не хвърля монета. Монетата все още ли е нагоре? Забележете, че ""обърнете"" тук означава ""обратно"". ";Да, да ;A
"Монета е глава нагоре. Констанс хвърля монетата. Николай не хвърля монетата. Уил хвърля монетата. Любовта хвърля монетата. Монетата все още ли е нагоре? Забележете, че ""обърнете"" тук означава ""обратно"". ";Не, не ;B
"Монета е глава нагоре. Джини не хвърля монета. Кенет не хвърля монетата. Порфирио не хвърля монетата. Езекиел хвърля монетата. Монетата все още ли е нагоре? Забележете, че ""обърнете"" тук означава ""обратно"". ";Не, не ;B
"Монета е глава нагоре. Марио хвърля монетата. Пиер не хвърля монетата. Амит хвърля монетата. Нелсън не хвърля монета. Монетата все още ли е нагоре? Забележете, че ""обърнете"" тук означава ""обратно"". ";Да, да ;A
"Монета е глава нагоре. Мерцедес не хвърля монета. Адела хвърля монетата. Сузана хвърля монетата. Роуз не хвърля монетата. Монетата все още ли е нагоре? Забележете, че ""обърнете"" тук означава ""обратно"". ";Да, да ;A
"Монета е глава нагоре. Фред хвърля монетата. Нолан хвърля монетата. Джонатан хвърля монетата. Карсън не хвърля монетата. Монетата все още ли е нагоре? Забележете, че ""обърнете"" тук означава ""обратно"". ";Не, не ;B
"Монета е глава нагоре. Каролайн хвърля монетата. Деметрий хвърля монетата. Фидел не хвърля монетата. Соломон хвърля монетата. Монетата все още ли е нагоре? Забележете, че ""обърнете"" тук означава ""обратно"". ";Не, не ;B
"Монета е глава нагоре. Хулио не хвърля монетата. Сидни хвърля монетата. Ейдън хвърля монетата. Шей не хвърля монета. Монетата все още ли е нагоре? Забележете, че ""обърнете"" тук означава ""обратно"". ";Да, да ;A
"Монета е глава нагоре. Мейбъл не хвърля монета. Естела хвърля монетата. Айрин хвърля монетата. Мей хвърля монетата. Монетата все още ли е нагоре? Забележете, че ""обърнете"" тук означава ""обратно"". ";Не, не ;B
"Монета е глава нагоре. Маркъс хвърля монетата. Рамирес не хвърля монетата. Джуниър хвърля монетата. Арели не хвърля монетата. Монетата все още ли е нагоре? Забележете, че ""обърнете"" тук означава ""обратно"". ";Да, да ;A
"Монета е глава нагоре. Тод хвърля монетата. Джони хвърля монетата. Гил хвърля монетата. Фран не хвърля монетата. Монетата все още ли е нагоре? Забележете, че ""обърнете"" тук означава ""обратно"". ";Не, не ;B
"Монета е глава нагоре. Герсън хвърля монетата. Роксан не хвърля монетата. Дебора не хвърля монетата. Натаниел не хвърля монетата. Монетата все още ли е нагоре? Забележете, че ""обърнете"" тук означава ""обратно"". ";Не, не ;B
"Монета е глава нагоре. Колтън хвърля монетата. Декстър не хвърля монета. Кейти хвърля монетата. Брейдън не хвърля монета. Монетата все още ли е нагоре? Забележете, че ""обърнете"" тук означава ""обратно"". ";Да, да ;A
"Монета е глава нагоре. Тори не хвърля монетата. Мариам не хвърля монета. Габи не хвърля монетата. Брайън не хвърля монетата. Монетата все още ли е нагоре? Забележете, че ""обърнете"" тук означава ""обратно"". ";Да, да ;A
"Монета е глава нагоре. Мишел не хвърля монетата. Рой не хвърля монетата. Сергей не хвърля монета. Джеси не хвърля монетата. Монетата все още ли е нагоре? Забележете, че ""обърнете"" тук означава ""обратно"". ";Да, да ;A
"Монета е глава нагоре. Анил не хвърля монетата. Енрике хвърля монетата. Джими хвърля монетата. Джони не хвърля монетата. Монетата все още ли е нагоре? Забележете, че ""обърнете"" тук означава ""обратно"". ";Да, да ;A
"Монета е глава нагоре. Анхел хвърля монетата. Карлтън не хвърля монета. Самир не хвърля монета. Мартинес хвърля монетата. Монетата все още ли е нагоре? Забележете, че ""обърнете"" тук означава ""обратно"". ";Да, да ;A
"Монета е глава нагоре. Марица не хвърля монетата. Баба не хвърля монета. Лорета хвърля монетата. Ерик не хвърля монетата. Монетата все още ли е нагоре? Забележете, че ""обърнете"" тук означава ""обратно"". ";Не, не ;B
"Монета е глава нагоре. Томас хвърля монетата. Кара хвърля монетата. Нита не хвърля монетата. Франсис хвърля монетата. Монетата все още ли е нагоре? Забележете, че ""обърнете"" тук означава ""обратно"". ";Не, не ;B
"Монета е глава нагоре. Чуй не хвърля монета. Шейн не хвърля монетата. Джейдън не хвърля монетата. Мейнор хвърля монетата. Монетата все още ли е нагоре? Забележете, че ""обърнете"" тук означава ""обратно"". ";Не, не ;B
"Монета е глава нагоре. Виолета не хвърля монетата. Клей хвърля монетата. Джанел не хвърля монетата. Мак не хвърля монетата. Монетата все още ли е нагоре? Забележете, че ""обърнете"" тук означава ""обратно"". ";Не, не ;B
"Монета е глава нагоре. Гуадалупе не хвърля монетата. Ебона хвърля монетата. Уил хвърля монетата. Люк хвърля монетата. Монетата все още ли е нагоре? Забележете, че ""обърнете"" тук означава ""обратно"". ";Не, не ;B
"Монета е глава нагоре. Джени хвърля монетата. Леонел хвърля монетата. Майкъл не хвърля монетата. Кат не хвърля монетата. Монетата все още ли е нагоре? Забележете, че ""обърнете"" тук означава ""обратно"". ";Да, да ;A
"Монета е глава нагоре. Язмин хвърля монетата. Леа не хвърля монетата. Родриго не хвърля монетата. Сами хвърля монетата. Монетата все още ли е нагоре? Забележете, че ""обърнете"" тук означава ""обратно"". ";Да, да ;A
"Монета е глава нагоре. Емили хвърля монетата. Челси не хвърля монета. Владимир хвърля монетата. Тайрон не хвърля монета. Монетата все още ли е нагоре? Забележете, че ""обърнете"" тук означава ""обратно"". ";Да, да ;A
"Монета е глава нагоре. Бил хвърля монетата. Сантос не хвърля монета. Рокси хвърля монетата. Ранди хвърля монетата. Монетата все още ли е нагоре? Забележете, че ""обърнете"" тук означава ""обратно"". ";Не, не ;B
"Монета е глава нагоре. Дафни не хвърля монетата. Лола хвърля монетата. Джоана не хвърля монетата. Шийна не хвърля монетата. Монетата все още ли е нагоре? Забележете, че ""обърнете"" тук означава ""обратно"". ";Не, не ;B
"Монета е глава нагоре. Лара не хвърля монета. Грег не хвърля монетата. Итън хвърля монетата. Терънс хвърля монетата. Монетата все още ли е нагоре? Забележете, че ""обърнете"" тук означава ""обратно"". ";Да, да ;A
"Монета е глава нагоре. Ото не хвърля монетата. Марджъри хвърля монетата. Леонор хвърля монетата. Естер хвърля монетата. Монетата все още ли е нагоре? Забележете, че ""обърнете"" тук означава ""обратно"". ";Не, не ;B
"Монета е глава нагоре. Малкълм хвърля монетата. Хусейн не хвърля монета. Франко хвърля монетата. Хюго не хвърля монетата. Монетата все още ли е нагоре? Забележете, че ""обърнете"" тук означава ""обратно"". ";Да, да ;A
"Монета е глава нагоре. Джойс хвърля монетата. Лерой хвърля монетата. Алиса не хвърля монетата. Маги не хвърля монета. Монетата все още ли е нагоре? Забележете, че ""обърнете"" тук означава ""обратно"". ";Да, да ;A
"Монета е глава нагоре. Мариам не хвърля монета. Сузи не хвърля монета. Тринити хвърля монетата. Пърл хвърля монетата. Монетата все още ли е нагоре? Забележете, че ""обърнете"" тук означава ""обратно"". ";Да, да ;A
"Монета е глава нагоре. Дъстин хвърля монетата. Луис не хвърля монетата. Роландо хвърля монетата. Конър не хвърля монетата. Монетата все още ли е нагоре? Забележете, че ""обърнете"" тук означава ""обратно"". ";Да, да ;A
"Монета е глава нагоре. Хуан Мануел хвърля монетата. Бенджамин хвърля монетата. Рори не хвърля монета. Рафаел хвърля монетата. Монетата все още ли е нагоре? Забележете, че ""обърнете"" тук означава ""обратно"". ";Не, не ;B
"Монета е глава нагоре. Фермин не хвърля монетата. Беринис не хвърля монетата. Мариан не хвърля монетата. Елинор хвърля монетата. Монетата все още ли е нагоре? Забележете, че ""обърнете"" тук означава ""обратно"". ";Не, не ;B
"Монета е глава нагоре. Сабрина хвърля монетата. Пийт не хвърля монетата. Мери не хвърля монета. Ла хвърля монетата. Монетата все още ли е нагоре? Забележете, че ""обърнете"" тук означава ""обратно"". ";Да, да ;A
"Монета е глава нагоре. Естрела не хвърля монетата. Мадисън не хвърля монета. Пако не хвърля монетата. Р.Дж. хвърля монетата. Монетата все още ли е нагоре? Забележете, че ""обърнете"" тук означава ""обратно"". ";Не, не ;B
"Монета е глава нагоре. Ники хвърля монетата. Греъм хвърля монетата. Върнън хвърля монетата. Бо хвърля монетата. Монетата все още ли е нагоре? Забележете, че ""обърнете"" тук означава ""обратно"". ";Да, да ;A
"Монета е глава нагоре. Бърни не хвърля монета. Мелина не хвърля монетата. Келси не хвърля монета. Ръсти хвърля монетата. Монетата все още ли е нагоре? Забележете, че ""обърнете"" тук означава ""обратно"". ";Не, не ;B
"Монета е глава нагоре. Латоя хвърля монетата. Елисей не хвърля монетата. Трина хвърля монетата. Мелиса не хвърля монетата. Монетата все още ли е нагоре? Забележете, че ""обърнете"" тук означава ""обратно"". ";Да, да ;A
"Монета е глава нагоре. Уесли не хвърля монета. Марсело не хвърля монетата. Родолфо хвърля монетата. Ерик не хвърля монетата. Монетата все още ли е нагоре? Забележете, че ""обърнете"" тук означава ""обратно"". ";Не, не ;B
"Монета е глава нагоре. Шон не хвърля монета. Ребека хвърля монетата. Марко хвърля монетата. Сами хвърля монетата. Монетата все още ли е нагоре? Забележете, че ""обърнете"" тук означава ""обратно"". ";Не, не ;B
"Монета е глава нагоре. Бланка не хвърля монета. Моника не хвърля монетата. Ървин не хвърля монета. Лори хвърля монетата. Монетата все още ли е нагоре? Забележете, че ""обърнете"" тук означава ""обратно"". ";Не, не ;B
"Монета е глава нагоре. Лорейн хвърля монетата. Корин хвърля монетата. Кейт хвърля монетата. Флойд хвърля монетата. Монетата все още ли е нагоре? Забележете, че ""обърнете"" тук означава ""обратно"". ";Да, да ;A
