question;answer;answer_ab
"Mince je hlavou vzhůru. Tiara hodí mincí. Araceli hodí mincí. Michaela hodí mincí. Genaro neháže mincí. Je mince stále hlavou vzhůru? Všimněte si, že ""převrat"" zde znamená ""obrat"". ";Ne, ne, ne. ;B
"Mince je hlavou vzhůru. Alexa neháže mincí. Pilar nehraje s mincí. Rod neháže mincí. Nicola hodí mincí. Je mince stále hlavou vzhůru? Všimněte si, že ""převrat"" zde znamená ""obrat"". ";Ne, ne, ne. ;B
"Mince je hlavou vzhůru. Yamileth hodí mincí. Dane hodí mincí. Aron hodí mincí. Dee neháže mincí. Je mince stále hlavou vzhůru? Všimněte si, že ""převrat"" zde znamená ""obrat"". ";Ne, ne, ne. ;B
"Mince je hlavou vzhůru. Rachel nehraje s mincí. Alisa neháže mincí. Fanny neháže mincí. Jeffery neháže mincí. Je mince stále hlavou vzhůru? Všimněte si, že ""převrat"" zde znamená ""obrat"". ";Ano, ano, ano ;A
"Mince je hlavou vzhůru. Manuel hodí mincí. Aurelio neháže mincí. Indie hodí mincí. Rosalba hodí mincí. Je mince stále hlavou vzhůru? Všimněte si, že ""převrat"" zde znamená ""obrat"". ";Ne, ne, ne. ;B
"Mince je hlavou vzhůru. Garrett neháže mincí. Eva neháže mincí. Joaquin hodí mincí. Monique mincí neháže. Je mince stále hlavou vzhůru? Všimněte si, že ""převrat"" zde znamená ""obrat"". ";Ne, ne, ne. ;B
"Mince je hlavou vzhůru. Ivy hodí mincí. Romeo neháže mincí. Jana hodí mincí. Ej neháže mincí. Je mince stále hlavou vzhůru? Všimněte si, že ""převrat"" zde znamená ""obrat"". ";Ano, ano, ano ;A
"Mince je hlavou vzhůru. Yajaira hodí mincí. Terrell hodí mincí. Adam hodí mincí. Lexie hodí mincí. Je mince stále hlavou vzhůru? Všimněte si, že ""převrat"" zde znamená ""obrat"". ";Ano, ano, ano ;A
"Mince je hlavou vzhůru. Virginia neháže mincí. Juanita neháže mincí. Zak hodí mincí. Wayne neháže mincí. Je mince stále hlavou vzhůru? Všimněte si, že ""převrat"" zde znamená ""obrat"". ";Ne, ne, ne. ;B
"Mince je hlavou vzhůru. Mari hodí mincí. Ximena hodí mincí. Leo neháže mincí. Antonia mincí neháže. Je mince stále hlavou vzhůru? Všimněte si, že ""převrat"" zde znamená ""obrat"". ";Ano, ano, ano ;A
"Mince je hlavou vzhůru. Salvador neháže mincí. Sol hodí mincí. Tyler neháže mincí. Kareem hodí mincí. Je mince stále hlavou vzhůru? Všimněte si, že ""převrat"" zde znamená ""obrat"". ";Ano, ano, ano ;A
"Mince je hlavou vzhůru. Allyson hodí mincí. Mara neháže mincí. Jo hodí mincí. Toni neháže mincí. Je mince stále hlavou vzhůru? Všimněte si, že ""převrat"" zde znamená ""obrat"". ";Ano, ano, ano ;A
"Mince je hlavou vzhůru. Rocio neháže mincí. Sandy neháže mincí. Anahi hodí mincí. Latasha neháže mincí. Je mince stále hlavou vzhůru? Všimněte si, že ""převrat"" zde znamená ""obrat"". ";Ne, ne, ne. ;B
"Mince je hlavou vzhůru. Vicki neháže mincí. Dwight hodí mincí. Johnson hodí mincí. Alexandra hodí mincí. Je mince stále hlavou vzhůru? Všimněte si, že ""převrat"" zde znamená ""obrat"". ";Ne, ne, ne. ;B
"Mince je hlavou vzhůru. Emma hodí mincí. Maryann hodí mincí. Olga mincí neháže. Nataly hodí mincí. Je mince stále hlavou vzhůru? Všimněte si, že ""převrat"" zde znamená ""obrat"". ";Ne, ne, ne. ;B
"Mince je hlavou vzhůru. Belkis neháže mincí. Wendell hodí mincí. Lissette neháže mincí. Patricia mincí neháže. Je mince stále hlavou vzhůru? Všimněte si, že ""převrat"" zde znamená ""obrat"". ";Ne, ne, ne. ;B
"Mince je hlavou vzhůru. Nikdy nehodí mincí. Gio hodí mincí. Elia hodí mincí. Ramesh neháže mincí. Je mince stále hlavou vzhůru? Všimněte si, že ""převrat"" zde znamená ""obrat"". ";Ne, ne, ne. ;B
"Mince je hlavou vzhůru. Dallas neháže mincí. Uriel hodí mincí. Brendan hodí mincí. Julian hodí mincí. Je mince stále hlavou vzhůru? Všimněte si, že ""převrat"" zde znamená ""obrat"". ";Ne, ne, ne. ;B
"Mince je hlavou vzhůru. Sandeep hodí mincí. Graciela neháže mincí. Jai hodí mincí. Xiomara neháže mincí. Je mince stále hlavou vzhůru? Všimněte si, že ""převrat"" zde znamená ""obrat"". ";Ano, ano, ano ;A
"Mince je hlavou vzhůru. Frank hodí mincí. Trevor neháže mincí. Al neháže mincí. Gabriella hodí mincí. Je mince stále hlavou vzhůru? Všimněte si, že ""převrat"" zde znamená ""obrat"". ";Ano, ano, ano ;A
"Mince je hlavou vzhůru. Elva hodí mincí. Kari hodí mincí. Shirley neháže mincí. Gilberto hodí mincí. Je mince stále hlavou vzhůru? Všimněte si, že ""převrat"" zde znamená ""obrat"". ";Ne, ne, ne. ;B
"Mince je hlavou vzhůru. Alonzo neháže mincí. Dorothy nehraje mincí. Alfred hodí mincí. Rodriguez hodí mincí. Je mince stále hlavou vzhůru? Všimněte si, že ""převrat"" zde znamená ""obrat"". ";Ano, ano, ano ;A
"Mince je hlavou vzhůru. Ernest neháže mincí. Yuri hodí mincí. Camila neháže mincí. Ashlee hodí mincí. Je mince stále hlavou vzhůru? Všimněte si, že ""převrat"" zde znamená ""obrat"". ";Ano, ano, ano ;A
"Mince je hlavou vzhůru. Jim hodí mincí. Dwayne neháže mincí. Ricky neháže mincí. Artemio hodí mincí. Je mince stále hlavou vzhůru? Všimněte si, že ""převrat"" zde znamená ""obrat"". ";Ano, ano, ano ;A
"Mince je hlavou vzhůru. Noah neháže mincí. Aubrey hodí mincí. Cesar neháže mincí. Eliana neháže mincí. Je mince stále hlavou vzhůru? Všimněte si, že ""převrat"" zde znamená ""obrat"". ";Ne, ne, ne. ;B
"Mince je hlavou vzhůru. Shawn neháže mincí. Tracie hodí mincí. Lynne neháže mincí. Leila hodí mincí. Je mince stále hlavou vzhůru? Všimněte si, že ""převrat"" zde znamená ""obrat"". ";Ano, ano, ano ;A
"Mince je hlavou vzhůru. Norma neháže mincí. Timothy hodí mincí. Willie neháže mincí. Mathew nehraje s mincí. Je mince stále hlavou vzhůru? Všimněte si, že ""převrat"" zde znamená ""obrat"". ";Ne, ne, ne. ;B
"Mince je hlavou vzhůru. Maricruz neháže mincí. Alfredo neháže mincí. Barry hodí mincí. Deepak hodí mincí. Je mince stále hlavou vzhůru? Všimněte si, že ""převrat"" zde znamená ""obrat"". ";Ano, ano, ano ;A
"Mince je hlavou vzhůru. Julia hodí mincí. Kirsten neháže mincí. Pam hodí mincí. Adan hodí mincí. Je mince stále hlavou vzhůru? Všimněte si, že ""převrat"" zde znamená ""obrat"". ";Ne, ne, ne. ;B
"Mince je hlavou vzhůru. Adalberto hodí mincí. Jamal neháže mincí. Carter hodí mincí. Robyn nehraje mincí. Je mince stále hlavou vzhůru? Všimněte si, že ""převrat"" zde znamená ""obrat"". ";Ano, ano, ano ;A
"Mince je hlavou vzhůru. Nicky hodí mincí. Eden neháže mincí. James nehraje s mincí. Matt neháže mincí. Je mince stále hlavou vzhůru? Všimněte si, že ""převrat"" zde znamená ""obrat"". ";Ne, ne, ne. ;B
"Mince je hlavou vzhůru. Jaime hodí mincí. Brad hodí mincí. Levi hodí mincí. Emmanuel hodí mincí. Je mince stále hlavou vzhůru? Všimněte si, že ""převrat"" zde znamená ""obrat"". ";Ano, ano, ano ;A
"Mince je hlavou vzhůru. Kristie neháže mincí. Johnnie hodí mincí. Marisa hodí mincí. Derick neháže mincí. Je mince stále hlavou vzhůru? Všimněte si, že ""převrat"" zde znamená ""obrat"". ";Ano, ano, ano ;A
"Mince je hlavou vzhůru. Wilfredo neháže mincí. Abby neháže mincí. Karthik neháže mincí. Perry neháže mincí. Je mince stále hlavou vzhůru? Všimněte si, že ""převrat"" zde znamená ""obrat"". ";Ano, ano, ano ;A
"Mince je hlavou vzhůru. Pancho hodí mincí. Claudio hodí mincí. Elaine neháže mincí. Vicky neháže mincí. Je mince stále hlavou vzhůru? Všimněte si, že ""převrat"" zde znamená ""obrat"". ";Ano, ano, ano ;A
"Mince je hlavou vzhůru. Teri neháže mincí. Lina neháže mincí. Mery hodí mincí. Melanie hodí mincí. Je mince stále hlavou vzhůru? Všimněte si, že ""převrat"" zde znamená ""obrat"". ";Ano, ano, ano ;A
"Mince je hlavou vzhůru. Selene neháže mincí. Felix neháže mincí. Milton neháže mincí. Yessica hodí mincí. Je mince stále hlavou vzhůru? Všimněte si, že ""převrat"" zde znamená ""obrat"". ";Ne, ne, ne. ;B
"Mince je hlavou vzhůru. Gus neháže mincí. Brock hodí mincí. Ava neháže mincí. Jenna hodí mincí. Je mince stále hlavou vzhůru? Všimněte si, že ""převrat"" zde znamená ""obrat"". ";Ano, ano, ano ;A
"Mince je hlavou vzhůru. Karen mincí neháže. Hector hodí mincí. Mai hodí mincí. Steven hodí mincí. Je mince stále hlavou vzhůru? Všimněte si, že ""převrat"" zde znamená ""obrat"". ";Ne, ne, ne. ;B
"Mince je hlavou vzhůru. Alexandr nehraje mincí. Marina neháže mincí. Valentina neháže mincí. Mila neháže mincí. Je mince stále hlavou vzhůru? Všimněte si, že ""převrat"" zde znamená ""obrat"". ";Ano, ano, ano ;A
"Mince je hlavou vzhůru. Kristine mincí neháže. Van hodí mincí. Marisol hodí mincí. Preston neháže mincí. Je mince stále hlavou vzhůru? Všimněte si, že ""převrat"" zde znamená ""obrat"". ";Ano, ano, ano ;A
"Mince je hlavou vzhůru. Evan neháže mincí. Ray hodí mincí. Sofia hodí mincí. Alonso neháže mincí. Je mince stále hlavou vzhůru? Všimněte si, že ""převrat"" zde znamená ""obrat"". ";Ano, ano, ano ;A
"Mince je hlavou vzhůru. Alfonso neháže mincí. Collin neháže mincí. Amado neháže mincí. Dick hodí mincí. Je mince stále hlavou vzhůru? Všimněte si, že ""převrat"" zde znamená ""obrat"". ";Ne, ne, ne. ;B
"Mince je hlavou vzhůru. Les neháže mincí. Jun hodí mincí. Noe hodí mincí. Juliana hodí mincí. Je mince stále hlavou vzhůru? Všimněte si, že ""převrat"" zde znamená ""obrat"". ";Ne, ne, ne. ;B
"Mince je hlavou vzhůru. Damian hodí mincí. Crystal hodí mincí. Nisha hodí mincí. Hernan neháže mincí. Je mince stále hlavou vzhůru? Všimněte si, že ""převrat"" zde znamená ""obrat"". ";Ne, ne, ne. ;B
"Mince je hlavou vzhůru. Rosario neháže mincí. Manoj neháže mincí. Adolfo hodí mincí. Reina neháže mincí. Je mince stále hlavou vzhůru? Všimněte si, že ""převrat"" zde znamená ""obrat"". ";Ne, ne, ne. ;B
"Mince je hlavou vzhůru. Marcia neháže mincí. Belen neháže mincí. Reyna hodí mincí. Britney hodí mincí. Je mince stále hlavou vzhůru? Všimněte si, že ""převrat"" zde znamená ""obrat"". ";Ano, ano, ano ;A
"Mince je hlavou vzhůru. Idalia hodí mincí. Arnoldo neháže mincí. Marla neháže mincí. Duane neháže mincí. Je mince stále hlavou vzhůru? Všimněte si, že ""převrat"" zde znamená ""obrat"". ";Ne, ne, ne. ;B
"Mince je hlavou vzhůru. Katia neháže mincí. Mina mincí neháže. Cam neháže mincí. Ronda neháže mincí. Je mince stále hlavou vzhůru? Všimněte si, že ""převrat"" zde znamená ""obrat"". ";Ano, ano, ano ;A
"Mince je hlavou vzhůru. Rashad neháže mincí. Savannah hodí mincí. Flavio neháže mincí. Bert neháže mincí. Je mince stále hlavou vzhůru? Všimněte si, že ""převrat"" zde znamená ""obrat"". ";Ne, ne, ne. ;B
"Mince je hlavou vzhůru. Leanne hodí mincí. Lulu neháže mincí. Lopez neháže mincí. JP neháže mincí. Je mince stále hlavou vzhůru? Všimněte si, že ""převrat"" zde znamená ""obrat"". ";Ne, ne, ne. ;B
"Mince je hlavou vzhůru. Lora nehraje mincí. Alberto neháže mincí. Cathy neháže mincí. Kara neháže mincí. Je mince stále hlavou vzhůru? Všimněte si, že ""převrat"" zde znamená ""obrat"". ";Ano, ano, ano ;A
"Mince je hlavou vzhůru. Roni hodí mincí. Nikita neháže mincí. Hannah hodí mincí. Kiana nehraje s mincí. Je mince stále hlavou vzhůru? Všimněte si, že ""převrat"" zde znamená ""obrat"". ";Ano, ano, ano ;A
"Mince je hlavou vzhůru. Edwin hodí mincí. Lovely neháže mincí. Curt hodí mincí. Damon hodí mincí. Je mince stále hlavou vzhůru? Všimněte si, že ""převrat"" zde znamená ""obrat"". ";Ne, ne, ne. ;B
"Mince je hlavou vzhůru. Missy hodí mincí. Erin hodí mincí. Lorna hodí mincí. Lenny hodí mincí. Je mince stále hlavou vzhůru? Všimněte si, že ""převrat"" zde znamená ""obrat"". ";Ano, ano, ano ;A
"Mince je hlavou vzhůru. Vijay hodí mincí. Sherrie neháže mincí. Doug neháže mincí. Suzy hodí mincí. Je mince stále hlavou vzhůru? Všimněte si, že ""převrat"" zde znamená ""obrat"". ";Ano, ano, ano ;A
"Mince je hlavou vzhůru. Claudia hodí mincí. Cole neháže mincí. Matthew nehraje s mincí. Juan Pablo neháže mincí. Je mince stále hlavou vzhůru? Všimněte si, že ""převrat"" zde znamená ""obrat"". ";Ne, ne, ne. ;B
"Mince je hlavou vzhůru. Arturo neháže mincí. Dominick hodí mincí. Christa mincí neháže. Myles neháže mincí. Je mince stále hlavou vzhůru? Všimněte si, že ""převrat"" zde znamená ""obrat"". ";Ne, ne, ne. ;B
"Mince je hlavou vzhůru. Marc hodí mincí. Doris hodí mincí. Ernie neháže mincí. Gary hodí mincí. Je mince stále hlavou vzhůru? Všimněte si, že ""převrat"" zde znamená ""obrat"". ";Ne, ne, ne. ;B
"Mince je hlavou vzhůru. Teresa hodí mincí. Reid neháže mincí. Karin minci nehraje. Gracie neháže mincí. Je mince stále hlavou vzhůru? Všimněte si, že ""převrat"" zde znamená ""obrat"". ";Ne, ne, ne. ;B
"Mince je hlavou vzhůru. Rahul hodí mincí. Praveen hodí mincí. Isaiah hodí mincí. Elsie neháže mincí. Je mince stále hlavou vzhůru? Všimněte si, že ""převrat"" zde znamená ""obrat"". ";Ne, ne, ne. ;B
"Mince je hlavou vzhůru. Miranda neháže mincí. Jacques nehraje s mincí. Clarence hodí mincí. Chandra hodí mincí. Je mince stále hlavou vzhůru? Všimněte si, že ""převrat"" zde znamená ""obrat"". ";Ano, ano, ano ;A
"Mince je hlavou vzhůru. June hodí mincí. Robin nehraje mincí. Josie hodí mincí. Bo neháže mincí. Je mince stále hlavou vzhůru? Všimněte si, že ""převrat"" zde znamená ""obrat"". ";Ano, ano, ano ;A
"Mince je hlavou vzhůru. Luisa neháže mincí. Tatiana nehraje s mincí. Drake neháže mincí. Hillary nehraje mincí. Je mince stále hlavou vzhůru? Všimněte si, že ""převrat"" zde znamená ""obrat"". ";Ano, ano, ano ;A
"Mince je hlavou vzhůru. Louise hodí mincí. Mariano neháže mincí. Laura neháže mincí. Gerardo hodí mincí. Je mince stále hlavou vzhůru? Všimněte si, že ""převrat"" zde znamená ""obrat"". ";Ano, ano, ano ;A
"Mince je hlavou vzhůru. Hvězda hodí mincí. Jude neháže mincí. Rosemarie nehraje s mincí. Raquel mincí neháže. Je mince stále hlavou vzhůru? Všimněte si, že ""převrat"" zde znamená ""obrat"". ";Ne, ne, ne. ;B
"Mince je hlavou vzhůru. Clark neháže mincí. Jenn hodí mincí. Diane hodí mincí. Blair neháže mincí. Je mince stále hlavou vzhůru? Všimněte si, že ""převrat"" zde znamená ""obrat"". ";Ano, ano, ano ;A
"Mince je hlavou vzhůru. Lalo neháže mincí. Yolanda hodí mincí. Elida neháže mincí. Ester hodí mincí. Je mince stále hlavou vzhůru? Všimněte si, že ""převrat"" zde znamená ""obrat"". ";Ano, ano, ano ;A
"Mince je hlavou vzhůru. Bethany nehraje s mincí. Rakesh neháže mincí. Christine mincí neháže. Dinesh hodí mincí. Je mince stále hlavou vzhůru? Všimněte si, že ""převrat"" zde znamená ""obrat"". ";Ne, ne, ne. ;B
"Mince je hlavou vzhůru. Nery hodí mincí. Cindy hodí mincí. Jess hodí mincí. Chris hodí mincí. Je mince stále hlavou vzhůru? Všimněte si, že ""převrat"" zde znamená ""obrat"". ";Ano, ano, ano ;A
"Mince je hlavou vzhůru. Miriam nehraje s mincí. Brandy hodí mincí. Bertha hodí mincí. Renato hodí mincí. Je mince stále hlavou vzhůru? Všimněte si, že ""převrat"" zde znamená ""obrat"". ";Ne, ne, ne. ;B
"Mince je hlavou vzhůru. Abel hodí mincí. Mallory hodí mincí. Theresa nehraje mincí. Quinn hodí mincí. Je mince stále hlavou vzhůru? Všimněte si, že ""převrat"" zde znamená ""obrat"". ";Ne, ne, ne. ;B
"Mince je hlavou vzhůru. Celso neháže mincí. Tracy neháže mincí. Winston hodí mincí. Anton neháže mincí. Je mince stále hlavou vzhůru? Všimněte si, že ""převrat"" zde znamená ""obrat"". ";Ne, ne, ne. ;B
"Mince je hlavou vzhůru. Lore neháže mincí. Erasmo hodí mincí. Louis hodí mincí. David nehraje s mincí. Je mince stále hlavou vzhůru? Všimněte si, že ""převrat"" zde znamená ""obrat"". ";Ano, ano, ano ;A
"Mince je hlavou vzhůru. Cristobal hodí mincí. Dania neháže mincí. Li neháže mincí. Anna hodí mincí. Je mince stále hlavou vzhůru? Všimněte si, že ""převrat"" zde znamená ""obrat"". ";Ano, ano, ano ;A
"Mince je hlavou vzhůru. Wally hodí mincí. Claire neháže mincí. Helen hodí mincí. Nacho neháže mincí. Je mince stále hlavou vzhůru? Všimněte si, že ""převrat"" zde znamená ""obrat"". ";Ano, ano, ano ;A
"Mince je hlavou vzhůru. Rosa hodí mincí. Lana hodí mincí. Curtis neháže mincí. Rae neháže mincí. Je mince stále hlavou vzhůru? Všimněte si, že ""převrat"" zde znamená ""obrat"". ";Ano, ano, ano ;A
"Mince je hlavou vzhůru. Angeles hodí mincí. Richard hodí mincí. Luciana hodí mincí. Darlene neháže mincí. Je mince stále hlavou vzhůru? Všimněte si, že ""převrat"" zde znamená ""obrat"". ";Ne, ne, ne. ;B
"Mince je hlavou vzhůru. Jodi hodí mincí. Judi hodí mincí. Nia neháže mincí. Raj hodí mincí. Je mince stále hlavou vzhůru? Všimněte si, že ""převrat"" zde znamená ""obrat"". ";Ne, ne, ne. ;B
"Mince je hlavou vzhůru. Irvin neháže mincí. Brittney hodí mincí. Vince hodí mincí. Lucas neháže mincí. Je mince stále hlavou vzhůru? Všimněte si, že ""převrat"" zde znamená ""obrat"". ";Ano, ano, ano ;A
"Mince je hlavou vzhůru. Guille neháže mincí. Lisa hodí mincí. Harvey neháže mincí. Gina neháže mincí. Je mince stále hlavou vzhůru? Všimněte si, že ""převrat"" zde znamená ""obrat"". ";Ne, ne, ne. ;B
"Mince je hlavou vzhůru. Renata hodí mincí. Mariela neháže mincí. Mona neháže mincí. Kristin hodí mincí. Je mince stále hlavou vzhůru? Všimněte si, že ""převrat"" zde znamená ""obrat"". ";Ano, ano, ano ;A
"Mince je hlavou vzhůru. Johan hodí mincí. Damien hodí mincí. Serena hodí mincí. Grace hodí mincí. Je mince stále hlavou vzhůru? Všimněte si, že ""převrat"" zde znamená ""obrat"". ";Ano, ano, ano ;A
"Mince je hlavou vzhůru. Aj neháže mincí. JD hodí mincí. Maddie neháže mincí. Francisca mincí neháže. Je mince stále hlavou vzhůru? Všimněte si, že ""převrat"" zde znamená ""obrat"". ";Ne, ne, ne. ;B
"Mince je hlavou vzhůru. Daryl neháže mincí. Owen neháže mincí. Myra hodí mincí. Aaron nehraje s mincí. Je mince stále hlavou vzhůru? Všimněte si, že ""převrat"" zde znamená ""obrat"". ";Ne, ne, ne. ;B
"Mince je hlavou vzhůru. Nick hodí mincí. Ada hodí mincí. Stephany nehraje s mincí. Suzie hodí mincí. Je mince stále hlavou vzhůru? Všimněte si, že ""převrat"" zde znamená ""obrat"". ";Ne, ne, ne. ;B
"Mince je hlavou vzhůru. Elle hodí mincí. Alex neháže mincí. Irma hodí mincí. Stephan hodí mincí. Je mince stále hlavou vzhůru? Všimněte si, že ""převrat"" zde znamená ""obrat"". ";Ne, ne, ne. ;B
"Mince je hlavou vzhůru. Arnold neháže mincí. Aidan neháže mincí. Ally hodí mincí. Ami neháže mincí. Je mince stále hlavou vzhůru? Všimněte si, že ""převrat"" zde znamená ""obrat"". ";Ne, ne, ne. ;B
"Mince je hlavou vzhůru. Gabino neháže mincí. Kayla hodí mincí. Laurie nehraje s mincí. Familia hodí mincí. Je mince stále hlavou vzhůru? Všimněte si, že ""převrat"" zde znamená ""obrat"". ";Ano, ano, ano ;A
"Mince je hlavou vzhůru. Logan neháže mincí. Ely neháže mincí. Abbie neháže mincí. Colleen neháže mincí. Je mince stále hlavou vzhůru? Všimněte si, že ""převrat"" zde znamená ""obrat"". ";Ano, ano, ano ;A
"Mince je hlavou vzhůru. Kristy hodí mincí. Brandi neháže mincí. Lizeth neháže mincí. Petra hodí mincí. Je mince stále hlavou vzhůru? Všimněte si, že ""převrat"" zde znamená ""obrat"". ";Ano, ano, ano ;A
"Mince je hlavou vzhůru. Hazel neháže mincí. Gabrielle hodí mincí. Tre neháže mincí. Dalton neháže mincí. Je mince stále hlavou vzhůru? Všimněte si, že ""převrat"" zde znamená ""obrat"". ";Ne, ne, ne. ;B
"Mince je hlavou vzhůru. Conrad hodí mincí. Marcella neháže mincí. Annette hodí mincí. Esteban hodí mincí. Je mince stále hlavou vzhůru? Všimněte si, že ""převrat"" zde znamená ""obrat"". ";Ne, ne, ne. ;B
"Mince je hlavou vzhůru. Isaac nehraje s mincí. Reyes neháže mincí. Carly hodí mincí. Tania hodí mincí. Je mince stále hlavou vzhůru? Všimněte si, že ""převrat"" zde znamená ""obrat"". ";Ano, ano, ano ;A
"Mince je hlavou vzhůru. Wilma hodí mincí. Margie hodí mincí. Amber hodí mincí. Sergio hodí mincí. Je mince stále hlavou vzhůru? Všimněte si, že ""převrat"" zde znamená ""obrat"". ";Ano, ano, ano ;A
"Mince je hlavou vzhůru. Sonya hodí mincí. Eddy neháže mincí. Carol neháže mincí. Yung hodí mincí. Je mince stále hlavou vzhůru? Všimněte si, že ""převrat"" zde znamená ""obrat"". ";Ano, ano, ano ;A
"Mince je hlavou vzhůru. Leandro hodí mincí. Maricela neháže mincí. Genevieve hodí mincí. Lesly nehraje mincí. Je mince stále hlavou vzhůru? Všimněte si, že ""převrat"" zde znamená ""obrat"". ";Ano, ano, ano ;A
"Mince je hlavou vzhůru. Andy neháže mincí. Cecilia hodí mincí. Gretchen hodí mincí. Sandi hodí mincí. Je mince stále hlavou vzhůru? Všimněte si, že ""převrat"" zde znamená ""obrat"". ";Ne, ne, ne. ;B
"Mince je hlavou vzhůru. Darwin hodí mincí. Colin hodí mincí. Cj hodí mincí. Abhishek hodí mincí. Je mince stále hlavou vzhůru? Všimněte si, že ""převrat"" zde znamená ""obrat"". ";Ano, ano, ano ;A
"Mince je hlavou vzhůru. Lupita hodí mincí. Cyndi hodí mincí. Kay neháže mincí. Derrick hodí mincí. Je mince stále hlavou vzhůru? Všimněte si, že ""převrat"" zde znamená ""obrat"". ";Ne, ne, ne. ;B
"Mince je hlavou vzhůru. Felipe neháže mincí. Heidi hodí mincí. Nino neháže mincí. Bradley neháže mincí. Je mince stále hlavou vzhůru? Všimněte si, že ""převrat"" zde znamená ""obrat"". ";Ne, ne, ne. ;B
"Mince je hlavou vzhůru. Dorian hodí mincí. Mayra hodí mincí. Freddie neháže mincí. Magaly hodí mincí. Je mince stále hlavou vzhůru? Všimněte si, že ""převrat"" zde znamená ""obrat"". ";Ne, ne, ne. ;B
"Mince je hlavou vzhůru. Flora hodí mincí. Warren hodí mincí. Gwendolyn nehraje mincí. Alissa neháže mincí. Je mince stále hlavou vzhůru? Všimněte si, že ""převrat"" zde znamená ""obrat"". ";Ano, ano, ano ;A
"Mince je hlavou vzhůru. As hodí mincí. Rosy neháže mincí. Kimberly nehraje mincí. Jean neháže mincí. Je mince stále hlavou vzhůru? Všimněte si, že ""převrat"" zde znamená ""obrat"". ";Ne, ne, ne. ;B
"Mince je hlavou vzhůru. Jeremy neháže mincí. Simone hodí mincí. Alondra neháže mincí. Wyatt neháže mincí. Je mince stále hlavou vzhůru? Všimněte si, že ""převrat"" zde znamená ""obrat"". ";Ne, ne, ne. ;B
"Mince je hlavou vzhůru. Deanna nehraje mincí. Terri nehraje mincí. Gabriela hodí mincí. Jonah hodí mincí. Je mince stále hlavou vzhůru? Všimněte si, že ""převrat"" zde znamená ""obrat"". ";Ano, ano, ano ;A
"Mince je hlavou vzhůru. Conor nehraje mincí. Randall neháže mincí. Oleg hodí mincí. Stephanie neháže mincí. Je mince stále hlavou vzhůru? Všimněte si, že ""převrat"" zde znamená ""obrat"". ";Ne, ne, ne. ;B
"Mince je hlavou vzhůru. Náhoda hodí mincí. Valentin neháže mincí. Micah hodí mincí. Clara hodí mincí. Je mince stále hlavou vzhůru? Všimněte si, že ""převrat"" zde znamená ""obrat"". ";Ne, ne, ne. ;B
"Mince je hlavou vzhůru. Dusty neháže mincí. Yanet hodí mincí. Hortencia hodí mincí. Lili hodí mincí. Je mince stále hlavou vzhůru? Všimněte si, že ""převrat"" zde znamená ""obrat"". ";Ne, ne, ne. ;B
"Mince je hlavou vzhůru. Natalie hodí mincí. Gilbert hodí mincí. Brian neháže mincí. Sanchez neháže mincí. Je mince stále hlavou vzhůru? Všimněte si, že ""převrat"" zde znamená ""obrat"". ";Ano, ano, ano ;A
"Mince je hlavou vzhůru. Ulises hodí mincí. Derek hodí mincí. Adrianna hodí mincí. Eugene hodí mincí. Je mince stále hlavou vzhůru? Všimněte si, že ""převrat"" zde znamená ""obrat"". ";Ano, ano, ano ;A
"Mince je hlavou vzhůru. Carlitos hodí mincí. Damaris hodí mincí. Nikhil neháže mincí. Jennie neháže mincí. Je mince stále hlavou vzhůru? Všimněte si, že ""převrat"" zde znamená ""obrat"". ";Ano, ano, ano ;A
"Mince je hlavou vzhůru. Yessenia neháže mincí. Geraldine hodí mincí. Minerva hodí mincí. Tanya hodí mincí. Je mince stále hlavou vzhůru? Všimněte si, že ""převrat"" zde znamená ""obrat"". ";Ne, ne, ne. ;B
"Mince je hlavou vzhůru. Nicolas neháže mincí. Aaliyah hodí mincí. Pascual neháže mincí. Rob neháže mincí. Je mince stále hlavou vzhůru? Všimněte si, že ""převrat"" zde znamená ""obrat"". ";Ne, ne, ne. ;B
"Mince je hlavou vzhůru. Brandon neháže mincí. Ivonne neháže mincí. Jefferson hodí mincí. Isabella mincí neháže. Je mince stále hlavou vzhůru? Všimněte si, že ""převrat"" zde znamená ""obrat"". ";Ne, ne, ne. ;B
"Mince je hlavou vzhůru. Pedro hodí mincí. Leopoldo neháže mincí. Tee neháže mincí. Mar hodí mincí. Je mince stále hlavou vzhůru? Všimněte si, že ""převrat"" zde znamená ""obrat"". ";Ano, ano, ano ;A
"Mince je hlavou vzhůru. Paříž nevyhodí mincí. Jimmie neháže mincí. Andrew hodí mincí. Ramón hodí mincí. Je mince stále hlavou vzhůru? Všimněte si, že ""převrat"" zde znamená ""obrat"". ";Ano, ano, ano ;A
