question;answer;answer_ab
"Mince je hlavou vzhůru. Anastasia neháže mincí. Thelma hodí mincí. Sheri hodí mincí. Rosita hodí mincí. Je mince stále hlavou vzhůru? Všimněte si, že ""převrat"" zde znamená ""obrat"". ";Ne, ne, ne. ;B
"Mince je hlavou vzhůru. Guillermina hodí mincí. Evelin hodí mincí. Dominique hodí mincí. Johnny neháže mincí. Je mince stále hlavou vzhůru? Všimněte si, že ""převrat"" zde znamená ""obrat"". ";Ne, ne, ne. ;B
"Mince je hlavou vzhůru. Sid hodí mincí. Isabelle neháže mincí. Jackson hodí mincí. Heidy neháže mincí. Je mince stále hlavou vzhůru? Všimněte si, že ""převrat"" zde znamená ""obrat"". ";Ano, ano, ano ;A
"Mince je hlavou vzhůru. Margaret nehraje mincí. Rosi hodí mincí. Willy hodí mincí. Charlene neháže mincí. Je mince stále hlavou vzhůru? Všimněte si, že ""převrat"" zde znamená ""obrat"". ";Ano, ano, ano ;A
"Mince je hlavou vzhůru. Carla hodí mincí. Dolores hodí mincí. Cooper hodí mincí. Damion hodí mincí. Je mince stále hlavou vzhůru? Všimněte si, že ""převrat"" zde znamená ""obrat"". ";Ano, ano, ano ;A
"Mince je hlavou vzhůru. Davis hodí mincí. Jules neháže mincí. Fabiola hodí mincí. Cherie neháže mincí. Je mince stále hlavou vzhůru? Všimněte si, že ""převrat"" zde znamená ""obrat"". ";Ano, ano, ano ;A
"Mince je hlavou vzhůru. Raven hodí mincí. Marisela mincí neháže. Ross hodí mincí. Angie hodí mincí. Je mince stále hlavou vzhůru? Všimněte si, že ""převrat"" zde znamená ""obrat"". ";Ne, ne, ne. ;B
"Mince je hlavou vzhůru. Jeff neháže mincí. Jen hodí mincí. Giselle hodí mincí. Noel neháže mincí. Je mince stále hlavou vzhůru? Všimněte si, že ""převrat"" zde znamená ""obrat"". ";Ano, ano, ano ;A
"Mince je hlavou vzhůru. Kristi hodí mincí. Eduardo neháže mincí. Angelo neháže mincí. Clare neháže mincí. Je mince stále hlavou vzhůru? Všimněte si, že ""převrat"" zde znamená ""obrat"". ";Ne, ne, ne. ;B
"Mince je hlavou vzhůru. Alina neháže mincí. Alessandra neháže mincí. Amina mincí neháže. Bianca hodí mincí. Je mince stále hlavou vzhůru? Všimněte si, že ""převrat"" zde znamená ""obrat"". ";Ne, ne, ne. ;B
"Mince je hlavou vzhůru. Zach hodí mincí. Trenton hodí mincí. Cary neháže mincí. Beth hodí mincí. Je mince stále hlavou vzhůru? Všimněte si, že ""převrat"" zde znamená ""obrat"". ";Ne, ne, ne. ;B
"Mince je hlavou vzhůru. Altagracia hodí mincí. Howard neháže mincí. Patti hodí mincí. Douglas hodí mincí. Je mince stále hlavou vzhůru? Všimněte si, že ""převrat"" zde znamená ""obrat"". ";Ne, ne, ne. ;B
"Mince je hlavou vzhůru. Jordan neháže mincí. Yoni hodí mincí. Lawrence neháže mincí. Aura hodí mincí. Je mince stále hlavou vzhůru? Všimněte si, že ""převrat"" zde znamená ""obrat"". ";Ano, ano, ano ;A
"Mince je hlavou vzhůru. Leticia hodí mincí. Jacinto hodí mincí. Natasha neháže mincí. Raphael hodí mincí. Je mince stále hlavou vzhůru? Všimněte si, že ""převrat"" zde znamená ""obrat"". ";Ne, ne, ne. ;B
"Mince je hlavou vzhůru. Mickey neháže mincí. Dom hodí mincí. Lilly hodí mincí. Eloy neháže mincí. Je mince stále hlavou vzhůru? Všimněte si, že ""převrat"" zde znamená ""obrat"". ";Ano, ano, ano ;A
"Mince je hlavou vzhůru. Timmy neháže mincí. Katherine nehraje mincí. Gabriel hodí mincí. Nate neháže mincí. Je mince stále hlavou vzhůru? Všimněte si, že ""převrat"" zde znamená ""obrat"". ";Ne, ne, ne. ;B
"Mince je hlavou vzhůru. Raymundo hodí mincí. Jonathon hodí mincí. Lexi neháže mincí. Rony hodí mincí. Je mince stále hlavou vzhůru? Všimněte si, že ""převrat"" zde znamená ""obrat"". ";Ne, ne, ne. ;B
"Mince je hlavou vzhůru. Amy hodí mincí. Ella neháže mincí. Amilcar neháže mincí. Roman neháže mincí. Je mince stále hlavou vzhůru? Všimněte si, že ""převrat"" zde znamená ""obrat"". ";Ne, ne, ne. ;B
"Mince je hlavou vzhůru. Bailey hodí mincí. Lourdes neháže mincí. Brianna nehraje s mincí. Martín hodí mincí. Je mince stále hlavou vzhůru? Všimněte si, že ""převrat"" zde znamená ""obrat"". ";Ano, ano, ano ;A
"Mince je hlavou vzhůru. Daniella hodí mincí. Dianne neháže mincí. Ram hodí mincí. Mirian hodí mincí. Je mince stále hlavou vzhůru? Všimněte si, že ""převrat"" zde znamená ""obrat"". ";Ne, ne, ne. ;B
"Mince je hlavou vzhůru. Rosie neháže mincí. Charlie neháže mincí. Mick hodí mincí. Jacquelyn nehraje mincí. Je mince stále hlavou vzhůru? Všimněte si, že ""převrat"" zde znamená ""obrat"". ";Ne, ne, ne. ;B
"Mince je hlavou vzhůru. Ericka neháže mincí. Aly hodí mincí. Darius neháže mincí. Reed hodí mincí. Je mince stále hlavou vzhůru? Všimněte si, že ""převrat"" zde znamená ""obrat"". ";Ano, ano, ano ;A
"Mince je hlavou vzhůru. Glenda hodí mincí. Beverly hodí mincí. Agustin hodí mincí. Igor neháže mincí. Je mince stále hlavou vzhůru? Všimněte si, že ""převrat"" zde znamená ""obrat"". ";Ne, ne, ne. ;B
"Mince je hlavou vzhůru. Dino hodí mincí. Toby neháže mincí. Abigail hodí mincí. Manuela mincí neháže. Je mince stále hlavou vzhůru? Všimněte si, že ""převrat"" zde znamená ""obrat"". ";Ano, ano, ano ;A
"Mince je hlavou vzhůru. Shannon neháže mincí. Millie hodí mincí. Rosemary nehraje mincí. Priyanka hodí mincí. Je mince stále hlavou vzhůru? Všimněte si, že ""převrat"" zde znamená ""obrat"". ";Ano, ano, ano ;A
"Mince je hlavou vzhůru. Cristian hodí mincí. Nik neháže mincí. Gwen hodí mincí. Josiah hodí mincí. Je mince stále hlavou vzhůru? Všimněte si, že ""převrat"" zde znamená ""obrat"". ";Ne, ne, ne. ;B
"Mince je hlavou vzhůru. Garry hodí mincí. Arielle hodí mincí. Elba neháže mincí. Rodney neháže mincí. Je mince stále hlavou vzhůru? Všimněte si, že ""převrat"" zde znamená ""obrat"". ";Ano, ano, ano ;A
"Mince je hlavou vzhůru. Clarissa neháže mincí. Shauna neháže mincí. Alexis neháže mincí. Branden hodí mincí. Je mince stále hlavou vzhůru? Všimněte si, že ""převrat"" zde znamená ""obrat"". ";Ne, ne, ne. ;B
"Mince je hlavou vzhůru. Barb neháže mincí. Gage hodí mincí. Kristian hodí mincí. Asie neháže mincí. Je mince stále hlavou vzhůru? Všimněte si, že ""převrat"" zde znamená ""obrat"". ";Ano, ano, ano ;A
"Mince je hlavou vzhůru. Emilia hodí mincí. Jonas hodí mincí. Christi neháže mincí. Sophia neháže mincí. Je mince stále hlavou vzhůru? Všimněte si, že ""převrat"" zde znamená ""obrat"". ";Ano, ano, ano ;A
"Mince je hlavou vzhůru. Sonia hodí mincí. Griffin hodí mincí. Claude hodí mincí. Josephine hodí mincí. Je mince stále hlavou vzhůru? Všimněte si, že ""převrat"" zde znamená ""obrat"". ";Ano, ano, ano ;A
"Mince je hlavou vzhůru. Arthur hodí mincí. Shan neháže mincí. Norman hodí mincí. Manny neháže mincí. Je mince stále hlavou vzhůru? Všimněte si, že ""převrat"" zde znamená ""obrat"". ";Ano, ano, ano ;A
"Mince je hlavou vzhůru. Abdi neháže mincí. Clyde neháže mincí. Ana Maria neháže mincí. Pepe neháže mincí. Je mince stále hlavou vzhůru? Všimněte si, že ""převrat"" zde znamená ""obrat"". ";Ano, ano, ano ;A
"Mince je hlavou vzhůru. Scotty hodí mincí. Edgar hodí mincí. Hanna hodí mincí. Austin hodí mincí. Je mince stále hlavou vzhůru? Všimněte si, že ""převrat"" zde znamená ""obrat"". ";Ano, ano, ano ;A
"Mince je hlavou vzhůru. Denis neháže mincí. Gigi hodí mincí. Heather nehraje mincí. Ginger hodí mincí. Je mince stále hlavou vzhůru? Všimněte si, že ""převrat"" zde znamená ""obrat"". ";Ano, ano, ano ;A
"Mince je hlavou vzhůru. Steph hodí mincí. Pablo hodí mincí. Ceci hodí mincí. Francine hodí mincí. Je mince stále hlavou vzhůru? Všimněte si, že ""převrat"" zde znamená ""obrat"". ";Ano, ano, ano ;A
"Mince je hlavou vzhůru. Orlando neháže mincí. Colby neháže mincí. Julius hodí mincí. Ofelia hodí mincí. Je mince stále hlavou vzhůru? Všimněte si, že ""převrat"" zde znamená ""obrat"". ";Ano, ano, ano ;A
"Mince je hlavou vzhůru. Rogelio hodí mincí. Freddy neháže mincí. Ivan hodí mincí. Madeleine mincí neháže. Je mince stále hlavou vzhůru? Všimněte si, že ""převrat"" zde znamená ""obrat"". ";Ano, ano, ano ;A
"Mince je hlavou vzhůru. Marshall hodí mincí. Herman neháže mincí. Faye neháže mincí. Grant neháže mincí. Je mince stále hlavou vzhůru? Všimněte si, že ""převrat"" zde znamená ""obrat"". ";Ne, ne, ne. ;B
"Mince je hlavou vzhůru. Bernard neháže mincí. Lidia hodí mincí. Sebastian neháže mincí. Judy neháže mincí. Je mince stále hlavou vzhůru? Všimněte si, že ""převrat"" zde znamená ""obrat"". ";Ne, ne, ne. ;B
"Mince je hlavou vzhůru. Kyra mincí neháže. Luciano hodí mincí. Ciara neháže mincí. Bryan hodí mincí. Je mince stále hlavou vzhůru? Všimněte si, že ""převrat"" zde znamená ""obrat"". ";Ano, ano, ano ;A
"Mince je hlavou vzhůru. Myriam mincí neháže. José hodí mincí. Cecy hodí mincí. Faisal hodí mincí. Je mince stále hlavou vzhůru? Všimněte si, že ""převrat"" zde znamená ""obrat"". ";Ne, ne, ne. ;B
"Mince je hlavou vzhůru. Memo hodí mincí. Joey neháže mincí. Phil hodí mincí. Samuel hodí mincí. Je mince stále hlavou vzhůru? Všimněte si, že ""převrat"" zde znamená ""obrat"". ";Ne, ne, ne. ;B
"Mince je hlavou vzhůru. Angel hodí mincí. Sheryl hodí mincí. Dulce hodí mincí. Kenny hodí mincí. Je mince stále hlavou vzhůru? Všimněte si, že ""převrat"" zde znamená ""obrat"". ";Ano, ano, ano ;A
"Mince je hlavou vzhůru. Selina hodí mincí. Tasha hodí mincí. Jarrod neháže mincí. Maddy neháže mincí. Je mince stále hlavou vzhůru? Všimněte si, že ""převrat"" zde znamená ""obrat"". ";Ano, ano, ano ;A
"Mince je hlavou vzhůru. Talia hodí mincí. Nicki neháže mincí. Tia hodí mincí. Divya neháže mincí. Je mince stále hlavou vzhůru? Všimněte si, že ""převrat"" zde znamená ""obrat"". ";Ano, ano, ano ;A
"Mince je hlavou vzhůru. Franklin hodí mincí. Rochelle neháže mincí. Brent nehraje s mincí. Sarai hodí mincí. Je mince stále hlavou vzhůru? Všimněte si, že ""převrat"" zde znamená ""obrat"". ";Ano, ano, ano ;A
"Mince je hlavou vzhůru. Clinton hodí mincí. Yanira hodí mincí. Barbara hodí mincí. Betsy hodí mincí. Je mince stále hlavou vzhůru? Všimněte si, že ""převrat"" zde znamená ""obrat"". ";Ano, ano, ano ;A
"Mince je hlavou vzhůru. Ronnie hodí mincí. Kiki hodí mincí. Alan hodí mincí. Remy hodí mincí. Je mince stále hlavou vzhůru? Všimněte si, že ""převrat"" zde znamená ""obrat"". ";Ano, ano, ano ;A
"Mince je hlavou vzhůru. Erwin neháže mincí. Chad neháže mincí. Margarito neháže mincí. Shanna neháže mincí. Je mince stále hlavou vzhůru? Všimněte si, že ""převrat"" zde znamená ""obrat"". ";Ano, ano, ano ;A
"Mince je hlavou vzhůru. Connie neháže mincí. Elena neháže mincí. Tami hodí mincí. Stuart neháže mincí. Je mince stále hlavou vzhůru? Všimněte si, že ""převrat"" zde znamená ""obrat"". ";Ne, ne, ne. ;B
"Mince je hlavou vzhůru. Blaine hodí mincí. Syed hodí mincí. Priya neháže mincí. Ruby hodí mincí. Je mince stále hlavou vzhůru? Všimněte si, že ""převrat"" zde znamená ""obrat"". ";Ne, ne, ne. ;B
"Mince je hlavou vzhůru. Fernanda hodí mincí. Magda hodí mincí. Elmer hodí mincí. Alvaro nehraje s mincí. Je mince stále hlavou vzhůru? Všimněte si, že ""převrat"" zde znamená ""obrat"". ";Ne, ne, ne. ;B
"Mince je hlavou vzhůru. Anand hodí mincí. Estefania neháže mincí. Stanley hodí mincí. Lizette hodí mincí. Je mince stále hlavou vzhůru? Všimněte si, že ""převrat"" zde znamená ""obrat"". ";Ne, ne, ne. ;B
"Mince je hlavou vzhůru. Sunil hodí mincí. Tiana minci neháže. Darla neháže mincí. Darnell hodí mincí. Je mince stále hlavou vzhůru? Všimněte si, že ""převrat"" zde znamená ""obrat"". ";Ano, ano, ano ;A
"Mince je hlavou vzhůru. Eugenio hodí mincí. Moises neháže mincí. Marion mincí neháže. Kirk neháže mincí. Je mince stále hlavou vzhůru? Všimněte si, že ""převrat"" zde znamená ""obrat"". ";Ne, ne, ne. ;B
"Mince je hlavou vzhůru. Marty hodí mincí. Justine hodí mincí. Edgardo neháže mincí. Osman hodí mincí. Je mince stále hlavou vzhůru? Všimněte si, že ""převrat"" zde znamená ""obrat"". ";Ne, ne, ne. ;B
"Mince je hlavou vzhůru. Tucker neháže mincí. Daniel hodí mincí. Hernandez neháže mincí. Alison hodí mincí. Je mince stále hlavou vzhůru? Všimněte si, že ""převrat"" zde znamená ""obrat"". ";Ano, ano, ano ;A
"Mince je hlavou vzhůru. Sherri neháže mincí. Genesis hodí mincí. Jeffrey neháže mincí. Samir neháže mincí. Je mince stále hlavou vzhůru? Všimněte si, že ""převrat"" zde znamená ""obrat"". ";Ne, ne, ne. ;B
"Mince je hlavou vzhůru. Kočka neháže mincí. Alisha hodí mincí. Ramon nehraje mincí. Norberto hodí mincí. Je mince stále hlavou vzhůru? Všimněte si, že ""převrat"" zde znamená ""obrat"". ";Ano, ano, ano ;A
"Mince je hlavou vzhůru. Hilario hodí mincí. Magdalena hodí mincí. Morris hodí mincí. Patricio neháže mincí. Je mince stále hlavou vzhůru? Všimněte si, že ""převrat"" zde znamená ""obrat"". ";Ne, ne, ne. ;B
"Mince je hlavou vzhůru. Fausto neháže mincí. Tito neháže mincí. Jade neháže mincí. Terrance neháže mincí. Je mince stále hlavou vzhůru? Všimněte si, že ""převrat"" zde znamená ""obrat"". ";Ano, ano, ano ;A
"Mince je hlavou vzhůru. Gayle neháže mincí. Doreen neháže mincí. Chelsey hodí mincí. Helena neháže mincí. Je mince stále hlavou vzhůru? Všimněte si, že ""převrat"" zde znamená ""obrat"". ";Ne, ne, ne. ;B
"Mince je hlavou vzhůru. Lucio hodí mincí. Víctor neháže mincí. Lester hodí mincí. Allie hodí mincí. Je mince stále hlavou vzhůru? Všimněte si, že ""převrat"" zde znamená ""obrat"". ";Ne, ne, ne. ;B
"Mince je hlavou vzhůru. Donnie neháže mincí. Alli neháže mincí. Terry hodí mincí. Krystal neháže mincí. Je mince stále hlavou vzhůru? Všimněte si, že ""převrat"" zde znamená ""obrat"". ";Ne, ne, ne. ;B
"Mince je hlavou vzhůru. Carlos neháže mincí. Jackie neháže mincí. Callie hodí mincí. Caitlin hodí mincí. Je mince stále hlavou vzhůru? Všimněte si, že ""převrat"" zde znamená ""obrat"". ";Ano, ano, ano ;A
"Mince je hlavou vzhůru. Debi neháže mincí. Raymond nehraje mincí. Luis neháže mincí. Federico hodí mincí. Je mince stále hlavou vzhůru? Všimněte si, že ""převrat"" zde znamená ""obrat"". ";Ne, ne, ne. ;B
"Mince je hlavou vzhůru. Kelvin nehraje mincí. Brennan nehraje s mincí. Carina hodí mincí. Paty neháže mincí. Je mince stále hlavou vzhůru? Všimněte si, že ""převrat"" zde znamená ""obrat"". ";Ne, ne, ne. ;B
"Mince je hlavou vzhůru. Janice hodí mincí. Shelly hodí mincí. Arnulfo neháže mincí. Nestor hodí mincí. Je mince stále hlavou vzhůru? Všimněte si, že ""převrat"" zde znamená ""obrat"". ";Ne, ne, ne. ;B
"Mince je hlavou vzhůru. Bob hodí mincí. Aman neháže mincí. Richie hodí mincí. Sana neháže mincí. Je mince stále hlavou vzhůru? Všimněte si, že ""převrat"" zde znamená ""obrat"". ";Ano, ano, ano ;A
"Mince je hlavou vzhůru. Juan Jose neháže mincí. Dalia neháže mincí. Osud nevyhodí mincí. Amelia hodí mincí. Je mince stále hlavou vzhůru? Všimněte si, že ""převrat"" zde znamená ""obrat"". ";Ne, ne, ne. ;B
"Mince je hlavou vzhůru. Jose Luis neháže mincí. Kiara hodí mincí. Arun neháže mincí. Josefina neháže mincí. Je mince stále hlavou vzhůru? Všimněte si, že ""převrat"" zde znamená ""obrat"". ";Ne, ne, ne. ;B
"Mince je hlavou vzhůru. Guillermo neháže mincí. Gerry neháže mincí. Lizbeth hodí mincí. Charly hodí mincí. Je mince stále hlavou vzhůru? Všimněte si, že ""převrat"" zde znamená ""obrat"". ";Ano, ano, ano ;A
"Mince je hlavou vzhůru. Reginald nehraje mincí. Franky hodí mincí. Kira hodí mincí. Gordon hodí mincí. Je mince stále hlavou vzhůru? Všimněte si, že ""převrat"" zde znamená ""obrat"". ";Ne, ne, ne. ;B
"Mince je hlavou vzhůru. Bret neháže mincí. Lois hodí mincí. Ismael hodí mincí. Mirna hodí mincí. Je mince stále hlavou vzhůru? Všimněte si, že ""převrat"" zde znamená ""obrat"". ";Ne, ne, ne. ;B
"Mince je hlavou vzhůru. Peggy hodí mincí. Trent hodí mincí. Darrell hodí mincí. Pamela hodí mincí. Je mince stále hlavou vzhůru? Všimněte si, že ""převrat"" zde znamená ""obrat"". ";Ano, ano, ano ;A
"Mince je hlavou vzhůru. Sophie neháže mincí. Gregorio nehraje s mincí. Avery neháže mincí. Pooja neháže mincí. Je mince stále hlavou vzhůru? Všimněte si, že ""převrat"" zde znamená ""obrat"". ";Ano, ano, ano ;A
"Mince je hlavou vzhůru. Yvonne neháže mincí. Rafaela neháže mincí. JB neháže mincí. Salomon nehraje s mincí. Je mince stále hlavou vzhůru? Všimněte si, že ""převrat"" zde znamená ""obrat"". ";Ano, ano, ano ;A
"Mince je hlavou vzhůru. Gabi hodí mincí. Dante hodí mincí. Rafa hodí mincí. Tricia neháže mincí. Je mince stále hlavou vzhůru? Všimněte si, že ""převrat"" zde znamená ""obrat"". ";Ne, ne, ne. ;B
"Mince je hlavou vzhůru. Martin neháže mincí. Sage neháže mincí. Tanisha minci nehádá. Rick neháže mincí. Je mince stále hlavou vzhůru? Všimněte si, že ""převrat"" zde znamená ""obrat"". ";Ano, ano, ano ;A
"Mince je hlavou vzhůru. Suzanne hodí mincí. Julissa hodí mincí. Chino hodí mincí. Amerika neháže mincí. Je mince stále hlavou vzhůru? Všimněte si, že ""převrat"" zde znamená ""obrat"". ";Ne, ne, ne. ;B
"Mince je hlavou vzhůru. Mel neháže mincí. Josh hodí mincí. Alejandra hodí mincí. Harley hodí mincí. Je mince stále hlavou vzhůru? Všimněte si, že ""převrat"" zde znamená ""obrat"". ";Ne, ne, ne. ;B
"Mince je hlavou vzhůru. Candy neháže mincí. Megan hodí mincí. Ed neháže mincí. Nathan hodí mincí. Je mince stále hlavou vzhůru? Všimněte si, že ""převrat"" zde znamená ""obrat"". ";Ano, ano, ano ;A
"Mince je hlavou vzhůru. Diego neháže mincí. Val hodí mincí. Vincent neháže mincí. Stacie neháže mincí. Je mince stále hlavou vzhůru? Všimněte si, že ""převrat"" zde znamená ""obrat"". ";Ne, ne, ne. ;B
"Mince je hlavou vzhůru. Salvatore neháže mincí. Gustavo hodí mincí. Jill neháže mincí. Celeste neháže mincí. Je mince stále hlavou vzhůru? Všimněte si, že ""převrat"" zde znamená ""obrat"". ";Ne, ne, ne. ;B
"Mince je hlavou vzhůru. Marcy hodí mincí. Gonzalez neháže mincí. Alice neháže mincí. Arlene hodí mincí. Je mince stále hlavou vzhůru? Všimněte si, že ""převrat"" zde znamená ""obrat"". ";Ano, ano, ano ;A
"Mince je hlavou vzhůru. Dana neháže mincí. Němec hodí mincí. Alvin neháže mincí. Braden hodí mincí. Je mince stále hlavou vzhůru? Všimněte si, že ""převrat"" zde znamená ""obrat"". ";Ano, ano, ano ;A
"Mince je hlavou vzhůru. Paula neháže mincí. Irina hodí mincí. Laurel neháže mincí. Maribel hodí mincí. Je mince stále hlavou vzhůru? Všimněte si, že ""převrat"" zde znamená ""obrat"". ";Ano, ano, ano ;A
"Mince je hlavou vzhůru. Andrés neháže mincí. Miles neháže mincí. Ronaldo hodí mincí. Melinda hodí mincí. Je mince stále hlavou vzhůru? Všimněte si, že ""převrat"" zde znamená ""obrat"". ";Ano, ano, ano ;A
"Mince je hlavou vzhůru. Williams neháže mincí. Reza hodí mincí. Ashton hodí mincí. Lillian hodí mincí. Je mince stále hlavou vzhůru? Všimněte si, že ""převrat"" zde znamená ""obrat"". ";Ne, ne, ne. ;B
"Mince je hlavou vzhůru. Lacey hodí mincí. Nora neháže mincí. Debra mincí neháže. Ashleigh nevyhodí mincí. Je mince stále hlavou vzhůru? Všimněte si, že ""převrat"" zde znamená ""obrat"". ";Ne, ne, ne. ;B
"Mince je hlavou vzhůru. Itzel hodí mincí. Anderson neháže mincí. Kenia minci nehraje. Edy hodí mincí. Je mince stále hlavou vzhůru? Všimněte si, že ""převrat"" zde znamená ""obrat"". ";Ano, ano, ano ;A
"Mince je hlavou vzhůru. Forrest neháže mincí. Juanito neháže mincí. Allan neháže mincí. Candice neháže mincí. Je mince stále hlavou vzhůru? Všimněte si, že ""převrat"" zde znamená ""obrat"". ";Ano, ano, ano ;A
"Mince je hlavou vzhůru. Nico neháže mincí. Lorenzo hodí mincí. Johanna mincí neháže. Teresita neháže mincí. Je mince stále hlavou vzhůru? Všimněte si, že ""převrat"" zde znamená ""obrat"". ";Ne, ne, ne. ;B
"Mince je hlavou vzhůru. Paulo hodí mincí. Tatjana hodí mincí. Bernice neháže mincí. Raúl hodí mincí. Je mince stále hlavou vzhůru? Všimněte si, že ""převrat"" zde znamená ""obrat"". ";Ne, ne, ne. ;B
"Mince je hlavou vzhůru. Lionel hodí mincí. Fiona hodí mincí. Bobby neháže mincí. Janeth neháže mincí. Je mince stále hlavou vzhůru? Všimněte si, že ""převrat"" zde znamená ""obrat"". ";Ano, ano, ano ;A
"Mince je hlavou vzhůru. Dany hodí mincí. Hilda hodí mincí. Butch hodí mincí. Mahesh neháže mincí. Je mince stále hlavou vzhůru? Všimněte si, že ""převrat"" zde znamená ""obrat"". ";Ne, ne, ne. ;B
"Mince je hlavou vzhůru. Deon hodí mincí. Lane hodí mincí. Everett hodí mincí. Lindsay hodí mincí. Je mince stále hlavou vzhůru? Všimněte si, že ""převrat"" zde znamená ""obrat"". ";Ano, ano, ano ;A
"Mince je hlavou vzhůru. Ubaldo neháže mincí. Katrina hodí mincí. Francis neháže mincí. Lynn hodí mincí. Je mince stále hlavou vzhůru? Všimněte si, že ""převrat"" zde znamená ""obrat"". ";Ano, ano, ano ;A
"Mince je hlavou vzhůru. Lesley hodí mincí. Luna hodí mincí. Nadia neháže mincí. Adriana hodí mincí. Je mince stále hlavou vzhůru? Všimněte si, že ""převrat"" zde znamená ""obrat"". ";Ne, ne, ne. ;B
"Mince je hlavou vzhůru. Maureen hodí mincí. Fabian hodí mincí. Claudette hodí mincí. Peyton hodí mincí. Je mince stále hlavou vzhůru? Všimněte si, že ""převrat"" zde znamená ""obrat"". ";Ano, ano, ano ;A
"Mince je hlavou vzhůru. Gabby neháže mincí. Reese hodí mincí. Leah mincí neháže. Celia neháže mincí. Je mince stále hlavou vzhůru? Všimněte si, že ""převrat"" zde znamená ""obrat"". ";Ne, ne, ne. ;B
"Mince je hlavou vzhůru. Ramona mincí neháže. Lucy hodí mincí. Gail neháže mincí. Octavio hodí mincí. Je mince stále hlavou vzhůru? Všimněte si, že ""převrat"" zde znamená ""obrat"". ";Ano, ano, ano ;A
"Mince je hlavou vzhůru. Sue hodí mincí. Cassandra hodí mincí. Cody hodí mincí. Cali neháže mincí. Je mince stále hlavou vzhůru? Všimněte si, že ""převrat"" zde znamená ""obrat"". ";Ne, ne, ne. ;B
"Mince je hlavou vzhůru. Efrain neháže mincí. Rickey neháže mincí. Jonathan hodí mincí. Kelli neháže mincí. Je mince stále hlavou vzhůru? Všimněte si, že ""převrat"" zde znamená ""obrat"". ";Ne, ne, ne. ;B
"Mince je hlavou vzhůru. Efren hodí mincí. Rex hodí mincí. Marilyn hodí mincí. Emerson hodí mincí. Je mince stále hlavou vzhůru? Všimněte si, že ""převrat"" zde znamená ""obrat"". ";Ano, ano, ano ;A
"Mince je hlavou vzhůru. Bobbi nehraje mincí. Tamika nehraje s mincí. Zac neháže mincí. Lala hodí mincí. Je mince stále hlavou vzhůru? Všimněte si, že ""převrat"" zde znamená ""obrat"". ";Ne, ne, ne. ;B
"Mince je hlavou vzhůru. Kendall neháže mincí. Matias hodí mincí. Kaleb hodí mincí. Randy neháže mincí. Je mince stále hlavou vzhůru? Všimněte si, že ""převrat"" zde znamená ""obrat"". ";Ano, ano, ano ;A
"Mince je hlavou vzhůru. Armando hodí mincí. Astrid neháže mincí. Anibal hodí mincí. Dakota neháže mincí. Je mince stále hlavou vzhůru? Všimněte si, že ""převrat"" zde znamená ""obrat"". ";Ano, ano, ano ;A
"Mince je hlavou vzhůru. Lamont neháže mincí. Frederick hodí mincí. Lance hodí mincí. Esperanza neháže mincí. Je mince stále hlavou vzhůru? Všimněte si, že ""převrat"" zde znamená ""obrat"". ";Ano, ano, ano ;A
"Mince je hlavou vzhůru. Lynda hodí mincí. Danilo hodí mincí. Jonny neháže mincí. Judith nehraje mincí. Je mince stále hlavou vzhůru? Všimněte si, že ""převrat"" zde znamená ""obrat"". ";Ano, ano, ano ;A
"Mince je hlavou vzhůru. Deandre neháže mincí. Moe neháže mincí. Jack neháže mincí. Vanessa neháže mincí. Je mince stále hlavou vzhůru? Všimněte si, že ""převrat"" zde znamená ""obrat"". ";Ano, ano, ano ;A
"Mince je hlavou vzhůru. Tere neháže mincí. Niko hodí mincí. Keith neháže mincí. Conner neháže mincí. Je mince stále hlavou vzhůru? Všimněte si, že ""převrat"" zde znamená ""obrat"". ";Ne, ne, ne. ;B
"Mince je hlavou vzhůru. Kelly neháže mincí. Cheryl neháže mincí. Nancy neháže mincí. Jojo neháže mincí. Je mince stále hlavou vzhůru? Všimněte si, že ""převrat"" zde znamená ""obrat"". ";Ano, ano, ano ;A
"Mince je hlavou vzhůru. Héctor hodí mincí. Daniela hodí mincí. Rossy hodí mincí. Jose Manuel neháže mincí. Je mince stále hlavou vzhůru? Všimněte si, že ""převrat"" zde znamená ""obrat"". ";Ne, ne, ne. ;B
"Mince je hlavou vzhůru. Carissa hodí mincí. Paige neháže mincí. Consuelo minci nehádá. Izzy hodí mincí. Je mince stále hlavou vzhůru? Všimněte si, že ""převrat"" zde znamená ""obrat"". ";Ano, ano, ano ;A
"Mince je hlavou vzhůru. Wilson neháže mincí. Abbey neháže mincí. Harold hodí mincí. Nelly hodí mincí. Je mince stále hlavou vzhůru? Všimněte si, že ""převrat"" zde znamená ""obrat"". ";Ano, ano, ano ;A
