question;answer_number
"SeaSide- ի հիմնական նավահանգստում մաքսային ծառայող հաշվարկել է ներմուծված մեքենաների 2 կոնտեյներ, որոնցից յուրաքանչյուրում 5 մեքենա է: ""Ամեն ինչ լավ է, որ մենք ունենք այդպիսի մեքենաներ""։ Հաշվարկել երկրորդ օրը ներմուծված կոնտեյներների թիվը' ենթադրելով, որ բոլոր կոնտեյները պարունակում են 5 մեքենա: ";4
Ադրիենի ընդհանուր աշխատավարձը 30 տոկոսով ավելի բարձր էր, քան Լայլիը։ Չորս տարի անց նրա աշխատավարձը բարձրացավ, եւ նա 40%-ով ավելի էր վաստակում, քան չորս տարի առաջ: Եթե Ադրիենի եւ Լայլի աշխատավարձը միաժամանակ աճել է, եւ Ադրիենը չորս տարի առաջ վաստակել է 40000 դոլար, հաշվարկեք, թե չորս տարի անց նրանց աշխատավարձը որքան է եղել: ;95200
Միգելը շաբաթական 2 թղթե տուփ է օգտագործում իր նկարների համար: Եթե մի թղթի վրա 30 թղթի կտոր կա, ապա քանի՞ թղթի կտոր է նա օգտագործում ամեն ամիս: ;240
Մորիսեթին եւ Կաելին խնդրեցին պտուղներ բերել: Մորիսետը բերեց 5 խնձոր եւ 8 նարնջ, իսկ Կաելը բերեց երկու անգամ ավելի շատ խնձոր եւ կեսը նարնջի, քան Մորիսետը։ Ընդհանուր առմամբ քանի՞ հատ պտուղ ունեն: ;27
Սեդին երկուշաբթի 8 ժամ է քնել: Հաջորդ երկու օրերին նա 2 ժամ պակաս է քնել, քանի որ պետք է ավարտի որոշ առաջադրանքներ: Եթե նա շաբաթվա մնացած օրերին 1 ժամ ավելի է քնել, քան այդ երկու օրերին, ապա քանի՞ ժամ է նա քնել ամբողջ շաբաթվա ընթացքում: ;48
Ռոզին կարող է ժամում 10 մղոն վազել 3 ժամ: Դրանից հետո նա վազում է 8 կմ/ժ արագությամբ: Քանի՞ մղոն կարող է նա վազել 7 ժամում: ;50
Ջենին օգնում է իր մոր գրասենյակում: Նա ունի 60 նամակ, որոնք պետք է կնճիռներ ունենան, եւ մի կույտ նամակներ, որոնք արդեն կնճիռներ են: Նա նամակների մեկ երրորդի վրա դրոշմ է դնում, որոնք դրոշմ են պահանջում: Եթե արդեն դրոշմված նամակների կուտակում կա 30 նամակ, ապա քանի՞ նամակ էր այդ կուտակում, երբ Ջեննին սկսեց գրել: ;10
"Ջուլիան պատրաստվում էր ընթրիքի իր տանը, որտեղ նա մտադիր էր մատուցել stew. Նա նկատեց, որ պլաստմասսե գդալները վերջացել են, ուստի գնել է նորը։ Հետագայում նրա ամուսինը եւս գնել է 5 նոր գդալ եւ տվել Ջուլիային։ Ջուլիան պատրաստելիս երեք գդալներից մի քանիսը փորձարկեց իր խաշածը: ""Երբ նա գնաց սեղան դնելու, նա 12 գդալ ուներ""։ Քանի՞ գդալ կար այն փաթեթում, որը Ջուլիան գնել էր։ ";10
Դիլանին հավի սոսյուզներ եւ ձկան սոսյուզներ էին պետք, որպեսզի կատեգորիայի համար սոսյուզային հաց պատրաստի: Նա գնել է 38 հավի սոսյուզ եւ 6 ձկան սոսյուզ ավելի շատ, քան հավի սոսյուզը: Դիլանը քանի՞ սոսյուզ է գնել։ ;82
Այմին նոր դպրոց տեղափոխվելուց հետո 20 ընկեր է ունեցել, քան Լիլին: Եթե Լիլին 50 ընկեր է ունեցել, ապա քանի՞ ընկեր ունեն Լիլին եւ Էմին միասին: ;120
Վելլայի մայրը մետաղադրամներ, պղպեղներ եւ նարնջներ է վաճառում տեղի խանութում։ Մի ձմերուկը երեք անգամ ավելի է արժե, քան մեկ պղպեղը: Նարնջը 5 անգամ էժան է, քան ջրավազանը: Դիլոնը գնում է խանութ՝ 4 ձմերուկ, 20 պղպեղ եւ 10 նարնջ գնելու։ Որքա՞ն գումար է նա ծախսելու, եթե յուրաքանչյուր պղպեղը արժե 15 դոլար: ;880
Հիվանդանոցը օրական 500 մարդ է ընդունում: Յուրաքանչյուր հիվանդին միջինում դիտում են 24 րոպե: Բժիշկները հիվանդանոցից ժամը 150 դոլար են պահանջում, իսկ հիվանդանոցը հիվանդներից՝ 200 դոլար։ Որքա՞ն եկամուտ է ստանում հիվանդանոցը այս այցելություններից: ;10000
Նիսան վարձում է 60 սեզոնային աշխատողներ, որպեսզի իր խանութի Սուրբ Ծննդյան գյուղում դեւեր խաղան: Էլֆերի մեկ երրորդը հրաժարվում է, երբ երեխաները փսխում են նրանց վրա, իսկ մնացած 10-ը' երբ երեխաները խփում են նրանց ոտքերը: Քանի՞ գայլ է մնացել: ;30
Մայիսին Ջոզեֆի ծախսերը կազմել են 500 դոլար: Հունիսին նրա ծախսերը 60 դոլարով պակաս էին: Որքա՞ն գումար է ծախսել այս երկու ամսվա ընթացքում։ ;940
Պամը եւ Ֆրեդը գնացինք տոնավաճառ: Պեմը 2 անգամ հեծանիվ է վարել, իսկ Ֆրեդը 4 անգամ: Դրանից հետո նրանցից յուրաքանչյուրը որոշեց երկու անգամ լողավազանով գնալ: Եթե յուրաքանչյուր ուղեւորության համար վճարվում է 6 տոմս, ապա քանի՞ տոմս են նրանք օգտագործել այդ օրը: ;60
Երկուշաբթի օրը Ուոլթը քայլել է 4 մղոն: Երեքշաբթի օրը նա քայլել է երկուշաբթի օրվա 6 անգամ ավելի շատ մղոն: Երկուշաբթիից մինչեւ չորեքշաբթի նրա ընդհանուր քաշը եղել է 41 մղոն: Քանի՞ մղոն է նա քայլել չորեքշաբթի օրը: ;13
Թոմը ամսական 4 անգամ մեքենա է լվանում։ Եթե յուրաքանչյուր մեքենա լվացքի համար 15 դոլար է արժե, ապա որքան է նա վճարում մեկ տարվա ընթացքում: ;720
Բրայանի ընկեր Բոբբին ունի 5 անգամ պակաս, քան 3 անգամ ավելի շատ վիդեո խաղեր, քան Բրայանը: Եթե Բրայանը 20 խաղ ունի, բայց 5 խաղը կորցրել է, քանի՞ խաղ ունի Բոբին։ ;40
Աշխարհում մնացել է 27 միաթեյջ եղջյուր: Դրանց մեկ երրորդը գտնվում է Շոտլանդիայի լեռնաշխարհում: Շոտլանդական միաթեծների երկու երրորդը կանացի են: Քանի՞ կանացի շոտլանդական միաթեյ կա: ;6
Ռորին պատվիրում է 2 սուպսենտ 7.50 դոլարով, 2 տուփ կարտոֆիլ՝ 1.50 դոլարով եւ 2 թխվածքաբլիթ՝ 1.00 դոլարով։ Հեռանալիս ավելացվում է առաքման 20% վճար, եւ նա ցանկանում է ավելացնել 5 դոլար տիպ: Որքա՞ն կարժենա նրա առաքման պատվերը: ;29
Մարկը երեկ թեստ է տվել, որը բաղկացած էր 75 հարցից: Նա ավարտեց թեստը ժամը 5 հարցով: Այսօր նա եւս մեկ թեստ տվեց, 100 հարցից բաղկացած, նույն արագությամբ: Եթե Մարկը 8 ժամ ժամանակ ուներ առաջին թեստը ավարտելու համար եւ 6 ժամ՝ երկրորդը, ապա քանի՞ հարց է թողել անավարտ: ;105
Շաքարավազի մեքենայում կա 22 շաքարավազի, ինչը չորս անգամ ավելի շատ է, քան կան կապույտ շաքարավազի: Եթե կա 12 կապույտ գոմբալ, քանի՞ վարդագույն կա: ;70
Վարձակալության համար առկա 20 ավտոմեքենաներից 12-ը ավտոմատ, 4-ը ձեռքով, իսկ մնացածը կիսաավտոմատ են: Որքա՞ն տոկոսն է կիսաավտոմատ մեքենաների: ;20
Կաղամբում 700 մեղու կա: Աշխատող մեղուների թիվը կրկնակի է փոքր մեղուների թվից, իսկ փոքր մեղուների թիվը կրկնակի է թագուհիների թվից: Քանի՞ աշխատող մեղու կա: ;400
Ջորդանը ամեն օր 2 ժամ վիդեո խաղեր է խաղում: Նա նաեւ կիսաժամկետ աշխատանք ունի, որտեղ ժամը 10 դոլար է վաստակում։ Որքա՞ն գումար կստանա Ջորդանը մեկ շաբաթում, եթե նա աշխատի իր խաղերի ժամանակի փոխարեն։ ;140
Ջոնը կաթ է գնում 2 դոլարով, ձու՝ 3 դոլարով, լամպ՝ 3 դոլարով, բաժակ՝ 3 դոլարով, եւ կոճապղծություն՝ 4 դոլարով։ Եթե բոլոր ոչ սննդամթերքի ապրանքների վրա 10% հարկ կա, ապա ինչքա՞ն արժե ամեն ինչ: ;16
Կիմը սկսել է իր սեփական տնային տնտեսության բիզնեսը եւ հաշվարկում է, թե որքան շահույթ կստանա իր հաճախորդներից: Նա արդեն ունի 3 հաճախորդ, բայց խոսում է եւս 5 պոտենցիալ հաճախորդների հետ եւ բավականին վստահ է, որ դրանք ներառի իր հաշվարկներում: Յուրաքանչյուր հաճախորդի տանը անհրաժեշտ է 2 շիշ սպիտակեցնող միջոց եւ մի տուփ թանաքներ մաքրելու համար: Բալիկները 2 դոլար արժեն, իսկ կտորները՝ 5 դոլար: Սա նրա միակ ծախսերն են: Նա հաշվարկել է, որ իր ընդհանուր եկամուտը շաբաթական 92 դոլար է լինելու։ շահույթը ընդհանուր եկամուտների եւ ծախսերի տարբերությունն է, այսինքն՝ որքան շահույթ է, դոլարով, ամեն շաբաթ կստանա Լուկասը: ;20
Ջոնը 10 հեկտար անանասի դաշտ ունի։ Յուրաքանչյուր հեկտարում 100 անանաս կա: Ջոնը կարող է իր անանասը հավաքել 3 ամիսը մեկ: Քանի՞ անանաս կարող է Ջոնը հավաքել մեկ տարվա ընթացքում։ ;4000
Ջոնին հավաքում է իր սենյակի հատակին ընկած խաղալիքները։ Նա գետնին գցել էր 500 կտորով Lego-ի տուփը, եւ մեկ ուրիշը, որը 3 անգամ ավելի շատ կտորներ ուներ, քան 500 կտորովը, եւ մեկ այլ, որը 1/4 կտորով էր: Քանի՞ բլոկ է հավաքում Ջոնին, եթե հավաքի բոլոր լեգոնները: ;2125
Դեբրան հետեւում է արջաբուծությանը, որպեսզի տեսնի, թե օրական քանի՞ մեղու է գալիս եւ գնում: Նա տեսնում է, որ առաջին 6 ժամում 30 մեղու լքում է բույնը, եւ հետո տեսնում է, որ այդ քանակի կեսը վերադառնում է հաջորդ 6 ժամում: Նա տեսնում է երկու անգամ ավելի շատ մեղուներ, քան առաջին անգամ, երբ նա տեսավ, որ թողնում են արջուկը: Նրանք թռչում են արջուկից եւ հեռանում են հաջորդ 6 ժամվա ընթացքում: Այնուհետեւ յուրաքանչյուր մեղու, որը հեռացել է դրանից առաջ եւ դեռ չի վերադարձել, վերադառնում է բջիջը հաջորդ 6 ժամվա ընթացքում: Քանի՞ մեղու է Դեբրան տեսել, որ վերադարձել է բջիջը օրվա վերջին 6 ժամում: ;75
Բրիտանին եւ նրա մայրը գնում են թանգարան: Մուտքի վճարը մեծահասակների համար 12 դոլար է, իսկ երեխաների համար' 10 դոլար: Բրիտանիայի մայրը դրամատուրին տալիս է 1 երեխայի եւ 1 մեծահասակի տոմսի համար: Եթե նա 8 դոլար է ստացել, ապա քանի՞ դոլար է տվել դրամապահին: ;30
Չարլին երեք անգամ ավելի շատ ֆեյսբուքյան ընկերներ ունի, քան Դորոտին։ Ջեյմսը 4 անգամ ավելի շատ ընկերներ ունի Ֆեյսբուքում, քան Դորոտին։ Եթե Չարլին ունի 12 ընկեր Ֆեյսբուքում, ապա քանի՞ ընկեր ունի Ջեյմսը։ ;16
Սթիվն ու Թիմը որոշում են տեսնել, թե ով է դպրոցից շուտ տուն հասնելու: Սթիվը ապրում է Թիմից ավելի հեռու, ուստի նրան թույլատրվում է հեծանիվ վարել: Սթիվը ապրում է դպրոցից 3 մղոն հեռավորության վրա եւ կարող է հեծանիվ վարել րոպեում 440 ոտնաչափ արագությամբ: Թիմը ապրում է դպրոցից 2 մղոն հեռավորության վրա։ Եթե Թիմը կարող է սկանդալել իր սկանդալաձեւ հեծանիվով րոպեում 264 ոտնաչափ արագությամբ, ապա որքան ժամանակ հաղթողը կսպասի իր տանը, մինչեւ պարտվածը կավարտի մրցավազքը: ;4
Շոնդան որոշում է, որ իր հարեւանության երեխաները կարող են օգտվել հեծանիվների գնաճից: Նա որոշում է, որ լավագույն միջոցը լարվածության համար լարվածության մեջ է: Յուրաքանչյուր անվադող փչելու համար ծախսվում է 25 սենտ: Առաջին օրը, 5 մարդ հեծանիվներով մոտեցավ, որպեսզի երկու անվադողերը լցնեն: Երեք մարդ եկավ, որպեսզի իրենց երեքշաբթի հեծանիվների անվադողերը լցնեն: Վերջապես, մեկը մոտեցավ միանվագ հեծանիվով: Քանի՞ դոլար է նա վաստակել այդ օրը: ;5
Կարլը տասը փաթեթ թխվածքաբլիթ է գնում: Յուրաքանչյուր փաթեթ բլիթներ ունի վեց բլիթներ ներսում: Յուրաքանչյուր թխվածքաբլիթ արժե 0.10 դոլար: Որքա՞ն է փոխանցվում Կարլին, եթե նա վճարում է 10 դոլարի թղթադրամով: ;4
Դեյվը գնել է մեծ փաթեթ կարտոֆիլ եւ կերել է 14-ը, մինչեւ որ սոված ծովախեցգետինը գողացել է փաթեթը նրա ձեռքից: Երբ ծովախեցգետինն իջավ, նա կուլ տվեց Դեյվի ուտում ֆրանսիական կարտոֆիլի կեսը: Այնուհետեւ երեք աղավնիները նրան հեռացրին ուտելիքից, եւ յուրաքանչյուր աղավնին կերավ երեք կարտոֆիլ: Հետագայում, ռակունը գողացավ մնացած կարտոֆիլի երկու երրորդը: Մրջյունները վերցրել են վերջին ֆրանսիական կարտոֆիլը, թողնելով 5 հատ: Քանի՞ կարտոֆիլ էր տուփում, երբ Դեյվը գնել էր այն: ;48
Երկուշաբթի, չորեքշաբթի եւ ուրբաթ օրերին քոլեջի ուսանող Կիմոն ունի օրական երեք 1-ժամյա դաս: Երեքշաբթի եւ հինգշաբթի օրերին նա երկու անգամ երկու ժամանոց դասեր է անցկացնում: Մեկ կիսամյակում դպրոցը 16 շաբաթ տեւում է: Մեկ կիսամյակում, քանի՞ ժամ է Կիմոն անցկացնում դասերին մասնակցելով: ;272
Բիլը ամեն օր 300 տորթ է հանում, 120 շոկոլադե կրոուսան եւ 60 բագետ: Յուրաքանչյուր գլուխը 4 դյույմ երկարություն ունի, յուրաքանչյուր կրոսսանը 6 դյույմ երկարություն ունի, եւ յուրաքանչյուր բագետը երկու ոտնաչափ երկարություն ունի: Եթե Բիլը բոլոր հացերը միացնի, քանի՞ րոպե կպահանջվի, որ դրանք ոտքերի մեջ լինեն: ;280
Կենդանաբանական այգու պահապանը կերակրում է կենդանաբանական այգու բոլոր կապիկներին: Նա երկու ամիսը մեկ տեղական ֆերմայից պատվիրում է բոլոր բանանները: Եթե կապիկներին անհրաժեշտ է 200 բանան, գորիլաներին՝ 400 բանան, եւ բապունիներին՝ 100 բանան ամսական, ապա քանի՞ բանան է անհրաժեշտ պատվիրել, որպեսզի այն բավարարի 2 ամսվա ընթացքում: ;1400
Բլեյքը եւ Քելլին մրցույթ են կազմակերպում, թե ով կարող է ամենաշատը վազել 15 րոպեում: Նրանք որոշում են դա անել ֆուտբոլային խաղադաշտում, որը 100 գարնան է: Բլեյքը 15 անգամ առաջ ու ետ է վազում: Քելլին առաջ ու ետ է վազում, հետո որոշում է, որ չի ուզում վազել Բլեյքի կողքին, ուստի սկսում է վազել դեպի 40 գնդի գիծը եւ ետ: Նա անում է դա 34 անգամ: Որքա՞ն հեռու է հաղթողը վազում, քան պարտվողը: ;80
Ռաֆայելը գնացել է դպրոցական պարագաներ գնելու: Նա գնել է 4 գրիչներ, որոնցից յուրաքանչյուրը արժե 1.5 դոլար, 2 գրքույկներ, որոնցից յուրաքանչյուրը արժե 4 դոլար, եւ մի շերտ թուղթ, որը արժե 20 դոլար: Որքա՞ն գումար է Ռաֆայելը ծախսել ամեն ինչի վրա: ;34
Ֆիննը դիտում է 11 գորգեր, որոնք լողում են լճում: Հանկարծ նա տեսնում է, որ վեց հոգի դուրս են գալիս թաքնվածությունից, հետո տեսնում է, որ երկուսը թաքնվում են քարերի տակ: Քանի՞ գորգ է Ֆինն տեսնում լճում: ;15
Երկուշաբթի օրը ջրի տանկը 17 ոտնաչափ խորություն ունի: Երեքշաբթի օրը, ջրամբարը 7 ոտնաչափ ավելի շատ ջուր ուներ: Չորեքշաբթի օրը ջրի խորությունը երեքշաբթի օրվա խորության երկու երրորդն է: Ինչ է ջրի խորությունը tank է չորեքշաբթի? ;16
Անակինը եւ Լոքսինը այսօր գնացին լողափ: Անակինը բռնել է 10 ծովաստղ, 6 ծովային ձի եւ 3 կլոունֆիշ: Լոքսինը 5 ծովաստղ է ավելի քիչ որսացել, քան Անակինը, 3 ծովային ձի է ավելի քիչ, քան Անակինը, եւ 2 կլոունֆիշ է ավելի շատ, քան Անակինը: Քանի՞ ձուկ էին նրանք կարողացել բռնել։ ;32
Եթե մարգարտի տոպրակը 20 դոլար արժե եւ ամեն երկու ամիսը մեկ այն 20 տոկոսով է աճում, ապա 36 ամսից հետո ինչքա՞ն կկազմի դրա արժեքը: ;92
Մի սենյակում կան տարբեր խաղալիքներ. 5 կարմիր մեքենա, 3 դիմանկարներ եւ տիկնիկ: Այս տիկնիկը արժե 3 դիմանկար եւ մեկ կարմիր մեքենան արժե 4 դոլար: Որքա՞ն արժեն բոլոր խաղալիքները, եթե գործողության համար նախատեսված կադրերը 5 դոլար արժեն: ;50
Ջեքին փորձում է որոշել, թե ինքն է հարկերը վճարելու, թե հաշվապահ է վարձելու: Եթե նա ինքն է հարկերը վճարում, նա կկարողանա 3 ժամ ավելի քիչ ազատ աշխատել, կորցնելով 35 դոլար/ժամը եկամուտների կորստի պատճառով: Հաշվապահը 90 դոլար է պահանջում: Որքա՞ն գումար կունենա նա, եթե վարձի հաշվապահին: ;15
Էլվիրան իր 30 ամյակի համար նվեր ստացավ նոր համակարգիչ՝ բազմաթիվ պարագաներով։ Նա ունի 1500 եվրո բյուջե, որը նվիրաբերել է իր ամբողջ ընտանիքը եւ կարծում է, որ նա կկարողանա մի փոքր գումար պահել, որպեսզի կարողանա հագուստ գնել: Նա գնում է համակարգչային խանութ եւ ընտրում է մի սարք, որը արժե 1090 եվրո, ունի էկրան, ստեղնաշար եւ մկնիկ: Նա նաեւ վերցնում է սկաներ 157 եվրոյով, CD այրիչ 74 եվրոյով եւ տպիչ 102 եվրոյով: Որքա՞ն գումար է մնացել նրա հագուստի համար։ ;77
Սանդրայի հարեւանը նրան տալիս է 9 ձու պարունակող զամբյուղ, ամեն անգամ, երբ նա խնամում է իրենց աղջկան: Իսպանական ֆլան պատրաստելու համար նրան 3 ձու է պետք: Եթե Սանդրան հանձնարարվել է պատրաստել 15 իսպանական սալիկներ իր դպրոցի նվիրատվության համար, քանի՞ անգամ է Սանդրան ստիպված պահել երեխային: ;5
Սեթը երկու անգամ ավելի մեծ է, քան Բրուքը: Երկու տարուց նրանց տարիքների գումարը կլինի 28։ Որքա՞ն տարեկան է Սեթը: ;16
Ջիմին ունի 2 դոլար, որը երկու անգամ ավելի շատ է, քան Էթելը: Եթե Էթալը 8 դոլար ունի, ապա որքան գումար ունի Ջիմին: ;18
Պանչոն օրական 20 մղոն է քայլում: Բացի հանգստյան օրերից, երբ նա քայլում է 10 մղոն: Քանի՞ մղոն է նա քայլում շաբաթական: ;120
Մարշային խմբի անդամները նոր համազգեստներ են պատվիրում: Յուրաքանչյուր համազգեստի հետ միասին կա մի գլխարկ, որը 25 դոլար արժե, մի բաճկոն, որը երեք անգամ ավելի թանկ է, քան գլխարկը, եւ շորեր, որոնք արժեն գլխարկի եւ բաճկոնի միջին արժեքը: Որքա՞ն է արժե յուրաքանչյուր համազգեստը: ;150
Ջեյքը քայլում է միջատաբանության թանգարանում: Նա տեսնում է 80 արծիվ, որոնցից յուրաքանչյուրը ունի 8 ոտք, 90 միջատ՝ յուրաքանչյուրը 6 ոտք, եւ 3 հազվագյուտ անմեղքաբորբ կենդանիներ՝ յուրաքանչյուրը 10 ոտք: Ջեյքը ընդհանուր քանի՞ ոտք է տեսնում: ;1210
Կաբոուզում չորս թռչուն կա: Սալլի Երկրորդը երեք տարով մեծ է տատիկ Կարմիրից: Կարմիր տատիկը երկու անգամ ավելի մեծ է, քան Սալլի Չորսը: Եթե Սալլի 4-ը նույն տարիքի է, ինչ Սալլի 32-ը, եւ Սալլի 32-ը 8 տարեկան է, ապա ինչպիսի՞ն է չորս թռչունների ընդհանուր տարիքը: ;51
Ջեսիկա փորձում է որոշել, թե որքան գումար է պետք վճարել իր բոլոր պարտքերի համար ամեն ամիս։ Նրա ուսանողական վարկերի նվազագույն վճարումը ամսական 300 դոլար է, նրա վարկային քարտի նվազագույնը ամսական 200 դոլար է, եւ նրա հիփոթեքային վարկի նվազագույնը ամսական 500 դոլար է: Եթե Ջեսիկան ցանկանում է վճարել նվազագույնից 50%-ով ավելի, ապա որքան է նա վճարում մեկ տարում: ;18000
