question;answer_number
Dok je bio u trgovini, Sloane je brojao 100 kupaca koji su ušli u trgovinu. Sljedećeg dana, broji 50 kupaca više nego prvog dana. Ako je ukupan broj kupaca do trećeg dana bio 500, koliko je kupaca brojala trećeg dana? ;250
Jerry ima dva bazena, s curenjem koji ih isprazni sa 4 galona u minuti. Prije 4 minute, veliki bazen je imao dvostruko više vode od malog bazena. Sada veliki bazen ima četiri puta više vode od malog bazena. Koliko vode ima mali bazen sada? ;8
Lori želi kupiti cipele od 320 dolara i odgovarajući pojas koji košta 32,00 dolara. Na njenom dijelu posla zarađuje 8 dolara na sat. Koliko sati mora raditi prije nego što može kupiti? ;44
Janeth je posudila 2000 dolara i obećala da će ih vratiti sa dodatnih 10% od iznosa. Ako će plaćati 165 dolara mjesečno 12 mjeseci, koliko će do tada biti Janethin preostali iznos? ;220
U vazi su četiri ruže. U vazi je 7 dahlija više nego ruža. Koliko cveća ima u cvećari u cvjeti? ;15
Adrian je tri puta stariji od Harriet, a Harriet je upola starija od Zacka. Izračunaj prosječnu dob od tri u tri godine ako je Harriet sada 21 godina. ;45
Četiri učenika su u igri na ploči ukupno postigla 251 bod. Naomi je dobila 68 bodova. Yuri je postigao 10 više od polovine koliko Naomi i Brianna je postigla 17 bodova više od Naomi. Koliko je Jojo postigao bodova? ;54
Carmen treba 10 minuta da završi križaljku i 5 minuta da završi sudoku. Tokom vikenda je riješila 3 križaljke i 8 sudoku zagonetki. Koliko je vremena provela igrajući te igre? ;70
Zaliva za vodu je puna 120 litara vode. Celine je koristila 90 litara vode iz rezervoara za zalivanje svog malog vrta. Tada je mogla sakupiti duplo više kišne vode nego što je preostalo. Koliko litre vode ima u spremniku? ;90
Andy sadi 90 geranija i 40 petunija manje od geranija. Koliko cvijeća je on posadio ukupno? ;140
Tvrtka troši 15.000 dolara na oglašavanje za godinu dana, a onda troši trećinu tog iznosa na oglašavanje za sljedeću godinu. Koliko je ukupno tvrtka potrošila na oglašavanje u dvije godine? ;20000
Carlos i Benji su na plaži. Carlos iznajmljuje kanu za 30 dolara na sat, a Benji iznajmljuje splav za 18 dolara na sat. Ako Carlos koristi čamac 3 sata, a Benji koristi splav 5 sati, koliko će oni platiti za svoje stanarine, ukupno? ;180
Andrew planira putovanje iz New Jerseya u Rochester. Treba 6 dana da se putuje autobusom i pola toliko dana da se putuje autom iz New Jerseya do Rochester. Koliko dana će putovati ako planira ići u Rochester autobusom i vratiti se iz Rochestera autom? ;9
James broji svoje Pokemon karte. Ima 30 vatrenog tipa, 20 trave tipa, i 40 vodeni tip. Ako izgubi 8 od vodene vrste i kupi 14 od trave, koja je procenat šanse (zaokružena na najbliži cijeli broj) da će nasumično odabrana karta biti vodena vrsta? ;33
Chad je naručio burrito za ručak. Osnovni burrito je 6,50 dolara. Dodaje ekstra meso za 2 dolara, ekstra sir za 1 dolar, avokado za 1 dolar i 2 umaka za 0,25 dolara svaki. Odlučio je da poboljša svoj obrok za dodatnih 3 dolara, što će dodati čips i piće. Ima poklon karticu za $5.00 koju koristi pri izlasku. Koliko još duguje? ;9
Kalinda radi na 360 komada slagalice s majkom. Kalinda može normalno dodati 4 komada u minuti. Njezina mama obično može postaviti pola toliko komada u minuti kao Kalinda. Koliko sati će im trebati da završe ovu slagalicu? ;1
Na jednoj farmi je bilo 120 male lubenice. Ashlyn je otišla na farmu nakon dva mjeseca i otkrila da je 30% lubenica spremno za žetvu, pa ih je odnijela kući. Kad se vratila dva tjedna kasnije, 3/4 preostalih lubenica bilo je spremno, pa ih je sakupila. Koliko dinje nije bilo spremno za žetvu nakon dva tjedna? ;21
Mark kupuje flotu od 12 automobila za svoju tvrtku. Svaki auto se prodaje za 20.000 $. Plaća 10% poreza na automobile i još 1000 dolara za registraciju svakog od njih. Koliko plaća za sve? ;276000
Kylie i Robert vole ići na plažu skupljati školjke. U ponedjeljak, Kylie skuplja 5 školjki više od Roberta, koji skuplja 20 školjki. U utorak, Kylie skuplja 2 puta više školjki nego što je to učinila u ponedjeljak. Koliko oklopnih čestica Kylie skuplja u utorak? ;50
Dax je otišao na njihovu farmu da pokupi jabuke i našao je pola više kukaca nego mrava u vrtu. Ako je bilo 50 mrava, izračunajte ukupan broj insekata u vrtu. ;75
36 pingvina sunča se na snijegu. Jedna trećina njih skoči u vodu i pliva u oceanu. Još jedna trećina ulazi u pećinu da bi jela večeru. Koliko je pingvina ostalo da se sunča? ;12
Steve odlučuje početi jesti više rajčica i odlučuje uzgajati svoje trešnje rajčice. On jede dvostruko više od svoje djevojke. On jede 6 dnevno. Ako jedna loza može da proizvede tri rajčica tjedno koliko loza mu treba? ;21
John naručuje pizzu da podijeli s prijateljima. Ima ukupno 20 prijatelja, a John želi biti siguran da svaki može dobiti 4 komada. Pice se prodaju samo narezane na 8 porcija. Koliko pica John treba naručiti? ;10
Ram koristi puno olovaka. Otkrio je da može uštedjeti novac tako što će pomiješati tintu iz pet praznih olovaka i napraviti jednu punu olovku. Ako kupi 25 olovaka i onda ih koristi da napravi nove olovke kad mu ponestane tinte, koliko će ukupno olovaka imati? ;31
Johnny je uzeo svoj džeparac od 20 dolara i dodao dodatnih 10 dolara. Zatim je uložio tu sumu novca, koja se utrostručila za godinu dana. Koliko je novca imao nakon godinu dana? ;90
Mary je dvije godine mlađa od Joan, koja je pet godina starija od Jesse. Ako Jessa ima 20 godina, koliko je ukupna starost tri djevojke? ;68
Broj učenika u školi je bio 1000. Dvorana je imala 3 ulaza A, B i C koji su također služili kao izlazi. Ako je nakon sastanka 30% učenika izašlo iz zgrade izlazom A, 3/5 preostalih izašlo izlazom B, a ostatak izašao izlazom C, izračunati broj učenika koji su izašli iz izlaz C. ;280
James ima 6 slatkiša više od Roberta. John ima dvostruko više bombona od Roberta. Ako John ima 54 slatkiša, koliko više slatkiša John ima od Jamesa? ;21
Dolly ima dvije knjige. Pandora ima jedan. Ako i Dolly i Pandora čitaju knjige jedni drugima, kao i svoje, koliko će knjiga zajedno pročitati do kraja? ;6
Mike je bio prijatelj pismom s pet ljudi. Prestao je pisati s dvojicom njih. Svaki šalje dva pisma tjedno, 5 stranica. On odgovara na isti način. Može napisati stranicu svakih 6 minuta. Koliko sati tjedno piše? ;3
Jason ima telefon plan od 1000 minuta mjesečno. Svaki dan ima 15-minutni poziv sa svojim šefom, a imao je 300 dodatnih minuta poziva ovog mjeseca drugim ljudima. Koliko minuta ima Jason ako ovaj mjesec ima 30 dana? ;250
Griffin je imao 24 pomfritova, ali Kyle je uzeo pet. Billy je uzeo dvostruko više od Kylea. Ginger je dala Griffin hrpu njezina krumpirića, a onda Colby je od Griffin 3 manje od broja krumpirića da je Kyle uzeo. Ako je na kraju Griffin imao 27 krumpirića, koliko ih je Ginger dala Griffin? ;20
U jednom akvariju ima 4 puževa, a u drugom 32. Razlika između broja puževa u dva akvarija je dvostruko veća od količine riba u oba akvarija. Ako su u oba akvarija isti broj riba, koliko ih je u svakom? ;7
Jeansova šminkerka naplaćuje joj 250 dolara na sat. Ona zahtijeva vrlo skupu šminku za film u kojem glumi i treba joj 6 sati da to uradi svaki dan i treba joj da to uradi 4 puta tjedno. Film traje 5 tjedana. Nakon što je film završen, šminker daje Jean 10% popusta zbog količine posla. Koliko je Jean platila? ;27000
Isabelle je kupila zalihe za rođendan svoje sestre. Potrošila je 12 dolara na sastojke za tortu, 43 dolara na rođendanske poklone, 15 dolara na ukrase, 4 dolara na pozivnice i 22 dolara na torbe za goste. Podijelila je trošak na tri jednako s oba roditelja. Koliko je platio svaki? ;32
Kuvar je kupio 4 vreće luka. Svaka vreća teži 50 funti. Kilogram luka košta 1,50 dolara. Koliko je kuhar potrošio? ;300
U ponedjeljak je Su jela 4 puta više kolača od sestre. U utorak je jela dvostruko više kolača od sestre. Njena sestra je u ponedjeljak jela pet kolača, a sljedećeg dana 13. Ako jedan kolačić ima 200 kalorija, koliko je Sue više kalorija potrošila od svoje sestre? ;5600
