question;answer_number
Josie kweekt druiven op haar boerderij van 10 hectare. Elke hectare produceert 5 ton druiven per jaar, en elke ton druiven maakt 2 vaten wijn. Hoeveel vaten wijn produceert haar boerderij per jaar? ;100
Carl's lievelingseten is kaas. Hij at deze week elke dag een broodje voor de lunch en gebruikte 2 plakjes kaas op elke broodje. Hij at kaas- en ei-omeletten voor het ontbijt drie dagen per week... met één stuk meer per omelet dan per broodje. Hij maakte een groot bord macaroni met kaas, genoeg voor meerdere maaltijden in de week, en gebruikte er acht plakken kaas in. Hoeveel stukjes kaas heeft hij gebruikt? ;31
Janet had 22 groene pennen en 10 gele pennen. Toen kocht ze 6 zakken blauwe pennen en 2 zakken rode pennen. Er waren 9 pennen in elke zak blauw en 6 pennen in elke zak rood. Hoeveel pennen heeft Janet nu? ;98
Brinley zit in Mr. Bert's wiskundeles. Mr Bert geeft zes tests per semester. Hij laat de studenten de laagste score van het gemiddelde aftrekken elk semester. Als Brinley een score van 89, 71, 92, 100 en 86 heeft op de eerste vijf tests, welke score heeft ze nodig op de zesde test om een gemiddelde van 93 te krijgen? ;98
Michael houdt van fietsen. Hij reed er minstens vijf keer per week op en maakte elke keer 25 kilometer. Hij deed dat vier weken lang, en toen besloot hij, om slechts twee keer per week op de fiets te rijden, maar voor 60 kilometer elke keer, en dat deed hij drie weken lang. Hoeveel kilometer heeft Michael in totaal gereden? ;860
Joe's zak met Halloween snoep heeft 25 chocoladerepen en 80 geconfectioneerde appels. Elke chocoladereep weegt twee keer zoveel als elke gezoete appel. Als elke chocoladereep 40 gram weegt, hoeveel weegt Joe's zak snoep dan, in gram? ;2600
Rose ging maandag naar de winkel en kocht vier taarten. Dinsdag ging ze naar een andere winkel en kocht drie keer zoveel gebak. Op woensdag ging ze naar een andere winkel en kocht 5 keer zoveel gebak als op dinsdag. Hoeveel koekjes heeft ze na drie dagen gekocht? ;76
Twintig dozijn kopjes kosten $1200 minder dan de totale kosten van een half dozijn borden die elk $6000 kosten. Bereken de totale kosten van de aankoop van elke beker. ;145
Sara wil een nieuw jasje en twee paar schoenen kopen. Het jasje kost 30 dollar en de schoenen 20 dollar. Sara babysit de kinderen van de buren vier keer, en verdient $5 voor elke keer dat ze op ze past. Haar ouders betalen haar $4 voor elke keer dat ze het gras maagt. Als Sara al tien dollar had gespaard voor ze begon met babysitten, hoe vaak moet ze dan het gras maaien voor ze het jasje en de schoenen kan betalen? ;10
Jerry heeft een kudde kippen. De rode kippen produceren 3 eieren per dag en de witte kippen produceren 5 eieren per dag. Elke dag verzamelt Jerry 42 eieren. Als hij twee meer witte kippen heeft dan rode kippen, hoeveel rode kippen heeft hij dan? ;4
Gary wandelt graag rond de rand van het plaatselijke park, een rechthoek die 1,5 bij 6 mijl is. Als hij loopt met 5 km/uur, hoeveel uur loopt hij dan? ;5
Sloane telt 100 klanten die de winkel binnenkomen. De volgende dag telt ze 50 klanten meer dan de eerste dag. Als het totale aantal klanten op de derde dag 500 was, hoeveel klanten had ze dan op de derde dag? ;250
Jerry heeft twee zwembaden, beide met lekkages die ze leegmaken met 4 gallons per minuut. Vier minuten geleden had het grote zwembad twee keer zoveel water als het kleine. Nu heeft het grote zwembad vier keer zoveel water als het kleine zwembad. Hoeveel water heeft het kleine zwembad nu? ;8
Lori wil een paar schoenen van $320 kopen en een bijpassende riem die $32.00 kost. Haar deeltijdbaan betaalt haar $8 per uur. Hoeveel uren moet ze werken voor ze haar aankoop kan doen? ;44
Janeth leende 2000 dollar en beloofde het terug te betalen met nog eens 10% van het bedrag. Als zij gedurende 12 maanden 165 dollar per maand gaat betalen, hoeveel zal Janeth dan nog over hebben? ;220
Er zitten vier rozen in de vaas. Er zitten 7 meer dahlia's dan rozen in de vaas. Hoeveel bloemen zijn er in totaal in de vaas? ;15
Adrian is drie keer zo oud als Harriet, en Harriet is de helft zo oud als Zack. Bereken de gemiddelde leeftijd van de drie over drie jaar als Harriet nu 21 is. ;45
Vier studenten scoorden in totaal 251 punten in een bordspel. Naomi scoorde 68 punten. Yuri scoorde 10 punten meer dan de helft van Naomi en Brianna scoorde 17 punten meer dan Naomi. Hoeveel punten scoorde Jojo? ;54
Carmen heeft tien minuten nodig om een kruiswoordpuzzel te maken en vijf minuten om een sudoku puzzel te maken. In het weekend heeft ze drie kruiswoordpuzzels en acht sudoku puzzels opgelost. Hoeveel tijd besteedde ze aan deze spelletjes? ;70
Een waterreservoir is gevuld met 120 liter water. Celine gebruikte 90 liter water uit de tank om haar kleine tuin te bewateren. Ze was toen in staat om twee keer zoveel regenwater op te vangen als wat er over was. Hoeveel liter water zit er nu in de tank? ;90
Andy plant 90 geraniums en 40 minder petunias dan geraniums. Hoeveel bloemen plant hij in totaal? ;140
Een bedrijf besteedt 15.000 dollar aan reclame voor een jaar, en dan besteedt een derde van dat bedrag aan reclame voor een volgend jaar. Wat is het totale bedrag dat het bedrijf besteedde aan reclame voor de twee jaar? ;20000
Carlos en Benji zijn op het strand. Carlos huurt een kano voor $30 per uur en Benji huurt een bananenboot voor $18 per uur. Als Carlos de boot 3 uur gebruikt en Benji de vlot 5 uur, hoeveel betalen ze dan voor hun huur? ;180
Andrew is van plan een road trip te maken van New Jersey naar Rochester. Het duurt zes dagen om met de bus te reizen en half zoveel dagen om met de auto van New Jersey naar Rochester te reizen. Hoeveel dagen zal hij reizen als hij van plan is om naar Rochester te gaan met de bus en terug te keren van Rochester met de auto? ;9
James telt zijn Pokémon kaarten. Hij heeft 30 vuur type, 20 gras type, en 40 water type. Als hij 8 van het watertype verliest en 14 van het grastype koopt, wat is de kans (afgerond op het dichtstbijzijnde gehele getal) dat een willekeurig gekozen kaart een watertype is? ;33
Chad bestelde een 'bouw-je-eigen-burrito' voor de lunch. De burrito kost $6.50. Hij voegt extra vlees toe voor $2, extra kaas voor $1, avocado voor $1, en 2 sauzen voor $0,25 per stuk. Hij besluit zijn maaltijd te verbeteren voor een extra $3.00 waarmee hij chips en een drankje toevoegt. Hij heeft een cadeaukaart van $5,00 die hij gebruikt bij het uitchecken. Hoeveel is hij nog schuldig? ;9
Kalinda werkt aan een puzzel met 360 stukken met haar moeder. Kalinda kan normaal 4 stukken per minuut toevoegen. Haar moeder kan meestal de helft zoveel stukken per minuut plaatsen als Kalinda. Hoeveel uur zullen ze nodig hebben om deze puzzel te voltooien? ;1
Een watermeloenboerderij bracht 120 babywatermeloenen voort. Ashlyn ging na twee maanden naar de boerderij en ontdekte dat 30% van de watermeloenen klaar was voor de oogst, dus nam ze ze mee naar huis. Toen ze twee weken later terugkwam, waren driekwart van de overgebleven meloenen klaar, dus oogstte ze ze. Hoeveel meloenen waren er na twee weken nog niet klaar om geoogst te worden? ;21
Mark koopt een vloot van 12 auto's voor zijn bedrijf. Elke auto verkoopt voor 20.000 dollar. Hij betaalt 10% belasting op de auto's en nog eens 1000 dollar voor de registratie van elk van hen. Hoeveel betaalt hij voor alles? ;276000
Kylie en Robert gaan graag naar het strand om schelpen te verzamelen. Op maandag verzamelt Kylie 5 meer kogels dan Robert, die 20 verzamelt. Op dinsdag verzamelt Kylie twee keer zoveel kogels als op maandag. Hoeveel kogels verzamelt Kylie op dinsdag? ;50
Dax ging naar hun boerderij om wat appels te plukken en vond de helft zoveel insecten als mieren in de tuin. Als er 50 mieren waren, bereken dan het totale aantal insecten in de tuin. ;75
Er zijn 36 pinguïns die in de sneeuw zonnebaden. Een derde van hen springt in en zwemt in de oceaan. Een derde gaat de grot in om te eten. Hoeveel pinguïns zijn er nog over om te zonnebaden? ;12
Steve besluit om meer tomaten te gaan eten en besluit om zijn eigen cherry tomaten te kweken. Hij eet twee keer zoveel als zijn vriendin. Hij eet er zes per dag. Als een wijnstok 3 tomaten per week kan produceren, hoeveel wijnstokken heeft hij dan nodig? ;21
John bestelt wat pizza's om met zijn vrienden te delen. Er zijn in totaal 20 vrienden en John wil ervoor zorgen dat iedereen 4 plakjes kan krijgen. Pizza's worden alleen verkocht in 8 porties gesneden. Hoeveel pizza's moet John bestellen? ;10
Ram gebruikt veel pennen. Hij ontdekte dat hij geld kon besparen door de inkt van vijf lege pennen te mengen tot één volle pen. Als hij 25 pennen koopt en ze vervolgens gebruikt om nieuwe pennen te maken als de inkt op is, hoeveel pennen krijgt hij dan in totaal? ;31
Johnny nam zijn zakgeld van $20 en voegde er nog eens $10 aan toe. Hij investeerde dit bedrag, dat in een jaar drie keer zo groot was geworden. Hoeveel geld had hij na een jaar? ;90
Mary is twee jaar jonger dan Joan, die vijf jaar ouder is dan Jessa. Als Jessa 20 jaar oud is, wat is dan de som van de leeftijden van de drie meisjes? ;68
Het aantal leerlingen in een schoolzaal was 1000. De hal had 3 ingangen A, B en C die ook als uitgangen dienden. Als na een vergadering 30% van de studenten het gebouw via uitgang A verlaten heeft, 3/5 van de resterende via uitgang B en de rest via uitgang C, bereken dan het aantal studenten dat via uitgang C is uitgegaan. ;280
James heeft zes snoepjes meer dan Robert. John heeft twee keer zoveel snoep als Robert. Als John 54 snoepjes heeft, hoeveel snoepjes heeft John dan James? ;21
Dolly heeft twee boeken. Pandora heeft er een. Als Dolly en Pandora elkaars boeken lezen, en ook hun eigen boeken, hoeveel boeken zullen ze dan samen hebben gelezen? ;6
Mike had vijf penvrienden. Hij was geen briefvriend meer met twee van hen. Ze sturen elk twee brieven per week die vijf pagina's lang zijn. Hij reageert op dezelfde manier. Hij kan elke zes minuten een bladzijde schrijven. Hoeveel uur per week schrijft hij? ;3
Jason heeft een telefoonplan van 1000 minuten per maand. Elke dag heeft hij 15 minuten met zijn baas en hij heeft deze maand 300 extra minuten gehad met andere mensen. Hoeveel minuten heeft Jason nog over als deze maand 30 dagen heeft? ;250
Griffin had 24 frietjes, maar Kyle nam er vijf. Billy nam twee keer zoveel als Kyle. Ginger gaf Griffin een handvol van haar frietjes, en toen nam Colby van Griffin 3 minder dan het aantal frietjes dat Kyle had genomen. Als Griffin uiteindelijk 27 frietjes had, hoeveel frietjes gaf Ginger Griffin dan? ;20
Er zijn 4 slakken in één aquarium en 32 slakken in een ander aquarium. Het verschil tussen het aantal slakken in de twee aquaria is twee keer zo groot als het aantal vissen in beide aquaria. Als beide aquaria hetzelfde aantal vissen bevatten, hoeveel vissen zijn er dan in elk aquarium? ;7
Jeans make-up artist rekent haar 250 dollar per uur. Ze heeft heel dure make-up nodig voor een film waar ze in speelt en het duurt 6 uur om het te doen elke dag en ze moet het 4 keer per week doen. De film duurt vijf weken. Na afloop van de film geeft de make-up artist Jean 10% korting vanwege de hoeveelheid werk die is gedaan. Hoeveel heeft Jean betaald? ;27000
Isabelle kocht feestartikelen voor het verjaardagsfeestje van haar zusje. Ze gaf $12 uit aan ingrediënten voor de taart, $43 aan verjaardagscadeaus, $15 aan decoraties, $4 aan uitnodigingen en $22 aan goodies voor de feestgasten. Ze deelde de kosten gelijkmatig met haar beide ouders. Hoeveel dollar heeft elke persoon betaald? ;32
Een chef kocht 4 zakken uien. Elke zak weegt 50 pond. Een pond uien kost $1,50. Hoeveel heeft de chef-kok uitgegeven? ;300
Op maandag at Sue vier keer zoveel koekjes als haar zus. Op dinsdag at ze twee keer zoveel koekjes als haar zus. Haar zuster at 5 koekjes op maandag en 13 de volgende dag. Als 1 koekje 200 calorieën bevat, hoeveel calorieën heeft Sue dan meer verbruikt dan haar zus? ;5600
