question;answer_number
Մորգերի թփը պարունակում է 6 կլաստեր, որոնցից յուրաքանչյուրը պարունակում է 20 հատ մրգ եւ 67 հատ մրգ, որոնք ցրված են թփի վրա: Քանի՞ մրգ կա ընդհանուր առմամբ: ;187
Մեկ զամբյուղում կա 25 նարնջ, որոնցից 1-ը վատն է, 20%-ը չծաղկած, 2-ը թթվասեր, իսկ մնացածը լավն է: Քանի՞ նարնջ է լավը: ;17
Ջանեթը իր դստեր համար կոշիկ է գնում: Նա 500 դոլար է վճարում այն պատրաստելու համար անհրաժեշտ նյութի համար, իսկ հետո եւս 800 դոլար՝ այն կառուցելու համար ոսկերչին: Դրանից հետո նա վճարում է դրա 10%-ը ապահովագրության համար: Որքա՞ն է նա վճարել: ;1430
Եթե Մարսին աշխատում է նույն ընկերությունում 40 տարի, նա տարեկան ստանում է 50,000 դոլար կենսաթոշակ: 20 տարուց սկսած, նա տարեկան ստանում է կենսաթոշակի արժեքի 5%-ը: Եթե նա հրաժարվի 30 տարի աշխատելուց հետո, ինչպիսի՞ն կլինի նրա տարեկան կենսաթոշակը: ;25000
Ալինան բաժանորդագրվել է մի հոսքային ծառայության, որը նրան ամսական 140 դոլար է գանձում: Եթե հոսքային ծառայության մատուցող ընկերությունը վճարել է նրան տարվա առաջին կեսի համար նախատեսված սկզբնական գումարը, իսկ տարվա երկրորդ կեսին վճարել է 10%-ով պակաս գումար, ապա հաշվարկեք այն ընդհանուր գումարը, որը նա վճարել է հոսքային ծառայության համար մինչեւ տարվա վերջ: ;1596
Սոֆիան մտածում է, թե իր մեքենայով ինչ-որ տեղ ճանապարհորդելու մասին։ Նա ուզում է իմանալ, թե որքան հեռու կարող է գնալ մեկ բենզինով։ Նա անցել է 160 կմ, քանի որ վերջին անգամ լցրել է իր բենզին, եւ նա պետք է 4 գալոն գազ լցնի, որպեսզի այն լցնի նորից: Նրա մեքենայի վարորդական ձեռնարկում ասվում է, որ նրա բենզին պահում է 12 գալոն բենզին: Որքա՞ն կիլոմետր կարող է Սոֆիան վառելիքի մեկ տանկով անցնել: ;300
Ջիմը 2 ժամ է անցկացնում հեռուստացույց դիտելով, հետո որոշում է քնել եւ կես ժամ էլ կարդալ: Նա դա անում է շաբաթական 3 անգամ: Քանի՞ ժամ է նա անցկացնում 4 շաբաթվա ընթացքում հեռուստացույց դիտելով եւ ընթերցելով: ;36
Չորս դպրոցներ մրցում են բասկետբոլի մրցաշարում: Յուրաքանչյուր դպրոց ուղարկել է աղջիկների եւ տղաների բասկետբոլային թիմեր: Յուրաքանչյուր թիմ ունի 5 խաղացող: Յուրաքանչյուր դպրոց նաեւ մարզիչ է ուղարկել յուրաքանչյուր թիմի համար: Ընդհանուր առմամբ, քանի՞ մարդ է ուղարկվել բոլոր դպրոցներից: ;48
Գանձերի որոնողը գտավ թաղված գանձարան, որը լի էր թանկարժեք քարերով: Դրանցից 175 -ը ադամանդներ էին, իսկ ռուբինները՝ ադամանդներից 35 -ով պակաս, իսկ սմրաղդերը՝ ռուբիններից երկու անգամ ավելի շատ։ Քանի՞ քարը կար կրծքավանդակի մեջ: ;595
Դոկտոր Վերտցի դպրոցում երկու անգամ ավելի շատ տղաներ կան, քան աղջիկներ: Եթե յուրաքանչյուր ուսուցչի համար կա 60 աղջիկ եւ 5 աշակերտ, ապա քանի՞ ուսուցիչ կա: ;36
Բեյլին սկսում է որոշակի գումարով: Այնուհետեւ նա ստանում է շաբաթական 5 դոլար 8 շաբաթվա ընթացքում: 8 շաբաթվա վերջում, եթե նա ունի 100 դոլար, ապա ինչքա՞ն գումարով է սկսել Բեյլին: ;60
Ջուդին պարի 5 դաս է սովորեցնում ամեն օր, շաբաթ օրերին եւ 8 դաս շաբաթ օրերին: Եթե յուրաքանչյուր դասարանում կա 15 աշակերտ եւ նա յուրաքանչյուրից 15 դոլար է պահանջում, ապա որքան գումար է նա վաստակում մեկ շաբաթում: ;7425
Կելյանն ունի երկու բաղադրատոմս, որոնցից մեկը 20 հրահանգներ ունի, իսկ երկրորդը երկու անգամ ավելի շատ։ Քանի՞ հրահանգ է Կելյանն ընթերցում երկու ուտեստ պատրաստելու համար։ ;60
Թոմին իր բարեգործության համար գումար է հավաքում՝ վաճառելով բրաունիսները 3 դոլարով եւ պանիրի տորթերը 4 դոլարով: Եթե Թոմին 43 բրաունի եւ 23 կտոր պանիր վաճառի, ապա որքան գումար կստանա Թոմին: ;221
Շիլան գնել է հինգ բջջային հեռախոս՝ յուրաքանչյուրը 150 դոլարով, 3 ամսվա վճարով: Յուրաքանչյուր միավորի համար կվճարվի 2% տոկոս: Որքա՞ն է Շիլան վճարելու 3 ամսվա ընթացքում: ;255
Արթին ծաղիկների խանութ ունի գյուղատնտեսական շուկայում: Նա երեք տեսակի ծաղիկներ է վաճառում. Մարիգոլդներ, պետունիաներ եւ բեգոնիաներ: Նա սովորաբար կարտոֆիլներ է վաճառում մեկ տուփի համար 2.74 դոլարով, պետունիաներ՝ 1.87 դոլարով եւ բեգոնիաներ՝ 2.12 դոլարով: Արթին այսօր չի կարող փոխել, ուստի որոշել է բոլոր գները կլորացնել մինչեւ ամենամոտ դոլարը: Եթե Արթին վաճառի 12 տուփ սաղավարտ, 9 տուփ պետունիա եւ 17 տուփ բեգոնիա, ինչքա՞ն կստանա նա: ;88
Լուկը ժամանակ է անցկացնում լողափում՝ ավազե ամրոցներ կառուցելով: Նա վերջապես նկատում է, որ ավազե ամրոցի յուրաքանչյուր մակարդակ կունենա դրա ներքեւի մակարդակի կեսը: Եթե նա կառուցի 4 մակարդակով ավազե ամրոց, որի վերին մակարդակը 16 քառակուսի ֆուտ է, ապա ի՞նչ է միջին քառակուսի ֆուտը մեկ մակարդակի համար: ;60
Սեսիլիան նոր շուն է գնել։ Ըստ նրա անասնաբույժի, նա պետք է կերակրի իր շանտաժին ամեն օր 1 բաժակ շան սնունդ առաջին 180 օրվա ընթացքում: Այնուհետեւ նա ստիպված է կերակրել շան կատուին 2 բաժակ շան սնունդ ամեն օր իր կյանքի մնացած ժամանակահատվածում: Եթե շների սննդի մեկ տոպրակը պարունակում է 110 բաժակ, ապա քանի՞ տոպրակ կուտակվի Սեսիլիայի կողմից առաջին տարում: ;5
Եթե Ռեյմոնդը լվանում է Սառայի լվացքի կեսը, իսկ Սառան լվանում է Դեյվիդի լվացքի 4 անգամ ավելի շատ, հաշվարկեք Ռեյմոնդի եւ Դեյվիդի լվացքի տարբերությունը, եթե Սառան լվանում է 400 ֆունտ լվացք: ;100
Վինսենտը կարող է գնել ծաղիկներ 3 փաթեթով՝ 2,50 դոլարով կամ 2 փաթեթով՝ 1 դոլարով։ Որքա՞ն գումար է խնայել՝ ավելի լավ գնով 18 ծաղիկ գնելով։ ;6
Ջոնը որդեգրում է շուն: Նա շանը տանում է մաքրողին, որը 100 դոլար է արժե: Գրեմերը նոր հաճախորդի համար 30% զեղչ է առաջարկում: Որքա՞ն է արժե մաքրությունը: ;70
Երկու աղջիկներ, յուրաքանչյուրը ստացել է 24 լիտր ջրի 1/6-ը: Այնուհետեւ մի տղա 6 լիտր ջուր է ստացել: Քանի՞ լիտր ջուր է մնացել: ;10
Չարլին 10 կցորդ էր ունեցել: Նա 21 կցորդ է գնել առեւտրի կենտրոնի խանութից եւ 23 կցորդ է ստացել իր ծննդյան օրը: Այնուհետեւ Չարլին 9 կցորդ տվեց իր քրոջը եւ 28 կցորդը զարդարեց շնորհավորական քարտը: Քանի՞ կցորդ է մնացել Չարլիի մոտ: ;17
Գրեյսը կշռում է 40 կգ։ Ալեքսը 2 ֆունտով պակաս է, քան Գրեյսը 4 անգամ: Որքա՞ն են դրանց ընդհանուր քաշը կիլոգրամներով: ;623
Դանը 3 վարդի թփ է տնկում։ Յուրաքանչյուր վարդի թփ ունի 25 վարդ: Յուրաքանչյուր վարդ ունի 8 փշր: Քանի՞ փշ կա։ ;600
Ֆուտբոլային թիմը խաղացել է 22 խաղ: Նրանք 8 անգամ ավելի շատ են հաղթել, քան կորցրել են: Քանի՞ հատ են նրանք հաղթել: ;15
Ջինը հին հիշողության վերնաշապիկներից թաթախում է: Նա ունի մեկ վերնաշապիկ ամեն արձակուրդից, որ նա եղել է: Յուրաքանչյուր վերնաշապիկ իր սեփական բլոկն է: Յուրաքանչյուր շարքը պատրաստված է տարբեր արձակուրդների տարիքից: Նա տարեկան չորս անգամ արձակուրդ է գնում եւ արձակուրդ է վերցնում 23 տարեկանից: Այժմ նա 34 տարեկան է։ Ընդհանուր առմամբ քանի՞ հատ թփվածք ունի նա: ;44
Գրեգը օրական երեք անգամ զանգ է տալիս, որպեսզի հիշեցնի։ Երբ ազդանշանը սկսում է ազդել, այն շարունակում է զանգել, մինչեւ որ Գրեգը այն անջատում է: Այսօր առաջին անգամ, երբ այն պայթեց, չորս անգամ զանգահարեց: Երկրորդ անգամ այն զանգահարեց, երեք անգամ երկար, քան առաջին անգամ: Երրորդ անգամ, այն զանգահարեց երկրորդ անգամի կեսից քիչ ժամանակ: Քանի՞ անգամ է զանգահարել ահազանգը։ ;22
Ընկերությունը իր աշխատակիցներից յուրաքանչյուրին ամսական 600 դոլար է վճարում: Ընկերությունը ունի քաղաքականություն, որով իր աշխատակիցներից յուրաքանչյուրի աշխատավարձը բարձրացնում է սկզբնական աշխատավարձի 10%-ով ամեն տարի նրանց համար, ովքեր ընկերությունում մնացել են հինգ տարի: Եթե Սիլվին անցած դեկտեմբերին 5 տարի աշխատել է ընկերությունում, ապա ի՞նչ է նրա տարեկան աշխատավարձը եւս երեք տարվա ծառայությունից հետո: ;9360
Մերիլինի առաջին ձայնասկավառակը 10 անգամ ավելի շատ օրինակ է վաճառվել, քան Հարալդի ձայնասկավառակը: Եթե այդ գրքերի ընդհանուր վաճառքը 88000 է, ապա քանի՞ օրինակ է վաճառել Հարալդը։ ;8000
Քրիստինան պլանավորում է ծննդյան երեկույթ եւ յուրաքանչյուր հրավիրված հյուրի համար անհրաժեշտ է 75-ական նվեր, քանի որ ներկաների 1/4-ը չի գալիս: Նա հրավիրել է 16 ընկերների: Նվերների տոպրակները մեկական 2 դոլար են: Որքա՞ն գումար է նա ծախսելու: ;24
Թեդ Տի-Ռեքսը մտադիր էր կարտոֆիլի աղցան բերել դինոզավրերի ճաշի: Նա գիտի, որ մեծահասակ դինոզավրը կուտի 10 ֆունտ կարտոֆիլի աղցան, իսկ երեխան կուտի մեծահասակի կեսը: Եթե պիկնիկին 20 մեծահասակ եւ 5 երեխա է լինելու, ապա քանի՞ կիլոգրամ կարտոֆիլային աղցան է պետք Թեդին, եթե նա հույս ունի, որ բոլորին կերակրել է: ;225
Յանը երեք անգամ ավելի շատ կենդանիներ ունի, քան Մարչիան։ Մարչիան Սինդիից երկու անգամ ավելի շատ կենդանիներ ունի: Եթե Սինդին ունի չորս ընտանի կենդանին, ապա քանի՞ կենդանին ունի այդ երեքը: ;28
Էմիլին ունի 4 երեխա, որոնց անուններն են՝ Էմի, Ջեքսոն, Քորի եւ Ջեյմս: Էմիը 5 տարով մեծ է Ջեքսոնից եւ 2 տարով փոքր Քորիից։ Եթե Ջեյմսը 10 տարեկան է եւ 1 տարով փոքր Քորիից, ապա քանի՞ տարեկան է Ջեքսոնը: ;4
Լին կարող էր 400 մետր խոչընդոտներով վազել երկու վայրկյան ավելի արագ, քան Ջերալդը 400 մետր խոչընդոտներով: Բայց Ջերալդը փոխեց իր սննդակարգը, ինչը բարելավեց իր արագությունը 10%-ով: Եթե Լին վազում է 400 մետր խոչընդոտներով 38 վայրկյանում, ապա որքան արագ կարող է Ջերալդը, իր բարելավված դիետայով, վազել 400 մետր խոչընդոտներով, վայրկյանում: ;36
Շրջանում կենդանիների թվաքանակը տասներկու անգամ պակաս է, քան կենդանիների թվաքանակը միասին վերցրած: Եթե յուրաքանչյուր շան համար կա երկու կատու, իսկ շների թիվը 60, ապա քանի՞ կենդանին կա հարեւանությամբ: ;348
5-րդ դասարանի 200 աշակերտներից 2-ը տղաներ են, իսկ 2-ը աղջիկներ: Քանի՞ աղջիկ է, որ չի մասնակցում աղջիկների հետախուզությանը: ;40
Հարին անցած գիշեր 9 ժամ է քնել: Նրա ընկեր Ջեյմսը քնում էր միայն Հարիի քնի 2/3-ը: Քանի՞ ժամ է Հարին ավելի շատ քնել, քան Ջեյմսը: ;3
Երբ Ֆրեդան թարմացնում է թիթեռը, այն կորցնում է իր ծավալի կեսը: Յուրաքանչյուր 16 ունցի լոլիկի տուփ, որը նա օգտագործում է, պարունակում է երեք լոլիկ: Ֆրեդայի վերջին տոմատի սոուսը կազմել է 32 օնսիա: Քանի՞ լոլիկ է օգտագործել Ֆրեդան: ;12
Ավտոմեքենաները շարվել են ավտոմայրուղու վրա։ Ավտոմեքենաների մի մասը անցնում է երթեւեկության խցանումից հետո առաջին 15 րոպեի ընթացքում, իսկ մնացած 15 րոպեն անցնում է եւս 20 մեքենայի: 5 մեքենա դուրս են գալիս, որպեսզի նրանք ստիպված չլինեն անցնել երթեւեկության խցանումը: Եթե սկզբում 30 մեքենա էր ավտոմայրուղու վրա, ապա քանի՞ մեքենա է անցել երթեւեկության խցանումից առաջին 15 րոպեի ընթացքում: ;5
"Մարիամը շատ սիրող այգեպան է։ Երեկ նա 18 նոր բույս է ստացել իր սիրելի բուսական այգուց: ""Ամեն ինչ լավ է, եթե դու ես այն, ինչ ուզում ես"" Բարեգործություն զգալով, նա որոշել է, որ վաղը յուրաքանչյուր բարձի վրա 1 բույս կփոխանցի ընկերներին եւ ընտանիքին: Քանի՞ բույս է Մարիամը պահելու: ";58
Ջերոմը 4 ընկերներ ուներ, որոնք որոշակի օր այցելել էին նրան: Առաջին ընկերը 20 անգամ սեղմեց դռան զանգին, մինչեւ Ջերոմը բացեց, երկրորդ ընկերը 1/4 անգամ ավելի շատ սեղմեց դռան զանգը, քան Ջերոմի առաջին ընկերը: Երրորդ ընկերն ավելի հաճախ է զանգում, քան չորրորդը: Եթե չորրորդ ընկերը 60 անգամ սեղմեց զանգի վրա, քանի՞ անգամ է զանգը զանգել: ;175
Սոլոն պետք է կարդա 4 էջ իր գիտության դասագրքից, 20 էջ իր սոցիալական ուսումնասիրությունների դասագրքից, 7 էջ իր պատմության դասագրքից եւ 8 էջ իր աշխարհագրության դասագրքից: Սոլոն երկուշաբթի օրը կարդացել է 15 էջ: Եթե նա 4 օր ունի, որ կարդա ամբողջ գիրքը, ապա միջինում քանի՞ էջ է պետք կարդալ մեկ օրում։ ;6
Ջոնը սիրում է մի բաժակ ջուր խմել նախաճաշի, ճաշի եւ ընթրիքի ժամանակ: Վերջապես, նա էլ է խմում քնելուց առաջ: Ջոնը դա անում է ամեն օր, բայց հանգստյան օրերին նա սիրում է հանգստանալ եւ սոդա խմել ընթրիքի ժամանակ: Ջոնը շաբաթական քանի բաժակ ջուր է խմում: ;26
Օվկիանոսից մառախուղի պաշար է ծածկում քաղաքը: Քաղաքի յուրաքանչյուր 3 մղոնը անցնելու համար 10 րոպե է պահանջվում: Եթե քաղաքը 42 մղոն է ծովափից դեպի հակառակ ներքին եզրը, քանի՞ րոպե կպահանջվի մառախուղի լողափը ամբողջ քաղաքը ծածկելու համար: ;140
Պոպին լուծում է 1000 կտոր փաթեթը: Նա դնում է կտորների քառորդ մասը տախտակի վրա, հետո մայրը դնում է մնացած կտորների երրորդ մասը: Քանի՞ կտոր կա, որ պետք է տեղադրվի: ;500
Քոդին երեք անգամ ավելի շատ թխվածք է ուտում, քան Ամիրը: Եթե Ամիրը ուտում է 5 թխվածք, ապա քանի՞ թխվածք են նրանք ուտում միասին: ;20
Ջոնը ունի 3 տուփ: Յուրաքանչյուր տուփը 5 դյույմ է 6 դյույմ 4 դյույմ: Կայքի պատերը մեկ դյույմ հաստություն ունեն: Որքա՞ն է բոլոր 3 տուփերի ներքին ծավալը: ;72
Ֆրենկին ամեն երեկո հեռուստացույց է նայում, երբ ավարտում է իր տնային աշխատանքը: Երկուշաբթի եւ երեքշաբթի օրերին նա ամեն գիշեր մեկ ժամ դիտում էր իր սիրելի շոուի դրվագները: Չորեքշաբթի օրը նա մի քանի դրվագ դիտեց 30 րոպեանոց շոուի: Հինգշաբթի օրը նա վաղ ավարտեց տնային աշխատանքը եւ դիտեց 1 ժամ տեւողությամբ դրվագ եւ 30 րոպե տեւողությամբ շոու: Ուրբաթ օրը նա ուշ էր արթնանում ու հետեւում էր երկու ժամանոց դրվագներին: Եթե նա դիտել է 7 ժամ հեռուստացույց, ապա քանի՞ 30 րոպեանոց դրվագ է դիտել չորեքշաբթի օրը։ ;3
Հենրին թխվածքաբլիթներ է պատրաստում տեղական թխելու մրցույթի համար: Նա ցանկանում է կրկնակի շատ գումար վաստակել, քան նախորդ տարի: Երբ նա ավարտում է թխելը, նա հասկանում է, որ իրականում 15 թխվածքաբլիթ է ավելացրել, քան նա է մտադիր: Նա 5 թխվածքաբլիթ է գցում, երբ դրանք դուրս է դնում սառեցնելու համար, եւ այժմ ընդհանուր առմամբ 110 թխվածքաբլիթ ունի: Քանի՞ թխվածք է հենրին հացել անցյալ տարի: ;50
Տեղական բենզալցակայանը գազը վաճառում է 3 դոլար գալոնի դիմաց: Ծրագրային ընկերությունը առաջարկում է 20 դոլար վերադարձ յուրաքանչյուր գալոնի համար, եթե լիցքավորեք այս կայանում: Եթե ինչ-որ մեկը գնի 10 գալոն գազ, ինչքա՞ն կլինի գազը, եթե գումար վերադարձնեն: ;28
Մարսելը եւ Բեատրիսը մրցույթ են կազմակերպում, թե ով կարող է ուտել ամենաշատ պտղի փաթաթվածները, ուստի նրանք բացում են այնքան, որքան կարող են գտնել: Ցավոք, ինչ-որ մեկը սխալվում է եւ Բեատրիսը երկու կաթիլ լայնությամբ եւ 24 կաթիլ երկարությամբ էր, մինչդեռ Մարսելը 3 կաթիլ լայնությամբ եւ 14 կաթիլ երկարությամբ էր: Եթե երկուսն էլ կերան ամբողջ քանակը, ապա միջինում քանի՞սն են կերել։ ;45
Ջուլիայի նավակը ջրահեղուկ է ստացել, երբ նա լճի վրա էր: Նավը երկու լիտր ջուր էր ստանում յուրաքանչյուր 10 ոտնաչափի համար, որ նա քշում էր դեպի ափ: Նա 16 վայրկյան է ծախսել 20 ոտնաչափ քշելու համար: Կողմը 64 վայրկյան հեռու էր: Որքա՞ն ջուր էր մտել նավակը, երբ Ջուլիան հասավ ափին: ;16
Դասասասենյակում կա մի վայթբորդ, որը կիսվում է 4 ուսուցիչների միջեւ, ովքեր հերթականությամբ օգտագործում են դասասենյակը: Յուրաքանչյուր ուսուցիչ ունի օրական 2 դաս եւ օգտագործում է վայթբորդը յուրաքանչյուր դասի ընթացքում: Եթե վայթբորդը մաքրում են 3 անգամ մեկ դասի ընթացքում, ապա քանի՞ անգամ է մաքրում օրական: ;24
Ռայանը իր այգում օրական 2 ծաղիկ է տնկում: 15 օր անց քանի՞ ծաղիկ է նա ունեցել, եթե 5 ծաղիկ չի աճել: ;25
Ջամալի հեռախոսը կարող է 6 անգամ ավելի շատ լուսանկարներ պահել, քան Բրիտանիի հեռախոսը: Բրիտանիի հեռախոսի լուսանկարների առավելագույն քանակը 50 անգամ ավելի շատ է, քան թռչունների քանակը, որոնք Ջամալի լուսանկարում են կենդանաբանական այգում: Եթե Ջամալի հեռախոսը կարող է պահել 1800 լուսանկար, ապա քանի՞ բադիկ կարելի է տեսնել կենդանաբանական այգում գտնվող բադիկների Ջամալի լուսանկարում: ;6
"Սաշան նկատում է, որ վերջին մի քանի ամիսների ընթացքում փայտի գները 50%-ով բարձրացել են, երբ նա որոշ փայտ է գնել։ ""Ամեն ինչ լավ է"" Նա 10 2x4x10 տախտակ է թողել, որոնցից յուրաքանչյուրը 10 դոլար արժե։ Նա նաեւ ունի 5 4x4x10 տախտակ, որոնցից յուրաքանչյուրը գնել է 16 դոլարով: Եթե նա վաճառի բոլորի համար, ապա որքան շահույթ կստանա: ";90
Քեյթին սուրճ է պատրաստում՝ օգտագործելով թեյի գդալ շաքար եւ բաժակ ջուր՝ 7:13 հարաբերակցությամբ։ Եթե նա օգտագործել է ընդհանուր 120 թեյի գդալ շաքար եւ մի քանի բաժակ ջուր, ապա հաշվարկիր, թե քանի թեյի գդալ շաքար է օգտագործել: ;42
Ջոնը իր երեք երեխաներից յուրաքանչյուրի համար 2 զույգ կոշիկ է գնում: Դրանք մեկական 60 դոլար արժեն: Որքա՞ն է նա վճարել: ;360
