question;answer_number
Ջանեթի բադերը օրական 16 ձու են դնում: Նա ամեն առավոտ երեքով ուտում է նախաճաշի համար եւ իր ընկերների համար մաֆիններ է պատրաստում ամեն օր չորսով: Նա մնացածը ամեն օր վաճառում է գյուղացու շուկայում՝ թարմ բադի ձվի դիմաց 2 դոլարով։ Որքա՞ն դոլար է նա ամեն օր վաստակում գյուղացիների շուկայում: ;18
Գոգին 2 կլոր կապույտ մանրաթել է պահանջում, իսկ սպիտակ մանրաթելը՝ կեսը: Ընդհանուր առմամբ քանի՞ փական է անհրաժեշտ: ;3
Ջոշը որոշում է փորձել տունը շրջել: Նա տուն է գնում 80,000 դոլարով եւ հետո 50,000 դոլար է ծախսում վերանորոգման վրա: Սա ավելացրեց տան արժեքը 150%-ով: Որքա՞ն շահույթ է նա ունեցել։ ;70000
Ջեյմսը որոշում է շաբաթական 3 անգամ 3 վազք վազել: Նա վազում է 60 մետր ամեն սպրինտում: Քանի՞ մետր է նա վազում շաբաթական: ;540
Ամեն օր Վենդին իր յուրաքանչյուր հավին կերակրում է երեք բաժակ խառնված հավի կերակուրով, որը պարունակում է սերմեր, հացահատիկի որդեր եւ բանջարեղեն, որպեսզի դրանք առողջ լինեն: Նա հավերին երեք անգամ կերակրում է: Առավոտյան նա իր հոտին 15 բաժակ կեր է տալիս: Կենդանակերպի նշաններ Քանի՞ բաժակ կերակուր է պետք, որ նա իր հավերին տա օրվա վերջին ճաշի ժամանակ, եթե Վենդիի հոտի չափը 20 հավ է: ;20
Կայլարը գնացել է խանութ, որպեսզի իր նոր բնակարանի համար ակնոցներ գնի: Մեկ բաժակը 5 դոլար է, բայց յուրաքանչյուր երկրորդ բաժակը արժե գնի միայն 60% -ը: Կայլարը ցանկանում է 16 բաժակ գնել: Որքա՞ն պետք է վճարի նրանց համար: ;64
Տուլուզը Չարլսթոնի երկու անգամ ավելի շատ ոչխարներ ունի: Չարլսթոնն ունի 4 անգամ ավելի շատ ոչխարներ, քան Սիեթլը: Քանի՞ ոչխար ունեն Տուլուզը, Չարլսթոնը եւ Սիեթլը միասին, եթե Սիեթլը ունի 20 ոչխար: ;260
Կառլան ներբեռնում է 200 ԳԲ ֆայլ: Սովորաբար նա կարող է ներբեռնել 2 ԳԲ/մեկ րոպե, բայց ներբեռնման ընթացքում 40%-ով Windows-ը ստիպում է վերագործարկել թարմացումները, ինչը տեւում է 20 րոպե: Այդ դեպքում Կառլան պետք է վերսկսի բեռնումը սկզբից: Որքա՞ն բեռ է պահանջվում ֆայլը ներբեռնելու համար: ;160
Ջոնը երեք ժամ է մեքենա վարում 100 կմ/ժ արագությամբ, հետո շրջվում է, քանի որ հասկանում է, որ տանը շատ կարեւոր բան է մոռացել: Նա փորձում է տուն հասնել 4 ժամում, բայց առաջին 2 ժամը անցկացնում է երթեւեկության մեջ: Նա հաջորդ կես ժամը վարում է 30 մղոն /ժամ արագությամբ, նախքան 4 ժամվա մնացած ժամանակը 80 մղոն /ժամ արագությամբ վարելը: Որքա՞ն հեռու է նա տնից այդ 4 ժամվա վերջում: ;45
Էլիզայի աշխատավարձը շաբաթական առաջին 40 ժամը կազմում է 10 դոլար։ Նաեւ ստանում է 1.2 անգամ ավել աշխատավարձ: Եթե Էլիզան այս շաբաթ աշխատել է 45 ժամ, ապա որքան են նրա եկամուտները այս շաբաթվա համար: ;460
Նոր ծրագիրը առաջին ամսում 60 ներբեռնման է ենթարկվել: Երկրորդ ամսվա ընթացքում ներբեռնվածների թիվը երեք անգամ ավելի շատ էր, քան առաջին ամսվա ընթացքում, բայց երրորդ ամսվա ընթացքում նվազել է 30%-ով: Քանի՞ անգամ է ներբեռնվել ծրագիրը այս երեք ամսվա ընթացքում: ;366
Թուլան գնացել է հացագործարան եւ տարբեր տեսակի հաց է գնել: Նա գնել է 3 տասնյակ տոննա, որոնք արժեն 68 դոլար տասնյակի համար, 2 տասնյակ մինի տորթ, որոնք արժեն 80 դոլար տասնյակի համար, եւ 6 տասնյակ մինի պանիր տորթ, որոնք արժեն 55 դոլար տասնյակի համար: Որքա՞ն կարժենա այն։ ;694
Կառլոսը լիմոնե ծառ է տնկում։ Ծառը տնկելը կարժենա 90 դոլար: Ամեն տարի 7 լիմոն կաճի, որոնցից յուրաքանչյուրը կարող է վաճառվել 1.5 դոլարով։ Ծառը ջրելու եւ կերակրելու համար տարեկան 3 դոլար է պահանջվում: Քանի՞ տարի կպահանջվի, մինչեւ նա սկսի գումար վաստակել լիմոնե ծառից: ;13
Մելանիան տնից տուն վաճառող է։ Նա վաճառեց իր փոշեկուլների մեկ երրորդը կանաչ տանը, եւս երկուսը կարմիր տանը, եւ մնացածի կեսը նարնջագույն տանը: Եթե Մելանիի մոտ մնացել է 5 փոշեկուլ, ապա քանի՞ն էր նա սկսել: ;18
20 աշակերտներից բաղկացած պարային դասարանում 20%-ը սովորում էր ժամանակակից պար, մնացած 25%-ը սովորում էր ջազ պար, իսկ մնացածը սովորում էր հիպ-հոփ պար: Ուսանողների քանի՞ տոկոսը սովորում է հիպ-հոփ պարեր: ;60
Գնորդը ցանկանում է ընտրություն կատարել երկու գնման պլանների միջեւ. 5000 դոլար արժողությամբ զարդեր կամ 8000 դոլար արժողությամբ էլեկտրոնային սարքավորումներ: Նրա ֆինանսական խորհրդականը ենթադրում է, որ ոսկերչական շուկան կբարձրանա 2.5%-ով, իսկ էլեկտրոնային սարքերի շուկան կբարձրանա 1.2%-ով նույն ամսվա ընթացքում: Եթե վաճառողը ցանկանում է առավելագույն շահույթ ստանալ այս ամսվա վերջում, ընտրություն կատարելով, ապա որքան շահույթ կունենա դա: ;125
Երկու գնացքները մեկնում են Սան Ռաֆայելից միաժամանակ: Նրանք սկսում են ճանապարհորդել դեպի արեւմուտք, երկուսն էլ ճանապարհորդում են 80 մղոնով: Հաջորդ օրը նրանք շարժվում են դեպի հյուսիս՝ անցնելով 150 մղոն: Որքա՞ն հեռավորություն է անցել յուրաքանչյուր գնացքը երկու օրվա ընթացքում: ;230
Ջիլին վճարում են 20 դոլար ժամում դասավանդելու համար եւ 30 դոլար՝ խիերլիդերի մարզիչ լինելու համար: Եթե նա աշխատում է 50 շաբաթ մեկ տարում, 35 ժամ մեկ շաբաթ որպես ուսուցիչ եւ 15 ժամ մեկ շաբաթ որպես մարզիչ, ինչ է նրա տարեկան աշխատավարձը: ;57500
Քլերը ամեն առավոտ նախաճաշի համար պատրաստում է 3 ձուանոց օմլետ: Քանի՞ տասնյակ ձու է նա կուտի 4 շաբաթվա ընթացքում: ;7
Մարիսան 12 մղոն հեռավորության վրա է քայլում: Առաջին 4 մղոնն անցնելու համար նրան մեկ ժամ էր պետք, իսկ հաջորդ 2 մղոնը անցնելու համար եւս մեկ ժամ: Եթե նա ցանկանում է, որ իր միջին արագությունը լինի 4 մղոն ժամում, ապա ի՞նչ արագությամբ (մղոն ժամում) պետք է քայլի մնացած հեռավորությունը: ;6
Ես ունեմ 10 լիտր նարնջի խմիչք, որի երկու երրորդը ջուր է, եւ ես ցանկանում եմ ավելացնել այն 15 լիտր անանասի խմիչքին, որի երեք հինգերորդը ջուր է: Բայց երբ ես լցնում եմ, ես թափում եմ մեկ լիտր նարնջագույն ըմպելիք: Որքա՞ն ջուր կա մնացած 24 լիտրում: ;15
Ռեյմոնդն ու Սամանթան զարմիկներ են։ Ռեյմոնդը ծնվել է Սամանթայից 6 տարի առաջ։ Ռեյմոնդը որդի է ունեցել 23 տարեկանում։ Եթե Սամանթան այժմ 31 տարեկան է, քանի՞ տարի առաջ է ծնվել Ռեյմոնդի որդին: ;14
Բիլլին վաճառում է DVD-ներ։ Երեքշաբթի օրը նա 8 հաճախորդ ունի: Նրա առաջին 3 հաճախորդները գնել են մեկ DVD: Նրա հաջորդ երկու հաճախորդները յուրաքանչյուրը գնում է 2 DVD: Նրա վերջին 3 հաճախորդները չեն գնում DVD-ներ: Քանի՞ DVD է վաճառել Բիլլին երեքշաբթի օրը։ ;7
Մոմը 2 սանտիմետրով հալվում է ամեն ժամ, երբ այրվում է: Քանի՞ սանտիմետրով է կրճատվում մոմը, երբ այն այրվում է ժամը 13:00-ից մինչեւ 17:00-ը: ;8
Քայլը 19.50 դոլարով գնել է անցյալ տարվա ամենավաճառվող գիրքը: Սա 25% զեղչով է նախնական գնից: Ի՞նչ էր գրքի սկզբնական գինը: ;26
Մարիան պատվիրեց մի հավի ճաշ, որը կարժենա 12 դոլար, 5 փաթեթ կաթ, որոնցից յուրաքանչյուրը կարժենա 3 դոլար, 4 խնձոր, որոնցից յուրաքանչյուրը կարժենա 1,50 դոլար, եւ մի քանի տուփ պիցցա։ Մարիան վճարեց ընդհանուր առմամբ 50 դոլար։ Քանի՞ տուփ պիցցա է պատվիրել Մարիան, եթե յուրաքանչյուր տուփը 8.50 դոլար է արժե: ;2
Միշկան գնել է 3 զույգ կարճ շորթ, 3 զույգ շորթ եւ 3 զույգ կոշիկ: Մեկ շորթը 16.50 դոլար է արժե: Մի զույգ շալվարը 22.50 դոլար է, իսկ մեկ զույգ կոշիկը՝ 42 դոլար: Քանի՞ դոլար է Միշկան ծախսել հագուստի վրա։ ;243
Սինթիան ամեն գիշեր մեկ բաժակ սառույց է ուտում: Նա գնում է 15 բաժակ սառցադեղուկ՝ մեկ տուփը 4 դոլարով։ 60 օր անց, որքան գումար կծախսի նա սառցադեղուկի վրա: ;16
Հենրին երկու անգամ կանգ է առել իր 60 մղոնանոց հեծանիվով ճանապարհորդության ընթացքում: Նա առաջին անգամ կանգ առավ 20 մղոն անց: Երկրորդ կանգառը 15 մղոն էր ճանապարհի ավարտից առաջ: Քանի՞ մղոն է նա անցել առաջին եւ երկրորդ կանգառների միջեւ: ;25
Գլորիան կոշիկներ է գնում, երբ բախվում է մի զույգ կոշիկի, որոնք համապատասխանում են նրա կոշիկի բյուջեին: Սակայն նա պետք է ընտրի կոշիկների եւ երկու զույգ բարձրակրունկ կոշիկների միջեւ, որոնք միասին 5 դոլարով ավելի էժան են, քան կոշիկները: Եթե մեկ զույգ բարձունքային կոշիկները 33 դոլար արժեն, իսկ մյուսները՝ երկու անգամ ավելի, ապա քանի՞ դոլար արժեն կոշիկները: ;104
Դարելի եւ Ալենի տարիքը 7:11 հարաբերակցությամբ է: Եթե նրանց ընդհանուր տարիքը 162 է, ապա հաշվարկիր Ալենի տարիքը 10 տարի հետո։ ;109
Գունտերը փորձում է հաշվել ջելեյ-բոբինները: Նա հարցնում է ընկերներին, թե քանի՞սն են այդ բրենդում։ Մեկը ասում է 80։ Մեկ ուրիշը ասում է, որ 20 դրամն ավել է առաջինի կեսից: Երրորդը ասում է, որ առաջինից 25%-ով ավելի շատ է: Որքա՞ն է նրանց միջին գնահատականը: ;80
Ջոնը հոգ է տանում 10 շների մասին: Յուրաքանչյուր շուն օրական 1.5 ժամ է ծախսում զբոսնելու եւ իր գործերի մասին հոգ տանելու համար: Շաբաթական քանի՞ ժամ է նա ծախսում շների վրա: ;35
Գրետչենը ունի 110 մետաղադրամ: Ոսկե մետաղադրամները 30 անգամ ավելի շատ են, քան արծաթե մետաղադրամները: Քանի՞ ոսկե մետաղադրամ ունի Գրետչենը: ;70
Շիոբանը 2 անգամ ավելի քիչ զարդեր ունի, քան Ահարոնը: Ահարոնը 5 անգամ ավելի շատ զարդեր ունի, քան Ռեյմոնդի զարդերի կեսը: Եթե Ռեյմոնդը 40 զարդ ունի, ապա Սիոբանը քանի՞ զարդ ունի: ;23
Մայքը 40 րոպե խաղում է պինգ-պոնգ: Առաջին 20 րոպեի ընթացքում նա 4 միավոր է հավաքել: Երկրորդ 20 րոպեի ընթացքում նա 25 տոկոսով ավելի շատ միավորներ է հավաքում: Որքա՞ն միավոր է նա հավաքել։ ;9
Թերին օրական 2 յոգուրտ է ուտում: Ներկայումս դրանք վաճառվում են 4 յոգուրտով 5 դոլարով: Որքա՞ն է նա ծախսում յոգուրտի վրա 30 օրվա ընթացքում: ;75
Ջոնը մտադիր է վաճառել իր բոլոր խաղալիքները եւ այդ գումարը օգտագործել վիդեո խաղեր գնելու համար։ Նա ունի 13 լեգո սեթ եւ դրանք վաճառում է 15 դոլարով: Նա վերջում գնում է 8 տեսախաղ՝ յուրաքանչյուրը 20 դոլարով եւ մնացել է 5 դոլար: Քանի՞ լեգո սեթ ունի նա: ;2
Ջոնը շաբաթական վազում է 100 կմ։ Նա շաբաթական 3 օր վազում է: Առաջին օրը նա վազում է 3 ժամ, իսկ մյուս երկու օրը' կեսից քիչ: Որքա՞ն արագ է նա վազում: ;10
Դանան կարող է վազել չորս անգամ ավելի արագ, քան քայլում է, բայց նա կարող է ցատկել իր վազած արագության կեսով: Եթե նա կարող է թռչել ժամում 3 մղոն արագությամբ, ապա քանի՞ մղոն կարող է նա անցնել 6 ժամում, եթե նա ժամանակի 1/3-ը վազում է, իսկ 2/3-ը քայլում: ;18
Բրենդոնի iPhone-ը չորս անգամ ավելի հին է, քան Բենի iPhone-ը: Բենի iPhone-ը երկու անգամ ավելի հին է, քան Սուզիի iPhone-ը: Եթե Սուզիի iPhone-ը 1 տարեկան է, ապա քանի՞ տարեկան է Բրենդոնի iPhone-ը: ;8
Մեծ վիշապը, Պերգը, նստած էր Ֆարբո լեռան գագաթին, կրակ էր շնչում ամեն ինչի վրա, որը մոտ էր 1000 ոտնաչափի: Պոլլին կարող էր նետել ոսկե նետը, միակ հայտնի զենքը, որը կարող էր սայլակով նապաստակը քշել, 400 ոտնաչափ հեռավորության վրա, որը գտնվում էր նապաստակի կրակի հասանելիության սահմաններում: Բայց երբ Պոլլին պահում էր սափիրե քարը, նա կարող էր նետը նետել երեք անգամ ավելի հեռու, քան երբ նա չէր պահում քարը: Եթե նա պահում է քարը, ապա որքան հեռու է նա կարող կանգնել վիշապի կրակի հասանելիությունից եւ այնուամենայնիվ հարվածել վիշապին ոսկե նետով: ;200
Տատիկ Ջոնսը խնձորի 5 տորթ է պատրաստել հրշեջի ճաշի համար: Նա յուրաքանչյուր պիցցան կտրեց 8 կտորի եւ հինգ պիցցաները դրեց բուֆետի սեղանի վրա, որպեսզի հյուրերը կարողանան իրենց ծառայել: Երեկոյի վերջում, երբ հյուրերը վերցրել եւ կերել էին իրենց թխվածքաբլիթները, մնացել էր 14 թխվածքաբլիթ: Քանի՞ կտոր են վերցրել հյուրերը: ;26
Ըստ սննդային ինֆորմացիայի, մի տուփ կարտոֆիլը ունի 250 կալորիա մեկ բաժակով: Եթե 300 գրամանոց տոպրակը պարունակում է 5 բաժին, քանի՞ գրամ կարող եք ուտել, եթե ձեր օրական կալորիականության թիրախը 2000 է, եւ դուք արդեն 1800 կալորիա եք օգտագործել: ;48
Չարլին ցանկանում է վաճառել մեղուների մոմեր: Մեղուների մոմի յուրաքանչյուր կիլոգրամի համար նա կարող է պատրաստել 10 թեւավոր մոմ: Մի կիլոգրամ մեղու մոմը եւ փաթեթները 10 դոլար արժեն: Եթե նա յուրաքանչյուր մոմը վաճառի 2 դոլարով, ապա ի՞նչ շահույթ կստանա, եթե 20 մոմ արտադրի եւ վաճառի: ;20
Մերեդիթը ազատ բլոգեր է, ով գրում է առողջության մասին եւ ամեն օր ներկայացնում է հաճախորդներին որպես իր մշտական աշխատանք: Բլոգի հոդվածը հետազոտելու եւ գրելու համար միջինում 4 ժամ է պահանջվում: Անցած շաբաթ նա երկուշաբթի օրը 5 հոդված է գրել, իսկ երեքշաբթի օրը 2/5 անգամ ավելի շատ հոդվածներ, քան երկուշաբթի օրը: Չորեքշաբթի օրը նա երկու անգամ ավելի շատ հոդվածներ է գրել, քան երեքշաբթի օրը: Հաշվարկեք, թե երեք օրվա ընթացքում նա քանի ժամ է ծախսել հոդվածներ գրելու վրա։ ;104
Քենդիսը 80 նամակ դրեց իր պայուսակի մեջ, նախքան սրճարանում աշխատանքի գնալը: Ճանապարհին նա կանգ առավ խանութում եւ գնել է մի փաթեթ Post-it նոտաներ: Աշխատավայրում նա մեկ Post-it նոտա դրեց յուրաքանչյուր 220 տարբեր բաժակ սուրճի վրա: Եթե նա ընդհանուր առմամբ 23 նամակ էր թողել, ապա քանի՞ նամակ էր նրա գնած փաթեթում: ;163
Ջոնը երկու անգամ ավելի շատ կարմիր կապույտ կապոցներ է գնում, քան կապույտ: Կարմիր գոտկապերը 50%-ով ավելի թանկ են, քան կապույտ գոտկապերը: Նա 200 դոլար ծախսեց կապույտ կապույտ կապույտ կապույտ կապույտ կապույտ կապույտ կապույտ կապույտ կապույտ կապույտ կապույտ կապույտ կապույտ կապույտ կապույտ կապույտ կապույտ կապույտ կապույտ կապույտ կապույտ կապույտ կապույտ կապույտ կապույտ կապույտ կապույտ կապույտ կապույտ կապույտ Որքա՞ն գումար է ծախսել կապույտների վրա: ;800
Թրեյսին օգտագործել է 4 ոտնաչափ երկարությամբ մետրանոց, որպեսզի դիետաները պահի այգում: Կապը կտրված էր 6 դյույմ երկարությամբ: Քանի՞ կտոր է նա ձեռք բերել: ;8
Ռիչարդը ապրում է 15 հարկանի շենքում։ Յուրաքանչյուր հարկում կա 8 միավոր, եւ շենքի 3/4-ը զբաղված է: Ի՞նչ թիվ ունի շենքի բոլոր դատարկ բնակարանները: ;30
Լլոյդը ձու ֆերմա ունի։ Նրա հավերը օրական 252 ձու են արտադրում եւ նա դրանք վաճառում է տասնյակի դիմաց 2 դոլարով: Որքա՞ն է Լլոյդը վաստակում ձվերից շաբաթական: ;294
Թոմի նավը կարող է ժամում 10 մղոն արագությամբ շարժվել: Նա նավարկում է ժամը 1-ից 4-ը: Այնուհետեւ նա վերադառնում է մոտ 6 մղոն/ժամ արագությամբ: Որքա՞ն ժամանակ է պահանջվում նրան վերադառնալ? ;5
Ուրիայի գրքերի պայուսակը չափազանց ծանր է դառնում նրա համար: Նա պետք է 15 ֆունտ քաշ հեռացնի: Նրա կոմիքսները կշռում են մեկ կիլոգրամ, իսկ իր խաղալիքները՝ մեկ կիլոգրամ: Եթե նա հեռացնում է 30 կոմիքսներ, ապա քանի՞ խաղալիք է պետք հեռացնել: ;15
"Մեքենիկը տարբեր գներ է պահանջում բեռնատարների եւ ավտոմեքենաների անվադողերի համար։ ""Ամեն անգամ, երբ մեքենան վերանորոգվում է, մեքենավարը 60 դոլար է պահանջում, իսկ մեքենաների համար՝ 40 դոլար։ Մեքենիկը հինգշաբթի օրերին վերանորոգում է 6 բեռնատարի եւ 4 ավտոմեքենայի անվադողերը։ Ուրբաթ օրը մեքենաշինը 12 անգամ փորձել է մեքենաները վերանորոգել, բայց ոչ մի բեռնատարի անվադող չի վերանորոգել: Որքա՞ն եկամուտ է վաստակել մեքենաշինագործը ավելի բարձր եկամուտ ունեցող օրը: ";40
Doubtfire քույրերը տուն են գնում 7 կատուներով, որոնք որդեգրվել են կենդանիների տեղական ապաստարանից, երբ նրանց մայրը զանգահարում է նրանց տեղեկացնելու, որ իրենց երկու տնային կատուները նոր են ծնվել: Նա ասում է, որ առաջին կատուն՝ Փաթչին, որդեգրված կատուների թվից երեք անգամ ավելի շատ կատուներ է ունեցել, մինչդեռ մյուս կատուն՝ Թրիքսին, ունեցել է 12-ը: Քանի՞ կատու ունի Դուբթֆայերի ընտանիքը: ;40
Ջենը 30 լոլիկ ունի: Ջինը ուտում է 2 կաթնաշոռ: Մնացած լոլիկներով Ջինը ցանկանում է մեկ տոպրակում երկու լոլիկ փաթեթավորել: Քանի՞ տոպրակ կարող է Ջինը լցնել: ;14
Փիթերը ծրագրում է այս շաբաթ կինոյ գնալ։ Նա միշտ տոմս է ստանում 7 դոլարով եւ պոպքորն 7 դոլարով: Եթե նա 42 դոլար ունի շաբաթվա համար, քանի՞ անգամ կարող է գնալ կինո: ;3
Ծառի կամուրջը կարող է կրել ոչ ավելի, քան 5000 ֆունտ: Կատարման բեռնատարը, որը լի է նույնանման տուփերով, որոնցից յուրաքանչյուրը կշռում է 15 ֆունտ, կանցնի կամրջի վրայով: Վարորդի եւ դատարկ բեռնատարի ընդհանուր քաշը կազմում է 3755 ֆունտ: Որքա՞ն է տուփերի առավելագույն քանակը, որոնք կարող են բեռնվել բեռնատարի վրա՝ չանցնելով կամրջի քաշային սահմանը: ;83
Սթիվենը առցանց գնումներ է կատարել: Նրա վերջնական հաշիվը կազմել է 40 դոլար: Քանի որ դա կատարվել է առաքման վաճառողի միջոցով, նրանք ավելացրել են 25% վճար իր վերջնական գումարի վրա եւ վճարել են նրան 3 դոլար առաքման վճարով: Սթիվենը նաեւ ավելացրեց 4 դոլար տիպ: Բացի լրացուցիչ վճարներից, ի՞նչ էր Ստեփենի սննդամթերքի վերջնական գինը։ ;57
