,input_sentence_1,input_sentence_2,input_sentence_3,input_sentence_4,sentence_quiz1,sentence_quiz2,answer_right_ending
0,"Станах фен на ""Закон и ред"" през 2011 г.",Бях в възстановяване от инсулт.,"Когато се прибрах, се опитах да гледам всеки епизод.",Беше трудно да се опиташ да гледаш 20 години шоу.,"Мисля, че ""Закон и ред"" е едно от най-лошите предавания, създавани някога.",Накрая ги гледах всичките.,2
1,"Всички обичаха Боб, защото играеше популярния герой във филма.","Боб го мразеше, защото той не приличаше на този герой.",Джим помоли Боб да каже фразата на героя си.,Това беше твърде много за Боб и той избухна от ярост.,Боб каза на човека да го остави на мира.,Боб помоли човека за чай.,1
2,Лита искаше да гледа любимото си предаване по телевизията.,Децата й настояха да седне и да го гледа с тях.,"Лита им каза, че има работа.",Децата й завлечеха кошницата за пране в хола.,Лита поръча пица с пеперони за обяд.,"Лита сгъна прането, докато гледа телевизия.",2
3,"Лив скочи, когато беше изненадана от силен гръм.","Тя осъзна, че е лампата в кухнята й, която изгаря.",Тя извади стомаха и стъпи върху него.,Тя се разклати под нея и тя почти падна.,Лив реши да смени крушката в банята.,Лив смени крушката.,2
4,"Майка каза на децата си, че след петнадесет минути ще е обяд.",Но тогава тя получи важно обаждане.,"Докато тя говореше, кучето пълнеше кал по цялата кухня.","Децата започнаха да тормозят майка си, която все още говореше по телефона.",Майката се почувства доста разочарована.,Поведението на децата успокоило майката.,1
5,Хектор винаги си купува кафе в местния магазин преди работа.,"Осъзнава, че навика му да купува кафе е много скъпа.",Един ден Хектор решава да си направи кафе вкъщи.,"Гордее се, че кафето, което е направил у дома, е толкова добро.",Хектор продължаваше да си прави кафе и спестяваше пари.,Хектор започна да купува повече кафе от Старбъкс.,1
6,"Кели е разбрала, че има ново момиче в училище.","Когато влезе в училището, тя отиде да я търси.","Когато я срещна, тя я покани да обядва с нея.","Когато обядваха, момичетата станаха приятели.",Кели никога повече не говори с нея.,"Кели беше щастлива, че си е намерила нов приятел.",2
7,Томи се е тренирал здраво за първите си 5 км.,"По време на състезанието той се чувстваше разочарован, когато толкова много хора го преминаха.","Когато чу името му да се казва по време на наградите, беше шокиран.","Не е осъзнавал, че ще правят награди по възрастови групи.","Срамуваше се, че не е получил признание.","Гордее се, че е първи по възраст, но десети като цяло.",2
8,Лори ще ходи на първия си официален танц тази вечер.,Нейният приятел я взе и й подари красива роза.,Лори носеше дълга блестяща рокля.,Танцуваха и се забавляваха с всичките си приятели.,Лори се прибра плачейки.,Лори завърши вечерта с целувка.,2
9,Нийл е изследвал исторически железници.,"Той е в Скрантън, Пенсилвания.","Осъзнал, че е красиво старо влаково депо.","Той направи много снимки, докато беше там.",Нийл изтри всичките си снимки.,Нийл е запазил снимките в компютъра си.,2
10,Боб се страхуваше от първия си ден в ресторант за бързо хранене.,"Той планираше да изчака, за да облече блестящата си морска униформа.","Боб започна да прави рибни бургери, след като облече униформата.","Беше толкова зает, че забрави да се преоблече в уличните си дрехи.","Боб толкова обичаше костюма, че го показваше на приятелите си.",Боб излезе след работа облечен в морски костюм.,2
11,Приятелка дойде на гости.,"Казах й, че кучето ми хапе.",Тя не ме послуша.,Опита се да го гали и да си играе с него.,Кучето ми я ухапа.,Кучето ми избяга.,1
12,Лестър винаги е искал да бъде по-художествен.,Един ден решава да нарисува цвете.,Седнал е пред красива орхидея и започнал да рисува.,Рисунката на Лестър е много добра.,Той окачва картината на стената в хола си.,Решава никога повече да не рисува нищо.,1
13,Пабло обича да яде червеи.,В училище е чел как се прави това.,Той ги пържи в зехтин.,Обича да прави това поне веднъж месечно.,Пабло обича червеите и ги смята за деликатес.,Пабло не обича да яде червеи.,1
14,Кира винаги е обичал японската култура.,Много от любимите й филми са на японски.,Тя реши да пътува там.,От години спестяваше пари за пътуването си.,Изхарчи всичките пари за обувки.,Беше най-хубавото пътуване в живота й.,2
15,Глен имаше настроение за разходка.,Облече си якето и излезе навън.,"Докато вървеше по тротоара, се спъна и си счупи коляното.",Глен се изправи и се върна куцайки към къщата си.,Глен изкарал най-доброто си време на маратон.,"Глен се закле, че никога няма да ходи отново.",2
16,Исус прекара деня в полиране на мебелите.,"С наближаването на нощта той преглеждаше работата, която е свършил.",Всичко изглеждаше чисто и чисто.,Исус покани всичките си приятели на парти тази вечер.,"Казаха, че мебелите му са хубави.",Приятелите му лъскаха мебелите му.,1
17,Наскоро отидох до магазина.,"Когато минавах през изхода, почувствах студена, твърда стомана на ръката си.","Бях шокиран, че ме блъсна кола!","Шофьорът се извини, след като видя, че съм бил ударен.","Казах им, че всичко е наред и си тръгнах.",Шофьорът на колата ми се ядоса.,1
18,Сестрата на Джина си е порязала глезена с чупено стъкло.,Кръвта е текла по крака и в обувката й.,"Когато видя кръвта, избяга вкъщи.","Джина я последва, но не успя да я догони.","Когато се прибраха вкъщи, всички ядоха сладолед.",Сестрата на Джина отиде на лекар.,2
19,Едно малко момче беше в трети клас.,"Беше много умен, но се мъчеше да чете.","Когато четеше на глас, съучениците му му се присмиваха.",Започна да практикува четенето всеки ден.,"Малкото момче прие, че никога няма да се подобри.",В края на годината той се справи добре с теста по четене.,2
20,Класът на Роузи правеше малко парти.,Тя реши да направи плодова салата за всички.,Тя е похарчила много пари за плодовете и много време за приготвянето им.,В деня на партито тя събра огромна купа плодова салата.,Рози и нейният клас са яли плодова салата.,Роузи държеше купата плодова салата в хладилника си вкъщи.,1
21,Кели беше щастлива да има новия си телефон.,Тя го носеше навсякъде.,"За съжаление, тя го разби.","За щастие, тя успя да го оправи.",Магазинът й даде справедлива цена за поправката.,Кели си купи нов телефон.,1
22,"Когато бях в колежа, срещнах един по-възрастен мъж.","Бях на 22, а той на 38.",Имахме добро разбирателство и си прекарахме добре заедно.,"Бяхме заедно през цялото време, когато бях там.",Имам приятни спомени от това време.,Имам негативни спомени от това време.,1
23,Боб искаше да участва в училищната пиеса.,Той е проучил ролята внимателно.,Често репетираше репликите си.,На прослушването той се справи чудесно.,Боб беше много горд.,Боб се срамуваше много.,1
24,Джаки е назначена за наблюдател на осми клас.,Тя е завидна на целия клас.,Съучениците често застрашавали работата й.,Щели да откраднат пропуска на Джаки.,Директорът отстрани нейните шумни съученици.,На съучениците й бяха дадени награди за тяхното поведение.,1
25,Баща ми току-що си беше купил нова кола.,"За да го отпразнуваме, всички отидохме на разходка.","Друга кола премина знак ""Стоп"" и се блъсна в нас.","Ударих прозореца достатъчно силно, за да го счупя.",Излезнах и с баща ми всичко беше наред.,И двамата бяхме смачкани от колата.,1
26,"Племенницата ми обича филма ""Замръзнали"".",Винаги иска да я носи.,Тя обикаля къщата пеейки.,"Обича да крещи ""пусни го"".",Пее я отново и отново.,Обича спорта и мрази принцесите.,1
27,"Алекс се качваше на корта, а отборът му беше с две точки под него.","Погледнал на таблото и видял, че са останали само 5 секунди.","Умът му се разбърка, докато търсеше някой, който да му отвори устата.",Защитниците се прилепваха към съотборниците му като лепило.,Звънят и отборът му печели.,Опита се да хвърли три точки и пропусна.,2
28,Влязох в библиотеката и седнах.,"Когато се огледах, забелязах едно дете.",Той ме зяпаше известно време.,Бях разочарован и се изправих от мястото си.,Не ме интересуваше какво прави хлапето.,Попитах го какъв му е проблемът.,2
29,Ива и Брант се опитваха да заченат дете.,"Опитвали са се шест месеца, но без успех.",На срещата с лекаря те изразиха обезсърчение.,Но тогава видяха лекаря да се усмихва широко.,Брант ще отмени плановете си да отвлече дете.,"Двойката ще се зарадва да знае, че очаква бебе.",2
30,Катрин винаги е била заинтригувана от спортния вид кърлинг.,Катрин обича да гледа спортистите по телевизията.,Един ден Катрин реши да посети тренировка по кърлинг.,На тренировката един от атлетите покани Катрин да играе.,След това Катрин започнала да практикува всеки ден и се усъвършенствала.,"Катрин мисли, че кърлингът изглежда скучен.",1
31,Франсис винаги е искал да се научи да шофира.,"Най-накрая е достатъчно голям, за да получи шофьорска книжка.","Франсис учи много усилено, за да получи лиценз.",Той лесно преминава изпита си за шофьор.,Франсис е много горд с постиженията си.,"Франсис решава, че предпочита да използва обществен транспорт.",1
32,"Вчера се забавлявах да гледам ""Чудесника"".",Напълно ми хареса.,Танцьорите украсяваха сцената. Беше прекрасно.,За мен беше чест да видя шоуто.,Заклех се никога повече да не го видя.,Исках да го видя отново.,2
33,Събудих се за часа си в 8:30 сутринта.,Сънливо станах от леглото и се изкъпах.,Побързах да закуся и тръгнах към клас.,"След 50 минути занятия, започнах да се връщам към общежитието си.",Реших да се върна в клас.,"Когато пристигнах, си дремнах.",2
34,Гари искаше да привлече вниманието на Лиса.,Един ден той решава да напише на Лиса поема.,На следващия ден в училище Гари вижда Лиса в коридора.,Гари се усмихна на Лиса и й подаде стихотворението.,Гари удари Лиса здраво и си тръгна.,"Лиса признава, че също е влюбена в Гари.",2
35,Карлос винаги е искал да посети Франция.,"Решава, че трябва да научи френски, преди да замине.",Записва се за вечерен курс и учи много усърдно.,Карлос най-накрая говори френски доста добре.,Карлос резервира полет до Австралия.,Карлос използва френския си най-добре по време на пътуването си до Париж.,2
36,Ларс винаги е искал да опита фотографията.,"Приятелят му беше отличен фотограф, но никога не се е опитвал.","Един ден си купил проста, но качествена камера.",От този ден нататък Ларс снимаше снимки на природата всеки ден.,Ларс се влюби в фотографията.,Ларс мразеше фотографията.,1
37,Купих телевизор от магазин за електроника.,Това е голям плосък екран с високо качество на изображението.,"Служителят ме убеди да купя гаранция за него, за всеки случай.",Седмица по-късно телевизорът падна от стената и се счупи.,Успях да го оправя с гаранцията.,По-късно служителят е намерен мъртъв.,1
38,Раян беше в парка.,"И видя малко момиче, държещо балон.","Когато напускал парка, видял същия балон, заклещен в дърво.","Той се изкачи на дървото, за да вземе балона.",Раян е изпуснал балона нарочно.,"Раян намери момичето и й даде балона, който беше изгубила.",2
39,"Мениджърът й каза, че трябва да качи автобиографията си.","Тя осъзна, че не е форматирана правилно.",Прехвърли цялото съдържание в правилния шаблон.,"Добавя информация за последната си работа, и актуализира автобиографията си.",После го изпрати на мениджъра си.,Джен мразеше да мие чиниите.,1
40,Нийл обикаляше града на Фес.,Той опитал етническата им кухня.,После отиде да си купи сувенири.,"Той отбеляза, че във Фес има и страхотни улични изпълнители.",Нийл си прекара страхотно.,Нийл и Фез станаха най-добри приятели.,1
41,Трябваше да разходя кучето си.,Моят квартал изисква каишка.,Търсих по къщата си за каишката.,Не можах да го намеря.,Реших да заведа кучето си в задния двор.,Пуснах кучето си в къщата.,1
42,"Беше светъл, топъл ден.","Джо реши, че ще е хубаво да се разходим.",Решил е да отиде пеша до кафенето.,Но на половината път той започна да се уморява.,И той избяга в кафенето.,"Джо съжалява, че е излязъл навън.",2
43,Джен чакаше пакет цял ден.,Накрая видял човека на UPS да идва до вратата.,Той е донесъл пакета и тя го е донесла вътре.,Отворила е пакета с нож.,В кутията имаше новородено бебе.,Джен намери новия си палто в пакета.,2
44,Франк не искаше да си прави домашното.,Искаше да играе видео игри.,Родителите на Франк му казаха да си направи домашното първо.,Франк се разсърди и беше наказан.,Франк загуби видеоигрите си за седмица.,Франк има нова игра.,1
45,Тими се състезаваше в състезанието за 3 точки в училището си.,Победителят ще има шанс да спечели стипендия от 1000 долара.,Тими тренира да стреля три точки през целия уикенд.,"Беше готов, когато дойде денят на състезанието.",Тими спечели състезанието.,Тими отиде на пистата за състезания в деня на състезанието.,1
46,Дрейк е бил на парти в петък.,"Открил, че портфейлът му е бил откраднат от палтото му.","Дрейк веднага се обади на полицията, но портфейла не беше намерен.",Дрейк се обърна към домакина на партито за проблема.,"И домакинът му каза, че не знае.","Дрейк каза на домакина, че иска да присъства на партитата му отново.",1
47,"Боб откри, че камионът му е с спукана гума.",Никога преди не е сменял гума.,Извади джак и желязо.,Не можа да махне болтовете.,Боб се обади на някой да му оправи спукана гума.,Боб отиде с камиона си до пазара.,1
48,Джак се умори да пише имейли на таблета си.,"Решава, че трябва да инвестира в лаптоп.","Той проучва различни лаптопи, докато не намери перфектния.",Най-накрая го купува.,Сега Джак наистина се радва да отговаря на имейли.,Джак сега използва пощенската услуга вместо електронната поща.,1
49,Косата на Джейк стана твърде дълга.,Имаше интервю за работа.,Помоли майка си да му подстриже косата.,"Майка му го подстригнала добре, за да изглежда професионално.",Джейк си е измил ръцете.,Джейк получи работата.,2
50,Шон дойде днес.,"Сам, Шон и аз си играехме игрички.","Започнаха да ми се сърдят, че съм толкова лоша.","Казаха, че не мога да играя повече, докато не се оправя.",Бях много наранен.,Наистина ми беше приятно.,1
51,Сара искаше да изпрати картичка.,Отиде до пощата.,Тя плати за марки.,Тя сложи писмото в плик.,Сара сама достави писмото си.,Писмото на Сара скоро стигна до местоназначението си.,2
52,Чък беше уморен от работа.,Затворил е за известно време.,"Той отвори форума, за да си поговори с колегите.","След тези лоши удари на Золтар, той се нуждаеше от почивка.",Чък реши да напусне работата си.,След това се почувствал принуден да се върне на работа.,2
53,Боб използваше пластмасови торбички за пазаруване.,"Тогава приятелят му му казал, че пластмасата е вредна за околната среда.",Боб реши да се откаже от пластмасовите си торбички.,Боб инвестира в няколко многократно използваеми торбички за хранителни стоки.,Боб използваше многократно използваните си торбички за пазаруване.,Боб продължаваше да използва пластмасовите си торбички за пазаруване.,1
