,input_sentence_1,input_sentence_2,input_sentence_3,input_sentence_4,sentence_quiz1,sentence_quiz2,answer_right_ending
378,Дан се прибираше от училище и видял витрината.,Имаше влак в прозореца на магазина.,Дан толкова много искаше да притежава този влак.,"Когато Дан се прибра вкъщи, майка му му каза, че има изненада.",Тя даде на Дан влака.,Майката на Дан му каза да се приготви за училище.,1
379,Джина искаше да открадне ключа от къщата на майка си.,"Тя изчака, докато майка й си дремне.",Взела е чантата на майка си в банята.,Тя тихо извади ключа от веригата.,"Тогава Джина сложи чантата там, където я намери.",Тогава Джина каза на майка си къде е ключът.,1
380,Имаше един мъж от Кентъки.,"Той обичаше момиче, което живееше в Луизиана.","Решил е, че трябва да се премести.","Той се премести, за да бъде с любовта си.",Премести се в Тексас.,Мъжът се премести в Кентъки.,2
381,Тим се проваляше по математика.,"Знаеше, че ако не премине, ще трябва да отиде на лятно училище.",Учил е много и е искал допълнителни кредити.,"В последния ден на училището той разбра, че е преминал!",Тим беше развълнуван.,Тим беше ужасно разочарован.,1
382,Мери-Ан се чувстваше самотна и реши да осинови котка.,"Отиде в местното хуманно общество, за да започне процеса.","Докато гледаше, една от котките й маях.",Мери-Ан разцели котката и беше любов от пръв поглед.,"Реши, че не е точната котка.",Взела е котката вкъщи.,2
383,Като дете съм правила гимнастика.,Учих се да балансирам и да правя движения с нея.,"Когато се обърнах с лъча, се приземих погрешно.",Счупих си глезена и толкова много ме болеше!,Бързо ме отведоха в болницата.,Станах и се върнах на балансовата греда.,1
384,"Имаше шест кученца, които се разхождаха из фоайето ми.","Щеше да е трудно да изберем това, което искаме да купим.",Всяка от дъщерите ми избра различно кученце.,"Собственикът каза, че можем да получим отстъпка за две кучета.",Всеки си купи по едно куче.,Не харесвахме кучетата.,1
385,Джони искаше да се отърве от живота си в големия град Бостън.,"Решил е, че ще е по-щастлив в сърцето на Америка.","Най-накрая денят настъпи, Джони се премести в Айдахо.",Той бе избягал от големия град.,Джони започна да планира да се премести в Бостън.,Джони беше щастлив да бъде в малък град.,2
386,Джоан мразеше да се прибира за Коледа.,"Знаеше, че майка й ще я преследва за любовния й живот.",Тази година на път за вкъщи е претърпяла автомобилна катастрофа.,"Майка й се втурнала към нея, за да се погрижи за нуждите й.","Майката на Джоан не говореше с нея, защото беше неомъжена.","Джоан се почувства добре, като видя лицето на майка си.",2
387,Прекарвам цялото си време в писане.,В резултат на това започнах да се чувствам доста самотна.,Реших да се присъединя към онлайн общност за запознанства.,"Когато се присъединявам, осъзнавам, че не харесвам особено другите хора.",Започнах да пиша повече.,Имах много срещи.,1
388,Дъщеря ми беше скаут в началното училище.,Един ден тя отиде на една нощна екскурзия.,Жена ми беше придружител.,Всички останаха в хижа в Ню Хемпшир за уикенда.,Дъщеря ми никога не забрави екскурзията си.,Със съпругата ми вечеряхме тази вечер.,1
389,Днес беше откриването на нов клуб зад ъгъла.,Нямах търпение да дойда.,"Когато влязохме в клуба, беше прекрасно.",Поръчахме вкусна храна и танцувахме.,"Сприятелихме се с изхвърляча, за да влезем в клуба утре.",Изхвърлячът не ни пусна в клуба.,1
390,Вчера носех нова чаша в кухнята.,"За моя изненада, аз го изпуснах.",Стъклото се разби.,Трябваше да го взема.,Нарязах се на малко парче.,Харесва ми как стъклото изглежда сега.,1
391,Семейството на Бил живеело на хълм.,Там никога не валеше или бушуваше.,Един ден торнадо премина през района.,"Къщата на Бил е била ударена, и покривът е бил откъснат.",Застрахователната компания покрива разходите за нов покрив.,"Решиха, че не им трябва и се преместиха.",1
392,"Алисън реши, че иска да научи повече за историята на района.",Отиде в библиотеката да прочете книга за това.,Влязла е вътре и не е могла да разбере как са подредени книгите.,"Намери библиотекар, който обясни десетичната система на Дюи.",Това й помогна да разбере коя кола не иска.,"Това й помогна да намери това, което искаше.",2
393,Себастиан искаше да играе футбол в отбора на приятелите си.,"Говорил е с приятеля си и е разбрал, че трябва да ходи на тренировка.",Цяла седмица тренираше да хване топката вкъщи.,Отиде на следващата тренировка и отбеляза тъчдаун.,Себастиан беше разочарован от успеха.,"Себастиан беше щастлив, че тренировката му се отплаща.",2
394,"Имало едно време една майка, която отчаяно искала бебето й да заспи.","Тя го разхождаше, но той не спи.","Хранила го е, но той не е спал.","Най-накрая си спомни коленената песен, която майка й й беше пела.",Майката нежно пееше люлката на бебето си.,Майката свири хип-хоп на бебето си.,1
395,Джони пишкаше в басейни като дете.,"Мислеше, че може да го направи като възрастен.",Заведе децата си в аквапарка.,След това се изпика в басейна.,Някои хора забелязаха и Джони се забърка в неприятности.,Всички бяха много щастливи заради поведението на Джони.,1
396,Ейми гледаше как другите деца си играят и се взираше в инхалатора си.,Поради астмата не може да спортува.,Почувства ръката на учителя си по изкуство на рамото си.,"Учителят й се усмихна и каза на Ейми, че един ден ще стане велик художник.",Ейми се чувстваше много по-добре.,Ейми се почувства ужасно.,1
397,Джо и приятелите му играха футбол днес.,Джо беше нервен.,Беше нервен дали ще спечели или не.,"Накрая, след мача, отборът на Джо спечели.",Джо се гордееше с отбора си.,Джо беше много разочарован от отбора си.,1
398,Марк имаше важно интервю за нова работа.,"Той се подготвяше за въпросите, които може да зададат.",Интервюиращият изглежда бил впечатлен от отговорите на Марк.,"Интервюиращият информира Марк, че е получил работата.",Марк беше много щастлив.,Марк се ядоса и излязъл.,1
399,Илейн не искаше да готви тази вечер.,Затова Илейн решила да излезе да яде.,Но Илейн не знаеше къде иска да яде.,Илейн обмисляше къде да отиде почти час.,На Илейн не й беше трудно да вземе решение.,На Илейн й беше трудно да вземе решение.,2
400,Сам се опитваше да влезе в колежа на мечтите си.,Прекарал е много време да попълва заявлението.,Това го кара да се чувства добре за академичните си постижения.,Той подаде молбата.,3 месеца по-късно той получава писмо за приемане.,Никога повече не си го помисли.,1
401,Мат реши да отиде да се разхожда с приятелите си една вечер.,Пили са три питиета в един бар.,"Отидоха на още четири, пиейки по три шота във всяка.",Мат се напи и загуби телефона си.,Мат и приятелите си се прибраха и си преспаха.,Мат не се интересуваше от липсващия телефон.,1
402,Бинду планираше парти с приятелите си.,"Срещнаха се в дома й, за да обсъдят какво да ядат и какво да използват.",Един от приятелите на Бинду донесе самоса и дог.,Четирима приятели пуснаха музика на партито.,Всички се забавлявахме.,Бинду мрази приятелите и партитата си.,1
403,Тайлър се събужда и трябва да се изкъпе преди училище.,Малкият му брат използва душ.,"Тайлър се притеснява, че ще изпусне автобуса.",Най-накрая е редът на Тайлър да се изкъпе.,"Тайлър е направил кексчета, за да покаже уменията си.",Тайлър взема бърз душ и стига навреме до автобусна спирка.,2
404,Томас се чувстваше незабелязан напоследък.,Отиде при лекаря си за преглед.,"Лекарят му каза, че холестерола му е малко висок.",Томас започна да се храни здравословно и да се разхожда.,"Диагностицирали са му диабет, след като е напълнил 10 килограма.",Лекарят му беше много доволен от следващия преглед.,2
405,"Звъняха на вратата, но нямаше никой.",Тя не беше сигурна дали да отвори вратата или не.,Бавно тя скрипна отваря вратата и се вгледа навън.,Брат й скочи и я изплаши.,Решила е да гледа любимото си комедийно шоу в Netflix.,Тя крещя и отблъсква брат си.,2
406,Стефани искаше да направи ябълково пюре.,Решила да отиде до пазара да вземе вкусни ябълки.,"Докато вървеше през градината, се спъна и падна.",Счупи си и двете китки.,Стефани се избута с ръцете си.,"Стефани не можеше да стане, докато някой не я намери.",2
407,Рой не можеше да разбере защо апартаментът му мирише толкова зле.,"Приятелите му го коментираха, когато отидоха.",Всички решиха да търсят източника.,"Оказа се, че е стара риба в хладилника.",Рой реши да остави рибата в хладилника.,Рой изхвърли стария рибар и всичко мирише по-добре.,2
408,Джими е израснал в бедност.,"Но родителите му винаги правели всичко възможно, за да се грижат за него.","Когато той влезе в добър колеж, те работиха на две работни места, за да си го позволят.","Когато завърши, искаше да покаже благодарността си.","И така, той им върна парите за колежа.",Джими се обади на родителите си и ги прокле.,1
409,"Джил се изненада, когато красив мъж я покани на танците.","Докато съквартирантите й се приготвяха, Джил се разтревожи за косата си.","Съквартирантите на Джил казаха, че могат да помогнат.",Джил се облече в бялата си рокля.,Пристигна и комплимент за външния й вид.,Джил и приятелите й се забавляват само с момичета.,1
410,"Собственикът на бар сложи голям плакат, за да рекламира бара си.",Вятърът беше силен и отнесе знамето.,Собственикът го преследва през целия град.,Приземи се в задния двор на една стара жена.,Старицата отказа да върне знамето.,"Старата жена се зарадва, че е намерила кожено палто.",1
411,"Майка ми има рецепта за тиквени батончета, която много ми харесва.","Веднъж ми ги направи, защото имах лош ден.",Ядох тиквени плочи и се почувствах много по-добре.,"Решетките ми напомняха, че майка ми се грижи за мен.",От този ден не съм яла тиквени батончета.,По-късно в живота си правех тиквени батончета и те ми напомняха за майка ми.,2
412,Тим реши да прекарва повече време с дядо си.,"Дядо му обичаше да гледа птици, затова Тим гледаше с него.",Те отбелязват забележителностите си в бележник.,Скоро Тим наистина прояви интерес!,"Тим реши, че вече не се интересува от птици.","Тим и дядо му намериха хоби, което им хареса.",2
413,Дани е работил в местния магазин за сладолед това лято.,"Беше много развълнуван, че е започнал първата си работа.",В първия си ден едно малко момче изпуснало сладоледа си на пода.,"Без да се колебае, Дани знаеше какво да прави.",Той му даде още една лъжица сладолед.,Той отказа да му даде още една скуп.,1
414,"В училището звъни камбаната, когато часовникът удари 2 часа.","Джина никога не е била по-щастлива, за да свърши деня.",Тя си взе нещата и изчака Тами на вратата.,Но Тами заминаваше с Рита и Мери.,"Джина се чувстваше самотна, когато се прибра.",Джина благодари на Тами на следващия ден.,1
415,Лорънс и семейството му решили да се преместят.,Първо си събраха мебелите.,След това са опаковали всичко останало.,Всички вещи са били преместени в микробуса.,Лорънс и семейството му се прибраха в новия си дом.,Лорънс е върнал всичките им вещи в къщата.,1
416,Джой искаше да намери перфектната черупка за раците си.,"Може да си купи, но ще е по-специално, ако я намери.",Цяла сутрин е претърсвала плажа.,"Всичко, което може да работи, е счупено!",Все пак трябваше да си купи черупка.,Затова тя донесе един вкъщи и го даде на раците си.,1
417,Уестин се омъжваше!,Искаше сватбата му да мине перфектно.,Всичко мина добре до вечерта.,Някой се е напил и е паднал в тортата!,Уестън е отрязал перфектната част от тортата.,Уестън и жена му изритаха пияното лице.,2
418,Джо помагаше на баща си да изчисти гората в задния двор.,Изведнъж чу силно бучене.,Той е разбунил пчелното гнездо.,"Ужил се е шест пъти, преди да успее да избяга.",Джо се засмя на това преживяване.,"Джо беше ядосан, че е бил ранен.",2
419,Беше есен.,Дворът на Тод беше пълен с листа.,"Решил е, че трябва да ги събере всичките.","След като свърши, ги сложи в торба.",Тод ги изхвърли в боклука.,Тод отвори торбата и разнесе листата наоколо.,1
420,Тим мечтаеше да стане бодибилдер.,"Тренираше всяка вечер, за да постигне целта си.",Трудът му се отплатил и той спечели място в популярен конкурс.,"Показа уменията си, вдигайки повече от 250 паунда.",Тим беше много решен.,Тим нямаше много решителност.,1
421,Хенри вървеше към класа си.,В същото време се опитваше да изчисти монитора си с кърпа.,"За съжаление, някой се е блъснал в него.",Телефонът му падна от ръката му и падна на земята.,Човекът се извини на Хенри.,Хенри беше щастлив и благодарен.,1
422,Тами реши да присъства на пробите по волейбол.,"Тя беше само в осми клас, но знаеше, че е добра.",Тя играеше здраво и даде всичко от себе си.,"Не очакваше, че другите играчи ще са толкова добри, колкото нея.",Тами влезе в баскетболния отбор.,"Всички играчи бяха добри, но тя влезе в отбора.",2
423,Боб и Джим играеха топка в къщата един ден.,Те преобърнаха вазата и тя се разчупи на много парчета.,"Страхуваха се, че майка им ще се ядоса на тях.",Намерили са лепило и внимателно са залепили вазата.,"Майка им се наслаждаваше на новата си, счупена ваза.",Лепилото е държало вазата заедно и майка им никога не е разбрала.,2
424,Стив беше много тъжен.,Приятелката на Стив го е напуснала.,Решил е да й напише песен.,Той изля сърцето си в песента.,Стив се чуди дали ще се съберат отново.,"Стив е карал час, за да отиде в стриптийз клуб за наркотици.",1
425,Глория искаше да купи цветя за съпруга си.,Глория беше шокирана от цената на дори половин дузина лилии.,Глория решила да събере някои от цветята от градината.,Тя събра няколко нарциси и хризантеми.,Скоро след това Глория подала молба за развод.,Съпругът на Глория оценил жеста.,2
426,Джош играеше баскетбол всеки ден.,Целта му беше да може да прави всяка кошница на корта.,Един ден някой го предизвикал на състезание.,Който направи най-много изстрели ще бъде победителят!,"Джон избяга, крещейки от ужас.",Той направи най-много удари и спечели състезанието.,2
427,Лорън винаги е искала да носи панталони на партита.,"Но трябва да отслабне, за да изглеждат добре тесните дънки.",Лорън започва да прави тежки упражнения.,"Най-накрая тя отслабна достатъчно, за да носи панталони.",Носеше ги гордо на следващото парти.,Тя ревнуваше.,1
428,Ходих на Хаваите в гимназията.,Целият ни клас на оркестъра беше там.,Отне ни 9 часа да летим до там.,Беше тропически рай.,"Реших, че искам да ходя повече на Хавай.",Хаваите не бяха добро място за пътуване.,1
429,"Сони живееше в Тексас, и беше горещо лято.",Беше му писнало от жегата.,Решил да намери начин да се охлади.,В началото не можеше да си помисли за нищо.,Решил е да си включи отоплението.,Тогава той реши да скочи в басейна си.,2
430,Чад беше невероятен певец.,Просто се страхуваше да пее.,"Искаше да се присъедини към църковния хор, но мислеше, че приятелите му ще му се присмеят.","Заради това, че се срамува от уменията и страстта си.",Чад се осмели да изпълни ролята си.,"Вместо да се смеят, всички аплодират, когато Чад най-накрая пее.",2
