,input_sentence_1,input_sentence_2,input_sentence_3,input_sentence_4,sentence_quiz1,sentence_quiz2,answer_right_ending
753,"Приятелката ми иска да стане лекар, затова е взела изпита.","Първият път, когато я взе, не получи достатъчно добър резултат.",Учила е много усилено и е взела отново.,Този път се справи много добре!,Тя никога повече не го обсъжда и не става лекар.,"Изведохме я на питие, за да го отпразнуваме.",2
754,Кели отиде да се отпусне в океана.,Тя веднага отиде и сложи краката си в.,"Но когато стъпи, вълната я хвана.",Дрехите й са се намокрили.,Кели се прибра да се преоблече.,"Кели беше много щастлива, че имаше мокри дрехи.",1
755,Бен беше развълнуван да отиде на риболов с дядо си за първи път.,Но за него беше отвратително да хваща червеите на куката.,Той случайно си е прободил пръста с една от куките.,"Бен скоро разбрал, че риболовът не е за него.",Бен попита дядо си кога ще могат да отидат на риболов.,Бен попита дядо си дали може да гледат филм вместо това.,2
756,Амелия се готвеше за среща в хубав италиански ресторант.,Приятелката на Амелия я е уредила за среща на сляпо седмица преди това.,Тя пристигна в ресторанта по-рано и изчака датата си.,"Минаха 30 минути, а гаджето й не се появи.",Амелия се върна у дома.,Амелия беше много щастлива.,1
757,Майката наистина искаше да си направи снимка на момчето с Дядо Коледа.,Момчето се уплаши и отказа.,"Майката казала на момчето, че Дядо Коледа носи подаръците.",Това променило решението на момчето.,Момчето се надяваше да получи много подаръци от Дядо Коледа!,"Момчето си тръгна, без да му направят снимка.",1
758,Стюарт се опита да довърши любимата си задача преди да си легне.,"Толкова се е впуснал в това, че е забравил да поддържа огъня.","Треперещ, той си обгърна куп одеяла около себе си.",Той стана много топъл и доволен.,"Когато се събуди, беше студено.","Стюарт се радваше, че не забрави да поддържа огъня.",1
759,Антъни искаше да се научи да говори испански.,Намерил е курс по испански онлайн и се записал.,Антъни се стараеше да учи и в крайна сметка научи езика.,Антъни говори испански свободно.,Антъни стана успешен заради езиковите си способности.,Антъни не можеше да се справи с езика.,1
760,Ейми отиде в хранителния магазин след работа.,"Имаше малък списък с неща, които да купи.",В магазина нямаха половината стоки.,Ейми трябваше да отиде в втори магазин.,Купи две поли и блуза.,След това тя можеше да се прибере вкъщи и да приготви вкусна храна.,2
761,Джоани се приготвяше да си изсуши косата за среща.,"Разстроена е, че е намерила изчезнала сушилнята си.",Тогава Джоани чу познат звук отвън.,Видя брат си да използва сушилнята.,Джоани беше доволна от брат си.,Джоани изтича навън да се изправи срещу брат си.,2
762,"Корнелия решава, че иска да пренареди апартамента си.",Леглото й е било до стената в продължение на много години.,"Корнелия премества леглото си, за да седне до прозореца.","Когато приятелите й видят новия й аранжман, те го обичат.",Корнелия преместила леглото си на мястото му.,Скоро всичките й приятели си бяха подредили леглата по същия начин.,2
763,Тим обичаше мотора си.,"Карал се е, когато е можел.","До миналата седмица, когато се разби.",Сега почти никога не я кара.,"Тим се чувства в безопасност, когато кара мотоциклета си.",Тим се страхува да кара мотоциклет.,2
764,Уенди си намери първата работа като медицинска сестра в старчески дом.,Тя наистина обичаше работата си и се свързваше с стажантите.,Тя наистина се наслаждаваше да говори с една малка стара дама.,Един ден жената й показала снимки на децата си.,Уенди изтича от стаята плачейки.,Уенди се наслаждава на снимките.,2
765,Том и Джейк отидоха на концерт.,"Те гледаха една група, която обичат.",Отидоха в общата приемна зона.,"Някои много високи хора стояха, така че не можеха да видят нищо.",Том и Джейк не можеха да видят любимата си група.,Том и Джейк се наслаждаваха на хубавата гледка.,1
766,"Лестър се гордееше, че е прекарал години без мобилен телефон.","Той обичаше да мисли, че е по-малко зависим от технологиите от другите.",Но един ден колата му изпукна и той пожела да има телефон.,Не искаше да има подобно преживяване отново.,Лестър продължи живота си без мобилен телефон.,"Лестър си купи най-добрия мобилен, който можеше да си позволи.",2
767,Бен се нуждаеше от смяна на маслото в колата си.,"Знаеше, че са доста скъпи.",Тогава видя купон в вестника.,Бен го извади и го занесе в гаража.,Бен успя да смени маслото.,Бен продаде бъбрека си за крек.,1
768,Събудих се гладен.,"Налях си чиния зърнени закуски, но открих, че нямам мляко.","След като помислих да използвам вода, реших да отида до магазина.",Отидох до ъгъла и взех половин галон 2%,Дойдох вкъщи и ядох зърнени закуски.,Дойдох вкъщи и ядох пица.,1
769,Ана имаше аквариум със солена вода.,Тя държеше само корали в нея.,"После реши, че иска и риба.",Купи няколко малки рибки-клоун и спусъци.,Анна скоро върна рибата в магазина.,Сега Анна има различен резервоар с риби и корали.,2
770,"Холи беше красива черна котка, която Лий обичаше много.","За съжаление, Холи се разболя и Лий трябваше да я приспи.","Лий беше много тъжен, че липсва на Холи всеки ден.","Един ден малко след това, малко черно коте се появи на задната врата на Лий.",Лий реши да осинови кученце.,Лий реши да осинови котето.,2
771,Боб се нуждаеше от нов чифт чорапи.,"Отиде в местния универсал, за да ги купи.",Магазинът имаше голяма разпродажба.,Той се озовава да купува много хубави неща.,Боб наистина се наслаждава на шопинг пътуването си.,Боб върна всичко на следващия ден.,1
772,Младият Реджи обичаше да играе и да гледа американски футбол.,Любимият му играч беше бегачът Джамал Луис.,Той беше на летището със семейството си и видя героя си.,"Той отиде при него и му каза, че също ще играе професионален футбол.",Джамал Луис му даде лични съвети и му пожела най-доброто.,Реджи му каза да стои далеч от него.,1
773,Ела намери малък робин на земята.,"Знаеше, че е паднало от гнездото си.",Тя внимателно го е опаковала и го е направила безопасен дом.,После го хранила с червеи.,Обичаше да се грижи за робина.,Но тя не искаше повече робин.,1
774,Взех решение да напусна работата си.,Написах си оставката.,Тихо отидох в офиса и го предадох.,Напуснах работата си.,"Сега съм свободен да следвам кариера, която ще ме направи щастлив.",Утре се връщам на работа.,1
775,Сложих черната пластмасова роза във ваза с вода.,Оставих го на шкафа си за няколко седмици.,Десет души ме попитаха за това.,"Искаха да знаят защо имам поливано, фалшиво цвете.","Честно казано, и аз не знаех защо.",След няколко седмици цветето умряло.,1
776,Бен реши да си вземе кафе.,Платил е за кафето с дебитна карта.,"По-късно банката му се обади, че е направил превишение.","Обясниха му, че трябва да плати 30 долара.",Бен беше разочарован от допълнителната такса.,"Бен беше щастлив, след като получи обаждането от банката.",1
777,Крис беше на втората си почивка тази седмица.,"Разхождайки се из летището, той реши да използва това време.",Инсталирал е приложение на телефона си и започнал да практикува френския си.,Друг клиент на летището го е чул и му е предложил помощ.,Покровителката помогна на Крис да научи френски.,"Патрона не разбра Крис, защото говореше само китайски.",1
778,"Когато бях дете, Google започна за първи път.","Помня, че попитах баща си как да ползвам сайта.",Той ми показа как да пиша и търся каквото искам.,"Бях завладяна и прекарвах всеки ден на бюрото си, забавлявайки се.",Научих много от Гугъл.,Много бързо се ядосвам.,1
779,"Джеф беше кандидат за повишение, за което трябваше да направи интервю.","Прибра се и се учи много усърдно, запаметявайки отговорите си.","Той се подготвял много дни, докато не се почувствал готов за интервюто.",Той отиде на интервюто и го премина с отличие!,"Беше доволен, когато му дадоха повишението.","Осъзна, че трябва да напусне работата си.",1
780,Риц се роди в голямо кошарче от 12 други кученца.,"Когато беше на осем седмици, го дадоха на едно прекрасно семейство.",Те го отгледаха добре и той водел много щастлив живот.,"Нещата се промениха един ден за Ритц, когато собственикът му получи рак.",Риц останал сирак и бил изпратен в приют.,Собственикът му започнал да тича по 12 мили на ден.,1
781,Миа обичаше да е навън.,Едно лято реши да се катери по планината.,"Тя се присъедини към един клуб от хора, които се катерят заедно.",Изкачили са най-високата планина в района.,Миа си прекара страхотно.,Миа искаше да е вътре.,1
782,Шефът на Фред го повика в офиса на бензиностанцията.,"Каза на Фред, че времето е тежко и трябва да бъде уволнен.",Фред се ядоса много.,Хвана шефа си за яката и го хвърли на земята.,Шефът на Фред го прегърна.,"Колегата на Фред, която го е видяла да напада шефа си, е извикала полиция.",2
783,Сестра ми се опитва да спести пари.,"Тя е скоро вдовица, живееща на пенсия.",Наскоро върна две от три кабелни камери.,"Казах й, че антените работят добре, след като предаванията са в HD.",Купи още кабелни кабели.,Тя се зарадва да чуе това.,2
784,"Виктор винаги се гордее с това, че опитва нови храни.",Но никога не е ял фисташки.,"Един ден купува буркан с фистаци, за да ги яде вкъщи.",Той обича как те вкус.,Виктор решава да купува фистаци редовно.,"Виктор осъзнава, че е забравил пуловерката си в салона.",1
785,Шарон е пазила торба с неизвестни семена в продължение на години.,Един ден решила да засади семената.,"Шарън ги е сложила в плантатори, мислейки, че ще са малки растения.",Шарън не можеше да е по-грешила в предположението си!,Тя отвори бира и взе глътка.,В крайна сметка станаха огромни растения.,2
786,Беше прекрасен ден.,Емили искаше да се възползва от чудесното време.,Тя реши да отиде в парка.,"Емили беше разочарована, когато разбра, че колата й не иска да запали.",Помоли съседката си да я пусне.,"Тя закара колата си до механика, за да я прегледа.",1
787,Том беше уморен от ежедневието.,"И така, той реши да се махне от мрежата.","Първата му седмица беше наред, но скоро му свърши водата.",Страдал е два дни и все още не е успял да намери.,Накрая Том се върна в мрежата.,Том обичаше идеята за пост.,1
788,Тим искаше да учи астрономия.,Искаше да отиде в космоса.,"Но той беше твърде млад, за да бъде астронавт.",Тази новина го натъжи.,"Тим се е трудил много в училище, за да стане такъв.",Тим мразеше Марс.,1
789,Сестра ми работи в център за възрастни.,Тя е сервитьорка.,"Тя ни даде календар, издаден от центъра.",Показала е как е облечена за Деня на Свети Патрик.,"Всички мислехме, че сестра ми изглеждаше много смешно облечена по този начин.",Сестра ми криеше нещо от нас.,1
790,"Фред реши да купи акции на ""Епъл"".","Цената на акциите е била 90 долара, когато той ги е купил.","За щастие, вчера са имали добри приходи.",След това акциите се повишиха до 100 долара.,Фред съжаляваше за покупката си на акции.,Фред беше много щастлив.,2
791,Джен беше толкова уверена в подготовката си за състезанието по правопис.,През последния месец всяка вечер изучаваше речника.,"Когато започна Пчелата, Джен оцеля, докато другите бяха нокаутирани.",Всичко се свеждаше до финалните две и противникът на Джен се беше объркал.,Джен спечели състезанието по правопис!,Джен загуби състезанието по правопис.,1
792,Кели не е напускала апартамента си от години.,"Ходих при нея днес, за да я поздравя.","Можех да кажа, че не искаше да ме пусне.",Говорихме за нея.,Кели обича да има гости.,Кели е агорафобична.,2
793,Емили беше на плажа.,Времето започна спокойно.,Изведнъж вятърът започнал да се усилва.,Ана беше хваната в страшна пясъчна буря!,Прекаляла е чудесно на плажа.,"За щастие, тя успя да се върне в къщата на плажа.",2
794,Андрю никога не е имал проблеми.,Родителите му бяха извън града за седмица.,Приятелите на Андрю дойдоха и искаха да пият.,"И така, Андрю взе тайното съкровище от алкохол на родителите си.",Андрю искаше родителите му да имат алкохол.,Те пиха алкохол и се напиха.,2
795,Елън живееше в провинцията.,Липсват й дните без ток.,"Един ден в града, където живеела, изчезнала електричеството заради ледена буря.",На нея й стана много студено.,"Беше щастлива, когато захранването се върна.",Елън беше напълно комфортна.,1
796,Хосе беше развълнуван.,Той току-що си беше купил нов скейтборд и искаше да го пробва.,Заведе я направо в скейтпарка.,Цял ден се пързаля.,Хосе се забавляваше в скейтпарка.,Хосе изхвърли скейтборда си.,1
797,Майк седеше на бюрото си.,Но изведнъж почувства странно сърбеж на ръката си.,И краката му започнаха да го сърбят.,И лицето му.,Майк получи инсулт.,Майк започна да се смее истерично.,1
798,Джил замина на пътешествие миналия месец.,Искаше да пътува от Бостън до Сиатъл.,"По средата на пътя, колата й се счупи.","Прекарала е часове на пътя, чакайки ААА.","Джил се зарадва, че са пристигнали толкова бързо.",Поправихме колата и я изпратихме.,2
799,"Директорът обяви, че в петък ще има училищен бал.",Мери се вълнуваше от танците.,Искаше Дан да я покани на училищния бал.,"Дан видя Мери в коридора и й каза, че трябва да говори с нея.","Обвинява я, че е откраднала колелото му.","Беше щастлива, че я е поканил на танците.",2
800,"Откриха нов магазин на ""Органик Авеню"" в Ню Йорк и аз го проверих.","Бях много развълнуван да го пробвам, защото никога не съм ходил преди.","Когато влязох, имаха невероятни салати и сокове за пробване.",Опитах лятна салата и кокосова вода.,Реших никога да не се връщам в този ресторант.,Това беше новият ми любим ресторант.,2
801,Стаята на Синди имаше бели стени.,"Но тя се оплакваше, че отразяват твърде много светлина.",Затова реши да си боядиса стените сини.,"Тя си мислеше, че нейната стая е по-спокойна.",Тя го мразеше и го смени с черна боя.,Тя беше доволна от резултатите.,2
802,Тази година за първи път се присъединих към футболна лига.,"Присъединих се към групата на приятеля си, защото им трябваше още един човек.",Никога не съм играл преди в живота си.,В крайна сметка спечелих първото място!,Бях много развълнуван.,Бях много разочарован.,1
803,Хелън стана рано за работа.,"Снежи снощи, така че трябваше да изкара колата си.",Отне й час да изчисти снега.,"Връщайки се в къщата, за да се приготви, тя чула познат звук.",Тя беше оставила душовете отворени.,Хелън отиде до езерото да наеме джет-ски.,1
804,След щатското баскетболно първенство репортерите интервюираха отбора.,Дан попита дали е било на живо или записано.,"Журналистът го информира, че е живо шоу.","Дан каза пред камерата, че баща му е бил вдъхновение за него.",Дан се възхищаваше на баща си.,Дан се срамуваше от баща си.,1
805,Джереми има силна и отличителна личност.,Имаше проблеми с работата и го уволниха.,Той каза някои нелестни неща на мениджъра си и колегите си.,Оттогава му е трудно да си намери работа.,Джереми има труден начин за работа.,Поведението на Джереми е идеално за работното място.,1
