,input_sentence_1,input_sentence_2,input_sentence_3,input_sentence_4,sentence_quiz1,sentence_quiz2,answer_right_ending
1127,С момчетата ходихме на плажа днес.,Взехме фризби и топка.,"Докато играехме във водата, някои други хора се присъединиха към нас.",Беше страхотно да се запознаеш с нови приятели.,Наистина се наслаждавах на запознанствата с новите момчета.,"Като цяло, беше страхотен ден за пешеходен поход.",1
1128,Беше петък вечер и реших да наема филм.,"Отидох в ""Редбокс"" да взема една.","След като ми отне час да реша, най-накрая избрах ""Отшелниците"".","Прибрах се вкъщи, направих си закуски и отидох да пусна филма.","Беше най-добрият филм, който бях гледал от много време.",Взех душ и отидох на работа.,1
1129,Пола е написала много поезия.,"Приятелите й я подкрепяха, въпреки че беше зле.",Поканили са я на парти.,Пола започна да говори.,Приятелите й аплодирали поемата й.,Пола разкъса стихотворението си.,1
1130,"След като слязох от училищния автобус, осъзнах, че телефонът ми липсва.","Тъй като имаше услуга, реших да я отменя.",Представителят на обслужването на клиенти го направи вместо мен.,"Освен това, той каза, че е имало обаждане направено в Ямайка.","Знаех, че някой я е откраднал.","Знаех, че някой скоро ще върне телефона.",1
1131,Днес беше петият рожден ден на Айрис!,Майка й й беше организирала парти изненада.,Всички нейни приятели бяха там.,Отворила е подаръци и е хапнала торта.,Айрис се забавляваше на партито си.,Айрис реши никога повече да не яде торта.,1
1132,"Тина винаги носеше червено бикини, когато ходеше на плажа.",Тя беше известна с това и всеки очакваше да я види в една.,Един ден тя се срещна с приятелите си в синьо бикини и ги изненада.,Не можеха да разберат защо тя е облечена по друг начин.,Харесаха новото бикини.,Приятелите на Тина знаеха колко непредсказуема е била.,1
1133,Тед винаги е мечтал да бъде собственик на къща.,"Но се страхувал, че това е цел, която никога няма да постигне.","Един ден баща му го изненада, като каза, че ще помогне на Тед.",Бащата на Тед помогна да разделим авансовото плащане за дом с Тед.,"Тед каза, че не иска да бъде собственик на къща повече.",Тед беше благодарен на баща си за помощта.,2
1134,Иви се скиташе в замъка с часове.,Тя изследва всеки ъгъл и кът на структурата.,Началниците й я разпитвали за наученото.,Отговори на въпросите им блестящо и лесно.,Гордее се със себе си.,Тя избяга в ужас.,1
1135,Ед и близнакът му Итън търсеха жени онлайн.,После видяха профил на две близначки.,Обадиха се на Сами и Сара и уредиха среща.,"На срещата си, и четирите си прекараха чудесно.",Години по-късно и двете двойки се ожениха.,Решиха да не се виждат повече.,1
1136,Марко започва нова работа днес.,Иска да изглежда добре в първия си ден.,Марко решава да си сложи вратовръзка.,Новият му шеф е впечатлен от това колко добре изглежда.,"Марко се радва, че е направил добро впечатление.",Марко е ужасен от реакцията на шефа си.,1
1137,Тим искаше да пътува в чужбина.,Никога не е летял с самолет.,Решил е да пътува до Китай по въздух.,Той наистина се наслаждава на полета!,"Тим се закле, че никога повече няма да се качи на друг самолет.",Тим започна да пътува на много места с самолет.,2
1138,Луси имаше тест утре в училище и едва се е учила.,Беше вече много късно и тя трябваше да си легне.,Училището беше затворено заради снега.,Люси имаше късмет и прекара целия си ден в учене за теста.,Луси е издържала теста.,"Луси не е издържала теста, защото не е учила.",1
1139,Фред обичаше мистериозни романи.,Преди четеше поне по един всеки месец.,"Когато приятелите му разбраха, всички му купиха подарък за рождения му ден.","Но за съжаление, той започна да се дразни от вниманието.","Фред каза на приятелите си, че си прави почивка от мистериозните романи.",Фред е създал клуб за книги за мистериозни романи за приятелите си.,1
1140,Тиа имаше своя пекарна.,В пекарната си правеше красиви торти.,"Един ден тя разбрала, че въпреки голямата поръчка, мухът й свършил.",Обади се из целия град и най-накрая намери някои.,Тиа беше разочарована.,Тия беше облекчена.,2
1141,Сара отиде с приятелите си в аквапарка.,Платиха си билетите и се облекоха в бански.,Чакаха в опашка за най-големия слайд.,Слязоха по пързалката и се забавляваха.,Те се заклеха никога да не се връщат.,На следващия ден се върнаха.,2
1142,Джеб правеше статуи от камъни.,"Направил е една, която прилича на костенурка.",Сам дойде и я свали.,Джеб започна да плаче.,Сам се засмя и избяга.,Джеб беше развълнуван да построи нов.,1
1143,Джеф ще ходи на екскурзия в дъждовната гора с класа си.,Джеф е развълнуван и няма търпение да дойде.,"Когато Джеф пристигна, беше много разочарован.",Дъждовната гора не беше вълнуваща и нямаше какво да се прави.,Джеф си прекара добре.,Джеф беше отегчен и разстроен.,2
1144,Дани беше сестра в интензивното.,Една нощ баща й е бил един от пациентите й.,"Дани не искаше, но лекуваше баща си.","Когато той се оправи, двамата започнаха да говорят.",Дани не беше изненадана от събитията този ден.,Дани опозна баща си много по-добре.,2
1145,Джина беше в къщата на приятелката си Рут.,"Момиче, което не познаваше, на име Джейн се появи.",Джейн беше груба и надута.,"По-късно Джина открива, че Джейн е сестрата на врага й Джо.",И сега тя избягва Джейн през цялото време.,Така че тя щастливо стана приятелка с Джейн.,1
1146,Ела прекара ден на слънце.,Забравила е да си сложи слънцезащитен крем.,Тя е получила ужасен изгаряне!,Но скоро избледня и се превърна в тен.,Ела изглеждаше страхотно и получи много комплименти.,Ела прекара следващия ден в дъжда.,1
1147,Нийл току-що пристигна в Кения.,Присъедини се към група за сафари.,Видяха всякакви екзотични животни.,Нийл прави снимка след снимка.,Той беше изяден от лъв.,"Нийл е съставил фотоалбум, когато се е прибрал.",2
1148,Джина реши да изпече ябълков пай за първи път.,Тя е била изключително внимателна да следва рецептата точно.,"След като сложила пайото в фурната, тя с нетърпение очаквала да го опита.","Оказа се, че е вкусно!",Затова реши да я хвърли в боклука.,Сподели рецептата и пайта с всичките си приятели.,2
1149,Пабло искаше да си счупи челюстта.,Но нямаше пари.,"Той е търсил в гардероба си, за да види какво може да продаде.",Намерил е играчка мечка и я продал за 50 цента.,После си купи сладки.,Купил е сода с него.,1
1150,Ана е наела склад за голямо парти.,"Декорациите бяха страхотни, но нещо липсваше.",Тогава Анна разбрала - те се нуждаят от диско топка!,Тя е наела топка от компания за партита.,Ана беше разочарована.,Партито мина страхотно.,2
1151,"Оскар отиде в детската стая да намери дърво, което да засади в двора си.",Беше му трудно да реши кое дърво да вземе.,"Имаше много дървета, през които да минеш.",Накрая избрал бонсай.,Съвпадаше перфектно с декора на дома му.,Унищожи я веднага щом се прибра.,1
1152,Имаше голям баскетболен мач в гимназията.,Аз и приятелят ми играехме в един отбор.,Играта стана интензивна и двата отбора завършиха равен.,Оставаха 4 секунди и трябваше да отбележим.,"Аз отбелязах победата, която спечели мача за нашия отбор.",Излязох от игрището и не погледнах назад.,1
1153,Дирк беше добър пианист.,Често се е изявявал пред обществото за пари.,"По време на последното му изпълнение, един от клавишите му се откъсна от клавиатурата.","Той завърши представлението, както най-добре можеше, но музиката беше лоша.",Дирк се засрами.,Дирк хареса как звучи.,1
1154,Ева обичаше катериците в двора си.,Започна да ги храни сандвичи с фъстъчено масло.,Скоро свикнаха с нея.,Единият беше особено приятелски настроен.,Ева се страхуваше от всички катерици.,Ева успя да ласкае една от катериците.,2
1155,Анди обичаше плажа.,Попита майка си дали могат да отидат на плажа.,Майка му е взела Анди на плажа.,По пътя към плажа започна да вали.,Анди мразеше плажа.,Анди беше тъжен.,2
1156,Купих телефонен корпус с каишка.,Трябваше ми един за мобилния ми телефон.,Куфарът пристигна без каишка.,"В сайта пише, че куфарът има скоба, но няма каишка.",Върнах си телефона.,Чувствах се глупаво.,2
1157,Смених чаршафите на леглото ми миналата седмица.,Омръзнаха ми старите.,Новите изглеждат по-добре и се чувстват по-добре.,Мисля да ги задържа.,"Радвам се, че не бяха скъпи.",Планирам да ги наряжа на ленти.,1
1158,Чейс наистина искаше нова играчка.,Майка му не би му купила нова играчка.,Тя му посъветва да си спести джобните.,Той си е спестил джобните.,Чейс си купи нова играчка.,Чейс избяга от вкъщи.,1
1159,Рене е вдъхновена от музиката на Еди Ван Хален.,Тя реши да се научи да свири на китара.,Купи си електрическа китара и усилвател.,Тя мразеше да натиска струните с пръстите си.,"Рене реши, че трябва да свикне с това.","Рене се радва, че е решила да се научи да свири на барабани.",1
1160,Бил отиде на риболов и улови много риба.,"Хванал е толкова много, че е трябвало да раздава някои.",Съседите му били бедни и били благодарни на Бил за рибата.,Съседите най-накрая се оправиха.,"Съседите на Бил го съдят, че ги е обеднял.",Те направили на Бил хляб в знак на благодарност за рибата.,2
1161,Миналата седмица интернетът спря.,С жена ми се отегчихме до смърт.,Всички други възможности изглеждаха скучни.,В крайна сметка пихме и си говорихме за известно време.,В крайна сметка се забавлявахме.,"Бяхме щастливи, че нямахме интернет и пиене.",1
1162,Цял живот Тим е искал да прави музика.,"Тим тренираше цял ден, всеки ден.","Когато Тим имаше достатъчно песни, се обади на студио за запис.",Студиото реши да го запише и Тим беше щастлив.,"Тим реши, че не харесва музика.",Тим стана професионален музикант.,2
1163,"Алекс подозира, че котката му Тигър може да има бълхи.",Тигър постоянно се чешеше ден и нощ.,"Алекс заведе Тигър на ветеринар, за да му постави диагноза.","Ветеринарният лекар потвърди, че Тигър наистина има бълхи.",Дадоха му лекарство срещу бълхи и се оправи.,"Алекс реши да не дава на котката лекарството, което е предписано.",1
1164,Хейли беше млад учен в известна лаборатория.,Всеки ден тя работише усилено върху текущия си проект.,Един от колегите й тайно крадеше изследванията й.,"Хейли го откри, когато го публикува в научен журнал.",Хейли се почувства предадена.,"Хейли чувстваше, че е била подкрепена по възхитителен начин.",1
1165,Сам искаше да направи парти.,Сам покани всичките си приятели и съседи.,Партито стана много диво.,Всички гости напуснаха партито в отвращение.,Сам стана организатор на партита.,Сам имаше ужасен махмурлук на следващия ден.,2
1166,Кейти не можеше да спи.,Тя се спуснала на пръсти надолу и влязла в кухнята.,Тя си наля чаша мляко.,После я е нагряла в микровълновата.,Кейти го изпи и се върна в леглото.,Кейти реши да изсипе млякото в канализацията.,1
1167,"Том говореше с жена си Беки, която имаше лош ден на работа.",Решил да й донесе любимата храна като изненада.,По пътя за вкъщи от работа имаше много трафик.,"След като взе храната, той се прибра вкъщи много по-късно от планираното.","Но всичко беше наред, след като се прегърнаха и вечеряха.","Том реши да отиде в казиното, пренебрегвайки семейството си.",1
1168,Трябваше да изберат печка за новата си къща.,Не можаха да изберат конкретна марка.,Харесаха издръжливостта на Викинг.,Също така им хареса сделката с Термадор.,Вече не им трябва печка.,Решиха да купят печката на викингите.,2
1169,Жасмин не е учила за големия тест по математика.,"Решила е, че може да го направи.","Жасмин скоро разбрала, че изпитанието е много трудно.","Тя реши да изневери, като погледна вестника на съседа си.",Учителят я е хванал и я е задържал.,Учителят я хванал и похвалил изобретателността й.,1
1170,"Сам се премести в Лос Анджелис, за да стане филмова звезда.","Той няма много пари, но мисли, че това е единственият начин.",След два месеца Сам спи в колата си и се разори.,Един ден отиде в китайския театър да моли.,Сам се чувстваше много надежден.,Сам се чувстваше много депресиран.,2
1171,Бен се събуди късно.,Бен реши да пропусне закуската и отиде на работа.,"Работата беше твърде заета, за да си починем или да обядваме.",След работа Бен беше хванат в много лошо трафик.,"Бен беше толкова гладен, че се разболя.",Бен успя да се прибере бързо.,1
1172,Дарън закъсня за работа и не можа да намери ключовете от колата си.,Той е претърсил цялата си къща.,Попитал е жена си къде са.,Тя му каза да си провери джобовете.,Дарън изключи компютъра.,Нямаше ключове в джобовете му.,2
1173,Имах интервю за работа миналата седмица.,Приятелката ми ми помогна да си избера нова вратовръзка.,Отидохме в магазина и търсихме с часове.,"Намерих три, които ми харесаха.",Вместо това си купих папионка.,Купих ги всичките.,2
1174,Хари обичаше хокей.,Решил е да играе в местната лига.,Хари присъстваше на пробите за отбора.,"Хари се надяваше да се справи достатъчно добре, за да влезе в отбора.",Хари напусна хокейния отбор.,"Няколко дни по-късно Хари разбра, че е в отбора.",2
1175,Малката Сю яздеше слон в зоопарка.,"В началото й хареса, но после се уплаши.",Започна да плаче за майка си.,На пазача му се наложи да спре слона и да я вземе.,Майката на Сю я заведе да гали козата.,Сю продължи да язди слона.,1
1176,Хана беше невероятен художник.,Винаги е имала дарба.,Решила е да участва в конкурс за изкуство.,За щастие тя спечели най-голямата награда.,Родителите й настоявали баба й да шие повечето.,Родителите й бяха много горди.,2
1177,Джим изнасяше боклука.,Подхлъзна се на парче лед на тротоара.,Джим падна здраво на тротоара.,Джим усети нещо да се счупи на ръката му.,Джим реши да направи ръчно изправие.,Джим беше ранен и се обади на 911.,2
1178,Мразя да правам пране.,Съвпадащите чорапи са ужасна загуба на време.,"Всеки път, когато мия, чорапите се губят.",Уморих се да търся съвпадащи чорапи.,Намирам прането за релаксиращо.,Изхвърлих всичките си стари чорапи и си купих обикновени бели.,2
1179,Джеймс беше на 12 години и обичаше храната.,До днес не е мислил за готвене.,Майка му му позволи да готви ориз за вечеря.,Джеймс научил колко забавно и креативно може да бъде готвенето.,"Джеймс реши да стане готвач, когато порасне.",Джеймс никога повече не готви.,1
1180,"Лий знаеше, че майка й се нуждае от нови ръкавици и не може да си ги позволи.",И Лий започна да плете.,Тя се побърза да ги довърши до Коледа.,После ги подари на майка си.,"Майката на Лий се гордееше с дъщеря си, че е толкова внимателна.",Майката на Лий хвърли ръкавиците по него и напусна стаята.,1
1181,Дженифър беше професионален копирайтър в голям град.,"Тя вършеше добра работа, но винаги получаваше лоши коментари за нейните рецензии.","Дженифър е разбрала, че шефът й се опитва да я саботира!",Тя решила да се изправи пред шефа си за негативните забележки.,Дженифър благодари на шефа си за неговата честност.,Дженифър нахлу в офиса му и изправи шефа си.,2
1182,Лорейн е играла софтбол.,Тя беше най-добрата в отбора си.,"Един ден, по време на игра, тя си изкълчи глезена.",Тя не можеше да играе повече.,Лорейн беше развълнувана!,Лорейн беше много тъжна.,2
