,input_sentence_1,input_sentence_2,input_sentence_3,input_sentence_4,sentence_quiz1,sentence_quiz2,answer_right_ending
366,Trip miloval melouny.,Jedl alespoň jeden denně.,"Jeho máma mu vždycky říkala, že by vyrostl strom, který by polykal semena.",Stejně je vždycky spolkl.,Trip si vychutnal chuť semen.,Trip úplně přestal jíst melouny.,1
367,"Angie, pracovnice MTurku, se považovala za pracovitou.",Jednoho dne ji jeden z jejích oblíbených žadatelů odmítl.,Angie byla velmi překvapená a poslala jim e-mail.,"Odpověděli, že její práce nebyla dost dobrá.","Angie se rozhodla říct žadateli, aby odmítl další její práci.",Angie se snažila o tom s ním podrobně diskutovat.,2
368,Donovan pozval Trinu na tanec.,"Trina měla Donovana ráda, tak řekla ano, ale měla strach.","Po škole běžela domů, aby požádala svého otce o pomoc.","Když se její otec vrátil domů, vysvětlila mu situaci a táta se usmál.",Trina otec Trina pokáral.,Trina se naučila tančit od jejího táty.,2
369,Andy vždycky chtěl velké dětské kolo.,"Když mu bylo šest, chtěl si k narozeninám koupit kolo.",Neuměl jezdit na kole.,Na Andyho narozeniny mu jeho matka dala kolo.,Andy plakal celé hodiny.,"Jeho táta ho naučil, jak na něm jezdit.",2
370,Suzy šla do zmrzlinárny.,Objednala si vanilkový milkshake.,"Když se mu snažila zaplatit za mléčný koktejl, usmál se na ni.","Řekl jí, že vyhrála speciální soutěž.","Řekl jí, že mu dluží šedesát dolarů.",Dal jí koktejl zadarmo.,2
371,Ned a jeho přátelé šli na trh.,Použil poslední peníze na koupi bavlněné cukrovky.,"Když odcházela, viděla malého chlapce, jak pláče.",Upustil svou cukrovou vatu do louže.,Ned mu dal svou vlastní vatku.,Koupil mu další cukrovou vatu.,1
372,"Sebastian si všiml, že venku je sluníčko a teplo.",Měl nějaké práce.,Neměl chuť dělat domácí práce.,"Sebastian se rozhodl, že být venku je lepší.",Sebastian ten den chtěl zůstat uvnitř.,Sebastian se prošel ven a šel se projít.,2
373,Rashid byl vynikající řidič.,Jednou přišel Rashidův bratr pozdě do práce.,"Rashid nabídl, že vezme jeho bratra.",Dostali se tam s časem navíc.,Jeho bratr na něj křičel a zabouchnul dveře.,Jeho bratr byl vděčný.,2
374,Ali šla do fast foodu a zaplatila kreditkou.,"Pokladníkovi trvalo dlouho, než jí kartu přinesl.","O pár dní později, Ali našla na její kartě neobvyklé transakce.","Zavolala své bance, která obvinění zrušila.","Přemýšlela, jestli jí pokladník neukradl informace.",Nezapomněla poděkovat pokladně.,1
375,Hledal jsem pěkný obraz pro můj obývací pokoj.,Proto jsem včera šel hledat.,"Konečně jsem našel krásnou, kterou jsem miloval.",Ten obraz byl vodopád.,"Rozhodl jsem se, že si ten obraz nekoupím, protože se mi nelíbil.",Koupil jsem ho a přinesl domů.,2
376,Chtěl jsem být povýšen.,"Rozhodl jsem se, že se pokusím dostat povýšení.",Celý rok jsem tvrdě pracoval.,Můj šéf si toho všiml a jednoho dne mě zavolal do své kanceláře.,Můj šéf mě okamžitě vyhodil.,"Dostal jsem povýšení, které jsem chtěl.",2
377,Maggie se s rodiči stěhovala do nového města.,"Maggie byla nervózní, protože nikoho nezněla.","Jakmile se nastěhovala, začala se tu představit.",Nakonec si našla pár přátel.,Maggie byla smutná a osamělá.,Maggie se líbilo nové město.,2
378,Dan šel ze školy domů a uviděl tu výlohu.,V okně obchodu byla vlaková výstava.,"Dan si tak moc přál, aby mu patřila tahle vlaková souprava.","Když se Dan vrátil domů, jeho matka mu řekla, že má pro něj překvapení.",Dala Danovi vlak.,"Danova matka mu řekla, aby se připravil do školy.",1
379,Gina chtěla ukrást klíč od domu své matky.,"Čekala, až její matka bude zdřímnout.",Vzala si peněženku své mámy do koupelny.,Tiše odtrhla klíč z řetězu.,"Pak Gina vložila kabelku zpátky tam, kde ji našla.","Pak Gina řekla své matce, kde je klíč.",1
380,Byl tam muž z Kentucky.,"Miloval dívku, která žila v Louisianě.","Rozhodl se, že se musí odstěhovat.","Přestěhoval se, aby byl se svou láskou.",Ten muž se přestěhoval do Texasu.,Ten muž se přestěhoval do Kentucky.,2
381,Tim propadl na hodině matematiky.,"Věděl, že když neprojde, bude muset jít na letní školu.",Tvrdě studoval a chtěl si dát víc kreditů.,"V poslední den školy zjistil, že prošel!",Tim byl nadšený.,Tim byl strašně zklamaný.,1
382,Mary-Anne se cítila osamělá a rozhodla se adoptovat kočku.,"Šla do místní humanitní společnosti, aby začala s procesem.","Zatímco se dívala, jedna z koček na ni mňoukala.",Mary-Anne mazlila kočku a byla to láska na první pohled.,"Rozhodla se, že to není ta pravá kočka.",Vzala si kočku domů.,2
383,Jako dítě jsem chodila na gymnastiku.,Učil jsem se rovnovážný trám a dělal na něm pohyby.,"Když jsem to otočil, tak jsem špatně přistál.",Zlomil jsem si kotník a bolí mě to!,Rychle mě odvezli do nemocnice.,Vstal jsem a hned jsem se vrátil na tyč.,1
384,V mém foyer běhalo šest štěňat.,"Bylo by těžké vybrat si, který chceme koupit.",Každá z mých dcer si vybrala jiné štěně.,"Majitelka řekla, že můžeme dostat slevu na dva psy.",Každý jsme si koupili jednoho psa.,Neměli jsme rádi psy.,1
385,Johnny chtěl změnu od svého života ve velkém městě v Bostonu.,"Rozhodl se, že bude šťastnější v srdci Ameriky.","Konečně ten den nadešel, Johnny se přestěhoval do Idaha.",Utekl životem ve velkém městě.,Johnny začal plánovat přestěhovat se do Bostonu.,"Johnny byl šťastný, že je v malém městě.",2
386,"Joan nesnášela, když se vracela domů na Vánoce.","Věděla, že ji její matka bude pronásledovat kvůli jejímu milostnému životu.",Letos při cestě domů měla autonehodu.,"Matka se k ní rychle přiblížila, aby se o ni postarala.","Joanina matka s ní nemluvila, protože nebyla vdaná.","Joan se cítila dobře, když viděla tvář své matky.",2
387,Trávím celý svůj čas psaním.,V důsledku toho jsem se začal cítit docela osamělý.,Rozhodla jsem se připojit k online seznamce.,"Když jsem se přidal, uvědomil jsem si, že nemám rád jiné lidi.",Začal jsem psát víc.,Měla jsem spoustu schůzek.,1
388,Moje dcera byla skautkou na základní škole.,Jednoho dne šla na noční výlet.,Moje žena tam byla jako doprovod.,Všichni strávili víkend v chatě v New Hampshire.,Moje dcera nikdy nezapomněla na svůj výlet.,Tu noc jsme s manželkou večeřeli.,1
389,Dnes bylo otevření nového klubu za rohem.,"Nemohl jsem se dočkat, až tam budu.","Když jsme vešli do klubu, bylo to nádherné.",Objednali jsme si výborné jídlo a tančili.,"Spřátelili jsme se s vyhazovačem, abychom se zítra dostali do klubu.",Vyhazovač nás do klubu nepustil.,1
390,Včera jsem do kuchyně nosil novou sklenici.,K mému překvapení mi spadl.,Sklo se rozbilo.,Musel jsem to vyzvednout.,Pořezal jsem se na malém kousku.,"Líbilo se mi, jak teď vypadá sklo.",1
391,Billova rodina žila na kopci.,Nikdy tam nepršelo ani nehurchalo.,Jednoho dne to tu prošlo tornádo.,Billův dům byl zasažen a střecha byla odtržena.,Pojišťovna zaplatila náklady na novou střechu.,"Rozhodli se, že to stejně nepotřebují a odstěhovali se.",1
392,"Allison se rozhodla, že se chce dozvědět více o historii její oblasti.","Šla do knihovny, aby si o tom prohlédla knihu.","Šla dovnitř a nemohla pochopit, jak jsou knihy uspořádány.","Našla knihovníka, který jí vysvětlil Deweyho desítkový systém.","To jí pomohlo zjistit, které auto nechtěla.","To jí pomohlo najít to, co chtěla.",2
393,Sebastian chtěl hrát fotbal v týmu svých přátel.,"Mluvil s přítelem a zjistil, že musí jít na trénink.",Celý týden trénoval chytání fotbalu doma.,Šel na další trénink a dal touchdown.,Sebastian byl zklamaný z úspěchu.,"Sebastian byl šťastný, že jeho praxe vyplatila.",2
394,"Byla jednou matka, která zoufale toužila, aby její dítě spalo.","Procházela ho, ale pořád nespal.","Nakrmila ho, ale on pořád nespal.","Konečně si vzpomněla na ukolébavku, kterou jí zpívala její matka.",Matka jemně zpívala ukolébavku svému dítěti.,Matka hrála hip hop pro své dítě.,1
395,Johnny jako dítě čůral v bazénech.,"Myslel si, že to zvládne jako dospělý.",Vzal své děti do vodního parku.,Pak se vyčůral do bazénu.,Někteří lidé si toho všimli a Johnny dostal potíže.,Všichni byli opravdu šťastní kvůli Johnnyho chování.,1
396,"Amy sledovala ostatní děti, jak si hrají a zírá na svůj inhalátor.",Kvůli astmatu nemohla hrát sport.,Cítila ruku svého učitele umění na rameni.,"Její učitelka se usmála a řekla Amy, že jednou bude velkou umělkyní.",Amy se cítila mnohem lépe.,Amy se cítila hrozně.,1
397,Joe a jeho přátelé měli dnes fotbalový zápas.,Joe byl nervózní.,"Byl nervózní, jestli vyhraje nebo ne.",Nakonec po zápase Joeův tým vyhrál.,Joe byl na svůj tým velmi hrdý.,Joe byl ve svém týmu velmi zklamaný.,1
398,Mark měl důležitý pohovor na novou práci.,"Připravil se na otázky, které mu možná položí.","Zdálo se, že na Markovu odpověď na něj zapůsobila osoba, která s ním dělala rozhovor.","Intervjuátor informoval Marka, že tu práci má.",Mark byl velmi šťastný.,Mark byl rozzuřený a vyběhl ven.,1
399,Elaine se dnes večer nechtěla vařit.,"Elaine se tedy rozhodla, že půjde na večeři.","Elaine však nevěděla, kde by chtěla jíst.","Elaine přemýšlela, kam by měla jít, skoro hodinu.",Elaine se rozhodla snadno.,Elaine se těžko rozhodla.,2
400,Sam se snažil dostat na vysokou školu svých snů.,Strávil hodně času vyplňováním žádosti.,Díky tomu měl dobrý pocit z jeho akademických úspěchů.,On podal žádost.,O tři měsíce později dostal přijetí.,Už na to nikdy nepomyslel.,1
401,Matt se jednou rozhodl jít s přáteli na barový skok.,V jednom baru vypili tři panáky.,"Šli na další čtyři, každý z nich vypil tři panáky.",Matt se nakonec opil a ztratil telefon.,Matt a kamarádi šli domů a vyspali se.,Matta nezajímal ten chybějící telefon.,1
402,Bindu naplánovala párty se svými přáteli.,"Setkali se u ní doma, aby se domluvili, jaké jídlo a pásku použít.",Jeden z Binduových přátel přinesl samosy a doogh.,Na párty hráli hudbu čtyři kamarádi.,Všichni se skvěle bavili.,Bindu nesnáší své přátele a večírky.,1
403,Tyler se probudí a musí se před školou osprchovat.,Jeho malý bratr se sprchuje.,"Tyler se bojí, že zmešká autobus.",Konečně je řada na Tylerovi.,"Tyler dělal dortíky, aby ukázal své pečení.",Tyler se rychle osprchoval a včas dorazil na autobusovou zastávku.,2
404,Thomas se v poslední době cítil pod radarem.,Šel za doktorem na prohlídku.,"Jeho lékař mu řekl, že má trochu vysokou hladinu cholesterolu.",Thomas začal jíst zdravěji a chodit na procházky.,"Byl diagnostikován s cukrovkou poté, co přibral 40 liber.",Jeho lékař byl při další prohlídce velmi potěšen.,2
405,"Zvonilo na dveře, ale nikdo tam nebyl.","Nebyla si jistá, jestli má otevřít dveře, nebo ne.",Pomalu škrábala otevřela dveře a díval se ven.,Její bratr na ni skočil a vyděsil ji.,Rozhodla se sledovat svou oblíbenou komedii na Netflixu.,Křičela a odtáhla bratra.,2
406,Stephanie chtěla udělat jablečnou omáčku.,"Rozhodla se jet na farmářský trh, aby si vybrala pár lahodných jablek.","Když šla po zahradě, zakopla a spadla.",Zlomila si obě zápěstí.,Stephanie se posunula rukama.,"Stephanie nemohla vstát, dokud ji někdo nenašel.",2
407,"Roy nemohl přijít na to, proč jeho byt tak špatně smrděl.","Jeho přátelé to komentovali, když tam šli.",Všichni se rozhodli hledat zdroj.,"Ukázalo se, že to byla stará ryba v lednici.",Roy se rozhodl nechat ryby v lednici.,Roy vyhodil starého rybáře a všechno vonělo lépe.,2
408,Jimmy vyrůstal velmi chudý.,"Jeho rodiče se však vždy snažili, aby pro něj byli k dispozici.","Když se dostal na dobrou vysokou, pracovali na dvou pracích, aby si to mohli dovolit.","Když skončil, chtěl ukázat své ocenění.",Takže jim zaplatil za vysokou.,Jimmy zavolal rodičům a nadával na ně.,1
409,"Jill byla překvapená, když ji pohledný kluk pozval na ples.","Když se spolubydlící připravovali, Jill se rozčilovala kvůli svým vlasům.","Jilliny spolubydlící říkali, že by mohli pomoct.",Jill se oblékla do svého bílého šatníku.,Přijel její přítel a pochválil její vzhled.,Jill a její kamarádky si užili zábavný večer jen pro holky.,1
410,Majitel baru si na reklamu svého baru vyvěsil velký transparent.,Vítr byl silný a odfoukl prapor.,Majitel ho honil přes celé město.,Přistál na zahradě staré ženy.,Stará žena odmítla vrátit transparent.,"Stará žena byla nadšená, že našla kožešinový kabát.",1
411,"Máma má recept na dýňové tyčinky, které mám docela rád.","Jednou mi je udělala, protože jsem měl špatný den.",Snědl jsem ty dýňové tyčinky a cítil jsem se mnohem lépe.,"Ty mříže mi připomínají, že mám o mě starost.",Od toho dne jsem nikdy nejedl dýňové tyčinky.,V pozdějším věku jsem dělala dýňové tyčinky a připomínaly mi mámu.,2
412,Tim se rozhodl trávit více času se svým dědečkem.,"Jeho děda miloval pozorování ptáků, takže Tim sledoval s ním.",Označili své pozorování v zápisníku.,Brzy se Tim opravdu začal zajímat!,"Tim se rozhodl, že už ho ptáci nezajímají.","Tim a jeho děda našli koníček, který se jim líbil.",2
413,Danny pracoval v místní zmrzlině tohle léto.,"Byl velmi nadšený, že začal svou první práci.","První den, co se narodil, jeden chlapec upustil zmrzlinu na zem.","Danny bez váhání věděl, co má dělat.",Dal mu další lžíci zmrzliny.,Odmítl mu dát další skluz.,1
414,"Školní zvonek zazvonil, když hodiny uhodily dvě.","Gina nikdy nebyla šťastnější, že den skončil.",Sebrala si věci a čekala u dveří na Tami.,Ale Tami odjížděla s Ritou a Mary.,"Gina se cítila osamělá, když šla domů.",Gina poděkovala Tami další den.,1
415,Laurence se svou rodinou se rozhodl přestěhovat.,Nejdřív si sbalili nábytek.,Pak sbalili všechno ostatní.,Všechny jejich věci byly přemístěny do dodávky.,Laurence a jeho rodina odjeli do nového domova.,Laurence dal všechny jejich věci zpátky do domu.,1
416,Joy chtěla najít perfektní skořápku pro svého kraba poustevníka.,"Mohla by si jeden koupit, ale bylo by to speciálnější, kdyby ho našla.",Celé ráno prohledávala pláž.,"Všechno, co mohlo fungovat, bylo zničené!",Nakonec si musela koupit skořápku.,Tak si jednu přinesla domů a dala ji krabovi.,1
417,Westin se měl vdát!,"Chtěl, aby jeho svatba proběhla perfektně.",Všechno šlo dobře až do večera.,Někdo se hodně opil a spadl do dortu!,Westin si vyřízl perfektní kousek z dortu.,Weston a jeho žena vyhodili toho opilce.,2
418,Joe pomáhal svému otci vyklízet les na zadním dvorku.,Najednou slyšel hlasitý bzučení.,Rozrušil včelí hnízdo.,"Šestkrát ho bodli, než mohl utéct.",Joe se tomu smál.,"Joe byl naštvaný, že se zranil.",2
419,Bylo to na podzim.,Toddův dvůr byl plný listů.,"Rozhodl se, že je musí všechny vyrazit.","Když skončil, dal je všechny do pytle.",Todd je vyhodil do koše.,Todd otevřel tašku a rozložil listy.,1
420,Tim měl sen stát se velkým kulturistou.,"Každý večer cvičil, aby dosáhl svého cíle.",Jeho tvrdá práce se vyplatila a on si zasloužil místo v populární soutěži.,"Ukázal své schopnosti, zvedl více než 250 liber.",Tim byl velmi odhodlaný.,Tim neměl moc odhodlání.,1
421,Henry šel do třídy.,Zároveň se snažil vyčistit obrazovku telefonu hadříkem.,"Bohužel, někdo do něj narazil.",Telefon mu vypadl z ruky a spadl na zem.,Ten člověk se omluvil Henrymu.,Henry byl šťastný a vděčný.,1
422,Tami se rozhodla zúčastnit se volleybalových zkoušek.,"Byla jen v osmé třídě, ale věděla, že je dobrá.",Hrála tvrdě a dala z toho všechno.,"Nečekal, že ostatní hráči budou tak dobří jako ona.",Tami se dostala do basketbalového týmu.,"Všichni hráči byli dobří, ale ona se dostala do týmu.",2
423,Bob a Jim si jednou hráli v domě.,Převrátili vázu a rozbili ji na kusy.,"Báli se, že se na ně máma naštve.",Našli nějaké lepidlo a opatrně vazu znovu přilepili.,"Jejich maminka si užívala svou novou, rozbitou vázu.",Lepidlo drželo vázu pohromadě a jejich máma se to nikdy nedozvěděla.,2
424,Steve byl velmi smutný.,Steveova přítelkyně se s ním rozešla.,Rozhodl se napsat jí píseň.,Vypustil do písně své srdce.,"Steve se divil, jestli se k sobě někdy vrátí.","Steve jel hodinu odtud, aby si koupil drogy.",1
425,Gloria chtěla koupit květiny pro svého manžela.,Gloria byla šokována cenou i pouhých půl tuctu lilie.,"Gloria se rozhodla, že si z zahrady sebere nějaké květiny.",Shromáždil nějaké narcisy a chryzantémy.,Gloria se brzy poté rozvedla.,Manžel Gloriiny ocenil její gesto.,2
426,Josh hrál basketbal každý den.,Jeho cílem bylo být schopen udělat jakýkoliv koš na hřišti.,Jednoho dne ho někdo vyzval na soutěž.,"Kdo udělá nejvíc střel, bude vítězem!",John utekl a křičel ze strachu.,Udělal nejvíce střel a vyhrál soutěž.,2
427,Lauren vždycky chtěla na večírky nosit tenké džíny.,"Nicméně, potřebuje zhubnout, aby ty tenké džíny vypadaly dobře.",Lauren začíná s náročným cvičením.,"Konečně zhubla dost na to, aby mohla nosit tenké džíny.",Nosila je hrdě na další párty.,Žárlila.,1
428,Na střední jsem byl na Havaji.,Celá naše třída kapely tam byla.,Létání trvalo devět hodin.,Byl to tropický ráj.,"Rozhodl jsem se, že chci jet na Havaji víc.",Hawaii nebylo dobré místo k cestování.,1
429,"Sonny žil v Texasu, a bylo horké léto.",Byl tak unavený z toho horka.,"Rozhodl se najít způsob, jak se uklidnit.",Nejdřív na nic nepomyslel.,Rozhodl se jít zapnout topení.,Pak se rozhodl skočit do bazénu.,2
430,Chad byl neuvěřitelný zpěvák.,Jen se bál zpívat.,"Chtěl se přidat k kostelnímu sboru, ale myslel si, že se mu budou přátelé smát.","Kvůli tomu, že se stydí za své schopnosti a vášeň.",Chad se odvážil předvést svou komediální scénu.,"Místo smíchu, všichni tleskali, když Chad konečně zpíval.",2
431,"Ronald měl dvě děti, kluka a holku.",To bylo víc než dost.,"Opravdu nechtěl, aby dva byli upřímní.","Jednou mu jeho žena řekla, že čeká třetí dítě.","Byl hluboce nešťastný, ale bál se odejít.",Jeho oči zářily vzrušením.,1
432,Minulou středu jsem byl na procházce.,"Když jsem šel, narazil jsem na něco, co mě vyděsilo.",Před sebou měl čtyřmetrového hada s očima jako z perlí.,Křičel jsem a utíkal až na hlavní silnici.,"Jsem biolog, který studuje hady.",Šla jsem po silnici zpátky k autu.,2
433,Mary ráda pila kávu každé ráno.,Dneska měla naspěch.,Šla do kavárny.,"Po odjezdu si všimla, že kafe bylo špatně.",Mary narazila na průzkum.,Mary dál řídila a stejně to pila.,2
434,Bill se kvůli práci právě přestěhoval do velkého města.,"Cítil se osamělý, protože ve městě nikoho neznal.","Jednoho dne se Bill rozhodl, že se po práci sejde s některými spolupracovníky na skleničku.",Měl s nimi spoustu legrace.,Bill si toho dne udělal hodně přátel.,Bill byl naštvaný na své spolupracovníky.,1
435,Billy se chtěl stát doktorem.,"Šel na vysokou, aby se stal lékařem.",Po absolvování studia změnil názor.,Billy se stal sestrou místo doktora.,Nikdy svého rozhodnutí nelitotil.,"Byl tak deprimovaný, že se stal alkoholikem.",1
436,Quintona vykopli z bytu.,Byl na mizině a neměl žádný příjem.,Jednoho dne se rozhodl utratit poslední dolar na loterii.,K jeho neuvěřitelnému úžasu vyhrál 50.000 dolarů!,Quinton byl v depresi.,Quinton byl tak šťastný.,2
437,"Když se Igor probudil, začal se připravovat do práce.","Zapnul sprchu a čekal, až se zahřeje.",Voda zůstala studená.,Dvořil se mezi studenou sprchou a sprchou.,Snědl muffin.,Igor se osprchoval.,2
438,Tara upřednostňovala big band hudbu před všemi alternativami.,Milovala všechny ty rohy a ostatní měděné nástroje.,Snažila se najít další milovníky velkých kapel.,Její pokusy byly marné.,Tara si to ráda poslechla sama!,Tara byla zlá holka.,1
439,Cestovala jsem do Washingtonu DC navštívit svého přítele.,Chodili jsme na spoustu míst po městě.,"Ale jedno místo, kam jsem chtěla jít, byl Bílý dům.",Vzal mě do Bílého domu a byla jsem tak šťastná.,Prošli jsme si to a užili si historii tohoto místa.,Opustil jsem Bílý dům náhle a nejel na prohlídku.,1
440,Můj syn koupil loňský podzim bubny pro svou jednoroční neteř.,"Na desce byly paličky, cymbal a sedadlo.",Jeho neteř žije v New Yorku.,"Viděla to, když přišla na návštěvu, a byla nadšená.",Nenávidí hudbu.,Chtěla hrát na bicí.,2
441,Maggie měla dnes svůj první koncert na klavír.,Byla velmi nervózní.,"Když nastoupila na pódium, třásla se.",Naštěstí nakonec hrála perfektně.,"Maggie byla povzbuzena, aby dělala víc.",Maggie se vzdá klavíru.,1
442,Ed měl rád rodinný filmový večer.,Dostávali sladkosti a pití a kroutili se kolem televize.,Dneska se dívali na Aladina.,"Ale Ed usnul, než to skončilo.",Ed byl šťastný s koncem.,"Ed litoval, že usnul.",2
443,"Rozhodl jsem se, že se chci zapsat do vánočního klubu s mojí bankou.","Zavolal jsem pokladně a zeptal se, kdy to můžu udělat.","Řekla mi, že můžu přijít kdykoliv.",Dnes ráno jsem se přihlásil k plánu.,"Jsem rád, že jsem se přihlásil.","Lituji, že jsem se přihlásil.",1
444,"Mac měl veganského přítele, který přišel na večeři.","Sténal, protože věděl, že neumí udělat steak nebo hamburgery.",Pak si vzpomněl na recept na omáčku Alfredo z kešu.,"K jeho překvapení, omáčka vyšla krémová a chutná.",Rozhodl se místo toho podávat masový koláč.,Všichni si jídlo užili.,2
445,Ryan pracoval pro ochranku v obchoďáku.,Často pracoval v noční směně.,Jednou viděl v obchoďáku mývala.,"Díval se na něj celé hodiny, dokud neodjel.",Ryan byl slepý.,"Ryan se rozhodl, že jeho práce je poněkud nudná.",2
446,Johnnyho učitelka objednala třídě domácí sněhové kužely.,Učitelka nechala každého studenta vybrat si barevnou sirupovou náplň.,"Když přišel jeho řad, Johnny se naštval, když viděl, že zbývá jen jedna barva.","Johnnyho učitelka se ptala, co se děje.","Johnny řekl učiteli, že je šťastný.","Johnny řekl učiteli, že je naštvaný, že nedostal další barvy.",2
447,"Tim si musel vybrat mezi třemi dívkami, se kterými chodil.","Líbily se mu všechny tři, ale musel se rozhodnout.","Mluvil se všemi třemi, aby zjistil, kdo ho má radši.","Nakonec odešel s dívkou, která ho chtěla vidět víc.",Tim je gay.,Tim byl spokojený.,2
448,"Jill přesvědčila svého přítele Joea, aby s ní šel hledat Geocache.","Nemyslel si, že to zní zábavně, ale rozhodl se ji pobavit.","Prohledali místo, kde měl být Geocache.",Po více než hodině hledání ho nenašli.,"Jill doufala, že ho brzy najdou.","Jill byla ráda, že si nevzala Joea.",1
449,Brigid a její kamarádka Ella se učily hrát na klavír.,Elin otec jí koupil drahé klavírní klavír od známého výrobce.,Brigidin otec si mohl dovolit koupit jí pouze použitý klavír.,"Ale Ella byla hloupá a necitlivá dívka, která nikdy neprocvičovala.",Ella nikdy nebyla dobrá na klavír.,Ella se pak stala hvězdou klavíristy.,1
450,Dave chtěl koupit zbraň.,Šel do obchodu se zbraněmi a položil mnoho otázek.,Díval se na velké a malé zbraně.,"Rozhodl se, že si chce koupit velkou brokovnici.",Dave byl proti druhému dodatku.,Dave ho koupil a jeho nákup se mu líbil.,2
451,Rose jela vlakem na Long Island.,Tam se vydal na samý konec ostrova.,Šla na pláž na Montauk Point.,Bylo chladno a fouká vítr.,"Rose byla tak teplá, že si sundala bundu.",Rose si zakryla tvář před větrem.,2
452,Drew používal psací stroj pro speciální projekt.,"Snažil se být opatrný, protože nemohl vymazat své slova.",Nakonec však usnul.,Jeho hlava přistála na klávesách a několik písmen bylo napsaných.,"Drew byl rád, že jeho projekt bude bez chyb.",Drew musel začít znovu psát.,2
453,Sarah byla vždy fascinována noční oblohou.,Sarahin otec si všiml její vášně a koupil jí nový dalekohled.,Byla nadšená.,"Každou noc chodila ven, aby se pečlivě dívala na noční oblohu.",Sarahin otec vzal zpět teleskop.,Sarah milovala svůj nový dalekohled.,2
454,Kristen měla dost svého pokoje.,Musí to pro změnu posunout.,Neměla ji přesunuta přes čtyři roky.,"Po přesunu všeho viděla obrovskou skvrnu, kde její postel pokryla.","Melanie se rozhodla, že pokoj vypadá teď perfektně.","Rozhodla se, že ten flek zakryje kobercem.",2
455,"Moje sestra se ke mně přestěhovala, když jí bylo 35.","Žila s mužem, který bil ženu, v přívěsu.","Ten muž ji vystopoval až ke mně domů jedné chladné, temné noci.","Vloupal se do mého domu, když jsme spali.","Když jsme se probudili, tak se vplížil oknem.",Sedl si k nám ke stolu a všichni jsme si dali něco k pití.,1
456,Moji rodiče se rozešli.,"Nevím, kdy se to stalo, ale zdá se, že to bylo vzájemné.",Rozhodli se to ukončit přátelsky.,"I když mě to bolí, jsem rád, že si vybrali to, co je dělá šťastnými.",Moji rodiče chtějí žít spolu.,Moji rodiče měli žít odděleně.,2
