,input_sentence_1,input_sentence_2,input_sentence_3,input_sentence_4,sentence_quiz1,sentence_quiz2,answer_right_ending
1100,Daria si koupila televizi do obývacího pokoje.,Nechala si od obchodu doručit televizi domů.,"Když přišla televize, Daria byla nadšená.",Televize byla její oblíbená věc.,Darla zapnula televizi a začala se dívat na film.,Darla rozbila televizi rake.,1
1101,Bílé růže byly Lillyino oblíbené květiny.,Pěstovala je ve své zahradě.,Jednou si bodla prst do trnu.,Ona si to nemyslela.,Lilly musel amputovat prst.,Ten čurák se nakazil a ona musela brát antibiotika.,2
1102,Jimmyho matka byla nemocná v nemocnici.,Šel ji navštívit do nemocnice.,Jimmy jí přinesl květiny a pohlednici.,Její matka byla velmi laskavá.,Jimmyho matce začalo být lépe.,Jimmy nenáviděl svou matku.,1
1103,Jednoho rána měl Sammy strašné bolesti břicha.,Ale ona se donutila jít do školy.,"Když se blížila k autobusu, myslela, že se vrátí.","Ale cítila, že už je pozdě na změnu názoru.","Seděla na chodníku a dívala se, jak kolem ní projíždí autobus.",Šla do školy a trpěla bolestí.,2
1104,Karmen byla připravena na cestu do Tanzanie.,Vzala si taxi na letiště.,Rychle prošla letištní ochranou.,Letoun stihla stihnout a našla své místo.,Letadlo vzlétlo a Karmen se uvolnila.,Karmen okamžitě vystoupila z letadla.,1
1105,Sandy žila v New Yorku.,"Sandy slyšela, že se blíží nebezpečná sněhová bouře.","Sandy se rozhodla, že bude mít připravený domov.",Během bouře vypadl proud.,Sandy se rozhodl jít ven a udělat si sněhuláka.,Sandy byla připravená.,2
1106,Quentin obvykle nemá rád firemní akce.,"I když mu nevadí spolupracovníci, rád je sám.",Jednoho dne se rozhodne zúčastnit se firemní oslavy.,"Snědl hranolky, aby se necítil trapně.",Quentin si ten večírek užil.,Quentin miloval být s lidmi.,1
1107,Používám Mr. Spice bez sodné omáčky.,Jsem na nízkých sodíkových dietách.,Včera jsem se snažil koupit pár lahví na internetu.,"Počítač odmítal mou objednávku, i když byla karta aktivní.","Byl jsem rád, jak snadné bylo objednat.",Nakonec se prodej uskutečnil.,2
1108,Dan chtěl jít na Halloween do školy oblečený jako ďábel.,Bál se požádat otce o kostým.,Místo toho se zeptal své babičky.,"Řekla mu, že jít jako ďábel je zlo.",Danova babička byla už oblečená za ďábla.,Dan si udělal vlastní kostým Ďábla.,2
1109,"Franz se rozhodl, že by chtěl být blíž ke své rodině.","Rezervuje si výlet, aby navštívil svého bratrance ve Philadelphii.",Franz a jeho bratranec navštěvují muzea a pijí spolu kávu.,Mají spolu skvělou návštěvu.,"Franz přísahá, že už nikdy neuvidí svého bratrance.","Franz je rád, že šel navštívit svého bratrance.",2
1110,"Koupil jsem si rohovou ropuchu, když mi bylo deset.",Bylo to v obchodním domě.,Žába vypadala velmi divoko.,"Snažili jsme se ho nakrmit, ale nechtěl jíst.",Nakonec žába zemřela hlady.,Po několika týdnech byla rohová žába velmi tlustá.,1
1111,Dnes jsem potkal Nancy poprvé.,"Než odešla, vyměnili jsme si čísla.","I když se na chvíli procházel, pořád mi posílala zprávy.","Rozhodl jsem se jí zavolat a požádat ji, aby mi přestala volat.",Milovala jíst banány.,Už jsem o ní nikdy neslyšel.,2
1112,Včera Kelly šla do CVS koupit nějaké sladkosti.,"Procházela se uličkami, aby našla, co chce.",K jejímu překvapení však narazila na starého přítele.,Ti dva si chvíli povídali.,Oba byli zatčeni.,Její kamarádka nakonec koupila ty sladkosti.,2
1113,Donův první den na doku měl nějaké problémy.,"Byl nervózní, když byl v blízkosti těžkých strojů.",Jednou tam hodil těžkou zásilku.,Málem zasáhla kolegu.,"Don byl rád, že nebyl nervózní v práci.","Don věděl, že se bude muset zlepšit.",2
1114,Dal potřeboval peníze na vysokou.,Začal dělat účetní pro místní gang.,"Když federálové vpadli do gangu, procházel jejich účty.",Byl náhodou zastřelen v křížové palbě.,Dal udělal špatné rozhodnutí.,Dal udělal chytré rozhodnutí.,1
1115,Dneska byl ve škole den fotek.,"Alice byla tak nadšená, protože jí její máma koupila nové oblečení.","Vstala, oblékla se a její máma si upravila vlasy.","Fotograf říkal, že je velmi hezká.","Alice se cítila dobře, když ji fotograf pochválil.",Alice se při focení zamračila.,1
1116,Mamince Nily diagnostikovali rakovinu ve 4. stadiu.,"Nila věděla, že její maminka už dlouho nežije.","Nila se postarala, aby její matka žila dobře až do své smrti.",Nila si s mámou udržovala mnoho dobrých vzpomínek a byli šťastní.,Nila se nestarala o svou matku.,Nila milovala svou mámu.,2
1117,Matka se podívala na tvář svého novorozeného chlapce.,Snila o jejich budoucnosti spolu.,"Její snem bylo dát mu dětství, které jí nebylo dáno.","Obětovala čas a energii, aby dosáhla svého cíle.",Chlapec trpěl v dětství.,Ten chlapec měl velmi šťastné dětství.,2
1118,Jessica a její bratři se na Vánoce moc těšili.,"Šli spát brzy, aby se mohli brzy probudit.",Probudili se a běželi k vánočnímu stromu.,Pod stromem byla jen jedna krabice.,"Jessica se divila, jestli se nevzbudili příliš brzy.",Každý z jejích bratrů otevřel své vánoční dárky.,1
1119,Jan a Kim používaly model Montessori.,Kim se rozhodla vzít svému dítěti všechny knihy o drakovi a fantasy.,"Jan byla naštvaná, že Kim udělala toto rozhodnutí.","Jan tvrdil, že představivost a fantazie jsou důležité.",Jan vyhodil knihy.,Jan přinesl ty knihy.,2
1120,První den školy jsem tam šla s dvěma mými nejbližšími přáteli.,Všichni jsme byli velmi nervózní.,"Když jsme přišli do školy, zkontrolovali jsme seznam tříd pro třetí třídu.",Všichni tři jsme byli přiděleni do jedné třídy!,Nemohli jsme uvěřit našemu štěstí.,Všichni tři jsme byli velmi zklamaní.,1
1121,"Jeff byl naštvaný, že pes jeho souseda vždy ráno štěkal.",A štěkot vždycky Jeffa vzbudil brzy.,Jednou jeho sousedka dala svého psa pryč.,"A Jeff byl rád, že už neslyšel žádné štěkání.",Jeff by konečně měl klid a klid.,Jeffovi by ten pes chyběl.,1
1122,"Holly požádala bratra, aby jí na záda dal opalovací krém.",Vzal si čas a velmi pečlivě ho aplikoval.,"Později toho dne se Holly divila, proč se lidé smějí.","Později si uvědomila, že její bratr vytvořil vzorek s tělem.","Holly na bratra křičela, aby se mu pomstila.",Holly dala svému bratrovi peníze jako náhradu.,1
1123,"Dřív jsem si dělal legraci z mé ženy, že má noční světlo.",Byla pár dní mimo město a já jsem šla spát bez něj.,"Když jsem se probudil uprostřed noci, abych si vzal vodu, zakopl jsem.",Neviděl jsem oblečení na zemi a dostal jsem špatnou modřinu.,"Rozhodl jsem se, že se natrvalo zbavím nočního světla.",Už jsem si nikdy nevysmíval svou ženu a její noční světlo.,2
1124,Amy se rozhodla přestěhovat se z Wisconsinu na Floridu.,Plánovala ten přesun měsíce.,V den stěhování se rozloučila se svými přáteli.,Jeli jsme na Floridu sami.,"Nicméně, objevila Aljašku jako hodně zábavy.","Nicméně, bez jejích přátel to nebylo zábavné.",2
1125,Kathy šla nakupovat.,Našla pár skvělých bot.,Ty boty stály 300 dolarů.,Koupila ty boty.,Kathy nesnášela nakupování bot.,Po koupi cítila výčitky.,2
1126,Amayah má narozeniny.,Bude jí pět let.,Její máma jí pořádá princezninu.,Pozvala hodně svých kamarádů ze školy.,"Amayah je ráda, že je princezna na její párty.","Amayah je smutná, protože nechce čajovou párty.",1
1127,Dnes jsme s klukama byli na pláži.,Vzali jsme si s sebou frisbee a míč.,"Zatímco jsme si hráli ve vodě, připojili se k nám další lidé.",Bylo skvělé získat nové přátele.,Opravdu jsem si užila setkání s novými kluky.,Celkově to byl skvělý den.,1
1128,"Byl pátek večer, tak jsem si půjčil film.",Šel jsem si pro něj do Redboxu.,Po hodině přemýšlení jsem si konečně vybrala Zmizelé.,"Přišel jsem domů, udělal jsem nějaké svačiny a pak jsem šel dát film.","Byl to nejlepší film, který jsem viděl za dlouhou dobu.",Dala jsem si sprchu a šla do práce.,1
1129,Paula napsala hodně mluvené poezie.,"Její přátelé ji podporovali, i když to bylo špatné.",Pozvali ji na párty.,Paula začala vyslovovat nějaké řeč.,Její přátelé jí tleskali za báseň.,Paula roztrhala svou báseň.,1
1130,"Když jsem vystoupil ze školního autobusu, uvědomil jsem si, že mi chybí telefon.","Protože to bylo na služební lince, rozhodl jsem se to zrušit.",Zástupce zákaznického servisu to udělal za mě.,"Navíc řekl, že tam byl telefonát na Jamajku.","Věděl jsem, že ho někdo ukradl.","Věděl jsem, že mi někdo brzy vrátí telefon.",1
1131,Dneska měla Iris pět narozenin!,Její máma jí naplánovala oslavu.,Byli tam všichni její přátelé.,Otevřela dárky a snědla dort.,Iris se na své párty moc bavila.,"Iris se rozhodla, že už nikdy nebude jíst dort.",1
1132,"Tina vždycky nosila červené bikiny, když šla na pláž.","Byla pro to známá a každý očekával, že ji v jednom uvidí.",Jednoho dne potkala své kamarády v modrých bikinách a překvapila je.,"Nechápali, proč by měla nosit něco jiného.",Líbilo se jim to nové bikiny.,"Tininy kamarádky věděly, jak je nepředvídatelná.",1
1133,"Ted vždycky snil o tom, že bude vlastnit dům.","Ale obával se, že to je cíl, kterého nikdy nedosáhne.","Jednou ho jeho otec překvapil, když mu řekl, že mu pomůže.",Tedův otec pomohl rozdělit zálohu na dům s Tedem.,"Ted řekl, že už nechce být majitelem domu.",Ted byl otci za pomoc vděčný.,2
1134,Evie se po hradě potulovala celé hodiny.,Prozkoumala každý kout a propast budovy.,"Její nadřízení se jí ptali, co se naučila.",Odpovídala na jejich otázky brilantně a s lehkostí.,Byla na sebe pyšná.,Vyděšená utekla.,1
1135,Ed a jeho dvojče Ethan hledali ženy na internetu.,Pak viděli profil dvou dvojčat.,Zavolali Sami a Sáře a domluvili si schůzku.,Na jejich rande si všichni čtyři užili nádhernou chvíli.,O dva roky později se oba párečky vzali.,"Rozhodli se, že se už nikdy neuvidí.",1
1136,Marco dnes začíná novou práci.,Chce vypadat dobře první den.,Marco se rozhodne si vzít kravatu.,"Jeho nový šéf je ohromen tím, jak dobře vypadá.","Marco je rád, že na něj udělal dobrý dojem.",Marco je zděšen reakcí svého šéfa.,1
1137,Tim chtěl cestovat do zahraničí.,Nikdy předtím nebyl v letadle.,Rozhodl se cestovat do Číny letadlem.,Ten let se mu opravdu líbil!,"Tim přísahal, že už nikdy neletí jiným letadlem.",Tim začal cestovat na mnoha místech letadlem.,2
1138,Lucy měla zítra ve škole zkoušku a sotva se učila.,Bylo už pozdě a musela jít do postele.,Druhý den ráno byla škola kvůli sněhu zakryta.,Lucy měla štěstí a strávila celý den učení na test.,Lucy měla na testu špičku.,"Lucy se nezdařila, protože se neučila.",1
1139,Fred měl rád záhadné romány.,Četl alespoň jeden každý měsíc.,"Když to jeho přátelé zjistili, všichni mu jeden koupili k narozeninám.","Ale bohužel, začal být podrážděn tím, že mu věnovali pozornost.","Fred řekl svým přátelům, že si dává pauzu od mysteriózních románů.",Fred založil pro své přátele klub pro čtení mystery románů.,1
1140,Tia měla vlastní pekárnu.,V pekárně dělala krásné koláče.,"Jednoho dne si uvědomila, že jí došly mouky, ačkoli měla velkou objednávku.",Volala po celém městě a konečně nějaké našla.,Tia byla zklamaná.,Tia byla uvolněná.,2
1141,Sarah šla se svými kamarády do akvaparku.,Zaplatili si lístky a oblékli si plavky.,Čekali ve frontě na největší skluz.,Šli dolů po toboganu a měli spoustu legrace.,"Přísahali, že se nikdy nevrátí.",Druhý den se vrátili.,2
1142,Jeb stavěl sochy ze skály.,"Udělal jednu, která vypadala jako želva.",Sam přišel a shodil to.,Jeb začal plakat.,Sam se zasmál a utekl.,"Jeb byl nadšený, že postaví nový.",1
1143,Jeff jede na výlet do deštného pralesa se svou třídou.,"Jeff je nadšený a nemůže se dočkat, až půjde.","Když Jeff dorazil, byl velmi zklamaný.",Deštný prales nebyl vzrušující a nebylo tam nic k dělat.,Jeff se bavil.,Jeff se nudil a byl rozrušený.,2
1144,Dani byla sestrou na JIPce.,Jednou v noci byl její odloučený otec jedním z jejích pacientů.,"Dani to nechtěla, ale ošetřila svého otce.","Když se mu dařilo, mohli spolu mluvit.",Dani nebyla překvapena událostmi toho dne.,Dani poznala svého otce mnohem lépe.,2
1145,Gina byla u kamarádky Ruth.,"Objevila se dívka, kterou neznal, jmenovala se Jane.",Jane byla hrubá a arogantní.,"Gina později zjistila, že Jane je sestra jejího nepřítele Joea.",Takže teď se Jane pořád vyhýbá.,Tak se s Jane šťastně přátelila.,1
1146,Ella strávila den na slunci.,Zapomněla si nanést opalovací krém.,Má pěkný popáleniny!,Ale brzy se vybledl a změnil se na opálenou.,Ella vypadala skvěle a dostala spoustu komplimentů.,Ella strávila další den v dešti.,1
1147,Neil právě dorazil do Keni.,Připojil se k safari skupině.,Viděli různá exotická zvířata.,Neil pořídil fotku za fotkou.,Byl rozsekán lvem.,"Neil složil fotoalbum, když se vrátil domů.",2
1148,Gina se rozhodla poprvé upéct jablečný koláč.,"Byla velmi opatrná, aby přesně dodržovala recept.","Když jí dal do trouby, toužila ho ochutnat.","Ukázalo se, že je to vynikající!",Tak se rozhodla ho vyhodit do koše.,Sdílela recept a koláč se všemi svými přáteli.,2
1149,Pablo chtěl roztrhačku.,Neměl žádné peníze.,"Prošel si skříň, aby zjistil, co by mohl prodat.",Našel medvěda a prodal ho za 50 centů.,Pak si koupil cukroví.,Koupil s ním nějakou limonádu.,1
1150,Anna pronajala sklad pro velkou párty.,"Dekorace byla skvělá, ale něco chybělo.","Pak si Anna uvědomila, že potřebují diskotéku!","Zabezpečila si půjčený míč od společnosti, která dodává zásoby na večírky.",Anna byla zklamaná.,Večírek byl skvělý.,2
1151,"Oscar šel do školky hledat strom, který by mohl zasadit na dvorek.","Měl problém se rozhodnout, který strom si koupit.","Bylo tam hodně stromů, které jsme museli projít.",Nakonec se rozhodl pro bonsai.,Dokonale to sedělo k jeho domácímu dekoru.,"Zničil ho, jakmile se vrátil domů.",1
1152,V tělocvičně se odehrával velký basketbalový zápas.,Já a můj přítel jsme hráli ve stejném týmu.,Hra se stala intenzivní a oba týmy byly na konci vyrovnané.,Zbývaly 4 sekundy a my jsme potřebovali skórovat.,"Vystřelil jsem vítězný koš, který vyhrál zápas pro náš tým.",Odešel jsem z hřiště a nikdy se neohlížel.,1
1153,Dirk byl skvělý klavírista.,Často vystupoval na veřejnosti za peníze.,Během jeho posledního vystoupení se mu odtrhla jedna z kláves.,"Dokončil představení, jak nejlépe uměl, ale hudba byla špatná.",Dirk se styděl.,"Dirkovi se líbilo, jak to znělo.",1
1154,Eva milovala veverky na svém dvorku.,Začala je krmit sendviči s burákovým máslem.,Brzy si na ni zvykli.,Jeden byl zvlášť přátelský.,Eva se bála všech veverek.,Eva byla schopná pohledávat jednu veverku.,2
1155,Andy miloval pláž.,"Zeptal se své matky, jestli by mohli jít na pláž.",Jeho matka vzala Andyho na pláž.,Cestou na pláž začalo pršet.,Andy nenáviděl pláž.,Andy byl smutný.,2
1156,Koupil jsem si telefonní pouzdro s lanýrem.,Potřeboval jsem jeden pro mobil.,Případ přišel bez šňůry.,"Na stránkách bylo, že ten kufřík má držák, ale ne šňůru.",Vrátil jsem telefon.,Cítil jsem se hloupě.,2
1157,Minulý týden jsem si vyměnila prostěradla.,Už jsem měl těch starých dost.,Ty nové vypadají líp a cítí se lépe.,"Myslím, že si je nechám.","Jsem ráda, že nebyly drahé.",Plánuju je rozřezat na proužky.,1
1158,Chase opravdu chtěl novou hračku.,Jeho máma by mu nekoupila novou hračku.,"Poradila mu, aby si šetřil kapesné.",Šetřil si kapesné.,Chase si koupil novou hračku.,Chase utekl z domova.,1
1159,Renee byla inspirována hudbou Eddieho Van Halena.,Rozhodla se naučit hrát na kytaru.,Koupila si elektrickou kytaru a zesilovač.,"Nesnášela, když měla prsty na strunách.","Renee se rozhodla, že si na to bude muset zvyknout.","Renee byla ráda, že se rozhodla naučit hrát na bicí.",1
1160,Bill šel na ryby a chytil spoustu ryb.,"Chytl jich tolik, že některé musel rozdat.",Jeho sousedi byli chudí a byli Billovi za ryby vděční.,Sousedi se konečně postavili na nohy.,"Billovi sousedé ho žalovali, že je zbídačil.",Pro vděčnost za všechny ty ryby pečou Billovi chleba.,2
1161,Minulý týden internet vypadl.,S manželkou jsme se nudili k smrti.,Všechny ostatní možnosti se mi zdály nudné.,Nakonec jsme jen pili a chvíli si povídali.,Nakonec jsme se bavili.,"Byli jsme šťastní, že nemáme internet a že pijeme.",1
1162,Tim chtěl dělat hudbu celý život.,"Tim cvičil celý den, každý den.","Když měl Tim dost písniček, zavolal nahrávacímu studiu.",Studio se rozhodlo nahrát ho a Tim byl šťastný.,"Tim se rozhodl, že nemá rád hudbu.",Tim se stal profesionálním hudebníkem.,2
1163,"Alex podezříval, že jeho kočka Tigger může mít blechy.",Tigger se neustále škrábal ve dne v noci.,"Alex vzal Tiggera k veterináři, aby mu stanovila diagnózu.","Veterinář potvrdil, že Tigger má opravdu blechy.",Dali mu lék proti blechám a vyčistilo se to.,"Alex se rozhodl, že kočičce nedá předepsaný lék.",1
1164,Haley byla mladá vědkyně ve slavné laboratoři.,Každý den tvrdě pracovala na svém aktuálním projektu.,Jeden z jejích kolegů tajně kradl její výzkum.,"Haley to objevil, když to publikoval ve vědeckém časopise.",Haley se cítila jako by byla zrazena.,"Haley cítila, že byla podporována obdivuhodně.",1
1165,Sam chtěl uspořádat párty.,Sam pozval všechny své přátele a sousedy.,Ta párty se velmi rozbouřila.,Všichni hosté odešli z večírku v odporu.,Sam se stal organizátorem večírků.,Sam měl příšernou kocovinu druhý den.,2
1166,Katie nemohla spát.,Šla na špičkách dolů a do kuchyně.,Nalila si sklenici mléka.,Pak ji zahřála v mikrovlnce.,Katie to vypila a šla zpátky do postele.,Katie se rozhodla vypít mléko do kanálu.,1
1167,"Tom mluvil se svou ženou Becky, která měla špatný den v práci.",Rozhodl se jí přinést domů její oblíbené jídlo jako překvapení.,Cestou z práce byla silná dopravní zácpa.,"Když si vzal jídlo, přišel domů mnohem později, než plánoval.","Ale všechno bylo v pořádku, jakmile se obejmali a snědli večeři.","Tom se rozhodl jet do kasina, ale svou rodinu ignoroval.",1
1168,Museli si vybrat sporák pro svůj nový dům.,Nemohli se rozhodnout pro konkrétní značku.,Líbila se jim odolnost Vikingů.,Taky se jim líbila dohoda s Thermadorem.,Už nepotřebovali sporák.,Rozhodli se koupit Vikingův sporák.,2
1169,Jasmine se neučila na svůj velký test z matematiky.,"Myslela si, že to může jen tak zkrotit.","Jasmine brzy pochopila, že to bude velmi těžký test.","Rozhodla se podvádět tím, že se podívá na sousedovy noviny.",Učitel ji chytil a dal jí odklad.,Učitel ji chytil a pochválil její vynalézavost.,1
1170,"Sam se přestěhoval do Los Angeles, aby se stal filmovou hvězdou.","Neměl moc peněz, ale myslel si, že je to jediná možnost.",Po dvou měsících Sam spal v autě a zbankrotoval.,Jednou šel do čínského divadla žebrat.,Sam měl velkou naději.,Sam byl ve velké depresi.,2
1171,Ben se probudil pozdě.,Ben se rozhodl přeskočit snídani a šel do práce.,"V práci jsem měl moc práce na to, abych si udělal přestávku nebo oběd.",Po práci byl Ben chycen v opravdu špatném provozu.,"Ben měl tak velký hlad, že onemocněl.",Ben se rychle dostal domů.,1
1172,Darren přišel pozdě do práce a nemohl najít klíče od auta.,Prohlédl si celý dům.,"Zeptal se své ženy, kde jsou.","Řekla mu, ať si zkontroluje kapsy.",Darren vypnul počítač.,V kapse neměl klíče.,2
1173,Minulý týden jsem měl pohovor.,Moje přítelkyně mi pomohla vybrat novou kravatu.,Šli jsme do obchodu a hledaly hodiny.,"Našel jsem tři, které se mi líbily.",Místo toho jsem si koupila motýlku.,Koupil jsem je všechny.,2
1174,Harry miloval hokej.,Rozhodl se zapsat do místní ligy.,Harry se zúčastnil výběrovek pro tým.,"Harry doufal, že se mu podaří dostat do týmu.",Harry pak odešel z hokejového týmu.,"O pár dní později se Harry dozvěděl, že je v týmu.",2
1175,Malá Sue jezdí na slonovi v zoo.,"Nejdřív se jí to líbilo, ale pak se bála.",Začala plakat pro svou mámu.,Správce zoo musel zastavit slona a dostat ji.,"Sueina máma ji místo toho vzala, aby mazlila kozu.",Sue pokračovala v jízdě na slonovi.,1
1176,Hannah byla úžasná umělkyně.,Vždycky měla přirozený dar.,Rozhodla se zapsat do soutěže umění.,Naštěstí vyhrála nejvyšší cenu.,"Její rodiče trvali na tom, aby většinu šití dělala její babička.",Její rodiče byli velmi hrdí.,2
1177,Jim vynášel odpadky.,Uklouzl na kousku ledu na chodníku.,Jim se těžce zhroutil na chodník.,"Jim cítil, jak se mu něco zlomilo na ruce.",Jim se rozhodl udělat handstand.,Jim byl zraněný a musel zavolat 911.,2
1178,Nesnáším praní prádla.,Sladit ponožky je strašná ztráta času.,"Pokaždé, když si vyperu prádlo, se mi ztratí ponožky.",Už jsem byl unavený z hledání shodných ponožek.,Mně je praní prádla uklidňující.,Vyhodil jsem všechny svoje staré ponožky a koupil si čistě bílé ponožky.,2
1179,Jamesovi bylo dvanáct let a miloval jídlo.,Až do dnešního dne nikdy nepřemýšlel o vaření.,"Jeho matka mu dovolila, aby pomáhal připravit rýži na večeři.","James se naučil, jak zábavné a kreativní může být vaření.","James se rozhodl, že se stane kuchařem, až vyroste.",James už nikdy nevařil.,1
1180,"Lee věděla, že její máma potřebuje nové rukavice a nemohla si je dovolit.",Takže Lee začal pletit pár.,"Pospěšilo jí, aby je dokončila do Vánoc.",Pak je předala své matce.,"Leeho máma byla pyšná na svou dceru, že byla tak pozorná.",Leeho máma hodila rukavice na Leeho a odešla z pokoje.,1
1181,Jennifer byla profesionální copywriterka ve velkém městě.,"Odvedla dobrou práci, ale vždy dostala špatné poznámky na své recenze.","Jennifer zjistila, že se ji její šéf snaží sabotovat!","Rozhodla se, že se svým šéfem konfrontuje s negativními poznámkami.",Jennifer poděkovala svému šéfovi za jeho spravedlnost.,Jennifer vtrhla do jeho kanceláře a vyčistila si šéfa.,2
1182,Lorraine hrála softball.,Byla nejlepší ve svém týmu.,Jednou si při hře vážně protáhla kotník.,Už nemohla hrát.,Lorraine byla nadšená!,Lorraine byla opravdu smutná.,2
1183,Abby a Tammy byly nejlepší kamarádky.,"Oba rádi dělali věci společně, které byly zábavné a kreativní.","Rozhodli se, že si společně vyrobí náramky přátelství a budou je rozdávat.",Abby udělala pět a Tammy dalších sedm.,Tammy už nikdy nemluvila s Abby.,"Rozhodli se, že si ty náramky nechávají pro sebe.",2
1184,Včera v noci byla velká bouře.,Vypnul to elektřinu.,Celá čtvrť neměla elektřinu.,Bylo opravdu chladno a my jsme se báli.,Budeme muset odkrájet sníh.,Pak asi po hodině se zase vrátila elektřina.,2
1185,"Sal byl naštvaný, že se jeho rodiče stěhují.",Stěhovali se do osmého patra budovy.,Nesnášel žít tak vysoko.,"Když se přestěhoval, podíval se z okna svého ložnice.",Sal vyhodil polštář oknem.,Krásný výhled ho přiměl změnit názor.,2
1186,Lydie měla včera večer divný sen.,"Zdálo se jí, že dělá zkoušku ve škole.","Když dělala test, uvědomila si, že si zapomněla vzít kalhoty!","Byla tak zahanbena, že utekla z třídy.","Lydia si přála, aby sen byl skutečný.","Lydie se cítila ulevena, když si uvědomila, že to byl jen sen.",2
1187,Alex potřeboval nějaké potraviny.,"Udělala seznam věcí, které chce koupit.",Sbalila si plátnový pytle.,Šla do obchodu.,Alex si koupil jachtu.,Koupila jídlo.,2
1188,Yolanda nesnáší horské dráhy.,Katie nechápe proč.,"Rozhodla se donutit Yolandu, aby s ní jela.",Yolanda zvracela po celé Katie.,"Katie byla šťastnější, než kdy byla.","Katie litovala, že donutila Yolandu jet na jízdu.",2
1189,"Jedna věc, kterou Tina chtěla dělat v New Yorku, bylo jít do stánku s hot dogy.",Nakonec viděla stánek Nathan a objednala si tradiční.,Jídlo bylo úžasné.,"Bylo to drahé, ale stálo to za to.",Byla smutná kvůli tomu hotdogu.,Byla šťastná s tím hot-dogem.,2
1190,Tammy ráda háčkává.,Vánoce byly za pár týdnů a ona neměla peníze.,Měla nápad vzít si zbytek a udělat z něj deku.,Pak ji zabalí pro svou vnučku Lorelei.,"Tammy byla smutná, že neměla dárek.",Lorelei si tu deku vážila roky.,2
1191,Melinda chtěla jít na horor.,"Chtěla jít sama, aby dokázala, že je statečná.",Melinda šla do kina a koupila si lístek.,Melinda se při sledování filmu velmi bála.,"Melinda si myslela, že ten film byl k popukání.","Melinda si přála, aby si někoho přivedla.",2
1192,"Lamar se dozví, že jednoho odpoledne bude mít nečekané hosty.","Nemá doma žádné jídlo, které by dal svým hostům.",Rozhodl se jim místo toho uvařit čaj.,"Všichni jeho hosté si vychutnávají čaj, který dělá.","Lamar jim dal čaj, aby si ho vzali domů.",Lamar šel do parku.,1
