,input_sentence_1,input_sentence_2,input_sentence_3,input_sentence_4,sentence_quiz1,sentence_quiz2,answer_right_ending
767,Ο Μπεν χρειαζόταν αλλαγή λαδιού στο αυτοκίνητό του.,Ήξερε ότι ήταν αρκετά ακριβά.,Τότε είδε ένα κουπόνι στην εφημερίδα.,Ο Μπεν το έκοψε και το πήγε στο γκαράζ.,Ο Μπεν κατάφερε να αλλάξει το λάδι του.,Ο Μπεν πούλησε το νεφρό του για να πάρει κρακ.,1
768,Ξύπνησα πεινασμένος.,Έριξα ένα μπολ δημητριακά αλλά ανακάλυψα ότι δεν είχα καθόλου γάλα.,Αφού σκέφτηκα να χρησιμοποιήσω νερό αποφάσισα να πάω στο μαγαζί.,Πήγα στη γωνία και πήρα μισό γαλόνι 2%,Γύρισα σπίτι και έφαγα δημητριακά.,Γύρισα σπίτι και έφαγα πίτσα.,1
769,Η Άννα είχε μια δεξαμενή με ψάρια αλμυρού νερού.,Κρατούσε μόνο κοράλλια μέσα.,Μετά αποφάσισε ότι ήθελε και ψάρι.,Αγόρασε μερικά μικρά κλόουνψαρα και πυροκροτητές.,Η Άννα σύντομα επέστρεψε τα ψάρια στο κατάστημα.,Τώρα η Άννα έχει μια δεξαμενή με ψάρια και κοράλλια.,2
770,Η Χόλι ήταν μια όμορφη μαύρη γάτα που ο Λι αγαπούσε πολύ.,"Δυστυχώς, η Χόλι αρρώστησε πολύ και ο Λι έπρεπε να την κοιμίσει.",Ο Λι στενοχωριόταν που του έλειπε η Χόλι κάθε μέρα.,"Μια μέρα, ένα μικρό μαύρο γατάκι εμφανίστηκε στην πίσω πόρτα του Λι.",Ο Λι αποφάσισε να υιοθετήσει ένα κουτάβι.,Ο Λι αποφάσισε να υιοθετήσει το γατάκι.,2
771,Ο Μπομπ χρειαζόταν ένα καινούριο ζευγάρι κάλτσες.,Πήγε στο τοπικό πολυκατάστημα να τα αγοράσει.,Το μαγαζί είχε μια μεγάλη έκπτωση.,Βρήκε τον εαυτό του να αγοράζει πολλά ωραία πράγματα.,Ο Μπομπ πραγματικά απολάμβανε το ταξίδι του για ψώνια.,Ο Μπομπ τα επέστρεψε όλα την επόμενη μέρα.,1
772,Ο νεαρός Ρέτζι λάτρευε να παίζει και να βλέπει αμερικανικό ποδόσφαιρο.,Ο αγαπημένος του παίκτης ήταν ο Τζαμάλ Λιούις.,Ήταν στο αεροδρόμιο του Σολτ Λέικ με την οικογένειά του και είδε τον ήρωά του.,Πήγε και του είπε ότι θα παίξει και επαγγελματικό ποδόσφαιρο.,Ο Τζαμάλ Λιούις του έδωσε προσωπικές συμβουλές και του ευχήθηκε τα καλύτερα.,Ο νεαρός Ρέτζι του είπε να μείνει μακριά του.,1
773,Η Έλλα βρήκε ένα μικρό ρομπίν στο έδαφος.,Ήξερε ότι πρέπει να έπεσε από τη φωλιά της.,Το τύλιξε προσεκτικά και το έκανε ασφαλές σπίτι.,Μετά το τάιζε με σκουλήκια με τα χέρια.,Της άρεσε να φροντίζει το ρομπίν.,Αλλά δεν ήθελε πια το ρομπίν.,1
774,Πήρα την απόφαση να παραιτηθώ από τη δουλειά μου.,Έγραψα την παραίτησή μου.,Πήγα ήσυχα στο γραφείο και το παρέδωσα.,Παραιτήθηκα από τη δουλειά μου.,Τώρα είμαι ελεύθερος να ακολουθήσω μια καριέρα που θα με κάνει ευτυχισμένο.,Θα επιστρέψω στη δουλειά μου αύριο.,1
775,Έβαλα το μαύρο πλαστικό τριαντάφυλλο σε ένα βάζο με νερό.,Το άφησα πάνω στην βιβλιοθήκη μου για μερικές εβδομάδες.,Δέκα άνθρωποι με ρώτησαν γι' αυτό.,"Ήθελαν να μάθουν γιατί είχα ένα ποτισμένο, ψεύτικο λουλούδι.","Ειλικρινά, ούτε εγώ ήξερα γιατί.",Μετά από μερικές εβδομάδες το λουλούδι πέθανε.,1
776,Ο Μπεν αποφάσισε να κεράσει στον εαυτό του έναν καφέ.,Πλήρωσε τον καφέ με την χρεωστική του κάρτα.,"Αργότερα, η τράπεζα του τηλεφώνησε λέγοντας ότι είχε υπερβολική τραπεζική πίστωση.",Του εξήγησαν ότι έπρεπε να πληρώσει τριάντα δολάρια.,Ο Μπεν ήταν απογοητευμένος με την επιπλέον χρέωση.,Ο Μπεν ήταν χαρούμενος όταν του τηλεφώνησαν από την τράπεζα.,1
777,Ο Κρις ήταν στη δεύτερη στάση του την εβδομάδα.,"Καθώς περπατούσε στο αεροδρόμιο, αποφάσισε να εκμεταλλευτεί αυτό το χρόνο.",Εγκατέστησε μια εφαρμογή στο κινητό του και άρχισε να εξασκείται στα γαλλικά του.,Ένας άλλος πελάτης του αεροδρομίου τον άκουσε και του προσέφερε βοήθεια.,Ο προστάτης βοήθησε τον Κρις να μάθει να μιλάει βασικά γαλλικά.,Ο πελάτης δεν κατάλαβε τον Κρις επειδή μιλούσε μόνο κινέζικα.,1
778,"Όταν ήμουν παιδί, η Google ξεκίνησε για πρώτη φορά.",Θυμάμαι να ρωτάω τον πατέρα μου πώς να χρησιμοποιήσω την ιστοσελίδα.,Μου έδειξε πώς να πληκτρολογώ και να ψάχνω οτιδήποτε ήθελα.,Με γοήτευσε και περνούσα κάθε μέρα στο γραφείο μου διασκεδάζοντας.,Έμαθα πολλά από το Google.,Γρήγορα θυμώνω πολύ.,1
779,"Ο Τζεφ ήταν έτοιμος για προαγωγή, για την οποία θα έπρεπε να πάει σε συνέντευξη.","Πήγε σπίτι και μελέτησε πολύ σκληρά, απομνημονεύοντας τις απαντήσεις του.",Προετοίμαζε για πολλές μέρες μέχρι που ένιωσε έτοιμος για τη συνέντευξη.,Πήγε για τη συνέντευξή του και πέρασε με διακρίσεις!,Ήταν ευχαριστημένος όταν του δόθηκε η προαγωγή.,Συνειδητοποίησε ότι έπρεπε να παραιτηθεί από τη δουλειά του.,1
780,Ο Ριτς γεννήθηκε σε μια μεγάλη αγκαλιά με 12 άλλα κουτάβια.,"Όταν ήταν οκτώ εβδομάδων, τον δώρισαν σε μια υπέροχη οικογένεια.",Τον μεγάλωσαν καλά και οδήγησε μια πολύ ευτυχισμένη ζωή.,Τα πράγματα άλλαξαν μια μέρα για τον Ριτς όταν ο ιδιοκτήτης του έπαθε καρκίνο.,Ο Ριτς έμεινε ορφανός και έπρεπε να πάει σε ένα άσυλο.,Ο ιδιοκτήτης του άρχισε να τρέχει 12 μίλια την ημέρα.,1
781,Η Μία αγαπούσε να είναι έξω.,"Ένα καλοκαίρι, αποφάσισε να πάει για ορειβασία.",Μπήκε σε μια ομάδα ανθρώπων που σκαρφάλωναν μαζί.,Ανέβηκαν στο ψηλότερο βουνό στην περιοχή της.,Η Μία πέρασε υπέροχα.,Η Μία θα ήθελε να ήταν μέσα.,1
782,Το αφεντικό του Φρεντ τον κάλεσε στο γραφείο του σταθμού βενζίνης.,Είπε στον Φρεντ ότι οι καιροί ήταν δύσκολοι και έπρεπε να τον απολύσουν.,Ο Φρεντ θύμωσε πολύ γι' αυτό.,Πήρε το αφεντικό του από το κολάρο και τον έριξε κάτω.,Το αφεντικό του Φρεντ τον αγκάλιασε.,Ο συνάδελφος του Φρεντ που τον είδε να επιτίθεται στο αφεντικό του κάλεσε την αστυνομία.,2
783,Η κουνιάδα μου προσπαθεί να εξοικονομήσει χρήματα.,Είναι πρόσφατη χήρα που ζει με σύνταξη.,Πρόσφατα επέστρεψε δύο από τα τρία καλωδιακά.,Της είπα ότι οι κεραίες δουλεύουν καλά τώρα που οι εκπομπές είναι σε υψηλή ευκρίνεια.,Αγόρασε κι άλλα καλωδιακά.,Χαίρεται που το ακούει.,2
784,Ο Βίκτορ πάντα υπερηφανευόταν για το ότι δοκίμαζε νέα τρόφιμα.,"Ωστόσο, δεν έχει φάει ποτέ φιστίκι.",Μια μέρα αγοράζει ένα βάζο με φιστίκια για να τα φάει στο σπίτι.,Του αρέσει η γεύση τους.,Ο Βίκτορ αποφασίζει να αρχίσει να αγοράζει φυστασιά τακτικά.,Ο Βίκτορ συνειδητοποιεί ότι άφησε το πουλόβερ του στο γυμναστήριο.,1
785,Η Σάρον είχε φυλάξει μια τσάντα με άγνωστους σπόρους για χρόνια.,Αποφάσισε μια μέρα να φυτέψει τους σπόρους.,"Η Σάρον τα έβαλε σε φυτώρια, πιστεύοντας ότι θα ήταν μικρά φυτά.",Η Σάρον δεν θα μπορούσε να είχε κάνει μεγαλύτερο λάθος στην υπόθεση της!,Άνοιξε μια μπύρα και πήρε μια γουλιά.,Τελικά έγιναν τεράστια φυτά.,2
786,Ήταν μια υπέροχη μέρα έξω.,Η Έμιλι ήθελε να εκμεταλλευτεί τον υπέροχο καιρό.,Αποφάσισε να πάει στο πάρκο.,Η Έμιλι απογοητεύτηκε όταν έμαθε ότι το αυτοκίνητό της δεν ξεκινούσε.,Ζήτησε από τη γειτόνισσά της να την ξεκινήσει.,Πήγε με το αυτοκίνητό της στον μηχανικό για να το κοιτάξει.,1
787,Ο Τομ ήταν κουρασμένος από την καθημερινότητα.,"Έτσι, αποφάσισε να φύγει από το δίκτυο.","Η πρώτη του εβδομάδα ήταν εντάξει, αλλά σύντομα του τελείωσε το νερό.",Υποφέρει για δύο μέρες και ακόμα δεν μπορούσε να βρει κανένα.,Τελικά ο Τομ επέστρεψε στο δίκτυο.,Ο Τομ λάτρευε την ιδέα της νηστείας.,1
788,Ο Τιμ ήθελε να μάθει αστρονομία.,Ήθελε να πάει στο διάστημα.,Ωστόσο ήταν πολύ νέος για να γίνει αστροναύτης.,Αυτά τα νέα τον θλίψαν.,Ο Τιμ δούλεψε σκληρά στο σχολείο για να γίνει ένας.,Ο Τιμ μισούσε τον Άρη.,1
789,Η κουνιάδα μου δουλεύει σε ένα κέντρο ευγηρίας.,Είναι σερβιτόρα.,Μας έδωσε ένα ημερολόγιο που εκδόθηκε από το κέντρο.,Την έδειχνε ντυμένη για την Ημέρα του Αγίου Πατρίκη.,Όλοι σκεφτήκαμε ότι η αδερφή μου ήταν ξεκαρδιστική ντυμένη έτσι.,Η αδερφή μου μας έκρυβε κάτι.,1
790,Ο Φρεντ αποφάσισε να αγοράσει μετοχές της Apple.,Η τιμή της μετοχής ήταν 90 δολάρια όταν την αγόρασε.,Ευτυχώς είχαν καλά κέρδη χθες.,Η μετοχή ανέβηκε στα 100 δολάρια.,Ο Φρεντ μετάνιωσε για την αγορά των μετοχών του.,Ο Φρεντ ήταν πολύ χαρούμενος.,2
791,Η Τζεν ήταν τόσο σίγουρη για την προετοιμασία της για τον διαγωνισμό ορθογραφίας.,Είχε περάσει τον τελευταίο μήνα μελετώντας το λεξικό κάθε βράδυ.,"Όταν ξεκίνησε η Μπί, η Τζεν επέζησε ενώ οι άλλοι έπεσαν.",Όλα κατέληξαν στους δύο τελικούς και ο αντίπαλος της Τζεν τα είχε κάνει θάλασσα.,Η Τζεν κέρδισε τον διαγωνισμό ορθογραφίας!,Η Τζεν έχασε τον διαγωνισμό ορθογραφίας.,1
792,Η Κέλι δεν έχει βγει από το διαμέρισμά της εδώ και χρόνια.,Πήγα στο σπίτι της σήμερα για να της πω ένα γεια.,Το κατάλαβα ότι ήταν απρόθυμη να με αφήσει να μπω.,Μιλήσαμε για λίγο για το πώς τα πάει.,Η Κέλι λατρεύει τους επισκέπτες.,Η Κέλι έχει agorafobia.,2
793,Η Έμιλι ήταν στην παραλία.,Ο καιρός ξεκίνησε ήρεμος.,Ξαφνικά ο άνεμος άρχισε να ανεβαίνει πολύ.,Η Άννα πιάστηκε σε μια τρομακτική αμμοθύελλα!,Πέρασε υπέροχα στην παραλία.,"Ευτυχώς, κατάφερε να επιστρέψει στο σπίτι της παραλίας με ασφάλεια.",2
794,Ο Άντριου δεν είχε μπλέξει ποτέ σε τίποτα.,Οι γονείς του ήταν εκτός πόλης για μια εβδομάδα.,Ήρθαν οι φίλοι του Άντριου και ήθελαν να πιουν.,Έτσι ο Άντριου πήρε από τους γονείς του κρυφή αποθήκη αλκοόλ.,Ο Άντριου θα ήθελε οι γονείς του να είχαν αλκοόλ.,Ήπιανε το αλκοόλ και μεθύσανε.,2
795,Η Έλεν ζούσε στην εξοχή.,Της λείπουν οι μέρες που δεν έχει ρεύμα.,Μια μέρα μια παγωμένη καταιγίδα προκάλεσε το διακοπή ρεύματος στο σπίτι της στην πόλη.,Έπαθε πολύ κρύο.,Ήταν χαρούμενη όταν επανήλθε το ρεύμα.,Η Έλεν ήταν απόλυτα άνετα.,1
796,Ο Χοσέ ήταν ενθουσιασμένος.,Είχε μόλις πάρει ένα νέο skateboard και ήθελε να το δοκιμάσει.,Το πήγε κατευθείαν στο πάρκο.,Έκανε πατινάζ όλη μέρα.,Ο Χοσέ διασκέδασε στο παγοδρόμιο.,Ο Χοσέ πέταξε το σκέιτμπορντ του.,1
797,Ο Μάικ καθόταν στο γραφείο του.,"Αλλά ξαφνικά, ένιωσε μια παράξενη αίσθηση φαγούρας στο χέρι του.",Ένιωσε και τα πόδια του να τον φαγωθούν.,Και μετά το πρόσωπό του.,Ο Μάικ έπαθε εγκεφαλικό.,Ο Μάικ άρχισε να γελάει υστερικά.,1
798,Η Τζιλ πήγε ταξίδι τον περασμένο μήνα.,Ήθελε να ταξιδέψει από τη Βοστώνη στο Σιάτλ.,"Στο μέσο της δουλειάς, χάλασε το αμάξι της.","Πέρασε ώρες στην άκρη του δρόμου, περιμένοντας για την ΑΑΑ.",Η Τζιλ χάρηκε που έφτασαν τόσο γρήγορα.,Της έφτιαξαν το αμάξι και την έστειλαν στο δρόμο της.,2
799,Ο διευθυντής ανακοίνωσε ότι θα γίνει χορός στο σχολείο την Παρασκευή.,Η Μαίρη ενθουσιάστηκε με τον χορό.,Ήθελε ο Νταν να την καλέσει στον χορό του σχολείου.,Ο Νταν είδε τη Μαίρη στο διάδρομο και της είπε ότι έπρεπε να της μιλήσει.,Την κατηγόρησε για την κλοπή του ποδηλάτου του.,Ήταν χαρούμενη που την κάλεσε στο χορό.,2
800,Ένα νέο κατάστημα Organic Avenue άνοιξε στη Νέα Υόρκη και το τσεκάρισα.,Ήμουν πολύ ενθουσιασμένος που το δοκίμασα γιατί δεν είχα ξαναπάει ποτέ.,"Όταν μπήκα, είχαν καταπληκτικές σαλάτες και χυμούς για να δοκιμάσω.",Δοκίμασα μια καλοκαιρινή σαλάτα και νερό καρύδας.,Αποφάσισα να μην ξαναπάω στο εστιατόριο.,Αυτό ήταν το νέο μου αγαπημένο εστιατόριο.,2
801,Το δωμάτιο της Σίντι είχε λευκούς τοίχους.,Αλλά παραπονιόταν ότι αντανακλούσαν πολύ φως.,Έτσι αποφάσισε να βάψει τους τοίχους της μπλε.,Πίστευε ότι το δωμάτιό της ήταν πιο ήρεμο.,Το μισούσε και άλλαξε σε μαύρη μπογιά.,Ήταν ευχαριστημένη με τα αποτελέσματα.,2
802,Μπήκα σε ένα πρωτάθλημα φανταστικού ποδοσφαίρου για πρώτη φορά φέτος.,Μπήκα στην ομάδα του φίλου μου επειδή χρειαζόταν ένα ακόμα άτομο.,Δεν έχω παίξει ποτέ στη ζωή μου.,Τελικά κέρδισα την πρώτη θέση!,Ήμουν πολύ ενθουσιασμένη.,Ήμουν πολύ απογοητευμένος.,1
803,Η Έλεν σηκώθηκε νωρίς για τη δουλειά.,Χιονίζει το βράδυ και πρέπει να ξεφουσκώσει το αμάξι της.,Της πήρε μια ώρα να καθαρίσει το χιόνι.,"Καθώς επέστρεφε στο σπίτι για να ετοιμαστεί, άκουσε έναν οικείο ήχο.",Είχε αφήσει το ντους ανοιχτό.,Η Έλεν πήγε στη λίμνη για να νοικιάσει τζετ-σκι.,1
804,"Μετά το πρωτάθλημα μπάσκετ, δημοσιογράφοι πήραν συνέντευξη από την ομάδα.",Ο Νταν ρώτησε αν ήταν ζωντανή ή ηχογραφημένη.,Ο δημοσιογράφος τον ενημέρωσε ότι ήταν ζωντανή εκπομπή.,Ο Νταν είπε στην κάμερα ότι ο πατέρας του ήταν η έμπνευσή του.,Ο Νταν θαύμαζε τον πατέρα του.,Ο Νταν ντρεπόταν γι' αυτόν τον πατέρα.,1
805,Ο Τζέρεμι έχει ξεχωριστή και ισχυρή προσωπικότητα.,Είχε μια άσχημη περίοδο με τη δουλειά του και απολύθηκε.,Είπε κάποια δυσφημιστικά πράγματα στον προϊστάμενό του και τους συναδέλφους του.,"Από τότε, δυσκολεύεται να βρει δουλειά.",Ο Τζέρεμι έχει δύσκολους τρόπους για το χώρο εργασίας.,Η συμπεριφορά του Τζέρεμι είναι τέλεια για το χώρο εργασίας.,1
806,Η Φραν αγόρασε ένα σπίτι στην παραλία.,Κάθε μέρα οι γερανοί τρέφονταν από τα έντομα στην αυλή της.,Μια μέρα όμως οι γερανοί σταμάτησαν να έρχονται.,Πέρασαν αρκετοί μήνες και δεν υπήρχαν ακόμα γερανοί.,Η αυλή της Φραν έχει γεμίσει με έντομα.,Η Φραν έπαθε καρδιακή προσβολή ενώ έκοβε λουλούδια.,1
807,Η ομάδα μας είχε ένα παιχνίδι ποδοσφαίρου σήμερα.,Όλοι ήμασταν ενθουσιασμένοι για τη νίκη.,Πήγαμε στο γήπεδο και εξασκηθήκαμε πριν το παιχνίδι.,Η ομάδα μας ήταν ενωμένη και δούλευε μαζί.,Η ομάδα μας ντρεπόταν για την απόδοσή της.,Η ομάδα μας ένιωσε ικανοποιημένη.,2
808,Η Κέλι μισούσε τα μαθηματικά και δυσκολευόταν να μάθει τις έννοιες.,Πολεμούσε πολύ με την εργασία και συχνά αναζητούσε βοήθεια από τους δασκάλους.,Δούλεψε πολύ σκληρά και απέδωσε με καλούς βαθμούς.,Θα μπήκε στο κολέγιο το φθινόπωρο.,Έκοψε το κολέγιο.,Η Κέλι αποφοίτησε με καλούς βαθμούς.,2
809,Η γιαγιά της Σόφι ήταν άρρωστη.,Η Σόφι την επισκέφτηκε στο νοσοκομείο για να της πει αντίο.,Η γιαγιά της έδωσε στη Σόφι το πολύτιμο χρυσό μενταγιόν της.,Είπε στη Σόφι να το κρατήσει για να την θυμάται.,Η Σόφι έκλαψε.,Η Σόφι της γέλασε κατάμουτρα.,1
810,Η Κέλι είχε μια νέα συνέντευξη για δουλειά σήμερα.,Έγινε έτοιμη σε δέκα λεπτά και έτρεξε έξω από την πόρτα.,"Όταν έφτασε εκεί και συνάντησε τη γυναίκα, αυτή απάντησε σε ερωτήσεις.","Όταν τελείωσε η συνέντευξη, της είπαν ότι θα της τηλεφωνούσαν.",Η Κέλι ήλπιζε ότι θα λάβει σύντομα μια κλήση.,Η Κέλι ήλπιζε ότι δεν θα έπαιρνε τηλεφώνημα.,1
811,Ο Ντον παρατήρησε μια μύγα να μπαίνει στο σαλόνι.,Αποφάσισε να το χτυπήσει.,Προσπάθησε για μισή ώρα αλλά συνεχώς του ξεφεύγει.,Τελικά η μύγα πέταξε έξω από μόνη της.,Ο Ντον έκλεισε την πόρτα από την οποία πέταξε έξω.,Ο Ντον δεν ξαναπήγε στη λίμνη.,1
812,Ο Ζακ και οι φίλοι του πέρασαν από ένα τρομακτικό σπίτι στο δρόμο τους για το σχολείο.,"Μια μέρα, αποφάσισαν να μπουν μέσα.",Ο Ζακ και οι φίλοι του μπήκαν σε κάθε δωμάτιο.,Το σπίτι ήταν παλιό και εγκαταλελειμμένο.,Αποφάσισαν να παίξουν μπέιζμπολ εκεί.,Έφυγαν και πήγαν στο σχολείο.,2
813,Η Μία πήγε στο καζίνο χθες το βράδυ.,Ξεκίνησε τη βραδιά παίζοντας πόκερ.,"Αφού έχασε ένα σημαντικό ποσό χρημάτων, έπαιξε στα κουλοχέρηδες.",Της είχαν σχεδόν τελειώσει τα λεφτά όταν το κοπάδι χτύπησε.,Η Μία κέρδισε τζακπότ!,Η Μία έχασε ακόμα περισσότερα χρήματα.,1
814,Η Πόρσια λατρεύει να περπατάει στο δάσος κοντά στο σπίτι της.,"Ωστόσο, παρατηρεί ότι τα αθλητικά της παπούτσια γίνονται βρώμικα και αηδιαστικά.",Αποφασίζει να αγοράσει ένα ζευγάρι μπότες πεζοπορίας.,Η Πόρσια βρίσκει ένα ζευγάρι που είναι άνετο και όχι πολύ ακριβό.,Είναι ευχαριστημένη με την επιλογή της.,Δωρίζει τις μπότες στο κατάστημα.,1
