,input_sentence_1,input_sentence_2,input_sentence_3,input_sentence_4,sentence_quiz1,sentence_quiz2,answer_right_ending
386,Η Τζόαν μισούσε να πηγαίνει σπίτι για τα Χριστούγεννα.,Ήξερε ότι η μητέρα της θα την κυνηγούσε για την ερωτική της ζωή.,"Φέτος, στο δρόμο για το σπίτι της, είχε ένα αυτοκινητιστικό ατύχημα.",Η μητέρα της έτρεξε στο πλευρό της για να φροντίσει τις ανάγκες της.,Η μητέρα της Τζόαν δεν της μίλησε επειδή ήταν ανύπαντρη.,Η Τζόαν ένιωσε καλά που είδε το πρόσωπο της μητέρας της.,2
387,Περνάω όλο μου τον χρόνο δουλεύοντας στο γράψιμο.,Ως αποτέλεσμα άρχισα να αισθάνομαι πολύ μόνη.,Αποφάσισα να μπω σε μια διαδικτυακή κοινότητα γνωριμιών.,"Καθώς εντάσσομαι, συνειδητοποιώ ότι δεν μου αρέσουν ιδιαίτερα οι άλλοι άνθρωποι.",Άρχισα να γράφω περισσότερο.,Είχα πολλά ραντεβού.,1
388,Η κόρη μου ήταν πρόσκοπος στο δημοτικό.,Μια μέρα πήγε σε μια διανυκτερεύουσα εκδρομή.,Η γυναίκα μου πήγε ως συνοδός.,Όλοι έμειναν σε μια καλύβα στο Νιου Χάμσαϊρ για ένα Σαββατοκύριακο.,Η κόρη μου δεν ξέχασε ποτέ την εκδρομή της.,Η γυναίκα μου κι εγώ φάγαμε εκείνο το βράδυ.,1
389,Σήμερα ήταν το άνοιγμα ενός νέου κλαμπ στη γωνία.,Ανυπομονούσα να έρθω.,Όταν μπήκαμε στο κλαμπ ήταν πανέμορφα.,Παρήγγειλαμε νόστιμο φαγητό και χορέψαμε.,Φιλήσαμε με τον φύλακα για να μπούμε στο κλαμπ αύριο.,Ο φύλακας δεν μας άφησε να μπούμε στο κλαμπ.,1
390,Χθες κουβαλούσα ένα καινούργιο ποτήρι στην κουζίνα.,"Προς έκπληξή μου, μου έπεσε.",Το γυαλί έσπασε.,Έπρεπε να το πάρω.,Κόπηκα σε ένα μικρό κομμάτι.,Μου άρεσε ο τρόπος που έμοιαζε το ποτήρι τώρα.,1
391,Η οικογένεια του Μπιλ ζούσε σε ένα λόφο.,Δεν έβρεχε ποτέ εκεί.,Μια μέρα ένας ανεμοστρόβιλος περνούσε από την περιοχή.,Το σπίτι του Μπιλ χτυπήθηκε και η οροφή έσπασε.,Η ασφαλιστική κάλυψε τα έξοδα για μια νέα στέγη.,Αποφάσισαν ότι δεν το χρειάζονταν και μετακόμισαν.,1
392,Η 'λισον αποφάσισε ότι ήθελε να μάθει περισσότερα για την ιστορία της περιοχής της.,Πήγε στη βιβλιοθήκη να διαβάσει ένα βιβλίο γι' αυτό.,Μπήκε μέσα και δεν μπορούσε να καταλάβει πώς ταξινομήθηκαν τα βιβλία.,Βρήκε έναν βιβλιοθηκάριο που του εξήγησε το δεκαδικό σύστημα Ντιούι.,Αυτό την βοήθησε να καταλάβει ποιο αυτοκίνητο δεν ήθελε.,Αυτό την βοήθησε να βρει αυτό που ήθελε.,2
393,Ο Σεμπάστιαν ήθελε να παίξει ποδόσφαιρο στην ομάδα των φίλων του.,Μίλησε με τον φίλο του και έμαθε ότι έπρεπε να πάει στην προπόνηση.,Εξασκούνταν στο να πιάνει την μπάλα όλη την εβδομάδα.,Πήγε στην επόμενη προπόνηση και σκόραρε ένα τάντσαουν.,Ο Σεμπάστιαν απογοητεύτηκε από την επιτυχημένη απόδοση.,Ο Σεμπάστιαν ήταν ευτυχής που η πρακτική του απέδωσε.,2
394,"Μια φορά κι έναν καιρό, μια μητέρα ήθελε απεγνωσμένα να κοιμηθεί το μωρό της.","Τον περιφέρεται, αλλά ακόμα δεν κοιμάται.","Τον τάιζε, αλλά ακόμα δεν κοιμόταν.","Τελικά, θυμήθηκε το νάρκωμα που της είχε τραγουδήσει η μητέρα της.",Η μητέρα τραγουδούσε απαλά το νάρκωμα στο μωρό της.,Η μητέρα έπαιξε λίγο χιπ-χοπ για το μωρό της.,1
395,Ο Τζόνι κατουρούσε σε πισίνες όταν ήταν παιδί.,Νόμιζε ότι θα μπορούσε να το κάνει ως ενήλικας.,Πήγε τα παιδιά του σε ένα θαλάσσιο πάρκο.,Μετά κατούρησε στην πισίνα.,Κάποιοι το πρόσεξαν και ο Τζόνι έμπλεξε.,Όλοι ήταν πολύ χαρούμενοι εξαιτίας της συμπεριφοράς του Τζόνι.,1
396,Η Έιμι έβλεπε τα άλλα παιδιά να παίζουν και κοίταζε το αναπνευστήριό της.,Λόγω του άσθματος δεν μπορούσε να κάνει αθλήματα.,Ένιωσε το χέρι του δασκάλου της στο ώμο της.,Η δασκάλα της χαμογέλασε και είπε στην Έιμι ότι θα γίνει μια μεγάλη καλλιτέχνης μια μέρα.,Η Έιμι ένιωσε πολύ καλύτερα.,Η Έιμι ένιωσε απαίσια.,1
397,Ο Τζο και οι φίλοι του είχαν το παιχνίδι ποδοσφαίρου σήμερα.,Ο Τζο ήταν νευρικός.,Ήταν νευρικός αν θα κερδίσει ή όχι.,"Τελικά, μετά το παιχνίδι, η ομάδα του Τζο κέρδισε.",Ο Τζο ήταν πολύ περήφανος για την ομάδα του.,Ο Τζο ήταν πολύ απογοητευμένος με την ομάδα του.,1
398,Ο Μαρκ είχε μια μεγάλη συνέντευξη για μια νέα δουλειά.,Προετοιμαζόταν για τις ερωτήσεις που μπορεί να του κάνουν.,Ο συνεντευξιαστής φάνηκε να εντυπωσιάστηκε από τις απαντήσεις του Μαρκ.,Ο συνεντευξιαστής ενημέρωσε τον Μαρκ ότι είχε τη δουλειά.,Ο Μαρκ ήταν πολύ χαρούμενος.,Ο Μαρκ ήταν εξοργισμένος και βγήκε έξω.,1
399,Η Ελέιν δεν ήθελε να μαγειρέψει απόψε.,"Γι' αυτό, η Ελέιν αποφάσισε να βγει έξω για φαγητό.","Ωστόσο, η Ελέιν δεν ήξερε πού ήθελε να φάει.",Η Ελέιν σκεφτόταν πού να πάει για σχεδόν μια ώρα.,Η Ελέιν δεν δυσκολεύτηκε να αποφασίσει.,Η Ελέιν δυσκολεύτηκε να αποφασίσει.,2
400,Ο Σαμ προσπαθούσε να μπει στο κολέγιο των ονείρων του.,Πέρασε πολύ χρόνο συμπληρώνοντας την αίτηση.,Τον έκανε να νιώθει καλά για τα ακαδημαϊκά του επιτεύγματα.,Αυτός υπέβαλε την αίτηση.,3 μήνες αργότερα έλαβε μια επιστολή αποδοχής.,Δεν το ξανασκέφτηκε ποτέ.,1
401,Ο Ματ αποφάσισε να πάει σε μπαρ με τους δύο φίλους του ένα βράδυ.,Ήπιανε 3 σφηνάκια σε ένα μπαρ.,"Πήγαν σε 4 ακόμα, πίνοντας 3 σφηνάκια σε κάθε ένα.",Ο Ματ μεθύστηκε και έχασε το κινητό του.,Ο Ματ και οι φίλοι του πήγαν σπίτι και κοιμήθηκαν.,Ο Ματ δεν νοιαζόταν για το χαμένο τηλέφωνο.,1
402,Η Μπίντου σχεδίασε ένα πάρτι με τις φίλες της.,Συναντήθηκαν στο σπίτι της για να συζητήσουν τι φαγητό και τι μπάντα θα χρησιμοποιήσουν.,Ένας από τους φίλους του Μπίντου έφερε σαμόσες και ντούγκ.,Τέσσερις φίλοι έπαιξαν μουσική στο πάρτι.,Όλοι πέρασαν υπέροχα.,Η Μπίντου μισεί τους φίλους της και τα πάρτι.,1
403,Ο Τάιλερ ξυπνάει και θέλει να κάνει μπάνιο πριν το σχολείο.,Ο μικρός του αδερφός κάνει ντους.,Ο Τάιλερ ανησυχεί ότι θα χάσει το λεωφορείο.,Τελικά είναι η σειρά του Τάιλερ να κάνει ντους.,Ο Τάιλερ έφτιαχνε κεκάκια για να επιδείξει τις ικανότητές του.,Ο Τάιλερ κάνει ένα γρήγορο ντους και φτάνει στην στάση του λεωφορείου στην ώρα του.,2
404,Ο Τόμας δεν είχε την αίσθηση του ραντάρ τελευταία.,Πήγε στον γιατρό του για να κάνει έλεγχο.,Ο γιατρός του είπε ότι τα επίπεδα χοληστερόλης του ήταν λίγο υψηλά.,Ο Τόμας άρχισε να τρώει πιο υγιεινά και να κάνει βόλτες.,Διαγνώστηκε με διαβήτη αφού πήρε 40 κιλά.,Ο γιατρός του ήταν πολύ ευχαριστημένος στην επόμενη εξέταση του.,2
405,"Χτύπησε το κουδούνι, αλλά δεν ήταν κανείς εκεί.",Δεν ήταν σίγουρη αν θα άνοιγε την πόρτα ή όχι.,Αργά άνοιξε την πόρτα και κοίταξε έξω.,Ο αδερφός της την χτύπησε και την τρόμαξε.,Αποφάσισε να δει την αγαπημένη της κωμική σειρά στο Netflix.,Φώναξε και έσπρωξε τον αδερφό της μακριά.,2
406,Η Στέφανι ήθελε να φτιάξει σάλτσα μήλου.,Αποφάσισε να πάει στην αγορά για να μαζέψει μερικά νόστιμα μήλα.,"Καθώς περπατούσε στον κήπο, σκοντάφτηκε και έπεσε.",Έσπασε και τους δύο καρπούς της.,Η Στέφανι έσπρωξε τον εαυτό της με τα χέρια της.,Η Στέφανι δεν μπορούσε να σηκωθεί μέχρι να την βρει κάποιος.,2
407,Ο Ρόι δεν μπορούσε να καταλάβει γιατί το διαμέρισμά του μύριζε τόσο άσχημα.,Οι φίλοι του σχολίασαν όταν πήγαν εκεί.,Όλοι αποφάσισαν να ψάξουν για την πηγή.,Αποδείχθηκε ότι ήταν ένα παλιό ψάρι στο ψυγείο.,Ο Ρόι αποφάσισε να αφήσει το ψάρι στο ψυγείο.,Ο Ρόι πέταξε έξω τον γέρο ψαρά και όλα μύριζαν καλύτερα.,2
408,Ο Τζίμι μεγάλωσε πολύ φτωχός.,"Ωστόσο, οι γονείς του έκαναν πάντα το καλύτερο δυνατό για να τον φροντίζουν.","Όταν μπήκε σε καλό κολέγιο, δούλευαν σε δύο δουλειές για να το αντέξουν οικονομικά.","Όταν αποφοίτησε, ήθελε να δείξει την εκτίμησή του.",Έτσι τους ξεπλήρωσε για το κολέγιο.,Ο Τζίμι κάλεσε τους γονείς του και τους έβρισε.,1
409,Η Τζιλ ξαφνιάστηκε όταν ένα όμορφο αγόρι την κάλεσε στο χορό του κολλεγίου.,"Καθώς οι συγκάτοικοι της ετοιμαζόντουσαν, η Τζιλ ταράχτηκε με τα μαλλιά της.",Οι συγκάτοικοι της Τζιλ είπαν ότι μπορούν να βοηθήσουν.,Η Τζιλ τελείωσε να ντύνεται με το λευκό της φόρεμα.,Η συνοδός της έφτασε και της έκανε κομπλιμέντα για την εμφάνισή της.,Η Τζιλ και οι φίλες της πέρασαν μια ωραία βραδιά μόνο για κορίτσια.,1
410,Ένας ιδιοκτήτης μπαρ έβαλε ένα μεγάλο πανό για να διαφημίσει το μπαρ του.,Ο άνεμος ήταν δυνατός και πήρε το πανό.,Ο ιδιοκτήτης κυνήγησε το απαγορευμένο του στην άλλη άκρη της πόλης.,Κατέληξε στην αυλή μιας γριάς.,Η γριά αρνήθηκε να δώσει πίσω το πανό.,Η γριά ήταν ενθουσιασμένη που βρήκε το γούνινο παλτό.,1
411,Η μητέρα μου έχει μια συνταγή για τα μπαρ κολοκύθας που μου αρέσει πολύ.,Μια φορά μου τα έφτιαξε επειδή είχα μια άσχημη μέρα.,Έφαγα τις μπάρες κολοκύθας και ένιωσα πολύ καλύτερα.,Οι μπάρες μου θύμισαν ότι η μητέρα μου νοιάζεται για μένα.,Δεν έφαγα ποτέ μου μπάρες κολοκύθας μετά από εκείνη την ημέρα.,Έφτιαχνα μπάρες κολοκύθας αργότερα στη ζωή μου και μου θύμιζαν τη μαμά μου.,2
412,Ο Τιμ αποφάσισε να περνάει περισσότερο χρόνο με τον παππού του.,"Ο παππούς του λάτρευε την παρατήρηση των πουλιών, έτσι ο Τιμ παρακολουθούσε μαζί του.",Σημείωσαν τις παρατηρήσεις τους σε ένα σημειωματάριο.,Σύντομα ο Τιμ ενδιαφέρθηκε πραγματικά!,Ο Τιμ αποφάσισε ότι δεν τον ενδιαφέρουν πια τα πουλιά.,Ο Τιμ και ο παππούς του βρήκαν ένα χόμπι που τους άρεσε και στους δύο.,2
413,Ο Ντάνι δούλευε στο τοπικό παγωτατζίδικο αυτό το καλοκαίρι.,Ήταν πολύ ενθουσιασμένος που ξεκίνησε την πρώτη του δουλειά.,Την πρώτη του μέρα ένα μικρό αγόρι έριξε το παγωτό του στο πάτωμα.,"Χωρίς δισταγμό, ο Ντάνι ήξερε ακριβώς τι να κάνει.",Του έδωσε άλλη μια κουταλιά παγωτό.,Αρνήθηκε να του δώσει άλλη μια σούπα.,1
414,Το κουδούνι του σχολείου χτύπησε όταν το ρολόι χτύπησε τις 2.,Η Τζίνα δεν ήταν ποτέ πιο χαρούμενη για να τελειώσει μια μέρα.,Πήρε τα πράγματά της και περίμενε στην πόρτα την Τάμι.,Αλλά η Τάμι έφευγε με τη Ρίτα και τη Μαίρη.,Η Τζίνα ένιωθε μοναξιά όταν γύρισε σπίτι.,Η Τζίνα ευχαρίστησε την Τάμι την επόμενη μέρα.,1
415,Ο Λόρενς και η οικογένειά του αποφάσισαν να μετακομίσουν.,Πρώτα μάζεψαν τα έπιπλα τους.,Μετά μάζεψαν τα πάντα.,Όλα τα υπάρχοντά τους μεταφέρθηκαν στο φορτηγάκι.,Ο Λόρενς και η οικογένειά του οδήγησαν στο νέο τους σπίτι.,Ο Λόρενς έβαλε όλα τους τα υπάρχοντα πίσω στο σπίτι.,1
416,Η Τζόι ήθελε να βρει το τέλειο κέλυφος για τον καβούρι της.,"Θα μπορούσε να αγοράσει ένα, αλλά θα ήταν πιο ξεχωριστό αν το έβρισκε.",Έψαχνε την παραλία όλο το πρωί.,Όλα όσα θα μπορούσαν να δουλέψουν ήταν χαλασμένα!,Έπρεπε να αγοράσει ένα κέλυφος τελικά.,Έτσι έφερε ένα σπίτι και το έδωσε στο καβούρι της.,1
417,Ο Γουέστιν παντρεύτηκε!,Ήθελε ο γάμος του να πάει τέλεια.,Όλα πήγαν καλά μέχρι το βράδυ.,Κάποιος μεθούσε πολύ και έπεσε μέσα στην τούρτα!,Ο Γουέστιν έκοψε μια τέλεια φέτα από την τούρτα.,Ο Γουέστον και η γυναίκα του έδιωξαν τον μεθυσμένο.,2
418,Ο Τζο βοηθούσε τον πατέρα του να καθαρίσει το δάσος στην πίσω αυλή τους.,Ξαφνικά άκουσε ένα δυνατό βουητό.,Είχε αναστατώσει μια φωλιά μελισσών.,Τον τσίμπησαν έξι φορές πριν μπορέσει να δραπετεύσει.,Ο Τζο γέλασε με την εμπειρία.,Ο Τζο ήταν θυμωμένος που τραυματίστηκε.,2
419,Ήταν φθινόπωρο.,Η αυλή του Τοντ ήταν γεμάτη φύλλα.,Αποφάσισε ότι έπρεπε να τους ξεσκίσει όλους.,"Μόλις τελείωσε, τα έβαλε όλα σε μια τσάντα.",Ο Τοντ τα πέταξε στα σκουπίδια.,Ο Τοντ άνοιξε την τσάντα και έριξε τα φύλλα.,1
420,Ο Τιμ ονειρευόταν να γίνει μεγάλος bodybuilder.,Έκανε γυμναστική κάθε βράδυ για να φτάσει το στόχο του.,Η σκληρή δουλειά του απέδωσε και κέρδισε μια θέση σε έναν δημοφιλή διαγωνισμό.,"Έδειξε τις ικανότητές του, σηκώνοντας πάνω από 250 κιλά.",Ο Τιμ ήταν πολύ αποφασισμένος.,Ο Τιμ δεν είχε αποφασιστικότητα.,1
421,Ο Χένρι πήγαινε στην τάξη του.,"Την ίδια στιγμή, προσπαθούσε να καθαρίσει την οθόνη του τηλεφώνου του με ένα πανί.","Δυστυχώς, κάποιος τον έπεσε πάνω.",Το κινητό του έπεσε από το χέρι του και έπεσε στο έδαφος.,Το άτομο ζήτησε συγγνώμη από τον Χένρι.,Ο Χένρι ήταν ευτυχισμένος και ευγνώμων.,1
422,Η Τάμι αποφάσισε να πάει στις δοκιμές του βόλεϊ.,"Ήταν μόνο στην 8η τάξη, αλλά ήξερε ότι ήταν καλή.",Έπαιξε σκληρά και έδωσε τα πάντα.,Δεν περίμενε ότι οι άλλοι παίκτες θα ήταν τόσο καλοί όσο εκείνη.,Η Τάμι μπήκε στην ομάδα μπάσκετ.,"Όλοι οι παίκτες ήταν καλοί, αλλά αυτή μπήκε στην ομάδα.",2
423,Ο Μπομπ και ο Τζιμ έπαιζαν μπάλα στο σπίτι μια μέρα.,Έριξαν το βάζο και έσπασε σε πολλά κομμάτια.,Φοβόντουσαν ότι η μαμά τους θα τους θυμώσει.,Βρήκαν λίγη κόλλα και κόλλησαν το βάζο προσεκτικά.,Η μαμά τους απολάμβανε το νέο της σπασμένο βάζο.,Η κόλλα κράτησε το βάζο μαζί και η μαμά τους δεν το ανακάλυψε ποτέ.,2
424,Ο Στιβ ήταν πολύ λυπημένος.,Η κοπέλα του Στιβ τον χώρισε.,Αποφάσισε να της γράψει ένα τραγούδι.,Έριξε την καρδιά του στο τραγούδι.,Ο Στιβ αναρωτιόταν αν θα μπορούσαν ποτέ να ξανασμίξουν.,Ο Στιβ πήγε σε στριπτιτζάδικο για να πάρει ναρκωτικά.,1
425,Η Γκλόρια ήθελε να αγοράσει λουλούδια για τον άντρα της.,Η Γκλόρια σοκαρίστηκε από την τιμή έστω και μιας μισής ντουζίνας κρίνων.,Η Γκλόρια αποφάσισε να μαζέψει μερικά από τα λουλούδια της στον κήπο.,Έφερε μαζί της νάρκισες και χρυσαvτέμους.,Η Γκλόρια ζήτησε διαζύγιο λίγο μετά.,Ο σύζυγος της Γκλόρια εκτίμησε τη χειρονομία.,2
426,Ο Τζος έπαιζε μπάσκετ κάθε μέρα.,Στόχος του ήταν να μπορεί να κάνει οποιοδήποτε καλάθι στο γήπεδο.,"Μια μέρα, κάποιος τον πρότεινε σε έναν διαγωνισμό.",Όποιος κάνει τις περισσότερες βολές θα είναι ο νικητής!,Ο Τζον το έσκασε φωνάζοντας από τρόμο.,Έκανε τα περισσότερα χτυπήματα και κέρδισε τον διαγωνισμό.,2
427,Η Λόρεν πάντα ήθελε να φοράει skinny τζιν στα πάρτι.,"Ωστόσο, πρέπει να χάσει βάρος ώστε τα skinny jeans να φαίνονται καλά.",Η Λόρεν αρχίζει ένα προκλητικό πρόγραμμα άσκησης.,Τελικά έχασε αρκετό βάρος για να φοράει skinny jeans.,Τα φορούσε με υπερηφάνεια στο επόμενο πάρτι.,Ζήλευε.,1
428,Πήγα στη Χαβάη στο λύκειο.,Όλη η τάξη μας θα πήγαινε.,Χρειάστηκαν 9 ώρες για να πετάξουμε εκεί.,Ήταν ένας τροπικός παράδεισος.,Αποφάσισα ότι ήθελα να πάω στη Χαβάη περισσότερο.,Η Χαβάη δεν ήταν καλό μέρος για να ταξιδέψεις.,1
429,"Ο Σόνι ζούσε στο Τέξας, και ήταν ένα ζεστό καλοκαίρι.",Ήταν τόσο άρρωστος από τη ζέστη.,Αποφάσισε να βρει έναν τρόπο να ηρεμήσει.,"Στην αρχή, δεν μπορούσε να σκεφτεί τίποτα.",Αποφάσισε να πάει να ανοίξει τις θερμαντήρες του.,Τότε αποφάσισε να πηδήξει στην πισίνα του.,2
430,Ο Τσαντ ήταν απίστευτος τραγουδιστής.,Απλά φοβόταν να τραγουδήσει.,Ήθελε να μπει σε εκκλησιαστική χορωδία αλλά νόμιζε ότι οι φίλοι του θα γελούσαν.,Επειδή ντρέπεται για την ικανότητά του και το πάθος του.,Ο Τσαντ είχε το θράσος να κάνει την κωμωδία του.,"Αντί να γελάσουν, όλοι χειροκρότησαν όταν ο Τσαντ τελικά τραγούδησε.",2
431,"Ο Ρόναλντ είχε δύο παιδιά, ένα αγόρι και ένα κορίτσι.",Αυτό ήταν περισσότερο από αρκετό.,Δεν ήθελε να είναι ειλικρινείς.,Μια μέρα η γυναίκα του του είπε ότι το τρίτο μωρό ήταν στο δρόμο.,Ήταν πολύ δυστυχισμένος αλλά φοβόταν να φύγει.,Τα μάτια του έλαμψαν από ενθουσιασμό.,1
432,Πήγα βόλτα την περασμένη Τετάρτη.,"Καθώς περπατούσα, έπεσα πάνω σε κάτι που με τρόμαξε.",Μπροστά μου ήταν ένα φίδι 4 ποδιών με μαργαριταρένια μάτια.,Φώναξα και έτρεξα πίσω στον κεντρικό δρόμο.,Είμαι βιολόγος που μελετά τα φίδια.,Ακολούθησα το δρόμο πίσω στο αυτοκίνητό μου.,2
433,Η Μαίρη ήθελε να πίνει καφέ κάθε πρωί.,Σήμερα βιαζόταν.,Πήγε σε ένα καφέ με αυτοκίνητο.,"Παρατήρησε ότι ο καφές ήταν σε λάθος σειρά, αφού έφυγε.",Η Μαίρη έπεσε σε μια δημοσκόπηση.,Η Μαίρη συνέχισε να οδηγεί και το ήπιε έτσι κι αλλιώς.,2
