,input_sentence_1,input_sentence_2,input_sentence_3,input_sentence_4,sentence_quiz1,sentence_quiz2,answer_right_ending
1103,Ο Σάμι είχε τρομερό στομαχόπονο ένα πρωί.,Αλλά αναγκάστηκε να πάει σχολείο.,"Καθώς πλησίαζε το λεωφορείο, σκέφτηκε να γυρίσει πίσω.",Αλλά ένιωσε ότι ήταν πολύ αργά για να αλλάξει γνώμη.,Κάθισε στο πεζοδρόμιο και είδε το λεωφορείο να περνάει από δίπλα της.,Πήγε στο σχολείο και υπέφερε από τον πόνο.,2
1104,Η Κάρμεν ήταν έτοιμη για το ταξίδι της στην Τανζανία.,Πήρε ταξί για το αεροδρόμιο.,Πέρασε από την ασφάλεια του αεροδρομίου γρήγορα.,Έπιασε την πτήση της στην ώρα της και βρήκε την θέση της.,Το αεροπλάνο απογειώθηκε και η Κάρμεν χαλαρώθηκε.,Η Κάρμεν βγήκε αμέσως από το αεροπλάνο.,1
1105,Η Σάντι ζούσε στη Νέα Υόρκη.,Η Σάντι άκουσε για μια επικίνδυνη χιονοθύελλα που έρχεται προς τα εκεί.,Η Σάντυ αποφάσισε να φροντίσει να είναι το σπίτι της προετοιμασμένο.,"Κατά τη διάρκεια της χιονοθύελλας, έπεσε το ρεύμα.",Ο Σάντι αποφάσισε να βγει έξω και να φτιάξει χιονάνθρωπο.,Η Σάντι ήταν προετοιμασμένη.,2
1106,Ο Κουέντιν δεν του αρέσει να πηγαίνει σε εταιρικές εκδηλώσεις.,"Αν και δεν τον πειράζουν οι συνάδελφοί του, του αρέσει να μένει μόνος.",Μια μέρα αποφασίζει να πάει σε ένα πάρτι της εταιρείας.,Τρώει μερικές πατάτες για να μην νιώθει αμήχανα.,Ο Κουέντιν κατέληξε να απολαμβάνει το πάρτι.,Ο Κουέντιν αγαπούσε να είναι με όλους τους ανθρώπους.,1
1107,Χρησιμοποιώ τον κύριο Σπυρί χωρίς σάλτσα νατρίου.,Είμαι σε δίαιτα χαμηλής περιεκτικότητας σε νάτριο.,Προσπάθησα να αγοράσω μερικά μπουκάλια στο διαδίκτυο χθες.,"Ο υπολογιστής απέρριπτε την παραγγελία μου, παρόλο που η κάρτα ήταν ενεργή.",Ήμουν χαρούμενος για το πόσο εύκολο ήταν να τοποθετήσει την παραγγελία.,Τελικά η πώληση έγινε.,2
1108,Ο Νταν ήθελε να πάει στο σχολείο το Χάλογουιν ντυμένος σαν ο διάβολος.,Φοβόταν να ζητήσει από τον πατέρα του τη στολή.,Ζήτησε από τη γιαγιά του.,Του είπε ότι το να πάει ως ο διάβολος είναι κακό.,Η γιαγιά του Νταν ήταν ήδη ντυμένη σατανά.,Ο Νταν έφτιαξε το δικό του κοστούμι του Διαβόλου.,2
1109,Ο Φραντς αποφασίζει ότι θα ήθελε να είναι πιο κοντά στην οικογένειά του.,Κλείνει ταξίδι για να επισκεφτεί τον ξάδερφό του στη Φιλαδέλφεια.,Ο Φραντς και ο ξάδερφός του επισκέπτονται μουσεία και πίνουν καφέ μαζί.,Έχουν μια φοβερή επίσκεψη μαζί.,Ο Φραντς ορκίζεται να μην επισκεφτεί ποτέ ξανά τον ξάδερφό του.,Ο Φραντς είναι χαρούμενος που πήγε να επισκεφτεί τον ξάδερφό του.,2
1110,Αγόρασα έναν κέρατο βάτραχο όταν ήμουν δέκα.,Ήταν σε ένα πολυκατάστημα.,Ο βάτραχος φαινόταν πολύ άγριος.,Προσπαθήσαμε να το ταΐσουμε αλλά δεν ήθελε να φάει.,Τελικά ο κέρατος βάτραχος πέθανε από την πείνα.,"Μετά από αρκετές εβδομάδες, ο κέρατος βάτραχος ήταν πολύ χοντρός.",1
1111,Σήμερα γνώρισα την Νάνσι για πρώτη φορά.,"Πριν φύγει, ανταλλάξαμε αριθμούς τηλεφώνου.","Παρά το γεγονός ότι περπάτησε για μια στιγμή, μου έστελνε συνεχώς μηνύματα.",Αποφάσισα να της τηλεφωνήσω και να της ζητήσω να σταματήσει να μου τηλεφωνεί.,Της άρεσε να τρώει μπανάνες.,Δεν άκουσα ποτέ ξανά νέα της.,2
1112,Χθες η Κέλι πήγε στο ΚΒΣ να αγοράσει καραμέλες.,Περπατούσε πάνω κάτω στους διαδρόμους για να βρει αυτό που ήθελε.,"Προς έκπληξή της, όμως, έπεσε πάνω σε έναν παλιό φίλο.",Οι δύο μίλησαν για λίγο.,Και οι δύο συνελήφθησαν.,Η φίλη της κατέληξε να αγοράζει τα γλυκά για εκείνη.,2
1113,Η πρώτη μέρα του Ντον στην αποβάθρα είχε μερικά προβλήματα.,Ήταν νευρικός κοντά σε βαριά μηχανήματα.,Κάποια στιγμή έριξε ένα βαρύ φορτίο.,Παραλίγο να χτυπήσει έναν συνάδελφο.,Ο Ντον ήταν χαρούμενος που δεν ήταν νευρικός στη δουλειά.,Ο Ντον ήξερε ότι θα έπρεπε να βελτιωθεί.,2
1114,Ο Νταλ χρειαζόταν λεφτά για να πάει στο κολέγιο.,Άρχισε να κάνει λογιστική για μια τοπική συμμορία.,"Όταν οι ομοσπονδιακοί επιτέθηκαν στην συμμορία, έλεγχε τα βιβλία τους.",Τον πυροβόλησαν κατά λάθος στο σταυροβόλο.,Ο Νταλ πήρε μια κακή απόφαση.,Ο Νταλ πήρε μια έξυπνη απόφαση.,1
1115,Σήμερα ήταν η μέρα των φωτογραφιών στο σχολείο.,Η 'λις ήταν τόσο ενθουσιασμένη επειδή η μαμά της της αγόρασε ένα καινούργιο ρούχο.,Σηκώθηκε και ντύθηκε και η μαμά της έφτιαξε τα μαλλιά της.,Ο φωτογράφος είπε ότι ήταν πολύ όμορφη.,Η 'λις ένιωσε καλά αφού ο φωτογράφος την κομπλιμένταρε.,Η 'λις έσφιξε τα μούτρα της κατά τη διάρκεια της φωτογραφίας της.,1
1116,Η μαμά της Νίλα διαγνώστηκε με καρκίνο στο τέταρτο στάδιο.,Η Νίλα ήξερε ότι η μαμά της δεν είχε πολύ χρόνο να ζήσει.,Η Νίλα φρόντισε να έχει μια καλή ζωή η μητέρα της μέχρι το θάνατό της.,Η Νίλα είχε πολλές καλές αναμνήσεις με τη μαμά της και ήταν ευτυχισμένες.,Η Νίλα δεν νοιαζόταν για τη μητέρα της.,Η Νίλα αγαπούσε τη μαμά της.,2
1117,Μια μητέρα κοίταξε το πρόσωπο του νεογέννητου αγοριού της.,Ονειρευόταν το μέλλον τους μαζί.,Το όνειρό της ήταν να του δώσει την παιδική ηλικία που δεν της δόθηκε.,Θυσίασε χρόνο και ενέργεια για να επιτύχει το στόχο της.,Το αγόρι υπέφερε στην παιδική του ηλικία.,Το αγόρι είχε μια πολύ ευτυχισμένη παιδική ηλικία.,2
1118,Η Τζέσικα και τα αδέρφια της ήταν πολύ ενθουσιασμένοι για τα Χριστούγεννα.,Πήγαν για ύπνο νωρίς για να ξυπνήσουν νωρίς.,Ξύπνησαν και έτρεξαν στο χριστουγεννιάτικο δέντρο.,Υπήρχε μόνο ένα κουτί κάτω από το δέντρο.,Η Τζέσικα αναρωτήθηκε αν ξύπνησαν νωρίς.,Κάθε ένας από τους αδελφούς της άνοιξε τα δώρα των Χριστουγέννων.,1
1119,Η Τζαν και η Κιμ χρησιμοποιούσαν το μοντέλο εκπαίδευσης Μοντεσσόρι.,Η Κιμ αποφάσισε να πάρει όλα τα βιβλία δράκων και φαντασίας από το παιδί της.,Η Τζαν ήταν αναστατωμένη που η Κιμ πήρε αυτή την απόφαση.,Ο Τζαν υποστήριξε ότι η φαντασία και η φαντασία ήταν σημαντικές.,Η Τζαν πέταξε τα βιβλία.,Η Τζαν έφερε πίσω τα βιβλία.,2
1120,Την πρώτη μέρα στο σχολείο πήγα με δύο από τους καλύτερους φίλους μου.,Ήμασταν όλοι πολύ νευρικοί.,"Όταν φτάσαμε στο σχολείο, ελέγξαμε την λίστα της τάξης για την τρίτη τάξη.",Και οι τρεις μας διορισθήκαμε στην ίδια τάξη!,Δεν μπορούσαμε να πιστέψουμε την τύχη μας.,Και οι τρεις μας ήμασταν πολύ απογοητευμένοι.,1
1121,Ο Τζεφ ήταν θυμωμένος που ο σκύλος του γείτονα του γαβγίζει πάντα το πρωί.,Και το γαβγίσμα πάντα ξυπνούσε τον Τζεφ νωρίς.,"Μια μέρα, ο γείτονάς του έδωσε το σκυλί του.",Και ο Τζεφ ήταν χαρούμενος που δεν άκουσε άλλο γαβγίσματα.,Ο Τζεφ θα είχε επιτέλους γαλήνη και ησυχία.,Ο Τζεφ θα έχανε το σκυλί.,1
1122,Η Χόλι ζήτησε από τον αδερφό της να της βάλει αντηλιακή λοσιόν στην πλάτη.,Πήρε τον χρόνο του και την εφάρμοσε πολύ προσεκτικά.,"Αργότερα εκείνη την ημέρα, η Χόλι αναρωτήθηκε γιατί γελούσαν οι άνθρωποι.",Αργότερα συνειδητοποίησε ότι ο αδελφός της είχε κάνει ένα σχέδιο με την λοσιόν.,Η Χόλι φώναξε στον αδερφό της για να του το πάρει.,Η Χόλι έδωσε στον αδερφό της χρήματα ως αποζημίωση.,1
1123,Πλάκα έκανα με τη γυναίκα μου που είχε νυχτερινό φως.,Έλειπε για λίγες μέρες και πήγα να κοιμηθώ χωρίς αυτό.,"Όταν ξύπνησα στη μέση της νύχτας για να πάρω νερό, σκοντάψα.",Δεν έβλεπα τα ρούχα στο έδαφος και πήρα μια άσχημη μελανιά.,Αποφάσισα να ξεφορτωθώ το νυχτερινό φως.,Δεν ξαναγέλασα ποτέ με τη γυναίκα μου και το νυχτερινό της φως.,2
1124,Η Έιμι αποφάσισε να μετακομίσει από το Ουισκόνσιν στη Φλόριντα.,Σχεδίαζε την μετακόμιση για μήνες.,"Την ημέρα της μετακόμισης, αποχαιρέτησε τους φίλους της.",Οδήγησε μόνη της μέχρι τη Φλόριντα.,"Ωστόσο, ανακάλυψε ότι η Αλάσκα ήταν πολύ διασκεδαστική.","Ωστόσο, η εμπειρία δεν ήταν διασκεδαστική χωρίς τους φίλους της.",2
1125,Η Κάθι πήγε για ψώνια.,Βρήκε ένα ζευγάρι υπέροχα παπούτσια.,Τα παπούτσια ήταν 300 δολάρια.,Αγόρασε τα παπούτσια.,Η Κάθι μισούσε να αγοράζει παπούτσια.,Ένιωσε τύψεις αγοραστή μετά την αγορά.,2
1126,Τα γενέθλια της Αμάγια πλησιάζουν.,Θα είναι πέντε χρονών.,Η μαμά της της κάνει πάρτι για πριγκίπισσες.,Έχει καλέσει πολλούς φίλους της από το σχολείο.,Η Αμάγια είναι χαρούμενη που είναι η πριγκίπισσα στο πάρτι της.,Η Αμάγια είναι λυπημένη επειδή δεν θέλει ένα πάρτι τσαγιού.,1
1127,Πήγαμε με τα παιδιά στην παραλία σήμερα.,Πήραμε μαζί μας ένα φρίσμπι και μια μπάλα.,"Ενώ έπαιζα στο νερό, κάποιοι άλλοι άνθρωποι μπήκαν μέσα.",Ήταν υπέροχο να κάνεις νέους φίλους.,Πραγματικά απόλαυσα να γνωρίζω κάποια νέα αγόρια.,"Συνολικά, ήταν μια υπέροχη μέρα πεζοπορίας.",1
1128,Ήταν Παρασκευή βράδυ και αποφάσισα να νοικιάσω μια ταινία.,Πήγα στο Redbox να πάρω ένα.,"Μετά από μια ώρα που το σκέφτηκα, επιλέξα τους ""Αποχωρημένους"".","Πήγα σπίτι και έφτιαξα μερικά σνακ, και μετά πήγα να βάλω την ταινία.",Ήταν η καλύτερη ταινία που είχα δει εδώ και πολύ καιρό.,Πήρα ένα ντους και πήγα στη δουλειά.,1
1129,Η Πόλα έγραψε πολλά λόγια.,"Οι φίλοι της την υποστήριξαν, ακόμα κι αν ήταν άσχημα.",Την κάλεσαν σε ένα πάρτι.,Η Πάουλα άρχισε να λέει κάτι.,Οι φίλες της χειροκρότησαν το ποίημα της.,Η Πόλα έσκισε το ποίημα της.,1
1130,"Αφού κατέβηκα από το σχολικό λεωφορείο, συνειδητοποίησα ότι το τηλέφωνό μου λείπει.","Αφού υπήρχε υπηρεσία, αποφάσισα να το ακυρώσω.",Ο εκπρόσωπος εξυπηρέτησης πελατών το έκανε για μένα.,"Επιπλέον, είπε ότι έγινε ένα τηλεφώνημα στην Τζαμάικα.",Ήξερα ότι κάποιος το είχε κλέψει.,Ήξερα ότι κάποιος θα μου επέστρεφε το τηλέφωνο.,1
1131,Σήμερα ήταν τα πέμπτα γενέθλια της Άιρις!,Η μαμά της είχε σχεδιάσει ένα πάρτι έκπληξη.,Όλες οι φίλες της ήταν εκεί.,Άνοιξε δώρα και έφαγε τούρτα.,Η Άιρις διασκέδασε πολύ στο πάρτι της.,Η 'ιρις αποφάσισε να μην ξαναφάει ποτέ τούρτα.,1
1132,Η Τίνα φορούσε πάντα κόκκινο μπικίνι όταν πήγαινε στην παραλία.,Ήταν γνωστή γι' αυτό και όλοι περίμεναν να τη δουν σε ένα.,Μια μέρα συνάντησε τους φίλους της με μπλε μπικίνι και τους έκανε έκπληξη.,Δεν μπορούσαν να καταλάβουν γιατί φορούσε κάτι διαφορετικό.,Τους άρεσε το καινούριο μπικίνι.,Οι φίλοι της Τίνα ήξεραν πόσο απρόβλεπτη ήταν.,1
1133,Ο Τεντ πάντα ονειρευόταν να γίνει ιδιοκτήτης σπιτιού.,"Ωστόσο, φοβόταν ότι δεν θα μπορούσε ποτέ να το πετύχει.",Μια μέρα ο πατέρας του τον εξέπληξε λέγοντας ότι θα βοηθούσε τον Τεντ.,Ο πατέρας του Τεντ βοήθησε να μοιραστεί την προκαταβολή για ένα σπίτι με τον Τεντ.,Ο Τεντ είπε ότι δεν ήθελε να είναι ιδιοκτήτης πλέον.,Ο Τεντ ήταν ευγνώμων στον πατέρα του για τη βοήθεια.,2
1134,Η Ίβι περιπλανιόταν στο κάστρο για ώρες.,Εξερεύνησε κάθε γωνιά και ρωγμή της δομής.,Οι προϊστάμενοί της την ανέκριναν για αυτά που είχε μάθει.,Απάντησε στις ερωτήσεις τους με ευκολία και ευφυία.,Ήταν περήφανη για τον εαυτό της.,Το έσκασε τρομοκρατημένη.,1
1135,Ο Εντ και ο δίδυμος του Ήθαν κοιτούσαν γυναίκες στο ίντερνετ.,Μετά είδαν ένα προφίλ για δύο δίδυμες κυρίες.,Τηλεφώνησαν στον Σάμι και στη Σάρα και κανόνισαν ένα ραντεβού.,"Στο ραντεβού τους, και οι τέσσερις πέρασαν υπέροχα.",Χρόνια αργότερα και τα δύο ζευγάρια παντρεύτηκαν.,Αποφάσισαν να μην ξαναβρεθούν.,1
1136,Ο Μάρκο ξεκινά μια νέα δουλειά σήμερα.,Θέλει να δείχνει καλά την πρώτη του μέρα.,Ο Μάρκο αποφασίζει να βάλει γραβάτα.,Το νέο του αφεντικό εντυπωσιάστηκε με το πόσο όμορφος φαίνεται.,Ο Μάρκο είναι ευτυχής που έκανε καλή εντύπωση.,Ο Μάρκο είναι τρομοκρατημένος από την αντίδραση του αφεντικού του.,1
1137,Ο Τιμ ήθελε να ταξιδέψει στο εξωτερικό.,Δεν είχε ξαναβρεθεί σε αεροπλάνο.,Αποφάσισε να ταξιδέψει στην Κίνα με αεροπλάνο.,Πραγματικά απολάμβανε την πτήση!,Ο Τιμ ορκίστηκε να μην ξαναπάει σε άλλο αεροπλάνο.,Ο Τιμ άρχισε να ταξιδεύει σε πολλά μέρη με αεροπλάνο.,2
1138,Η Λούσι είχε ένα τεστ αύριο στο σχολείο και μόλις που μελέτησε.,Ήταν ήδη πολύ αργά και έπρεπε να πάει για ύπνο.,Το επόμενο πρωί το σχολείο ήταν κρυμμένο λόγω χιονιού.,Η Λούσι ήταν τυχερή και πέρασε όλη την ημέρα της μελετώντας για το τεστ.,Η Λούσι πήρε άριστα το τεστ.,Η Λούσι απέτυχε στο τεστ επειδή δεν είχε μελετήσει.,1
1139,Ο Φρεντ αγαπούσε τα μυθιστορήματα μυστηρίου.,Διάβαζε τουλάχιστον ένα κάθε μήνα.,"Όταν το έμαθαν οι φίλοι του, του πήραν ένα για τα γενέθλιά του.","Αλλά δυστυχώς, άρχισε να ενοχλείται από την προσοχή.",Ο Φρεντ είπε στους φίλους του ότι έκανε ένα διάλειμμα από τα μυθιστορήματα μυστηρίου.,Ο Φρεντ ξεκίνησε μια λέσχη μυθιστορημάτων μυστηρίου για τους φίλους του.,1
1140,Η Τία είχε το δικό της φούρνο.,"Στο φούρνο της, έφτιαχνε όμορφα κέικ.","Μια μέρα, συνειδητοποίησε ότι δεν είχε αλεύρι παρά το ότι είχε μια μεγάλη παραγγελία.",Κάλεσε σε όλη την πόλη και βρήκε κάποια.,Η Τία απογοητεύτηκε.,Η Τία ανακουφίστηκε.,2
1141,Η Σάρα πήγε με τις φίλες της στο υδάτινο πάρκο.,Πλήρωσαν τα εισιτήρια τους και φόρεσαν τα μαγιό τους.,Περίμεναν στην ουρά για τη μεγαλύτερη γλίστρα.,Κατέβηκαν στην τσουλήθρα και διασκέδασαν πολύ.,Ορκίστηκαν να μην επιστρέψουν ποτέ.,Πήγαν πίσω την επόμενη μέρα.,2
1142,Ο Τζεμπ έφτιαχνε αγάλματα από βράχους.,Έφτιαξε ένα που έμοιαζε με χελώνα.,Ο Σαμ ήρθε και το έριξε κάτω.,Ο Τζεμπ άρχισε να κλαίει.,Ο Σαμ γέλασε και το έσκασε.,Ο Τζεμπ ήταν ενθουσιασμένος που έφτιαχνε καινούριο.,1
1143,Ο Τζεφ θα πάει εκδρομή στο βροχερό δάσος με την τάξη του.,Ο Τζεφ είναι ενθουσιασμένος και ανυπομονεί να πάει.,Όταν έφτασε ο Τζεφ ήταν πολύ απογοητευμένος.,Το βροχερό δάσος δεν ήταν συναρπαστικό και δεν υπήρχε τίποτα να κάνω.,Ο Τζεφ πέρασε καλά.,Ο Τζεφ βαριόταν και ήταν αναστατωμένος.,2
1144,Η Ντάνι ήταν νοσοκόμα στην εντατική.,Ένα βράδυ ο αποξενωμένος πατέρας της ήταν ένας από τους ασθενείς της.,"Η Ντάνι δεν ήθελε, αλλά θεράπευσε τον πατέρα της.","Καθώς γινόταν καλύτερα, οι δύο τους μπόρεσαν να μιλήσουν.",Η Ντάνι δεν εκπλήσστηκε από τα γεγονότα εκείνη την ημέρα.,Η Ντάνι γνώρισε τον πατέρα της πολύ καλύτερα.,2
1145,Η Τζίνα ήταν στο σπίτι της φίλης της Ρουθ.,"Μια κοπέλα που δεν ήξερε, η Τζέιν, εμφανίστηκε.",Η Τζέιν ήταν αγενής και αλαζονική.,"Η Τζίνα ανακάλυψε αργότερα ότι η Τζέιν ήταν η αδερφή του εχθρού της, του Τζο.",Έτσι τώρα αποφεύγει την Τζέιν όλη την ώρα.,"Έτσι, έγινε ευτυχισμένη φίλη με την Τζέιν.",1
1146,Η Έλλα πέρασε μια μέρα στον ήλιο.,Ξέχασε να βάλει αντηλιακό.,Έχει ένα άσχημο κάψιμο!,Αλλά σύντομα ξεθωριάστηκε και έγινε μαύρο.,Η Έλλα ήταν υπέροχη και έλαβε πολλά κομπλιμέντα.,Η Έλλα πέρασε την επόμενη μέρα στη βροχή.,1
1147,Ο Νιλ μόλις είχε φτάσει στην Κένυα.,Μπήκε σε μια ομάδα τουρισμού σαφάρι.,Είδαν όλα τα είδη των εξωτικών ζώων.,Ο Νιλ έβγαζε φωτογραφίες.,Τον έφαγε ένα λιοντάρι.,Ο Νιλ συνέθεσε ένα άλμπουμ φωτογραφιών όταν γύρισε σπίτι.,2
1148,Η Τζίνα αποφάσισε να φτιάξει μια μηλόπιτα για πρώτη φορά.,Ήταν εξαιρετικά προσεκτική να ακολουθήσει τη συνταγή ακριβώς.,"Αφού έβαλε την πίτα στον φούρνο, περίμενε ανυπομονούσε να τη δοκιμάσει.",Αποδείχθηκε ότι ήταν υπέροχο!,Έτσι αποφάσισε να το πετάξει στα σκουπίδια.,Μοιράστηκε τη συνταγή και την πίτα με όλους τους φίλους της.,2
1149,Ο Πάμπλο ήθελε ένα σαγόνι.,Δεν είχε χρήματα όμως.,Έψαχνε στην ντουλάπα του για να δει τι θα μπορούσε να πουλήσει.,Βρήκε μια αρκούδα και την πούλησε για 50 σεντς.,Μετά αγόρασε τα γλυκά του.,Αγόρασε αναψυκτικό με αυτό.,1
1150,Η Άννα νοίκιασε μια αποθήκη για ένα μεγάλο πάρτι.,"Οι διακοσμήσεις ήταν υπέροχες, αλλά κάτι έλειπε.",Τότε η Άννα συνειδητοποίησε - ότι χρειάζονταν μια ντίσκο μπάλα!,Πήρε μια μπάλα από μια εταιρεία εφοδιασμού πάρτι.,Η Άννα απογοητεύτηκε.,Το πάρτι πήγε τέλεια.,2
