,input_sentence_1,input_sentence_2,input_sentence_3,input_sentence_4,sentence_quiz1,sentence_quiz2,answer_right_ending
1128,It was Friday night so I decided to rent a movie.,I headed down to a Redbox to get one.,After taking an hour to decide I finally picked The Departed.,"I got home and made some snacks, then went to put the movie in.",It was the best movie I'd seen in a long time.,I took a shower and went to work.,1
1129,Paula wrote a lot of spoken word poetry.,Her friends were supportive even though it was bad.,They invited her to a party.,Paula started delivering some spoken word.,Her friends applauded her poem.,Paula tore up her poem.,1
1130,"After getting off the school bus, I realized that my phone is missing.","Since there was service on it, I decided to cancel it.",The customer service representative did it for me.,"In addition, he said that there was a call made to Jamaica.",I knew someone had stolen it.,I knew someone would soon return the phone.,1
1131,Today was Iris's fifth birthday!,Her mom had planned a surprise party for her.,All her friends were there.,She opened presents and had cake.,Iris had a lot of fun at her party.,Iris decided never to have cake again.,1
1132,Tina always wore a red bikini when she went to the beach.,She was known for it and everyone expected to see her in one.,One day she met her friends in a blue bikini and surprised them.,They couldn't understand why she would wear something different.,They liked the new bikini though.,Tina's friends knew how unpredictable she was.,1
1133,Ted had always dreamed of being a homeowner.,"However, he had feared that it was a goal he would never reach.",One day his father surprised him by saying he would help Ted out.,Ted's father helped split the down payment on a home with Ted.,Ted said he didn't want to be a homeowner anymore.,Ted was grateful to his father for the help.,2
1134,Evie wandered around the castle for hours.,She explored every nook and cranny of the structure.,Her supervisors questioned her about what she had learned.,She answered their questions brilliantly and with ease.,She was proud of herself.,She fled in terror.,1
1135,Ed and his twin Ethan were looking at women online.,Then they saw a profile for two twin ladies.,They called Sami and Sara and arranged a date.,"On their date, all four had a wonderful time.",Years later both couples got married.,They decided not to see each other anymore.,1
1136,Marco is starting a new job today.,He wants to look good on his first day.,Marco decides to put on a tie.,His new boss is impressed with how good he looks.,Marco is glad that he made a good impression.,Marco is horrified by his boss's reaction.,1
1137,Tim wanted to travel overseas.,He'd never been on an airplane before.,He decided to travel to China by air.,He actually enjoyed the flight!,Tim vowed never to get on another plane again.,Tim started traveling a lot of places by airplane.,2
1138,Lucy had a test tomorrow at school and she barely studied.,It was already very late and she had to get to bed.,The next morning school was hidden due to snow.,Lucy was lucky and spent her whole day off studying for the test.,Lucy passed the test.,Lucy failed the test because she had not studied.,1
1139,Fred liked mystery novels.,He used to read at least one every month.,"When his friends found out, they all bought him one for his birthday.","But unfortunately, he started getting irritated by the attention.",Fred told his friends he was taking a break from mystery novels.,Fred started a mystery novel book club for his friends.,1
1140,Tia owned her own bakery.,"In her bakery, she made beautiful cakes.","One day, she realized that she had run out of flour despite having a large order.",She called all over town and finally found some.,Tia was disappointed.,Tia was relieved.,2
1141,Sarah went with her friends to the water park.,They paid for their tickets and got into their swimsuits.,They waited in line for the biggest slide.,They went down the slide and had a lot of fun.,They vowed never to return.,They went back the next day.,2
1142,Jeb was building statues out of rocks.,He made one that looked like a turtle.,Sam came and knocked it down.,Jeb started crying.,Sam laughed and ran away.,Jeb was excited to build a new one.,1
1143,Jeff is going on a field trip to the rainforest with his class.,Jeff is excited and can't wait to go.,When Jeff arrived he was very disappointed.,The rainforest wasn't exciting and there was nothing to do.,Jeff had a fun time.,Jeff was bored and upset.,2
1144,Dani was a nurse in the ICU.,One night her estranged father was one of her patients.,"Dani didn't want to, but she treated her father.","As he got better, the two of them were able to talk.",Dani was not surprised by the events of that day.,Dani got to know her father much better.,2
1145,Gina was at her friend Ruth's house.,A girl she didn't know named Jane showed up.,"Jane was rude, and stuck up.",Gina later discovered Jane was her enemy Joe's sister.,So now she avoids Jane all the time.,So she happily became friends with Jane.,1
1146,Ella spent a day in the sun.,She forgot to apply sunscreen.,She got a nasty burn!,But soon it faded and turned to a tan.,Ella looked great and got a lot of compliments.,Ella spent the next day in the rain.,1
1147,Neil had just arrived in Kenya.,He joined a safari tour group.,They saw all kinds of exotic animals.,Neil took photo after photo.,He was mauled by a lion.,Neil composed a photo album when he got home.,2
1148,Gina decided to bake an apple pie for the first time.,She was extremely careful to follow the recipe exactly.,"After putting the pie in the oven, she eagerly waited to try it.",It turned out to be delicious!,So she decided to throw it in the garbage.,She shared the recipe and the pie with all her friends.,2
1149,Pablo wanted a jawbreaker.,He had no money however.,He went through his closet to see what he could sell.,He found a toy bear and sold it for 50 cents.,Then he bought his candy.,He bought some soda with it.,1
1150,Anna rented out a warehouse for a big party.,"The decorations were great, but something was missing.",Then Anna realized - they needed a disco ball!,She secured a rented ball from a party supply company.,Anna was disappointed.,The party went great.,2
1151,Oscar headed over to the nursery to find a tree to plant in his yard.,He had a hard time deciding which tree to get.,There were a lot of trees to go through.,"Finally, he opted for a Bonsai tree.",It went perfectly with his home decor.,He destroyed it as soon as he got home.,1
1152,There was a big basketball game in the gymnasium.,Me and my friend played on the same team.,The game became intense and both teams were tied at the end.,There were 4 seconds left on the clock and we needed to score.,I shot the winning basket that won the game for our team.,I walked off the court and never looked back.,1
1153,Dirk was a fine pianist.,He often performed in public for money.,"During his last performance, one of the keys broke off his keyboard.","He finished the performance as best he could, but the music was poor.",Dirk was embarrassed.,Dirk liked how it sounded.,1
1154,Eva loved the squirrels in her yard.,She started feeding them peanut butter sandwiches.,Soon they grew used to her.,One was especially friendly.,Eva was afraid of all the squirrels.,Eva was able to pet one of the squirrels.,2
1155,Andy loved the beach.,He asked his mother if they could go to the beach.,His mother took Andy to the beach.,"On the way to the beach, it started to rain.",Andy hated the beach.,Andy was sad about it.,2
1156,I bought a phone case with a lanyard.,I needed one for my cell phone.,The case arrived without a lanyard.,The website said the case had a bracket but no lanyard.,I returned my phone.,I felt foolish.,2
1157,I changed the sheets on my bed last week.,I was tired of the old ones.,The new ones look nicer and feel better.,I think I'll keep them.,I'm glad they weren't too expensive.,I plan to cut them into strips.,1
1158,Chase really wanted a new toy.,His mom wouldn't buy him a new toy.,She advised him to save his allowance.,He saved his allowance.,Chase bought himself a new toy.,Chase ran away from home.,1
1159,Renee was inspired by the music of Eddie Van Halen.,She decided to learn to play the guitar.,She bought an electric guitar and an amp.,She hated pressing the strings with her fingers.,Renee decided she'd have to get used to it.,Renee was glad she decided to learn to play the drums.,1
1160,Bill went fishing and caught a lot of fish.,He caught so many he had to give some away.,His neighbors were poor and were grateful to Bill for the fish.,The neighbors finally got back on their feet.,Bill's neighbors sued him for making them poor.,They baked Bill some bread in appreciation for all the fish.,2
1161,Last week the internet went out.,My wife and I were bored out of our minds.,Every other option available seemed boring.,Eventually we just drank and talked for a while.,We ended up having a fun time after all.,We were happy not to have Internet and to drink.,1
1162,"All Tim's life, he wanted to make music.","Tim practiced all day, every day.","When Tim had enough songs, he called a recording studio.","The studio decided to record him, and Tim was happy.",Tim decided he didn't like music.,Tim became a professional musician.,2
1163,Alex suspected that his cat Tigger might have fleas.,Tigger was constantly scratching himself day and night.,Alex took Tigger to the vet to be diagnosed.,The veterinarian confirmed that Tigger did indeed have fleas.,They gave him a flea medication and it cleared up.,Alex decided not to give the cat the prescribed medication.,1
1164,Haley was a young scientist at a famous laboratory.,"Every day, she worked hard on her current project.",One of her colleagues was secretly stealing her research.,Haley discovered this when he published it in a scientific journal.,Haley felt like she had been betrayed.,Haley felt she had been supported admirably.,1
1165,Sam wanted to throw a party.,Sam invited all his friends and neighbors.,The party got extremely wild.,All the guests left the party in disgust.,Sam became a party planner.,Sam had a terrible hangover the next day.,2
1166,Katie couldn't sleep at all.,She tiptoed downstairs and into the kitchen.,She poured herself a glass of milk.,Then she heated it in the microwave.,Katie drank it and went back to bed.,Katie decided to pour the milk down the drain.,1
1167,Tom was talking to his wife Becky who had a bad day at work.,He decided to bring home her favorite meal as a surprise.,"On the way home from work, there was a lot of traffic.","After getting the food, he arrived home much later than planned.",But everything was fine as soon as they hugged and ate dinner.,"Tom decided to take a trip to the casino, he ignored his family.",1
1168,They had to pick out a stove for their new house.,They couldn't decide on a particular brand.,They liked the durability of the Viking.,They also liked the deal with the Thermador.,They didn't need a stove anymore.,They decided to buy the Viking stove.,2
1169,Jasmine didn't study for her big math test.,She figured she could just wing it.,Jasmine soon realized the test was very difficult.,She decided to cheat by looking at her neighbor's paper.,The teacher caught her and gave her detention.,The teacher caught her and praised her ingenuity.,1
1170,Sam moved to Los Angeles to become a movie star.,He didn't have much money but he thought that going was the only way.,After two months Sam was sleeping in his car and broke.,He went to the Chinese theater to beg one day.,Sam felt quite hopeful.,Sam felt very depressed.,2
1171,Ben woke up late.,Ben decided to skip breakfast and went to work.,Work was too busy to take a break or eat lunch.,"After work, Ben got caught in some really bad traffic.",Ben was so hungry that he became sick.,Ben was able to get home quickly.,1
1172,Darren was late for work and couldn't find his car keys.,He looked all over his house.,He asked his wife where they were.,She told him to check his pockets.,Darren turned off the computer.,There were no keys in his pockets.,2
1173,I had a job interview last week.,My girlfriend helped me pick out a new tie.,We went to the store and looked for hours.,I found three I liked.,I bought a bow tie instead.,I bought them all.,2
1174,Harry loved hockey.,He decided to sign up to play for a local league.,Harry attended the tryouts for the team.,Harry hoped he did well enough to make the team.,Harry then quit his hockey team.,"A few days later, Harry heard that he made the team.",2
1175,Little Sue was riding an elephant at the zoo.,She liked it at first but then got scared.,She started crying for her mom.,The zookeeper had to stop the elephant and get her.,Sue's mom took her to pet the goat instead.,Sue continued to ride the elephant.,1
1176,Hannah was an amazing artist.,She always had a natural gift.,She decided to enter an art competition.,Thankfully she was able to win the top prize.,Her parents insisted that her grandmother did most of the sewing.,Her parents were very proud.,2
1177,Jim was taking out the garbage.,He slipped on a piece of ice on the sidewalk.,Jim fell hard on the pavement.,Jim felt something break on his arm.,Jim decided to do a handstand.,Jim was hurt and had to call 911.,2
1178,I hate doing laundry.,Matching socks is a horrible waste of time.,Every time I do laundry socks get lost.,I was tired of looking for matching socks.,I find doing laundry relaxing.,I threw out all my old socks and bought plain white socks.,2
1179,James was twelve years old and loved food.,He never really thought about making food until today.,His mother let him help prepare rice for dinner.,James learned how fun and creative cooking could be.,James decided to become a chef when he grows up.,James never cooked again.,1
1180,Lee knew her mom needed new gloves and couldn't afford them.,So Lee began to knit a pair.,She hurried to finish them by Christmas.,Then she presented them to her mom.,Lee's mom was proud of her daughter for being so thoughtful.,Lee's mom threw the gloves at Lee and left the room.,1
1181,Jennifer was a professional copywriter in a big city.,She did good work but always received poor reviews on her reviews.,Jennifer found out that her boss was trying to sabotage her!,She decided to confront her boss about the negative remarks.,Jennifer thanked her boss for his fairness.,Jennifer stormed into his office and straightened out her boss.,2
1182,Lorraine was a softball player.,She was the best in her team.,"One day, during a game, she twisted her ankle badly.",She couldn't play anymore.,Lorraine was thrilled!,Lorraine was really sad.,2
1183,Abby and Tammy were the best of friends.,They both loved to do things together that were fun and creative.,They decided to make friendship bracelets together and give to others.,Abby made five and Tammy made seven more.,Tammy never spoke to Abby again.,They decided to keep the bracelets for themselves.,2
1184,Last night there was a big lightning storm.,It took out the power.,The whole neighborhood didn't have electricity.,It got really cold and we got scared.,We'll have to shovel the snow.,Then after about an hour the power came back on.,2
1185,Sal was mad that his parents were moving.,They were moving to the eighth floor of a building.,He hated living that high.,"After moving, he took a look out of his bedroom window.",Sal threw his pillow out the window.,The beautiful view made him change his mind.,2
1186,Lydia had a strange dream last night.,She dreamt that she was taking a test at school.,While she was taking the test she realized she forgot to put on pants!,She was so embarrassed that she ran right out of the classroom.,Lydia wished the dream were real.,Lydia felt relieved when she realized it was just a dream.,2
1187,Alex needed groceries.,She made a list of things to buy.,She gathered her reusable canvas bags.,She walked to the store.,Alex bought a yacht.,She bought groceries.,2
1188,Yolanda hates roller coasters. She's not a fan of them.,Katie doesn't understand why.,She decided to force Yolanda to ride one with her.,Yolanda threw up all over Katie.,Katie was the happiest she'd ever been.,Katie regretted forcing Yolanda to go on the ride.,2
1189,One thing Tina wanted to do in NYC was go to a hot dog stand.,She finally saw a Nathan's stand and ordered a traditional one.,The food tasted amazing.,It was expensive but worth it.,She was sad about the hot dog.,She was happy with the hot dog.,2
1190,Tammy likes to crochet.,Christmas was a few weeks away and she didn't really have any money.,She got the idea to take the spare yarn she had to make a blanket.,She then wrapped it up for her granddaughter Lorelei.,Tammy was sad that she didn't have a present to give.,Lorelei treasured that blanket for years.,2
1191,Melinda wanted to go see a scary movie.,She wanted to go by herself to prove she was brave.,Melinda went to the movies and bought a ticket.,Melinda was very afraid while watching the movie.,Melinda thought the movie was hilarious.,Melinda wished she'd brought someone.,2
1192,Lamar learns that he will have unexpected houseguests one afternoon.,He doesn't have any food at home to give to his guests.,He decides to brew a pot of tea for them instead.,His guests all enjoy the tea he makes.,Lamar gave them tea to take home.,Lamar walked to the park.,1
1193,My niece applied for a job at the RMV two years ago.,She got the job and was excited.,"They told her she needed a driver's license, which she didn't have.",She showed her employer a doctor's note stating that she could not drive.,They decided it was okay to let her work as a secretary.,She had a perfect driving record.,1
1194,Lela was diagnosed with cancer five years ago.,Every day has been a struggle.,She went to doctors and treatments almost every day.,Lela finally started getting better the last few months.,Lela then finished the treatment and felt better.,Lela then got over her flu.,1
1195,Fred was a new student in class.,He was really awkward and he had a hard time.,Nobody seemed to want to be friends with him.,Later at lunch someone ate with him.,Fred was popular.,Fred talked with his lunch-mate and made friends.,2
1196,Joyce was adopted by her foster mother when she was 5 years old.,After her adoption her mom adopted 3 more children.,Joyce loved being an older sister and she helped her mom a lot.,When she moved out on her own she became a foster parent too.,Joyce abandoned her children shortly after.,Joyce loved her children just as much.,2
1197,Horatio had always been afraid of eating a raw oyster.,"His girlfriend told him it was delicious, but he was nervous.",Finally she took him on a vacation to Cape Cod to try a fresh oyster.,Horatio took his first bite into a raw oyster and loved it.,He decided not to eat anymore.,He ate ten more.,2
1198,Tom liked to herd cattle.,He did it every day.,One day a cow went free.,He searched everywhere.,"He noticed the cow in a neighbor's field, ignored it, and left.",He found the cow and brought it back.,2
1199,Alyssa got some coffee on the way to work.,She drank the coffee while she was driving.,"Suddenly, she had to quickly stop her car.","The coffee spilled all over her lap, scalding her legs.",She laughed as she continued to drive to work.,She almost had an accident as she screamed out in pain.,2
1200,John was driving down the highway.,A Mustang pulled up next to him and kept up speed.,He was driving his new Camaro.,They decided to race.,John won the race.,John pulled over to buy a Mustang.,1
1201,Ben wanted to win the costume contest at work this year.,He spent many hours making his costume from scratch.,To add to his costume he applied a lot of stage makeup.,"At work, everyone was impressed with how he looked.",Ben was pleased.,Ben backed out of the costume contest.,1
1202,My mom asked if she could borrow $100 dollars from me.,"Considering that she's broke, I lent her my credit card.","The next day, my credit card was declined when I tried to buy food.",The company told me that I made a $320 dollar purchase.,I told my mom to keep using my credit card.,I was angry at my mom for running up my credit card.,2
1203,Kelly always had the driest hair.,She had no idea what to do.,Finally she went to the doctor.,He prescribed her pills.,Kelly finally had hair that wasn't dry.,Kelly loves the potato chips.,1
1204,Sarah had a fear of being around others.,She decided to force herself to go to a party.,"At the party, she became dizzy and nervous.","Sarah decided this was enough, and went to see a therapist.",The therapist taught her ways to cope with her problem.,The therapist told her she was strange.,1
1205,Ellen was at her doctor's office.,She was about to find out the sex of her baby.,She was really hoping for a boy!,She held her breath as the doctor scanned her belly.,Ellen was disappointed to find out she was having a boy.,Her doctor confirmed it was a boy!,2
1206,Zoey was taunted by her friends for having a strange name.,She liked her name and wished people wouldn't be so mean.,A new show was made that had a main character named Zoey.,Zoey's name suddenly became very cool to her peers.,Zoey was happy that everyone liked her name now.,Zoey had her name changed when she turned 18.,1
1207,Miranda just got her driver's license.,She took the family van out for a spin.,She drove for a long time.,But then she realized she was lost.,Miranda went back the way she came to retrace her steps.,Miranda was happy about her proud moment.,1
1208,Bob went to the doctor.,The doctor told him that he was overweight.,Bob realized that he had to get in shape.,He joined a gym and started watching what he ate.,Bob gained 50 pounds.,Bob got in shape.,2
1209,Lonnie was trying to figure out what majors to take in college.,He knew that his ultimate goal was to be a teacher.,He asked the career counselor for advice.,The counselor gave him a list of prerequisites.,Lonnie finally decided to go into education.,Lonnie threw the list away.,1
1210,Sherry liked to explore the outdoors.,She decided to hike in the state park on a sunny day.,While walking along a creek she saw something shiny.,"Bending down, she picked up the shiny item.",It was a quarter.,She picked up a knife covered with rust.,1
1211,Phil went for a walk in the park.,It was a warm breezy day.,He ran into a few friends along his walk.,One of them offered him a drink.,Phil was thirsty and accepted the drink.,Phil was angry at his friends.,1
1212,Dorothy's cat was pregnant.,She didn't know how it happened.,She convinced the family to keep the kittens.,It wound up having 7 kittens.,Dorothy made sure to buy lots of cat food.,Dorothy went to the pet store and bought a new hamster.,1
1213,Jeremy's mother didn't approve of his lifestyle.,"When he was 21, Jeremy decided to move out.",He found an apartment in a nearby state with a new job.,"After several years he cleaned up, and finances his own life.",Jeremy had to move back in with his mother.,Jeremy enjoyed being more responsible.,2
1214,Terry realizes his neighborhood has become covered in litter.,He wishes it looked as clean as it did when he was young.,He decides to pick up cans and cigarette butts every night after work.,Eventually his neighbors do too and his neighborhood looks better.,Terry hated cleaning up.,Everyone felt better that it was cleaner.,2
1215,I wanted to take a shower after work.,I got my clothes and towel from the closet.,I went into the bathroom and turned on the shower.,I got undressed.,Then I walked over to my neighbor's house to borrow some soap.,Then I stepped into the hot shower.,2
1216,I approached the front of my school.,"Since my brother was at work, I had to wait for him to pick me up.","Several hours later, I was impatiently waiting.",He eventually came before night time.,I was very angry at him for not picking me up earlier.,I was glad to be home early from school that day.,1
1217,Barry loved to lift weights.,He only used his special barbell to lift weights.,One day he forgot to bring his barbell!,He decided to do cardio instead of lifting.,He always enjoyed a nice nap in his hammock.,He still ended up having a great workout.,2
1218,Amber had been working a lot lately.,It was stressing her out a great deal due to other personal issues.,She'd been dying for a day off to relax.,On her day off she hung out with boyfriend Rob,Amber couldn't find any time to relax.,They relaxed all day and Amber felt much better.,2
1219,Carl joined the military right after high school.,He signed a short contract that put him on the front lines.,His best friend was killed in front of him.,Happiness became a foreign concept to Carl.,Carl hung out with his best friend when they came home.,Carl had to go to therapy for post-traumatic stress disorder.,2
1220,Eddie liked to watch people use metal detectors on the beach.,He watched one man for a while.,It had been over an hour and the man hadn't found anything yet.,Eddie secretly buried a pile of quarters in the sand.,The man sadly found nothing that day.,And watched the man happily get a ping.,2
1221,"When I first met Janice, she didn't know how to crack a walnut.",I couldn't believe she'd gotten this far in life without this skill.,I offered to teach her many methods to crack nuts.,She accepted.,Janice decided she didn't want to learn how to crack walnuts.,Janice is now an expert walnut cracker.,2
1222,Amy walked home from volleyball practice alone.,She called and told her friend Kim she was the worst player.,Amy felt like a loser just saying it out loud.,"Kim reminded her it was the first day, and she would improve.",And throughout the season she kept getting better.,She loved being bad at volleyball.,1
