,input_sentence_1,input_sentence_2,input_sentence_3,input_sentence_4,sentence_quiz1,sentence_quiz2,answer_right_ending
0,I became a Law and Order fan in 2011.,I was recovering from a stroke.,When I got home I tried to watch every episode.,It was hard trying to binge watch 20 Years of a show.,I think Law and Order is one of the worst shows ever made.,Eventually I watched them all.,2
1,Everybody loved Bob because he played a popular character in the movie.,Bob hated it because he was nothing like that character.,Jim asked Bob to say his character's catch phrase.,It was too much for Bob and he exploded with rage.,Bob told the man to leave him alone.,Bob asked the man for tea.,1
2,Lita wanted to watch her favorite show on television.,Her children insisted that she sit down to watch it with them.,Lita told them she had chores to do.,Her kids dragged her laundry basket to the living room.,Lita ordered a pepperoni pizza for lunch.,Lita folded the laundry while watching television.,2
3,Liv jumped as she was startled by a loud pop.,She realized it was the light bulb in her kitchen burning out.,She got out a footstool and stepped on it.,It wobbled under her and she almost fell.,Liv decided to change a light bulb in the bathroom.,Liv then changed the light bulb.,2
4,Mother told her children it would be lunchtime in fifteen minutes.,But then she got an important phone call.,"While she was talking, the dog dragged mud all over the kitchen.","The kids started pestering their mother, who was still on the phone.",The mother felt quite frustrated.,The children's behavior calmed the mother down.,1
5,Hector always bought coffee at a local shop before work.,He realizes that his coffee buying habit is very expensive.,One day Hector decides to brew coffee at home.,He is proud that the coffee he made at home is so good.,Hector kept brewing his own coffee and saved money.,Hector started buying more coffee from Starbucks.,1
6,Kelly found out there was a new girl at school.,When she walked into the school she went looking for her.,"When she met her, she invited her to sit with her at lunch.","When they ate lunch, the girls became friends.",Kelly never spoke to her again.,Kelly was happy to have made a new friend.,2
7,Tommy trained hard to run his first 5K.,During the race he felt frustrated when so many people passed him.,When he heard his name called during awards he was shocked.,He didn't realize they'd do awards by age group.,He was ashamed that he didn't get any recognition.,He was proud to finish first by age but tenth overall.,2
8,Laurie is going to her first formal dance tonight.,Her date picked her up and gave her a beautiful rose.,Laurie was wearing a long sparkling dress.,They danced and had fun with all their friends.,Laurie went home crying.,Laurie ended the night by kissing her date.,2
9,Neil was exploring historic railroads.,"He rode into Scranton, Pennsylvania.",He realized it was a beautiful old train depot.,He took a lot of photos while he was there.,Neil deleted all his photos.,Neil saved the photos on his computer.,2
10,Bob dreaded his first day working at a fast food fish joint.,He planned to wait to put on his gaudy nautical uniform.,Bob got to work making fish burgers after putting on the uniform.,"He was so busy, he forgot to change back into his street clothes",Bob loved the outfit so much that he showed it to his friends.,Bob went out after work wearing the sailor suit.,2
11,A friend came to visit.,I told her that my dog bites.,She didn't listen.,She tried to pet him and play with him.,My dog bit her.,My dog ran away.,1
12,Lester has always wanted to be more artistic.,He decides to try to draw a picture of a flower one day.,He sits in front of a beautiful orchid and begins to draw.,Lester's drawing comes out very well.,He hangs the picture on the wall in his living room.,He decides never to draw anything again.,1
13,Pablo likes to eat worms.,He read a book in school on how to do this.,He fries them in olive oil.,He likes to do this at least once a month.,Pablo enjoys worms and views them as a delicacy.,Pablo doesn't like to eat worms.,1
14,Kira always loved Japanese culture.,Many of her favorite movies were in Japanese.,She decided that she would travel there.,For years she saved money for her trip.,She spent all the money on shoes.,It was the best trip of her life.,2
15,Glen was in the mood for a walk.,He put on his jacket and went outside.,"While walking on the sidewalk, he tripped and broke his knee open.",Glen got back up and limped back to his house.,Glen ran his best marathon time ever.,Glen swore he'd never walk again.,2
16,Jesus spent the day polishing the furniture.,As night approached he surveyed the work he had done.,Everything looked shiny and new.,Jesus invited all his friends over for a party that evening.,They said his furniture looked nice.,His friends polished his furniture.,1
17,I was walking to the store recently.,"As I was passing an exit, I felt cold, hard steel on my arm.",I was shocked that I was being hit by a car!,The driver was very apologetic after he saw I was hit.,I told them it was okay and then walked away.,The driver of the car became very angry with me.,1
18,Gina's sister cut her ankle on broken glass.,The blood ran down her foot and into her shoe.,When she saw the blood she ran home.,"Gina ran behind her, but couldn't keep up.",When they got home they all had ice cream.,Gina's sister went to the doctor.,2
19,A little boy was in third grade.,He was very smart but struggled with reading.,Whenever he read aloud his classmates laughed at him.,He started practicing reading every single day.,The little boy accepted that he would never improve.,"At the end of the year, he did well on his reading test.",2
20,Rosie's class was having a little party.,She decided to make a fruit salad for everyone.,She spent a lot of money on the fruit and a lot of time preparing it.,On the day of the party she scooped up a huge bowl of the fruit salad.,Rosie's class shared the fruit salad.,Rosie kept the bowl of fruit salad in her fridge at home.,1
21,Kelly was happy to have her new phone.,She took it with her everywhere.,Unfortunately she smashed it.,Thankfully however she was able to get it fixed.,The store gave her a fair price to fix it.,Kelly bought a new phone.,1
22,"While I was in college, I had met an older man.",I was 22 and he was 38.,We had a good understanding and had a good time together.,We stayed together the whole time I was there.,I have fond memories of that time.,I have negative memories of that time.,1
23,Bob wanted to be in the school play.,He studied the part carefully.,He rehearsed his lines often.,"On the day of the audition, he did a great job.",Bob was very proud.,Bob was very ashamed.,1
24,Jackie has been appointed eighth grade hall monitor.,She is envied throughout the class.,Her classmates often put her job in jeopardy.,They would steal Jackie's hall passes.,The principal suspended her rowdy classmates.,Her classmates were given awards for their behavior.,1
25,My dad had just gotten a new car.,To celebrate we all went for a drive.,Another car ran over a stop sign and crashed into us.,I slammed the window hard enough to break it.,I climbed out and me and my dad were okay.,We were both flattened by the vehicle.,1
26,My niece loves the Frozen movie.,She always wants it on.,She goes around the house singing.,She loves to scream let it go.,She sings it over and over again.,She loves sports and hates princess things.,1
27,"Alex was dribbling up the court, with his team down by two points.","He glanced at the scoreboard, and saw there were only 5 seconds left.",His mind raced as he tried to find an open man.,The defenders were sticking to his teammates like glue.,The buzzer went off and his team won the game.,He attempted a three-pointer and missed.,2
28,I came into the library and took a seat.,"When I looked around, I noticed a kid.",He was staring at me for a while.,I became frustrated and got up from my seat.,I didn't mind what the kid was doing.,I asked him what his problem was.,2
29,Iva and Brant were trying to conceive a child.,They had been trying for six months without success.,"At their doctor's appointment, they expressed discouragement.",But then they saw the doctor smiling broadly.,Brant will cancel his plans to kidnap a child.,The couple will be happy to know they have a baby on the way.,2
30,Catherine has always been intrigued by the sport of Curling.,Catherine loves watching the athletes play the sport on television.,"One day, Catherine decided she would visit a Curling practice session.","At practice, one of the athletes invited Catherine to play.",Catherine then began practicing every day and became good at it.,Catherine thought curling looked boring.,1
31,Francis has always looked forward to learning how to drive.,Finally he is old enough for a driver's license.,Francis studies very hard to get a license.,He passed his driver's test easily.,Francis is really proud of his accomplishment.,Francis decides he'd rather take public transportation.,1
32,Yesterday I had a great time watching The Nutcracker.,I absolutely loved it.,As the dancers graced the stage it was beautiful.,I felt honored to have seen the show.,I vowed never to see it again.,I wanted to see it again.,2
33,I woke up for my class at 8:30 in the morning.,I got out of bed and took a shower.,I quickly ate breakfast and began walking to class.,"After 50 minutes of class, I began to walk back to my dorm.",I decided to go back to class again.,"When I got there, I took a nap.",2
34,Gary wanted to get Lisa's attention.,One day he decides to write Lisa a poem.,"The next day at school, Gary sees Lisa in the hallway.",Gary gives Lisa a really big smile and hands her the poem.,"Gary slaps Lisa hard, and walks away.",Lisa confesses she's also in love with Gary.,2
35,Carlos has always wanted to visit France.,He decides that he should learn to speak French before he goes.,He enrolls in a night class and studies very hard.,Finally Carlos can speak French pretty well.,Carlos booked a flight to Australia.,Carlos makes the most of his French on his trip to Paris.,2
36,Lars had always wanted to try photography.,"His friend was an excellent photographer, but he had never tried.","One day he bought a simple, but high-quality, camera.","From that day on, Lars shot images of nature every day.",Lars fell in love with photography.,Lars hated photography.,1
37,I bought a television from an electronics store.,It is a large flat screen with a high definition picture quality.,The employee convinced me to buy a warranty for it just in case.,A week later the television fell off my wall and broke.,I was able to get it fixed with the warranty.,The employee was later found dead.,1
38,Ryan was in a park.,And he saw a little girl holding a balloon.,"As he was leaving the park, he saw the same balloon stuck in a tree.",He climbed the tree to retrieve the balloon.,Ryan then popped the balloon on purpose.,Ryan then found the girl and gave her the balloon she lost.,2
39,Jen's manager told her she needed to upload her resume.,She realized her resume wasn't formatted properly.,She transferred all the content over to the proper template.,"Adding information on her latest job, she updated the resume.",Then she sent it to her manager.,Jen hated washing dishes.,1
40,Neil was touring the city of Fez.,He tasted their ethnic cuisine.,Then he went shopping for souvenirs.,"Fez had great street performers as well, he noted.",Neil had a great time.,Neil and Fez became best friends.,1
41,I needed to take my dog for a walk.,My neighborhood requires a leash.,I looked through my house for the leash.,I couldn't find it.,I decided to take my dog out to the backyard.,I let my dog go inside the house.,1
42,"It was a bright, warm day.",So Joe thought it would be nice to take a walk.,He decided to walk to his local coffee shop.,"But halfway there, he started getting tired.",So he ran to the coffee shop.,Joe regrets going outside.,2
43,Jen was waiting for a package all day.,Finally she saw the UPS man walking up to the door.,He delivered the package and she brought it inside.,She opened the package with a knife.,In the box was a newborn baby.,Jen found her new coat inside the package.,2
44,Frank didn't want to do his homework.,He wanted to play video games instead.,Frank's parents told him to do his homework first.,Frank had a tantrum and got punished.,Frank lost his video games for a week.,Frank got a whole new game.,1
45,Timmy was competing in the 3 point competition at his school.,"The winner would have a chance to win a $1,000 college scholarship.",Timmy practiced shooting three-pointers all weekend.,He was ready when the day of the competition arrived.,Timmy won the competition.,Timmy went to the driving range the day of the competition.,1
46,Drake attended a party on Friday.,He discovered that his wallet had been stolen from his coat.,"Drake immediately called the police, but the wallet was never found.",Drake confronted the host of the party about the issue.,And the host told him that he didn't know either.,Drake told the host he wanted to attend his parties again.,1
47,Bob discovered his truck had a flat tire.,He'd never changed a tire before.,He got out the tire jack and iron.,He couldn't remove the bolts.,Bob called someone to fix his flat tire.,Bob drove his truck to the market.,1
48,Jack is tired of writing emails on his tablet computer.,He decides he needs to invest in a laptop.,He researches different laptops until he has found the perfect one.,Finally he buys it.,Now Jack actually enjoys answering emails.,Jack now uses the postal service instead of email.,1
49,Jake's hair was getting a little too long.,He had a job interview coming up.,He asked his mother to cut his hair.,His mother gave him a nice cut professional looking haircut.,Jake washed his hands.,Jake got the job.,2
50,Sean came over today.,"Sam, Sean, and I played games.",They started getting mad at me about how bad I was.,They said I couldn't play anymore until I got better.,I was really hurt.,I was really pleased.,1
51,Sarah wanted to mail a card.,She went to the post office.,She paid for stamps.,She put the letter in an envelope.,Sarah delivered her letter herself.,Sarah's letter was soon on its way to its destination.,2
52,Chuck was tired from work.,He closed his work for a while.,He opened the forum to chat with co-workers.,After those nasty Zoltar hits he needed this break.,Chuck decided to quit his job.,He then felt compelled to get back to work.,2
53,Bob used plastic grocery bags to go shopping.,"Then, his friend told him that plastic is bad for the environment.",Bob decided to forgo his plastic bags.,Bob invested in some reusable grocery bags.,Bob used his reusable grocery bags to go shopping.,Bob continued to use his plastic grocery bags to go shopping.,1
54,Joe needed to get a portrait of himself for a project.,He called some local artists and asked their rates.,One of the artists had reasonable rates.,Joe made an appointment with that artist to do the portrait.,Joe was very satisfied with the results.,The artist painted a Joe's cat.,1
55,Ann was trying to quit smoking.,She made several attempts but always failed.,Then she applied to nicotine patch to help her.,And help her do it!,Ann doubled the amount of cigarettes she smoked each day.,Ann was able to quit smoking successfully.,2
56,Jen got sent to her aunt's for the summer.,She hated the thought of being away from her local library all summer.,She took a few books with her but she would go through those quickly.,When she arrived her aunt took her into a special room in her home.,Jen saw her books burning in the fireplace.,The room was full of shelves of books that appealed to girls.,2
57,Yesterday was Rob's tooth cleaning.,He's usually really afraid of dentists.,But there's a cute new nurse at the office.,So he was excited to go.,Rob felt refreshed after his colonoscopy.,Rob was bummed when the cute nurse wasn't in that day.,2
58,Joe loved to eat dirt.,He would make mud pies every chance he got.,He was eating a pie when he felt something very hard in his mouth.,Joe had bitten down on a rock and knocked out his tooth.,Joe wanted to chew more rocks.,Joe decided not to eat dirt again.,2
59,Rob has never been on a rollercoaster.,Rob's friends offered him a free ticket to Six Flags.,Rob decided he might as well join.,They all went and waited in a long line.,Rob had generous friends.,Rob's friends were thoughtless.,1
60,Carly was waiting for Sam to call her.,He promised to on Friday.,It was now late Saturday and she hadn't heard anything.,Finally she decided to call him.,Sam answered the phone.,Carly ordered takeout over the phone.,1
61,Amy came home from school on her birthday to an empty house.,She was upset that everyone had forgotten her special day.,She walked sadly into the living room.,"Suddenly, her friends and family jumped out of their hiding places.",Amy smiled with delight.,Amy walked out of the room and left the house.,1
62,Pan tried to hit me for no apparent reason.,"As mad as I was, I simply defended her punch.",She kept throwing her fist at me.,"In an effort to stop her, I threw her to the ground.",Pan finally stopped.,I gave Pan a big hug.,1
63,Becky has a cousin named Ashley.,Becky and Ashley used to be friends when they were kids.,Ashley started being stupid when she grew up.,She went to jail for stealing tampons from a dollar store.,Becky lost contact with her.,Becky is proud of Ashley.,1
64,Pam and Tom's baby was a light sleeper.,Their thoughtless neighbor often left his dog outside barking all day.,"Every time Pam put her baby to sleep, the dog started barking.",Pam fantasized about unleashing the dog so it would run away.,"One night, Pam let her cats into her home.","One night, Pam decided to let the dogs go.",2
65,May was accepted to college in Fredonia.,She took the bus to her new school.,She explored the campus.,She loved everything she saw.,She dropped out of school.,She even liked all her professors.,2
66,Mary needed to have her teeth pulled.,She wanted the dentist to put her to sleep.,All he could do was numb the area with Novocaine.,Mary stared at him in horror.,"After seeing her expression, the dentist was able to help Mary.",Mary left the dentist in a great mood.,1
67,Ford was proud of his high GPA.,He worked every night on assignments in order to improve it.,Ford's friends warned him that he was missing out on fun.,"Later in life, Ford became a successful lawyer.",Ford was sad that he achieved so much.,Ford was proud of his accomplishments.,2
68,My wife says I lack passion.,That I don't have many hobbies or interests.,I tried to argue but couldn't.,I realized she was right.,I decided to change.,I'm not married.,1
69,Nina wanted a nice Halloween costume.,But she couldn't afford anything fancy.,She looked through her house for ideas.,Then she found a great costume for free.,Nina bought a toy.,Nina was excited.,2
70,Veronika liked hiking in the woods.,One day she was on a trail and found a tree house.,She climbed the ladder and was amazed at all the stuff in the house.,It was fully furnished with a furniture and blankets.,Veronika didn't like the tree house very much.,Veronika decides to visit the tree house more often.,2
71,It was a beautiful spring day in early March.,Tracey decided to go for a walk in the woods behind her house.,She heard a woodpecker and began to look for it in the trees.,She tripped over a root and fell on the path.,Tracey ran back to the house.,Tracey shrugged off her fall.,2
72,Bob was really thirsty and wanted a soda.,"Unfortunately, he didn't have any money.",Bob walked into a gas station and asked if he could have a soda.,The cashier asked him if he had any money.,He said no and left the gas station.,He decided to go for a run.,1
73,Jim was waiting at the airport.,His wife would be there in an hour.,He was very bored.,He then decided to catch up on his book.,Jim saw his wife after an hour.,Jim drove away before his wife showed up.,1
74,Joe really wanted to attend Columbia University.,"He worked really hard in school, was on the soccer team.",He got put on the waiting list.,"Although he was disappointed, he tried his best to the very end.",Joe was still very proud of his hard work.,Joe decided he didn't want to go to college.,1
75,Gina's friend Tami had a folder she didn't want anyone else to have.,Gina wanted one but didn't know where to buy one.,"Now Tami had a new Lisa Frank Trapper Keeper, and she was a great one.",Gina was jealous since she wanted one too.,Gina checked on ebay and found one she could afford.,Gina mowed the whole yard and had no help from anyone.,1
76,Leah had a beautiful Christmas tree in her house.,"One day, she left to go to the store.","When she returned, the tree was knocked over.",Her cat had climbed it and pulled it down!,Leah decided she liked the tree on the floor better than standing.,Leah chastised her cat.,2
77,Peter had used the same chair for years.,It was getting worn out.,"He decided to buy a new, more comfortable chair.",When it arrived Peter was very happy.,Peter thought it might even be more comfortable than the old one.,Peter let his dog use the chair for his own.,1
78,Rex is getting ready for a party tonight.,He realizes he hasn't prepared anything for guests to eat with cheese.,Rex runs out to get a baguette.,He slices it into thin even slices to make it easy to eat.,Rex went on a long journey across the ocean.,Everyone enjoyed the cheese and bread.,2
79,Ali always takes the train to get to work every day.,One day she was very sick but still went to work.,She worked hard all day and even took work home.,She got on the train and fell asleep.,She was a lazy employee.,She missed her stop and had to take a bus home.,2
80,The football team had worked hard all season.,They had won every game and made it to the championship.,There were only seconds left on the clock and the game was tied.,The quarterback through a long pass and the receiver scored.,The crowd booed the team loudly.,The crowd all stood up in their seats and applauded wildly.,2
81,We live in a high-rise building.,"One day the wind was strong, partly due to the height of the building.",The wind blew the tree branches so much my wife could not sleep.,The wind also knocked down the internet cable.,My wife and I were very unhappy to lose our internet connection.,We loved the strong wind and lack of sleep.,1
82,Kate wanted to buy a new keyboard for her computer.,She saved for months to afford a good keyboard.,Kate finally went online and ordered her keyboard!,She eagerly waited for days for its arrival.,Then she canceled her order.,Then her keyboard arrived in the mail.,2
83,Jon graduated from college and began his job search.,He applied for jobs in his field every day.,"Three weeks after he started, he got a call.",The person calling asked if he would be interested in an interview.,Jon accepted.,Jon rejected the offer.,1
84,Julie loved to read anything she could get her hands on.,Most of her time was spent in the library.,Her favorite library was staffed by Miss Watson.,Miss Watson saw Julie's love of books and offered her a job.,Julie happily accepted!,Julie punched her friend in the eye.,1
85,Amy's family was going to Six Flags.,She sat patiently in the car waiting to arrive.,When they arrived she sat on her knees surveying the park.,She waited in line for an hour to ride the biggest roller coaster.,Amy was really excited to be at the park.,Amy thought the park was boring.,1
86,Steve was in a hurry to get to the football game.,"On the highway, Steve drove his car very fast.",The highway patrol stopped Steve's car.,The officer wrote Steve a ticket for speeding.,Steve was pleased.,Steve was upset.,2
87,My daughter went to her first birthday party for a friend.,She was so excited leading up to the party.,She talked about nothing else for a week.,She went to the party and had a blast.,She decided never to go to a party again.,"When she came home she fell asleep immediately, exhausted.",2
88,Bob needed money to buy food.,He was sad that he couldn't eat because he had no money.,He decided to write a book about his hard life.,People immediately praised the book and bought thousands of copies!,The profits from the book sales gave Bob enough money to eat.,The public reaction to the book means Bob is still hungry.,1
89,I just completed my first marathon today.,It was about six miles and I worked really hard.,I trained for it for about three months.,It's always been on my to do list in life,I've never been happier.,I'm really disappointed in myself.,1
90,Bobby folded his fruit roll-up into the shape of an airplane.,He wound up his arm and threw roll-up airplane as hard as he could.,"It was far too heavy, though, and fell like a brick.",Bobby decided that planes should be made out of paper.,Bobby was five years old.,Bobby was thirty-five years old.,1
91,Sam was stargazing one night.,Suddenly he sat bolt upright.,"He saw a twinkling, moving star!",He ran to show it to his dad.,His dad laughed because the star was really a jet with lights.,Sam's dad was glad his son was interested in geology.,1
92,John and Meg had been dating for five years.,"John loved Meg, and wanted to marry her.","He decided to ask her to marry him tonight, after a movie date.","When they walked out of the movies, he suddenly fell to his knees.",He started screaming obscenities at Meg.,He asked her to marry him.,2
93,A beautiful bunch of bananas dangled just out of reach.,"Bobby tried to throw his shoe, but it got stuck.","He tried to climb the tree, but he fell.","Next, he struck furiously with a hoe, but it was too short to reach.",Bobby was upset that he got the bananas.,Bobby went into the shed to get a ladder to get the bananas.,2
