,input_sentence_1,input_sentence_2,input_sentence_3,input_sentence_4,sentence_quiz1,sentence_quiz2,answer_right_ending
379,Gina wanted to steal her mother's house key.,She waited until her mother was taking a nap.,She took her mom's purse to the bathroom.,She removed the key from the chain quietly.,Then Gina put the purse right back where she found it.,Then Gina told her mom where the key was.,1
380,There was a man from Kentucky.,He loved a girl who lived in Louisiana.,He decided he needed to move.,He moved to be with his love.,The man moved to Texas.,The man moved to Kentucky.,2
381,Tim was failing math class.,He knew if he didn't pass he'd have to go to summer school.,He studied hard and asked for extra credit.,On the last day of school he found out he passed!,Tim was thrilled.,Tim was terribly disappointed.,1
382,Mary-Anne was feeling lonely and decided to adopt a cat.,She went to her local humane society to start the process.,"While she was looking, one of the cats meowed at her.","Mary-Anne pet the cat, and it was love at first sight.",She decided it wasn't the right cat.,She took the cat home with her.,2
383,I took gymnastics as a child.,I was learning the balance beam and doing moves on it.,"As I did a round off flipping off the beam, I landed wrong.",I broke my ankle and was in so much pain!,I was rushed to the hospital.,I got up and got right back on the balance beam.,1
384,There were six puppies running around my foyer.,It was going to be hard to choose the one we wanted to buy.,Each of my daughters picked a different puppy.,The owner said we could get a discount on two dogs.,We each bought one dog.,We didn't like the dogs.,1
385,Johnny wanted a change from his big city life in Boston.,He decided he'd be happier in America's Heartland.,"Finally the day had come, Johnny moved to Idaho.",He had escaped the big city life.,Johnny began planning to move to Boston.,Johnny was happy to be in a small town.,2
386,Joan hated going home for Christmas.,She knew that her mother would hound her about her love life.,This year on her way home she was in a car accident.,Her mother rushed to her side to care for her needs.,Joan's mother didn't speak to her because she was unmarried.,Joan felt good seeing her mother's face.,2
387,I spend all my time working on my writing.,As a result I have begun to feel quite lonely.,I've decided to join an online dating community.,"As I join, I realize that I don't particularly like other people.",I started writing more.,I went on many dates.,1
388,My daughter was a girl scout in elementary school.,One day she went on a field trip overnight.,My wife went as a chaperone.,Everyone stayed in a cabin in New Hampshire for a weekend.,My daughter never forgot her field trip.,My wife and I had dinner that night.,1
389,Today was the club opening of a new club around the corner.,I couldn't wait to attend.,When we got to the club it was beautiful.,We ordered delicious food and danced.,We befriended the bouncer so we could get into the club tomorrow.,The bouncer wouldn't let us into the club.,1
390,Yesterday I was carrying a new glass into the kitchen.,To my surprise I dropped it.,The glass shattered.,I had to pick it up.,I cut myself on a small piece.,I loved the way the glass looked now.,1
391,Bill's family lived on a hill.,It never rained or stormed there.,One day a tornado was passing through the area.,"Bill's house got hit, and the roof ripped off.",The insurance company covered the costs for a new roof.,"They decided they didn't need it anyway, and moved.",1
392,Allison decided she wanted to learn more about her area's history.,She went down to the library to check out a book on it.,She went inside and couldn't understand how the books were sorted.,She found a librarian who explained the Dewey decimal system.,That helped her figure out which car she didn't want.,That helped her find what she wanted.,2
393,Sebastian wanted to play football on his friends team.,He talked to his friend and found out he needed to go to practice.,He practiced catching the football at home all week.,He went to the next practice and scored a touchdown.,Sebastian was disappointed in the hit performance.,Sebastian was happy that his practice paid off.,2
394,Once there was a mother who was desperate for her baby to sleep.,She walked him around but still he did not sleep.,She fed him but still he did not sleep.,"Finally, she remembered the lullaby her mother had sung to her.",The mother gently sang the lullaby to her baby.,The mother played some hip hop for her baby.,1
395,Johnny used to pee in swimming pools as a kid.,He thought he could do it as an adult.,He took his kids to a water park.,Next he peed in the wading pool.,Some people noticed and Johnny got in trouble.,Everyone was really happy because of Johnny's behavior.,1
396,Amy watched the other kids play and stared at her inhaler.,Because of asthma she couldn't play sports.,She felt her art teacher's hand on her shoulder.,Her teacher smiled and told Amy she would be a great artist one day.,Amy felt so much better.,Amy felt terrible about it.,1
397,Joe and his friends had their soccer game today.,Joe was nervous.,He was nervous if he would win or not.,"Finally after the game, Joe's team won.",Joe was very proud of his team.,Joe was very disappointed in his team.,1
398,Mark had a big interview for a new job.,He prepared himself for the questions they might ask.,The interviewer seemed impressed with Mark's answers.,The interviewer informed Mark that he had the job.,Mark was very happy.,Mark was enraged and stormed out.,1
399,Elaine didn't feel like cooking tonight.,"Therefore, Elaine decided that she would go out to eat.","However, Elaine did not know where she wanted to eat.",Elaine deliberated on where she should go for almost an hour.,Elaine found it easy to make up her mind.,Elaine found it difficult to make up her mind.,2
400,Sam was trying to get into the college of his dreams.,He spent a long time filling out the application.,It made him feel good about his academic achievements.,He submitted the application.,3 months later he received a letter of acceptance.,He never thought of it again.,1
401,Matt decided to go bar hopping with his two friends one night.,They drank 3 shots in one bar.,"They went to 4 more, drinking 3 shots in each.",Matt ended up getting too drunk and lost his phone.,Matt and friends walked home and slept it off.,Matt didn't care about the missing phone.,1
402,Bindu planned a party with her friends.,They met at her house to discuss what food and band to use.,One of Bindu's friends brought samosas and doogh.,Four friends played music at the party.,Everyone had a great time.,Bindu hates her friends and parties.,1
403,Tyler wakes up and needs to shower before school.,His little brother is using the shower.,Tyler is worried he'll miss the bus.,Finally it's Tyler's turn to shower.,Tyler made cupcakes to show off his baking skills.,Tyler takes a quick shower and gets to the bus stop on time.,2
404,Thomas had been feeling under the radar lately.,He went to his doctor to get checked out.,His doctor told him that his cholesterol levels were a little high.,Thomas started eating healthier and going for walks.,He was diagnosed with diabetes after gaining forty pounds.,His doctor was very pleased at his next checkup.,2
405,The doorbell rang but no one was there.,She was unsure whether she should open the door or not.,Slowly she creaked open the door and peered outside.,Her brother jumped out at her and gave her a good scare.,She decided to watch her favorite comedy show on Netflix.,She screamed and pushed her brother away.,2
406,Stephanie wanted to make applesauce.,She decided to drive to the farmers market to pick some delicious apples.,As she was walking through the orchard she tripped and fell.,She broke both her wrists.,Stephanie pushed herself up with her hands.,Stephanie couldn't get up until someone found her.,2
407,Roy couldn't figure out why his apartment smelled so bad.,His friends commented on it when they went over.,Everyone decided to look for the source.,It turned out to be an old fish in the fridge.,Roy decided to leave the fish in the fridge.,Roy threw out the old fisherman and everything smelled better.,2
408,Jimmy grew up very poor.,"However, his parents always did their best to provide for him.","When he got into a good college, they worked two jobs to afford it.","When he graduated, he wanted to show his appreciation.",So he repaid them for college.,Jimmy called his parents and cursed at them.,1
409,Jill was surprised when a handsome boy asked her to the college dance.,"As her roommates got ready, Jill fussed about her hair.",Jill's roommates said they could help.,Jill finished dressing in her toga-like white gown.,Her date arrived and complimented her appearance.,Jill and her friends had a fun girls-only night out.,1
410,A bar owner put up a large banner to advertise his bar.,The wind was strong and blew the banner away.,The owner chased his banned across town.,It landed in the backyard of an old woman.,The old woman refused to give back the banner.,The old woman was delighted to find the fur coat.,1
411,My mother has a recipe for pumpkin bars that I like quite a lot.,She once made them for me because I was having a bad day.,I ate the pumpkin bars and I felt much better.,The bars reminded me that my mother cares about me.,I never ate pumpkin bars after that day.,I made pumpkin bars later in life and they reminded me of my mom.,2
412,Tim decided to spend more time with his grandfather.,"His grandfather loved birdwatching, so Tim watched with him.",They marked their sightings in a notebook.,Soon Tim was really interested!,Tim decided he wasn't interested in birds anymore.,Tim and his grandfather found a hobby that they both enjoyed.,2
413,Danny was working at the local ice cream shop this summer.,He was very excited to have started his first job.,On his first day a little boy dropped his ice cream on the floor.,"Without hesitation, Danny knew just what to do.",He gave him another scoop of ice cream.,He refused to give him another scoop.,1
414,The school bell rang when the clock struck two.,Gina was never happier for a day to end.,She grabbed her things and waited at the door for Tami.,But Tami was leaving with Rita and Mary.,Gina felt lonely when she went home.,Gina thanked Tami the next day.,1
415,Laurence and his family decided to move.,First they packed up their furniture.,Then they packed up everything else.,All their belongings were moved into the van.,Laurence and his family drove to their new home.,Laurence put all their belongings back in the house.,1
416,Joy wanted to find the perfect shell for her hermit crab.,"She could buy one, but it would be more special if she found it.",She scoured the beach all morning.,Everything that could work was broken!,She had to buy a shell after all.,So she brought one home and gave it to her crab.,1
417,Westin was getting married!,He wanted his wedding to go perfectly.,Everything went well until the evening.,Someone got very intoxicated and fell into the cake!,Westin cut a perfect slice from the cake.,Weston and his wife kicked the intoxicated person out.,2
418,Joe was helping his dad clear the woods in the back of their yard.,All of a sudden he heard a loud buzzing.,He had stirred up a bee's nest.,He got stung six times before he could escape.,Joe laughed about the experience.,Joe was angry he got hurt.,2
419,It was autumn.,Todd's yard was full of leaves.,He decided he needed to rake them all up.,"Once he was done, he put them all in a bag.",Todd threw them in the trash.,Todd opened the bag and spread the leaves around.,1
420,Tim had dreams of becoming a great bodybuilder.,He worked out every night to try to reach his goal.,His hard work paid off and he earned a spot in a popular contest.,"He showed his skills, lifting more than 250 lbs.",Tim was very determined.,Tim had little determination.,1
421,Henry was walking to his class.,"At the same time, he was trying to clean his phone screen with a cloth.","Unfortunately, someone bumped into him.",His phone fell out of his hand and landed on the ground.,The person apologized to Henry.,Henry was happy and grateful.,1
422,Tami decided to attend volleyball tryouts.,"She was only in the 8th grade, but she knew she was good.",She played hard and gave it her all.,She hadn't anticipated the other players would be as good as her.,Tami made the basketball team.,All the players were good but she made the team.,2
423,Bob and Jim were playing ball in the house one day.,They knocked over the vase and it broke into many pieces.,They were afraid their mom would get mad at them.,"They found some glue, and carefully glued the vase back together.","Their mom enjoyed her new, broken vase.",The glue held the vase together and their mom never found out.,2
424,Steve was very sad.,Steve's girlfriend broke up with him.,He decided to write a song to her.,He poured his heart into the song.,Steve wondered if they could ever get back together.,Steve drove an hour away to go to a strip joint for drugs.,1
425,Gloria wanted to buy flowers for her husband.,Gloria was shocked at the price of even just half a dozen lilies.,Gloria decided to pick some of her own flowers from the garden.,She got together some daffodils and chrysanthemums.,Gloria filed for divorce shortly after.,Gloria's husband appreciated the gesture.,2
426,Josh played basketball every day.,His goal was to be able to make any basket on the court.,"One day, someone challenged him to a contest.",Whoever makes the most shots would be the winner!,John ran away screaming in terror.,He made the most shots and won the contest.,2
427,Lauren has always wanted to wear skinny jeans to parties.,"However, she needs to lose weight so the skinny jeans will look good.",Lauren begins a challenging exercise regimen.,Finally she has lost enough weight to wear skinny jeans.,She wore them proudly to the next party.,She was jealous.,1
428,I went to Hawaii in high school.,Our whole band class was going.,It took 9 hours to fly there.,It was a tropical paradise.,I decided that I wanted to go to Hawaii more.,Hawaii was not a good place to travel to.,1
429,"Sonny lived in Texas, and it was a hot summer.",He was so sick of the heat.,He decided to find a way to cool off.,"At first, he couldn't think of anything.",He decided to go turn on his heaters.,He then decided to jump into his pool.,2
430,Chad was an incredible singer.,He was just too afraid to sing.,He wanted to join a church choir but thought his friends would laugh.,Because he was so embarrassed by his skill and passion.,Chad got up the nerve to deliver his comedy routine.,"Instead of laughing, everyone applauded when Chad finally sang.",2
431,"Ronald had two children, a boy and a girl.",That was more than enough.,He really didn't want two to be honest.,One day his wife told him baby number three was on the way.,He was deeply unhappy but afraid to leave.,His eyes glowed with excitement.,1
432,I was hiking last Wednesday.,While walking I stumbled across something that scared me.,In front of me was a 4 foot snake with beady eyes.,I screamed and ran all the way back to the main road.,I am a biologist who studies snakes.,I followed the road back to my car.,2
433,Mary liked to drink coffee every morning.,Today she was in a hurry.,She went to a drive-through coffee place.,She noticed the coffee was in the wrong order after she drove away.,Mary crashed into a poll.,Mary kept driving and drank it anyway.,2
434,Bill had just moved to a big city for work.,He felt lonely because he didn't know anyone in town.,After work one day Bill decided to join some coworkers for a drink.,He had a lot of fun hanging out with them.,Bill made a lot of friends that day.,Bill was upset at his coworkers.,1
435,Billy wanted to become a doctor.,He went to college to become a doctor.,"After he graduated with his degree, he changed his mind.",Billy became a nurse instead of a doctor.,He never regretted his decision.,"He was so depressed, he became an alcoholic.",1
436,Quinton was getting evicted from his apartment.,He was broke with no income.,"One day, he decided to spend his last dollar on the lotto.","To his disbelief, he won $50,000!",Quinton was depressed.,Quinton was so happy.,2
437,After Igor woke up he began to get ready for work.,He turned on the shower and waited for it to get hot.,The water remained cold.,He debated between taking a cold shower and not showering.,He ate a muffin.,Igor took a cold shower.,2
438,Tara preferred big band music to all the alternatives.,She loved all the horns and other brass instruments involved.,She tried to find fellow big band lovers.,Her attempts were futile.,Tara still enjoyed listening on her own!,Tara was a mean girl.,1
439,I traveled to Washington DC to visit my boyfriend.,We went to many places around town.,But one place I wanted to go was the White House.,"He took me to the White House, and I was so happy.",We took the tour and enjoyed the history of the place.,We left the White House abruptly and didn't take the tour.,1
440,My son bought a drum set for his one-year-old niece last fall.,"The set had drumsticks, a cymbal, and a seat.",His niece lives in NYC.,"She saw it when she visited, and was thrilled.",She hates music.,She wanted to play the drums.,2
441,Maggie had her first piano recital tonight.,She was very nervous.,When she got on stage she was shaking.,Thankfully she ended up playing perfectly.,Maggie was encouraged to do more.,Maggie gave up the piano.,1
442,Ed liked movie nights with the family.,They would get treats and drinks and huddle around the TV.,They were watching Aladdin tonight.,But Ed fell asleep before it ended.,Ed was happy with the ending.,Ed regretted falling asleep.,2
443,I decided I wanted to sign up for a Christmas club with my bank.,I called the teller and asked when I could do this.,She told me I could come in anytime.,I went in this morning and signed up for the plan.,I'm glad I signed up.,I regret signing up.,1
444,Mac had a vegan friend coming for dinner.,"He groaned, knowing he couldn't make steak or hamburgers.",Then he remembered a recipe for an Alfredo sauce made with cashews.,"To his surprise, the sauce came out creamy and delicious.",He decided to serve meatloaf instead.,They all enjoyed the meal.,2
445,Ryan used to work for mall security.,He often worked the night shift.,"One day, he saw a raccoon in the mall.",He stared at it for hours until it left.,Ryan was blind.,Ryan decided his job was rather dull.,2
446,Johnny's teacher treated the class to homemade snow cones.,The teacher let each student pick a colored syrup topping.,"When his turn came, Johnny got mad when he saw only one color left.",Johnny's teacher asked what was wrong.,Johnny told the teacher he was happy.,Johnny told the teacher he was upset he didn't get more colors.,2
447,Tim had to choose between three girls to date.,He liked all three of them but he needed to make a decision.,He talked to all three of them to see who liked him more.,He eventually went with the girl who wanted to see him more.,Tim is gay.,Tim was satisfied.,2
448,Jill convinced her boyfriend Joe to go look for Geocache with her.,He didn't think it sounded like fun but decided to humor her.,They searched the location where the Geocache was supposed to be.,After more than an hour of searching they were unable to find it.,Jill hoped they would find it soon.,Jill was glad she didn't bring Joe.,1
449,Brigid and her friend Ella both took piano lessons.,Ella's father bought her a very expensive grand piano by a renowned maker.,Brigid's father could only afford to buy her a used upright piano.,But Ella was a foolish and insensitive girl who never practiced.,Ella never became good at piano.,Ella then became a star pianist.,1
450,Dave wanted to buy a gun.,He went to the gun store and asked a lot of questions.,He looked at big guns and small guns.,He decided he wanted to buy a big shotgun.,Dave was against the second amendment.,Dave bought it and enjoyed his purchase.,2
451,Rose took a train to Long Island.,"There, she went to the very tip of the island.",She went to the beach at Montauk Point.,It was cold and windy.,Rose was so warm that she took off her jacket.,Rose shielded her face from the wind.,2
452,Drew was using a typewriter for a special project.,He tried to be careful since he couldn't erase his words.,"However, he ended up falling asleep.",His head landed on the keys and several letters were typed.,Drew was glad his project would be free of any mistakes.,Drew had to start typing the paper over again.,2
453,Sarah has always had a fascination with the night sky.,"Noting her passion, Sarah's father bought her a new telescope.",She was ecstatic.,She went outside every night to diligently view the night sky.,Sarah's father took back the telescope.,Sarah loved her new telescope.,2
454,Kristen was tired of her room.,She needs to move it around for a change.,She hadn't moved it in over four years.,After moving everything she saw a huge stain where her bed covered.,Melanie decided that the room looked perfect now.,She decided to put a rug over the stain.,2
455,My sister moved in with me when she was 35.,She'd been living with a wife beater in a rundown trailer park.,"The man tracked her down to my house one cold, dark night.",He broke into my house while we were sleeping.,We woke up to find him sneaking in through a window.,"He sat down at the table with us, and we all had drinks.",1
456,My parents fell out of love.,I'm not sure when it happened but it seems to have been mutual.,They decided to end things amicably.,Although I'm hurt by this I'm glad they chose what makes them happy.,My parents want to live together.,My parents were to live separate lives.,2
457,Anna was going to have a baby sibling.,Her mom went into the hospital and Anna was hopeful.,"She really wanted a little sister, but not a brother!","When her mother returned home with the baby, Anna was overjoyed.",The new baby was a boy.,The new baby was a girl.,2
458,Monica decided to play Truth or Dare with her friends.,They were all afraid to confess anything and only picked Dare.,The Dares got progressively more elaborate as the day wore on.,Monica dared a friend to steal doritos and the friend did it.,Monica and her friends enjoyed the doritos before the next Dare.,Monica couldn't explain why her friend had stolen the doritos.,1
459,Ray went to a friend's house for a sleepover.,He realized that he had forgotten his toothbrush.,He couldn't even brush his teeth!,"Ray tried to use toothpaste on his finger, but it was no use.","Finally, Ray asked his friend if he had a spare toothbrush.",Ray did a good job brushing his teeth.,1
460,Ellie had a lot of homework to do.,She started with her math homework.,"After she finished that, she wrote a book report.","The last assignment was a study guide, which took her ten minutes.",Ellie felt prepared for her schooling.,Ellie decided to skip school the next day because she was ahead.,1
461,Don loved comic books.,He consistently collected issues of his favorite stories.,As he grew older his love for comics grew.,He decided that he wanted to start his own comic book company.,He named it Don's Comics.,Don threw his comics in the trash.,1
462,Arnold was afraid of bats.,He thought that if they bit him he would turn into a vampire.,One day he saw a bat in his bathroom.,He freaked out so much he screamed.,Arnold took a relaxing shower with the bat.,The bat flew directly towards the source of the scream.,2
463,Annabelle loves to sing.,She sings in her school choir.,Mary noticed Annabelle's great singing voice.,Mary asked Annabelle to be in her band.,Annabelle said yes and was excited for the opportunity.,Annabelle was very offended.,1
464,Uki was traveling in Africa.,"One night, he was bitten by a black mamba.",Uki screamed in pain!,He was rushed to the local hospital.,The doctor instructed him to drink plenty of fluids.,They gave him the antidote that saved his life.,2
465,Sean was homeless.,He begged for money on the streets.,"For a week, no one gave him money.",He was starving.,Sean decided to go to a shelter.,Sean eventually moved into a huge house.,1
466,Two hobos agreed to make dinner together.,Each set out to find ingredients.,The first returned with a worn boot.,The second returned with a gross of wing nuts.,They decided they couldn't make a meal.,The two hobos ate their cheeseburgers.,1
467,Judy and Bill were preparing to have dinner with their parents.,Judy makes a roast with potatoes and rolls with gravy.,Bill sets the table and puts on some background music.,"The doorbell rings, it's their parents.",Judy and Bill were highly unprepared.,Judy and Bill were very prepared.,2
468,Sal hurt his leg when his wife accidentally tripped him.,She felt so bad that she waited on him hand and foot.,She bought him food and gave him messages.,Sal liked all the attention.,Sal was furious with his wife.,Sal's leg eventually healed.,2
469,Rebecca met Jake when they were both six years old.,They became best friends and grew up together.,"When they were 13 years old, Jakels family moved away.",He promised Rebecca he'd come back for her.,Jake's family moved back next door to Rebecca three years later.,Rebecca and Jake both auditioned for the musical.,1
470,One weekend we wanted to see a movie with the kids.,There were two movies they wanted to see.,So we decided to divide and conquer.,Two kids and I went to one and my husband and our son to another.,"After that, we got a divorce.",Both groups had a great time seeing the movies they wanted.,2
471,Amy's sister took her to the beach to surf on her vacation.,Amy hurriedly suited up in her wetsuit.,The instructor was patient when Amy couldn't get the hang of it.,Finally it was time for Amy to try on her own.,Amy decided to go swimming.,Amy was surprised that she did a good job.,2
