,input_sentence_1,input_sentence_2,input_sentence_3,input_sentence_4,sentence_quiz1,sentence_quiz2,answer_right_ending
1128,"Péntek este volt, úgyhogy elhatároztam, hogy bérelünk egy filmet.","Elmentem a Redboxba, hogy vegyek egyet.","Egy óráig tartott, mire végül a ""Túlélők"" című filmet választottam.","Hazaértem, készítettem egy kis harapnivalót, aztán elmentem beállítani a filmet.","Ez volt a legjobb film, amit régóta láttam.",Lezuhanyoztam és elmentem dolgozni.,1
1129,Paula sok szóbeli verset írt.,"A barátai támogatták, még ha rossz is volt.",Meghívták egy buliba.,Paula elkezdett beszélni.,A barátai tapsoltak a versének.,Paula széttépte a versét.,1
1130,"Miután leszálltam az iskolabuszon, rájöttem, hogy eltűnt a telefonom.","Mivel volt rajta szolgáltatás, úgy döntöttem, hogy lemondom.",Az ügyfélszolgálat képviselője tette.,"Azt is mondta, hogy hívás érkezett Jamaicába.","Tudtam, hogy valaki ellopta.","Tudtam, hogy valaki hamarosan visszaadja a telefont.",1
1131,Ma volt Iris ötödik születésnapja!,Az anyja meglepetés bulit tervezett neki.,Az összes barátja ott volt.,Kinyitotta az ajándékokat és süteményt evett.,Iris nagyon jól szórakozott a partin.,"Iris úgy döntött, hogy soha többé nem eszik tortát.",1
1132,"Tina mindig piros bikinit viselt, amikor a tengerpartra ment.","Mindenki azt várta, hogy egy ilyenben látja.",Egy nap találkozott a barátaival kék bikiniben és meglepte őket.,"Nem értették, miért öltözködne valami másra.",De tetszett nekik az új bikini.,"Tina barátai tudták, milyen kiszámíthatatlan.",1
1133,"Ted mindig is arról álmodott, hogy lakástulajdonos lesz.","De attól félt, hogy ez olyan cél, amit soha nem fog elérni.","Egy nap apja meglepte, hogy segítene Tednek.",Ted apja segített megosztani a háztartás előlegét Teddel.,"Ted azt mondta, nem akar többé lakástulajdonos lenni.",Ted hálás volt az apjának a segítségért.,2
1134,Evie órákig kóborolt a kastélyban.,Minden sarkát és rését átkutatta.,"Főnökei kikérdezték, mit tanult.",A kérdéseikre briliáns és könnyedén válaszolt.,Büszke volt magára.,Rettegve elmenekült.,1
1135,"Ed és az ikertestvére, Ethan online nőket keresett.",Aztán meglátták a profilat két ikerlányról.,"Felhívták Samit és Sárát, és megbeszélték a randit.",A randijukon mind a négyen csodálatos időtöltésük volt.,Évekkel később mindkét pár összeházasodott.,"Úgy döntöttek, hogy nem találkoznak többé.",1
1136,Marco ma új állást kezd.,Jól akar kinézni az első napján.,"Marco úgy dönt, hogy nyakkendőt vesz fel.","Az új főnöke lenyűgözte, hogy milyen jól néz ki.","Marco örül, hogy jó benyomást tett rá.",Marco megrémült a főnöke reakciójától.,1
1137,Tim tengerentúli utazást akart.,Még soha nem szállt repülőre.,"Elhatározta, hogy repülővel utazik Kínába.",Élvezte a repülést!,"Tim megesküdött, hogy soha többé nem száll egy másik gépre.",Tim elkezdett repülővel utazni.,2
1138,"Lucy-nak holnap vizsgája volt az iskolában, és alig tanult.","Már nagyon késő volt, és lefeküdnie kellett.",A következő reggeli iskola el volt rejtve a hó miatt.,"Lucy szerencsés volt, és az egész szabadnapját a vizsgára tanult.",Lucy kitűnően teljesítette a tesztet.,"Lucy azért bukott le a vizsgán, mert nem tanult.",1
1139,Fred szerette a rejtélyes regényeket.,Minden hónapban legalább egyet olvasott.,"Amikor a barátai megtudták, mind vettek neki egyet a születésnapjára.","De sajnos, elkezdett irritálódni a figyelem miatt.","Fred azt mondta a barátainak, hogy szünetet tart a krimi regényeknél.",Fred egy titokzatos regény könyvklubot indított a barátainak.,1
1140,Tia saját pékséggel rendelkezett.,A pékségében gyönyörű süteményeket készített.,"Egy nap rájött, hogy kifogyott a lisztből, annak ellenére, hogy nagy rendelést kapott.","Az egész városban kereste, és végre talált.",Tia csalódott volt.,Tia megkönnyebbült.,2
1141,Sarah a barátaival elment a víziparkra.,Fizették a jegyeiket és felvették a fürdőruhájukat.,A legnagyobb csúsztatásra sorakoztak.,"Lementek a csúszón, és nagyon jól érezték magukat.","Megesküdtek, hogy soha többé nem térnek vissza.",Másnap visszamentek.,2
1142,Jeb sziklákat épített.,"Egy olyanat csinált, ami teknősnek nézett ki.",Sam jött és lerombolta.,Jeb sírni kezdett.,Sam nevetett és elfutott.,"Jeb izgatott volt, hogy új építőt építhet.",1
1143,Jeff az osztályával elmegy egy kirándulásra az esőerdőbe.,"Jeff izgatott és alig várja, hogy elmenjen.","Amikor Jeff megérkezett, nagyon csalódott volt.","Az esőerdő nem volt izgalmas, és nem volt mit csinálni.",Jeff jól szórakozott.,Jeff unatkozott és dühös volt.,2
1144,Dani nővér volt az intenzív osztályon.,Egyik este az elkülönült apja volt az egyik páciense.,"Dani nem akarta, de ő kezelte az apját.","Ahogy jobban lett, a két ember képes volt beszélni.",Dani nem lepődött meg a mai események miatt.,Dani sokkal jobban megismerte az apját.,2
1145,"Gina a barátnője, Ruth házában volt.","Egy Jane nevű lány, akit nem ismer, megjelent.","Jane udvariatlan volt, és öntelt.","Gina később rájött, hogy Jane az ellensége, Joe húga.",Szóval most mindig elkerülte Jane-t.,Így boldogan barátkozott Jane-nel.,1
1146,Ella egy napot töltött a napon.,Elfelejtette a naptejet.,- Elégett!,De hamar elhalványult és barnult.,"Ella remekül nézett ki, és sok dicséretet kapott.",Ella a következő napot az esőben töltötte.,1
1147,Neil épp most érkezett Kenya-ba.,Egy safari csoporthoz csatlakozott.,Mindenféle egzotikus állatot láttak.,Neil fotót fotózott.,Egy oroszlán szúrta meg.,"Neil készített egy fotóalbumot, amikor hazaért.",2
1148,"Gina úgy döntött, hogy először süt egy almás pitét.",Nagyon gondosan követte a receptet.,"Miután a pitét a sütőbe tette, alig várta, hogy megkóstolhassa.",Nagyon finom lett!,"Úgy döntött, a szemétbe dobja.",Megosztotta a receptet és a pitét minden barátjával.,2
1149,Pablo egy torkot akart.,De nem volt pénze.,"Átnézte a szekrényét, hogy lássa, mit adhat el.","Talált egy játékmedvét, és 50 centért adta el.",Aztán vett egy cukorkát.,Vett vele egy kis üdítőt.,1
1150,Anna kiadózott egy raktárt egy nagy partira.,"A díszítés nagyszerű volt, de valami hiányzott.","Aztán Anna rájött, hogy diszkólabda kell nekik!",Bérelt egy labdát egy parti ellátó cégtől.,Anna csalódott volt.,A buli remekül ment.,2
1151,"Oscar átment a gyerekszobába, hogy találjon egy fát, amit az udvarába ültethet.","Nehéz volt eldönteni, melyik fát vegye.",Sok fából kellett átmennünk.,Végül egy bonsai fát választott.,Tökéletesen illett a lakásába.,"Elpusztította, amint hazaért.",1
1152,Volt egy nagy kosárlabda meccs a tornateremben.,Én és a barátom ugyanabban a csapatban játszottunk.,"A játék intenzív lett, és a végén mindkét csapat egyenlő lett.","4 másodperc maradt az órából, és pontot kellett szereznünk.","Én lőttem a nyerő kosárba, ami megnyerte a meccset a csapatunknak.","Elmentem a pályáról, és nem néztem vissza.",1
1153,Dirk remek zongorista volt.,Gyakran előadott a nyilvánosság előtt pénzért.,Az utolsó előadásán az egyik billentyű eltört a billentyűzetéről.,"A legjobb tudása szerint fejezte be a fellépést, de a zene gyenge volt.",Dirk zavarban volt.,"Dirknak tetszett, ahogy hangzott.",1
1154,Eva imádta a mókusokat az udvarában.,Mogyoróvajas szendvicsekkel kezdte etetni őket.,Hamarosan megszokták.,Az egyik különösen barátságos volt.,Eva félt a mókusoktól.,Eva képes volt megsimogatni az egyik mókusot.,2
1155,Andy imádta a strandon.,"Megkérdezte az anyját, hogy mehetnek-e a tengerpartra.",Az anyja vitte Andyt a tengerpartra.,Útban a tengerpartra esni kezdett.,Andy utálta a strandon.,Andy szomorú volt miatta.,2
1156,"Vettem egy telefonházat, aminek van egy kötél.",Szükségem volt egy mobilra.,A táskát a kötél nélkül hozták.,"A honlapon az állt, hogy a táskában volt egy tartó, de nem volt kötél.",Visszaadtam a telefonomat.,Bolondnak éreztem magam.,2
1157,Múlt héten cseréltem ágyneműt az ágyamon.,Elegem volt a régiektől.,Az új jobban néz ki és jobban érzi magát.,"Azt hiszem, megtartom őket.","Örülök, hogy nem voltak túl drágák.","Tervezem, hogy szétvágom őket.",1
1158,Chase nagyon akart egy új játékot.,Az anyja nem vásárolna neki új játékot.,"Azt tanácsolta, hogy tartsa meg a zsebpénzét.",Elmentette a zsebpénzét.,Chase vett magának egy új játékot.,Chase elfutott otthonról.,1
1159,Renee-t Eddie Van Halen zenéje inspirálta.,"Elhatározta, hogy gitározni tanul.",Vett egy elektromos gitárt és egy erősítőt.,"Utálta, hogy ujjaival nyomja a húrokat.","Renee úgy döntött, hogy hozzá kell szoknia.","Renee örült, hogy meg akart tanulni dobolni.",1
1160,Bill horgászni ment és sok halat fogott.,"Annyian kaptak, hogy néhányat el kellett adni.","A szomszédai szegények voltak, és hálásak voltak Billnek a halért.",A szomszédok végre újra lábra álltak.,"Bill szomszédai beperelték, mert szegényre tették őket.","Pénzt sütöttek Billnek, hogy megmutassák, mennyire hálásak a halért.",2
1161,Múlt héten leállt az internet.,A feleségem és én halálosan unatkoztunk.,Minden más lehetőség unalmasnak tűnt.,Végül csak ittuk és beszélgettünk egy darabig.,Végül is jól éreztük magunkat.,"Örülünk, hogy nincs internetünk és nem iszunk.",1
1162,Tim egész életében zenét akart csinálni.,"Tim egész nap gyakorolt, minden nap.","Amikor Timnek elég zenéje volt, felhívott egy lemezstúdiót.","A stúdió úgy döntött, felveszi, és Tim boldog volt.","Tim úgy döntött, hogy nem szereti a zenét.",Tim hivatásos zenész lett.,2
1163,"Alex gyanította, hogy a macskája, Tigger bolhás lehet.",Tigger folyamatosan kaparta magát éjjel-nappal.,"Alex elvitte Tigger-t az állatorvoshoz, hogy diagnosztizálják.","Az állatorvos megerősítette, hogy Tiggernek valóban volt bolhája.","Bólya elleni gyógyszert adtak neki, és rendbe jött.","Alex úgy döntött, nem adja a macskának a felírt gyógyszert.",1
1164,Haley fiatal tudós volt egy híres laboratóriumban.,Minden nap keményen dolgozott a jelenlegi projektjén.,Az egyik kollégája titokban ellopta a kutatását.,"Haley felfedezte ezt, amikor egy tudományos folyóiratban publikálta.","Haley úgy érezte, hogy elárulták.","Haley úgy érezte, hogy csodálatosan támogatták.",1
1165,Sam bulit akart szervezni.,Sam meghívta az összes barátját és szomszédját.,A parti nagyon vadul indult.,Minden vendég undorral távozott a buliból.,Sam bulit szervezett.,Samnek borzasztó másnapos volt a következő nap.,2
1166,Katie nem tudott aludni.,"Lement a lépcsőn, és a konyhába.",Beöntött magának egy pohár tejet.,Aztán felmelegítette a mikrohullámú sütőben.,Katie megitt és visszament az ágyba.,"Katie úgy döntött, hogy ledöntötte a tejet a csatornába.",1
1167,"Tom a feleségével, Beckyvel beszélt, akinek rossz napja volt a munkahelyén.","Úgy döntött, hogy meglepetésként elhozza a kedvenc ételét.",A munkából hazafelé nagy volt a forgalom.,"Miután megkapta az ételt, sokkal később érkezett haza, mint tervezte.","De minden rendben volt, amint megölelték egymást és vacsoráztak.","Tom úgy döntött, hogy elmegy a kaszinóba, de nem vette figyelembe a családját.",1
1168,Kellett választaniuk egy kályhát az új házukhoz.,Nem tudtak egy adott márkát választani.,Tetszett nekik a Viking tartóssága.,És tetszett nekik a Thermadorral kötött megállapodás.,Nem volt szükségük a tűzhelyre.,"Úgy döntöttek, megveszik a Viking kályhát.",2
1169,Jasmine nem tanult a nagy matekvizsgájához.,"Azt hitte, hogy csak úgy megcsinálja.","Jasmine hamar rájött, hogy a teszt nagyon nehéz.","Úgy döntött, hogy megcsalja a szomszéd újságot.",A tanár elkapta és büntetést szabott ki.,A tanár elkapta és dicsérte a találékonyságát.,1
1170,"Sam Los Angelesbe költözött, hogy filmcsillag legyen.","Nem volt sok pénze, de úgy gondolta, hogy az egyetlen út az, hogy elmenjen.",Két hónap után Sam a kocsijában aludt és tönkrement.,Egy nap elment a kínai színházba könyörögni.,Sam elég reménytelen volt.,Sam nagyon lehangolt volt.,2
1171,Ben későn ébredt.,"Ben úgy döntött, hogy kihagyja a reggelit, és munkába megy.","Túl elfoglalt volt a munka, hogy szünetet tartson vagy ebédeljen.",Ben a munka után rossz forgalomban volt.,"Ben annyira éhes volt, hogy beteg lett.",Ben gyorsan haza tudott jutni.,1
1172,"Darren elkésett a munkából, és nem találta a kocsi kulcsát.",Átnézte a házát.,"Megkérdezte a feleségét, hol vannak.","Azt mondta, nézze meg a zsebeit.",Darren kikapcsolta a számítógépet.,Nem volt kulcs a zsebében.,2
1173,Múlt héten volt egy állásinterjúm.,A barátnőm segített új nyakkendőt választani.,Elmentünk a boltba és órákig kerestük.,"Találtam háromat, amik tetszettek.",Helyette papagáj nyakkendőt vettem.,Mindet megvettem.,2
1174,Harry szerette a hokit.,"Úgy döntött, hogy egy helyi ligában játszik.",Harry részt vett a csapat próbaversenyein.,"Harry remélte, hogy elég jól teljesít, hogy bekerüljön a csapatba.",Harry aztán kilépett a hokicsapatból.,"Néhány nappal később Harry megtudta, hogy bekerült a csapatba.",2
1175,A kis Sue elefánton lovagolt az állatkertben.,"Először tetszett neki, de aztán megijedt.",Elkezdett sírni az anyja után.,"Az állatkert őrének meg kellett állítania az elefántot, hogy elhozza őt.","Sue anyja elvitte, hogy simogassa a kecskét.",Sue tovább lovagolt az elefánton.,1
1176,Hannah egy csodálatos művész volt.,Mindig is volt egy természetes adottsága.,"Elhatározta, hogy részt vesz egy művészeti versenyen.",Szerencsére ő nyerte meg a fődíjat.,"A szülei ragaszkodtak hozzá, hogy a nagymamája csinálja a legtöbb varrást.",A szülei nagyon büszkék voltak rá.,2
1177,Jim kivitte a szemetet.,Elcsúszott egy jégdarabon a járdán.,Jim keményen a járdára esett.,"Jim érezte, hogy valami eltörik a karján.","Jim úgy döntött, hogy kézállást csinál.",Jim megsérült és hívni kellett a 911-et.,2
1178,Utálom a mosást.,A harisnyák összehasonlítása szörnyű időpocsékolás.,"Mindig elvesznek a zoknik, amikor mosok.","Belefáradtam, hogy páros zoknit keressek.",A mosást pihentetőnek találom.,"Kidobtam az összes régi zoknimat, és fehér zoknit vettem.",2
1179,James 12 éves volt és imádta az ételt.,"Egészen a mai napig nem is gondolt arra, hogy főzzön.","Az anyja hagyta, hogy segítsen rizst készíteni vacsorára.","James megtanulta, milyen szórakoztató és kreatív lehet a főzés.","James úgy döntött, hogy főszakács lesz, ha felnő.",James soha többé nem főzött.,1
1180,"Lee tudta, hogy az anyjának új kesztyűre van szüksége, és nem engedhette meg magának.",Lee elkezdett kötni egy párat.,"Sietett, hogy karácsonyra befejezze őket.",Aztán bemutatta az anyjának.,"Lee anyja büszke volt a lányára, hogy ilyen figyelmes.",Lee anyja Lee-re dobta a kesztyűt és elhagyta a szobát.,1
1181,Jennifer egy nagyvárosban volt profi szövegíró.,"Jó munkát végzett, de mindig rossz megjegyzéseket kapott a kritikájáról.","Jennifer rájött, hogy a főnöke megpróbálta szabotálni!","Úgy döntött, hogy szembenéz a főnökével a negatív megjegyzések miatt.",Jennifer megköszönte a főnökének a tisztességességét.,"Jennifer belevágott az irodájába, és kiigazította a főnökét.",2
1182,Lorraine softball játékos volt.,Ő volt a legjobb a csapatában.,"Egy nap, egy játék közben, nagyon kificamította a bokáját.",Nem tudott tovább játszani.,Lorraine nagyon meg volt elégedve!,Lorraine nagyon szomorú volt.,2
1183,Abby és Tammy a legjobb barátok voltak.,Mindketten szerettek együtt szórakozni és kreatív dolgokat csinálni.,"Úgy döntöttek, hogy baráti karkötőket készítenek és másoknak adnak.","Abby ötöt, Tammy pedig még hetet.",Tammy soha többé nem beszélt Abbyvel.,"Úgy döntöttek, megtartják a karkötőket maguknak.",2
1184,Tegnap este volt egy nagy villámvihar.,Elvették az áramot.,Az egész környéken nem volt áram.,"Nagyon hideg lett, és megijedtünk.",El kell ásnunk a havat.,Aztán egy óra múlva újra áram volt.,2
1185,"Sal dühös volt, hogy a szülei elköltöznek.",Egy épület nyolcadik emeletére költöztek.,"Utálta, hogy ilyen magasban él.","Miután elköltöztek, kinézett a hálószobája ablakából.",Sal kidobta a párnát az ablakon.,A gyönyörű kilátás miatt meggondolta magát.,2
1186,Lydia furcsa álmot látott tegnap este.,"Azt álmodta, hogy vizsgázott az iskolában.","A teszt alatt rájött, hogy elfelejtette felvenni a nadrágját!","Annyira zavarba jött, hogy elfutott az osztályból.","Lydia azt kívánta, bárcsak az álom valóságos lenne.","Lydia megkönnyebbült, amikor rájött, hogy csak álom volt.",2
1187,Alexnek kellett a vásárlás.,Csinált egy listát a vásárlandó dolgokról.,Összegyűjtötte a újrafelhasználható vászonzsákjait.,A boltba ment.,Alex vett egy jachtot.,Ő vette a bevásárlást.,2
1188,Yolanda utálja a hullámvasútokat.,"Katie nem érti, miért.","Úgy döntött, hogy kényszeríti Yolandát, hogy vele utazzon.",Yolanda Katie-re hányt.,"Katie a legboldogabb volt, mint valaha.","Katie megbánta, hogy Yolandát kényszerítette a kalandra.",2
1189,"Az egyik dolog, amit Tina New Yorkban szeretett volna csinálni, egy hot dog standba menni.","Végre meglátott egy Nathan-t, és rendelt egy hagyományosat.",Az étel csodálatos volt.,"Drága volt, de megérte.",Szomorú volt a hot dog miatt.,Boldog volt a hot doggal.,2
1190,Tammy szeret horgolni.,"Pár hét múlva karácsony volt, és nem volt pénze.","Az ötlete az volt, hogy a tartalék fonalból takarót készítsen.","Aztán becsomagolta az unokájának, Loreleinek.","Tammy szomorú volt, hogy nem volt ajándékja.",Lorelei évekig őrizte azt a takarót.,2
1191,Melinda egy horrorfilmet akart nézni.,"Egyedül akart menni, hogy bebizonyítsa, milyen bátor.",Melinda elment moziba és vett egy jegyet.,"Melinda nagyon félt, miközben nézte a filmet.",Melinda szerint a film nagyon vicces volt.,"Melinda azt kívánta, bárcsak hozott volna magával valakit.",2
1192,"Lamar megtudja, hogy egy délután váratlan vendégei lesznek.","Nincs otthon semmi étele, amit a vendégeinek adhatna.","Úgy döntött, inkább teát főz nekik.",A vendégei élvezik a teáját.,"Lamar teát adott nekik, hogy vigyék haza.",Lamar a parkba ment.,1
1193,Az unokahúgom két éve jelentkezett az RMV-be.,"Megkapta a munkát, és izgatott volt.","Azt mondták neki, hogy szüksége van egy jogosítványra, ami nincs meg.","Megmutatta a munkáltatójának az orvos által kiadott igazolást, hogy nem tud vezetni.","Úgy döntöttek, hogy jó, ha titkárnőnek dolgozik.",Tökéletes vezetési bizonyítványa volt.,1
1194,Lela-t öt éve diagnosztizálták rákosnak.,Minden nap egy küzdelem volt.,Majdnem minden nap orvosokhoz és kezelésekhez ment.,Lela végre jobban lett az elmúlt hónapokban.,"Lela befejezte a kezelést, és jobban érezte magát.",Lela aztán túl lett az influenzaján.,1
1195,Fred új volt az osztályban.,"Nagyon kínos volt, és nehéz időszaka volt.","Senki sem akarta, hogy barátja legyen.",Később ebéd közben valaki vele evett.,Fred népszerű volt.,Fred beszélgetett az ebédlő társával és barátokat szerzett.,2
1196,Joyce-ot 5 évesen örökbe fogadta a nevelőanyja.,Az örökbefogadás után az anyja még három gyereket fogadott örökbe.,"Joyce imádott idősebb nővér lenni, és sokat segített az anyjának.","Amikor egyedül költözött, ő is nevelőszülő lett.",Joyce nem sokkal később elhagyta a gyerekeit.,Joyce is ugyanúgy szerette a gyerekeit.,2
1197,Horatio mindig is félt a nyers osztrigától.,"A barátnője azt mondta, hogy finom, de ideges volt.","Végül elvitte nyaralni Cape Codba, hogy megkóstolhasson egy friss osztrigát.","Horatio először harapott egy nyers osztrigába, és imádta.","Úgy döntött, nem eszik többet.",Még tízet evett.,2
1198,Tom szerette a marhákat.,Minden nap ezt csinálta.,Egy nap egy tehén szabadon ment.,Mindenhol kereste.,"Észrevette a tehenet a szomszéd mezején, nem vette észre, és elment.",Megtalálta a tehenet és visszahozta.,2
1199,Alyssa kávézott a munkába menet.,A kávét vezetés közben ivta.,Hirtelen meg kellett állítania a kocsiját.,"A kávé a térdére ömlik, és megégeti a lábát.","Nevetett, miközben tovább vezetett a munkába.","Majdnem balesetet szenvedett, miközben fájdalomtól kiabált.",2
1200,John az autópályán vezetett.,Egy Mustang megállt mellette és megtartotta a sebességet.,Az új Camaróját vezette.,"Úgy döntöttek, versenyeznek.",John megnyerte a versenyt.,"John megállt, hogy vegyen egy Mustangot.",1
1201,Ben idén a munkahelyi jelmezversenyen akart nyerni.,"Sok órát töltött azzal, hogy a semmiből készítse a jelmezt.",A jelmeze mellett rengeteg színpadi sminket használt.,A munkahelyén mindenki lenyűgözte a kinézetét.,Ben örült.,Ben kivonult a jelmezversenyből.,1
1202,"Anyám megkérdezte, hogy kölcsönkérhet-e tőlem 100 dollárt.","Mivel csődben van, kölcsönadtam neki a hitelkártyámat.","Másnap, amikor ételt akartam venni, a hitelkártyámat visszautasították.","A cég azt mondta, hogy 320 dolláros vásárlást tettem.","Mondtam anyámnak, hogy használhassa a hitelkártyámat.","Dühös voltam anyámra, amiért kifizette a hitelkártyámat.",2
1203,Kellynek mindig is a legszárazabb haja volt.,"Fogalma sem volt, mit tegyen.",Végül elment az orvoshoz.,Ő írt fel neki tablettákat.,Kelly végre nem volt száraz a haja.,Kelly imádja a chipset.,1
1204,Sarah félt mások közelében lenni.,"Elhatározta, hogy kényszeríti magát, hogy elmenjen egy buliba.",A partin szédült és ideges lett.,"Sarah úgy döntött, hogy ez elég, és elment egy pszichiáterhez.","A pszichiáter megtanította neki, hogyan tud megbirkózni a problémájával.","A terapeutája azt mondta, hogy furcsa.",1
1205,Ellen az orvosnál volt.,Épp most tudta meg a babája nemét.,Tényleg fiút remélett!,"Megállt a lélegzetével, amíg az orvos megvizsgálta a hasát.","Ellen csalódott volt, amikor megtudta, hogy fiú lesz.","Az orvos megerősítette, hogy fiú!",2
1206,"Zoey-t a barátai gúnyolódtak, mert furcsa a neve.","Szerette a nevét, és azt kívánta, bárcsak az emberek ne lennének ilyen gonoszak.","Egy új sorozat készült, aminek Zoey volt a főszereplője.",Zoey neve hirtelen nagyon menővé vált a társai számára.,"Zoey örült, hogy mindenki kedveli a nevét.",Zoey 18 éves korában megváltoztatta a nevét.,1
1207,Miranda most kapta meg a jogosítványát.,Elvitte a családi furgont egy körre.,Hosszú ideig vezetett.,"De aztán rájött, hogy elveszett.","Miranda visszament, hogy visszakövetse a lépéseit.",Miranda örült a büszkeségének.,1
1208,Bob elment az orvoshoz.,"Az orvos azt mondta neki, hogy túlsúlyos.","Bob rájött, hogy formába kell jönnie.","Beiratkozott egy edzőterembe, és elkezdett figyelni, hogy mit eszik.",Bob nyert 50 fontot.,Bob formába jött.,2
1209,"Lonnie azon gondolkodott, hogy milyen főiskolára járjon.","Tudta, hogy a végső célja, hogy tanár legyen.",A karrier tanácsadótól kért tanácsot.,A tanácsadó megadta neki a feltételeket.,"Lonnie végül úgy döntött, hogy az oktatásba fog belemenni.",Lonnie kidobta a listát.,1
1210,Sherry szerette a szabadban járni.,"Elhatározta, hogy egy napos napon a parkban sétál.","Egy patak mentén sétálva látott valamit, ami csillogott.","Lehajolt, és felvette a csillogó tárgyat.",Egy negyed dollár volt.,Felvette egy rozsdás késet.,1
1211,Phil elment sétálni a parkba.,"Meleg, szellőző nap volt.",Néhány barátjával találkozott a sétája során.,Az egyikük felkínálta egy italra.,"Phil szomjas volt, és elfogadta az italt.",Phil dühös volt a barátaira.,1
1212,Dorothy macskája terhes volt.,"Nem tudta, hogy történt.","Meggyőzte a családot, hogy tartsák meg a cicait.",Végül 7 kölyök született.,Dorothy sok macskakaját vett.,Dorothy elment az állatboltba és vett egy új hörcsögöt.,1
1213,Jeremy anyja nem helyeselte az életmódját.,"Amikor Jeremy 21 éves volt, úgy döntött, hogy elköltözik.","Talált egy lakást egy közeli államban, új munkával.","Néhány év után rendbe jött, és saját maga finanszírozta az életét.",Jeremy-nek vissza kellett költözni az anyjához.,"Jeremy élvezte, hogy felelősségteljesebb.",2
1214,"Terry rájön, hogy a környéke teljesen el van borítva.","Bárcsak olyan tiszta lenne, mint amikor ő fiatal volt.","Elhatározza, hogy minden este munka után elmegy a dobozokért és a cigarettacsillapítókért.","Végül a szomszédai is így tesznek, és a környéke jobbnak tűnik.",Terry utálta a takarítást.,"Mindenki jobban érezte magát, hogy tisztább volt.",2
1215,Dolgozás után le akartam zuhanyozni.,Hoztam a ruháimat és a törülközőmet a szekrényből.,"Bementem a fürdőbe, és bekapcsoltam a zuhanyzót.",Leöltözöttem.,"Aztán a szomszéd házába mentem, hogy kölcsönkérjek egy kis szappant.",Aztán beléptem a forró zuhanyba.,2
1216,Megkerestem az iskola bejáratát.,"Mivel a bátyám a munkahelyén volt, meg kellett várnom, hogy elvigyen.",Néhány óra múlva türelmetlenül vártam.,Végül még az éjszaka előtt jött.,"Nagyon dühös voltam rá, hogy nem jött korábban értem.","Örültem, hogy korán hazaértem az iskolából.",1
