,input_sentence_1,input_sentence_2,input_sentence_3,input_sentence_4,sentence_quiz1,sentence_quiz2,answer_right_ending
350,Arthur és a barátai együtt lógtak.,Söröztek és beszélgettek.,Hirtelen elfogyott a sör.,Arthur nem akarta elvenni az utolsó.,"Arthur úgyis jól érezte magát, hogy elvitte az utolsó.",Arthur rendelt még egy kört a barátainak.,2
351,"Hester mindig is szerette, hogy egyenesnek néz ki a haja.",Egy nap meghívják egy művészeti galéria megnyitójára.,"Elhatározza, hogy az eseményre egyenesíti a haját.","A barátai dicsérik, hogy milyen jól néz ki.",Hester büszke a megjelenésére.,Hester leborotválta a fejét.,1
352,Jill új kocsit akart venni.,Jill elvitte a régi kocsiját az autókereskedésbe.,Az eladó cserélte Jill régi kocsiját egy új kocsival.,"Miután kifizette az eladót is, Jill megkapta az új autóját.",Jill izgatott volt.,Jill depressziós volt.,1
353,Jaden eléggé feledékeny volt.,"Nem vette észre, hogy már Valentin-nap volt.","Elkapott, ezért elment és vett virágot és csokoládét.",Jaden barátnője jött haza és megtalálta a cukorkát.,Jaden barátnője pofán vágott.,Jaden mentette meg a napot.,2
354,John-nak biciklit kaptak a születésnapjára.,Nem tudott lovagolni.,Egész héten gyakorolt.,A hét végén levette a segítőkerékét.,A bicikli nélkül is jól tudott biciklizni.,"Rájött, hogy a biciklizés nem neki való, és helyette egy kis szundit csinált.",1
355,Quentin még soha életében nem volt hajóban.,Egyik nyáron egy barátja meghívta Quentint a tóparti házába.,"Amíg ott voltak, Quentin és a barátja vitorlázni mentek.",Izgalmas élmény volt.,"Quentin örült, hogy elment.","Quentin megesküdött, hogy soha többé nem fog vitorlázni.",1
356,Egy férfi palacsintát rendelt egy étteremben a pincértől.,Pár perccel később hozott neki egy tányér palacsintát.,"A férfi panaszkodott, hogy a palacsinta túl vastag.",A pincér visszavitte a szakácsnak.,A szakács dicsérte.,"A szakács úgy döntött, hogy újra csinálja a palacsintákat.",2
357,A gyerekeim háziállatot akartak.,"Családként úgy döntöttünk, hogy ez egy nagyszerű ötlet.","Elmentünk a helyi állatmenhelyre, hogy megkeressük az új szőrös barátunkat.","A megérkezéskor találkoztunk egy fekete laborossal, akit automatikusan mindannyian szerettünk.","Úgy döntöttünk, a fekete labor nem jön haza velünk.",Fogadtuk a fekete laborot és hazavittük.,2
358,A kertem virágai elpusztulnak.,Elhervadtak és kiszáradtak a napfénytől.,"A barátom jött, hogy segítsen felmérni, mi a baj a növényekkel.","Rájött, hogy több vízre van szükségük.","Miután több vizet adtam, a növények jobban néznek ki, mint valaha.",Nem öntöztem meg őket.,1
359,Jill videojátékokat játszott a húgával.,"Jill dühös volt, hogy minden meccset veszít.","Jill elvette a játékvezérlőjét, és a tévébe dobta.",A tévé képernyője megrepedt a közepén.,Jill és a húga nem tudtak többet videojátékokat játszani.,Jill egyre jobban játszott videojátékokkal.,1
360,"Elkezdtem megállás nélkül nézni a ""Buffy a vámpírvadász""-ot.","Néhány óra múlva, úgy éreztem, futni akarok.",Sajnos kint sötét volt.,Egy ideig az ajtóban álltam.,Aztán elaludtam a következő reggelig.,"Aztán azt képzeltem, hogy én vagyok Buffy, és elfutottam.",2
361,"12 évesen Drew úgy döntött, hogy bűnöző lesz.","Elhatározta, hogy betörni fog az ajtókat és kirabolni a házakat.","Gyakorolt, hogy szekrényeket rúgjon be, hogy erősödjön.","Az anyja hazajött, és meglátta, hogy minden szekrény ajtaja törve van.",Drew mindig engedelmeskedni akar a törvénynek.,Az anyja nagyon dühös volt.,2
362,"Sokáig, amikor keményre főztem tojást, mindig rosszul jöttek ki.",Az interneten kerestem a megoldást a problémámra.,"Egy weboldal azt javasolta, hogy sütse a tojásait, ahelyett, hogy forralja őket.","Pontosan azt tettem, amit kért.",A sütött tojás remek volt.,"A héját rajta hagytam, és egészben ettem meg őket.",1
363,Egy fiú látott egy negyedest a járdán.,Meghajolt és felvette.,"Ahogy ezt tette, egy köpőgolyó repült a fejének helyén.","Körülnézett, és látta, hogy a főellenségében egy szívószál van.",A fiú hálás volt.,A fiú dühös volt.,2
364,"Hector észreveszi, hogy a fejhallgatója csak az egyik fülén működik.","Új párat akar, hogy zenét hallgasson.","Végre talál egy jó pár fejhallgatót, amit megengedhet magának.","Megveszi őket, és azonnal elkezd zenét hallgatni.","Hector úgy dönt, hogy nem szereti a zenét.","Hector örül, hogy mindkét füle működik.",2
365,Tom el akart menni a New York Giants meccsére.,A jegyek azonban túl drágák voltak.,"Végül olyan jegyet talált, ami az ő árcsoportjába tartozott.",A felső fedélzeten ült.,Amúgy is élvezte a meccset.,Tom szerint ez volt a legjobb hokimetszés valaha.,1
366,Trip imádta a görögdinnye.,Legalább egyet evett naponta.,"Az anyja mindig azt mondta neki, hogy ha megesik egy fa, magokat nyelni fog.",Mindig lenyelte őket.,Trip élvezte a magok ízét.,Trip teljesen abbahagyta a görögdinnye-evést.,1
367,"Angie, az MTurk egyik dolgozója szorgalmasnak tartotta magát.",Egy nap az egyik kedvenc kérelmezője visszautasította a munkáját.,Angie nagyon meglepődött és e-mailt küldött nekik.,"Azt válaszolták, hogy a munkája nem volt elég jó.","Angie úgy döntött, hogy megmondja a kérőnek, hogy utasítsa el a munkáját.",Angie megpróbálta részletesen megbeszélni a kérdést.,2
368,"Donovan megkért Trinát, hogy menjen táncolni vele.","Trina kedvelte Donovat, ezért igent mondott, de nagyon aggódott.","Az iskola után hazament, hogy segítséget kérjen az apjától.","Amikor apja hazajött, elmagyarázta a helyzetet, és apa mosolygott.",Trina apja megvádolta Trinát.,Trina apja tanította táncolni.,2
369,Andy mindig is nagy gyerek kerékpárt akart.,"Amikor hat éves lett, kerékpárt kért a születésnapjára.","Nem tudta, hogyan kell biciklizni.",Andy születésnapján az anyja adta neki egy biciklit.,Andy órákig sírt.,Az apja tanította meg lovagolni.,2
370,Suzy a fagylaltos boltba ment.,Vaníliás milkshake-et rendelt.,"Amikor megpróbálta kifizetni a milkshake-ét, a férfi mosolygott rá.","Azt mondta neki, hogy nyert egy különleges versenyen.","Azt mondta neki, hogy hatvan dollárral tartozik neki.",Ingyen adta neki a milkshake-et.,2
371,Ned és a barátai elmentek a vásárra.,Az utolsó pénzét egy puha cukorkát vásárolni használta.,"Ahogy elment, látott egy kisfiút sírni.",A cukorkát egy patakba dobta.,Szóval Ned adott neki saját cukorkát.,Vett még cukorkát a fiúnak.,1
372,"Sebastian észrevette, hogy meleg és napsütés van.",- Volt egy kis dolga.,Nem volt kedve megcsinálni a házimunkáját.,"Sebastian úgy döntött, hogy a szabadban jobb.","Sebastian abban a napon úgy érezte, hogy bent akar maradni.",Sebastian kiment sétálni.,2
373,Rashid kiváló autós volt.,Egy nap Rashid bátyja elkésett a munkából.,"Rashid felajánlotta, hogy elviszi a bátyját.",Idővel odaérnek.,"A bátyja kiabált vele, és becsapta az ajtót.",A bátyja hálás volt.,2
374,"Ali elment egy gyorsétterembe, és a hitelkártyájával fizetett.","A pénztárosnak nagyon sokáig tartott, hogy visszahozza a kártyáját.",Néhány nappal később Ali szokatlan tranzakciókat talált a kártyáján.,"Felhívta a bankját, aki visszavonta a vádakat.","Azon tűnődött, hogy a pénztáros ellopta-e az adatait.",Megköszönte a gyorséttermi pénztárosnak.,1
375,Egy szép festményt kerestem a nappaliba.,Ezért mentem tegnap is keresni.,"Végre találtam egy gyönyörűt, akit szerettem.",A festmény egy vízesésről szólt.,"Úgy döntöttem, nem veszem meg a festményt, mert nem tetszett.",Megvettem és hazahoztam.,2
376,Én előléptetést akartam.,"Úgy döntöttem, megpróbálok előléptetni.",Egész évben keményen dolgoztam.,"A főnököm észrevette, és egy nap behívott az irodájába.",A főnököm azonnal kirúgott.,"Megkaptam az előléptetést, amit akartam.",2
377,Maggie és a szülei új városba költöztek.,"Maggie ideges volt, mert nem ismerett senkit.","Amint beköltözött, bemutatkozott.",Végül barátokat szerzett.,Maggie szomorú és magányos volt.,Maggie-nek tetszett az új város.,2
378,"Dan hazafelé sétált az iskolából, és meglátta az ablakot.",Egy vonat volt a bolt ablakában.,"Dan annyira szerette volna, ha ez a vonat neki lenne.","Amikor Dan hazaért, az anyja azt mondta neki, hogy van egy meglepetése.",Ő adta Dannek a vonatot.,"Dan anyja azt mondta neki, hogy készüljön fel az iskolába.",1
379,Gina el akarta lopni az anyja házának kulcsát.,"Megvárta, amíg az anyja szundít.",Elvitte anyja táskáját a fürdőszobába.,Csendesen kivette a kulcsot a láncról.,"Gina pedig visszahelyezte a táskát, ahol találta.","Gina elmondta anyjának, hol van a kulcs.",1
380,Volt egy Kentucky-i férfi.,"Egy lányt szeretett, aki Louisiannában élt.","Úgy döntött, hogy költözni kell.","Elköltözik, hogy a szerelmével lehessen.",A férfi Texasba költözött.,A férfi Kentuckyba költözött.,2
381,Tim nem ért el matekot.,"Tudta, hogy ha nem megy át, nyári iskolába kell mennie.",Sokat tanult és extra krediteket kért.,"Az utolsó napján megtudta, hogy elment!",Tim nagyon meg volt elégedve.,Tim nagyon csalódott volt.,1
382,"Mary-Anne magányosnak érezte magát, és úgy döntött, hogy fogad egy macskát.","Elment a helyi humánus társasághoz, hogy elindítsa a folyamatot.","Amíg nézte, az egyik macska miavott.","Mary-Anne megsimogatta a macskát, és első látásra szerelmes lett.","Úgy döntött, hogy nem a megfelelő macska.",Hazavitte a macskát.,2
383,Gyerekkoromban gimnasztikáztam.,Megtanultam a mérleget és mozgásokat csináltam rajta.,"Amikor elfordítottam a gerendát, rosszul landoltam.","Eltörtem a bokám, és nagyon fájt!",Sietve kórházba vittek.,"Felkeltem, és visszamentem a mérleghez.",1
384,Hat kiskutya futott a bejáratomon.,"Nehéz volt eldönteni, melyiket vegyük.",A lányaim mindegyike más-más kiskutyát választott.,"A tulaj azt mondta, kedvezményt kaphatunk két kutyára.",Mindketten vettünk egy kutyát.,Nem szerettük a kutyákat.,1
385,Johnny változást akart a nagyvárosi bostoni életéből.,"Úgy döntött, hogy boldogabb lesz Amerika szívében.","Végre eljött a nap, Johnny Idaho-ba költözött.",Megszökött a nagyvárosi élet elől.,"Johnny elkezdte tervezni, hogy Bostonba költözzön.","Johnny boldog volt, hogy egy kisvárosban van.",2
386,Joan utálta hazatérni karácsonyra.,"Tudta, hogy az anyja a szerelmi életéről fog zaklatni.",Idén hazafelé autóbalesetet szenvedett.,"Az anyja sietett hozzá, hogy gondoskodjon a gyermeke szükségleteiről.","Joan anyja nem beszélt vele, mert nem volt férje.","Joan jól érezte magát, amikor látta az anyja arcát.",2
387,Minden időmet az írással töltöm.,Ennek eredményeként kezdtem magányosnak érezni magam.,"Úgy döntöttem, csatlakozom egy online társkereső közösséghez.","Ahogy csatlakozom, rájövök, hogy nem igazán kedvelem a többieket.",Elkezdtem többet írni.,Sok randiba mentem.,1
388,A lányom is cserkész volt az általános iskolában.,Egy nap egy éjszakai kirándulásra ment.,A feleségem ment kísérőként.,Mindenki egy házikóban maradt New Hampshire-ben egy hétvégére.,A lányom sosem felejtette el a kirándulását.,A feleségemmel vacsoráztunk azon az estén.,1
389,Ma volt egy új klub megnyitója a sarkon.,"Alig vártam, hogy ott legyek.","Ahogy beléptünk a klubba, gyönyörű volt.",Finom kaját rendeltünk és táncoltunk.,"A kibaszóval barátkoztunk, hogy holnap bejussanak a klubba.",A kidobó nem engedett be minket a klubba.,1
390,Tegnap egy új poharat vittem a konyhába.,Meglepetésemre elejtettem.,Az üveg összeomlott.,Fel kellett vennem.,Egy kis darabban megvágtam magam.,"Imádtam, ahogy most nézett ki az üveg.",1
391,Bill családja egy dombon élt.,"Ott sosem esett, vagy viharos volt.",Egy nap egy tornádó ment át a környéken.,"Bill házát eltalálták, és a tető lecsapott.",A biztosító fedezte a tető felújításának költségeit.,"Úgy döntöttek, hogy nem kell nekik, és elköltöztek.",1
392,"Allison úgy döntött, hogy többet akar megtudni a környék történelméről.","Lement a könyvtárba, hogy megnézzen egy könyvet róla.","Bement, és nem értette, hogy vannak a könyvek rendezve.","Talált egy könyvtárost, aki elmagyarázta a Dewey tizedes rendszert.","Ez segített neki kitalálni, melyik autót nem akarja.","Ez segített neki megtalálni, amit akart.",2
393,Sebastian a barátai csapatában akart focizni.,"Beszélt a barátjával, és rájött, hogy gyakorolni kell.",Egész héten otthon gyakorolta a focifogást.,A következő edzésen touchdownt ért el.,Sebastian csalódott volt a teljesítményében.,"Sebastian örült, hogy a gyakorlása kifizetődött.",2
394,"Volt egyszer egy anya, aki kétségbeesetten aludt a babájáért.","Körbevezeti, de mégsem alszik.","Etetett, de mégsem aludt.",Végül eszembe jutott az anyja áloméneklete.,Az anya finoman énekelte a gyermekének a altatót.,Az anya hip-hopot játszott a babájáért.,1
395,Johnny gyerekkorában mindig úszómedencékbe pisilt.,"Azt hitte, felnőttként meg tudja csinálni.",A gyerekeit egy víziparkra vitte.,Aztán bepisilt a medencébe.,Néhány ember észrevette és Johnny bajba került.,Mindenki nagyon boldog volt Johnny viselkedése miatt.,1
396,"Amy nézte a többi gyereket játszani, és bámulta az inhalátort.",Asztmája miatt nem tudott sportolni.,Érezte a művészettanár kezét a vállán.,"A tanára mosolygott és azt mondta Amynek, hogy egy nap nagy művész lesz belőle.",Amy sokkal jobban érezte magát.,Amy szörnyen érezte magát.,1
397,Joe és a barátai ma futballoztak.,Joe ideges volt.,"Ideges volt, hogy nyer-e vagy sem.",Végül a meccs után Joe csapata nyert.,Joe nagyon büszke volt a csapatára.,Joe nagyon csalódott volt a csapatában.,1
398,Marknak egy fontos állásinterjúja volt.,"Felkészült a kérdésekre, amiket feltehetnek.","Úgy tűnt, hogy Mark válaszai megdöbbentették az interjút készítő embert.","Az interjúvezető tájékoztatta Markot, hogy megkapta az állást.",Mark nagyon boldog volt.,Mark dühös volt és kifelé tört.,1
399,Elaine nem volt kedve főzni ma este.,"Ezért Elaine úgy döntött, hogy elmegy valahová enni.","Elaine azonban nem tudta, hogy hol akar enni.","Elaine majdnem egy órán át gondolkodott azon, hogy hová menjen.",Elaine-nek könnyű volt meghozni a döntését.,Elaine-nek nehéz volt meghozni a döntését.,2
400,Sam az álmai főiskolára akart bejutni.,Hosszú ideig töltötte az alkalmazást.,Jó érzéssel töltötte el az akadémiai eredményei miatt.,Ő benyújtotta a kérelmet.,3 hónappal később megkapta a felvételi levelet.,Soha többé nem gondolt rá.,1
401,"Matt úgy döntött, hogy elmegy a bárba két barátjával egy este.",Három üveget ittak egy bárban.,"Még négyre mentek, mindegyikben három üveggel.","Matt túl sokat ivott, és elvesztette a telefonját.",Matt és a barátai hazafelé sétáltak és aludtak.,Mattet nem érdekelte az eltűnt telefon.,1
402,Bindu bulit tervezett a barátaival.,"A házában találkoztak, hogy megbeszéljék, milyen ételt és zsinórot használjanak.",Bindu egyik barátja hozott szamoszát és dohg-ot.,Négy barát zenéltek a partin.,Mindenki jól érezte magát.,Bindu utálja a barátait és a buliját.,1
403,"Tyler felébred, és le kell zuhanyoznia, mielőtt suliba megy.",A kisöccse a zuhanyzóban van.,"Tyler attól tart, hogy lekésse a buszt.",Végre Tyleré a zuhanyzás.,"Tyler süteményeket készített, hogy bemutassa a sütéses képességeit.","Tyler gyorsan lezuhanyozik, és időben eljut a buszmegállóba.",2
404,Thomas nem volt túl figyelemre méltó az utóbbi időben.,"Elment az orvosához, hogy megvizsgálják.","Az orvos azt mondta neki, hogy a koleszterinszintje egy kicsit magas.",Thomas egészségesebben kezdett enni és sétálni.,"Diabéteszben szenvedett, miután nyert 40 fontot.",Az orvos nagyon örült a következő vizsgálatnak.,2
405,"A csengő csörgött, de senki sem volt ott.","Nem volt biztos abban, hogy kinyissa-e az ajtót vagy sem.","Lassan csikorgott nyitott ajtót, és nézett ki.",A bátyja ugrott rá és jól megijesztette.,"Úgy döntött, hogy megnézi a kedvenc komédiás műsorát a Netflixen.",Sikított és elgázolta a bátyját.,2
406,Stephanie almásport akart csinálni.,"Elhatározta, hogy elmegy a farmer piacra, hogy néhány finom almát szedjen.","Ahogy a gyümölcsösben sétált, megbotlott és elesett.",Mindkét csuklóját eltörte.,Stephanie a kezével emelte magát.,"Stephanie nem tudott felkelni, amíg valaki nem találta meg.",2
407,"Roy nem tudta, miért bűzlött annyira a lakása.","A barátai megjegyezték, amikor átmentek.","Mindenki úgy döntött, hogy megkeresi a forrást.","Kiderült, hogy egy régi hal a hűtőben.","Roy úgy döntött, hogy a halat a hűtőben hagyja.","Roy kidobta az öreg halászt, és minden jobb illatú lett.",2
408,Jimmy nagyon szegényen nőtt fel.,"A szülei azonban mindig mindent megtettek azért, hogy gondoskodjanak róla.","Amikor belépett egy jó főiskolára, két állásban dolgoztak, hogy megengedhessék maguknak.","Amikor lediplomázott, meg akarta mutatni az elismerését.",Ezért kifizette a főiskolát.,Jimmy felhívta a szüleit és átkozta őket.,1
409,"Jill meglepődött, amikor egy jóképű fiú meghívta a főiskolai táncra.","Ahogy a szobatársai készülődtek, Jill a hajával kezdett nyüzsgeni.","Jill szobatársai azt mondták, segíthetnek.",Jill befejezte a toga-szerű fehér ruháját.,A társa megérkezett és dicsérte a megjelenését.,Jill és a barátai szórakoztatóan szórakoztak a lányokkal.,1
410,Egy bártulajdonos kivetített egy nagy bannert a bárjának reklámozására.,A szél erős volt és elfújta a zászlót.,A tulajdonos a városon át üldözte a betiltottat.,Egy öreg hölgy hátsó udvarába szállt le.,Az öregasszony nem volt hajlandó visszaadni a zászlót.,"Az öregasszony örült, hogy megtalálta a bundát.",1
411,"Anyámnak van egy olyan receptje a tök-rácsokhoz, amit nagyon szeretek.","Egyszer nekem csinált, mert rossz napom volt.",Megettem a tökrácsot és sokkal jobban éreztem magam.,"A rácsok emlékeztettek arra, hogy anyám törődik velem.",Azután a nap után nem ettem többé tökösdobozt.,"Később tökös süteményeket csináltam, amik anyámra emlékeztettek.",2
412,"Tim úgy döntött, hogy több időt tölt a nagyapjával.","A nagyapja imádta a madárfigyelést, ezért Tim vele nézte.",Megjegyezték a megfigyeléseiket egy jegyzetfüzetben.,Tim hamarosan igazán érdeklődött!,"Tim úgy döntött, hogy már nem érdekli a madarak.","Tim és a nagyapja találtak egy hobbit, amit mindketten élveztek.",2
413,Danny a helyi fagylaltosban dolgozott a nyáron.,"Nagyon izgatott volt, hogy elkezdte az első munkáját.",Az első napján egy kisfiú ledobta a fagyit a földre.,"Danny nem habozott, pontosan tudta, mit kell tennie.",Adott neki még egy adag fagyit.,Nem volt hajlandó még egy kis információt adni.,1
414,"Az iskola harangja megszólalt, amikor az óra kettőt ütött.","Gina soha nem volt boldogabb, hogy egy nap véget ér.","Összepakolta a dolgait, és az ajtónál várta Tamit.",De Tami elment Rita és Mary-vel.,"Gina magányosnak érezte magát, amikor hazajött.",Gina másnap megköszönte Taminak.,1
415,"Laurence és a családja úgy döntött, hogy elköltöznek.",Először összepakolták a bútoraikat.,Aztán mindent összepakoltak.,Az összes holmijukat a furgonba vitték.,Laurence és a családja elment az új otthonukba.,Laurence visszahelyezte a holmijukat a házba.,1
416,Joy a remete rákjának akarta megtalálni a tökéletes kagylót.,"Vehet egyet, de különlegesebb lenne, ha megtalálja.",Egész reggel átkutatta a partot.,"Minden, ami működhetett, elromlott!",Végül is meg kellett vennie egy kagylót.,"Ezért hazavitte az egyiket, és odaadta a rákjának.",1
417,Westin megházasodott!,"Azt akarta, hogy az esküvője tökéletes legyen.",Minden rendben ment az estéig.,Valaki nagyon részeg lett és beleesett a tortaba!,Westin tökéletes szeletet vágott a tortából.,Weston és a felesége kirúgta a részeg embert.,2
418,Joe segített az apjának kiüríteni az erdőt a hátsó udvaron.,Hirtelen hangos zümmögést hallott.,Felkavarta a méhfészket.,"Hatszor megcsípték, mielőtt megszökhetett volna.",Joe nevetett a tapasztalat miatt.,"Joe dühös volt, hogy megsérült.",2
419,Ősz volt.,Todd kertje tele volt levelekkel.,"Úgy döntött, hogy mindet fel kell szednie.","Amint végezte, mindet egy zsákba tett.",Todd kivette a szemétbe.,"Todd kinyitotta a zacskót, és szétszórta a leveleket.",1
420,"Tim arról álmodott, hogy nagyszerű testépítő lesz belőle.","Minden este edzett, hogy elérje a célját.","A kemény munkája kifizetődött, és egy népszerű versenyen szerepelhetett.","Megmutatta a képességeit, több mint 250 fontot emelt.",Tim nagyon eltökélt volt.,Timnek nem volt elég elszántsága.,1
421,Henry az osztályába ment.,Ugyanakkor megpróbálta egy zsebkendővel kitisztítani a telefonját.,Sajnos valaki összefutott vele.,A telefonja leesett a kezéből és a földre esett.,A személy bocsánatot kért Henrytől.,Henry boldog és hálás volt.,1
422,"Tami úgy döntött, hogy részt vesz a röplabda próbákon.","Csak nyolcadikban járt, de tudta, hogy jó.","Keményen játszott, és mindent beleadott.","Nem számított arra, hogy a többi játékos is olyan jó lesz, mint ő.",Tami bekerült a kosárlabda csapatba.,"Minden játékos jó volt, de ő bekerült a csapatba.",2
423,Bob és Jim fociztak a házban egy nap.,"Leverték a vázát, és darabokra tört.","Féltek, hogy az anyjuk dühös lesz rájuk.","Találtak ragasztót, és óvatosan összeragasztották a vázát.","Az anyjuk élvezte az új, törött vázáját.","A ragasztó tartotta össze a vázát, és az anyjuk sosem jött rá.",2
424,Steve nagyon szomorú volt.,Steve barátnője szakított vele.,"Úgy döntött, hogy ír egy dalt neki.",A szívét öntötte a dalba.,"Steve azon tűnődött, hogy vajon valaha is újra együtt lehetnek-e.","Steve egy órányi autóútra ment, hogy drogot vegyen egy sztriptízbárban.",1
425,Gloria virágot akart venni a férjének.,"Gloria megdöbbent, hogy csak fél tucat liliom árát adták.","Gloria úgy döntött, hogy a kertből szed néhány virágot.",Összehozott néhány nárciszt és krizantémát.,Gloria nem sokkal később válást kért.,Gloria férje nagyra értékelte a gesztust.,2
426,Josh minden nap kosárlabdázott.,"A célja az volt, hogy bármit meg tudjon szerezni a pályán.",Egy nap valaki kihívta egy versenyre.,"Aki a legtöbbet lő, az nyer!","John elfutott, és terrorizáltan kiabált.",Ő dobta a legtöbbet és megnyerte a versenyt.,2
427,Lauren mindig is szűk farmerben akart bulizni.,"De neki le kell fogynia, hogy a szűk farmer jól nézzen ki.",Lauren egy kihívást jelentő edzésre indul.,"Végre elég súlyt veszített, hogy szűk farmereket hordjon.",Büszkén viselte őket a következő partin.,Féltékeny volt.,1
428,A középiskolában elmentem Hawaii-ra.,Az egész zenekarunk elment.,9 óra volt a repülőút.,Trópusi paradicsom volt.,"Úgy döntöttem, hogy többet akarok Hawaii-ra menni.",Hawaii nem volt jó hely az utazáshoz.,1
429,"Sonny Texasban élt, és forró nyár volt.",Annyira eleget kapott a forróságból.,"Úgy döntött, hogy megtalálja a módját, hogy lehűljön.",Először nem tudott semmire gondolni.,"Elhatározta, hogy bekapcsolja a fűtőgépét.","Aztán úgy döntött, hogy beleugrik a medencébe.",2
430,Chad hihetetlenül jó énekes volt.,Csak félt énekelni.,"Egy templomi kórusba akart csatlakozni, de azt hitte, hogy a barátai nevetni fognak rajta.",Mert annyira zavarba ejtő a képessége és szenvedélye.,"Chad megvan a bátorsága, hogy megcsinálja a komédiás műsorát.","Nevetés helyett mindenki tapsolt, amikor Chad végre énekelt.",2
431,"Ronaldnak két gyereke volt, egy fiú és egy lány.",Ez több mint elég.,"Nem akarta, hogy két ember legyen őszinte.","Egy nap a felesége elmondta neki, hogy a harmadik gyerekük úton van.","Nagyon boldogtalan volt, de félt elmenni.",A szeme izgatottan ragyogott.,1
432,Múlt szerdán sétáltam egyet.,"Sétálva megbotlottam valamiben, ami megijesztett.","Előttem egy négy láb magas kígyó volt, gyöngyszemű szemekkel.",Kiabáltam és végig a főút felé rohantam.,"Biológus vagyok, kígyókat tanulmányozok.","Az útra mentem, vissza az autómhoz.",2
433,Mary szeretett kávézni minden reggel.,Ma sietett.,Egy kávézóba ment.,"Észrevette, hogy a kávé rossz rendelés, miután elment.",Mary beleütközött egy szavazásba.,Mary vezetett és itta.,2
434,Bill éppen most költözött egy nagyvárosba munka miatt.,"Magányosnak érezte magát, mert nem ismerett senkit a városban.","Egy nap Bill úgy döntött, hogy munka után elmegy néhány munkatárshoz egy italra.",Nagyon jól szórakozott velük.,Bill sok barátot szerzett azon a napon.,Bill dühös volt a munkatársaira.,1
435,Billy orvos akart lenni.,Orvosnak tanult.,"Miután diplomázott, meggondolta magát.","Billy nővér lett, nem orvos.",Soha nem bánta meg a döntését.,"Olyan depressziós volt, hogy alkoholista lett.",1
436,Quintont kilakoltatják a lakásából.,Pénz nélkül élt.,"Egy nap úgy döntött, hogy az utolsó dollárját a lottóra költözteti.","Hihetetlenül, ő nyert 50.000 dollárt!",Quinton depressziós volt.,Quinton olyan boldog volt.,2
