,input_sentence_1,input_sentence_2,input_sentence_3,input_sentence_4,sentence_quiz1,sentence_quiz2,answer_right_ending
698,Jackson mindig is került az alkoholt.,"Tudta, hogy az alkohol egészségre káros, és befolyásolhatja az ítélőképességet.",Egy nap azonban Jackson főnöke meghívta egy bárba sörre.,"Jackson rájött, hogy szereti a sör ízét.","Úgy döntött, hogy kettőt szerez.",E kiköpte a sörét.,1
699,Egy béka éhes volt egy későbbi vacsorára.,Átnézett a tóon és egy legyet látott.,A béka csendesen úszott a légyhez.,"Sajnos a légy látta, hogy jön, és elbújt.",A béka még soha nem volt ilyen tele a gyomrával egész életében.,A béka még mindig éhes volt.,2
700,Oscar sosem takarította fel az ágyát.,Az anyja mindig is ezt akarta.,"Végül úgy döntött, hogy elkezdte ágyat takarítani.",Az anyja büszke volt rá.,Egy desszertet adott neki.,Kiabált vele.,1
701,Egy nap az erdőben sétáltam.,Néhány méterrel arrébb láttam egy vörös kígyót.,Azonnal megálltam.,Lassan hátrafelé kezdtem járni.,Aztán a kígyó felé rohantam.,Megharapott a kígyó.,2
702,"Philnek volt egy kis rohama, amikor először nyert blackjackben.",Hetente többször is elment a kaszinóba.,"A veszteségei sokkal gyorsabban halmozódtak fel, mint a nyereményei.",Egy év alatt teljesen kifogyott a pénzéből.,El volt ragadtatva a szerencsejátékban elnyert nyereményei miatt.,"Úgy döntött, hogy valamit kell tennie a függőségével.",2
703,"Az unokatestvérem megkérdezte, hogy volt-e olyan pont az életemben, ami nehéz volt.",Kinyitottam egy fotókeretet.,A képek a kórházban töltött időmet mutatják.,"Elmagyaráztam neki, hogy korábban leukémiás beteg voltam.","Sírt és megölelt, csodálta a bátorságomat.","Kifelé tört, és azt állította, hogy mindig másról beszélek.",1
704,Matthew anyja a számítógépen dolgozott.,Matthew kiabált.,Matthew-t megütötték.,"Matthew anyja megalázódott, és felhagyott a munkájával.",Matthew anyja befejezte a munkáját a számítógépen.,Matthew anyja a szünet sarkára tette.,2
705,Tine a futócsapatba akart bejutni.,"Remélte, hogy elég gyors lesz.","Egy hónapig, a próbaidőszak előtt, egyedül futott.","Minden reggel korán kelt, hogy kilométereket futogassa.",Tine a legjobb idővel került a csapatba.,"Tine a kanapén ült és bonbont evett ahelyett, hogy kipróbálta volna.",1
706,Gyakran vadásztam.,"Amikor legutóbb hazamentem, éjszaka vadásztam.",Sokáig csendben voltam.,Végre láttam valamit mozogni a sötétben.,"Nem vettem tudomásul, és hazamentem.","Egy szarvas volt, akit sikeresen eltaláltam és lelőttem.",2
707,Jack és Chad lemászott a Grand Canyon falán.,"Jack megállt, hogy lefényképezze, és meghajolt, hogy jó szögben lőhessen.",Jack véletlenül leült egy kaktuszon.,Most már tűk voltak Jack nadrágjában.,"20 percbe telt, hogy eltávolítsuk a tűket és tovább másszunk.",Jack mindenféle kényelmetlenség nélkül tudott mászni.,1
708,"Amy, Lynn és Kim a Lynn háza melletti boltba mentek.","Amíg ott voltak, látták, hogy Lynn belezúgott Jimbe.",A boltban volt a táskás fiú.,Megálltak és beszélgettek vele egy ideig.,Jim randira hívta Lynn-t.,"Lynn azt mondta Jimnek, hogy vonzótalan.",1
709,Riley nem volt túl népszerű az iskolában.,Furcsa ruhákat viselt.,"Egy nap a barátnője azt javasolta, hogy csináljanak egy sminkre.","Riley beleegyezett, hogy átváltozik.","Riley sokkal jobban nézett ki, és jól fogadták.",Riley nem volt többé a barátom.,1
710,Ann terhes.,"Nagyon izgatott volt, hogy megtudta, mert mindig is gyereket akart.",Pár hónappal később elvetélte.,Mélyen megrázta.,Ann-nek összetört a szíve.,"Ann megkönnyebbült, hogy nem terhes.",1
711,Aya modell akart lenni.,"Azt hitte, van esélye, mert vékony és csinos.",Így beiratkozott a város éves modellversenyébe.,"Megdöbbent, amikor megnyerte a versenyt.",Aya nagyon boldog volt a verseny eredményével.,Aya nagyon feldúlt volt a verseny eredményével kapcsolatban.,1
712,Jared egy hétig szárazföldi volt.,Sosem takarította ki a szobáját.,"A szülei azt mondták neki, hogy kaphat pár napot a porszívás miatt.","Körbejárta a házat, és elporolta.",A szülei három napot adtak neki.,A szülei kidobták a házból.,1
713,Anna egy reggel az iskolába sétált.,A főúton a gyalogosok kereszteződésére lépett.,Egy autó hirtelen belerepült és elütötte.,"Anna-t összetörték, és eltörték a lábát.","Anna beperelte őket, de nem kapott semmit, mert nem volt biztosításuk.",Anna elment a klubba és egész éjjel táncolt.,1
714,Dave összegyűjtötte a tengerparti felszerelését.,"Csak azért vett ki egy szabadnapot, hogy a strandon tölthesse.","Amikor kiment, rájött, hogy túl sötét van.",Az ég tele volt fekete viharfelhőkkel.,Dave annyira csalódott volt!,Dave annyira megkönnyebbült!,1
715,Ron és Kim új házat akartak.,"Ron úgy döntött, hogy amennyire csak lehet, túlórázik a munkahelyén.",Néhány év alatt megtakarította a túlórákért fizetett pénzt és sok készpénz volt.,"Kimmel új, nagyobb házat kezdtek vásárolni.",Vettek egy szép házat egy új környéken.,Mindketten sportkocsit vettek a pénzzel.,1
716,"Írtam egy e-könyvet, aminek borítójára volt szüksége.",Több könyvborítót készítettem Photoshopban.,Több emberrel is megosztottam a alkotásaimat.,"Megkértem az embereket, hogy szavazzanak az A vagy a B címlapra.",Nincs számítógépem.,A legtöbb embernek tetszett az A címlap.,2
717,Múlt héten vettünk egy új macskapocstot.,A régi nagyon el volt kopott.,A macskánk nagyon válogatós.,"Ha a pólus nem sziszálból van, el fogja utasítani.",A macska elfogadta a szisálból készült új állványt.,A macska elutasította a szisálból készült új oszlopot.,1
718,Daniel íróként akart beállni.,"Daniel készített egy weboldalt, ahol közzéteheti a cikkét.",A weboldal lassan épült és felkeltette a figyelmet.,Az építés és a gyarapodás túl lassú volt Dániel számára.,Daniel utálta az írást.,Danielnek igazi munkát kellett találnia.,2
719,Jeff kezében volt a kosárlabda.,"Gary a kezét a levegőben lengette, mióta nyitva volt a lövés.",Jeff figyelmen kívül hagyta és a kosár felé rohant.,Két őr közeledett hozzá.,Az őrök ellopták Jeff labdáját.,Gary megköszönte a figyelmet.,1
720,Apa elvitt minket az erdőbe kempingezni.,"Megtanított minket, hogyan kell tűzöt gyújtani a pálcikákkal.","Segített megtanulni, hogyan kell a saját sátrakat.","Elaludtunk, miközben számoltuk a csillagokat az égen.",Soha többé nem fogunk táborozni.,Csodálatos volt a kempingezés.,2
721,A hétvégén a helyi piacra mentem.,"Mivel több darabot is árulnak, átnéztem őket.",Néhány zöldség és gyümölcsleves volt 50%-os kedvezménnyel.,"Elvittem néhány dolgot, és elmentem a pénztárba.",Szerettem jó ajánlatot kapni.,"Úgy döntöttem, hogy a dobólabdámat a pultra dobom.",1
722,"Joey egy nagyszerű cégnél dolgozott, de lecsökkentették a munkaidejét.","A cég azt mondta, hogy el kell engedniük, és kirúgták.",Joey azonnal új munkát keresett.,"Nehéz munkát talált, de a munkáját az egész ház átkutatásával adta.","Joey végül megkapta a hívást egy munkáltatótól, és megkapta az állást.",Joey videojátékokkal töltötte a napokat.,1
723,Joe magányos életet élt.,"Nem volt semmi dolga, csak tévézni.","Egy nap úgy döntött, hogy találkozik valakivel a Craigslist-en.",Új barátokat szerzett.,"Joe rendelt néhány új kábelcsatornát, de még mindig elégedetlen volt.","Sokkal boldogabb volt, most, hogy volt pár társa az életében.",2
724,Amy állandóan nagyon stresszes volt.,"Egy barátja azt javasolta, hogy próbáljon meditálni.","Amy szkeptikus volt, de beleegyezett, hogy megpróbálja.","Elment egy órára, lélegzett és koncentrált.",Másnap meditációt tanított.,Hatalmasan segített a mentális állapotában.,2
725,Nya megpróbált egészséges ételt enni és vigyázni a súlyára.,De egy este nagyon vágyott a kényelmes ételre.,"Úgy döntött, hogy sült csirkét és krumplipürét rendel.","Élvezettel evett zsíros, zsíros ételeket.","Nya úgy döntött, hogy minden nap ugyanazt eszi.","Később megbánta, hogy nem egészséges ételeket evett.",2
726,A szobatársam beteg volt.,"Nem ment dolgozni, nem járt iskolába.",Egész nap aludt.,A nap végére már jobban érezte magát.,"Úgy döntött, a pihenés segít.","Remélte, hogy hamarosan megint megbetegszik.",1
727,"Ted és a barátai a parkba mentek, hogy megmásszanak egy hegyet.",Elkezdték a túrát.,Két óra után elfáradtak és szünetet tartottak.,Befejezték a túrát és a csúcsra értek.,Ted beszállt az autóba és hazament.,"A kilátás nagyszerű volt, és Ted örült, hogy eljöttek.",2
728,Általában nyugodt és meleg van reggelente Floridában.,Tegnap reggel nagyon szél volt.,"A pálmafa levél olyan erősen fújt, hogy megkarmolták az ablakokat.","Bekapcsoltam a tévét, és bekapcsolt egy tornádó figyelmeztetés!",A tornádó két háztömbnyire volt a házunktól!,Kimentem játszani.,1
729,Mostanában a művészetekért vagyok oda.,Karácsonyra kaptam egy rajzolókönyvet.,A könyvben van egy bevásárló listája a szükséges rajzkészletekkel.,"Elmentem a boltba a minap, és vettem, amire szükségem volt.","Úgy döntöttem, nem szeretek rajzolni.",Haza mentem és gyakoroltam a rajzolást.,2
730,"Lisa rájött, hogy nem szereti az üzleti tanulmányokat.","Művészetet akart tanulni, de aggódott, hogy pénzt kereshet.","Egy nap végre volt bátorsága, hogy otthagyja az iskolát.","A barátai és a családja azt mondta neki, hogy őrültség lenne elhagyni az iskolát.","Lisa még mindig bízott abban, hogy a választása boldoggá teszi.",Lisa diplomája az üzleti szakon.,1
731,Mary késő este akart moziba menni.,"Sajnos iskolába járt, és szigorú szülei voltak.","Megvárta, amíg mindenki elaludt, és kisurrant.","A barátnőivel nézte a filmet, és nagyon jól érezték magukat.","Amikor a szülei elkapták, büntetést kapott.",Mary barátai nagyon csalódottak voltak benne.,1
732,Ivy-t egy nem hagyományos randin hívták meg.,"A szerelme, Peter, megkért, hogy menjen túrázni!",Ivy egyetértett.,Az erdőbe mentek és órákig gyalogoltak.,Utána egy szikláról nézték a naplementét.,"Ivy hazatért, és soha többé nem beszélt Peterrel.",1
733,Egy férfi elment tervezni a világ legmagasabb tornyát.,"Terve szerint kétszer akkora lesz, mint a jelenlegi.","Elvitte a terveket egy fejlesztőnek, hogy építsenek.","A fejlesztő megkérdezte tőle, hogy mennyi magasságra építse a tornyot.",Az Ember nem építész volt.,"Az ember építette a tornyot, és az nagyszerű volt.",2
734,"Lauren és a nővérei Jacksonville-ben vannak, Floridában.","Az utazásuk utolsó napján, együtt akarnak fényképezni.",Lauren és a testvérei egy aranyos kávézó előtt pózolnak.,"A képeket elkészíti, és elküld egy példányt minden testvérnőnek.","Megpillantotta, hogy mennyire hasonlít a húgára.",Szétszakította a képet és kidobta.,1
735,Liz egy 5 éves fiúra vigyázott.,Bújócskázni akart.,"Párszor megtalálta, de aztán eltűnt.","Elkeseredett, ahogy átkutatta a házat.",Liz unatkozott a játékban és szundikált.,"Amikor hallotta, hogy a szekrényből nevet, Liz megkönnyebbült.",2
736,Mark elkésett a munkából.,"Megpróbálta időben elérni, a sebességkorlátozáson túl vezetve.",Egy közlekedési rendőr megállította.,Gyorsasági büntetést kapott.,Mark elkésett a munkából.,Mark korán ment dolgozni.,1
737,Amy mindig is a furulyán akart játszani.,Az első napon a zenekarban ezt mondta a tanárnak.,Egy hétig gyakorolt a furulyáján minden nap.,Szörnyen nehéz volt furulyázni.,Amy nagyon elkötelezett volt.,Amy nem nagyon érdeklődött a furulyáért.,1
738,Bryan gyümölcsöt vásárolt a családjának.,"Átnézett az egész folyosón, de nem tudott döntést hozni a gyümölcsön.","A felesége utálta a szőlőt, a lánya utálta az almát.",Még a fia is válogatós volt a gyümölcsét esve!,Bryan tésztát vett.,"Bryan úgy döntött, hogy banánt vesz.",2
739,Emily elvitte a gyermekét az állatkertbe.,"Sok állatot láttak, köztük oroszlánokat is.",A gyereke nagyon félt az oroszlánoktól.,Elkezdett sikítani és sírni.,Emily gyermeke közelebb sétált az oroszlánokhoz.,"Emily felvette a gyermekét, hogy vigasztalja.",2
740,"Kimnek lehetne egy kiskutya, ha egy kosarat tesz a meccsen.",Egész nap otthon gyakorolt.,Az iskolából hazafelé a csapatával edzett a tornateremben.,Végre eljött a nagy meccs napja.,Kim eltalált egy kosarat és kapott egy kiskutyát.,"Kim dühös volt, amikor a családja kutyával lett.",1
741,Karen softball játékos volt.,A csapatának nem ment valami jól.,Az edzője nagyon inspiráló beszédet mondott nekik.,Mindenki elkezdett gyakorolni és sokkal keményebben dolgozni.,Karen a csapatban fejlődött.,"Karen nem érezte magát motiválva, miután meghallotta a beszédet.",1
742,Kayla nem volt egy társadalmi eseményen közel három évig.,Megszegő szorongás sújtotta.,"Minél tovább tartott, annál nehezebb lett.","A bátyja ideges volt érte, és elvitte egy pszichiáterhez.","Kayla szerint ez volt a legjobb randja, amit valaha is élt.","Kayla elmondta a pszichológusnak, hogy öngyilkos akar lenni, és segítséget kért.",2
743,"Ricky leesett, miközben túrázott az erdőben.",Rettegett!,"Azt hitte, hogy egy mérgező füvesre esett.","Aztán a természetrajzvezetőjét használta, hogy azonosítsa a növényt.","Megkönnyebbült, hogy tévedett.","Ricky teljesen átázott, mert beleesett a tóba.",1
744,A férjem imádja a Blue Belle fagyit.,"Nemrég, Blue Belle-t visszahívták, és abbahagyta a produkciót.","A fiam a Krogernél dolgozik, nemrég találkoztak a Kék Belle-ről.",A Blue Belle fagylalt a múlt héten érkezett a Krogerbe.,A férjem nagyon hálás!,A férjem annyira csalódott!,1
745,Oni még soha nem játszott közönség előtt.,"De a tehetségkutatáson abban reménykedett, hogy megnyeri a fődíjat.","Azt hitte, hogy csak a legjobbját adja.",Oni énekelt a show-ban és mindenki tapsolt.,Oni a tehetségkutatást nyerte a fantasztikus énekével.,"A tehetségkutató azt mondta Oni-nak, hogy soha ne jöjjön vissza.",1
746,Ralph utálja a bevásárlást.,Az anyja kényszeríti.,Már régóta ott vannak.,Ralph segít az anyjának a bevásárlással.,"Ralph anyja megbünteti, amiért nem hajlandó segíteni.","Meglepődik, amikor az anyja pénzt ad neki a segítségért.",2
747,Kayla kölcsönvett egy könyvet a húgától.,"Elvitte a könyvet egy kávézóba, hogy elolvassa.",Kayla véletlenül kiöntött egy kis vaníliás tejet a könyvre.,"Azonnal hazament, hogy értesítse a húgát.",Kayla egyetlen gyerek volt.,A húga őrült volt!,2
748,Lenny mozizni akart.,A helyi Hollywood videóhoz ment.,Lenny három horrorfilmet bérelt.,Lenny a szomszédba ment és vett egy pizzát a boltból.,Haza ment és megállás nélkül nézte az összes filmet.,"Amikor hazaért, készen állt, hogy visszaadja a három filmet.",1
749,Laura mesélt egy sztorit a 60-as években égett melltartókról.,"A tömeg megőrült, miután megtudta ezt a személyes információt.","Laura biztosította a tömeget, hogy ez már régen volt.",Ő jelentkezett az elnökségért.,Laura-t az ország vád alá helyezte.,Laura-t aztán az ország választotta meg.,2
750,Charlie rendőrtiszt akart lenni Hawaii-n.,"Átment a vizsgáján, és Honoluluban vették fel.",Charlie szerette a közösséggel való kapcsolatot.,Charlie nem szerette a korrupciót a rendőrségben.,Charlie megvesztegetést kapott.,"Charlie megesküdött, hogy megváltoztatja a dolgokat, ha valaha főnökévé válnak.",2
751,"Volt két kutyám, akik nagyon közel álltak egymáshoz.",Az idősebb kutya nagyon megbetegedett és elágyalták.,A fiatalabb kutya nagyon magányos volt.,A szomszéd kutya jött át játszani.,"A kutyánk nagyon élvezi, hogy egyedül van a házban.","A kutyánk sokkal jobban érzi magát, ha egy másik kutyával játszik.",2
752,"Sean szobatársai észrevették, hogy a ruhái és az ágy büdösek.","Azt mondják, hogy hamarosan meg kell mosnia a ruháit.","Sean először tiltakozik, de végül megtisztítja a ruháit.","A szobatársai hálásak, hogy Sean nem szagol olyan rosszul.","Sean szobatársai nagyon mérgesek voltak, hogy nem hallgatott.","Azt mondják, soha többé ne várjon ilyen sokáig a mosáson.",2
753,"A barátnőm orvos akar lenni, ezért elment az MCAT-re.","Amikor először vett rá, nem kapott elég jó pontszámot.",Nagyon keményen tanult és újra elvitte.,Ezúttal nagyon jól csinálta!,"Soha többé nem beszélt róla, és nem lett orvos.","Elvittük egy italra, hogy megünnepeljük.",2
754,Kelly lement az óceánhoz pihenni.,"Azonnal elment, és tette a lábát.","De ahogy a lábát a vízbe tette, a hullám elkapta.",A ruhái áztatták.,"Kelly hazament, hogy átöltözzön száraz ruhába.","Kelly nagyon boldog volt, hogy nedves ruhái vannak.",1
755,"Ben izgatott volt, hogy először megy halászni a nagyapjával.",De a férgek horogra való felállítása undorító volt.,Véletlenül az egyik kampóval is megcsípte az ujját.,"Ben hamar rájött, hogy a horgászat nem neki való.","Ben megkérdezte a nagyapját, mikor mehetnek horgászni.","Ben megkérdezte a nagyapját, hogy nézzenek-e inkább filmet.",2
756,Amelia egy szép olasz étteremben készülődött egy randira.,Amelia barátja egy héttel azelőtt összehozta a vak randiját.,"Korán érkezett az étterembe, és várta a randit.","Harminc perc telt el, és a társa nem jött el.",Amelia hazatért.,Amelia nagyon boldog volt.,1
757,Az anyja nagyon akarta a fiút a Télapóval lefotózni.,A fiú megijedt és visszautasította.,"Az anya azt mondta a fiúnak, hogy a Mikulás az, aki ajándékokat hoz.",Ez meggondolta a fiút.,A fiú sok ajándékot akart kapni a Mikulástól!,"A fiú elment anélkül, hogy lefényképezték volna.",1
758,Stewart megpróbálta befejezni a kedvenc feladatát lefekvés előtt.,"Annyira bele volt foglalva, hogy elfelejtette, hogy égjen a tűz.","Reszketve, egy csomó takarót húzott magára.",Nagyon meleg és elégedett lett.,"Amikor felébredt, hideg volt.","Stewart örült, hogy nem felejtette el a tüzet égni tartani.",1
759,Anthony meg akarta tanulni spanyolul beszélni.,"Talált egy online spanyol tanfolyamot, és beiratkozott.","Anthony keményen tanult, és végül megtanulta a nyelvet.",Anthony most folyékonyan beszél spanyolul.,Anthony a nyelvi képességei miatt lett sikeres.,Anthony nem tudta rendesen letenni a nyelvet.,1
760,Amy elment a boltba munka után.,Volt egy rövid listája a vásárolandó tárgyakról.,A boltnak elfogyott a cuccainak a fele.,Amy-nek egy másik boltba kellett mennie.,Két szoknyát és egy blúzst vett.,"Ezután haza tudott menni, és főzni egy jó ételt.",2
761,"Joanie készen állt, hogy lehúzza a haját egy randi miatt.","Nagyon feldúlt, hogy eltűnt a szárítója.","Aztán Joanie hallott egy ismerős hangot, ami kívülről jött.","Látta, hogy a bátyja a szárítót használja.",Joanie elégedett volt a bátyjával.,"Joanie kifutott, hogy szembenézzen a bátyjával.",2
762,"Cornelia úgy dönt, hogy át akarja rendezni a lakását.",Az ágyja sok éven át állt a fal mellett.,Cornelia az ablak mellé helyezi az ágyát.,"Amikor a barátai meglátták az új szerkesztését, imádták.",Cornelia aztán visszahelyezte az ágyát a helyére.,Hamarosan minden barátnője ugyanúgy rendezte el az ágyát.,2
763,Tim imádta a motorját.,"Mindig lovagolt rajta, amikor csak lehetett.","Múlt héten, amikor elcseszett.",Most már szinte soha nem lovagol rajta.,"Tim biztonságban érzi magát, amikor a motorjával jár.",Tim fél a motorral.,2
764,Wendy első munkáját egy ápolónő otthonában végzett.,Nagyon szerette a munkáját és kapcsolatot ápolt a rezidensekkel.,"Nagyon élvezte, hogy egy kis öregasszonnyal beszélhetett.",Egy nap a hölgy megmutatta a gyerekeinek a képét.,Wendy sírva szaladt ki a szobából.,Wendy élvezte a képeket.,2
765,Tom és Jake elmentek egy koncertre.,"Egy zenekarhoz mentek, amit imádnak.",A főfelvételi területre mentek.,"Néhány nagyon magas ember állt, így nem láttak semmit.",Tom és Jake nem látta a kedvenc bandáját.,Tom és Jake élvezte a szép kilátást.,1
766,"Lester büszke volt arra, hogy évekig nem volt mobiltelefonja.","Szerette azt hinni, hogy kevésbé függ a technológiától, mint mások.","Egy nap azonban az autójának kiégett a gumiabroncsa, és azt kívánta, bárcsak lenne telefonja.","Nem akarta, hogy újra ilyen élményben részesüljön.",Lester tovább élt mobiltelefon nélkül.,"Lester elment és vett a legjobb mobiltelefont, amit megengedhetett magának.",2
767,Bennek olajat kellett cserélni a kocsijában.,"Tudta, hogy elég drágák.",Aztán látott egy kuponot az újságban.,Ben kivágta és a garázsba vitte.,Ben meg tudta változtatni az olaját.,Ben eladta a veséjét a crackért.,1
768,"Ébren voltam, és éhes voltam.","Beöntöttem egy tál gabonapelyhet, de nem találtam tejben.","Miután elgondolkodtam a víz használatán, elhatároztam, hogy elmegyek a boltba.",Elmentem a sarokba és vettem egy fél gallon 2%-ot.,Hazajöttem és zabpelyhet ettem.,Hazajöttem és pizzát ettem.,1
769,Annának volt egy sósvízi akváriuma.,Csak korallot tartott benne.,"Aztán úgy döntött, hogy ő is szeretne egy kis halat.",Vett néhány kis bohóchalat és lövedékeket.,Anna hamarosan visszavitte a halat a boltba.,Most Annának van egy hal- és koralltartály.,2
770,"Holly egy gyönyörű fekete macska volt, akit Lee nagyon szerett.","Szomorúan, Holy nagyon beteg lett és Lee-nek le kellett feküdtetnie.","Lee nagyon szomorú volt, hogy Holly hiányzott minden nap.","Egy nap, nem sokkal azután, hogy egy kis fekete cica megjelent Lee hátsó ajtaján.","Lee úgy döntött, hogy örökbe fogad egy kiskutyát.","Lee úgy döntött, hogy örökbe fogadja a macskát.",2
771,Bobnak új zokni kellett.,"Elment a helyi áruházba, hogy megvegye őket.",Nagy árverés volt a boltban.,Rengeteg jó cuccot vásárolt.,Bob nagyon élvezte a bevásárlókutatást.,Bob másnap mindent visszaadott.,1
772,Reggie imádott focizni és focizni.,A kedvenc játékosának Jamal Lewisnak volt a hátsó futása.,"A Salt Lake-i repülőtéren volt a családjával, és látta a hősét.","Elment hozzá, és azt mondta, hogy ő is profi focizni fog.","Jamal Lewis személyes tanácsot adott neki, és a legjobbat kívánta neki.","Reggie azt mondta, tartson távol tőle.",1
773,Ella talált egy apró vörösborost a földön.,"Tudta, hogy a fészkéből esett le.",Óvatosan csomagolta és biztonságos otthonává tette.,Aztán a kezével táplálta féregekkel.,Szerette a vörösbőrűt.,De már nem akarta a vörösbelatot.,1
774,"Elhatároztam, hogy felmondok a munkámban.",Írtam a lemondó levelemet.,"Csendben elmentem az irodába, és átadtam.",- Elmondtam a munkámat.,"Most már szabad vagyok, hogy olyan karrieret folytathassak, ami boldoggá tesz.",Holnap visszamegyek dolgozni.,1
775,A fekete műanyag rózsát vízbe tettem.,Pár hétig a könyvespolcom tetején hagytam.,Tíz ember kérdezett róla.,"Tudni akarták, miért van egy öntözött, hamis virágom.","Őszintén szólva, én sem tudtam, miért.",Néhány hét múlva a virág elpusztult.,1
776,"Ben úgy döntött, hogy meghívja magát egy kávéra.",A bankkártyájával fizetett a kávéért.,"Később a bank felhívta, hogy túlzottan nagy a számlája.","Elmagyarázták, hogy harminc dolláros díjat kell fizetnie.",Ben frusztrált a plusz díj miatt.,"Ben boldog volt, miután megkapta a telefont a bankból.",1
777,Chris a héten másodszor állt meg.,"A repülőtéren sétálva úgy döntött, hogy kihasználja ezt az időt.","Telepített egy alkalmazást a telefonjára, és elkezdte gyakorolni a franciáit.",Egy másik repülőtér-tulajdonos meghallotta és felajánlotta a segítségét.,A patron segített Chrisnek megtanulni az alapvető francia nyelvet.,"A patron nem értette Chris-t, mert csak kínaiul beszélt.",1
778,Gyerekkoromban kezdték el használni a Google-t.,"Emlékszem, apámat kérdeztem, hogyan használjam a weboldalt.","Megmutatta, hogyan kell betűzni és keresni, amit csak akarok.","Elbűvölő lettem, és minden nap az asztalomnál szórakoztam.",Sokat tanultam a Google-tól.,Nagyon gyorsan dühös leszek rá.,1
779,"Jeff-et előléptették, és ő is el kellett mennie a meghallgatásra.","Haza ment és nagyon keményen tanult, és megjegyezte a válaszokat.","Sok napig készülődött, míg felkészült az interjúra.","Elment az interjúra, és kitűnően ment át!","Örült, amikor előléptették.","Rájött, hogy fel kell mondania a munkáját.",1
780,"Ritz egy nagy, 12 másik kiskutyával teli targoncban született.","Amikor 8 hetes volt, egy kedves családnak adták.","Jól neveltek, és boldog életet élt.","Ritz életében egy nap megváltozott a helyzet, amikor a tulaja rákos lett.","Ritz árva lett, és menedékbe kellett mennie.",A tulajdonosja naponta 20 km-t futott.,1
781,Mia szerette a szabadban lenni.,"Egy nyáron elhatározta, hogy hegymászni megy.","Csatlakozott egy olyan klubhoz, ahol a hegyekre másztak.",Felmásztak a legmagasabb hegyre a környékén.,Mia jól érezte magát.,"Mia azt kívánta, bárcsak bent lehetne.",1
