,input_sentence_1,input_sentence_2,input_sentence_3,input_sentence_4,sentence_quiz1,sentence_quiz2,answer_right_ending
1171,Ben si è svegliato tardi.,Ben ha deciso di saltare la colazione e di andare a lavorare.,Il lavoro era troppo impegnativo per fare una pausa o pranzare.,"Dopo il lavoro, Ben e' stato beccato in un brutto traffico.",Ben era così affamato che si ammalò.,Ben è riuscito a tornare a casa in fretta.,1
1172,Darren era in ritardo al lavoro e non riusciva a trovare le chiavi della macchina.,Ha guardato in tutta la casa.,Chiese a sua moglie dove fossero.,Gli ha detto di controllare le tasche.,Darren ha spento il computer.,Non aveva le chiavi nelle tasche.,2
1173,Ho avuto un colloquio di lavoro la settimana scorsa.,La mia ragazza mi ha aiutato a scegliere una nuova cravatta.,Siamo andati al negozio e abbiamo cercato per ore.,Ne ho trovate tre che mi piacciono.,Ho comprato un papillon.,Li ho comprati tutti.,2
1174,Harry amava l'hockey.,Ha deciso di iscriversi per giocare in un campionato locale.,Harry ha partecipato alle selezioni per la squadra.,Harry sperava di aver fatto abbastanza bene da far parte della squadra.,Harry ha lasciato la sua squadra di hockey.,"Qualche giorno dopo, Harry ha saputo che era entrato nella squadra.",2
1175,La piccola Sue stava cavalcando un elefante allo zoo.,"All'inizio le piaceva, ma poi si è spaventata.",Ha iniziato a piangere per la madre.,Il custode dello zoo ha dovuto fermare l'elefante e prenderla.,La mamma di Sue l'ha portata a accarezzare la capra.,Sue continuò a cavalcare l'elefante.,1
1176,Hannah era un'artista straordinaria.,Ha sempre avuto un dono naturale.,Ha deciso di partecipare a un concorso d'arte.,Per fortuna è riuscita a vincere il primo premio.,I suoi genitori insistevano che la nonna facesse la maggior parte dei lavori di cucito.,I suoi genitori erano molto orgogliosi.,2
1177,Jim stava portando fuori la spazzatura.,È scivolato su un pezzo di ghiaccio sul marciapiede.,Jim cadde con forza sul marciapiede.,Jim ha sentito qualcosa che si era rotto sul braccio.,Jim ha deciso di fare un handstand.,Jim era ferito e ha dovuto chiamare il 911.,2
1178,Odio fare il bucato.,Mettere calzini a coppia e' una terribile perdita di tempo.,Ogni volta che lavo i calzini si perdono.,Ero stanco di cercare calzini uguali.,Facendo il bucato mi sento rilassata.,Ho buttato via tutti i miei vecchi calzini e ho comprato solo calzini bianchi.,2
1179,James aveva dodici anni e amava il cibo.,Non ha mai pensato di cucinare fino ad oggi.,Sua madre gli ha permesso di aiutare a preparare il riso per cena.,James ha imparato quanto sia divertente e creativo cucinare.,James ha deciso di diventare uno chef quando sarà grande.,James non ha mai piu' cucinato.,1
1180,Lee sapeva che sua madre aveva bisogno di nuovi guanti e non poteva permetterselo.,Così Lee cominciò a fare un paio.,Si affrettò a finirle per Natale.,Poi le ha presentate alla madre.,La mamma di Lee era orgogliosa di sua figlia per essere stata cosi' premurosa.,La mamma di Lee gli ha lanciato i guanti e ha lasciato la stanza.,1
1181,Jennifer era una copywriter professionista in una grande città.,Ha fatto un buon lavoro ma ha sempre ricevuto commenti scadenti sulle sue recensioni.,Jennifer ha scoperto che il suo capo stava cercando di sabotarla!,Decise di affrontare il suo capo per le osservazioni negative.,Jennifer ha ringraziato il suo capo per la sua imparzialità.,Jennifer e' entrata nel suo ufficio e ha messo in ordine il suo capo.,2
1182,Lorraine era una giocatrice di softball.,Era la migliore della sua squadra.,"Un giorno, durante una partita, si torse gravemente la caviglia.",Non era piu' in grado di suonare.,Lorraine era entusiasta!,Lorraine era davvero triste.,2
1183,Abby e Tammy erano le migliori amiche.,Entrambi amavano fare cose insieme divertenti e creative.,Decise di fare insieme braccialetti d'amicizia e di darli agli altri.,Abby ne ha fatti cinque e Tammy ne ha fatti altri sette.,Tammy non ha mai piu' parlato con Abby.,Hanno deciso di tenere i braccialetti per loro.,2
1184,Ieri sera c'è stata una grande tempesta di fulmini.,Ha tagliato la corrente.,L'intero quartiere non aveva elettricità.,Fava molto freddo e avevamo paura.,Dovremo spalare la neve.,"Poi dopo circa un'ora, la corrente e' tornata.",2
1185,Sal era arrabbiato perche' i suoi genitori si stavano trasferendo.,Si stavano trasferendo all'ottavo piano di un edificio.,Odiava vivere così in alto.,"Dopo essersi trasferito, ha dato un'occhiata dalla finestra della sua camera da letto.",Sal ha buttato il cuscino dalla finestra.,La bella vista lo fece cambiare idea.,2
1186,Lydia ha fatto uno strano sogno la scorsa notte.,Ha sognato di fare un esame a scuola.,"Mentre faceva il test, si è accorta di aver dimenticato di indossare i pantaloni!",Era così imbarazzata che è scappata fuori dalla classe.,Lydia ha desiderato che il sogno fosse reale.,Lydia si sentì sollevata quando si rese conto che era solo un sogno.,2
1187,Alex aveva bisogno di fare la spesa.,Ha fatto una lista di cose da comprare.,Ha raccolto i suoi sacchi di tela riutilizzabili.,Lei andò al negozio.,Alex ha comprato uno yacht.,Ha comprato la spesa.,2
1188,Yolanda odia le montagne russe.,Katie non capisce perché.,Decise di costringere Yolanda a farne uno con lei.,Yolanda ha vomitato su Katie.,Katie era la persona più felice che avesse mai vissuto.,Katie si e' pentita di aver costretto Yolanda a fare il giro.,2
1189,Una cosa che Tina voleva fare a New York era andare in un chiosco di hot dog.,Alla fine ha visto un banco Nathan e ne ha ordinato uno tradizionale.,Il cibo era fantastico.,"E' stato costoso, ma ne e' valsa la pena.",Era triste per l'hot dog.,Era felice con l'hot dog.,2
1190,A Tammy piace l'uncinetto.,Il Natale era tra qualche settimana e lei non aveva davvero soldi.,Le venne l'idea di prendere il filo di scorta che aveva per fare una coperta.,Poi l'ha avvolto per sua nipote Lorelei.,Tammy era triste di non avere un regalo da dare.,Lorelei ha tenuto quella coperta per anni.,2
1191,Melinda voleva andare a vedere un film dell'orrore.,Voleva andare da sola per dimostrare di essere coraggiosa.,Melinda è andata al cinema e ha comprato un biglietto.,Melinda era molto spaventata mentre guardava il film.,Melinda pensava che il film fosse divertente.,Melinda avrebbe voluto portare qualcuno.,2
1192,Lamar scopre che avrà degli ospiti inaspettati un pomeriggio.,Non ha cibo a casa da dare ai suoi ospiti.,Decide invece di preparare una teiera per loro.,I suoi ospiti gustano tutti il tè che lui prepara.,Lamar ha dato loro del tè da portare a casa.,Lamar e' andato a piedi al parco.,1
1193,Mia nipote ha fatto domanda per un lavoro all'RMV due anni fa.,Ha ottenuto il lavoro ed era entusiasta.,"Le dissero che le serviva una patente di guida, che non aveva.",Mostrò al suo datore di lavoro una nota del medico che diceva che non poteva guidare.,Hanno deciso che andava bene farla lavorare come segretaria.,Aveva un record di guida perfetto.,1
1194,A Lela e' stato diagnosticato un cancro cinque anni fa.,Ogni giorno è stata una lotta.,Andava quasi ogni giorno dai medici e per le cure.,Lela ha iniziato a stare meglio negli ultimi mesi.,Lela poi finì il trattamento e si sentì meglio.,Lela poi si riprese dall'influenza.,1
1195,Fred era un nuovo studente in classe.,Era davvero imbarazzato e ha passato un brutto periodo.,Nessuno sembrava voler essere suo amico.,"Più tardi, a pranzo, qualcuno mangiò con lui.",Fred era popolare.,Fred parlò con il suo compagno di pranzo e si fece degli amici.,2
1196,Joyce fu adottata dalla madre adottiva quando aveva 5 anni.,"Dopo l'adozione, sua madre ha adottato altri 3 bambini.",Joyce adorava essere una sorella maggiore e aiutava molto sua madre.,"Quando si e' trasferita da sola, e' diventata anche una madre adottiva.",Joyce ha abbandonato i suoi figli poco dopo.,Joyce amava i suoi figli altrettanto.,2
1197,Horatio aveva sempre avuto paura di mangiare un'ostrica cruda.,"La sua ragazza gli ha detto che era delizioso, ma era nervoso.",Alla fine lo portò in vacanza a Cape Cod per assaggiare ostriche fresche.,Horatio ha preso il suo primo morso di ostrica cruda e l'ha adorato.,Ha deciso di non mangiare più.,Ne ha mangiati altri dieci.,2
1198,A Tom piaceva allevare il bestiame.,Lo faceva ogni giorno.,Un giorno una mucca si liberò.,Ha cercato dappertutto.,"Ha notato la mucca nel campo di un vicino, l'ha ignorata e se n'è andato.",Ha trovato la mucca e l'ha riportata.,2
1199,Alyssa ha preso un caffe' mentre andava al lavoro.,Ha bevuto il caffè mentre guidava.,"Improvvisamente, dovette fermare rapidamente la sua macchina.","Il caffè le si è versato in tutto il ginocchio, scottandole le gambe.",Ha riso mentre continuava a guidare per andare al lavoro.,Ha quasi avuto un incidente mentre urlava di dolore.,2
1200,John stava guidando lungo l'autostrada.,Una Mustang si è accosta accanto a lui e ha mantenuto la velocità.,Guidava la sua nuova Camaro.,Hanno deciso di correre.,John ha vinto la gara.,John si e' fermato per comprare una Mustang.,1
1201,Ben voleva vincere il concorso di costumi al lavoro quest'anno.,Ha passato molte ore a fare il suo costume da zero.,"Per aggiungere al suo costume, ha applicato un sacco di trucco da palcoscenico.","Al lavoro, tutti erano impressionati dal suo aspetto.",Ben era contento.,Ben si e' ritirato dal concorso di costume.,1
1202,Mia madre ha chiesto se poteva prendere in prestito 100 dollari da me.,"Considerando che è al verde, le ho prestato la mia carta di credito.","Il giorno dopo, la mia carta di credito fu rifiutata quando cercai di comprare del cibo.",La compagnia mi ha detto che ho fatto un acquisto da 320 dollari.,Ho detto a mia madre di continuare a usare la mia carta di credito.,Ero arrabbiato con mia madre per avermi fatto pagare la carta di credito.,2
1203,Kelly ha sempre avuto i capelli più secchi.,Non aveva idea di cosa fare.,Alla fine andò dal dottore.,Le ha prescritto delle pillole.,Kelly finalmente aveva i capelli che non erano asciutti.,Kelly adora le patatine.,1
1204,Sarah aveva paura di stare in compagnia di altri.,Ha deciso di forzarsi ad andare a una festa.,"Alla festa, lei è diventata vertiginosa e nervosa.",Sarah ha deciso che era abbastanza e e' andata da un terapista.,Il terapeuta le ha insegnato come affrontare il suo problema.,Il terapeuta le ha detto che era strana.,1
1205,Ellen era all'ufficio del suo medico.,Stava per scoprire il sesso del suo bambino.,Sperava davvero in un maschio!,Ha trattenuto il respiro mentre il dottore le faceva la scansione della pancia.,Ellen fu delusa quando scoprì che avrebbe avuto un maschio.,Il suo medico ha confermato che era un maschio!,2
1206,Zoey era presa in giro dai suoi amici per avere un nome strano.,Le piaceva il suo nome e desiderava che la gente non fosse cosi' cattiva.,E' stato fatto un nuovo show con una protagonista di nome Zoey.,Il nome di Zoey e' diventato improvvisamente figo per i suoi compagni.,Zoey era felice che a tutti piacesse il suo nome.,Zoey ha cambiato nome quando ha compiuto 18 anni.,1
1207,Miranda ha appena preso la patente.,Ha fatto un giro con il furgone di famiglia.,Ha guidato per molto tempo.,Ma poi si e' resa conto di essere persa.,Miranda ha ripreso la strada che aveva preso per ripercorrere i suoi passi.,Miranda era felice del suo momento di orgoglio.,1
1208,Bob è andato dal medico.,Il medico gli disse che era sovrappeso.,Bob si rese conto che doveva mettersi in forma.,Si e' iscritto ad una palestra e ha cominciato a stare attento a quello che mangiava.,Bob ha messo su 50 chili.,Bob si è messo in forma.,2
1209,Lonnie stava cercando di capire quali specializzazioni prendere all'universita'.,Sapeva che il suo obiettivo finale era quello di diventare un insegnante.,Chiese consiglio al consulente di carriera.,Il consulente gli ha dato una lista di requisiti.,Lonnie ha finalmente deciso di studiare.,Lonnie ha buttato via la lista.,1
1210,A Sherry piaceva esplorare l'aria aperta.,Ha deciso di fare una passeggiata nel parco di stato in una giornata di sole.,Mentre camminava lungo un ruscello vide qualcosa di luccicante.,Si chinò e prese l'oggetto luccicante.,Era un quarto di dollaro.,Lei ha preso un coltello ricoperto di ruggine.,1
1211,Phil e' andato a fare una passeggiata nel parco.,Era una giornata calda e ventosa.,Ha incontrato alcuni amici durante la sua passeggiata.,Uno di loro gli ha offerto da bere.,Phil aveva sete e ha accettato di bere.,Phil era arrabbiato con i suoi amici.,1
1212,La gatta di Dorothy era incinta.,Non sapeva come fosse successo.,Ha convinto la famiglia a tenere i gattini.,Alla fine ha avuto 7 gattini.,Dorothy si è assicurata di comprare un sacco di cibo per gatti.,Dorothy andò al negozio di animali e comprò un nuovo criceto.,1
1213,La madre di Jeremy non approvava il suo stile di vita.,"A 21 anni, Jeremy decise di andarsene.",Ha trovato un appartamento in uno stato vicino con un nuovo lavoro.,"Dopo parecchi anni si è ripulito, e ha finanziato la sua vita.",Jeremy ha dovuto tornare a vivere con sua madre.,A Jeremy piaceva essere piu' responsabile.,2
1214,Terry si rende conto che il suo quartiere è coperto di spazzatura.,Vorrebbe che fosse pulito come quando era giovane.,Decide di andare a prendere lattine e mozziconi di sigarette ogni sera dopo il lavoro.,Alla fine anche i suoi vicini lo fanno e il suo quartiere sembra migliore.,Terry odiava pulire.,Tutti si sentivano meglio che fosse più pulito.,2
1215,Volevo fare una doccia dopo il lavoro.,Ho preso i vestiti e l'asciugamano dall'armadio.,Sono entrata in bagno e ho acceso la doccia.,Mi sono spogliata.,Poi sono andato a casa del mio vicino a prendere in prestito del sapone.,Poi mi sono fatta una doccia calda.,2
1216,Mi avvicinai alla porta della mia scuola.,"Dato che mio fratello era al lavoro, ho dovuto aspettare che venisse a prendermi.","Diverse ore dopo, ero in attesa impaziente.",Alla fine è arrivato prima della notte.,Ero molto arrabbiata con lui per non essere venuto a prendermi prima.,Ero felice di essere tornata a casa prima da scuola quel giorno.,1
1217,Barry amava sollevare pesi.,Usava la sua barra speciale solo per sollevare pesi.,Un giorno si dimenticò di portare la sbarra!,Ha deciso di fare cardio invece di sollevare.,Gli piaceva sempre fare un bel pisolino sull'amaca.,Eppure ha finito per fare un ottimo allenamento.,2
1218,Amber ha lavorato molto ultimamente.,La stava stressando molto a causa di altri problemi personali.,Non vedeva l'ora di prendersi un giorno di riposo.,Il giorno libero andava con il fidanzato Rob.,Amber non riusciva a trovare il tempo per rilassarsi.,Si sono rilassati tutto il giorno e Amber si e' sentita molto meglio.,2
1219,Carl si e' arruolato subito dopo il liceo.,Ha firmato un contratto breve che lo ha messo in prima linea.,Il suo migliore amico e' stato ucciso davanti a lui.,La felicità divenne un concetto estraneo a Carl.,Carl e' stato con il suo migliore amico quando sono tornati a casa.,Carl ha dovuto andare in terapia per disturbo da stress post-traumatico.,2
1220,A Eddie piaceva guardare la gente che usava i metal detector sulla spiaggia.,Ha osservato un uomo per un po'.,Era passata piu' di un'ora e l'uomo non aveva ancora trovato nulla.,Eddie ha nascosto una pila di monete nella sabbia.,Purtroppo quell'uomo non trovò nulla quel giorno.,E ho visto l'uomo felice di ricevere un ping.,2
1221,"Quando ho conosciuto Janice, non sapeva come spezzare una noce.",Non potevo credere che fosse arrivata fin qui senza questa abilità.,Le ho offerto di insegnarle molti metodi per rompere le noci.,Lei ha accettato.,Janice ha deciso che non voleva imparare a spaccare le noci.,Janice è ora un'esperta di cracker di noci.,2
1222,Amy e' tornata a casa da sola dall'allenamento di pallavolo.,Ha chiamato la sua amica Kim e le ha detto che era la peggior giocatrice.,Amy si sentiva una perdente solo per averlo detto ad alta voce.,Kim le ha ricordato che era il primo giorno e che avrebbe fatto meglio.,E durante la stagione ha continuato a migliorare.,Amava essere cattiva in pallavolo.,1
1223,Beth stava facendo la doccia quando sentì un forte bussare alla porta.,Non ha voluto rispondere e ha aspettato che fosse finita.,"La volta successiva che fece la doccia, sentì di nuovo il forte bussare.","Ma quando uscì di corsa dalla doccia per rispondere, non c'era nessuno.",Beth ha deciso che stava sentendo delle cose.,Beth era sorda.,1
1224,Joe ha studiato arte.,Si è laureato in pittura.,Non riusciva a trovare un lavoro.,Poi ha risposto a un annuncio sul giornale.,Joe odiava la pizza.,Poi e' stato assunto.,2
1225,Bob ha preso i suoi bicchieri dal tavolo.,Li ha messi nello zaino per portarli a scuola.,Aveva bisogno di loro per vedere il consiglio.,"In scienza, li indossava.",Bob si divertiva a usare il suo binocolo.,Bob fu in grado di leggere la scrittura sulla lavagna.,2
1226,Ero molto nervosa prima del mio primo ballo delle medie.,Sono rimasta sorpresa che la mia cotta avesse detto di si'.,Quando finalmente abbiamo avuto la possibilità di ballare le ho calpestato il piede.,E' finita rotta.,L'ho portata a iHop per pancake e frullati.,Ora non vuole nemmeno parlarmi.,2
1227,Un mio amico uscì una sera in cerca dell'amore.,E' finito per ubriacarsi.,E poi abbiamo capito che stava flirtando con un gay.,"Dopo un po', abbiamo perso la pista del nostro amico.",Il nostro amico e' finito a casa alle tre di notte con una ragazza.,Abbiamo scoperto che il nostro amico era andato a sciare.,1
1228,Benjamin è andato al parco oggi.,"Prima, si e' appeso a testa in giù alle sbarre.","Dopo di che, è andato scivolando giù per la scivolata.",Poi sua madre lo ha spinto sull'altalena e lui e' andato molto in alto.,A Benjamin non piaceva il parco.,Benjamin si e' divertito e poi ha lasciato il parco.,2
1229,Io e Megan tornavamo a casa da scuola vicino a una strada trafficata.,Ho visto passare tre macchine blu in fila.,Abbiamo deciso di contare le macchine blu.,Io e Megan siamo rimasti sul marciapiede tutto il pomeriggio.,"Dopo aver contato le macchine, siamo tornati a casa.",Poi ci siamo seduti e abbiamo iniziato a contare le auto.,1
1230,Kelly ha deciso di fare una festa in casa.,"I suoi genitori stavano andando via, cosi' ha deciso di averne uno.",Ha invitato tutti i suoi amici.,"Quando sono arrivati, si sono divertiti.",Kelly aveva un disturbo neurologico che la costringeva a stare su una sedia a rotelle.,Kelly ha ripulito in tempo e i suoi genitori non l'hanno mai scoperto.,2
1231,James si rende conto un pomeriggio che non ha lasciato casa per tutto il giorno.,Decide di andare a correre nel parco.,Ha fatto una lunga corsa intorno al lago nel suo parco locale.,Quando torna a casa si sente stanco ma soddisfatto.,James decide di non uscire mai più di casa.,James e' contento di aver deciso di candidarsi.,2
1232,Lars si rende conto che si era accumulata molta neve sul suo ponte.,Decide di spalare un po' di neve.,Lars lavora tutto il pomeriggio finché la neve non si è sfollata.,"Quando ha finito, va dentro a fare una doccia.",Si sente soddisfatto.,"Quando esce dalla doccia, spala il suo mazzo.",1
1233,Matt sospettava che sua moglie Ginny avesse una relazione.,Ha iniziato a leggere furtivamente le sue email.,Ha trovato delle email che erano di un altro uomo.,"Leggendola, vide che i suoi sospetti erano giustificati.",Matt ha iniziato a ridere.,Matt era molto arrabbiato.,2
1234,Mike giocava a racchetta con Perry.,Prenotavano un campo un paio di volte a settimana.,Ma una volta Mike colpì Perry per sbaglio nella parte posteriore della testa.,Perry non ne era molto contento.,Mike ha dovuto scusarsi.,Mike e Perry si sono sposati.,1
1235,Sydney doveva fare il bucato.,Ha ordinato i suoi vestiti sporchi per colore.,Ha buttato il primo carico nella lavatrice.,Ha aggiunto il detersivo e l'ammorbiditore.,Ha deciso di andare al cinema.,Continuò a farlo finché non ebbe finito il bucato.,2
1236,Stava arrivando un uragano e abbiamo dovuto evacuare.,Prendemmo tutto ciò di cui avevamo bisogno e ci diressimo verso l'altra sponda dell'isola.,Abbiamo aspettato la tempesta con la famiglia.,"Quando fu finita, abbiamo fatto le valigie e siamo tornati a casa.","Trovammo la nostra casa in piedi, ma in disordine.",Abbiamo deciso di andare a nuotare sulla spiaggia.,1
1237,Tom morse la barretta di Snickers e sentì un dolore pungente.,Un piccolo sassolino in esso gli ha fatto spezzare un dente!,Lui si precipitò dal dentista.,"Poiché era un'emergenza, lo hanno visto subito.",Il dentista gli ha aggiustato il dente.,Tom si è divertito così tanto quel giorno.,1
1238,Rufus si sveglia e si accorge che il suo cappello è sparito.,All'inizio non ricorda dove potrebbe essere.,Alla fine si rende conto di averlo indossato al bar ieri sera.,Rufus torna al bar per prendere il suo cappello.,Rufus è sollevato nel trovare la sua valigetta al bar.,Vede il suo cappello appeso alle corna di alce dietro il bancone.,2
1239,Alexia era entusiasta di avere un nuovo cane.,Voleva un nuovo cane da anni.,Alla fine i suoi genitori accettarono di procurarle uno.,L'hanno portata al kernel per prenderne uno.,Alexia si e' innamorata di un cane peloso al canile.,Alexia ha pianto perche' voleva un gatto.,1
1240,Dan voleva trovare il regalo perfetto per il compleanno di sua madre.,Ha fatto acquisti al centro commerciale per ore e non è stato in grado di trovare nulla.,E' tornato a casa deluso e senza un regalo.,Sua madre vide la sua faccia quando entrò e gli chiese cosa non andava.,Dan ha spiegato la situazione e sua madre non era sconvolta.,Dan urlò contro sua madre per essere schizzinosa.,1
1241,Bill era povero.,Bill aveva un lavoro a salario minimo.,Riusciva a malapena a pagare i conti.,Bill decise di prendere una laurea in informatica.,Bill ha iniziato a guadagnare molto di piu'.,Bill guadagnava meno come informatico di prima.,1
1242,Jane adorava i suoi nuovi tacchi alti.,Voleva sfiorarli.,Li indossava quando ballava al club.,Nel giro di pochi minuti le facevano troppo male i piedi.,Jane ha ballato a piedi nudi e ha lasciato le scarpe nella borsa.,Jane era ansiosa di iniziare la scuola di tap.,1
1243,Jose è un immigrato.,Lui e la sua famiglia sono venuti qui dal Messico.,Jose vuole fare un viaggio per visitare gli altri membri della sua famiglia in Messico.,Pianifica con diligenza e compra gli oggetti necessari per il viaggio.,"Jose, fai il viaggio in Messico.",Jose giura di non andare mai più in Messico.,1
1244,Hannah si sentiva molto rigida e inflessibile.,Decise di iscriversi a un corso di yoga per migliorare la sua flessibilità.,Era pessima nello yoga e per mesi non migliorò.,Ma ha deciso di continuare a provarci.,Hannah si e' fatta piu' rigida col tempo.,"Alla fine, Hannah riuscì.",2
1245,L'insegnante ha annunciato che ci sarebbe stato un quiz.,Gli studenti emissero un gemito collettivo.,Questo e' il secondo quiz in una settimana.,"Mentre l'insegnante iniziava a distribuire i quiz, suonò l'allarme antincendio.",Gli studenti hanno applaudito perché erano liberi.,I ragazzi erano arrabbiati per essere stati fuori.,1
1246,Carla era preoccupata che sua figlia Ann si stesse sforzando troppo.,Aveva visto il tempo libero di sua figlia sparire con i suoi nuovi club.,Tutto e' arrivato a un punto critico quando Ann ha portato a casa un D in un test.,"Ann promise di lavorare sodo, implorando di poter rimanere nel suo club.",Carla ha detto a sua figlia che doveva entrare in piu' club.,La mamma di Ann ha detto che sua figlia poteva scegliere un club se avesse studiato.,2
1247,La famiglia di Gina era in visita alla nonna in Illinois.,"Era il primo giorno, e Gina era l'ultima a svegliarsi.",È andata in cucina a fare colazione.,La famiglia aveva già mangiato la maggior parte del cibo.,Gina era felice del risultato in casa.,Gina era triste e piangeva.,2
1248,James stava per festeggiare il suo compleanno.,Voleva un arco da caccia.,Sua madre è uscita e gli ne ha comprato uno.,Ha dimenticato di chiedere delle frecce per l'arco.,E' andato al negozio di articoli sportivi per comprare proiettili.,Tagliava dei bastoni per farne delle frecce improvvisate.,2
1249,Una ragazza di nome Taylor aveva sempre desiderato un animale domestico.,"Un giorno sua madre le fece una sorpresa, portandola in un negozio di animali.",Entrarono entrambi nel negozio e si guardarono intorno.,Taylor ha avuto difficoltà a decidere quale animale adottare.,Taylor ha finalmente scelto il gattino carino nell'angolo.,Taylor ha deciso invece di andare a comprare vestiti.,1
1250,Zeke stava organizzando una festa di Halloween.,Tutti i suoi amici si stavano travestendo.,Zeke ha pensato di diventare un vampiro o un mago.,Poi ha scelto un costume più spaventoso.,Zeke si travesteva da zucca.,Zeke vestito come uno scheletro.,2
1251,Janet ha sempre voluto fare il cinema.,Finalmente ha ottenuto un ruolo in un grande film.,Doveva debuttare in tutta la nazione la settimana scorsa.,Purtroppo è stato ritardato.,Janet era sollevata.,Janet era delusa.,2
1252,Marge ha implorato il marito Bill per una piscina nel giardino.,Alla fine cedette e la piscina fu installata.,"Presto, Marge organizzava feste settimanali in piscina.","A una festa, ha visto un vicino con le curve in bikini che parlava con Bill.",Marge ha messo una chiave nuova sul portachiavi.,Marge si e' pentita di aver messo la piscina in quel momento.,2
1253,Rosie il cavallo quarto piagnucolato irritabilmente.,Il contadino Jones non aveva ancora portato la sua avena del mattino.,"Sentendosi cattiva, si intrufolava verso il frutteto di mele.","Il contadino Jones non sapeva del punto basso della recinzione, ma Rosie sì!",Rosie ha aspettato pazientemente il contadino Jones.,Rosie si e' liberata per andare al frutteto.,2
