,input_sentence_1,input_sentence_2,input_sentence_3,input_sentence_4,sentence_quiz1,sentence_quiz2,answer_right_ending
752,I compagni di stanza di Sean notano che i suoi vestiti e il suo letto cominciano a puzzare.,Gli dicono che deve pulire il bucato molto presto.,"Sean protesta all'inizio, ma alla fine pulisce la sua biancheria.",I suoi compagni di stanza sono grati che Sean non puzzi piu' cosi' male.,I compagni di stanza di Sean si sono arrabbiati molto perche' non stava ascoltando.,Gli dicono di non aspettare cosi' tanto per fare il bucato.,2
753,"La mia amica vuole diventare un dottore, quindi ha fatto l'esame.","La prima volta che l'ha presa, non ha ottenuto un punteggio abbastanza buono.",Ha studiato molto e l'ha ripresa.,"Stavolta, ha fatto molto bene!","Non ne parlò mai più, e non divenne medico.",L'abbiamo portata fuori a bere qualcosa per festeggiare.,2
754,Kelly e' andata in mare a rilassarsi.,Andò subito a mettere i piedi dentro.,"Mentre metteva i piedi dentro, l'onda la catturò.",I suoi vestiti sono bagnati.,Kelly e' andata a casa a cambiarsi i vestiti asciutti.,Kelly era molto felice di avere vestiti bagnati.,1
755,Ben era entusiasta di andare a pescare con suo nonno per la prima volta.,"Tuttavia, trovò disgustoso mettere i vermi sull'amo.",Si e' accidentalmente pugnalato il dito con uno degli anelli.,Ben si rese presto conto che la pesca non era per lui.,Ben chiese a suo nonno quando potevano andare a pescare.,Ben chiese a suo nonno se potevano guardare un film invece.,2
756,Amelia si stava preparando per un appuntamento in un bel ristorante italiano.,L'amica di Amelia l'aveva organizzata per un appuntamento alla cieca una settimana prima.,E' arrivata al ristorante prima e ha aspettato il suo appuntamento.,Erano passati trenta minuti e il suo appuntamento non si presentò.,Amelia e' tornata a casa.,Amelia era molto felice.,1
757,La madre voleva davvero fare una foto del ragazzo con Babbo Natale.,Il ragazzo era spaventato e si rifiutò.,La madre ha detto al ragazzo che Babbo Natale era responsabile di portare i regali.,Questo cambiò la sua opinione.,Il ragazzo sperava di ricevere molti regali da Babbo Natale!,Il ragazzo se n'è andato senza farsi fare una foto.,1
758,Stewart ha cercato di finire il suo compito preferito prima di andare a letto.,Era cosi' preso da tutto che si e' dimenticato di accendere il fuoco.,"Tremorando, si è avvolto con un mucchio di coperte.",Divenne molto caldo e contento.,"Quando si svegliò, faceva freddo.",Stewart era contento di aver ricordato di tenere acceso il fuoco.,1
759,Anthony voleva imparare a parlare spagnolo.,Ha trovato un corso di spagnolo online e si è iscritto.,Anthony studiò duramente e alla fine imparò la lingua.,Anthony parla spagnolo fluentemente ora.,Anthony ha avuto successo grazie alle sue capacità linguistiche.,Anthony non riusciva a capire bene la lingua.,1
760,Amy e' andata al supermercato dopo il lavoro.,Aveva una breve lista di cose da comprare.,Il negozio aveva esaurito metà degli articoli.,Amy ha dovuto andare in un secondo negozio di alimentari.,Ha comprato due gonne e una camicia.,Dopo di che fu in grado di andare a casa e cucinare un buon pasto.,2
761,Joanie si e' fatta asciugare i capelli per un appuntamento.,Era sconvolta per aver trovato il suo asciugatrice.,Poi Joanie ha sentito un suono familiare che veniva da fuori.,Ha visto suo fratello usare il asciugatrice.,Joanie era contenta di suo fratello.,Joanie e' scappata fuori per affrontare suo fratello.,2
762,Cornelia decide di riorganizzare il suo appartamento.,Il suo letto e' rimasto vicino al muro per molti anni.,Cornelia sposta il letto per sedersi vicino alla finestra.,"Quando gli amici vedono il suo nuovo arrangiamento, lo adorano.",Cornelia poi rimise il letto dove era.,Ben presto tutte le sue amiche avevano sistemato i loro letti nello stesso modo.,2
763,Tim amava la sua moto.,Lo cavalcava ogni volta che poteva.,"Fino alla scorsa settimana, quando ha fatto naufragio.",Ora non lo cavalca quasi mai.,Tim si sente al sicuro quando guida la sua moto.,Tim ha paura di andare in moto.,2
764,Wendy ha ottenuto il suo primo lavoro come infermiera in una casa di riposo.,Amava davvero il suo lavoro e aveva dei legami con i residenti.,Le piaceva parlare con una signora anziana in particolare.,Un giorno la signora le mostrò delle foto dei suoi figli.,Wendy e' scappata fuori dalla stanza piangendo.,Wendy ha apprezzato le foto.,2
765,Tom e Jake sono andati a un concerto.,Stavano frequentando una band che amano.,Sono andati nell'area generale di ammissione.,C'erano delle persone molto alte che non vedevano niente.,Tom e Jake non hanno potuto vedere la loro band preferita.,Tom e Jake si sono goduti la bella vista.,1
766,Lester era orgoglioso di aver passato anni senza un cellulare.,Gli piaceva pensare di essere meno dipendente dalla tecnologia rispetto agli altri.,"Tuttavia, un giorno la sua auto aveva un pneumatico a terra e desiderava avere un telefono.",Non voleva avere un'esperienza come quella di nuovo.,Lester ha continuato la sua vita senza cellulare.,Lester ha comprato il miglior cellulare che poteva permettersi.,2
767,Ben aveva bisogno di un cambio olio nella sua macchina.,Sapeva che erano piuttosto costosi.,Poi ha visto un coupon sul giornale.,Ben l'ha tagliata e portata in garage.,Ben e' riuscito a fargli cambiare l'olio.,Ben ha venduto il suo rene per il crack.,1
768,Mi sono svegliato affamato.,Ho versato una ciotola di cereali ma ho scoperto di non avere latte.,"Dopo aver pensato di usare l'acqua, decisi di andare al negozio.",Sono andato all'angolo e ho preso mezzo gallone di 2%,Sono tornato a casa e ho mangiato dei cereali.,Sono tornato a casa e ho mangiato la pizza.,1
769,Anna aveva un acquario di acqua salata.,Ci teneva solo i coralli.,Poi ha deciso che voleva anche un po' di pesce.,Ha comprato qualche pesce pagliaccio e dei grilletti.,Anna presto restituì il pesce al negozio.,Ora Anna ha un acquario diversificato con pesci e coralli.,2
770,Holly era un bel gatto nero che Lee amava molto.,"Purtroppo, Holy si e' ammalata e Lee ha dovuto metterla a dormire.",Lee era molto triste per Holly ogni giorno.,"Un giorno, poco dopo, un gattino nero si presentò alla porta di Lee.",Lee ha deciso di adottare un cucciolo.,Lee decise di adottare il gattino.,2
771,Bob aveva bisogno di un nuovo paio di calzini.,Andò al grande magazzino locale per comprarle.,Il negozio stava facendo una grande vendita.,Si ritrovò a comprare un sacco di cose fantastiche.,Bob si è davvero divertito con il suo viaggio di shopping.,Bob ha restituito tutto il giorno dopo.,1
772,Il giovane Reggie amava giocare e guardare il football americano.,Il suo giocatore preferito era il running back Jamal Lewis.,Era all'aeroporto di Salt Lake con la sua famiglia e ha visto il suo eroe.,Lui gli ha detto che avrebbe giocato a calcio professionistico.,Jamal Lewis gli ha dato dei consigli personali e gli ha augurato il meglio.,Il giovane Reggie gli ha detto di stare lontano da lui.,1
773,Ella ha trovato un piccolo rossignolo per terra.,Sapeva che doveva essere caduto dal nido.,L'ha avvolto con cura e l'ha fatto diventare una casa sicura.,Poi gli ha dato da mangiare dei vermi a mano.,Le piaceva prendersi cura del rossignolo.,Ma non voleva più il rossignolo.,1
774,Ho preso la decisione di lasciare il lavoro.,Ho scritto la mia lettera di dimissioni.,Sono andato tranquillamente in ufficio e l'ho consegnato.,Ho lasciato il lavoro.,Ora sono libero di fare una carriera che mi renderà felice.,Domani torno al lavoro.,1
775,Ho messo la rosa nera di plastica in un vaso con dell'acqua.,L'ho lasciato sulla mia libreria per qualche settimana.,Dieci persone me l'hanno chiesto.,Volevano sapere perche' avevo un fiore finto annaffiato.,"Onestamente, non sapevo neanche il perche'.",Dopo qualche settimana il fiore morì.,1
776,Ben ha deciso di prendersi un caffè.,Ha pagato il caffe' con la sua carta di debito.,"Più tardi, la banca lo ha chiamato dicendo che aveva fatto un esborso.",Gli spiegarono che doveva pagare una multa di trenta dollari.,Ben era frustrato per la spesa extra.,Ben era felice dopo aver ricevuto la chiamata dalla banca.,1
777,Chris era nella sua seconda sosta della settimana.,"Passeggiando per l'aeroporto, decise di sfruttare questo momento.","Installando un'app sul suo telefono, ha iniziato a praticare il suo francese.",Un altro cliente dell'aeroporto lo ha sentito e gli ha offerto aiuto.,Il mecenate ha aiutato Chris a parlare il francese di base.,Il cliente non capiva Chris perché parlava solo cinese.,1
778,"Quando ero bambino, Google ha iniziato per la prima volta.",Ricordo di aver chiesto a mio padre come usare il sito.,Mi ha mostrato come digitare e cercare tutto quello che volevo.,Ne ero affascinato e passavo ogni giorno alla mia scrivania divertendomi.,Ho imparato molto da Google.,Mi arrabbio molto rapidamente.,1
779,Jeff era in lizza per una promozione per la quale avrebbe dovuto fare un colloquio.,"Tornò a casa e studiò molto, memorizzando le risposte.",Si preparò per molti giorni finché non si sentì pronto per l'intervista.,E' andato al colloquio e l'ha superato con successo!,Era contento quando gli fu data la promozione.,Si rese conto che doveva lasciare il suo lavoro.,1
780,Ritz nacque in una grande cucciolata di altri 12 cuccioli.,"Quando aveva otto settimane, fu dato in custodia a una famiglia adorabile.",L'hanno cresciuto bene e ha condotto una vita molto felice.,Le cose cambiarono un giorno per Ritz quando il suo proprietario ebbe il cancro.,Ritz era orfano e dovette essere mandato in un rifugio.,Il suo proprietario ha iniziato a correre 12 miglia al giorno.,1
781,Mia adorava stare all'aperto.,"Un'estate, decise di andare in montagna.",Si unì ad un gruppo di persone che scalavano le montagne insieme.,Hanno scalato la montagna più alta della sua zona.,Mia si e' divertita un sacco.,Mia avrebbe voluto stare in casa.,1
782,Il capo di Fred lo ha chiamato in ufficio alla stazione di rifornimento di propano.,Ha detto a Fred che i tempi erano duri e che doveva essere licenziato.,Fred si arrabbiò molto per questo.,Ha preso il suo capo per il collare e l'ha buttato giù.,Il capo di Fred gli ha dato un grosso abbraccio.,Un collega di Fred che l'ha visto aggredire il suo capo ha chiamato la polizia.,2
783,Mia cognata sta cercando di risparmiare.,È una vedova recente che vive di pensione.,Ha recentemente restituito due dei tre box per la TV via cavo.,Le ho detto che le antenne funzionano bene ora che le trasmissioni sono in HD.,Ha comprato altre cabine.,Era contenta di sentirlo.,2
784,Victor è sempre stato orgoglioso di provare nuovi cibi.,"Tuttavia, non ha mai mangiato un pistacchio.",Un giorno compra un barattolo di pistacchi da mangiare a casa.,Adora il loro sapore.,Victor decide di iniziare a comprare fisticci regolarmente.,Victor si rende conto di aver dimenticato la sua felpa in palestra.,1
785,Sharon aveva tenuto un sacchetto di semi sconosciuti per anni.,Un giorno decise di piantare i semi.,"Sharon le ha messe in piantagioni, credendo che sarebbero state piante piccole.",Sharon non poteva sbagliarsi di più nella sua supposizione!,Ha aperto una birra e ha preso un sorso.,Sono diventate piante enormi.,2
786,Fuori era una giornata splendida.,Emily voleva approfittare del bel tempo.,Ha deciso di andare al parco.,Emily fu delusa quando scoprì che la sua macchina non voleva accendersi.,Ha chiesto al vicino di farla partire.,Ha portato la sua auto dal meccanico per farla controllare.,1
787,Tom era stanco della vita di tutti i giorni.,Quindi ha deciso di andare fuori dalla rete.,"La prima settimana andava bene, ma presto ha finito l'acqua.",Ha sofferto per due giorni e non è riuscito a trovarne.,Alla fine Tom tornò in rete.,Tom amava l'idea di un digiuno.,1
788,Tim voleva imparare l'astronomia.,Voleva andare nello spazio.,Comunque era troppo giovane per essere un astronauta.,Questa notizia lo rattristò.,Tim ha lavorato sodo a scuola per diventare un prete.,Tim odiava Marte.,1
789,Mia cognata lavora in un centro di assistenza.,Lei è una cameriera.,Ci ha dato un calendario del centro.,La mostrava vestita per il giorno di San Patrizio.,Pensavamo tutti che mia sorella fosse divertente vestita in quel modo.,Mia sorella ci nascondeva qualcosa.,1
790,Fred ha deciso di comprare alcune azioni di Apple.,Il prezzo delle azioni era di 90 dollari quando l'ha comprata.,Per fortuna ieri hanno fatto un ottimo guadagno.,Le azioni sono poi salite a 100 dollari.,Fred si pentì dell'acquisto di azioni.,Fred era molto felice.,2
791,Jen era cosi' sicura dei suoi preparativi per il concorso di ortografia della contea.,Aveva passato l'ultimo mese a studiare il dizionario ogni sera.,"Quando l'Ape ha iniziato, Jen e' sopravvissuta mentre gli altri sono stati eliminati.",E' arrivata la finale e l'avversario di Jen ha fatto un casino.,Jen ha vinto l'esibizione di ortografia!,Jen ha perso l'esibizione di ortografia.,1
792,Kelly non esce dal suo appartamento da anni.,Sono andata a casa sua oggi per salutarla.,Ho visto che era riluttante a farmi entrare.,Abbiamo parlato per un po' di come sta.,A Kelly piace avere visite.,Kelly ha l'agoraphobia.,2
793,Emily era in spiaggia.,Il tempo iniziò tranquillamente.,All'improvviso il vento cominciò a soffiare severamente.,Anna è stata presa da una terribile tempesta di sabbia!,Si è divertita alla spiaggia.,Per fortuna e' riuscita a tornare alla casa sulla spiaggia sana e salva.,2
794,Andrew non era mai stato nei guai per niente.,I suoi genitori erano fuori citta' per la settimana.,Gli amici di Andrew sono venuti a bere qualcosa.,Quindi Andrew ha preso la scorta segreta di alcol dei suoi genitori.,Andrew avrebbe voluto che i suoi genitori avessero l'alcol.,Hanno bevuto l'alcol e si sono ubriacati.,2
795,Ellen viveva in campagna.,Le mancano i giorni senza corrente.,Un giorno una tempesta di ghiaccio fece saltare la corrente nella sua casa in città.,Ha preso molto freddo.,Era felice quando e' tornata la corrente.,Ellen era perfettamente a suo agio.,1
796,Jose era eccitato.,Aveva appena comprato uno skateboard nuovo e voleva provarlo.,L'ha portata dritta allo skatepark.,Ha pattinato tutto il giorno.,Jose si e' divertito allo skatepark.,Jose ha buttato via il suo skateboard.,1
797,Mike era seduto alla sua scrivania.,"Ma all'improvviso, ha sentito una strana sensazione di prurito sul braccio.",Anche lui sentiva le gambe che gli prudevano.,E poi la sua faccia.,Mike ha avuto un ictus.,Mike ha iniziato a ridere istericamente.,1
798,Jill e' andata in viaggio il mese scorso.,Voleva viaggiare da Boston a Seattle.,"A metà strada, la sua macchina si è rotta.",Ha passato ore sul ciglio della strada ad aspettare la AAA.,Jill era contenta che fossero arrivati cosi' in fretta.,Le hanno riparato la macchina e l'hanno mandata via.,2
799,Il preside annunciò che ci sarebbe stato un ballo scolastico quel venerdì.,Mary si entusiasmò per il ballo.,Voleva che Dan la invitasse al ballo della scuola.,Dan ha visto Mary nel corridoio e le ha detto che aveva bisogno di parlarle.,Lui la incolpò per aver rubato la sua bici.,Era felice che lui l'avesse invitata al ballo.,2
800,Un nuovo negozio di Organic Avenue e' aperto a New York e ho fatto un giro.,Ero super eccitata di provarlo perche' non ci ero mai andata prima.,"Quando sono entrata, avevano delle insalate e dei succhi fantastici da provare.",Ho provato un'insalata estiva e acqua di cocco.,Ho deciso di non tornare mai più in quel ristorante.,Questo era il mio nuovo ristorante preferito.,2
801,La stanza di Cindy aveva le pareti bianche.,Ma lei si lamentava che riflettessero troppa luce.,Così ha deciso di far dipingere le pareti di blu.,Pensava che la sua stanza fosse piu' tranquilla.,L'ha odiato e ha cambiato colore.,Lei era soddisfatta dei risultati.,2
802,Sono entrato in una fantasy football league per la prima volta quest'anno.,Mi sono unito al gruppo del mio amico perche' avevano bisogno di un'altra persona.,Non ho mai giocato prima in vita mia.,Alla fine ho vinto il primo posto!,Ero molto eccitato.,Ero molto deluso.,1
803,Helen si e' alzata presto per andare al lavoro.,"Ha nevicato la sera prima, quindi ha dovuto spalare la sua macchina.",Le ci è voluta un'ora per sgomberare la neve.,"Tornando a casa per prepararsi, sentì un suono familiare.",Aveva lasciato la doccia aperta.,Helen è andata al lago a noleggiare un jet-ski.,1
804,"Dopo il campionato di basket, i giornalisti hanno intervistato la squadra.",Dan ha chiesto se era in diretta o registrato.,Il giornalista gli ha detto che era uno spettacolo dal vivo.,Dan ha detto alla telecamera che suo padre era la sua ispirazione.,Dan ammirava suo padre.,Dan si vergognava di questo padre.,1
805,Jeremy ha una personalità distinta e forte.,Ha avuto un brutto momento con il suo lavoro ed è stato licenziato.,Ha detto cose poco lusinghiere al suo capo e ai suoi colleghi.,"Da allora, ha avuto difficoltà a trovare un lavoro.",Jeremy ha un atteggiamento difficile verso il posto di lavoro.,Il comportamento di Jeremy e' perfetto per il posto di lavoro.,1
806,Fran ha comprato una casa sulla spiaggia.,Ogni giorno le gru si nutrivano degli insetti nel suo giardino.,Un giorno però le gru smise di venire.,Passarono diversi mesi e ancora nessuna gru.,Il giardino di Fran e' infestato di insetti.,Fran ha avuto un infarto fatale mentre organizzava dei fiori.,1
807,La nostra squadra ha giocato a football oggi.,Eravamo tutti entusiasti di vincere.,Siamo andati in campo e ci siamo allenati prima della partita.,La nostra squadra era unita e lavorava insieme.,La nostra squadra si vergognava della sua prestazione.,La nostra squadra si sentiva gratificata.,2
808,Kelly odiava le lezioni di matematica e aveva difficoltà a imparare i concetti.,Lottava molto con il lavoro e spesso cercava aiuto dagli insegnanti.,Ha lavorato molto duramente e ha ottenuto buoni voti.,Stava per entrare all'universita' in autunno.,Ha lasciato il college.,Kelly si e' laureata con buoni voti.,2
809,La nonna di Sophie era malata terminale.,Sophie l'ha visitata in ospedale per dirle addio.,La nonna ha dato a Sophie il suo prezioso medaglione d'oro.,Ha detto a Sophie di tenerlo per ricordarsi di lei.,Sophie ha pianto.,Sophie le ha riso in faccia.,1
810,Kelly ha avuto un nuovo colloquio di lavoro oggi.,Si preparò in dieci minuti e uscì di corsa dalla porta.,"Quando arrivò e incontrò la donna, lei rispose alle domande.","Quando l'intervista era finita, le dissero che l'avrebbero richiamata.",Kelly sperava di ricevere presto una chiamata.,Kelly sperava che non avrebbe ricevuto una telefonata.,1
811,Don ha notato una mosca che entrava in salotto.,Ha deciso di colpirlo.,"Ha provato per mezz'ora, ma continuava a sfuggire.",Alla fine la mosca volò via da sola.,Don ha chiuso la porta da cui è volato fuori.,Don non e' mai piu' andato al lago.,1
812,Zack e i suoi amici hanno passato una casa spaventosa mentre andavano a scuola.,"Un giorno, decisero di entrare.",Zack e i suoi amici sono entrati in ogni stanza.,La casa era vecchia e abbandonata.,Hanno deciso di giocare a baseball lì.,Sono andati a scuola.,2
813,Mia e' andata al casinò ieri sera.,Ha iniziato la serata giocando a poker.,"Dopo aver perso una notevole somma di denaro, ha giocato alle slot machine.",Era quasi senza soldi quando il branco RING RING RING.,Mia ha vinto il jackpot!,Mia ha perso ancora piu' soldi.,1
814,Portia ama passeggiare nei boschi vicino a casa sua.,"Tuttavia, nota che le sue scarpe da ginnastica si stanno sporcando di fango e sono disgustose.",Decide di comprare un paio di stivali da trekking.,Portia trova un paio comodo e non troppo costoso.,È contenta della sua scelta.,Dona gli stivali al negozio di seconda mano.,1
815,Andrew si sarebbe sposato domani.,Aveva comprato l'anello di nozze mesi prima e non riusciva a trovarlo!,Ha guardato dappertutto in casa sua.,Alla fine si ricordò che doveva tornare al negozio per farsi ridimensionare.,Andrew era deluso di aver trovato l'anello.,Andrew era cosi' sollevato.,2
816,Terry ha trovato 200 dollari al lavoro.,"Ha portato i soldi a casa, ma si chiedeva se avesse fatto la cosa giusta.",Il giorno dopo ha portato i soldi al lavoro e li ha consegnati.,"Dopo una settimana nessuno ha richiesto i soldi, quindi il suo capo gli li ha restituiti.",Odiava la sua decisione e se stesso.,Ha imparato che l'onestà paga.,2
817,Adoro le lunghe docce calde.,Sono fantastici e divertenti.,Sfortunatamente sono sprecati.,Quindi mi sento sempre male quando ne prendo una.,Ecco perche' ne prendo due al giorno.,Ho deciso di fare una sola doccia calda a settimana.,2
818,Barry ama giocare a baseball.,Barry decise che sarebbe andato a vedere una partita di professionisti.,Barry e' andato allo stadio e ha comprato un biglietto.,"Entrando, Barry decise di prendere una birra da bere.",Barry ha comprato anche un hot dog.,Barry ha deciso di lasciare il gioco.,1
819,Abbiamo avuto mosche della frutta a casa nostra l'anno scorso.,Abbiamo cercato varie terapie.,Abbiamo provato il vino rosso in ciotola.,Quando non ha funzionato abbiamo comprato una trappola speciale.,Abbiamo messo fuori altre ciotole di vino rosso dopo i risultati che abbiamo visto.,Potremmo anche vedere la trappola funzionare.,2
820,A Remy piaceva bere latte.,"Ma un giorno, ha versato il latte sul tappeto.",E non ha pensato di pulire correttamente la macchia.,"La mattina dopo, si svegliò con un odore terribile.",Remy ha imparato a non versare latte sul tappeto e a pulire meglio.,Remy ha pensato fosse una buona idea versare piu' latte sul tappeto.,1
821,Heather e Marcus erano pronti per il passo successivo nella loro relazione.,"Erano una coppia felice, ma volevano un membro della famiglia.","Anche se non erano ancora pronti per avere figli, si sentivano ancora soli.","Per capriccio, sono andati in un rifugio per animali e si sono innamorati di un gatto.",Hanno adottato il gatto.,Hanno lasciato il rifugio senza un animale.,1
822,Molte persone stavano andando a lezione.,Volevano tutti arrivare in fretta.,La gente ha cominciato a spingere gli altri fuori strada.,Sono caduti.,Sono tornati tutti a casa.,La folla ha fatto in modo che molte persone arrivassero in ritardo alla lezione.,2
823,Sabato scorso sono andato a un concerto degli Azalea.,Il concerto e' stato fantastico.,Devo stare in prima fila.,Dopo lo spettacolo sono andato dietro le quinte per incontrarla.,Azalea era molto figo.,Non tornero' ad un altro concerto.,1
824,Eric è sempre stato sovrappeso.,La sua risoluzione per il nuovo anno era di seguire una dieta.,E' andato in palestra a gennaio e ha mangiato in modo più sano.,- Che dura circa un mese.,Eric ha smesso di allenarsi.,Eric ha smesso di essere anoressico.,1
825,Sally stava lottando per fare bene a scuola.,I suoi genitori decisero che dovevano motivarla.,"Hanno detto che se ha fatto bene l'ultimo semestre, sceglie lei le vacanze.","Sally studiava giorno e notte, voleva fare bene.","Dopo aver finito di studiare, Sally raccolse legna da ardere.","Sally si comportò bene, e i suoi genitori accettarono di portarla alle Hawaii.",2
826,"Quando ero piccolo, io e i miei fratelli avevamo bisogno di soldi.",Abbiamo avuto l'idea di un chiosco della limonata.,Decidemmo di sistemare la nostra casa.,Abbiamo venduto limonate a qualche dozzina di persone.,Non abbiamo fatto soldi.,Abbiamo fatto un sacco di soldi per i nostri bisogni.,2
827,Da bambino adoravo le torce.,Quando sono cresciuto ho comprato delle piccole torce.,Le ho messe nella borsa per le emergenze.,"In seguito, l'avvento dello smartphone ha reso meno necessarie le torce.",La mia casa è piena di torce e non so cosa farne.,Odio il mio smartphone.,1
828,Terry odiava il suo nome.,Voleva un nome figo come Super Metro Volcano Man.,Ha detto a sua madre che voleva cambiare il suo nome.,La madre gli spiegò che aveva preso il nome dal nonno.,Terry aveva 45 anni.,Terry era ancora deluso.,2
829,La famiglia Parker cercava una nuova casa.,"Hanno cercato in tutta la citta', ma non hanno trovato la casa che volevano.",Finalmente hanno trovato una bella casa che amavano.,La casa era assolutamente splendida.,La famiglia Parker era frustrata.,La famiglia Parker si trasferì presto nella loro nuova casa.,2
830,Tom ha deciso di andare a casa della sua ragazza oggi.,"Ha guidato più veloce che ha potuto, anche se c'era molto traffico.","Quando arrivò davanti alla casa, suonò al campanello.","Nessuno rispose, tuttavia, la porta d'ingresso era aperta.",Tom cominciò a ridere.,Tom cominciò a preoccuparsi.,2
831,La batteria dell'auto di Kelly e' scarica.,"Ha provato a farla saltare, ma non ha funzionato.",Alla fine l'ha portata al negozio di auto.,L'hanno controllato per lei ed era morto.,Kelly era sollevato che la batteria fosse ancora buona.,Kelly ha pagato a malincuore per una nuova batteria.,2
832,Joe ha comprato uno skateboard con i suoi risparmi.,Ha portato il suo nuovo skateboard al parco per farne mostra ai suoi amici.,"Mentre faceva un trucco, Joe cadde e si ruppe il braccio.",Ha passato quattro ore in ospedale a sistemarsi il braccio.,"Dopo essere uscito dall'ospedale, Joe e' andato a fare surf.",Joe soffriva terribilmente.,2
833,Maddie ha deciso che era ora di tornare a fare shopping per la scuola.,Era metà agosto e le lezioni stavano per iniziare.,Ha controllato i requisiti del corso e le liste delle spese.,Poi ha guardato tutti gli annunci sul giornale per trovare le migliori offerte.,Maddie ha preso in prestito tutta la sua attrezzatura scolastica.,Trovò i posti migliori dove fare shopping e comprare tutte le sue forniture.,2
834,Neil aveva gustato il cibo cinese a Hunan.,Ma gli hanno detto che il cibo più speziato era nella provincia di Szechuan.,"Curioso, prese un treno per andare lì.",Poi ha ordinato un piatto di riso e noodles.,Aveva la sensazione che la sua bocca stesse bruciando.,Neil amava mangiare il pane.,1
