,input_sentence_1,input_sentence_2,input_sentence_3,input_sentence_4,sentence_quiz1,sentence_quiz2,answer_right_ending
334,Da giovane amavo nascondermi e sgattaiolare.,La suonavo anche quando gli altri non lo sapevano.,Mi nascondevo e saltavo fuori contro la gente.,Lo facevo sempre alle elementari.,"Quando sono cresciuto, ho dovuto smettere di saltare sulle persone.",La gente era molto felice quando giocavo a questo gioco senza di loro.,1
335,Rachel stava guardando la sua posta quotidiana.,Ha trovato una lettera scritta in una lingua straniera.,Rachel ha mostrato la lettera ai suoi amici.,Nessuno poteva leggere o capire la lettera.,Rachel non voleva sapere cosa diceva la lettera.,Rachel lo portò a un professore di lingue per la traduzione.,2
336,Deb e' stata licenziata per i tagli.,Era molto sconvolta e andò a casa a sbronzolare.,"Suo marito le ha detto che sarebbe andato tutto bene, ma Deb non ne era sicura.","Il giorno dopo, il marito di Deb le ha organizzato un colloquio al suo lavoro.",Deb ha iniziato a lavorare nello stesso lavoro che aveva fatto per anni.,Ha avuto il lavoro.,2
337,Bethany era imbarazzata per i capelli che aveva al braccio.,Ha provato a radersi.,E' ricresciuta in poche settimane.,Ha fatto una depilazione laser.,Lei desiderava che ricrescesse.,Si sentiva meglio con se stessa.,2
338,I genitori di Gina stavano andando in auto nell'Illinois.,Gina era seduta sul sedile posteriore schiacciata dai suoi fratelli.,A peggiorare le cose era l'ora di punta.,Il traffico si muoveva lentamente.,Gina e' uscita e e' tornata a casa a piedi.,Gina chiuse gli occhi e fece del suo meglio per addormentarsi.,2
339,Una estate io e mia sorella abbiamo aperto un chiosco di limonate.,Era il primo mese in una nuova casa e non conoscevamo nessuno.,Poche persone passavano e ancora meno si fermavano.,Il vecchio pastore è venuto dalla porta accanto.,Ha comprato della limonata e ci ha fatto sentire i benvenuti nel quartiere.,Ha versato la nostra limonata per terra.,1
340,Bob si trasferì da una piccola città in una grande città.,Era preoccupato di perdersi sempre.,Il primo giorno si e' perso mentre cercava di tornare a casa dal lavoro.,Poi Bob comprò un sistema di navigazione per aiutarlo a imparare a navigare.,Bob conosceva bene la zona e non ha mai usato il sistema di navigazione.,Il sistema di navigazione ha aiutato molto Bob.,2
341,Kelly stava leggendo su animali ibridi online.,E ha visto delle foto di liger.,Era colpita dalla loro grandezza e dalla loro forza.,Ma si chiedeva se potessero vivere in natura.,Kelly li aveva visti solo allo zoo.,Kelly si ricordava quando sua nonna le ha mostrato i fiori.,1
342,Jorie andò con la sua famiglia a visitare la casa di Anna Frank ad Amsterdam.,Lei ha letto il libro in anticipo.,Pensava che la casa fosse piuttosto piccola.,Sua madre piangeva mentre guardava il museo.,Jorie ha ammesso che e' stato un tour molto emotivo.,Hanno deciso di visitare il club della commedia al piano di sopra.,1
343,Un giorno Clara tornò a casa dal lavoro.,Poi si rese conto di essersi chiusa fuori!,Le chiavi erano sul tavolo della cucina quella mattina.,Ha dovuto chiamare sua madre per chiedere aiuto.,A Clara piaceva stare fuori.,La mamma di Clara ha aiutato subito.,2
344,L'altro giorno stavo pulendo un po' intorno all'appartamento.,Ho deciso di sbarazzarmi di tutto il disordine e delle carte sul tavolo.,Sotto tutte c'era una vecchia lettera della mia ragazza.,Dice che voleva rompere con me.,Ero arrabbiato e confuso per la lettera.,Ero molto felice per la lettera.,1
345,Ben era sposato con la sua fidanzata del liceo.,Sono stati sposati per molti anni.,Un giorno Ben si rese conto che non era felice nel suo matrimonio.,Ha deciso di avere una relazione.,Sua moglie era fiera di lui.,Sua moglie l'ha scoperto e hanno divorziato.,2
346,Un uomo ha scommesso con un altro che avrebbe battuto un'anatra.,Una anatra è stata trovata e fissata.,"Sebbene l'anatra non fosse consapevole di ciò che stava accadendo, non ha battuto ciglio.","Tuttavia, si bagnava gli occhi con la sua membrana nictitante.",L'uomo alla fine ha battuto gli occhi.,L'uomo voleva perdere la sua scommessa.,1
347,Shay e' andato al parco marino.,Lì vide un cartello che pubblicizzava il nuoto dei delfini.,Shay gli diede con entusiasmo i suoi 40 dollari e si vestì.,Poi si è buttata in piscina per nuotare con i delfini.,Shay si e' divertita un sacco.,A Shay non piacevano molto i delfini.,1
348,Lia è andata in Inghilterra.,Ha fatto un giro in autobus.,Il tour si è fermato a Stonehenge.,Lia e' scesa dal bus per guardare.,Lia odiava andare in Inghilterra.,Lia ha fatto molte foto di Stonehenge.,2
349,Stavo bevendo un bicchiere di succo.,La mia tazza e' caduta sul bancone.,Ho cercato qualcosa per pulire la macchia.,Ho trovato un pacchetto di asciugamani di carta.,Ho pulito il casino.,Ho lasciato il casino e ho fatto un panino.,1
350,Arthur e i suoi amici stavano uscendo.,Stavano bevendo birra e parlando.,All'improvviso la birra è finita.,Arthur non voleva prendere l'ultima.,Arthur si sentiva bene a prendere l'ultima comunque.,Arthur ha ordinato un altro giro per i suoi amici.,2
351,Hester ha sempre amato i capelli che sembrano dritti.,Un giorno viene invitata ad assistere all'inaugurazione di una galleria d'arte.,Decide di raddrizzarsi i capelli per l'evento.,I suoi amici le fanno complimenti per il suo aspetto.,Hester e' orgogliosa del suo aspetto.,Hester si è rasata la testa.,1
352,Jill voleva comprare una macchina nuova.,Jill ha portato la sua vecchia macchina alla concessionaria.,Il venditore ha scambiato la vecchia macchina di Jill per una nuova.,"Dopo aver pagato anche il commesso, Jill ha avuto la sua nuova macchina.",Jill era eccitata.,Jill era depressa.,1
353,Jaden era piuttosto dimenticosa.,Non si era accorto che era già San Valentino.,"Sentendosi di fretta, uscì e comprò dei fiori e della cioccolata.",La ragazza di Jaden e' tornata a casa e ha trovato le prelibatezze.,La ragazza di Jaden ha preso uno schiaffo in faccia.,Jaden aveva salvato la situazione.,2
354,John ha ricevuto una bici per il suo compleanno.,Non sapeva cavalcare.,Ha praticato tutta la settimana.,Alla fine della settimana si è tolto le ruote di assistenza.,Era in grado di andare in bicicletta senza di loro.,"Si e' reso conto che andare in bicicletta non era per lui, e ha fatto un pisolino.",1
355,Quentin non era mai stato su una barca in vita sua.,Un'estate un amico invitò Quentin alla sua casa sul lago.,"Quando erano lì, Quentin e il suo amico andarono a navigare.",È stata un'esperienza esaltante.,Quentin era contento di essere andato.,Quentin ha giurato di non andare mai più in barca.,1
356,Un uomo ha ordinato dei pancake da un ristorante.,Poco dopo gli ha portato un piatto di pancake.,L'uomo si lamentò che i pancake erano troppo spessi.,Il cameriere li ha riportati alla cuoca.,Il cuoco lo lodò.,Il cuoco ha deciso di rifarli.,2
357,I miei figli volevano un animale domestico.,Come famiglia abbiamo deciso che era una grande idea.,Siamo andati al rifugio per animali per trovare il nostro nuovo amico peloso.,"Arrivati lì, incontrammo un laboratorio nero che tutti amammo.",Abbiamo deciso che il laboratorio nero non dovrebbe tornare a casa con noi.,Abbiamo adottato il laboratorio nero e l'abbiamo portata a casa.,2
358,I fiori del mio giardino stanno morendo.,Sono appassite e asciutte dal sole.,Un mio amico è venuto per aiutarmi a valutare cosa c'è che non va nelle mie piante.,Ha scoperto che avevano bisogno di più acqua.,"Dopo averle irrigate di più, le mie piante sono più belle che mai.",Non le ho ancora annaffiate.,1
359,Jill stava giocando ai videogiochi con sua sorella.,Jill era arrabbiata perche' perdeva ogni partita.,Jill ha preso il suo controller e l'ha lanciato contro la TV.,Lo schermo della TV si e' rotto in mezzo.,Jill e sua sorella non potevano giocare più ai videogiochi.,Jill e' migliorata con i videogiochi.,1
360,"Ho iniziato a guardare a sbronza ""Buffy l'uccisione di vampiri"".","Dopo qualche ora, mi è venuto di correre.","Sfortunatamente, era buio fuori.",Sono rimasto in piedi nella porta per un po'.,Poi mi sono addormentato fino alla mattina seguente.,Poi ho immaginato di essere Buffy e sono corso.,2
361,"A 12 anni, Drew decise di diventare un criminale.",Decise di rompere le porte e di rapinare le case.,Si esercitava a rompere le porte degli armadi per rafforzarsi.,Sua madre è tornata a casa e ha visto tutte le porte degli armadi rotte.,Drew vuole sempre obbedire alla legge.,Sua madre era molto arrabbiata.,2
362,"Per molto tempo, ogni volta che facevo le uova sode, uscivano male.",Ho cercato in tutto Internet una soluzione al mio problema.,Un sito web mi ha suggerito di cuocere le uova invece di bollirele.,Ho fatto come mi ha chiesto.,Le uova al forno erano ottime.,Ho lasciato il guscio e le ho mangiate intere.,1
363,Un ragazzo ha visto un quarto di dollaro sul marciapiede.,Si è chinato e l'ha raccolta.,"Mentre lo faceva, una palla di sputo gli volava dietro la testa.","Guardandosi intorno, vide il suo nemico con una cannuccia in mano.",Il ragazzo era grato.,Il ragazzo era arrabbiato.,2
364,Hector nota che solo un orecchio delle sue cuffie funziona.,Vuole un paio di scarpe nuove per poter ascoltare la musica.,Alla fine trova un buon paio di cuffie che può permettersi.,Li compra e comincia subito ad ascoltare musica.,Hector decide che non gli piace la musica.,Hector e' felice che entrambe le orecchie funzionino.,2
365,Tom voleva andare a una partita dei New York Giants.,"Tuttavia, i biglietti erano troppo costosi.","Alla fine, trovò dei biglietti che erano nella sua fascia di prezzo.",E' finito seduto sul ponte superiore.,Gli piaceva comunque guardare la partita.,Tom pensava che fosse la migliore partita di hockey di sempre.,1
366,Trip adorava il cocomero.,Ne mangiava almeno uno al giorno.,Sua madre gli ha sempre detto che avrebbe fatto crescere un albero ingoiando semi.,Li ingoiava sempre.,Trip ha apprezzato il sapore dei semi.,Trip ha smesso di mangiare completamente il cocomero.,1
367,"Angie, una lavoratrice di MTurk, si considerava diligente.",Un giorno uno dei suoi richiedenti preferiti rifiutò il suo lavoro.,Angie era molto sorpresa e gli ha mandato una mail.,Risposero che il suo lavoro non era stato abbastanza buono.,Angie ha deciso di dire al richiedente di rifiutare altri suoi lavori.,Angie ha cercato di discutere il problema in dettaglio.,2
368,Donovan ha chiesto a Trina di andare a ballare con lui.,"Trina amava Donovan, quindi ha detto di si', ma era davvero preoccupata.",Dopo la scuola corse a casa per chiedere aiuto al padre.,"Quando suo padre tornò a casa, lei gli spiegò la situazione e lui sorrise.",Il padre di Trina ha rimproverato Trina.,Il padre di Trina le ha insegnato a ballare.,2
369,Andy aveva sempre voluto una bici per bambini grandi.,Quando ha compiuto sei anni ha chiesto una bici per il suo compleanno.,Non sapeva andare in bicicletta.,Il giorno del compleanno di Andy sua madre gli ha regalato una bicicletta.,Andy ha pianto per ore.,Suo padre gli ha insegnato a cavalcarlo.,2
370,Suzy e' andata al negozio di gelati.,Ha ordinato un milkshake alla vaniglia.,"Quando ha cercato di pagare l'uomo per il suo milk-shake, lui le ha sorriso.",Le ha detto che aveva vinto un concorso speciale.,Lui le disse che lei gli doveva sessanta dollari.,Le ha dato il frullato gratis.,2
371,Ned e i suoi amici sono andati alla fiera.,Ha usato gli ultimi soldi per comprare un cotone di caramelle.,"Mentre se ne andava, vide un ragazzino che piangeva.",Aveva lasciato cadere il suo cotone di caramelle in una pozzanghera.,Così Ned gli ha dato il suo stesso cotone di zucchero.,Ha comprato altro cotone per il ragazzo.,1
372,Sebastian ha notato che era soleggiato e caldo.,Aveva delle faccende da sbrigare.,Non aveva voglia di fare i suoi lavori.,Sebastian ha deciso che stare all'aperto era meglio.,Sebastian voleva restare dentro quel giorno.,Sebastian e' uscito e e' andato a fare una passeggiata.,2
373,Rashid era un ottimo autista.,Un giorno il fratello di Rashid era in ritardo al lavoro.,Rashid si e' offerto di accompagnare suo fratello.,Sono arrivati con tempo a disposizione.,Suo fratello gli ha urlato contro e ha sbatto la porta.,Suo fratello era grato.,2
374,Ali e' andata in un fast food e ha pagato con la sua carta di credito.,La cassiera ci ha messo molto a riportare la sua carta.,"Qualche giorno dopo, Ali ha trovato delle transazioni insolite sulla sua carta.","Ha chiamato la banca, che ha annullato le accuse.",Si chiedeva se la cassiera avesse rubato le sue informazioni.,Si e' assicurata di ringraziare la cassiera del fast food.,1
375,Stavo cercando un bel quadro per il mio soggiorno.,Ecco perché ieri sono andato a cercarlo.,Finalmente ho trovato una bellissima che ho amato.,Il dipinto era di una cascata.,Ho deciso di non comprare il dipinto perché non mi piaceva.,L'ho comprato e l'ho portato a casa.,2
376,Volevo ottenere una promozione.,Ho deciso di provare a ottenere una promozione.,Ho lavorato sodo tutto l'anno.,Il mio capo se ne accorse e un giorno mi chiamò nel suo ufficio.,Il mio capo mi ha licenziato sul posto.,Ho ricevuto la promozione che volevo.,2
377,Maggie e i suoi genitori si stavano trasferendo in una nuova citta'.,Maggie era nervosa perche' non conosceva nessuno.,"Appena si e' trasferita, si e' presentata in giro.",Ha finito per fare degli amici.,Maggie era triste e sola.,A Maggie piaceva la nuova citta'.,2
378,Dan stava tornando a casa da scuola e ha visto la vetrina.,C'era un treno nella vetrina del negozio.,Dan desiderava tanto possedere questo treno.,Quando Dan e' tornato a casa sua madre gli ha detto di avere una sorpresa.,Ha dato a Dan il treno.,La madre di Dan gli ha detto di prepararsi per andare a scuola.,1
379,Gina voleva rubare la chiave di casa di sua madre.,Ha aspettato che sua madre facesse un pisolino.,Ha portato la borsa di sua madre in bagno.,Lei tolse la chiave dalla catena in silenzio.,Poi Gina ha rimesso la borsa dove l'aveva trovata.,Poi Gina ha detto a sua madre dov'era la chiave.,1
380,C'era un uomo del Kentucky.,Amava una ragazza che viveva in Louisiana.,Ha deciso che doveva trasferirsi.,Si e' trasferito per stare con il suo amore.,L'uomo si e' trasferito in Texas.,L'uomo si e' trasferito in Kentucky.,2
381,Tim stava fallendo a matematica.,Sapeva che se non avesse passato avrebbe dovuto andare a scuola estiva.,Ha studiato sodo e ha chiesto crediti extra.,L'ultimo giorno di scuola ha scoperto di aver passato!,Tim era entusiasta.,Tim era terribilmente deluso.,1
382,Mary-Anne si sentiva sola e decise di adottare un gatto.,E' andata alla sua associazione umanitaria locale per iniziare il processo.,"Mentre guardava, uno dei gatti le miagolava.","Mary-Anne accarezzò il gatto, e fu amore a prima vista.",Ha deciso che non era il gatto giusto.,Ha portato il gatto a casa con lei.,2
383,Ho fatto ginnastica da bambino.,Stavo imparando la trave di equilibrio e facevo delle mosse su di essa.,"Mentre facevo un giro di tiro, ho fatto un atterraggio sbagliato.",Mi sono rotto la caviglia e soffrivo tanto!,Sono stata portata in fretta all'ospedale.,Mi alzai e mi misi subito sulla trave di bilanciamento.,1
384,C'erano sei cuccioli che correvano nel mio foyer.,Sarebbe stato difficile scegliere quello che volevamo comprare.,Ognuna delle mie figlie ha scelto un cucciolo diverso.,Il proprietario ha detto che possiamo avere uno sconto su due cani.,Ognuno di noi ha comprato un cane.,Non ci piacevano i cani.,1
385,Johnny voleva un cambiamento dalla sua vita di grande città a Boston.,Ha deciso che sarebbe stato piu' felice nel cuore dell'America.,"Finalmente arrivò il giorno, Johnny si trasferì nell'Idaho.",Era fuggito dalla vita di città.,Johnny iniziò a pianificare di trasferirsi a Boston.,Johnny era felice di essere in una piccola città.,2
386,Joan odiava andare a casa per Natale.,Sapeva che sua madre la avrebbe perseguitata per la sua vita amorosa.,"Quest'anno, mentre tornava a casa, ha avuto un incidente d'auto.",La madre si precipitò al suo fianco per prendersi cura di lei.,La madre di Joan non le ha parlato perche' era nubile.,Joan si sentiva bene a vedere il volto di sua madre.,2
387,Passo tutto il tempo a scrivere.,Di conseguenza ho cominciato a sentirmi piuttosto sola.,Ho deciso di unirmi a una comunita' di incontri online.,"Quando mi unisco, mi rendo conto che non mi piacciono particolarmente le altre persone.",Ho iniziato a scrivere di più.,Sono uscita con molte persone.,1
388,Mia figlia era una ragazza scout all' elementare.,Un giorno è andata in gita di notte.,Mia moglie è andata come accompagnatrice.,Tutti sono stati in una baita nel New Hampshire per un weekend.,Mia figlia non ha mai dimenticato la sua gita.,Io e mia moglie abbiamo cenato quella sera.,1
389,Oggi c'era l'inaugurazione di un nuovo club dietro l'angolo.,Non vedevo l'ora di partecipare.,Quando siamo entrati nel club era bellissimo.,Abbiamo ordinato del cibo delizioso e abbiamo ballato.,Abbiamo fatto amicizia con il buttafuori per entrare al club domani.,Il buttafuori non ci ha permesso di entrare nel club.,1
390,Ieri portavo un nuovo bicchiere in cucina.,"Con mia sorpresa, mi è caduto.",Il vetro si è rotto.,Dovevo andare a prenderlo.,Mi sono tagliato un pezzetto.,Mi piaceva come era il vetro adesso.,1
391,La famiglia di Bill viveva su una collina.,Non pioveva mai o non faceva tempesta.,Un giorno un tornado attraversava la zona.,La casa di Bill e' stata colpita e il tetto e' stato strappato.,La compagnia assicurativa ha coperto le spese per un nuovo tetto.,Hanno deciso che non serviva e si sono trasferiti.,1
392,Allison ha deciso di voler saperne di piu' sulla storia della sua zona.,E' andata in biblioteca a prendere un libro su di esso.,Entrò e non riuscì a capire come fossero ordinati i libri.,Trovò un bibliotecario che le spiegò il sistema decimale di Dewey.,Questo l'ha aiutata a capire quale macchina non voleva.,Questo l'ha aiutata a trovare quello che voleva.,2
393,Sebastian voleva giocare a football nella squadra dei suoi amici.,Ha parlato con il suo amico e ha scoperto che doveva andare a fare pratica.,Si è allenato a prendere la palla a casa tutta la settimana.,E' andato all'allenamento successivo e ha fatto un touchdown.,Sebastian era deluso dalla performance.,Sebastian era felice che la sua pratica avesse dato i suoi frutti.,2
394,C'era una volta una madre che desiderava disperatamente che il suo bambino dormisse.,Lo ha fatto camminare ma non ha dormito.,Lei lo nutriva ma non riusciva a dormire.,"Alla fine, si ricordò della ninna nanna che sua madre le aveva cantato.",La madre cantava dolcemente la ninna nanna al suo bambino.,La madre ha suonato un po' di hip hop per il suo bambino.,1
395,Johnny faceva pipi' nelle piscine da bambino.,Pensava di poterlo fare da adulto.,Ha portato i suoi figli in un parco acquatico.,Poi ha fatto pipì nella vasca.,Qualcuno se n'e' accorto e Johnny si e' messo nei guai.,Tutti erano davvero felici per il comportamento di Johnny.,1
396,Amy guardava gli altri bambini giocare e fissava il suo inalatore.,A causa dell'asma non poteva fare sport.,Sentiva la mano del suo insegnante di arte sulla sua spalla.,La sua insegnante sorrise e disse ad Amy che sarebbe stata una grande artista un giorno.,Amy si sentiva molto meglio.,Amy si sentiva terribilmente.,1
397,Joe e i suoi amici hanno giocato a calcio oggi.,Joe era nervoso.,Era nervoso se avrebbe vinto o no.,"Alla fine, dopo la partita, la squadra di Joe vinse.",Joe era molto orgoglioso della sua squadra.,Joe era molto deluso dalla sua squadra.,1
398,Mark aveva un importante colloquio per un nuovo lavoro.,Si preparò alle domande che potevano porgli.,L'intervistatore sembrava impressionato dalle risposte di Mark.,L'intervistatore ha informato Mark che aveva il lavoro.,Mark era molto felice.,Mark si infuriò e uscì di corsa.,1
399,Elaine non aveva voglia di cucinare stasera.,Perciò Elaine decise di andare a mangiare fuori.,Tuttavia Elaine non sapeva dove voleva mangiare.,Elaine ha deliberato per quasi un'ora su dove andare.,Elaine ha trovato facile prendere una decisione.,Elaine ha avuto difficoltà a prendere una decisione.,2
400,Sam stava cercando di entrare nel college dei suoi sogni.,Ha passato molto tempo a compilare la domanda.,Lo faceva sentire bene per i suoi risultati accademici.,Ha presentato la domanda.,Tre mesi dopo ricevette una lettera di accettazione.,Non ci ha mai più pensato.,1
401,Matt ha deciso di andare a fare un giro in un bar con i suoi due amici una sera.,Hanno bevuto tre bicchieri in un bar.,"Sono andati a 4 altre, bevendo 3 shot in ognuna.",Matt si e' ubriacato e ha perso il telefono.,Matt e gli amici sono tornati a casa e hanno dormito.,A Matt non importava del telefono scomparso.,1
402,Bindu ha organizzato una festa con le sue amiche.,Si sono incontrati a casa sua per discutere di quale cibo e fascia usare.,Uno degli amici di Bindu ha portato samosa e doogh.,Quattro amici hanno suonato musica alla festa.,Tutti si sono divertiti.,Bindu odia i suoi amici e le feste.,1
403,Tyler si sveglia e deve fare la doccia prima di andare a scuola.,Il suo fratellino sta usando la doccia.,Tyler e' preoccupato di perdere l'autobus.,Finalmente e' il turno di Tyler di fare la doccia.,Tyler ha fatto dei cupcake per mostrare le sue abilita' di pasticcere.,Tyler si fa una doccia veloce e arriva alla fermata dell'autobus in orario.,2
404,Thomas si sentiva sotto il radar ultimamente.,E' andato dal suo medico per un controllo.,Il suo medico gli ha detto che i suoi livelli di colesterolo erano un po' alti.,Thomas ha iniziato a mangiare in modo più sano e a fare passeggiate.,Gli fu diagnosticato il diabete dopo aver guadagnato quarant'anni.,Il suo medico fu molto soddisfatto al suo successivo controllo.,2
405,Il campanello ha suonato ma non c'era nessuno.,Non era sicura se avrebbe dovuto aprire la porta o no.,Lentamente ha crepitato la porta e sbirciato fuori.,Suo fratello le saltò addosso e le fece una bella paura.,Ha deciso di guardare il suo programma comico preferito su Netflix.,Ha urlato e ha spinto via suo fratello.,2
406,Stephanie voleva fare il purè di mele.,Decise di andare al mercato a raccogliere delle deliziose mele.,Mentre camminava nel frutteto inciampò e cadde.,Si e' rotta entrambi i polsi.,Stephanie si e' sollevata con le mani.,Stephanie non poteva alzarsi finche' qualcuno non l'aveva trovata.,2
407,Roy non riusciva a capire perche' il suo appartamento puzzasse cosi' tanto.,I suoi amici hanno commentato quando sono andati.,Tutti decisero di cercare la fonte.,Si è rivelato essere un vecchio pesce nel frigorifero.,Roy ha deciso di lasciare il pesce nel frigorifero.,Roy ha buttato fuori il vecchio pescatore e tutto ha avuto un odore migliore.,2
408,Jimmy è cresciuto molto povero.,Tuttavia i suoi genitori fecero sempre del loro meglio per provvedere a lui.,"Quando e' entrato in un buon college, hanno lavorato due volte per permettersi di studiare.","Quando si e' laureato, voleva mostrare il suo apprezzamento.",Quindi li ha ripagati per il college.,Jimmy ha chiamato i suoi genitori e li ha maledetti.,1
409,Jill fu sorpresa quando un bel ragazzo le chiese di andare al ballo del college.,"Mentre le sue compagne si preparavano, Jill si è agitata per i capelli.",I coinquilini di Jill hanno detto che potevano aiutarla.,Jill ha finito di indossare il suo vestito bianco simile a una toga.,Il suo ragazzo è arrivato e ha fatto i complimenti al suo aspetto.,Jill e le sue amiche si sono divertite una sera solo per ragazze.,1
410,Un proprietario di un bar ha messo un grande cartello per pubblicizzare il suo bar.,Il vento era forte e ha soffiato via la bandiera.,Il proprietario ha inseguito il suo proibito in tutta la citta'.,E' atterrato nel cortile di una vecchia.,La vecchia si rifiutò di restituire il banner.,La vecchia donna era felice di trovare il cappotto di pelliccia.,1
411,Mia madre ha una ricetta di barrette di zucca che mi piace molto.,Una volta me li ha fatti perché stavo avendo una brutta giornata.,Ho mangiato le barrette di zucca e mi sono sentita molto meglio.,Le sbarre mi hanno ricordato che mia madre si preoccupa per me.,Da quel giorno non ho più mangiato le barrette di zucca.,Ho fatto delle barrette di zucca piu' tardi nella vita e mi hanno ricordato mia madre.,2
412,Tim ha deciso di passare più tempo con suo nonno.,"Suo nonno amava osservare gli uccelli, quindi Tim guardava con lui.",Hanno segnato gli avvistamenti in un taccuino.,Ben presto Tim era davvero interessato!,Tim ha deciso che non era piu' interessato agli uccelli.,Tim e suo nonno hanno trovato un hobby che piaceva a entrambi.,2
413,Danny ha lavorato in un gelateria locale questa estate.,Era molto entusiasta di aver iniziato il suo primo lavoro.,Il primo giorno un ragazzino ha fatto cadere il gelato a terra.,"Senza esitare, Danny sapeva esattamente cosa fare.",Gli ha dato un'altra cucchiaia di gelato.,Si e' rifiutato di dargli un altro scoop.,1
414,La campana della scuola suonò quando l'orologio batté le due.,Gina non e' mai stata cosi' felice di poter finire una giornata.,Ha preso le sue cose e ha aspettato Tami alla porta.,Ma Tami se ne stava andando con Rita e Mary.,Gina si sentiva sola quando tornava a casa.,Gina ha ringraziato Tami il giorno dopo.,1
415,Laurence e la sua famiglia decisero di trasferirsi.,Prima hanno preparato i mobili.,Poi hanno messo insieme tutto il resto.,Tutti i loro effetti personali sono stati spostati nel furgone.,Laurence e la sua famiglia sono andati a casa.,Laurence ha riportato tutti i loro effetti personali in casa.,1
416,Joy voleva trovare il guscio perfetto per il suo granchio eremita.,"Potrebbe comprarne uno, ma sarebbe piu' speciale se lo trovasse.",Ha setacciato la spiaggia tutta la mattina.,Tutto quello che poteva funzionare era rotto!,"Ha dovuto comprare un guscio, dopotutto.",Così ne portò una a casa e la diede al suo granchio.,1
