,input_sentence_1,input_sentence_2,input_sentence_3,input_sentence_4,sentence_quiz1,sentence_quiz2,answer_right_ending
688,Laura tangi luwih dhisik supaya bisa tekan kelas ing wektu sing tepat.,Dheweke nggawe sarapan dhewe sadurunge dheweke lunga menyang sekolah.,"Sakwisé sarapan, Laura metu saka omah lan numpak bis.","Wektu tekan sekolah, dhèwèké ndelok ana tandha sing kandha nèk kelas wis dibatalake!",Laura rumangsa wis mbuwang-mbuwang wektu.,Dina kuwi Laura seneng banget ing kelas.,1
689,Ray nggantungaké ban ing tali kanggo nggawé ayunan kanggo anaké wédok.,Dhèwèké munggah ing njero lan seneng dolanan.,"Banjur Ray krungu swara sing banter banget, lan ana kebrukan sing banter.",Cangkang sing nyekeli ayunan kuwi wis pecah lan anaké wadon wis tiba!,Ray ngguyu karo kahanan sing edan.,Ray mlayu marani anaké wédok kanggo mriksa nèk dhèwèké ora apa-apa.,2
690,Bocah-bocah wadon padha lunga menyang bar.,Wong-wong kuwi mbukak rekening.,Wong loro kuwi ngombé-ngombé.,"Pungkasané, wong-wong kuwi mutuské kanggo mbayar utangé.",Wong loro kuwi mulih karo crita bab wengi kuwi.,Wong-wong kuwi mlebu pesawat.,1
691,Minggu kepungkur aku kudu menehi pidato gedhe.,Aku ora tau disiapake lan mung anyar banget dhasar.,Aku mikir aku mung bakal mlebu lan pura-pura.,Aku nggunakké tembung-tembung sing gedhé lan nyoba kanggo muni pinter.,Iki bisa lan pidato kasebut ditampa kanthi apik.,Aku mandheg ngomong lan mulih.,1
692,Bu Jio ngundang wong tuwané Nate kanggo rapat.,Dhèwèké kandha nèk Nate ngganggu lan butuh obat.,Wong tuwané Nate mulih lan rembugan dawa.,"Wong-wong kuwi nggawa Nate menyang dhokter, nanging ora éntuk obat.",Dokter nyaranaké supaya Jake mèlu konseling.,"Wong tuwané diwènèhi resep, lan langsung diisi.",1
693,Ana restoran Italia sing apik banget ing dalan saka Alice.,Dhèwèké biasané lunga mrana saben minggu.,Dheweke seneng pasta sing disajikake ing kana.,"Ing sawijining dina, dhèwèké nyoba lunga ing kono lan ngerti nèk kantoré wis ditutup.",Alice nesu amarga kudu mangan panganan Cina.,Dhèwèké ngundang kabèh kancané kanggo nggabung karo dhèwèké ing restoran kuwi.,1
694,Aku ora duwe mie.,Aku mlebu mobil lan mlayu menyang toko.,Aku tuku mie merek favoritku.,Aku cepet-cepet mulih.,Aku masak mi.,Aku mbuwang mie ing tong sampah.,1
695,Pete kudu ketemu karo makelar.,Ora suwé manèh dhèwèké arep tuku omah.,Pete ora bisa nemokake kontrak sing diwenehake dening agen real estate.,Dhèwèké nggolèki kabèh panggonan ing omahé.,"Akiré, dhèwèké nemokké ing garasi.",Pete mutusaké iku bakal wektu gedhe kanggo njupuk trip kanggo Vegas.,1
696,Fred seneng taman hiburan nanging ora tau numpak roller coaster.,Kancané ngécé dhèwèké merga wedi karo papan sing dhuwur.,"Ing sawijining dina ing taman hiburan, dhèwèké mutuské ngadhepi rasa wedi.",Fred numpak roller coaster paling cepet lan paling medeni ing taman!,Dhèwèké mutuské arep mulih lan nangis.,Dheweke seneng banget yen dheweke nindakake lan tresna karo taman kasebut.,2
697,Wendy tuku sawetara lenga adus kanthi online.,Dhèwèké salah maca lan nggunakké kabèh bahan kuwi ing awaké.,Dhèwèké kaget banget merga kulité dadi jambon.,Dhèwèké langsung nggolèk bantuan ing kantoré.,Wendy seneng banget tuku minyak mandi liyane.,Perusahaan kuwi mbayar dhuwit kabèh marang Wendy lan njaluk ngapura.,2
698,Jackson mesthi ora ngombé alkohol.,Dhèwèké ngerti nèk ngombé alkohol kuwi mbebayani kanggo awaké dhéwé lan isa nggawé awaké dhéwé ora nduwé pikiran sing bener.,"Nanging, ing sawijining dina, bosé Jackson ngundang dhèwèké ing sawijining bar kanggo ngombé bir.",Jackson ngerti nèk dhèwèké seneng karo rasa bir.,Dhèwèké mutuské nduwé anak loro.,E nyembur biré.,1
699,Ana kodhok sing kepéngin mangan ing wayah sore.,Panjenenganipun nyawang liwat blumbang lan spied fly a.,Kodhok mau nglangi nganti tekan laler kanthi tenang.,"Sayange, lalat weruh dheweke teka lan buzzed adoh.",Katak durung tau duwe weteng kaya ngono ing kabeh uripe.,Kodhok kuwi isih luwé.,2
700,Oscar ora tau nggawe kasur.,Ibuné mesthi kepéngin.,Akiré dhèwèké mutuské kanggo mulai nggawé kasur.,Ibuné bangga.,Dhèwèké mènèhi panganan cuci mulut.,Dhèwèké mbengok karo dhèwèké.,1
701,Ing sawijining dina aku mlaku-mlaku ing alas.,"Saka jarak pirang-pirang meter, aku weruh ula abang.",Aku langsung ora kuwatir.,Aku alon-alon mlaku mburi.,Banjur aku mlayu menyang ula.,Ula iku nyokot aku.,2
702,Phil ngrasakake semangat nalika pisanan menang tangan ing blackjack.,Dhèwèké mulai kerep menyang kasino seminggu.,Kerugiané saya tambah cepet tinimbang sing menang.,"Ora nganti setaun, dhèwèké wis ora nduwé dhuwit manèh.",Dhèwèké seneng banget merga wis menang judi.,Dhèwèké mutuské nèk kudu tumindak kanggo ngatasi kecanduané.,2
703,Sepupu takon apa ana wektu sing angel ing uripku.,Aku njupuk bingkai foto.,Gambar-gambar kuwi nduduhké wektu aku ing rumah sakit.,"Aku nerangké marang dhèwèké, nèk aku tau lara leukemia.","Dhèwèké nangis lan ngrangkul aku, merga ngajèni sipat kendelku.",Dhèwèké metu merga rumangsa aku tansah ngganti topik.,1
704,Ibuné Matthew lagi sibuk nyunting ing komputer.,Matthew njerit.,Matthew dipentung.,Ibuné Matthew banjur ora kuwatir manèh lan mandheg nyambut gawé.,Ibuné Matthew ngrampungké kabèh gawéan ing komputer.,Ibuné Matthew nglebokké Matthew ing pojok wektu istirahat.,2
705,Tine péngin mèlu tim atletik.,Dhèwèké péngin isa cepet.,"Sakwéné sesasi sakdurungé uji coba, dhèwèké mlaku dhéwé.","Saben esuk, dhèwèké tangi luwih dhisik kanggo mlayu nganti pirang-pirang mil.",Tine dadi tim kanthi wektu paling apik saka sapa wae.,Tine lungguh ing sofa lan mangan permen tinimbang nyoba metu.,1
706,Aku kerep mburu.,"Wektu aku mulih, aku mburu ing wayah wengi.",Aku meneng suwé.,"Akiré, aku ndelok ana sing obah ing peteng.",Aku ora nggatèkké lan mulih.,Iku rusa sing aku bisa kanggo stalk lan nembak kasil.,2
707,Jack lan Chad mudhun saka Tembok Grand Canyon.,"Jack mandheg kanggo motret, banjur mlengkung kanggo njupuk sudut tembakan sing apik.",Jack ora sengaja lungguh ing kaktus.,Jarum saiki wis macet ing celonone Jack.,Butuh wektu 20 menit kanggo nyopot jarum lan terus munggah.,Jack bisa munggah tanpa rasa ora nyaman.,1
708,"Amy, Lynn lan Kim mlaku menyang toko cedhak omahé Lynn.",Nalika ana padha weruh crush Lynn kang Jim.,Dhèwèké dadi juru tas ing toko.,Wong-wong kuwi mandheg lan omong-omongan karo dhèwèké.,Jim ngajak Lynn metu.,Lynn ngandhani Jim yen dheweke ora apik.,1
709,Riley ora pati disenengi ing sekolah.,Dhèwèké nganggo sandhangan sing lucu.,"Ing sawijining dina, kancané ngusulaké supaya padha ngganti dandanané.",Riley setuju kanggo nggawe awake dhewe liwat.,Riley luwih apik lan ditampa kanthi apik.,Riley ora dadi kanca manèh.,1
710,Ann lagi ngandhut.,Dheweke seneng banget ngerti iki amarga dheweke mesthi kepengin duwe bayi.,"Rong sasi sakwisé kuwi, dhèwèké keguguran.",Dhèwèké dadi trauma banget.,Ann ora seneng.,Ann seneng merga ora ngandhut.,1
711,Aya péngin dadi modhèl.,Dheweke ngira dheweke duwe kesempatan amarga dheweke kurus lan ayu.,"Dadi, dhèwèké mèlu kontès modhel taunan ing kutha asalé.",Dhèwèké kaget merga menang.,Aya seneng banget karo asil kontes kasebut.,Aya banget nesu karo asil kontes kasebut.,1
712,Jared diukum seminggu.,Dhèwèké ora tau ngresiki kamaré.,Wong tuwané kandha nèk dhèwèké éntuk cuti kanggo ngresiki.,Dheweke mlaku-mlaku ngubengi omah kabeh.,Wong tuwané mènèhi cuti telung dina.,Wong tuwané ngusir dhèwèké saka omah.,1
713,Ana sing lagi mlaku menyang sekolah ing sawijining dina.,Dhèwèké mlebu ing dalan gedhe.,"Ora suwé, ana mobil sing nyemplung ing mobil kuwi lan nabrak dhèwèké.",Anna kepecut lan sikilé patah.,Anna nuntut wong-wong mau nanging ora entuk apa-apa amarga ora duwe asuransi.,Anna lunga menyang klub lan nari nganti sewengi.,1
714,Dave ngumpulaké kabèh sandhangané.,Dheweke njupuk dina iki mung supaya bisa ngentekake ing pantai.,Nalika piyambakipun tindak njaba piyambakipun manggihaken iku akeh peteng.,Langit kebak méga badai ireng.,Dave dadi kuciwa banget!,Dave seneng banget!,1
715,Ron lan Kim péngin nduwé omah anyar.,Ron mutuské kanggo kerja lembur sak isa-isané.,"Ing sawetara taun, dheweke wis ngirit kabeh gaji lembur lan duwe akeh dhuwit.",Dhèwèké lan Kim mulai tuku omah sing luwih gedhé.,Wong loro kuwi tuku omah sing apik ing lingkungan sing anyar.,Wong loro kuwi tuku mobil sport nganggo dhuwit kuwi.,1
716,Aku nulis ebook sing butuh sampul.,Aku nggawé pirang-pirang sampul buku nganggo Photoshop.,Aku wis nyritakaké hasil ciptaanku marang wong-wong liya.,Aku njaluk wong milih Cover A utawa Cover B.,Aku ora duwe komputer.,Akèh wong seneng karo Cover A.,2
717,Kita tuku cat post anyar minggu kepungkur.,Sing lawas wis rusak banget.,Kucing kita seneng banget milih.,Yen pos kasebut ora digawe saka sisal dheweke bakal nolak.,Kucing mau nampa pos anyar sing digawé saka sisal.,Kucing ora gelem nampani cagak anyar sing digawé saka sisal.,1
718,Daniel kepéngin dadi penulis.,Daniel nggawé situs web kanggo masang artikel sing ditulis.,Situs web iki alon-alon dibangun lan entuk perhatian.,Dhanièl ora isa mbangun lan ngrebut kutha kuwi.,Daniel ora seneng nulis.,Daniel kudu nggolèk gawéan sing nyata.,2
719,Jeff nyekel bal basket ing tangane.,Gary wis nglambrang tangan ing udhara wiwit iku mbukak kanggo nembak.,Jeff ora nggatèkaké lan mlayu menyang balung.,Ana wong loro sing njaga.,Para penjaga nyolong bal saka Jeff.,Gary matur nuwun merga aku wis mikirké dhèwèké.,1
720,Bapak ngajak kita menyang alas kanggo kemah.,Dhèwèké mulang carané nggawé geni nganggo kayu.,Dhèwèké mbantu awaké dhéwé sinau carané nggawé kémah dhéwé.,Aku lan bojoku turu merga lagi ngitung lintang ing langit.,Kita ora bakal kemah maneh.,Kita seneng banget nalika kemah.,2
721,"Ing akhir minggu, aku lunga menyang pasar lokal.",Aku wis mriksa sawetara barang sing didol.,Ana sing ngedol sayuran lan jus jus kanthi diskon 50%.,Aku njupuk sawetara barang lan lunga menyang kantor.,Aku seneng nggolèk tawaran sing apik.,Aku mutuské kanggo mbuwang bal-balanku ing papan.,1
722,Joey nyambut gawé kanggo perusahaan sing apik nanging jam kerjaé dikurangi.,Perusahaan kasebut ujar manawa dheweke kudu ngeculake dheweke lan ngeculake dheweke.,Joey langsung nggolèki gawéan liya.,Dheweke wis hard wektu nemokake karya nanging menehi proyek nelusuri dheweke kabeh.,Joey pungkasanipun nampa telpon saka juragan lan entuk proyek kasebut.,Joey ngentèkaké dina-diné main game video.,1
723,Joe urip sepi.,Dheweke ora nate nindakake apa-apa kajaba nonton TV.,"Ing sawijining dina, dhèwèké mutusaké kanggo ketemu wong ing craigslist.",Dhèwèké isa nduwé kanca anyar.,"Joe pesen sawetara saluran kabel anyar, nanging isih ora seneng.",Dheweke luwih seneng saiki yen dheweke duwe sawetara kanca ing uripe.,2
724,Amy tansah stres banget.,Kanca nyaranake dheweke nyoba meditasi.,"Amy ora yakin, nanging gelem nyoba.",Dheweke lunga menyang kelas lan ambegan lan fokus.,Dheweke wiwit mulang meditasi ing dina sabanjure.,Iki mbantu kahanan mental dheweke banget.,2
725,Nya nyoba mangan kanthi sehat lan ngawasi bobot awak.,"Nanging ing sawijining wengi, dhèwèké kepéngin mangan panganan sing nyenengké.",Dhèwèké mutuské kanggo pesen pitik goreng lan kentang tumbuk.,Dheweke mangan panganan sing lemu lan lemu kanthi enak.,Nya mutusaké kanggo mangan sing padha saben dina.,Nya mengko getun mangan panganan sing ora sehat.,2
726,Kancaku sing manggon bareng karo aku lara.,Dhèwèké ora kerja lan ora sekolah.,Dheweke turu sedina muput.,"Ing dina kuwi, dhèwèké ngrasa luwih apik.",Dhèwèké mutuské nèk istirahat kuwi mbantu.,Dhèwèké péngin cepet lara manèh.,1
727,Ted lan kanca-kancané lunga menyang taman kanggo munggah gunung.,Wong-wong kuwi mulai mlaku-mlaku.,"Sawise rong jam, dheweke kesel lan ngaso.",Wong loro kuwi wis rampung munggah gunung lan wis tekan puncak.,Ted mlebu mobilé lan nyopir mulih.,Ted seneng banget merga para sedulur kuwi teka.,2
728,"Biasane tenang lan anget ing wayah esuk, ing Florida.","Nanging, esuk wingi angin banget.","Godhong wit kurma sing ditiup banget, nganti ngiris-iris jendhela.",Aku nguripake TV lan tandha tornado teka!,Tornado teka ing 2 blok omah!,Aku banjur metu arep dolanan.,1
729,Aku wis ing kick seni akhir-akhir iki.,Aku nampa buku instruksi nggambar kanggo Natal.,Buku iki nduwé daftar blanja kanggo bahan-bahan gambar sing dibutuhké.,Dina wingi aku lunga menyang toko lan tuku apa sing dibutuhake.,Aku mutusaké aku ora seneng nggambar.,Aku mulih lan nglatih nglukis.,2
730,Lisa wiwit nyadari yen dheweke ora seneng sinau bisnis.,"Dhèwèké péngin sinau seni, nanging kuwatir bab anggoné nggolèk dhuwit.","Akiré, dhèwèké wani mandheg sekolah.",Kanca lan kulawargane kandha yen dheweke ora bisa sekolah.,Lisa isih yakin nèk pilihané bakal nggawé dhèwèké bahagia.,Lisa wis lulus ing bidang bisnis.,1
731,Mary kepéngin nonton filem ing wayah sore.,Sayange dheweke sekolah lan wong tuwa sing ketat.,Dhèwèké ngentèni nganti kabèh wong turu lan nyolong metu.,Dhèwèké nonton film kuwi karo kanca-kancané lan seneng banget.,"Wektu wong tuwané nangkep dhèwèké, dhèwèké ora éntuk mlebu omah.",Kanca-kanca Mary kuciwa banget karo dheweke.,1
732,Ivy wis diundang ing tanggal ora konvensional.,Peter sing dhèwèké tresnani wis ngajak dhèwèké lunga!,Ivy setuju karo kuwi.,Wong loro kuwi lunga menyang alas lan mlaku nganti pirang-pirang jam.,"Sakwisé kuwi, wong-wong kuwi ndelok srengéngé surup saka bukit.","Ivy bali menyang omah, lan ora nate ngomong karo Peter maneh.",1
733,Ana wong sing ngrancang menara paling dhuwur ing donya.,Dhèwèké ngrancang arep nggawé gedhong iki dadi gedhong sing dhuwuré tikel loro.,Dhèwèké mènèhi rancangan kanggo pembangunan.,Pengembang takon marang sepira dhuwuré menara kasebut.,Wong kuwi dudu perancang bangunan.,Wong iku mbangun menara lan iku grand.,2
734,Lauren lan adhine ngunjungi Jacksonville Florida minggu iki.,"Ing dina pungkasan perjalanan, wong loro mau kepéngin foto bareng.",Lauren lan adhine pose ing ngarep kafe sing lucu.,Dhèwèké nggawé gambar kuwi lan ngirim siji kanggo saben sedulur wédok.,Dheweke gumun banget karo dheweke lan adhine.,Dhèwèké nyuwèk-nyuwèk gambaré lan mbuwang.,1
735,Liz lagi ngopeni bocah lanang umur 5 taun.,Dheweke kepengin main ndhelik lan golek.,"Dhèwèké ketemu karo dhèwèké ping pirang-pirang, nanging dhèwèké banjur ilang.",Dhèwèké dadi bingung merga nggolèki ing omah.,Liz bosen karo dolanan lan turu sedina.,"Wektu krungu dhèwèké ngguyu saka lemari, Liz lega.",2
736,Mark telat nyambut gawé.,Dhèwèké nyoba kanggo nggayuh wektu kanthi nyopir liwat wates kacepetan.,Pulisi lalu lintas mandheg.,Dhèwèké ditampa karcis amarga ngebut.,Mark akhiré telat kerja.,Mark wis mangkat kerja luwih dhisik.,1
737,Amy mesthi kepengin main suling.,"Dina kapisan ing band, dhèwèké kandha karo guru.",Dhèwèké latihan nggunakké suling saben dina suwéné seminggu.,Iku banget angel kanggo muter suling.,Amy kuwi setya banget.,Amy ora pati seneng karo suling.,1
738,Bryan lagi tuku woh-wohan kanggo keluargané.,"Dhèwèké ndelok kabèh buah ing sacedhaké lawang, ning ora éntuk milih siji.","Bojoné sengit anggur, anaké sengit apel.",Malah putrané uga seneng mangan woh-wohan!,Bryan tuku pasta.,Bryan mutusaké arep tuku pisang.,2
739,Emily nggawa anake menyang kebun binatang.,"Wong-wong kuwi ndelok akèh kéwan, klebu singa.",Anaké wedi banget karo singa.,Dhèwèké mulai njerit lan nangis.,Anaké Emily mlaku nyedhaki singa-singa kuwi.,Emily ngangkat anaké kanggo nglipur.,2
740,Kim bisa duwe anak kirik yen dheweke entuk basket ing game kasebut.,Dhèwèké latihan sedina muput ing omah.,Dhèwèké latihan ing gym sakwisé sekolah karo timé.,"Akiré, dina sing penting wis teka.",Kim damel gol lan pikantuk anak anjing.,Kim nesu banget wektu keluargané éntuk anak asu.,1
741,Karen kuwi pemain bola alus.,Timé ora apik.,Pelatihé mènèhi ceramah sing nginspirasi banget.,Saben uwong mulai latihan lan kerja luwih keras.,Karen dadi luwih apik karo tim.,"Sakwisé ngrungokké ceramah kuwi, Karen ora nduwé semangat manèh.",1
742,Kayla wis ora tau ing acara sosial ing meh telung taun.,Dhèwèké ngalami rasa kuwatir sing ngrusak.,"Saya suwé dhèwèké ora sesambungan, saya angèl.",Seduluré kuwatir lan nggawa dhèwèké menyang ahli terapi.,Kayla mikir nèk kuwi kencan sing paling apik.,Kayla ngandhani ahli terapi nèk dhèwèké péngin bunuh diri lan njaluk tulung.,2
743,Ricky tiba nalika mlaku-mlaku ing alas.,Dhèwèké wedi banget!,Dheweke panginten wis tiba menyang patch saka Poison Ivy.,"Banjur, dhèwèké nggunakké buku bab alamé kanggo nemtokké tanduran kuwi.",Dhèwèké lega merga ngerti nèk dhèwèké salah.,Ricky wis teles saka tiba ing blumbang.,1
744,Suamiku seneng es krim Blue Belle.,"Ora suwé, Blue Belle kelingan lan mandheg prodhuksi.","Anakku kerja ing Kroger, dheweke bubar duwe rapat babagan Blue Belle.",Es krim Blue Belle teka ing Kroger minggu kepungkur.,Suamiku seneng banget!,Suamiku kecewa banget!,1
745,Oni durung tau tampil ing ngarepé penonton.,Nanging dhèwèké mèlu acara bakat kuwi kanthi pangarep-arep menang hadiah gedhé.,Dhèwèké mikir nèk dhèwèké mung kudu ngupaya sing paling apik.,Oni nyanyi ing acara kasebut lan kabeh wong ngalem.,Oni menang ing pertunjukan bakat kanthi nyanyian sing apik banget.,Pameran bakat ngandhani Oni supaya ora bali maneh.,1
746,Ralph sengit karo blanja.,Ibuné sing nggawé dhèwèké lunga.,Wong-wong kuwi wis suwé ana ing kono.,Ralph mbantu ibuné mbukak lan mbongkar barang-barang.,Ibuné Ralph ngukum dhèwèké merga ora gelem mbantu.,Dhèwèké kaget wektu ibuné mènèhi dhuwit kanggo mbantu.,2
747,Kayla nyilih buku saka adhine.,Dhèwèké nggawa buku kuwi menyang warung kopi kanggo diwaca.,Kayla ora sengaja ngucuraké banyu vanilla latte ing buku kuwi.,Dhèwèké langsung mulih lan ngandhani adhine.,Kayla kuwi anak tunggal.,Seduluré wadon kuwi nesu banget!,2
748,Lenny kepéngin nonton filem.,Dheweke mlayu menyang video Hollywood lokal.,Lenny nyewa telung film horor.,Lenny lunga menyang toko sebelah lan tuku pizza.,Dheweke bali menyang omah lan nonton kabeh film.,"Wektu tekan omah, dhèwèké siap-siap mbalekké telung filmé.",1
749,Laura nyritakake bab bra sing kobong ing taun 60-an.,Wong akeh dadi edan sawise ngerti informasi pribadi iki.,Laura njamin wong akèh nèk kuwi wis suwé banget.,Dheweke menehi tawaran kanggo Presiden.,Laura banjur diadili dening negara kasebut.,Laura banjur dipilih déning negara.,2
750,Charlie kepéngin dadi petugas polisi ing Hawaii.,Dhèwèké lulus ujian lan dipunginaaké ing Honolulu.,Charlie seneng sesambungan karo masyarakat.,Charlie ora seneng karo jumlah korupsi ing pasukan kasebut.,Charlie wiwit njupuk suap.,Charlie sumpah bakal ngowahi kahanan yen dheweke dadi kepala.,2
751,Aku nduwé asu loro sing akrab banget.,Anjing sing luwih tuwa lara banget lan dileksanakake.,Anjing sing luwih enom kuwi kesepian banget.,Anjing tanggane teka kanggo dolanan.,Anjing kita seneng banget nèk omahé mung diduwèni dhèwèké.,Anjing kita luwih seneng dolanan karo asu liyane.,2
752,Kanca-kanca Sean nyadari yen sandhangan lan kasur wiwit mambu.,Wong-wong mau kandha yèn dhèwèké kudu ngresiki klambi-klambi sing wis dibasuh.,"Sean mbantah dhisik, nanging pungkasané ngresiki klambine.",Kanca-kancané sing manggon ing kamar padha bungah merga Sean ora mambu kaya mbiyèn.,Kanca-kancané Sean dadi nesu merga ora ngrungokké.,Wong-wong kuwi kandha nèk dhèwèké ora perlu ngentèni nganti suwé manèh kanggo ngumbah.,2
753,"Kancaku kepengin dadi dhokter, mula dheweke njupuk MCAT.","Wektu pertama, dhèwèké ora éntuk skor sing apik.",Dhèwèké sinau tenanan lan gelem manèh.,"Ning, dhèwèké isa nindakké sing apik banget.","Dheweke ora nate ngrembug maneh, lan ora dadi dokter.",Kita ngajak dheweke ngombe kanggo ngrayakake.,2
754,Kelly lunga menyang samodra kanggo ngendhokke.,Dheweke langsung lunga lan sijine sikil ing.,"Nanging, nalika dheweke mlaku, gelombang kasebut nyekel dheweke.",Sandhangané dadi teles.,Kelly mulih kanggo ganti klambi garing.,Kelly seneng banget yen klambi wis teles.,1
755,Ben seneng banget arep mancing karo mbah kakungé sing sepisanan.,"Nanging, dhèwèké rumangsa ora seneng karo wong-wong sing nggunakké cacing kanggo nggodha.",Dheweke uga ora sengaja nyuduk driji nganggo salah sawijining pancing.,"Ora let suwé, Ben sadhar nèk dhèwèké ora seneng mancing.",Ben takon marang mbah kakungé kapan dhèwèké isa mancing manèh.,Ben takon marang mbahé apa dhèwèké isa nonton filem.,2
756,Amelia lagi siyap-siyap kanggo kencan ing restoran Italia sing apik.,Kanca saka Amelia wis ngatur dheweke ing tanggal wuta minggu sadurunge.,Dhèwèké teka ing restoran luwih dhisik lan ngentèni kancané.,"Telung puluh menit wis kliwat, nanging pacaré ora teka.",Amelia bali menyang omah.,Amelia seneng banget.,1
757,Ibune kepengin banget njupuk gambar bocah karo Santa.,Bocah kuwi wedi lan ora gelem.,Ibuné ngandhani bocah lanang kuwi nèk Bapak Natal sing nggawa hadiah.,Iki nggawé bocah kuwi malih pikirané.,Bocah kuwi péngin éntuk akèh hadiah saka Santa!,Bocah kuwi lunga tanpa difotograf.,1
758,Stewart nyoba ngrampungaké tugas favorité sadurungé turu.,"Dhèwèké dadi sibuk banget, nganti lali njaga geni.",Dhèwèké ngguyang-guyang lan nyandhang selimut.,Dheweke dadi banget anget lan isi.,"Nalika tangi, hawa adhem banget.",Stewart seneng merga ora lali njaga geni tetep murub.,1
759,Anthony péngin sinau cara ngomong nganggo basa Spanyol.,"Dhèwèké nemokaké kursus basa Spanyol ing Internet, lan ndaftar.","Anthony sinau kanthi tenanan, lan pungkasané isa sinau basa kuwi.",Saiki Anthony wis lancar nganggo basa Spanyol.,Anthony dadi sukses amarga kemampuan basa.,Anthony ora bisa ngerteni basa kasebut kanthi bener.,1
760,Amy lunga menyang toko bahan pangan sakwisé kerja.,Dhèwèké nduwé dhaptar barang-barang sing arep dituku.,Toko kuwi wis entèk setengah barangé.,Amy kudu lunga menyang toko panganan liya.,Dheweke tuku rong rok lan blus.,"Sakwisé kuwi, dhèwèké isa mulih lan masak panganan sing enak.",2
761,Joanie siap-siap nggosok rambuté kanggo kencan.,Dhèwèké nesu merga ora ana mesin cuci endhasé.,"Banjur, Joanie krungu swara sing dingertèni saka njaba.",Dheweke weruh sedulure nggunakake blow dryer.,Joanie seneng karo seduluré.,Joanie mlayu metu kanggo ngadhepi seduluré.,2
762,Cornelia mutusaké arep ndandani apartemèné.,Katil dheweke wis ngadeg jejere tembok kanggo akeh taun.,Cornelia nggeser kasuré kanggo lungguh ing cedhak jendela.,"Wektu kanca-kancané ndelok cara anyar nyusun lagu, wong-wong kuwi seneng banget.",Cornelia banjur mbalèkaké kasuré.,"Ora let suwé, kanca-kancané uga padha-padha nggawé kasur.",2
763,Tim seneng banget karo motoré.,Dhèwèké numpak sepedha kuwi kapan waé isa.,Nganti minggu kepungkur nalika dheweke nabrak.,"Saiki, dhèwèké meh ora tau numpak.",Tim rumangsa aman wektu numpak sepedhah motor.,Tim wedi numpak motor.,2
764,Wendy éntuk tugas kapisan dadi perawat ing omah perawatan.,Dhèwèké seneng banget karo gawéan kuwi lan nduwé hubungan sing apik karo para penduduk.,Dhèwèké seneng banget omong-omongan karo wong wadon tuwa sing cilik.,"Ing sawijining dina, wong wadon kuwi nduduhké gambar anak-anaké.",Wendy mlayu metu saka kamar kanthi nangis.,Wendy seneng ndelok foto-foto kuwi.,2
765,Tom lan Jake lunga menyang konser.,Wong-wong kuwi nonton musik sing disenengi.,Wong-wong kuwi mlebu ing ruang umum.,"Sawetara wong sing dhuwur banget ngadeg, mula ora bisa ndeleng apa-apa.",Tom lan Jake banjur ora bisa ndeleng band favorit.,Tom lan Jake seneng karo pemandangan sing apik.,1
766,Lester bangga nèk wis pirang-pirang taun ora nggunakké ponsel.,Dheweke seneng mikir yen dheweke kurang gumantung karo teknologi tinimbang wong liya.,"Nanging, ing sawijining dina, mobilé dipatèni ban lan dhèwèké péngin nduwé telpon.",Dhèwèké ora péngin ngalami pengalaman kaya ngono manèh.,Lester terus urip tanpa ponsel.,Lester metu lan tuku ponsel sing paling apik.,2
767,Ben butuh ngganti lenga ing mobilé.,Dhèwèké ngerti nèk kuwi larang banget.,Banjur dhèwèké ndelok kupon ing koran.,Ben nyopot lan nggawa menyang garasi.,Ben bisa ngowahi lenga.,Ben ngedol ginjel kanggo crack.,1
768,Aku tangi kanthi luwe.,Aku ngiseni mangkuk sereal nanging ora duwe susu.,"Sawise mikir babagan nggunakake banyu, aku mutusake arep menyang toko.",Aku mlaku menyang pojok lan njupuk setengah galon 2%.,Aku mulih lan mangan sereal.,Aku mulih lan mangan pizza.,1
769,Anna nduwé bak iwak banyu asin.,Dheweke mung njaga karang ing kono.,Banjur dhèwèké mutusaké dhèwèké uga kepéngin iwak.,Dhèwèké tuku iwak badut cilik lan pemicu.,Ora let suwé Anna bali nggawa iwaké menyang toko.,Saiki Anna duwe tank sing maneka warna kanthi iwak lan karang.,2
770,Holly iku kucing ireng sing éndah sing ditresnani Lee.,"Sedih, Holy lara banget lan Lee kudu nglembutake dheweke.",Lee sedhih banget amarga saben dina ora ketemu Holly.,"Sawijining dina sakwisé kuwi, ana kucing ireng cilik teka ing ngarep omahé Lee.",Lee mutusaké kanggo nganggo anak asu.,Lee mutusaké kanggo ngadopsi kucing.,2
771,Bob butuh kaos kaki anyar.,Dhèwèké lunga menyang toko kanggo tuku.,Ing toko kuwi ana diskon sing gedhé.,Dhèwèké tuku barang-barang sing apik.,Bob seneng banget karo plancongan blanja.,Bob mbalèkaké kabèh barang-barang ing dina candhaké.,1
