,input_sentence_1,input_sentence_2,input_sentence_3,input_sentence_4,sentence_quiz1,sentence_quiz2,answer_right_ending
345,Ben nikah karo kekasihé saka sekolah menengah.,Padha nikah kanggo akeh taun.,"Ing sawijining dina, Ben sadhar nèk uripé ing omah ora nyenengké.",Dhèwèké mutuské nduwé hubungan sèks.,Bojoné bangga karo dhèwèké.,Bojoné ngerti lan banjur pegatan.,2
346,Siji wong totohan liyane sing bisa outstare bebek.,Ana bebek sing ditemokaké lan ditonton.,"Sanajan bebek ora ngerti apa sing kedadeyan, dheweke ora kedhip.","Nanging, mripaté udan nganggo membran nictitating.",Wong lanang kuwi akhiré mripat.,Wong kuwi péngin kélangan taruhané.,1
347,Shay lunga menyang taman laut.,"Ing kono, dhèwèké ndelok ana papan sing ngumumké nèk ana lumba-lumba sing nglangi.",Shay kanthi semangat nyerahake $ 40 lan nyandhang.,Banjur dhèwèké mlumpat ing kolam kanggo nglangi karo lumba-lumba.,Shay seneng banget.,Shay ora seneng karo lumba-lumba.,1
348,Lia lunga menyang Inggris.,Dhèwèké numpak bis.,Turé mandheg ing Stonehenge.,Lia metu saka bis kanggo ndelok.,Lia ora seneng lunga menyang Inggris.,Lia njupuk akèh foto Stonehenge.,2
349,Aku lagi ngombé jus.,Cangkirku tumpah ing konter.,Aku nggolèki apa-apa kanggo ngresiki tumpahan.,Aku nemu paket kertas handuk.,Aku ngresiki kekacoan.,Aku ninggalke kekacoan lan nggawe sandwich.,1
350,Arthur lan kanca-kancané lagi nongkrong.,Wong loro kuwi ngombé bir lan omong-omongan.,"Dumadakan, biré dadi entèk.",Arthur ora gelem njupuk sing terakhir.,Arthur rumangsa seneng merga wis éntuk sing terakhir.,Arthur pesen manèh kanggo kanca-kancané.,2
351,Hester mesthi seneng rambuté katon lurus.,"Ing sawijining dina, dhèwèké diundang kanggo teka ing acara pembukaan galeri seni.",Dhèwèké mutusaké kanggo nyetel rambuté kanggo acara kasebut.,Kancané kabèh ngalem marang dhèwèké merga katon apik.,Hester bangga karo penampilané.,Hester ngethok sirahé.,1
352,Jill kepéngin tuku mobil anyar.,Jill nyopir mobil lawasé menyang dealer mobil.,Penjual kuwi ngganti mobil lawasé Jill nganggo mobil anyar.,"Sakwisé mbayar wong sing dodol, Jill éntuk mobil anyar.",Jill seneng banget.,Jill ngalami depresi.,1
353,Jaden kuwi gampang lali.,Dheweke ora weruh yen wis dina Valentine.,"Merga rumangsa cepet-cepet, dhèwèké metu lan njupuk kembang lan coklat.",Pacar Jaden teka ing omah lan nemokake panganan.,Pacar Jaden ditampar.,Jaden wis nylametaké dina.,2
354,John entuk sepedha kanggo ulang taune.,Dheweke ora ngerti carane nunggang.,Dhèwèké latihan seminggu suwéné.,"Ing pungkasan minggu, dhèwèké ngethok rodha-rodha sing mbantu.",Dhèwèké isa numpak sepéda tanpa nganggo piranti kuwi.,"Dhèwèké sadhar yèn numpak sepedha kuwi ora kanggo dhèwèké, lan banjur turu sedhela.",1
355,Quentin ora tau numpak prau sak umuré.,"Ing sawijining mangsa panas, Quentin diundang kanca kanggo manggon ing omahé ing tlaga.","Wektu ana ing kono, Quentin lan kancané lunga kanggo nglayar.",Kuwi pengalaman sing nyenengké.,Quentin seneng merga dhèwèké gelem mèlu.,Quentin sumpah ora bakal nglayar manèh.,1
356,Ana wong lanang sing pesen pancake ing restoran saka server.,Dhèwèké nggawa piring pancake sawetara menit sakwisé kuwi.,Wong lanang kuwi sambat nèk pancake kuwi kandel banget.,Pelayan kuwi nggawa bali kanggo juru masak.,Wong masak kuwi ngalem dhèwèké.,Tukang masak mutusaké kanggo nggawe pancake maneh.,2
357,Anak-anakku péngin nduwé kéwan ingon.,"Minangka kulawarga, aku lan bojoku mutuské nèk kuwi pancèn gagasan sing apik.",Aku lan bojoku banjur lunga menyang papan perlindungan kéwan kanggo nggolèki kanca sing anyar.,"Wektu tekan kono, aku ketemu karo wong kulit ireng sing langsung tak tresnani.",Kita mutusake yen laboratorium ireng ora kudu mulih karo kita.,Kita diadopsi laboratorium ireng lan njupuk dheweke mulih.,2
358,Kembang-kembang ing kebonku wis mati.,Dheweke wis layu lan garing amarga srengenge.,Kancaku teka kanggo mbantu ngevaluasi apa sing salah karo tanduranku.,Dhèwèké ngerti nèk butuh banyu luwih akèh.,"Sakwisé ngombé luwih akèh, tanduranku katon luwih apik ketimbang biyèn.",Aku ora nyiram maneh.,1
359,Jill lagi main game video karo adhine.,Jill nesu merga kalah saben pertandingan.,Jill njupuk controller game lan dibalèkaké ing TV.,Layar TV pecah ing tengah.,Jill lan mbakyuné ora bisa main game video manèh.,Jill dadi luwih pinter main game.,1
360,"Aku mulai nonton ""Buffy the Vampire Slayer"" kanthi seneng.","Sakwisé pirang-pirang jam, aku krasa péngin mlayu.","Sayange, ing njaba peteng.",Aku ngadeg ing ngarep lawang sedhéla.,Banjur aku turu nganti esuk.,Banjur aku mbayangake yen aku Buffy lan mlayu.,2
361,"Ing umur 12 taun, Drew mutusaké kanggo dadi kriminal.",Dhèwèké mutuské arep ngrusak omah lan ngrusak lawang.,Dhèwèké nglatih nggepok lawang lemari kanggo mbangun kekuwatane.,Ibuné teka ing omah lan ndelok kabèh lawang lemari rusak.,Drew tansah kepengin manut karo hukum.,Ibuné nesu banget.,2
362,"Wis suwé, saben-saben aku nggawé endhog rebus, endhogé ora enak.",Aku nggoleki kabeh internet kanggo solusi kanggo masalahku.,"Ana situs web sing nyaranké aku nggorèkké endhogku, dudu nggodhok.",Aku mung nglakoni apa sing dijaluk.,Endhog panggang iku apik banget.,"Aku ora ngrusak cangkangé, lan mangan kabèh.",1
363,Ana bocah lanang sing weruh dhuwit recehan ana ing pinggir dalan.,Dhèwèké mbengok lan ngangkat.,"Wektu kuwi, ana bal sing ngleboni sirahé.","Dhèwèké ndelok ing sakubengé, terus ndelok mungsuhé sing gedhé kuwi nyekel jerami.",Bocah kuwi matur nuwun banget.,Bocah kuwi nesu.,2
364,Hector ngerti nèk mung siji kupingé sing isa ngrungokké swara.,Dheweke pengin njaluk pasangan anyar supaya bisa ngrungokake musik.,"Pungkasane, dheweke nemokake headphone sing apik sing bisa dituku.",Dheweke tuku lan langsung wiwit ngrungokake musik.,Hector mutusaké ora seneng musik.,Hector seneng merga kupingé loro-loroné isa ngrungokké.,2
365,Tom kepéngin nonton pertandingan New York Giants.,"Nanging, tiketé larang banget.","Akiré, dhèwèké nemokké tiket sing regané cocog karo dhèwèké.",Dhèwèké akhiré lungguh ing dek ndhuwur.,Dhèwèké seneng nonton pertandingan kuwi.,Tom mikir iku game hoki paling apik.,1
366,Trip seneng karo semangka.,Dhèwèké mangan paling ora siji saben dina.,Ibune tansah ngandhani yen dheweke bakal tuwuh wit ngulu wiji.,Dheweke tansah nguntal mau.,Trip seneng karo rasane wiji kasebut.,Trip mandheg mangan semangka.,1
367,"Angie, sawijining buruh MTurk, nganggep awake dhewe sregep.","Ing sawijining dina, salah siji saka para penglamar sing paling disenengi nolak karyane.",Angie kaget banget lan ngirim email.,Wong-wong kuwi njawab nèk gawéané ora cukup apik.,Angie mutusaké kanggo ngandhani panyuwunan kanggo nolak luwih akeh karyane.,Angie nyoba kanggo ngrembug masalah ing rinci.,2
368,Donovan ngajak Trina mèlu nari.,"Trina seneng karo Donovan, mula dheweke setuju nanging dheweke kuwatir banget.","Sawisé sekolah, dhèwèké mlayu mulih njaluk tulung marang bapaké.","Wektu bapaké teka ing omah, dhèwèké nerangké kahanané lan bapaké mesem.",Bapaké Trina ngécé Trina.,Bapaké Trina mulang dhèwèké carané nari.,2
369,Andy tansah kepéngin sepeda bocah gedhé.,"Nalika umuré nem taun, dhèwèké njaluk sepéda kanggo ulang tauné.",Dhèwèké ora ngerti carane numpak sepedha.,"Ing dina ulang taune Andy, ibune menehi sepedha.",Andy nangis pirang-pirang jam.,Bapakipun ngajaraken carane numpak.,2
370,Suzy lunga menyang toko es krim.,Dheweke pesen milkshake vanila.,"Wektu dhèwèké arep mbayar wong lanang kuwi kanggo milkshake, wong lanang kuwi mesem.",Dhèwèké kandha nèk dhèwèké menang ing kontès khusus.,Dhèwèké kandha yèn dhèwèké utang 60 dolar.,Dhèwèké mènèhi milkshake gratis.,2
371,Ned lan kanca-kancané lunga menyang pameran.,Dhèwèké nggunakké dhuwité sing pungkasan kanggo tuku gulali katun sing alus.,"Nalika mlaku adoh, dheweke weruh bocah lanang sing nangis.",Dhèwèké ngeculaké gulali ing blumbang.,Dadi Ned menehi gulali katun dhewe.,Dhèwèké tuku gulali kanggo bocah lanang kuwi.,1
372,Sebastian nggatèkaké yèn ing njaba ana srengéngé lan anget.,Dhèwèké nduwé tugas.,Dhèwèké ora péngin nindakké tugasé.,Sebastian mutuské nèk ana ing njaba luwih apik.,Sebastian rumangsa kaya tetep ing dina sing.,Sebastian mlaku-mlaku ing njaba lan mlaku-mlaku.,2
373,Rashid kuwi sopir mobil sing apik banget.,"Ing sawijining dina, kakangné Rashid telat teka ing kantor.",Rashid nawaraké kanggo nyopir kakangné.,Wong-wong kuwi tekan kono kanthi wektu sing cukup.,"Seduluré bengok marang, lan slammed lawang.",Seduluré lanang matur nuwun.,2
374,Ali lunga menyang restoran panganan cepet lan mbayar nganggo kertu kredit.,Kasir njupuk wektu sing suwe kanggo nggawa kertu kasebut.,"Sawetara dina sabanjuré, Ali nemokaké transaksi sing ora biasa ing kertu kredité.","Dhèwèké ngubungi banké, sing mbatalake biaya.",Dhèwèké mikir apa kasir kuwi nyolong informasié.,Dhèwèké matur nuwun marang juru kunci panganan cepet.,1
375,Aku nggoleki lukisan sing apik kanggo ruang tamu.,Mulane wingi aku metu looking.,Aku pungkasanipun ketemu siji ayu aku tresna.,Lukisan kuwi nggambarké air terjun.,Aku mutusaké ora tuku lukisan kuwi merga aku ora seneng.,Aku tuku lan nggawa menyang omah.,2
376,Aku kepéngin dipromosikaké.,Aku mutuské arep dipromosikké.,"Sajrone taun, aku kerja keras.",Bosku ngerti lan ngundang aku ing kantoré.,Bosku langsung ngecopot aku.,Aku éntuk promosi sing tak péngini.,2
377,Maggie lan wong tuwané arep pindhah menyang kutha anyar.,Maggie gugup merga ora kenal sapa-sapa.,"Sanalika dheweke pindhah ing, dheweke tindak watara ngenalaken piyambak.",Dhèwèké akhiré nduwé kanca.,Maggie sedhih lan kesepian.,Maggie seneng karo kutha anyar.,2
378,Dan lagi mlaku mulih saka sekolah lan weruh jendhela.,Ana set sepur ing jendhela toko.,Dan kepéngin banget bisa duwé set sepur iki.,"Nalika Dan teka ing omah, ibuné ngandhani yèn dhèwèké nduwé kejutan.",Dhèwèké mènèhi Dan sepur.,Ibune Dan ngandhani supaya siyap sekolah.,1
379,Gina péngin nyolong kunci omahé ibuné.,Dhèwèké ngentèni nganti ibuné turu sedhéla.,Dheweke nggawa tas ibune menyang kamar mandhi.,Dhèwèké mbusak kunci saka ranté kanthi tenang.,Banjur Gina sijine tas tengen bali ngendi dheweke ketemu.,Banjur Gina ngandhani ibuné ngendi kunci.,1
380,Ana wong lanang saka Kentucky.,Dhèwèké tresna karo cah wadon sing manggon ing Louisiana.,Dhèwèké mutuské nèk kudu pindhah.,Dhèwèké pindhah kanggo ketemu karo wong sing ditresnani.,Wong lanang kuwi pindhah menyang Texas.,Wong lanang kuwi pindhah menyang Kentucky.,2
381,Tim ora lulus ing kelas matématika.,"Dhèwèké ngerti nèk ora lulus, dhèwèké kudu sekolah ing sekolah musim panas.",Dhèwèké sinau tenanan lan njaluk kredit tambahan.,"Ing dina pungkasan sekolah, dhèwèké ngerti nèk wis lulus!",Tim seneng banget.,Tim dadi kuciwa banget.,1
382,Mary-Anne rumangsa sepi lan mutusaké kanggo nganggo kucing.,Dhèwèké lunga menyang komunitas kemanusiaan lokal kanggo miwiti prosès kuwi.,"Nalika dheweke lagi nonton, salah sawijining kucing meowed dheweke.","Mary-Anne ngrangkul kucing, lan iku katresnan ing pandeleng pisanan.",Dhèwèké mutuské nèk kuwi dudu kucing sing bener.,Dheweke nggawa kucing mau mulih.,2
383,Aku wis tau olahraga senam nalika isih cilik.,Aku sinau balok imbangan lan nglakoni gerakan ing iku.,"Wektu aku ngliwati balok, aku salah ndharat.",Aku patah pergelangan kaki dan sakit banget!,Aku digawa menyang rumah sakit.,Aku tangi lan langsung bali menyang balok keseimbangan.,1
384,Ana enem asu sing mlaku-mlaku ing ngarep omahku.,Iku bakal dadi angel kanggo milih siji kita wanted kanggo tuku.,Saben anak wadon milih asu sing béda.,Sing nduwé kandha nèk awaké dhéwé isa éntuk diskon kanggo loro asu.,Saben wong tuku siji asu.,Aku lan bojoku ora seneng karo asu.,1
385,Johnny péngin owah-owahan saka uripé ing kutha gedhé ing Boston.,Dhèwèké mutusaké yèn dhèwèké bakal luwih seneng ing Heartland Amérika.,"Akiré dina kuwi teka, Johnny pindhah menyang Idaho.",Dhèwèké wis mlayu saka kutha gedhé.,Johnny wiwit ngrancang arep pindhah menyang Boston.,Johnny seneng ana ing kutha cilik.,2
386,Joan ora seneng mulih ing Natal.,Dhèwèké ngerti nèk ibuné bakal ngganggu uripé.,Taun iki nalika arep mulih dheweke ngalami kacilakan mobil.,Ibuné langsung marani kanggo nyukupi kebutuhané.,Ibuné Joan ora ngomong karo dhèwèké merga dhèwèké durung nikah.,Joan seneng banget ndelok pasuryan ibuné.,2
387,Aku nglampahi kabeh wektu kanggo nulis.,"Akibaté, aku dadi sepi.",Aku mutusaké kanggo nggabungake komunitas kencan online.,"Nalika aku gabung, aku ngerti yen aku ora seneng banget karo wong liya.",Aku mulai nulis luwih akeh.,Aku wis kerep pacaran.,1
388,Anakku dadi pramuka ing sekolah dhasar.,"Ing sawijining dina, dhèwèké lunga ing perjalanan sekolah.",Bojoku dadi pengiring.,Saben uwong nginep ing pondhok ing New Hampshire kanggo akhir minggu.,Anakku ora tau lali karo perjalanan sekolahé.,Aku lan bojoku mangan bareng wengi kuwi.,1
389,Dina iki ana pembukaan klub klub anyar ing pojok.,Aku ora sabar kanggo teka.,Nalika kita entuk ing klub iku ayu.,Aku lan bojoku pesen panganan sing enak lan nari.,Kita kekancan karo bouncer supaya kita bisa mlebu ing klub sesuk.,Wong sing jaga kandhang ora gelem nglebokké awaké dhéwé ing klub kuwi.,1
390,Wingi aku nggawa gelas anyar menyang pawon.,"Aku kaget, merga aku ngeculaké buku kuwi.",Kaca pecah.,Aku kudu njupuk.,Aku ngiris awakku ing bagéyan cilik.,Aku seneng karo kaca sing saiki katon kaya ngono.,1
391,Kulawarga Bill manggon ing bukit.,Ing kono ora tau ana udan utawa badai.,"Ing sawijining dina, ana angin topan sing nyebrang ing dhaérah kuwi.","Omahé Bill kena serangan, lan atapé dirobol.",Perusahaan asuransi mbayar biaya kanggo atap anyar.,"Wong-wong kuwi mutuské nèk ora butuh manèh, lan pindhah.",1
392,Allison mutuské arep sinau luwih akèh bab sajarahé dhaérah kuwi.,Dhèwèké lunga menyang perpustakaan kanggo maca buku bab kuwi.,Dhèwèké mlebu lan ora ngerti carané buku-buku kuwi disusun.,Dhèwèké ketemu karo juru perpustakaan sing nerangké sistem desimal Dewey.,Kuwi mbantu dhèwèké ngerti mobil endi sing ora dikarepké.,Kuwi mbantu dhèwèké nemokké apa sing diupaya.,2
393,Sebastian kepéngin main bal-balan ing tim kancané.,Dheweke ngomong karo kancane lan ngerti yen dheweke kudu latihan.,Dheweke latihan nyekel bal-balan ing omah kabeh minggu.,Dheweke lunga menyang latihan sabanjure lan nyetak gol.,Sebastian kuciwa amarga kinerja sing sukses.,Sebastian seneng merga wis sinau Alkitab.,2
394,Ing sawijining dina ana ibu sing kepéngin banget bayiné turu.,Dheweke mlaku-mlaku ngubengi nanging isih ora turu.,Dheweke menehi panganan nanging isih ora turu.,"Pungkasané, dhèwèké kèlingan lagu ninin sing wis dinyanyèkaké ibuné.",Ibu kanthi alus nyanyi lagu ninine kanggo bayine.,Ibu main hip hop kanggo bayiné.,1
395,Johnny biyèn pipis ing kolam renang nalika isih cilik.,Dhèwèké mikir nèk isa nindakké kuwi wektu wis diwasa.,Dheweke nggawa anak-anake menyang taman banyu.,Sabanjure dheweke pipis ing wading pool.,Ana wong sing nggatèkké lan Johnny ngalami masalah.,Kabèh wong seneng banget merga tumindaké Johnny.,1
396,Amy nonton bocah-bocah liyané dolanan lan ndelok inhaleré.,Amarga asma dheweke ora bisa olahraga.,Dhèwèké ngrasakké tangan guru seni ing pundhaké.,Guru kuwi mesem lan kandha nèk Amy bakal dadi seniman sing hebat.,Amy ngrasa luwih apik.,Amy rumangsa ora trima.,1
397,Joe lan kanca-kancane duwe pertandingan bal-balan dina iki.,Joe dadi gugup.,Dhèwèké kuwatir apa bakal menang utawa ora.,"Akiré, timé Joe menang.",Joe bangga banget karo timnya.,Joe kuciwa banget karo timnya.,1
398,Mark wis wawancara penting kanggo proyek anyar.,Dhèwèké nyiapké awaké dhéwé kanggo pitakonan sing mungkin ditakokké.,Sing arep wawancara kuwi kaya-kaya kagum karo jawabané Mark.,Wong sing wawancara ngandhani Mark nèk dhèwèké éntuk tugas kuwi.,Mark seneng banget.,Mark nesu banget lan mlayu metu.,1
399,Elaine ora krasa masak bengi iki.,"Mula, Elaine mutuské arep mangan ing njaba.","Nanging, Elaine ora ngerti ing ngendi dheweke pengin mangan.",Elaine mikir-mikir arep lunga menyang ngendi nganti mèh sakjam.,Élaine ora gampang nggawé keputusan.,Élaine ora isa nggawé keputusan.,2
400,Sam nyoba kanggo njaluk menyang College impen kang.,Dhèwèké ngentèkaké wektu suwé kanggo ngisi lamaran.,Dhèwèké seneng merga wis isa ngrampungké tugasé.,Dhèwèké ngirim aplikasi.,3 wulan salajengipun piyambakipun pikantuk serat panrima.,Dhèwèké ora tau mikirké bab kuwi manèh.,1
401,Matt mutusaké kanggo pindhah bar hopping karo kanca loro sawijining wengi.,Wong-wong kuwi ngombé 3 gelas ing sak bar.,Wong-wong kuwi ngombé nganti telung gelas.,Matt akhiré mabuk banget lan ilang HPé.,Matt lan kanca-kancané mlaku mulih lan turu.,Matt ora perduli bab telpon sing ilang.,1
402,Bindu ngrencanakaké pésta karo kanca-kancané.,Wong loro kuwi ketemu ing omahé kanggo ngrembug apa sing kudu dipangan lan apa sing kudu dienggo.,Salah siji kanca Bindu nggawa samosas lan doogh.,Ana papat kanca sing main musik ing pesta kasebut.,Kabèh wong seneng-seneng.,Bindu sengit karo kanca lan pesta.,1
403,Tyler tangi lan kudu adus sadurunge sekolah.,Seduluré sing cilik lagi adus.,Tyler kuwatir yen dheweke bakal ketinggalan bis.,Akiré gilirané Tyler kanggo adus.,Tyler nggawé cupcakes kanggo nduduhké kaprigelané.,Tyler cepet-cepet adus lan tekan ing halte bis.,2
404,Thomas akhir-akhir iki rumangsa ora pati ngerti.,Dhèwèké lunga menyang dhokter kanggo mriksa awaké dhéwé.,Dokteré ngandhani yèn kadar kolesterolé rada dhuwur.,Thomas mulai mangan sing luwih séhat lan mlaku-mlaku.,Dheweke didiagnosis diabetes sawise nambah 40 pon.,Dokteré seneng banget pas mriksa manèh.,2
405,"Tombolé lawang dibengok, nanging ora ana wong ing kono.",Dheweke ora yakin apa dheweke kudu mbukak lawang utawa ora.,Alon-alon dheweke creaked mbukak lawang lan peered njaba.,Seduluré mlumpat metu ing dheweke lan menehi dheweke ajrih apik.,Dheweke mutusake kanggo nonton acara komedi favorit ing Netflix.,Dhèwèké mbengok lan nyurung kakangé.,2
406,Stephanie péngin nggawé saus apel.,Dhèwèké mutuské kanggo nyopir menyang pasar kanggo njupuk apel sing enak.,Nalika dheweke mlaku liwat kebon dheweke kesandhung lan tiba.,Dheweke ngrusak loro pergelangan tangan.,Stephanie nyurung awake dhewe nganggo tangane.,Stephanie ora isa tangi nganti ana wong sing nemoni dhèwèké.,2
407,Roy ora ngerti apa sebabé omahé mambu banget.,Kancané ngomong bab kuwi wektu lunga.,Kabèh wong mutuské kanggo nggolèki sumberé.,Tumuli dadi iwak lawas ing kulkas.,Roy mutusaké kanggo ninggalake iwak ing kulkas.,Roy mbuwang nelayan lawas lan kabeh mambu luwih apik.,2
408,Jimmy gedhé ing negara sing mlarat banget.,"Ning, wong tuwané mesthi ngupaya bèn isa nyukupi kebutuhané.","Wektu dhèwèké mlebu ing perguruan tinggi sing apik, dhèwèké kerja ing rong pagawéyan kanggo mbayar.","Wektu lulus, dhèwèké péngin nduduhké rasa maturnuwuné.","Dadi, dhèwèké mbayar dhuwit kanggo kuliah.",Jimmy nelpon wong tuwané lan nyenyamah.,1
409,Jill kaget nalika ana bocah lanang sing ganteng ngajak dheweke menyang tarian kuliah.,"Wektu kanca-kancané lagi siyap-siyap, Jill ngganggu rambuté.",Kanca-kanca sakamaré Jill kandha nèk isa mbantu.,Jill wis rampung nganggo klambi putih kaya toga.,Kancané teka lan ngalem penampilané.,Jill lan kanca-kancané nganakaké acara wengi kanggo bocah-bocah wadon.,1
410,Sing nduwé bar ngadhekké spanduk gedhé kanggo ngiklanké baré.,Anginé banter banget lan nggawa spanduk kuwi lunga.,Sing nduwé omah nggolèki sing dilarang ing kutha kuwi.,Udhé tiba ing halaman mburi omahé wong wadon tuwa.,Wong wadon tuwa kuwi ora gelem mbalekké spanduk kuwi.,Wong wadon tuwa seneng banget ketemu mantel wulu.,1
411,Ibuku duwe resep kanggo bar labu sing aku seneng banget.,Dhèwèké tau nggawé kuwi kanggo aku merga aku lagi ngalami dina sing ora nyenengké.,Aku mangan bar labu lan aku rumangsa luwih apik.,Bar kuwi ngélingké aku nèk ibuku perduli karo aku.,Aku ora mangan bar labu manèh sakwisé dina kuwi.,Aku nggawe bar labu mengko ing urip lan padha ngelingake aku ibu.,2
412,Tim mutusaké kanggo nglampahi wektu luwih karo mbah kakungé.,"Mbah kakungé seneng nonton manuk, mula Tim nonton bareng.",Wong-wong kuwi nyathet ing buku cathetan apa waé sing dideleng.,"Ora let suwé, Tim dadi péngin ngerti luwih akèh bab Alkitab.",Tim mutusaké ora kepéngin manuk manèh.,Tim lan simbahé nemokake hobi sing padha seneng.,2
413,Danny nyambut gawé ing toko es krim lokal ing mangsa panas iki.,Dhèwèké seneng banget merga wis miwiti nyambut gawé.,"Ing dina kapisan, ana bocah lanang cilik sing ngeculaké es krim ing lantai.","Ora ragu-ragu, Danny ngerti apa sing kudu dilakoni.",Dhèwèké mènèhi es krim sak scoop manèh.,Dhèwèké ora gelem mènèhi wong kuwi berita liyané.,1
414,Lonceng sekolah muni nalika jam ngethok jam 2.,Gina ora tau luwih seneng kanggo dina kanggo mungkasi.,Dhèwèké njupuk barang-barangé lan ngentèni Tami ing ngarep lawang.,Nanging Tami arep lunga karo Rita lan Mary.,Gina ngrasa sepi wektu mulih.,"Dina bar kuwi, Gina matur nuwun marang Tami.",1
415,Laurence lan keluargané mutuské kanggo pindhah.,"Sing sepisanan, wong-wong kuwi ngumpulaké peraboté.","Banjur, kabèh barang liyané dikempalké.",Kabèh barang-barangé digawa menyang van.,Laurence lan keluargané mlayu menyang omah anyar.,Laurence nglebokké barang-barangé wong loro mau ing omah.,1
416,Joy péngin nemokké cangkang sing sampurna kanggo kepiting pertapa.,"Dhèwèké isa tuku, nanging luwih istimewa nèk dhèwèké nemokké.",Dhèwèké nggolèki pantai sedina muput.,Kabèh sing isa digunakké wis rusak!,Dhèwèké kudu tuku cangkang.,"Mula, dhèwèké nggawa siji menyang omah lan mènèhi kepitingé.",1
417,Westin arep nikah!,Dhèwèké péngin pésta nikahané sampurna.,Kabèh lumaku lancar nganti soré.,Ana wong sing mabuk banget lan tiba ing jajan!,Westin ngethok irisan kue sing sampurna.,Weston lan bojoné ngusir wong sing mabuk.,2
418,Joe mbiyantu bapaké ngresiki alas ing lataré.,"Dumadakan, dhèwèké krungu swara sing banter.",Dhèwèké wis ngganggu saré lebah.,Dhèwèké dicepeng ping enem sakdurungé bisa lolos.,Joe ngguyu bab pengalaman kasebut.,Joe nesu merga dhèwèké tatu.,2
419,Wektu kuwi musim gugur.,Tamané Todd kebak godhong.,Dhèwèké mutuské nèk kudu nggolèk kabèh.,"Sakwisé rampung, kabèh kuwi dilebokké ing kanthong.",Todd mbuwang wong-wong mau ing tong sampah.,Todd mbukak tas lan nyebar godhong-godhongan.,1
420,Tim ngimpi dadi binaragawan sing hebat.,Dhèwèké olahraga saben wengi kanggo nggayuh tujuané.,Kerja kerasé dadi apik lan dhèwèké éntuk panggonan ing kontès sing misuwur.,"Dhèwèké nduduhké katrampilané, ngangkat luwih saka 250 lb.",Tim kuwi nduwé tékad sing kuwat.,Tim ora nduwé tékad.,1
421,Henry mlaku menyang kelasé.,"Ing wektu sing padha, dhèwèké nyoba ngresiki layar telponé nganggo kain.","Sayange, ana wong sing nemoni dheweke.",Telponé tiba saka tangané lan tiba ing lemah.,Wong kuwi njaluk ngapura marang Henry.,Henry seneng lan matur nuwun.,1
422,Tami mutusaké kanggo nekani uji coba voli.,"Dhèwèké mung kelas 8, nanging dhèwèké ngerti nèk dhèwèké apik.",Dhèwèké main kanthi tenanan lan mènèhi kabèh.,Dheweke ora ngira yen pemain liyane bakal apik kaya dheweke.,Tami mlebu tim basket.,Kabeh pemain apik nanging dheweke dadi tim.,2
423,Bob lan Jim lagi dolanan bal ing omah ing sawijining dina.,Wong-wong kuwi nggulingké vas kuwi lan pecah dadi pirang-pirang bagéyan.,Wong-wong kuwi wedi nèk ibuné nesu karo wong-wong kuwi.,"Wong-wong kuwi nggolèk lem, banjur mbangun gulung kuwi.",Ibuné seneng karo vas sing anyar lan rusak.,Lem kasebut njaga vas kasebut lan ibune ora nate ngerti.,2
424,Steve sedhih banget.,Pacar Steve putus karo dheweke.,Dhèwèké mutuské kanggo nulis lagu kanggo dhèwèké.,Dhèwèké nglebokké atiné ing lagu kuwi.,Steve mikir apa dhèwèké lan bojone isa urip bareng manèh.,Steve nyopir sakjam adohé kanggo lunga menyang panggonan strip kanggo narkoba.,1
425,Gloria péngin tuku kembang kanggo bojoné.,Gloria kaget amarga rega mung setengah lusin lily.,Gloria mutuské kanggo njupuk kembang saka taman.,Dhèwèké ngumpulaké bunga narcis lan krisan.,"Ora let suwé sakwisé kuwi, Gloria njaluk pegatan.",Bojoné Gloria seneng banget.,2
426,Josh main basket saben dina.,Tujuane yaiku bisa nggawe basket ing lapangan.,"Ing sawijining dina, ana wong sing nantang dhèwèké kanggo mèlu lomba.",Sing sapa bisa ngetokaké tembakan paling akèh bakal menang!,Yohanes mlayu karo bengok-bengok merga wedi.,Dhèwèké sing paling akèh nyétak lan menang ing kontès.,2
427,Lauren mesthi kepengin nganggo jins sing langsing ing pesta.,"Nanging, dhèwèké kudu ngurangi bobot awaké bèn celana jeans sing langsing kuwi apik.",Lauren miwiti latihan sing tantangan.,"Pungkasané, dhèwèké wis ilang bobot sing cukup kanggo nganggo jins sing langsing.",Dheweke nganggo kanthi bangga menyang pesta sabanjure.,Dhèwèké cemburu.,1
428,Aku lunga menyang Hawaii nalika sekolah menengah.,Kelas musik kabèh mèlu.,Butuh wektu 9 jam kanggo mabur mrana.,Iku swarga tropis.,Aku mutusaké yèn aku kepéngin luwih kerep menyang Hawaii.,Hawaii dudu panggonan sing apik kanggo lelungan.,1
429,"Sonny manggon ing Texas, lan iku panas banget.",Dhèwèké kesel banget merga panas.,Dhèwèké mutuské kanggo ngupaya bèn ora ngganggu.,"Wiwitane, dheweke ora bisa mikir apa-apa.",Dhèwèké mutuské kanggo nguripaké pemanas.,Banjur dhèwèké mutuské kanggo mlumpat ing kolam renang.,2
