,input_sentence_1,input_sentence_2,input_sentence_3,input_sentence_4,sentence_quiz1,sentence_quiz2,answer_right_ending
1112,Wingi Kelly lunga menyang CV kanggo tuku permen.,Dheweke mlaku munggah lan mudhun lorong kanggo golek apa dheweke wanted.,"Nanging, dheweke kaget nalika ketemu karo kanca lawas.",Wong loro kuwi ngobrol sedhéla.,Wong loro kuwi dipenjara.,Kancané sing tuku gulali kuwi.,2
1113,Don ing dina kapisan ing dermaga wis sawetara hiccups.,Dhèwèké gugup merga ana ing cedhaké mesin abot.,"Ing salah siji titik, dhèwèké ngeculaké barang sing abot.",Meh tekan kanca kerja.,Don seneng merga ora gugup wektu nyambut gawé.,Don ngerti nèk dhèwèké kudu luwih apik.,2
1114,Dal butuh dhuwit kanggo kuliah.,Dhèwèké mulai dadi akuntan kanggo siji geng lokal.,"Nalika FBI nyerang geng, dheweke lagi mriksa buku-buku kasebut.",Dheweke ora sengaja ditembak mati ing tembakan silang.,Dal nggawé keputusan sing salah.,Dal nggawé keputusan sing wicaksana.,1
1115,Dina iki dina gambar ing sekolah.,Alice seneng banget merga ibuné wis tuku klambi anyar kanggo dhèwèké.,Dhèwèké tangi lan ngrasuk klambi lan ibuné ndandani rambuté.,Fotografer ngomong yen dheweke ayu banget.,Alice rumangsa seneng banget sakwisé fotografer kuwi nglipur dhèwèké.,Alice frowned sak gambar dheweke.,1
1116,Ibuné Nila didiagnosa kanker tahap papat.,Nila ngerti nèk ibuné ora bakal urip suwé manèh.,Nila nggawé kabèh bèn ibuné urip apik nganti séda.,Nila ngopèni akèh kenangan apik karo ibuné lan padha seneng.,Nila ora perduli karo ibuné.,Nila tresna marang ibuné.,2
1117,Ana ibu sing ndelok bayiné sing lagi waé lair.,Dhèwèké ngimpi bab masa depané.,Impené yaiku mènèhi dhèwèké masa kanak-kanak sing ora diwènèhaké marang dhèwèké.,Dhèwèké nggunakké akèh wektu lan tenaga kanggo ngupaya bèn isa dadi muridé Yésus.,Bocah kuwi ngalami kasangsaran ing jaman cilik.,Bocah kuwi nduwé masa kanak-kanak sing nyenengké.,2
1118,Jessica lan sedulur-seduluré padha bungah banget kanggo Natal.,Wong-wong mau turu luwih awal supaya bisa tangi luwih awal.,Wong-wong mau tangi lan mlayu menyang wit Natal.,Ana mung siji kothak ing ngisor wit.,Jessica mikir apa dheweke wis tangi luwih awal.,Saben seduluré mbuka hadiah Natalé.,1
1119,Jan lan Kim padha nggunakake model pendhidhikan Montessori.,Kim mutusaké kanggo njupuk adoh kabeh naga lan buku fantasi saka anaké.,Jan nesu merga keputusané Kim.,Jan nyatakake yen imajinasi lan fantasi iku penting.,Jan mbuwang buku-bukuné.,Jan nggawa buku-buku kuwi.,2
1120,Ing dina pisanan sekolah aku mlaku-mlaku ana karo loro saka kanca-kanca sing paling cedhak.,Kita kabèh gugup banget.,"Wektu tekan sekolah, aku lan bojoku mriksa daftar kelas kelas telu.",Aku lan bojoku diutus ing kelas sing padha.,Aku lan bojoku ora percaya.,Awaké dhéwé telu padha kuciwa banget.,1
1121,Jeff nesu amarga asu tanggane tansah nggonggong esuk.,Lan Jeff mesthi tangi awal merga nggrundel.,"Ing sawijining dina, tanggané mènèhi asu.",Lan Jeff seneng merga ora krungu wong-wong nggonggong manèh.,Jeff pungkasané bakal tentrem lan tenang.,Jeff bakal kangen karo asu kuwi.,1
1122,Holly njaluk kakange kanggo nglebokaké lotion kanggo srengenge ing punggungé.,Dhèwèké cepet-cepet lan ngetrapké kanthi tliti.,"Ing dina kuwi, Holly mikir apa sebabé wong-wong ngguyu.",Banjur dhèwèké sadhar yèn seduluré wis nggawé desain nganggo lotion.,Holly mbengok marang kakangné kanggo mbales.,Holly mènèhi dhuwit marang kakangné minangka ganti rugi.,1
1123,Aku kerep ngguyu bojoku merga nduwé lampu wengi.,Dheweke metu saka kutha sawetara dina lan aku turu tanpa iku.,Nalika aku tangi ing tengah wengi kanggo njupuk banyu aku kesandhung.,Aku ora weruh sandhangan ing lemah lan entuk bruise ala.,Aku mutusaké kanggo nyingkiraké lampu wengi.,Aku ora tau ngguyu karo bojoku lan lampu wengi maneh.,2
1124,Amy mutusaké pindhah saka Wisconsin menyang Florida.,Dhèwèké wis ngrencanakké pindah pirang-pirang sasi.,"Ing dina pindhah, dhèwèké pamit karo kanca-kancané.",Dheweke nyopir kabeh cara kanggo Florida piyambak.,"Nanging, dheweke nemokake Alaska dadi nyenengake.",Nanging pengalaman kasebut ora nyenengake tanpa kanca-kancane.,2
1125,Kathy lunga blanja.,Dhèwèké nemokké sepatu sing apik banget.,Sepatu kuwi regané $300 (Rp.,Dheweke tuku sepatu kasebut.,Kathy ora seneng tuku sepatu.,Dheweke ngrasakake penyesalan pembeli sawise tuku.,2
1126,Ulang taun Amayah wis cedhak.,Dheweke bakal umur limang taun.,Ibuné nganakaké pésta putri.,Dheweke wis ngundang kanca-kancane saka sekolah.,Amayah seneng dadi putri ing pésta.,Amayah sedih amarga dheweke ora pengin pesta teh.,1
1127,Aku lan bocah-bocah lanang padha menyang pantai dina iki.,Aku lan bojoku nggawa frisbee lan bal.,"Nalika dolanan ing banyu, ana wong liya sing melu.",Aku seneng banget ketemu kanca-kanca anyar.,Aku seneng banget ketemu karo bocah-bocah anyar.,"Kabeh, iku dina hiking gedhe.",1
1128,Iku ana wengi Jum'at aku mutusaké kanggo nyewa film.,Aku lunga menyang Redbox kanggo njupuk siji.,"Sakwisé mikir sakjam, akiré aku milih The Departed.","Aku mulih lan nggawe cemilan, banjur mlebu kanggo nginstal film.",Iku film paling apik sing wis daktonton suwene.,Aku adus banjur kerja.,1
1129,Paula nulis akèh puisi sing diucapaké.,Kanca-kancané ndhukung senajan kahanané ora apik.,Wong-wong kuwi ngundang dhèwèké ing pesta.,Paula wiwit ngirim sawetara tembung sing diucapake.,Kanca-kancane padha ngeplok geguritane.,Paula nyuwek-nyuwek geguritane.,1
1130,"Sawise mudhun saka bis sekolah, aku ngerti yen telponku ilang.","Merga ana layanan ing kono, aku mutuské kanggo mbatalake.",Wakil layanan pelanggan sing nindakake kanggo aku.,"Kajaba iku, dheweke ujar manawa ana telpon sing digawe menyang Jamaika.",Aku ngerti ana wong sing nyolong.,"Aku ngerti nèk ora suwé, ana sing bakal mbalekké telponé.",1
1131,Dina iki ulang taun kaping lima Iris!,Ibuné wis nggawé acara kanggo ngélingké anaké.,Kabèh kancané ana ing kono.,Dhèwèké mbukak hadiah lan mangan jajan.,Iris seneng-seneng banget ing pésta kuwi.,Iris mutusaké ora bakal mangan jajan manèh.,1
1132,Tina tansah nganggo bikini abang nalika lunga menyang pantai.,Dhèwèké dikenal merga kuwi lan kabèh wong péngin ndelok dhèwèké ing salah siji acara kuwi.,"Ing sawijining dina, dhèwèké ketemu karo kanca-kancané nganggo bikini biru lan nggumunké wong-wong mau.",Wong-wong kuwi ora ngerti apa sebabé dhèwèké nganggo klambi sing béda.,"Nanging, wong-wong mau seneng karo bikini anyar.",Kanca-kancané Tina ngerti nèk dhèwèké ora isa dikira-kira.,1
1133,Ted mesthi ngimpi dadi pemilik omah.,"Ning, dhèwèké wedi nèk kuwi ora bakal isa ditindakké.","Ing sawijining dina, bapaké nggumunké Ted karo kandha nèk dhèwèké bakal mbantu Ted.",Bapaké Ted mbantu mbagi dhuwit kanggo omah karo Ted.,Ted kandha nèk dhèwèké ora péngin dadi pemilik omah manèh.,Ted matur nuwun banget merga bantuané bapaké.,2
1134,Evie nglambrang ing istana nganti pirang-pirang jam.,Dhèwèké njelajah saben pojok lan celah struktur.,Para pengawasé takon karo dhèwèké bab apa sing wis disinaoni.,Dheweke njawab pitakonan sing apik banget lan gampang.,Dhèwèké bangga karo dhèwèké.,Dhèwèké mlayu merga wedi.,1
1135,Ed lan Ethan kembarane nggoleki wanita online.,"Banjur, wong-wong kuwi ndelok profilé wong loro kembar.",Wong loro mau banjur nelpon Sami lan Sara lan ngatur tanggal.,"Ing dina kencané, wong papat kuwi seneng-seneng.","Pirang-pirang taun sabanjure, pasangan kasebut nikah.",Wong loro kuwi mutuské ora bakal ketemu manèh.,1
1136,Marco wiwit kerja anyar dina iki.,Dhèwèké péngin tampil apik ing dina kapisan.,Marco mutusaké kanggo nyandhang dasi.,Bos anyaré seneng banget karo penampilané.,Marco seneng merga dhèwèké nggawé kesan sing apik.,Marco kaget banget karo tanggepané bosé.,1
1137,Tim péngin lunga ing luar negeri.,Dhèwèké durung tau numpak pesawat.,Dhèwèké mutusaké lelungan menyang China kanthi pesawat.,Dhèwèké bener-bener seneng mabur!,Tim sumpah ora bakal numpak pesawat manèh.,Tim wiwit lelungan kanthi mabur menyang akèh panggonan.,2
1138,Lucy duwe tes sesuk ing sekolah lan dheweke meh ora sinau.,Iku wis banget pungkasan lan dheweke wis njaluk kanggo turu.,Sekolah esuk sabanjure didhelikake amarga salju.,Lucy beruntung lan ngentèkaké sedina muput kanggo sinau kanggo ujian.,Lucy lulus kanthi apik.,Lucy ora lulus ujian kuwi merga ora sinau.,1
1139,Fred seneng karo novel misteri.,Dhèwèké biyèn maca paling ora siji buku saben sasi.,"Wektu kanca-kancané ngerti, kabèh padha mènèhi hadiah kanggo ulang tauné.","Nanging sayangé, dhèwèké dadi nesu merga manungsa waé.",Fred kandha marang kanca-kancané yèn dhèwèké arep ngaso saka novel misteri.,Fred miwiti klub buku novel misteri kanggo kanca-kancane.,1
1140,Tia nduwé toko roti dhéwé.,"Ing toko roti, dheweke nggawe kue sing apik banget.","Ing sawijining dina, dhèwèké ora nduwé glepung, senajan wis pesen akèh.",Dhèwèké ngubungi kutha kuwi lan akhiré ketemu.,Tia kuciwa.,Tia seneng banget.,2
1141,Sarah lunga karo kanca-kancané menyang taman banyu.,Wong-wong kuwi mbayar tiket lan nganggo klambi renang.,Wong-wong kuwi antri ngentèni slide sing gedhé dhéwé.,Wong-wong mau mudhun ing slide lan seneng-seneng.,Wong-wong kuwi janji ora bakal bali manèh.,"Dina bar kuwi, wong-wong kuwi bali manèh.",2
1142,Jeb mbangun patung saka watu.,Dhèwèké nggawé sing kaya penyu.,Sam teka lan nggulingaké.,Jeb mulai nangis.,Sam ngguyu lan mlayu.,Jeb seneng banget mbangun sing anyar.,1
1143,Jeff arep lunga ing perjalanan sekolah menyang alas udan karo kelasé.,Jeff seneng banget lan ora sabar arep lunga.,"Wektu Jeff teka, dhèwèké kuciwa banget.",Alas udan ora nyenengake lan ora ana apa-apa.,Jeff seneng-seneng.,Jeff bosen lan nesu.,2
1144,Dani dadi perawat ing ICU.,"Ing sawijining wengi, bapaké sing wis pisah karo dhèwèké dadi salah siji pasièné.","Dani ora gelem, nanging dhèwèké nambani bapaké.","Wektu dhèwèké pulih, wong loro kuwi isa omong-omongan.",Dani ora kaget karo kedadéan ing dina kuwi.,Dani luwih kenal karo bapaké.,2
1145,"Gina ana ing omahé kancané, yaiku Ruth.",Ana cah wadon sing ora dikenal jenengé Jane.,"Jane ora sopan, lan sombong.","Gina banjur ngerti yèn Jane kuwi adhine Joe, mungsuhé.",Dadi saiki dhèwèké ngedohi Jane saklawasé.,"Dadi, dhèwèké seneng dadi kancané Jane.",1
1146,Ella nggunakké sedina ing srengéngé.,Dheweke lali nglamar tabir surya.,Dheweke entuk burns elek!,"Nanging ora suwé, wernané dadi padhang lan dadi coklat.",Ella katon apik banget lan éntuk akèh pujian.,"Dina sakbanjuré, Ella nginep ing udan.",1
1147,Neil lagi waé teka ing Kenya.,Dhèwèké mèlu grup wisata safari.,Wong-wong kuwi ndelok akèh kéwan-kéwan sing éndah.,Neil njupuk foto sakwisé foto.,Dhèwèké dipenggolèki singa.,Neil nggawé album foto sakwisé mulih.,2
1148,Gina mutusaké kanggo manggang jajan apel kanggo pisanan.,Dhèwèké ngati-ati banget kanggo manut resepé.,"Sakwisé masang jajané ing oven, dhèwèké ngentèni kanthi semangat kanggo ngrasakké.",Iki pancèn enak banget!,"Mula, dhèwèké mutuské mbuwang buku kuwi ing tong sampah.",Dhèwèké nyritakké resep lan jajané karo kanca-kancané.,2
1149,Pablo péngin ngremuk rahang.,"Nanging, dhèwèké ora nduwé dhuwit.",Dhèwèké nggolèk barang-barang sing isa didol ing lemari.,Dhèwèké nemokké bonéte beruang lan didol kanthi rega 50 sen.,Banjur dhèwèké tuku permen.,Dheweke tuku sawetara soda karo.,1
1150,Anna nyewa gudhang kanggo pésta gedhé.,"Dekorasi kuwi apik banget, nanging ana sing ilang.",Banjur Anna sadhar - padha perlu disco bal!,Dhèwèké nggunakké bal sing disewa saka perusahaan sing nyediakké acara.,Anna dadi kuciwa.,Pesta kuwi apik banget.,2
1151,Oscar lunga menyang kamar bayi kanggo golek wit sing arep ditandur ing halaman.,Dhèwèké ora isa milih wit sing arep dipilih.,Ana akèh wit sing kudu ditempuh.,"Pungkasané, dhèwèké milih wit Bonsai.",Iki cocog banget karo dekorasi omah.,Dheweke ngrusak iku sanalika dheweke mulih.,1
1152,Ana pertandingan basket gedhé ing gedung olahraga.,Aku lan kancaku main ing tim sing padha.,Game dadi intens lan loro tim padha digandhengake ing pungkasan.,Ana 4 detik ing jam lan kita needed kanggo Skor.,Aku nembak basket sing menang sing menang game kanggo tim kita.,Aku lunga saka lapangan lan ora tau nyawang mburi.,1
1153,Dirk kuwi pemain piano sing apik.,Dhèwèké kerep tampil ing ngarepé wong akèh kanggo dhuwit.,"Sajrone pagelaran pungkasan, salah sawijining tombol rusak saka keyboard.","Dhèwèké ngrampungké pagelaran kuwi sak isa-isané, nanging musiké ora apik.",Dirk rumangsa isin.,Dirk seneng karo swara kuwi.,1
1154,Eva seneng banget karo tupai ing halaman omahé.,Dhèwèké mulai mènèhi roti lapis sing diiseni butter kacang.,"Ora let suwé, wong-wong kuwi dadi akrab karo dhèwèké.",Ana sing seneng banget.,Eva wedi karo kabèh tupai.,Eva isa ngrangkul salah siji tuwung.,2
1155,Andy seneng karo pantai.,Dhèwèké takon marang ibuné apa dhèwèké isa lunga menyang pantai.,Ibuné ngajak Andy menyang pantai.,"Ing dalan menyang pantai, udan wiwit.",Andy sengit karo pantai.,Andy sedhih banget.,2
1156,Aku tuku kasus telpon nganggo tali.,Aku butuh siji kanggo ponselku.,Kasus kuwi teka tanpa tali.,Situs web kasebut nyatakake yen kasus kasebut duwe bracket nanging ora ana lanyard.,Aku bali telponku.,Aku rumangsa bodho.,2
1157,Aku ganti sprei ing kasur minggu kepungkur.,Aku bosen karo sing lawas.,Sing anyar luwih apik lan luwih apik.,Aku mikir aku bakal tetep.,Aku seneng ora larang banget.,Aku arep ngethok dadi irisan.,1
1158,Chase kepengin dolanan anyar.,Ibuné ora bakal tuku dolanan anyar kanggo dhèwèké.,Dhèwèké mènèhi naséhat supaya nyimpen dhuwit saku.,Dhèwèké nyimpen dhuwit saku.,Chase tuku dolanan anyar.,Chase mlayu saka omah.,1
1159,Renee diilhami musik Eddie Van Halen.,Dhèwèké mutuské sinau main gitar.,Dhèwèké tuku gitar listrik lan amp.,Dhèwèké ora seneng nggunakké driji kanggo nyandhet senar.,Renee mutuské nèk dhèwèké kudu mbiyèn.,Renee seneng merga dhèwèké mutuské sinau main drum.,1
1160,Bill lunga mancing lan nyekel iwak akeh.,Dhèwèké éntuk akèh banget nganti kudu mènèhi sebagéyan.,Tanggané mlarat lan matur nuwun marang Bill kanggo iwak kasebut.,Para tangga teparo pungkasané bisa ngadeg manèh.,Para tangga teparo Bill nuntut Bill amarga dhèwèké nggawé wong-wong kuwi mlarat.,Wong loro kuwi nggawé roti kanggo Bill kanggo matur nuwun merga wis nggawa iwak.,2
1161,Minggu kepungkur internet mati.,Aku lan bojoku bosen banget.,Pilihan liya sing ana kuwi kaya-kaya mboseni.,"Akiré, aku lan dhèwèké mung ngombé lan omong-omongan.","Akhiré, awaké dhéwé seneng-seneng.",Kita seneng ora duwe Internet lan ngombe.,1
1162,Tim tansah kepéngin gawé musik.,"Tim latihan sedina muput, saben dina.","Wektu wis cukup lagu, Tim ngubungi studio rekaman.","Studio mutusaké kanggo ngrekam, lan Tim seneng.",Tim mutusaké ora seneng musik.,Tim dadi musisi profésional.,2
1163,"Alex curiga yèn kucingé, Tigger, duwé kutu.",Tigger terus-terusan goresan awake dhewe awan lan wengi.,Alex nggawa Tigger menyang dokter hewan kanggo didiagnosis.,Dokter hewan dikonfirmasi manawa Tigger pancen duwe kutu.,Dheweke menehi obat kutu lan wis jelas.,Alex mutusaké ora mènèhi kucing obat sing diwènèhaké.,1
1164,Haley kuwi ilmuwan enom ing laboratorium sing misuwur.,"Saben dina, dhèwèké kerja keras kanggo proyek sing saiki.",Salah siji kanca kerjaé nyolong riseté.,Haley nemokaké iki nalika nerbitaké ing jurnal ilmiah.,Haley rumangsa dikhianati.,Haley rumangsa wis didhukung kanthi apik.,1
1165,Sam kepengin nganakake pesta.,Sam ngundang kanca-kancané lan tangga-tanggané kabèh.,Pésta kuwi dadi kepanasan.,Para tamu ninggalké pésta kuwi kanthi nesu.,Sam dadi perencana pesta.,Sam ngalami mabuk ing dina candhaké.,2
1166,Katie ora isa turu.,Dhèwèké mudhun ing lantai ngisor lan mlebu pawon.,Dheweke ngunjuk segelas susu.,"Banjur, dhèwèké nggorèkké ing oven mikro.",Katie ngombé lan banjur turu manèh.,Katie mutusaké kanggo pour susu mudhun saluran.,1
1167,Tom lagi ngomong karo bojone Becky sing lagi kerja sedina.,Dhèwèké mutuské nggawa panganan sing paling disenengi kanggo ngélingké Rut.,"Nalika mulih saka kerja, ana akèh lalu lintas.","Sawise njupuk panganan, dheweke teka ing omah luwih suwe tinimbang sing direncanakake.","Ning sakwisé ngrangkul lan mangan, kabèh dadi apik.","Tom mutusaké kanggo njupuk trip kanggo casino, kang diabaikan kulawarga.",1
1168,Wong loro kuwi kudu milih kompor kanggo omah sing anyar.,Padha ora bisa nemtokake merek tartamtu.,Wong-wong kuwi seneng karo daya tahan Viking.,Dheweke uga seneng karo kesepakatan karo Thermador.,Wong-wong kuwi ora butuh kompor manèh.,Wong-wong kuwi mutuské arep tuku kompor Viking.,2
1169,Jasmine ora sinau kanggo ujian matematika sing penting.,Dhèwèké mikir nèk dhèwèké isa nggawé dhéwé.,Jasmine ora suwé banjur sadhar yèn ujian kuwi angèl banget.,Dhèwèké mutuské kanggo ngapusi kanthi ndelok koran tanggané.,Guru kuwi nangkep lan ngukum dhèwèké.,Guru kuwi nangkep lan ngalem kepinterané.,1
1170,Sam pindhah menyang Los Angeles kanggo dadi bintang film.,"Dhèwèké ora nduwé dhuwit akèh, nanging dhèwèké mikir nèk kuwi mung cara kanggo lunga.",Sawise rong sasi Sam turu ing mobil lan mlarat.,Ing sawijining dina dhèwèké lunga menyang téater Cina kanggo ngemis.,Sam rumangsa nduwé pengarep-arep.,Sam ngrasa sedhih banget.,2
1171,Ben tangi telat.,Ben mutuské ora sarapan lan kerja.,Pakaryané sibuk banget nganti ora isa istirahat utawa mangan awan.,"Sakwisé kerja, Ben kejiret ing dalan sing kebak lalu lintas.",Ben dadi luwe banget nganti lara.,Ben isa cepet mulih.,1
1172,Darren telat nyambut gawé lan ora bisa nemokake kunci mobilé.,Dhèwèké nggolèki kabèh omah.,"Dhèwèké takon marang bojoné, ana ing ngendi.",Dhèwèké ngongkon dhèwèké mriksa kanthongé.,Darren mateni komputer.,Ora ana kunci ing kanthongé.,2
1173,Aku wawancara kerja minggu kepungkur.,Pacarku mbantu aku milih dasi anyar.,Aku lan bojoku lunga menyang toko lan nggolèki nganti pirang-pirang jam.,Aku ketemu telu sing tak senengi.,Aku malah tuku dasi kupu.,Aku tuku kabeh.,2
1174,Harry seneng main hoki.,Dhèwèké mutuské kanggo mlebu kanggo main ing liga lokal.,Harry nekani uji coba kanggo tim kasebut.,Harry ngarep-arep bisa dadi tim.,"Banjur, Harry metu saka tim hoki.","Pirang-pirang dina sakwisé kuwi, Harry krungu nèk dhèwèké wis dadi anggota tim.",2
1175,Sue cilik numpak gajah ing kebun binatang.,Wiwitane dheweke seneng nanging banjur wedi.,Dheweke wiwit nangis kanggo ibune.,Sing ngurus kebun binatang kudu ngendhegake gajah lan njupuk dheweke.,Ibuné Sue ngajak Sue ngrangkul wedhus.,Sue terus numpak gajah.,1
1176,Hannah kuwi seniman sing luar biasa.,Dhèwèké mesthi nduwé bakat alami.,Dhèwèké mutuské mèlu lomba seni.,"Untunge, dheweke bisa menang hadiah utama.",Wong tuwané meksa nyuwil-nyuwil kanggo mbah putri.,Wong tuwané bangga banget.,2
1177,Jim lagi ngeteraké sampah.,Dhèwèké kesandhung ing sapérangan ès ing trotoar.,Jim tiba ing trotoar.,Jim ngrasakké ana sing pecah ing lengené.,Jim mutusaké kanggo nglakoni handstand.,Jim tatu lan kudu nelpon 911.,2
1178,Aku ora seneng ngumbah.,Nyampur kaos kaki iku mbuwang-mbuwang wektu sing nggegirisi.,Saben aku ngumbah kaos kaki ilang.,Aku bosen nggoleki kaos kaki sing padha.,Aku rumangsa santai nalika ngumbah.,Aku mbuwang kabeh kaos kaki lawas lan tuku kaos kaki putih biasa.,2
1179,James wis rolas taun lawas lan tresna pangan.,Dheweke ora nate mikir babagan nggawe panganan nganti saiki.,Ibuné ngejarké dhèwèké mbantu nyiyapké beras kanggo nedha bengi.,James sinau carane nyenengake lan kreatif masak bisa.,James mutusaké arep dadi koki nalika gedhé.,James ora tau masak manèh.,1
1180,Lee ngerti ibuné butuh sarung tangan anyar lan ora bisa tuku.,"Dadi, Lee mulai nyikat siji pasangan.",Dheweke cepet-cepet ngrampungake nganti Natal.,"Banjur, dhèwèké mènèhi buku-buku kuwi marang ibuné.",Ibuné Lee bangga karo anaké merga dhèwèké sing nggatèkké.,Ibune Lee mbuwang sarung tangan ing Lee lan ninggalake ruangan.,1
1181,Jennifer kuwi dadi juru nulis ing kutha gedhé.,Dheweke nindakake tugas sing apik nanging mesthi nampa komentar sing ora apik babagan ulasan.,Jennifer ngerti nèk bosé arep ngrusak dhèwèké.,Dhèwèké mutuské arep ngomong karo bosé bab omongan sing ora apik.,Jennifer matur nuwun marang bosé merga jujur.,Jennifer mlebu kantoré lan ngadili bosé.,2
1182,Lorraine iku pemain softball.,Dhèwèké sing paling apik ing timé.,"Ing sawijining dina, dhèwèké nyuda sikilé pas lagi dolanan.",Dhèwèké ora isa main manèh.,Lorraine seneng banget!,Lorraine sedhih banget.,2
1183,Abby lan Tammy kuwi kanca sing paling akrab.,Wong loro kuwi seneng nganakké acara-acara sing nyenengké lan kreatif.,Wong loro kuwi mutuské kanggo nggawé gelang persahabatan lan mènèhi wong liya.,Abby nggawé lima lan Tammy nggawé pitung manèh.,Tammy ora tau ngomong karo Abby manèh.,Wong loro kuwi mutuské kanggo nyimpen gelang kuwi.,2
1184,Ing wengi wingi ana badai petir gedhe.,Iku njupuk daya metu.,Kabèh lingkungan ora nduwé listrik.,Awaké dhéwé dadi wedi merga adhem banget.,Kita kudu ngusap salju.,"Banjur kira-kira sakjam, listriké bali.",2
1185,Sal nesu merga wong tuwané arep pindhah.,Wong loro kuwi pindhah ing lantai 8 bangunan.,Dhèwèké ora seneng urip ing papan sing dhuwur.,"Sakwisé pindhah, dhèwèké mriksa metu jendela kamaré.",Sal mbuwang bantal metu jendhela.,Pandangan sing apik kuwi nggawé dhèwèké owah pikirané.,2
1186,Lydia ngimpi aneh wingi wengi.,Dhèwèké ngimpi nèk dhèwèké lagi ujian ing sekolah.,"Nalika lagi ujian, dhèwèké sadhar yèn dhèwèké lali nganggo celonone!",Dhèwèké isin banget lan langsung mlayu metu saka kelas.,Lydia péngin mimpi kuwi nyata.,Lydia rumangsa lega wektu ngerti nèk kuwi mung ngimpi.,2
1187,Alex butuh barang-barang kanggo tuku.,Dhèwèké nggawé daftar barang-barang sing arep dituku.,Dhèwèké ngumpulaké kanthong kanvas sing isa digunakké manèh.,Dheweke mlaku menyang toko.,Alex tuku kapal pesiar.,Dhèwèké tuku barang-barang.,2
1188,Yolanda sengit karo roller coaster.,Katie ora ngerti alesané.,Dhèwèké mutuské kanggo meksa Yolanda numpak sepédan karo dhèwèké.,Yolanda muntah-muntah ing Katie.,Katie ora tau ngrasakké seneng kaya ngono.,Katie gela merga meksa Yolanda mèlu.,2
1189,Siji bab sing dikarepake Tina ing NYC yaiku menyang stand hot dog.,"Akiré, dhèwèké ndelok warung Nathan lan pesen sing tradisional.",Panganané enak banget.,Iku larang nanging worth iku.,Dhèwèké sedhih merga hot dog.,Dheweke seneng karo hot dog.,2
1190,Tammy seneng nyukur.,Natal lagi sawetara minggu lan dheweke ora duwe dhuwit.,Dhèwèké nduwé gagasan kanggo njupuk benang sing isih ana kanggo nggawé selimut.,Banjur dibungkus kanggo cucune Lorelei.,Tammy sedhih merga ora nduwé hadiah kanggo diwènèhaké.,Lorelei wis pirang-pirang taun ngopèni selimut kuwi.,2
1191,Melinda péngin nonton filem horor.,Dhèwèké péngin mbuktèkké nèk dhèwèké wani.,Melinda lunga menyang bioskop lan tuku tiket.,Melinda wedi banget wektu nonton filem kuwi.,Melinda mikir nèk filem kuwi lucu banget.,Melinda péngin dhèwèké nggawa wong liya.,2
1192,Lamar sinau yen dheweke bakal duwe tamu sing ora dikarepake ing sawijining sore.,Dheweke ora duwe panganan ing omah kanggo menehi tamu.,Dhèwèké mutuské kanggo nggawé tèh kanggo wong loro kuwi.,Para tamué kabèh seneng karo tèh sing digawé.,Lamar maringi wong-wong mau teh kanggo njupuk omah.,Lamar mlaku menyang taman.,1
1193,Keponakanku nglamar kerja ing RMV rong taun kepungkur.,Dhèwèké éntuk tugas kuwi lan seneng banget.,"Wong-wong mau kandha nèk dhèwèké butuh SIM, nanging ora nduwé.",Dhèwèké nduduhké suraté dhokter sing kandha nèk dhèwèké ora isa nyetir.,Wong-wong kuwi mutuské nèk dhèwèké isa dadi sekretaris.,Dhèwèké nduwé cathetan bab nyopir sing sampurna.,1
1194,Lela didiagnosa kanker limang taun kepungkur.,Saben dina kuwi dadi perjuangan.,Saben dina dhèwèké lunga menyang dhokter lan njaluk perawatan.,Lela pungkasanipun wiwit dadi luwih apik sawetara wulan kepungkur.,Lela banjur ngrampungake perawatan lan rumangsa luwih apik.,Lela banjur mari saka flu.,1
1195,Fred kuwi murid anyar ing kelas.,Dhèwèké ora seneng lan ngalami kahanan sing angèl.,Ora ana sing kepéngin kekancan karo dhèwèké.,"Banjur, ana sing mangan bareng karo dhèwèké.",Fred misuwur.,Fred ngobrol karo kanca mangan lan nggawe kanca.,2
1196,Joyce diadopsi dening ibune angkat nalika umur 5 taun.,Sawisé diadopsi ibuné banjur ngadopsi 3 bocah liyané.,Joyce seneng dadi adhine sing luwih tuwa lan dheweke mbantu ibune akeh.,"Wektu dhèwèké urip dhéwé, dhèwèké uga dadi wong tuwa angkat.","Ora let suwé, Joyce ninggalké anak-anaké.",Joyce uga nresnani anak-anaké.,2
1197,Horatio mesthi wedi mangan tiram mentah.,"Pacaré kandha nèk panganan kuwi enak banget, nanging dhèwèké gugup.",Pungkasane dheweke ngajak dheweke plancongan menyang Cape Cod kanggo nyoba tiram seger.,Horatio njupuk dhadhakan pisanan ing tiram mentah lan tresna iku.,Dhèwèké mutusaké ora mangan manèh.,Dhèwèké mangan sepuluh manèh.,2
1198,Tom seneng angon sapi.,Saben dina dhèwèké nindakké kuwi.,"Ing sawijining dina, sapi bébas.",Dhèwèké nggolèki ing ngendi-endi.,"Dhèwèké ndelok sapi ing sawahé tangga-tanggané, ora nggatèkké, banjur lunga.",Dhèwèké nemokké sapi kuwi lan nggawa bali.,2
1199,Alyssa njupuk kopi nalika arep kerja.,Dheweke ngombe kopi nalika nyopir.,"Dumadakan, dhèwèké kudu mandheg mobilé.","Kopi kuwi tumpah ing sikilé, lan nggebugi sikilé.",Dheweke ngguyu nalika dheweke terus nyopir kerja.,Dhèwèké mèh cilaka merga nangis merga lara.,2
