,input_sentence_1,input_sentence_2,input_sentence_3,input_sentence_4,sentence_quiz1,sentence_quiz2,answer_right_ending
365,Tom ville gå til ein New York Giants-kamp.,Men billettane var for dyre.,Til slutt fann han ein billett som var i hans prisklasse.,Han enda opp på øvre dekk.,Han likte å sjå kampen likevel.,Tom meinte det var den beste hockeymatchen nokon gong.,1
366,Trip likte vatnmelon.,Han åt minst ein om dagen.,"Mor hans sa alltid at når ho skulle vokse opp, skulle ho sluka frø.",Han slukte dei alltid uansett.,Trip likte smaken av frøa.,Trip slutta å eta vatnmelon heilt.,1
367,"Angie, ein av MTurk-arbeidarane, såg seg sjølv som ei arbeidsklare.",Ein dag avslo ein av favoritt-søknadene hennar arbeidet hennar.,Angie var svært overraska og sende dei ein e-post.,Dei hevda at arbeidet hennar ikkje var godt nok.,Angie bestemte seg for å seia til den som søkte om å avvisa meir av arbeidet hennar.,Angie prøvde å diskutera problemet i detalj.,2
368,Donovan inviterte Trina til å dansa med han.,"Trina likte Donovan, så ho sa ja, men ho var verkeleg uroleg.",Etter skulen sprang ho heim for å be faren sin om hjelp.,"Då far hennar kom heim forklarte ho situasjonen, og faren smilte.",Trina sin far skeldde på Trina.,Trina sin far lærte henne å dansa.,2
369,Andy hadde alltid ynskt seg ein stor barnesykkel.,"Då han var seks år gamal, sa han at han ville få ein sykkel i fødselsdagsgave.",Han kunne ikkje ri sykkel.,På Andys bursdag gav mor han han ein sykkel.,Andy gret i timar.,Far hans lærte han å ri.,2
370,Suzy gjekk til iskrembutikken.,Ho bestilte ein vanilje-mjølkshake.,"Då ho prøvde å betala mannen for milkshaken sin, smilte han til henne.",Han fortalde at ho hadde vunne ein spesiell konkurranse.,Han sa at ho skulda han seksti dollar.,Han gav henne milkshaken gratis.,2
371,Ned og venene hans gjekk til messen.,Han brukte dei siste pengane sine på å kjøpe ein fluffig vatnsmelk.,"Då han gjekk bort, såg han ein liten gut som gret.",Han hadde kasta vatnsokken sin i ei pølse.,Så Ned gav han sin eigen candy candy.,Han kjøpte meir vatnevatn til guten.,1
372,Sebastian la merke til at det var solskin og varme ute.,Han hadde ein del oppgåver å gjera.,Han hadde ikkje lyst til å gjera husarbeidet sitt.,Sebastian bestemte at det var betre å vere utendørs.,Sebastian ville ikkje fare ut av huset den dagen.,Sebastian gjekk ut og tok ein tur.,2
373,Rashid var ein utmerka bilførar.,Ein dag var broren til Rashid sein til jobb.,Rashid tilbød å køyra broren sin.,Dei kom dit med all den tida dei hadde.,"Broren hans skreik på han, og smalla på døra.",Broren hans var takknemleg.,2
374,Ali gjekk til ein matbutikk og betalte med kredittkortet sitt.,Det tok lang tid før kassa kom med kortet hennar.,Nokre dagar seinare fann Ali uvanlege transaksjoner på kortet hennar.,Ho ringte banken sin og ba om å få dei att.,Ho undra om kassa hadde stjålet opplysingane hennar.,Ho heldt fram med å takka kassaforvaltaren.,1
375,Eg leitar etter eit pent bilde til stua mi.,Difor gjekk eg ut å leita i går.,Eg fann endeleg ei vakker ein som eg elskar.,Maleriet var av ein foss.,Eg bestemte meg for å ikkje kjøpa måleriet fordi eg ikkje likte det.,Eg kjøpte den og tok med meg heim.,2
376,Eg ville få ein framsetning.,Eg bestemte meg for å prøve å få ei oppgåve.,Eg arbeidde veldig hardt heile året.,Sjefen min merka det og kalla meg inn på kontoret sitt ein dag.,Sjefen min sparke meg på plass.,Eg fekk den framsetninga eg ønskte.,2
377,Maggie og foreldra hennar flytta til ein ny by.,Maggie var nervøs fordi ho ikkje kjende nokon.,"Så snart ho flytta inn, gjekk ho rundt og presenterte seg.",Ho enda opp med å få nokre vener.,Maggie var sorgleg og einsom.,Maggie likte den nye byen.,2
378,Dan gjekk heim frå skulen og såg vitrina.,Det var eit togsett i vindauga i butikken.,Dan ønskte så ille at han kunne eiga dette togsetet.,Då Dan kom heim sa mor hans at ho hadde ei overrasking.,Ho gav Dan toget.,Dan si mor sa til han at han skulle gjera seg klar for skulen.,1
379,Gina ville stela nøkkelen til huset til mor si.,Ho venta til mora hennar tok ein lur.,Ho tok mammas veske med seg på toalettet.,Ho tok nøkkelen frå kjeden i stilleik.,Så la Gina veska på plass igjen.,Så sa Gina til mamma kor dei hadde teke nøkkelen.,1
380,Det var ein mann frå Kentucky.,Han var i kjærleik med ei jente som budde i Louisiana.,Han bestemte seg for at han måtte flytte.,Han flytta for å vere med kjæresten sin.,Mannen flytta til Texas.,Han flytta til Kentucky.,2
381,Tim hadde ikkje det best på matte.,"Han visste at om han ikkje klarde skulen, måtte han gå på sommerskolen.",Han studerte hardt og bad om ekstra kreditt.,"På den siste dagen på skulen, fekk han vita at han hadde gått på rett kurs.",Tim var begeistrad.,Tim var særs skuffa.,1
382,Mary-Anne følde seg einsam og bestemte seg for å adoptera ei katt.,Ho for til det lokale samfunnet for å få byrja på det.,"Medan ho såg på, miaug ein av kattene til henne.","Mary-Anne kledde katten, og det var kjærleik ved første blikk.",Ho bestemte at det ikkje var den rette katten.,Ho tok katten heim med seg.,2
383,Eg tok gymnastikk som barn.,Eg lærte meg å balansere tak og tak og gjorde ein del bevegingar på den.,"Då eg gjorde ein runde av, kasta eg av strålen og landet feil.",Eg braut ankelen min og hadde så mykje smerte!,Eg vart brått med på sykehuset.,Eg reiste meg og gjekk tilbake til balansen.,1
384,Det var seks valpar som sprang rundt i foajéen min.,Det var ikkje lett å velja kva ein skulle kjøpe.,Kvar av døtrene mine valde ut ein annan valp.,Eigaren sa at vi kunne få ein rabatt på to hundar.,Vi kjøpte ein hund kvar.,Vi likte ikkje hundane.,1
385,Johnny ville ha ei forandring frå livet i Boston.,Han bestemte seg for at han ville vere lykkeligare i Amerika.,Seinare flyttade Johnny til Idaho.,Han hadde rømd frå livet i den store byen.,Johnny byrja å planleggja å flytta til Boston.,Johnny var glad for å vere i ein liten by.,2
386,Joan hata å gå heim til jul.,Ho visste at ho ville bli mobba av mor si på grunn av kjærleiken.,I år var ho med i ein bilulykke på veg heim.,Moren hennar skunda seg til sida hennar for å ta vare på ho.,Moren til Joan snakka ikkje med ho fordi ho var ugift.,Joan følde seg godt når ho såg andletet til mor si.,2
387,Eg bruker all tida mi på å arbeide med skriving.,Som eit resultat av dette har eg byrja å føle meg ganske einsam.,Eg har valt å bli med på eit nettdatingsamfunn.,"Då eg først kom på det, skjøna eg at eg ikkje likte andre menneske.",Eg byrja å skriva meir.,Eg hadde mange deiter.,1
388,Dottera mi var ein jente speidar på grunnskolen.,Ein dag gjekk ho på ein nattleg utflukt.,Kona mi gjekk som chaperone.,Alle overnatt i ein hytte i New Hampshire i ein helg.,Dottera mi gløymde aldri utflykten sin.,Kona mi og eg åt middag den kvelden.,1
389,I dag var det ein klubbopphalding i ein ny klubb i hjørnet.,Eg kunne ikkje venta å sjå på.,Då vi kom til klubben var det vakkert.,Vi bestilte deiilige mat og dansa.,Vi vart venner med dørvaktane så vi kunne kome inn i klubben i morgon.,Utestandaren lét oss ikkje koma inn i klubben.,1
390,I går bar eg eit nytt glas inn i kjøkkenet.,Til min overrasking fall det ned.,Glasset vart knust.,Eg måtte hente det.,Eg skar meg på eit lite stykke.,Eg elskar at det er slik glaset ser ut i dag.,1
391,Familjen til Bill budde på ein ås.,Det har aldri regna eller storma der.,Ein dag gjekk det ein tornado gjennom området.,"Huset hans vart skadd, og taket vart reint av.",Forsikringsselskapet dekte utgiftene for eit nytt tak.,Dei bestemte at dei ikkje trengde det i alle fall og dei flytta.,1
392,Allison bestemte seg for å læra meir om historia i området.,Ho gjekk ned til biblioteket for å sjekka ut ein bok om det.,Ho gjekk inn og skjøna ikkje korleis bøkene var sett saman.,Ho fann ein bibliotekar som forklarde dei om dewey-systemet.,Det var det som hjalp henne til å sjå kva bilen meinte.,Det hjelpte henne å finna det ho ville.,2
393,Sebastian ville spela fotball med venene sine.,Han snakka med venen sin og fekk vita at han trengte å gå på trening.,Han øvde seg på å få tak i ballen heime heile veka.,Han gjekk til neste trening og scorte ein touchdown.,Sebastian var skuffa over at han ikkje klarde å halde fram med ein gong.,Sebastian var glad at veninga hans bar frukt.,2
394,Det var ei mor som desperat ville at ungen hennar skulle sova.,"Ho gjekk rundt med han, men han sov ikkje.","Ho gjev han mat, men han sov ikkje.",Til slutt kom ho i hug den songen ho hadde høyrt frå mor si.,Moren song song songen til barnet sitt.,Moren spelte litt hip hop for barnet sitt.,1
395,Johnny pissa i basseng som barn.,Han trudde han kunne gjera det som ein voksen.,Han tok borna sine med til ein akvatarpark.,Seinare pissa han i vasken.,"Nokre sa det, og Johnny fekk problem.",Alle var verkeleg glade på grunn av at Johnny oppførte seg slik.,1
396,Amy såg på borna som spelte og peika på inhalatoren.,På grunn av astma kunne ho ikkje utøve sport.,Ho følde handa til kunstlæraren sin på skulderen.,Læraren hennar smilte og sa til Amy at ho ville bli ein stor artist ein dag.,Amy følde seg mykje betre.,Amy følgde seg forferdeleg.,1
397,Joe og venene hans hadde fotballkamp i dag.,Joe var nervøs.,Han var nervøs om han skulle vinna eller ikkje.,"Til slutt, etter kampen, vann Joe sitt lag.",Joe var veldig stolt av laget sitt.,Joe var svært skuffa på laget sitt.,1
398,Mark hadde eit stort intervju for ein ny jobb.,Han forberedde seg på spørsmål dei kanskje ville stille.,Intervjuaren synte seg å vera imponert av svarene til Mark.,Intervjuaren informerte Mark om at han hadde fått jobben.,Mark var svært glad.,Mark vart rasande og storma ut.,1
399,Elaine hadde ikkje lyst til å laga mat i kveld.,Difor bestemte Elaine seg for at ho skulle gå ut og eta.,Elaine visste ikkje kvar ho ville eta.,Elaine tenkte på kvar ho skulle gå i nesten ein time.,Elaine fann det lett å avgjera seg.,Elaine fann det vanskeleg å avgjera.,2
400,Sam prøvde å koma inn på det høgskolen han dro dro dro.,Han brukte lang tid på å fylla ut søknaden.,Det gjorde han godt med.,Han sende inn søknaden.,Tre månader seinare fekk han eit brev som sa han var blitt anta.,Han tenkte aldri på det att.,1
401,Matt bestemte seg for å gå på ein bar med venene sine ein kveld.,Dei drakk 3 skott på ein bar.,"Dei gjekk på 4 til, drakk 3 øl per person.",Matt enda opp med å bli for full og miste telefonen sin.,Matt og venene gjekk heim og sov det ut.,Matt brydde seg ikkje om den tapte telefonen.,1
402,Bindu planla ei fest med venene sine.,Dei møtte opp ved huset hennar og diskuterte kva dei skulle eta og kva band dei skulle bruka.,Ein av venene hans hadde med seg samosas og dough.,Fire vener spelte musikk på fest.,Alle hadde det godt.,Bindu hatar venene og festar.,1
403,Tyler vaknar og må dusja før han går på skule.,Den vesle broren hans brukar dusjen.,Tyler er redd han ikkje skal ta bussen.,Det er endeleg Tyler som skal dusja.,Tyler laga cupcakes for å visa fram sine bakingevner.,Tyler tek ein rask dusj og kjem til bussholdeplassen i tide.,2
404,Thomas hadde følt seg lite kjent i det siste.,Han gjekk til legen sin for å få ein kontroll.,Legen hans sa at kolesterolnivået hans var litt høgt.,Thomas byrja å eta sunnare og gå på tur.,Han fekk diagnostisert diabetes etter å ha gått opp i vekt med 45 kilo.,Legen hans var svært glad ved neste kontroll.,2
405,"Dørklokken ringde, men det var ingen der.",Ho var usikker på om ho skulle opna døra eller ikkje.,Langsomt knarka ho opp døra og peika ut.,Broren hennar hoppa ut på henne og gav henne ein god skremme.,Ho bestemte seg for å sjå på sitarette på Netflix.,Ho skreik og støytte broren sin bort.,2
406,Stephanie ville lage eple-sauce.,Ho bestemte seg for å køya dei dei deiligaste epla på marknaden.,Då ho gjekk gjennom frukthagen snubla ho og fall.,Ho braut begge handledene.,Stephanie trekte seg opp med hendene.,Stephanie kunne ikkje stå opp før nokon fann henne.,2
407,Roy kunne ikkje greie kva det var som gjorde at leiligheten hans lukta så ille.,Vennene hans kom med på det.,Alle bestemte seg for å leita etter kjelda.,Det viste seg å vera ein gamal fisk i kjøleskåpet.,Roy bestemte seg for å la fisken vera i kjøleskåpet.,"Roy kasta ut den gamle fiskaren, og alt lukta betre.",2
408,Jimmy voks opp svært fattig.,Men foreldra hans gjorde alltid det dei kunne for å ta vare på han.,"Då han kom inn på eit godt college, hadde dei to jobb for å få råd til å gå på.","Då han var ferdig med skolen, ville han visa sin takknemlighet.",Så han gav dei studenten til gjalds.,Jimmy ringde foreldra sine og spotta på dei.,1
409,Jill vart overraska då ein pen gut inviterte henne til høgskolsbalen.,"Som romkamratane hennar gjorde seg klare, Jill fussed om håret hennar.",Båe romkamratane hennar sa at dei kunne hjelpa.,Jill er ferdig med å kle seg i den kvite toga-kåra.,Datteren hennar kom og gjorde komplimentar til utseendet hennar.,Jill og venene hennar hadde ein moro jente-only-kveld ute.,1
410,Ei eigar av ein bar sette ut eit stort banner for å annonsera baren sin.,Vinden var sterk og blåste bort fanen.,Eigaren jagte han over heile byen.,Han landet på gardet til ein gamal kvinne.,Den gamle kvinna nekta å gje tilbake banneret.,Den gamle kvinna var glad for å finna pelskåken.,1
411,Mamma mi har ei oppskrift på pumpebarar som eg likte mykje.,Ho laga dei for meg ein gong fordi eg hadde ei vond dag.,Eg åt pumpebarene og følde meg mykje betre.,Båra minna meg på at mor mi bryr seg om meg.,Eg åt aldri meir pumpebar etter den dagen.,"Eg laga dei seinare i livet, og dei minns meg etter mamma.",2
412,Tim bestemte seg for å tilbringe meir tid med bestefaren sin.,"Morfaren hans elska fuglekikk, så Tim såg med han.",Dei skreiv ned kvar dei såg ein i ein notis.,Det var ikkje lenge før Tim var verkeleg interessert!,Tim bestemte at han ikkje var interessert i fuglar lenger.,Tim og bestefar hans fann ein hobby som dei begge likte.,2
413,Danny arbeidde på ein lokal isbutikk denne sommaren.,Han var veldig spent på å ha byrja på den første jobben sin.,"Den første dagen i skolan, kasta ein liten gutt is på golvet.",Utan å nøla visste Danny kva han skulle gjera.,Han gav han ein annan skope av is.,Han nekta å gje han ein ny snikkel.,1
414,Skolklokka ringde då klokken slo 2.,Gina var aldri meir glad for ein dag som tok slutt.,Ho tok med seg tinga sine og venta på Tami ved døra.,Men Tami skulle reise med Rita og Mary.,Gina følde seg einsam då ho gjekk heim.,Gina takka Tami dagen etter.,1
415,Laurence og familien hans bestemte seg for å flytta.,Først pakka dei inn møblene sine.,Dei pakka saman alt anna.,Alle eigedomane deira vart flytta inn i vogna.,Laurence og familien hans køyrde til det nye huset sitt.,Laurence tok med alt dei eigde tilbake til huset.,1
416,Joy ville finna det perfekte skallet for ein einskild krabb.,"Ho kunne kjøpt ei, men ho ville ikkje vore særleg om ho fann ein.",Ho vaska stranden heile morgonen.,"Alt som kunne ha vore mogleg, var i stykker.",Ho måtte vel kjøpe eit skal.,Så ho tok ei heim og gav han til krabben sin.,1
417,Westin skulle gifta seg!,Han ville at bryllaupet hans skulle gå perfekt.,Alt gjekk vel til kvelden.,Kvinna mi vart veldig beruset og fall ned i kaka.,Westin skar eit perfekt stykke av kaka.,Weston og kona hans sparka ut den inebria personen.,2
418,Joe var med på å ta bort skogane på gardet til far sin.,Plutseleg høyrde han eit brå summing.,Han hadde rørt opp eit bi-neste.,Han blei stukken seks gonger før han klarte å rømma.,Joe lo av dette.,Joe var sint fordi han vart skadd.,2
419,Det var hausten.,Todd hadde eit hus fullt av bla.,Han bestemte seg for å ta dei alle.,"Då han var ferdig, tok han dei alle med han og putta dei i ein pose.",Todd sette dei ut i søpla.,Todd opna veska og spreidde blada rundt.,1
420,Tim hadde drømmer om å bli ein stor kroppsbyggjar.,Han trena kvar kveld for å nå målet sitt.,Han arbeidde hardt og vann ein plass i ein populær konkurranse.,Han viste dykkar evner ved å lyfta meir enn 250 pounds.,Tim var veldig bestemt.,Tim hadde lite besluttsomheit.,1
421,Henry gjekk til klassa si.,Samstundes prøvde han å rengje telefonen sin med ein dusj.,"Dessverre, var det nokon som slo han.",Telefonen hans fall ut av handa hans og landet på jorda.,Han sa unnskyld til Henry.,Henry var glad og takknemleg.,1
422,Tami bestemte seg for å delta på volleyballprøvingar.,"Ho var berre i åttende klasse, men ho visste at ho var god.",Ho spelte hardt og gav seg av.,Ho hadde ikkje rekna med at dei andre spelarane ville vere så gode som ho.,Tami kom inn i basketballaget.,"Alle spelarane var gode, men ho vart med i laget.",2
423,Bob og Jim spelte ball heime ein dag.,Dei velte vasen over og den braut seg i mange stykker.,Dei var redde for at mamma deira ville verta sint på dei.,Dei fann litt lim og limde vasen forsiktig saman.,"Mor deira likte den nye, ødelagte vasen.","Limen heldt vasen oppe, og mor deira fekk aldri vita det.",2
424,Steve var veldig trist.,Kjærasten til Steve gjorde slutt med han.,Han bestemte seg for å skriva ein song til henne.,Han gjev sitt hjarte inn i songen.,Steve undra om dei nokon gong kunne kome saman igjen.,"Steve køyrde bil, og det tok ein time for han å gå på ein striptease-bar.",1
425,Gloria ville kjøpa blomar til mannen sin.,Gloria var sjokkert over prisen på berre eit halvt dusin liljer.,Gloria bestemte seg for å plukka nokre av dei blomstene ho hadde i hagen.,Ho samla nokre narcissar og krysantemum.,Gloria søkte om skilnad kort tid etter.,Mannen til Gloria sette pris på gjesten.,2
426,Josh spelte basketball kvar dag.,Målet hans var å kunna kasta kva korg som helst på banen.,Ein dag krev nokon han med i ein boksekamp.,"Den som får flest tak i gongen, vinn!",John rømde bort skrikande av redsle.,Han fekk flest skot og vann.,2
427,Lauren har alltid ynskt å ha skinny jeans på festar.,"Ho må gå ned i vekt, slik at skinnyjeansane hennar ser bra ut.",Lauren tek til med eit utfordrande treningsregime.,Til slutt har ho gått ned i vekt nok til å kunne ha på seg skinny jeans.,Ho brukte dei alle på eit stolt party.,Ho var sjalu.,1
428,Eg drog til Hawaii på high school.,Hele bandet vårt gjekk dit.,Det tok ni timar å flyga dit.,Det var eit tropisk paradis.,Eg bestemte meg for at eg ville reise til Hawaii meir.,Hawaii var ikkje eit godt stad å reise til.,1
429,"Sonny budde i Texas, og det var ein varm sommar.",Han var så roten av varmen.,Han bestemte seg for å finne ein måte å kølna ned på.,I byrjinga kunne han ikkje hugsa om noko.,Han bestemte seg for å gå og slå på varmen.,Så bestemte han seg for å hoppa i bassenget sitt.,2
430,Chad var ein fantastisk songar.,Han var berre for redd for å synge.,Han ville vera i ein kyrkjekor men trudde venene hans ville leika.,Fordi han er så vanærd for dykkar dykkar eigen evner og lidenskap.,Chad fekk motet til å leie opp med sitronar.,"I staden for å le, klappa alle når Chad endeleg song.",2
431,"Ronald hadde to born, ein gut og ei jente.",Det var meir enn nok.,Han ville verkeleg vera i stand til å gjere dei to lurtene.,Ein dag sa kona til han at dei skulle få ein tredje.,"Han var djupt misunneleg, men redd for å dra.",Auga hans glødde av spenning.,1
432,Eg gjekk på ein tur sist onsdag.,"Medan eg gjekk, kom eg over noko som skremde meg.",Framfor meg var det ein snake som hadde eit par par par par par solskin.,Eg skreik og sprang heile vegen tilbake til hovudvegen.,Eg er ein biolog som studerer slanger.,Eg følgde vegen tilbake til bilen min.,2
433,Mary likte å drikka kaffi kvar morgon.,I dag hadde ho eit skund.,Ho gjekk på ein kafe.,Ho merka at kaffien ikkje gjekk rett etter at ho var borte.,Mary krasja inn i ein meningsmåling.,Mary heldt fram med å køyre og drakk det likevel.,2
434,Bill hadde nettopp flytta til ein storby for å arbeide.,Han følde seg einsam fordi han ikkje kjende nokon i byen.,Etter arbeid ein dag bestemte Bill seg for å bli med nokre medarbeidarar på drikk.,Han hadde det veldig gøy med dei.,Bill fekk mange vener den dagen.,Bill var opprørt på medarbeidarane sine.,1
435,Billy ville bli lege.,Han gjekk på college for å bli lege.,"Etter han hadde fått eksamen, endra han meining.",Billy vart ein sykepleiar i staden for ein lege.,Han angra aldri på at han hadde valt dette.,Han var så deprimert at han blei alkoholikar.,1
436,Quinton blei bortvist frå heimen sin.,Han var utan pengar og inga inntekter.,Ein dag bestemte han seg for å gje ut den siste dollaren han hadde i lotto.,Han kunne ikkje tru at han hadde vunne 50 000 dollar!,Quinton følgde seg deprimert.,Quinton var så glad.,2
437,Etter at Igor hadde vakna tok han seg i gang med å gjera seg klar for å gå på jobb.,Han opna dusjen og venta på at han skulle verta varm.,Vatnet vart verande kald.,Han debatterte om han skulle ta ein kald dusj eller ikkje dusja.,Han åt ein muffin.,Igor tok ein kald dusj.,2
438,Tara føretrekte big band musikk framfor alle andre alternativ.,Ho elska all gongen med horn og andre instrument.,Ho prøvde å finne nokre som kunne lita på ein annan stor gruppe.,Forsøkene hennar var nyttlause.,Tara likte det likevel å lytte på eiga hand!,Tara var ei vond jente.,1
439,Eg drog til Washington DC for å vitja kjæresten min.,Vi gjekk mange stader rundt i byen.,Men ein av dei stadane eg ville dra var Hvíta huset.,"Han tok meg med til Det kvite huset, og eg var så glad.",Vi tok turen og likte historia til staden.,Vi forlét Det kvite huset brått og tok ikkje turen.,1
440,Son min kjøpte eit trommesett til den einår gamle systersosan sin i haust.,"Setet hadde trommestikkar, ein cymbal og eit sete.",Niesen hans bur i New York.,"Ho såg det då ho kom på besøk, og ho vart verkeleg opprømt.",Ho hatar musikk.,Ho ville spela trommer.,2
441,Maggie hadde sin første pianoopptreding i kveld.,Ho var veldig nervøs.,"Då ho gjekk på scenen, skaka ho.",Og det gjekk bra med ho.,Maggie blei oppfordra til å gjera meir.,Maggie gav opp pianoet.,1
442,Ed likte å sjå på kino med familien.,Dei hadde mos og drikk og treff og dei sat på TV.,Dei såg på Aladdin i kveld.,Men Ed gjekk bortover før han kom i gang med å snakke.,Ed var fornøyd med slutten.,Ed angra at han hadde sovna.,2
443,Eg bestemte meg for at eg ville registrera meg som medlem i ein bank som hadde mi eiga gjaldsklubb.,Eg ringte kassa og sa når eg kunne få gjera dette.,Ho sa at eg kunne koma inn når eg ville.,Eg gjekk inn og tek imot planen i morges.,Eg er glad eg tek med.,Eg angrar at eg tek med.,1
444,Mac hadde ein vegetar ven som kom til middag.,"Han støynte, han visste ikkje om han kunne lage biff eller hamburgare.",Då kom han i hug eit oppskrift på alfredo-sås laga med cashewnøyt.,Til hans overrasking kom sausen ut kremaktig og deiisk.,Han bestemte seg for å servera kjøttkjøtt i staden.,Dei likte alle måltidet.,2
445,"Ryan var ein av dei, som jobba på vakt.",Han arbeidde ofte nattskiftet.,Ein dag såg han ein tømmerfugl på ein kjøpesenter.,"Han stirra på ho i timevis, til ho gjekk bort.",Ryan var blind.,Ryan meinte at jobben hans var ganske keisam.,2
446,Læraren til Johnny gav klassen sine ein del hjemmelagde snøkjel.,Læraren lét kvar elev velja ein farga sirup-topping.,"Då det var hans tur, vart Johnny sint fordi han såg berre ein farge att.",Læraren frå Johnny spurde kva som var galt.,Johnny sa til læraren at han var lykkelig.,Johnny sa til læraren at han var opprørt over at han ikkje fekk meir fargar.,2
447,Tim måtte velja mellom tre jenter å treffa.,"Han likte dei alle, men måtte ta ei avgjørelse.",Han snakka med dei alle tre for å sjå kven som likte han best.,Til slutt gjekk han med jenta som ville sjå han meir.,Tim er homofil.,Tim var fornøyd.,2
448,Jill overtala kjæresten sin Joe til å gå og leita etter Geocache saman med henne.,"Han synte ikkje det høyrde gøy ut, men bestemte seg for å gjera henne morsom.",Dei leita i kvar det viste seg å vera.,Etter meir enn ein time med søk kunne dei ikkje finna han.,Jill håpa at dei ville finna han snart.,Jill var glad at ho ikkje hadde med seg Joe.,1
449,Brigid og venen hennar Ella tok begge pianoleksjonar.,Faren hennar kjøpte eit dyrt klaver av ein kjend produsent.,Far til Brigid hadde berre råd til å kjøpa eit brukt piano.,Men Ella var ein dum jente som ikkje hadde nokon ide.,Ella blei aldri god på piano.,Så vart Ella ein stjernepianospelar.,1
450,Dave ville kjøpa ei pistol.,Han gjekk til våpenhandla og stilte mange spørsmål.,Han såg på store kanonar og små kanonar.,Han bestemte seg for at han ville kjøpa eit stort haglgevær.,Dave var imot det andre tilføyinga.,Dave kjøpte den og likte kjøpet sitt.,2
451,Rose tok eit tog til Long Island.,Der drog ho til den ytterste delen av øya.,Ho gjekk på stranden ved Montauk Point.,Det var kaldt og vindfast.,Rose var så varm at ho tok av seg jakka si.,Rose verna andletet sitt frå vinden.,2
452,Drew brukte ein skrivemaskin for eit spesielt prosjekt.,Han prøvde å vera forsiktig sidan han ikkje kunne sletta orda sine.,Men til slutt fall han i søvn.,"Ho enda på tangentane, og det blei skrive nokre bokstavar.",Drew var glad at han kunne gjera eit prosjekt utan feil.,Drew måtte begynne å skrive frå start.,2
453,Sarah har alltid vore fascinert av nattehimmelen.,"Då faren hennar la merke til lidenskapen hennar, kjøpte han eit nytt teleskop til henne.",Ho var ekstatisk.,Ho gjekk ut kvar natt for å sjå på nattehimmelen.,Far til Sarah tok tilbake teleskopet.,Sarah likte det nye teleskopet sitt.,2
