,input_sentence_1,input_sentence_2,input_sentence_3,input_sentence_4,sentence_quiz1,sentence_quiz2,answer_right_ending
0,"Eg blei ein fan av ""Law and Order"" i 2011.",Eg var på veg tilbake frå ein slag.,Då eg kom heim prøvde eg å sjå på kvar einaste episode.,"Det var verkeleg vanskelge å sjå ""20 år av røyk"".","Eg trur ""Law and Order"" er ein av dei verste serieene nok.",Til slutt så såg eg på dei alle.,2
1,Alle elska Bob fordi han spelte ein populær karakter i ein film.,Bob hatar det fordi han ikkje er typen som spelar innimellom.,Jim bad Bob om å seia karakteren sin sin kåre.,"Det var for mykje for Bob, og han eksploderte av sinne.",Bob sa til mannen at han skulle la han vera i fred.,Bob bad mannen om te.,1
2,Lita ville sjå på favorittprogrammet sitt på fjernsyn.,Barna hennar insisterte på at ho skulle setja seg og sjå på han saman med dei.,Lita sa til dei at ho hadde ein del oppgåver å gjera.,Barna hennar drog vaskerommet til stua.,Lita bestilte ein pepperoni pizza til lunsj.,Lita foldte vasketøy medan ho såg på TV.,2
3,Liv hoppa over då ho vart skremd av ein kraftig røyst.,Ho skjøna at det var gløden i kjøkkenet hennar som hadde gått av.,Ho fekk ut ein fotstol og trilla på han.,"Ho sveip under seg, og ho gjekk nesten ut av vegen.",Liv bestemte seg for å byta ei gløydlampa på badet.,Liv bytte ut gløydlampa.,2
4,Mamma sa til borna at det var lunsj om femten minutt.,Men så fekk ho ein telefon.,"Medan ho snakka, dra hunden med seg leire over heile kjøkkenet.","Dei små byrja å plaga mor si, som berre sat på telefonen.",Moren vart ganske frustrert.,Barnas oppførsel rote moren ned.,1
5,Hector har alltid kjøpt kaffi i ein lokal butikk før han går på jobb.,Han skjønar at vanen med å kjøpa kaffi er veldig dyr.,Ein dag bestemte Hector seg for å brygge kaffi heime.,Han er stolt av at kaffen han laga heime er så god.,"Hector laga kaffi for seg sjølv, og sparte pengar.",Hector byrja å kjøpe kaffi frå Starbucks.,1
6,Kelly fekk vita at det var ei ny jente på skulen.,"Då ho gjekk inn i skulen, gjekk ho ut og leita etter henne.","Då ho møtte henne, inviterte ho henne til å sitja med henne til lunsj.","Då dei åt lunsj, vart jentene vener.",Kelly snakka aldri med ho att.,Kelly var glad for å ha fått ein ny ven.,2
7,Tommy trena hardt for å springa sine første fem kilometer.,Under løpet vart han frustrert då så mange menneske gjekk forbi han.,"Då han høyrde namnet sitt kalla under prisutdelingar, vart han sjokkert.",Han visste ikkje at dei gav ut pris etter aldersgruppe.,Han skamma seg over at han ikkje blei anerkjend.,"Han var stolt av å ha vore nummer ein i aldersklassen, men tiande i allrekker.",2
8,Laurie skal til sin fyrste dans ikveld.,Datteren hennar tok henne med og gav henne ei vakker rose.,"Laurie hadde på seg ei lang, glittrande klede.",Dei dansa og hadde det gøy med alle venene sine.,Laurie gjekk gråtande heim.,Laurie enda kvelden med å kyssa daten sin.,2
9,Neil var på leting etter historiske jernbanelinjer.,"Han reiste inn i Scranton, Pennsylvania.","Han innsåg at det var eit vakkert, gammalt tog.",Han tok mange bilete medan han var der.,Neil har sletta alle bileta sine.,Neil sparte bilda på datamaskina si.,2
10,Bob var redd for den første dagen han jobba på ein matbutikk.,Han planla å venta med å kle på seg den kåande sjømannsuniformen.,Bob fekk til å laga fiskburgar etter å ha sett på seg uniformen.,"Han var så oppteken, han gløymde å skifte tilbake til gateklæret sitt.",Bob likte kleda så mykje at han viste dei til venene sine.,Bob gjekk ut etter jobb med sjømannskostyme på.,2
11,Ein ven kom på besøk.,Eg sa til henne at hunden min bit.,Ho høyrde ikkje på.,"Ho prøvde å leika med han, og ho fekk ein blekk.",Hunden min bit henne.,Hunden min rømde bort.,1
12,Lester har alltid vore meir kunstnerisk.,Ein dag bestemte han seg for å teikna eit bilete av ein blomst.,Han set seg framfor ein vakker orkidé og tek tekst.,Lester teiknar det veldig godt.,Han heng ut biletet på veggen i stua si.,Han bestemte seg for å ikkje teikne meir.,1
13,Pablo likar å eta ormar.,Han las om dette i ein bok på skulen.,Han stekt dei i olivenolje.,Han likar å gjera dette minst ein gong i månaden.,Pablo likte orm og såg på dei som ein delikatesse.,Pablo liker ikkje å eta ormar.,1
14,Kira har alltid elska japansk kultur.,Mange av dei yndlingsfilmane hennar var på japansk.,Ho bestemte seg for å reise dit.,I mange år spara ho pengar til reisa si.,Ho brukte alle pengane på sko.,Det var den beste reisa ho nokon gong har hatt.,2
15,Glen var i stemning for å gå ein tur.,Han tok på seg jakka si og gjekk ut.,"Medan han gjekk på fortauet, snubla han og braut kneet sitt opp.",Glen reiste seg opp att og limpa heim til seg.,Glen spelte sitt beste maraton noensinne.,Glen sa at han aldri ville gå igjen.,2
16,Jesus brukte dagen på å polera møblane.,Då det nærma seg natt såg han på arbeidet han hadde gjort.,Alt såg skinande og nytt ut.,Jesus inviterte alle venene sine over til ei fest den kvelden.,Dei sa at møblet hans såg fint ut.,Vennane hans polerte møblene hans.,1
17,Eg gjekk til butikken nyleg.,"Då eg gjekk forbi ei utgang, kjende eg koldt, hardt stål på armen min.",Eg vart sjokkert over at eg blei slått av ein bil!,Sjåføren var veldig oppriktig etter han såg at eg vart skadd.,"Eg sa at det var greit, og så gjekk eg.",Sjåføren av bilen vart veldig sint på meg.,1
18,Sysken til Gina skar ankeln på glasskjort.,Blodet rann nedover foten hennar og inn i skoen hennar.,Då ho såg blodet sprang ho heim.,"Gina sprang etter henne, men kunne ikkje halde på.","Då dei kom heim, åt dei alle is.",Sysken til Gina gjekk til legen.,2
19,Ein liten gutt var i tredje klasse.,"Han var veldig smart, men hadde vanskeligheter med å lesa.","Når han las høgt, lo klassekameratane av han.",Han byrja å trene lese lese lese dagen etter.,Den vesle gutten aksepterte at han aldri ville bli betre.,På slutten av året gjorde han det godt på lesestesten sin.,2
20,Rosie hadde ein liten fest.,Ho bestemte seg for å laga ein fruktsalate for alle.,Ho brukte mykje pengar på frukt og tid på å laga den.,På dagen for festen skumpa ho opp ei stor skål med fruktsalate.,Klassen til Rosie delte fruktsalaten.,Rosie hadde skålen med fruktsalate i kjøleskåpet heime.,1
21,Kelly var glad for å ha den nye telefonen sin.,Ho tok med seg den med seg kvar og ein stad.,Dessverre øydelagde ho det.,Heldigvis klarde ho å fiksa det.,Butikken gav henne ein rettferdig pris for å laga han.,Kelly kjøpte ei ny telefon.,1
22,"Då eg var på college, hadde eg møtt ein eldre mann.","Eg var 22 år gamal, og han var 38.",Vi hadde ei god forståing og hadde ein god tid saman.,Me vart verande saman heile tida eg var der.,Eg har gode minner frå den tida.,Eg har negative minner om den tida.,1
23,Bob ville vera i skolespelen.,Han studerte delen nøye.,Han øvde replikkane sine ofte.,Han gjorde ein strålande jobb med ho.,Bob var veldig stolt.,Bob skamma seg mykje.,1
24,Jackie har vorte utnemnd til å halde vakt over salen i 8. klasse.,Ho er misunneleg i heile klassen.,Klassekameratar sette ofte jobben hennar i fare.,Dei ville stela avgangskortene til Jackie.,Rektoren suspenderte dei bråkande klassekameratane.,Klassekameratane hennar fekk prisar for atferd.,1
25,Far min hadde nettopp kjøpt ei ny bil.,For å feira det gjekk me alle på ein tur.,Ein annan bil gjekk forbi ein stoppskilt og krasja inn i oss.,Eg slo på vindauga så hardt at han vart broten.,Eg gjekk ut av rommet og fekk vita at eg og far min hadde det bra.,Vi vart begge trilla ned av bilen.,1
26,"Niesen min elskar filmen ""Frosen"".",Ho vil alltid ha den på seg.,Ho går rundt i huset og syng.,"Ho elskar å skrike og kjem alltid til å seie, ""Lat det gå!""",Ho syngjer det om og om igjen.,Ho elskar sport og ikkje har noko imot prinsesse.,1
27,Alex gjekk på banen og hadde to poeng att.,"Han såg på resultattavla, og såg at det berre var fem sekunder igjen.",Han prøvde å finna ein mann som kunne opna hjartet sitt.,Dei forsvarsmennene heldt på like sterkt som lim.,"Blåsen gjekk, og laget hans vann kampen.",Han prøvde å kasta tre poeng og mista.,2
28,Eg kom inn i biblioteket og sette meg.,"Då eg såg meg rundt, såg eg ein liten.",Han stirra på meg ei stund.,Eg vart frustrert og reiste meg frå sitja.,Eg brydde meg ikkje om kva han sa.,Eg spurde han kva problemet var.,2
29,Iva og Brant prøvde å bli med barn.,Dei hadde prøvd i seks månader utan å lykkes.,På apotektsmøtet sitt uttrykte dei motløyse.,Men så såg dei at doktoren smilte mykje.,Brant kansellerar planen sin for å kidnappa eit barn.,Paret vil vera glade når dei veit at dei har ein baby på veg.,2
30,Catherine har alltid vore fascinert av curling.,Catherine elskar å sjå idrettsutøvarane på TV.,Ein dag bestemte Catherine seg for å gå på ein curling trening.,Under treninga bød ein av idrettsutøvarane Catherine til å spela.,Catherine byrja då å träna kvar dag og vart god på det.,Catherine meinte at curling såg keisam ut.,1
31,Francis har alltid sett fram til å læra å sjåførja.,Til slutt er han gammal nok til å få førarlegvisens.,Francis studerar veldig hardt for å få ein lisens.,Han klarar sjåførprøva lett.,Francis er verkeleg stolt av det han har gjort.,Francis bestemde at han heller ville ta offentleg transport.,1
32,I går hadde eg ein flott stund på å sjå Nøtskjellaren.,Eg elskar det.,Som dansarane prydde scenen var det vakkert.,Eg følde meg æra over å ha sett showet.,Eg svor at eg aldri skulle sjå han igjen.,Eg ville sjå det igjen.,2
33,Eg vakna til timen min klokka 8:30 om morgonen.,Eg stod somnarleg opp av senga og tok ei dusj.,Eg åt fort frokost og tok til å gå til klassen.,Etter ein halv time på skule gjekk eg tilbake til rommet mitt.,Eg bestemte meg for å gå tilbake til klassen igjen.,"Då eg kom dit, tok eg ein lur.",2
34,Gary ville få Lisas oppmerksomhet.,Ein dag bestemte han seg for å skriva eit dikt til Lisa.,"Dagen etter i skulen, ser Gary Lisa i hallen.",Gary leitar verkeleg til Lisa og gjev henne dikt.,"Gary slår Lisa hardt, og går bort.",Lisa innreknar at ho òg er forelskad i Gary.,2
35,Carlos har alltid ynskt å vitja Frankrike.,Han bestemde seg for at han skulle læra å tala fransk før han gjekk.,Han tek timar om kvelden og studerar veldig hardt.,Carlos kan endeleg snakka fransk ganske godt.,Carlos tek eit fly til Australia.,Carlos nyttar fransk på ein måte han kan på reisa til Paris.,2
36,Lars hadde alltid ynskt å prøva fotografi.,"Venen hans var ein framtredande fotograf, men han hadde aldri prøvd det.","Ein dag kjøpte han eit enkelt, men høgkvalitets, kamera.",Frå den dagen av tok Lars bilder av naturen kvar dag.,Lars vart forelskad i fotografi.,Lars hata fotografi.,1
37,Eg kjøpte ein fjernsyn i ein elektronikkbutikk.,Det er ein stor flatskjerm med ein høgt definert kvalitetsbilde.,"Ein av dei ansatte overtala meg til å kjøpe ei garanti på den, for ein gongs skuld.",Ei veke seinare fall fjernsynet av veggen min og gjekk i stykker.,Eg fekk laga den med garanti.,Den ansatte blei seinare funne død.,1
38,Ryan var i ein park.,Og han såg ein liten jente med ein ballong.,"Då han gjekk ut av parken, såg han den same ballongen sitja fast i eit tre.",Han klatrer opp i treet for å henta ballongen.,Ryan poppa ballongen med vilje.,Ryan fann jenta og gav henne ballongen ho hadde tapt.,2
39,Manageren hennar sa at ho måtte lasta opp CV-en hennar.,Ho merka at CV-en hennar ikkje var formata riktig.,Ho overførte alt innhaldet til den rette malen.,"Ho la til informasjon om den siste jobben sin, og oppdaterte CV-en.",Så sendte ho det til forvaltaren sin.,Jen hata å vaska opplag.,1
40,Neil var på rundtur i byen Fez.,Han smaka på det etniske kjøkkenet deira.,Så gjekk han og kjøpte suvenirar.,"Fez hadde òg gode gatekonsertsmenn, sa han.",Neil hadde det så gøy.,Neil og Fez blei bestevenner.,1
41,Eg trengte å ta hunden min ut på ein tur.,I kvartalet mitt treng ein lein.,Eg leita gjennom huset mitt etter båndet.,Eg fann ikkje det.,Eg bestemte meg for å ta hunden min med ut i hagen.,Eg lét hunden min gå inn i huset.,1
42,Det var ein lys og varm dag.,Så Joe tenkte det ville vera fint å gå ein tur.,Han bestemte seg for å gå til ein lokal kaffibutikk.,Men midtveis gjekk han og fekk vekk merka.,Så han sprang til kaffebarane.,Joe angrar at han gjekk ut.,2
43,Jen venta på ein pakke heile dagen.,Til slutt såg ho ein mann som gjekk opp til døra.,"Han leverte pakken, og ho tok han med seg inn.",Ho opna pakka med ein kniv.,I esken var det ein nyfødd baby.,Jen fann den nye kappa si inne i pakken.,2
44,Frank ville ikkje gjera leksene sine.,Han ville leke med meg på ein video.,Foreldra til Frank sa at han skulle gjera leksene sine først.,Frank fekk eit raseri og vart straffa.,Frank tapte alle dataspelet hans for ei veke.,Frank har eit heilt nytt speltitall.,1
45,Timmy var med i ein av dei tre kappingane på skulen hans.,Vinnaren har ein sjanse til å vinna ein $ 1000-studentsbeurs.,Timmy øvde seg på tre poeng heile helga.,Han var klar då dagen for tevlinga kom.,Timmy vann konkurransen.,Timmy gjekk på driving range på dagen for konkurransen.,1
46,Drake var på ei fest på fredag.,Han oppdaga at lommeboka hans hadde vorte stjålne frå kappa hans.,"Drake ringte straks politiet, men vesken blei ikkje funnen.",Drake konfronterte vertane til festinga om problemet.,Og vertelen sa til han at han ikkje visste det heller.,Drake sa til vertane at han ville delta i festane hans igjen.,1
47,Bob oppdaga at vogna hans hadde eit flat dekk.,Han hadde aldri bytt dekk før.,Han tok ut dekkjacken og jernet.,Han kunne ikkje fjerne boltene.,Bob ringde nokon for å laga det sprekke dekket hans.,Bob køyrde bilen sin til marknaden.,1
48,Jack er trøytt av å skriva e-post på nettbrettet sitt.,Han bestemmer seg for at han treng ein laptop.,Han undersøkjer ulike bærbare datamaskinar til han har funne den perfekte.,Til slutt gjekk han over det.,No elskar Jack å svara på mail.,Jack brukar no posttjenesten i staden for e-post.,1
49,Jake hadde hatt håret litt for langt.,Han hadde eit jobbintervju.,Han bad mora si klippa håret hans.,"Mor hans gav han eit fint klippe, profesjonelt hår.",Jake vaska hendene sine.,Jake fekk jobben.,2
50,Sean kom over i dag.,"Sam, Sean og eg spelte nokre spel.",Dei vart sjokkerte over kor dårleg eg var.,Dei sa at eg ikkje kunne spela meir før eg var frisk.,Eg vart verkeleg opprørt.,Eg var verkeleg fornøyd.,1
51,Sarah ville senda eit kort.,Ho gjekk til postkontoret.,Ho betalte for frimerke.,Ho la brevet i ein konvolutt.,Sarah leverte brevet sitt sjølv.,Brevet frå Sarah var snart på veg til målis.,2
52,Chuck var trøytt etter å ha jobba.,Han stengde arbeidet sitt ei stund.,Han opna forumet for å snakka med medarbeidarane.,"Etter å ha vunne dei vonde Zoltar-lønene, trengde han ein pause.",Chuck bestemte seg for å gå av jobben sin.,Så følde han seg tvinga til å gå tilbake til arbeidet.,2
53,Bob brukte plastposar til mat når han gjekk på kjøp.,Venen hans sa til han at plast ikkje er godt for miljøet.,Bob bestemte seg for å avstå frå plastposane sine.,Bob investerte i nokre gjenbrukelege kjøpesekk.,Bob brukte dei gjenbruke kjøpesekkane sine til å handla.,Bob heldt fram med å bruka plastposane sine til mat når han gjekk på kjøp.,1
54,Joe måtte laga eit portrett av seg sjølv for eit prosjekt.,Han ringte nokre lokale kunstnarar og spurde om prisane.,Ein av desse hadde eit rimeleg lønn.,Joe avtala eit møte med kunstnaren for å laga portrettet.,Joe var svært fornøyd med resultatet.,Kunstnaren måla ei Joe-kat.,1
55,Ann prøvde å slutte å røyke.,"Ho gjorde fleire forsøk, men mislyktast alltid.",Så søkte ho om å få eit nikotinplaster som kunne hjelpa henne.,Og det gjorde han òg!,Ann dobla mengda røykingar ho røykte kvar dag.,Ann fekk heldt på å slutte å røyke.,2
56,Jen vart sendt til tante si for sommaren.,Ho hata tanken på å vere borte frå biblioteket heile sommaren.,"Ho tok nokre bøker med seg, men ho ville gå gjennom dei fort.","Då ho kom dit, tok moster hennar henne med seg til eit spesielt rom i huset sitt.",Jen såg bøkene brenna i peisen.,Rommet var fullt av hyllar med bøker som appellerte til jenter.,2
57,I går var det tannrening for Rob.,Han er vanlegvis redd tannlege.,"Men det er ei ny, søt, ny sjukskvinne på kontoret.",Så han var verkeleg opprømt.,Rob følde seg frisk etter kolonoskopien.,Rob var lei av at den søte sykepleiaren ikkje kom.,2
58,Joe elska å eta jord.,Han laga laga laga mubbekaker kvar gong han fekk høve til det.,Han åt ei paje då han følde noko veldig hardt i munnen.,Joe hadde biten ned på ein stein og slått ut tannen sin.,Joe ville tygge på fleire steinar.,Joe bestemte seg for ikkje å eta jord igjen.,2
59,Rob har aldri vore på ei berg- og dalbane.,Vennene hans tilbød han ein gratis billett til Six Flags.,Rob bestemte at han kunne verta med.,Dei gjekk alle og venta i ei lang kø.,Rob hadde generøse vener.,Vennene til Rob var tankeløse.,1
60,Carly venta på at Sam skulle ringje henne.,Han lovde å gjera det på fredag.,"Det var no seint på ein laugardag, og ho hadde ikkje høyrt noko.",Til slutt bestemte ho seg for å ringje han.,Sam tok telefonen.,Carly bestilte mat over telefonen.,1
61,Amy kom heim frå skulen på bursdagen sin til eit tomt hus.,Ho var opprørt fordi alle hadde gløymt den spesielle dagen hennar.,Ho gjekk sorgleg inn i stua.,Brått kom venene og familien ut av gjemda.,Amy grin av glede.,Amy gjekk ut av rommet og forlét huset.,1
62,Pan prøvde å slå meg utan grunn.,"Eg var sint, men forsvarte ho.",Ho heldt fram med å kasta knytneven på meg.,"I eit forsøk på å stoppa henne, kasta eg henne på jorda.",Pan stoppa endeleg.,Eg gav Pan ein stor klem.,1
63,Becky har ein fetter som heiter Ashley.,Becky og Ashley var vener då dei var små.,Ashley byrja å vere dumme då ho voks opp.,Ho vart fengsla for å ha stjålet tamponger frå ein butikk.,Becky mista kontakten med ho.,Becky er stolt av Ashley.,1
64,Barnet til Pam og Tom sov lett.,Den tankeløse naboen deira lét ofte hunden sin vera ute og gøyr heile dagen.,"Kvar gong Pam fekk barnet sitt til å sova, byrja hunden å gø.",Pam fantiserte om å løyse hunden slik at han kunne rømma.,Ein natt lét Pam kattene sine koma inn i heimen.,Ein natt bestemte Pam seg for å løysa hundane.,2
65,May blei akseptert på college i Fredonia.,Ho tok bussen til den nye skulen sin.,Ho utforskte campus.,Ho likte alt ho såg.,Ho gjekk ikkje på skule.,Ho likte professorar frå heile Europa.,2
66,Mary trong å få trekt tenn.,Ho ville at tannlegen skulle sovna henne.,Han kunne ikkje gjera anna enn å bedøve området med Novocaine.,Mary stirra på han i raring.,"Etter å ha sett uttrykket hennar, kunne tannlegen hjelpa Mary.",Mary gjekk frå tannlegen i eit godt humør.,1
67,Ford var stolt av den høge gjennomsnittet hans.,Han arbeidde kvar kveld med oppgåver for å bli betre.,Vennane hans åtvara han om at han gjekk glipp av moroa.,Seinare i livet vart Ford ein suksessfull advokat.,Ford var lei seg over at han hadde oppnådd så mykje.,Ford var stolt av prestasjonane sine.,2
68,Kona mi seier at eg manglar lidenskap.,At eg ikkje har mange hobbyer eller interessar.,"Eg prøvde å argumentere, men kunne ikkje.",Eg innsåg at ho hadde rett.,Eg bestemte meg for å endra.,Eg er ugift.,1
69,Nina ville ha ein fin Halloween-kostym.,Men ho hadde ikkje råd til noko fancy.,Ho såg gjennom huset sitt etter ide.,Så fann ho eit flott skodespelar for gratis.,Nina kjøpte eit leiktøy.,Nina var opprømt.,2
70,Veronika likte å gå på tur i skogen.,Ein dag var ho på ein tur og fann eit trehus.,Ho klatrer opp på stigen og er forbauka over alle dei tinga som er i huset.,Det var fullt møblert med møbler og tepper.,Veronika likte ikkje trehuset særs mykje.,Veronika bestemmer seg for å vitja trehuset oftere.,2
71,Det var ein vakker vårdag tidleg i mars.,Tracey bestemte seg for å gå ein tur i skogen bak huset sitt.,Ho høyrde ein speid og byrja å leita etter han i trea.,Ho snubla over ei rot og fall på stien.,Tracey sprang heim att.,Tracey overførte fallane sine.,2
72,Bob var veldig tørst og ville ha ein soda.,Dessverre hadde han ikkje pengar.,Bob gjekk inn på ein bensinstasjon og spurde om han kunne få ein soda.,Kassereren spurde han om han hadde pengar.,Han sa nei og gjekk ut av bensinstasjonen.,Han bestemte seg for å gå på ein løype.,1
73,Jim venta på flyplassen.,Kona hans ville vore der om ein time.,Han var særs kjedeleg.,Han bestemte seg då for å ta opp boka si.,Jim såg kona si etter ein time.,Jim køyrde bort før kona hans kom.,1
74,Joe ville verkeleg gå på Columbia University.,Han var ein veldig hard lærar. Han spelte med i fotballlaget.,Han vart sett på ventingelista.,"Sjølv om han var skuffa, gjorde han sitt beste til det siste.",Joe var framleis veldig stolt av det harde arbeidet sitt.,Joe bestemte at han ikkje ville gå på college.,1
75,"Tami, Ginas veninne, hadde ei mappe som ho ikkje ville at nokon annan skulle ha.","Gina ville ha ein, men visste ikkje kvar ho kunne få ein.",No hadde Tami ein ny Lisa Frank som var leiaren for fangsten hennar.,Gina var sjalu fordi ho ville ha ein også.,Gina gjekk på eBay og fann ein ho kunne betale for.,Gina klipte heile hagen og hadde ingen hjelp frå nokon.,1
76,Leah hadde eit vakkert juletre i huset sitt.,Ein dag gjekk ho ut for å handla.,"Då ho kom tilbake, vart treet knekke om.",Katten hennar hadde klatret opp på han og trekt han ned!,Leah bestemte seg for at ho likte treet på golvet betre enn å stå.,Leah tukta katten sin.,2
77,Peter hadde brukt den same stolen i åravis.,Det var blitt slitent.,"Han bestemte seg for å kjøpa ein ny, meir komfortabel stol.","Då han kom, var Peter svært glad.",Peter tenkte det kanskje var meir komfortabelt enn det gamle.,Peter lét hunden sin bruke stolen for seg sjølv.,1
78,Rex er klar for å feste i kveld.,Han innsett at han ikkje har laga noko til gjestene å eta med ost.,Rex går ut og tek ei bagett.,"Han skjærer det i tynne, jamne skiver for å gjera det lett å eta.",Rex gjekk på ei lang reise over havet.,Alle likte ost og brød.,2
79,Ali tek alltid toget for å koma til jobb kvar dag.,"Ein dag var ho veldig sjuk, men gjekk likevel på jobb.",Ho arbeidde hardt heile dagen og tok til og med arbeid med seg heim.,Ho steig på toget og sovna.,Ho var ein lat arbeidar.,Ho mista stoppestaden sin og måtte ta bussen heim.,2
80,Fotballlaget hadde arbeidd hardt heile sesongen.,Dei hadde vunne alle kampane og vart til VM-gamer.,"Det var berre få sekund igjen på timen, og kampen var enda.","Quarterbacken kastar ein lang pass, og mottakaren skorar.",Folkemengda booed laget høgt.,Folkehopen reiste seg alle opp frå plassene sine og klappa vilt.,2
81,Vi bur i ein høgklossarbygning.,"Ein dag var vinden sterk, delvis på grunn av høgda til bygningen.",Vindet blåste tregren så mykje at kona mi ikkje kunne sova.,Vindet reiv òg ned internettkabeln.,Kona mi og eg var veldig misunnelege over å mista internettforbindinga vår.,Vi likte den sterke vinden og mangelen på søvn.,1
82,Kate ville kjøpa eit nytt tastatur til datamaskina si.,Ho spara i fleire månader for å få råd til eit godt tastatur.,Kate gjekk endeleg online og bestilde keyboardet sitt!,Ho venta spent i fleire dagar på at han skulle koma.,Så kansellerte ho.,Seinare fekk ho ein ny bordspelar.,2
83,Jon tok eksamen frå høgskole og byrja å søkja arbeid.,Han søkte om ein jobb på sitt område kvar dag.,"Tre veker etter at han byrja, blei han oppringt.",Den som ringde spurde om han var interessert i å bli intervjud.,Jon godkjende.,Jon avviste tilbodet.,1
84,Julie elska å lesa alt ho fekk tak i.,Mesteparten av tida hennar var på biblioteket.,Favorittbiblioteket hennar var bemanna av Miss Watson.,Miss Watson såg at Julie elska bøker og tilbød henne ein jobb.,Julie godtok med glede!,Julie slo venen sin i auget.,1
85,Familjen hennar var på veg til Six Flags.,Ho sat tålmodig i bilen og venta på å koma.,"Då dei kom dit, sette ho seg på kne og såg ut i parken.",Ho venta i kø i ein time for å få ri på den største berg- og dalbane-fjellet.,Amy var verkeleg spent på å vere i parken.,Amy meinte at parken var kjedeleg.,1
86,Steve hadde skund til å koma til fotballkampen.,På motorvegen køyrde Steve bilen sin veldig fort.,Straumgarden stoppa bilen hans.,Offiseren skreiv ut ein bøte til Steve for å ha kjørt for fort.,Steve var glad.,Steve var opprørt.,2
87,Dottera mi gjekk til den fyrste bursdagsfeira hennar for ein ven.,Ho var så spent på å halde fest.,Ho snakka ikkje om noko anna i ei viku.,Ho gjekk til fest og hadde det fantastisk.,Ho bestemte seg for aldri å gå på fest att.,"Då ho kom heim, fall ho i søvn med ein gong, utslept.",2
88,Bob trong pengar til å kjøpa mat.,Han var trist fordi han ikkje kunne eta fordi han ikkje hadde pengar.,Han bestemte seg for å skriva ei bok om det vanskelege livet sitt.,Folk roste boka med ein gong og kjøpte tusenvis av eksemplar!,Profittet frå salget av boka gav Bob nok pengar til å eta.,Reaksjonen frå offentligheten på boka tyder at Bob framleis er svolten.,1
89,Eg fullførte første maraton i dag.,Det var cirka seks miles og eg jobbet verkeleg hardt.,Eg trena for det i om lag tre månader.,Eg har alltid hatt det på mi liste over alle eg har gjort,Eg har aldri vore lykkelegare.,Eg er verkeleg skuffa over meg sjølv.,1
90,Bobby foldte fruktpakken sin i form av eit fly.,Han samla armane og kasta flyet så hardt han kunne.,"Det var altfor tungt, og fall som ein murstein.",Bobby bestemte at fly skulle laga av papir.,Bobby var fem år gamal.,Bobby var 35 år gamal.,1
