,input_sentence_1,input_sentence_2,input_sentence_3,input_sentence_4,sentence_quiz1,sentence_quiz2,answer_right_ending
1084,Sist helg ville eg kjøpa sko.,"Eg trengde eit nytt par frå jobben, så eg måtte leita etter eit sted å gå.",Eg valde kjøpesenteret fordi det er så mykje ymse.,"Då eg kom dit, gjekk eg raskt til butikken eg hadde valt.",Eg fann eit perfekt par sko og kjøpte dei.,Eg kjøpte ein taco på matgarden.,1
1085,Gabby hadde ikkje mykje pengar.,Ho hadde ein jobb med minimumsløn.,Ho brukte resten av pengane sine på ein lotteri-billett.,Ho kom heim og skreiv det av.,Ho håpa at billeta var ein vinnar.,"Før ho fekk det ferdig, bestemte ho seg for at det var ein kasting av tid.",1
1086,Morfaren til Annie trong ein hjartetransplantasjon.,Han låg på sykehuset i ein lang tid.,"Då det hende transplanteringa, var heile familien redd.",Han blei likevel frisk att.,Familien til Annie var glade for utfallet.,Familien til Annie var sorgleg.,1
1087,"Då eg var fem, flytta eg.",Eg måtte gå på ei ny skule.,Eg følde meg einsam den første dagen.,Ein jente kom bort til meg og presenterte seg.,Eg følde meg mindre einsam.,Eg følde meg meir einsam.,1
1088,Larry var redd for høgd.,Han planla alltid reisa sine slik at han kunne unngå høge bruer.,"Dessverre for Larry, ein dag blei han utlova til ein annan rute.",Larry byrja å svette då han såg brua som kom over han.,Han snudde seg for å velja ein annan rute.,Larry lat seg i lag av glede medan han køyrde over brua.,1
1089,Jeff er ein veldig rask tenkar.,Han kan vere i kva enn situasjon han er i.,Det einaste han treng å gjere er å finne på ein grunn til å gå.,Han brukar dette mykje når han ikkje vil snakke med sysken sin lenger.,Jeff elskar å vitja svigerforeldra.,Jeff hatar å tilbringe tid med svigerforeldra sine.,2
1090,Binh bestemte seg for å vaska katten sin.,Ho tok opp katten sin frå dekk.,Så fylte ho badekaret med vatn.,Binh overtala katten til å vaska han i vatnet.,Katten enda opp i eit skitent rot.,Katten enda opp som ein reint skjerm.,2
1091,Eg bestilte eit familiemåltid på ein kinesisk restaurant.,"Så snart eg hadde lagt han på bordet, gjekk dei til åtak på han.",Dei åt mykje av maten.,"Då alle hadde ete, var det ikkje mat att.",Eg var glad vi hadde funne ein ny favoritt-restaurant.,Eg sa til forvaltaren at eg ville leggja fram ein klage.,1
1092,Humberto likar å hoppa på ein trampolin.,Han har aldri falle av og såra seg.,"Medan han hoppa i går, gjorde han nettopp det.",Humberto bestemte seg for å trekkja seg frå å hoppa på trampolin.,Han fall aldri av ein trampolin att.,Humberto hoppa på trampolin heile dagen dagen etter.,1
1093,Matt møtte Tammy på ein nattklub.,Matt og Tammy utveksla nummer etter kvelden.,Dei snakka på telefon kvar dag.,Ein dag såg Tammy Matt med venen hennar Emma.,Tammy vart sjalu då ho såg Matt og Emma saman.,Tammy hata det å ikkje ha ein telefon.,1
1094,Ben var ikkje nøye med det han gjekk forbi vindueskarmen.,Han sveiv handa rundt.,Det treff kaktusen som sat i vindauga.,Han hadde eit par små nåler i handa.,Ben hadde eit fantastisk grep.,Ben hadde vondt i handa og måtte ta ut alle nåla.,2
1095,Janet var redd for å fly.,"Uansett kvar ho måtte gå, reiste ho alltid over land.",Ein dag fekk Janet vita at mora hennar var sjuk.,"Ho var veldig uroleg, og den raskeste vegen var med fly.",Janet var spent på å få fly.,Janet innsåg at ho omsider måtte sjå frykta si i augo.,2
1096,Det var Nate som skulle sveipe golvet denne uken.,Han var notorisk late.,Han bestemte seg for å betale ein av naboane for å få henne til å gjera det.,Mannen som held dei pengane og aldri fekk arbeide med dei.,Nate hadde det vanskeleg å finne energien til å møte han.,Nate og venene hans lat seg freista over atferda til hunden sin.,1
1097,Elena var ein liten person og var svært usikre.,Ho trudde ingen ville treffe ho.,"Ein dag møtte ho ein vakker, stor mann.","Dei byrja å dejta, og han aksepterte betinginga hennar.",Han friga til Elena etter seks månader.,Han tok med ein kvinne i full størrelse til selskapets høgtekne fest.,1
1098,"Då Jay fekk vita at storesøster hennar var gravid, vart ho nervøs.","Ho var glad for syster si, men redd for å bli tante.",Jay visste at det var eit stort ansvar han hadde.,"Men så kom ho heim frå skulen, og såg ein brorson,",Jay meinte at nevøen hennar var stygg.,Jay skjøna med ein gong at det ho var redd for var grunnlaust.,2
1099,Jon var tørst.,Han hadde ikkje rinnande vatn i huset sitt.,Jon bestemte seg for å gå og kjøpa vatn i butikken.,Dessverre var han i ein bilulykke på vegen.,Jon angra at han var tørst i første omgang.,Jon var glad han hadde forlatt huset.,1
1100,Daria kjøpte ein fjernsyn til stua si.,Ho lét butikken leverera fjernsynet til huset hennar.,"Då TV-en kom, var Daria begeistrad.",Televisjonen var det ho likte best.,Darla sette på TV-en og byrja å sjå på ein film.,Darla øydela fjernsynet sitt med ein rake.,1
1101,Hvite roser var Lillys favorittblomst.,Ho dyrka dei i hagen sin.,Ein dag prikk ho fingeren på ein torn.,Ho tenkte ikkje på det.,Lillys finger måtte amputertast.,"Pølsen blei smitta, og ho måtte ta antibiotika.",2
1102,Mor til Jimmy var sjuk på sykehuset.,Han gjekk og vitja henne på sykehuset.,Jimmy gav henne blomar og eit velkomne kort.,Mor hennar var veldig venleg.,Mor til Jimmy byrja å bli betre.,Jimmy hata mor si.,1
1103,Sammy hadde vondt i magen ein morgon.,Men ho tvang seg sjølv til å gå på skule.,"Då ho nærma seg bussen, tenkte ho på å venda attende.",Men ho følde det var for seint å skifte meining.,Ho sat på trottoaren og såg bussen køyr forbi henne.,"Ho gjekk på skule, og ho forstod ikkje kva ho sa.",2
1104,Karmen var allereie klar for reisa til Tanzania.,Ho tok ein taxi til flyplassen.,Ho gjekk raskt gjennom valla på flyplassen.,Ho fekk flyet sitt i tide og fann sitta si.,"Flyet tok av, og Karmen slapp av.",Karmen gjekk straks ut av flyet.,1
1105,Sandy budde i New York.,Sandy høyrde om ein farlig snøstorm som kom mot henne.,Sandy bestemte seg for å sørgja for at heimen hennar var ferdigstilt.,Under snjóstormen gjekk strømmen ut.,Sandy bestemte seg for å gå ut og laga ein snømann.,Sandy var førebudde.,2
1106,Quentin liker vanlegvis ikkje å gå på selskapshendingar.,"Sjølv om han ikkje har noko imot medarbeidarane, vil han gjerne laast vera i fred.",Ein dag bestemte han seg for å gå på ei selskapsfest.,Han et lite pommes frites for å unngå å føle seg litt rotete.,Quentin enda opp med å nyte festen.,Quentin elskar å vere saman med alle menneske.,1
1107,Eg brukar ikkje natriumsaus.,Eg er på ein natriumfattig diett.,Eg prøvde å kjøpa nokre flaskar på nettet i går.,"Datoren avviste kvar gong bestillinga mi, sjølv om kortet var aktivt.",Eg var glad for at det var så lett å gjera bestilling.,Til slutt gjekk salget gjennom.,2
1108,Dan ville gå på skulen på Halloween kledd som djevelen.,Han var redd for å be faren sin om kostyme.,Han spurde bestemor si om det i staden.,Ho fortalde han at han skulle gå som djevelen.,Mormor til Dan var allereie kledd som djevelen.,Dan laga sin eigen djævelskostym.,2
1109,Franz bestemmer at han vil vere nærare familien sin.,Han bookar ei tur for å besøke kusinen sin i Philadelphia.,Franz og kusinen hans går på museum og drikk kaffi saman.,Dei hadde eit fantastisk besøk saman.,Franz sver aldri å vitja kusinen sin att.,Franz er glad han gjekk og vitja kusinen sin.,2
1110,Eg kjøpte ein hornkråke då eg var ti.,Det var i ein kjøpesenter.,Kråken såg veldig fiern ut.,"Vi prøvde å gje han mat, men han ville ikkje eta.",Til slutt døydde den hornede padda av sult.,Etter fleire veker var den hornede padda svært feit.,1
1111,Eg møtte Nancy for fyrste gong i dag.,"Før ho gjekk, utveksla me telefonnummer.","Sjølv om ho gjekk vekk ei stund, skreiv ho alltid på for meg.",Eg bestemte meg for å ringe henne og be om å slutte å ringe meg.,Ho elska å eta bananar.,Eg fekk aldri meir vita om ho.,2
1112,I går gjekk Kelly til CVS for å kjøpe slikk.,Ho gjekk opp og ned i gangane for å finna det ho ville.,"Til hennar overrasking, trilla ho inn i ein gammal ven.",Dei to prate ei stund.,Begge vart arresterte.,Vennen hennar enda med å kjøpa slikket for henne.,2
1113,Den første dagen på brattavenna hadde han nokre hicka.,Han var nervøs fordi han var i nærleiken av ein del maskinar.,Ein gong hadde han gjeve frå seg ein stor sending.,Det gjekk nesten ikkje så bra.,Don var glad han ikkje var nervøs på jobb.,Don visste at han måtte forbetra seg.,2
1114,Dal trengde pengar for å gå på college.,Han byrja å jobbe for ein lokal gjeng.,Då FBI tok over byen gjekk han gjennom regnskapene.,Han blei skoten i ei kryssild.,Dal tok ei dårleg avgjørelse.,Dal tok ei kløkt avgjerd.,1
1115,I dag var det solskinsdag på skulen.,Alice var så spent fordi mamma hennar hadde kjøpt henne ein ny klede.,"Ho stod opp, kledde seg og moren hennar laga håret hennar.",Fotografen sa at ho var veldig pen.,Alice følde seg bra etter at fotografen hadde komplimentert henne.,Alice brynte på kinnet under bildet sitt.,1
1116,Mamma hennar hadde kreft i fjerde stadie.,Nila visste at ho ikkje hadde lenge igjen å leve.,Nila sørgde for at ho levde eit godt liv til ho døydde.,"Nila hadde mange gode minner om mor si, og dei var glade.",Nila brydde seg ikkje om mor si.,Nila elska mamma si.,2
1117,Ei mor såg på andletet til den nyfødde gutane sine.,Ho drømte om framtida deira saman.,Ho drøymde om å gje han det barnet han ikkje hadde fått.,Ho ofra tid og energi for å nå målet sitt.,Drengen leid gjennom barndomen.,Drengen hadde ei svært lykkelig barndom.,2
1118,Jessica og brørne hennar var veldig glade for julen.,Dei gjekk tidleg til sengs så dei kunne vakna tidleg.,Dei vakna og sprang til juletreet.,Det var berre ein boks under treet.,Jessica undra seg om dei hadde stått opp for tidleg.,Kvar og ein av brørne hennar opna julegavene sine.,1
1119,Jan og Kim brukte begge to dei same metodane i Montessori-utdanninga.,Kim bestemte seg for å ta alle dragkantene og fantasy-bøkene frå barnet sitt.,Jan var opprørt over at Kim tok denne avgjerda.,Jan argumenterte for at fantasi var viktig.,Jan kasta bort bøkene.,Jan kom med bøkene.,2
1120,Den første dagen på skulen gjekk eg dit med to av venene mine.,Vi var alle veldig nervøse.,"Då vi kom til skulen, gjekk vi gjennom klasslista for tredje klasse.",Alle tre av oss blei tildelade det same klasserommet!,Vi kunne ikkje tru på lukka vår.,Alle tre var vi svært skuffa.,1
1121,Jeff var sint fordi hunden til naboen hans alltid gjev om morgonen.,Og det var alltid ein kamp mellom dei to.,Ein dag gav naboen hans hunden sin bort.,Og Jeff var glad fordi han ikkje høyrde meir bål.,Jeff hadde funne fred og ro.,Jeff kom ikkje til å sjå hunden sin.,1
1122,Holly bad broren si om å smøre solkrem på ryggen hennar.,Han tok all si tid og brukte den forsiktig.,Seinare den dagen undra Holly seg over kvifor folk lo.,Seinare innsåg ho at broren hennar hadde laga ein design med kremiet.,Holly skrek på broren sin for å gje han tilbake.,Holly gav broren si pengar som kompensasjon.,1
1123,Eg bruka meg alltid med kona mi fordi ho hadde eit nattlykt.,Ho var boren for nokre dagar sidan og eg gjekk til sengs utan den.,Då eg vakna opp midt på natta for å få vatn snubla eg.,Eg kunne ikkje sjå kleda på golvet og fekk ein dårleg blåmerke.,Eg bestemte meg for å kvitta meg med nattskjerna.,Eg spottar ikkje konen min over natta igjen.,2
1124,Amy bestemte seg for å flytta frå Wisconsin til Florida.,Ho planla å flytta i fleire månader.,På dagen for flytinga sa ho farvel til venene sine.,Ho køyrde heile vegen til Florida åleine.,Ho fann likevel ut at Alaska var ein god del av livet.,Men det var ikkje moro å sjå dei utan venene sine.,2
1125,Kathy gjekk på shopping.,Ho fann eit par flotte sko.,Skoene kosta 300 dollar.,Ho kjøpte skoene.,Kathy hata å kjøpa sko.,Ho følgde kjøparens reinsar etter kjøpet.,2
1126,Amayah har bursdag snart.,Ho er snart fem år gammal.,Mamma hennar gjev henne ein prinsesseplass.,Ho er invitert med mange av venene sine frå skulen.,Amayah er glad for å kunne vera prinsessa på festen hennar.,Amayah er lei seg fordi ho ikkje vil ha ein te-party.,1
1127,Eg og gutane gjekk på stranden i dag.,Vi tok med oss ein frisbee og ein ball.,"Medan dei spelte i vatnet, kom nokre andre med.",Det var moro å få nye vener.,Eg likte verkeleg å treffe nye born.,Alt i alt var det ein flott dag å gå på tur.,1
1128,"Det var fredagskveld, så eg bestemte meg for å leiga ein film.",Eg drog ned til ein redbox for å få ein,"Etter å ha tenkt i ein time, valde eg endeleg Departed.","Eg kom heim, gjorde litt snacks, og så gjekk eg og la filmen i.",Det var den beste filmen eg hadde sett på lenge.,Eg dusja og gjekk på jobb.,1
1129,Paula skreiv mykje spoken word poesi.,Vennene hennar støtta ho sjølv om ho var illa ute.,Dei inviterte henne til ein fest.,Paula byrja å fortelje nokre historier.,Vennene hennar klappa på dikta hennar.,Paula rive opp dikta si.,1
1130,"Etter å ha stige av skolebuss, innsåg eg at telefonen mi var borte.","Sidan det var ei teneste på den, bestemte eg meg for å avbryte den.",Kundestøtte representanten gjorde det for meg.,Han sa at dei hadde ringt til Jamaica.,Eg visste at nokon hadde stjålet det.,Eg visste at nokon snart ville returnera telefonen.,1
1131,I dag var det femårsdagen hennar.,Mamma hennar hadde planlagt ei overraskingsfest for ho.,Alle venene hennar var der.,Ho opna gåver og åt kake.,Iris hadde det mykje moro på festen sin.,Iris bestemte seg for aldri å ha kake igjen.,1
1132,Tina bar alltid ein raud bikini når ho gjekk på stranden.,"Ho var kjend for det, og alle forventade å sjå ho på ein film.",Ein dag møtte ho venene sine i ein blå bikini og overraska dei.,Dei kunne ikkje forstå kvifor ho hadde på seg noko anna.,"Dei likte den nye bikinien, sjølv om dei ikkje hadde sett den før.",Vennene hennar visste kor uforutsigbare ho var.,1
1133,Ted hadde alltid drømt om å bli eigar av ein heim.,Men han hadde vore redd at det var eit mål han aldri kunne nå.,Ein dag overraska faren han med å seia at han ville hjelpa Ted.,Far hans hadde delt opp difor.,Ted sa at han ikkje ville vere eigar av eit hus lenger.,Ted var takknemlig til faren sin for hjelpa.,2
1134,Evie gjekk rundt i borga i timar.,Ho utforskte kvar krøk i bygningen.,Overforstandarane hennar spurde henne om det ho hadde lært.,Ho svara på spørsmålene deira med lys og letthet.,Ho var stolt av seg sjølv.,Ho flykta i redsle.,1
1135,"Ed og tvillingane hans, Ethan, gjekk på festar med jenter på nettet.",Så fekk dei sjå ei profil av ei jente som hadde eit par tvillingar.,Dei ringde Sami og Sara og avtala ein date.,På deiten sin hadde dei alle fire ein fantastisk stund.,Mange år seinare gifta dei seg.,Dei bestemte seg for å ikkje treffa kvarandre meir.,1
1136,Marco tek i dag på ein ny jobb.,Han vil sjå bra ut på fyrste dagen.,Marco bestemmer seg for å ta på seg eit slips.,Den nye sjefen hans er imponert over kor godt han ser ut.,Marco er glad at han gjorde eit godt inntrykk.,Marco er skremd av reaksjonen til sjefen sin.,1
1137,Tim ville reise utanlands.,Han hadde aldri vore på eit fly før.,Han bestemte seg for å reise til Kina med fly.,Han likte reisa verkeleg!,Tim svor aldri å gå på eit anna fly igjen.,Tim byrja å reise mange stadar med fly.,2
1138,Lucy hadde ein test i skolen i morgon og ho studerte knapt.,"Det var allereie veldig seint, og ho måtte gå og leggja seg.",Morgonen etter blei skulen skjult på grunn av snø.,Lucy var heldig og brukte heile fridagen på å læra for prøva.,Lucy gjekk med på prøva.,Lucy fall på prøva fordi ho ikkje hadde studert.,1
1139,Fred likte mysteriumromanar.,Han brukte å lesa minst ein om månaden.,"Då venene hans fekk det opp, gav dei han ein til bursdagen.","Men uheldigvis for vanlegheitene, så byrja han å bli irritert av dette.",Fred sa til venene sine at han tok ei pause frå mysteriumromanar.,Fred starta ein bokklub for mystiske romaner for venene sine.,1
1140,Tia eigde sitt eige bageri.,I bageriet sitt laga ho vakre kake.,"Ein dag innsåg ho at ho var utan mjøl, sjølv om ho hadde fått ein stor bestilling.",Ho ringte heile byen og fann endeleg nokre.,Tia var skuffa.,Tia vart lettla.,2
1141,Sarah gjekk med venene sine til akvarelparken.,Dei betala for billettane og tok på seg badetøy.,Dei vart sitjande i køen og venta på den største slipan.,Dei gjekk ned på rutsjåra og hadde det veldig gøy.,Dei svor aldri å venda tilbake.,Dei gjekk attende dagen etter.,2
1142,Jeb bygde statutar av stein.,Han laga ein som såg ut som ein skildpadde.,Sam kom og slo han ned.,Jeb byrja å gråta.,Sam lat og sprang bort.,Jeb var verkeleg opprømt når han fekk ny energi.,1
1143,Jeff skal på ein lekserutflukt til regnskogen med klassen sin.,Jeff er spent og kan ikkje vente med å gå.,"Då Jeff kom, var han svært skuffa.","Regnskogen var ikkje så spennende, og det var ikkje noko å gjera.",Jeff hadde det moro.,Jeff var lei og opprørt.,2
1144,Dani var sjukskjermster på Intensiv.,Ein natt var far hennar ein av pasientene hennar.,"Dani ville ikkje, men ho tok vare på far sin.","Då han vart betre, kunne dei to snakka.",Dani var ikkje overraska over hendingane den dagen.,Dani fekk kjenna faren sin mykje betre.,2
1145,"Gina var heime hos Ruth, venen hennar.","Ei jente ho ikkje kjende, som heitte Jane, kom opp.",Jane var uhøfleg og sjølvoppfyllande.,Seinare oppdaga Gina at Jane var syster til fienden Joe.,Så no held ho seg frå Jane heile tida.,"Så, med glede, blei ho venn med Jane.",1
1146,Ella brukte ein dag i sola.,Ho gløymde å smyr solkrem.,Ho har ein ille brann!,Men snart blei det slitne og blei ein solbrun.,"Ella såg bra ut, og fekk mange komplimentar.",Ella brukte dagen etter i regnet.,1
1147,Neil var nettopp komen til Kenya.,Han vart med i ein safari-reisegruppe.,Dei såg alle slags eksotiske dyr.,Neil tok eit bilde etter eit anna.,Han vart såret av ein løve.,Neil komponerte eit fotoalbum då han kom heim.,2
1148,Gina bestemte seg for å baka ei eplepaie for første gong.,Ho var særs forsiktig med å følgja oppskriften nøyaktig.,"Etter å ha sett pajen i ovnen, venta ho ivrig på å smaka på han.",Det viste seg å vera deilig!,Så ho bestemte seg for å kasta han i søpla.,Ho delte oppskriften og pajen med alle venene sine.,2
1149,Pablo ville ha ein kjevebrek.,Men han hadde ikkje pengar.,Han gjekk gjennom skapet sitt for å sjå kva han kunne selge.,Han fann ein leiktøybjørn og selde han for 50 cent.,Så kjøpte han slikket sitt.,Han kjøpte litt brus med det.,1
1150,Anna leigde ut eit lagerhus til ein stor fest.,"Dekorasjonane var fine, men noko mangla.",Då innsåg Anna - dei trengde ein diskotekugel!,Ho leigde ballen frå eit selskap som selde brikkevarer.,Anna var skuffa.,Partye gjekk bra.,2
1151,Oscar gjekk over til barnehagen for å finna eit tre å planta i hagen sin.,Han hadde det vanskeleg å avgjere kva for eit tre han skulle ha.,Det var mange tre å gå gjennom.,Til slutt valde han eit bonsai-tre.,Det gjekk perfekt med innrekninga i heimen hans.,Han øydelagde ho så snart han kom heim.,1
1152,Det var ein stor basketkamp i treningsalen.,Eg og venen min spelte på same lag.,"Spellet blei intenst, og begge team blei like i slutten.","Det var 4 sekunder igjen på timen, og me måtte ta ein test.",Eg fekk den vinnande korgen som vann kampen for laget vårt.,Eg gjekk ut av salongen og såg ikkje tilbake.,1
1153,Dirk var ein fin pianist.,Han opptredde ofte i offentleg høgd for pengar.,Under hans siste framføring braut ein av tastene av tastaturet hans.,"Han fullførte framføringa så godt han kunne, men musikken var dåleg.",Dirk vart skjemd.,Dirk likte korleis det høyrast ut.,1
1154,Eva elska egern i hagen si.,Ho byrja å gjev dei jordnøttesandwichar.,Snart vart dei vanleg med henne.,Ein av dei var særleg venleg.,Eva var redd for alle egern.,Eva var i stand til å klappa eit av egernane.,2
1155,Andy elska stranda.,Han spurde mor si om dei kunne gå på stranden.,Mor hans tok Andy med seg til stranden.,På vegen til stranden byrja det å regna.,Andy hata stranden.,Andy var lei seg for det.,2
1156,Eg kjøpte ein telefonhylse med ein snor.,Eg trengde ei telefon.,Kassane kom utan lanyard.,"På nettsida sa dei at den hadde ei brikke, men ikkje ein bånd.",Eg gav telefonen min tilbake.,Eg følgde meg som ein nar.,2
1157,Eg bytte laken på senga mi i forrige veke.,Eg var lei av dei gamle.,"Dei nye er finare, og dei føles betre.",Eg trur eg held dei.,Eg er glad for at dei ikkje var for dyre.,Eg planar å kappa dei i striper.,1
1158,Chase ville verkeleg ha eit nytt leketøy.,Mamma hans ville ikkje kjøpa eit nytt leketøy for han.,Ho rådde han til å spara lommepengane sine.,Han sparte lommepengane sine.,Chase kjøpte seg ein ny leiktøy.,Chase rømde heime frå.,1
1159,Renee blei inspirert av musikk frå Eddie Van Halen.,Ho bestemte seg for å læra å spela gitar.,Ho kjøpte ei elektrisk gitar og ein forsterkar.,Ho hata å trykkje på strenger med fingrane.,Renee bestemte seg for at ho måtte venja seg til det.,Renee var glad at ho bestemte seg for å læra å spela trommer.,1
1160,Bill gjekk og fiska og fekk mykje fisk.,Han fanga så mange at han måtte gje frå seg nokre.,Naboane hans var fattige og var takknemlege til Bill for fisken.,Dei naboane fekk endeleg stå på beina igjen.,Naboane til Bill saksøkte han fordi han gjorde dei fattige.,Dei bakar ein del brød til Bill som takk for fisken.,2
1161,Sist veke gjekk Internett ut.,Kona mi og eg kjende oss ut av livet.,Alle andre moglegheit var keisam.,Til slutt drakk vi og snakka litt.,Vi enda opp med å ha det gøy.,Vi var glade fordi vi ikkje hadde Internett og ikkje kunne drikka.,1
1162,Tim har alltid ynskt å lage musikk.,"Tim trena heile dagen, kvar dag.",Då Tim hadde fått nok songar ringte han ein platestudio.,"Studioen bestemte seg for å ta opptak med han, og Tim var glad.",Tim bestemte at han ikkje likte musikk.,Tim blei ein profesjonell musikar.,2
1163,Alex mistenkte at katten hans Tigger kunne ha lopper.,Tigger skreiv seg sjølv dag og natt.,Alex tok Tigger til dyrlegen for å få sett diagnosen.,Veterinæren stadfesta at Tigger verkeleg hadde lopper.,Dei gav han eit medikament mot loppe.,Alex bestemte seg for å ikkje gje katten medisinen han hadde fått forskriva.,1
1164,Haley var ein ung vitskapsmann på eit kjent laboratorium.,Kvar dag jobba ho hardt med det ho dreiv på.,Ein av kollegaene hennar stal forskinga hennar på løgn.,Haley fann ut dette då han publiserte det i eit vitenskapeleg tidsskrift.,Haley følde seg sviken.,Haley følte at ho hadde fått ei beundringsverdig støtte.,1
1165,Sam ville halda ei fest.,Sam inviterte alle venene og naboane sine.,Partye vart særs vilt.,Alle gjestene gjekk ut av festen i avsky.,Sam vart ein festplanleggar.,Sam hadde ein forferdeleg bakrus dagen etter.,2
1166,Katie kunne ikkje sova.,Ho gjekk på tå ned nedover og inn i kjøkkenet.,Ho henta eit glas mjølk.,Ho varma han opp i mikrobølgeovnen.,Katie drakk han og gjekk tilbake til senga.,Katie bestemte seg for å hella mjølka ned i avløpet.,1
1167,Tom snakka med kona si Becky som hadde hatt ein dårleg dag på jobb.,Han bestemte seg for å ta med eit favorittmåltid heim til henne som ei overrasking.,På vegen heim frå arbeid var det mykje trafikk.,Etter å ha fått maten kom han heim mykje seinare enn han hadde planlagt.,"Men det gjekk over, så snart dei hadde klemt kvarandre og spist.","Tom bestemte seg for å ta ein tur til kasinoet, han ignorerte familien sin.",1
1168,Dei måtte velja ut ein komfyr til det nye huset sitt.,Dei kunne ikkje avgjera kva slag av bein dei ville ha.,Dei likte holdbarheten til Viking.,Dei likte òg avtalen med Thermador.,Dei trong ikkje ha ein komfyr lenger.,Dei bestemte seg for å kjøpa Viking-ovnen.,2
1169,Jasmine studerte ikkje for den store matte-testen si.,Ho tenkte at ho kunne ordne det slik at alle likte det.,Jasmine innsåg snart at prøva var svært vanskeleg.,Ho bestemte seg for å fuske ved å sjå på avisa til naboen.,Læraren fekk henne og gav henne skulda.,Læraren fekk grepet ho og roste han for oppfinningslivet hennar.,1
1170,Sam flytta til Los Angeles for å bli ein filmstjerne.,"Han hadde ikkje mykje pengar, men han meinte at det var den einaste vegen han kunne gå.",Sam sov i bilen sin i to månader og gjekk på røyk.,Han gjekk til det kinesiske teateret for å tigga ein dag.,Sam følde seg ganske håpefull.,Sam følde seg veldig deprimert.,2
1171,Ben vakna seint.,Ben bestemte seg for å hoppa over frokosten og gjekk på jobb.,Jobben var for travel til å ta ei pause eller eta lunsj.,Etter jobb vart Ben gripne i ein veldig vond trafikk.,Ben var så svolten at han vart sjuk.,Ben var i stand til å koma heim raskt.,1
1172,Darren var sein til arbeid og kunne ikkje finna nøklane til bilen sin.,Han såg heile huset sitt.,Han spurde kona kvar dei var.,Ho sa til han at han skulle sjekka lomma sine.,Darren stengde av datamaskina.,Det var ingen nøkkel i lomma hans.,2
1173,Eg hadde ein jobbintervju i forrige veke.,Kjæresten min hjelpte meg med å velja ut eit nytt slips.,Vi gjekk til butikken og leita i timar.,Eg fann tre som eg likte.,Eg kjøpte ein fluga i staden.,Eg kjøpte alle av dei.,2
1174,Harry elska hockey.,Han bestemte seg for å tekna for å spela for ein lokal liga.,Harry var med på prøvingar for laget.,Harry håpa han gjorde det godt nok til å bli med i laget.,Harry trekt seg frå hockeytæma si.,Nokre dagar seinare fekk Harry vita at han var med i laget.,2
1175,Lille Sue var på ei elefant i dyreparken.,"Ho likte det først, men vart skremd.",Ho byrja å gråta etter mamma si.,Dyrvakaren i dyrehagen måtte stoppa elefanten og hente henne.,Mor hennar tok henne med til å smelte katten i staden.,Sue heldt fram med å ri på elefanten.,1
