,input_sentence_1,input_sentence_2,input_sentence_3,input_sentence_4,sentence_quiz1,sentence_quiz2,answer_right_ending
726,Mi romkammerat var sjuk.,Ho vart verande heime frå arbeid og skule.,Ho sov heile dagen.,Ved slutten av dagen følde ho seg betre.,Ho sa at resten hadde hjelpt.,Ho håpa at ho snart ville bli sjuk igjen.,1
727,Ted og venene hans gjekk til parken for å klatrera eit fjell.,Dei byrja på fotturen.,Etter to timar vart dei trøytte og tok ei pause.,Dei enda oppfalla og var på toppen.,Ted gjekk i bilen sin og køyrde heim.,"Utsikten var fantastisk, og Ted var glad at dei var komne.",2
728,"Det er vanlegvis stille og varmt om morgonen, i Florida.",I går morgonen var det veldig vindlyst.,Palmeblada blåste så hardt at dei skrapa vindauge.,"Eg starta på TV, og så sa dei at det var ein tornado.",Ein tornado kom to kvarter frå huset.,Så eg gjekk ut og leika.,1
729,Eg har vore på eit kunstnarlag nyleg.,Eg fekk ei teikningsanvisningsbok til jul.,Boka har ein kjøpesetning for dei nødvendige teikningsutstyret.,Eg gjekk til butikken ein annan dag og kjøpte det eg trong.,Eg vedtok at eg ikkje likte å teikne.,Eg gjekk heim og øvde meg på å teikna.,2
730,Lisa byrja å innsjå at ho ikkje likte å studera handel.,"Ho ville studera kunst, men var uroleg for å tjene pengar.",Ein dag fekk ho omsider motet til å gå ut av skulen.,Venner og familie sa at det var dårleg å gå ut av skolen.,"Lisa var likevel sikker på at det valet ho hadde gjort, ville gjera henne lykkelig.",Lisa har ein grad i business.,1
731,Mary ville gå på ein sen film.,Dessverre hadde ho skule og strenge foreldre.,Ho venta til alle andre sovna og smyga ut.,Ho såg filmen med vener og hadde det fantastisk.,"Då foreldra hennar fekk tak i ho, fekk ho husarrest.",Vennene til Mary var svært skuffa på henne.,1
732,Ivy hadde fått ei uvanleg avtale.,"Peter, som ho var glad i, hadde invitert henne ut på tur.",Ivy var samd i det.,Dei gjekk ut i skogen og tok ein tur i fleire timar.,Seinare såg dei på solnedgangen frå ein klippe.,"Ivy drog heim, og snakka aldri med Peter att.",1
733,Ein mann gjekk for å designa det høgaste tårnet i verda.,Han teikna planar for å gjera den dobbelt så høg som den no høgaste.,Han gav byggplanen til ein bygningsutviklar.,Utbyggjaren spurde han kor høg han ville byggja tårnet.,Mannen var ikkje ein bygningsdesigner.,"Mannen bygde tårnet, og det var storslaget.",2
734,Lauren og systrene hennar er på besøk i Jacksonville i Florida denne vekta.,På den siste dagen på reisa vil dei ha eit bilete saman.,Lauren og systrene hennar poserer framfor ein søt kafé.,Ho har laga eit bilde og send kvar syster eit eksemplar.,Ho stirra på kor likt ho og syster hennar såg ut.,Ho rive opp biletet og kasta det bort.,1
735,Liz var barnevakten for ein femåring.,Han ville leke skjul og søk.,"Ho fann han eit par gonger, men så forsvann han.",Ho vart nervøs ettersom ho leita i huset etter han.,Liz vart lei av spelet og tok ein tupplur.,"Då ho høyrde han gilla frå ein skap, vart Liz lettla.",2
736,Mark var sein til jobb.,Han prøvde å få dei i tide ved å køyre over fartsgrensene.,Ein trafikkbetjent stansa han.,Han fekk ein fartbann.,Mark enda opp med å koma for seint til jobb.,Mark var tidleg på jobb.,1
737,Amy har alltid ynskt å spela fløyte.,Den første dagen i bandet fortalde ho det til læraren.,Ho øvde på fløyten sin kvar dag i ei veke.,Det var forferdeleg vanskeleg å spela fløyte.,Amy var svært engasjert.,Amy viste liten interesse for fløyten.,1
738,Bryan handla frukt for familien sin.,"Han såg gjennom heile veggen, men kunne ikkje velja ein frukt.","Kona hans hata druer, dottera hans hata eple.",Til og med sonen hans var ein krass frukt-etjar!,Bryan kjøpte pasta.,Bryan bestemte seg for å kjøpa bananar.,2
739,Emily tok barnet sitt med til dyreparken.,"Dei såg mange dyr, inkludert løver.",Barnet hennar var veldig redde for løvene.,Han byrja å skrika og gråta.,Barnet til Emily gjekk nærare løvene.,Emily tok barnet sitt i arm for å trøysta han.,2
740,Kim kunne få ein valp om ho gjorde ein mål i kampen.,Ho øvde heile dagen heime.,Ho øvar i salongen etter skulen med teamet sitt.,Det var store dagane i kampen.,Kim scorte ein kurv og fekk ein valp.,Kim var opprørt då familien hennar fekk ein valp.,1
741,Karen spelte softball.,Det gjekk ikkje så bra med laget hennar.,Og trenaren deira gav dei ei røyst på eit veldig sterkt språk.,Alle byrja å freiste og arbeidde mykje meir.,Karen utvikla seg med teamet.,Karen følgde seg ikkje motivert etter å ha høyrt talen.,1
742,Kayla har ikkje vore på eit sosialt arrangement i nesten tre år.,Ho leid av forkrøplingsangst.,"Jo lenger ho heldt på, jo vanskelegare vart det.",Broren hennar var nervøs og tok henne med til terapeuten.,Kayla meinte det var den beste dagen ho nokon gong hadde hatt.,Kayla fortalde terapeuten at ho hadde suicid-tendenser og bad om hjelp.,2
743,Ricky fall medan han gjekk på fottur i skogen.,Han var skremd!,Han trudde han hadde kome til eit område med eit giftig is.,Så brukte han naturguden sin til å identifisera planten.,Han vart lettla når han fekk vita at han hadde teke feil.,Ricky var våt av å ha falle i dammen.,1
744,Mannen min elskar Blue Belle is.,For ikkje så lenge sidan blei Blue Belle tilbakekalla og gjekk ut av produksjonen.,"Son min jobbar i Kroger, og dei hadde eit møte i Blue Belle på eit tidspunkt, i fjor,",Blue Belle kom til Kroger i forrige viku.,Mannen min er så takksam!,Mannen min er så skuffa!,1
745,Oni hadde aldri framført for eit publikum.,"Men han gjekk inn i den store konkurransen, og han håpa at han ville vinna.",Han tenkte at han berre skulle gjera det beste han kunne.,Oni song i showet og alle klappa.,Oni vann talentkonkurransen med den fantastiske songen sin.,Talentane sa til Oni at han aldri skulle koma tilbake.,1
746,Ralph hatar å handla.,Mor hans tvingar han til å gå.,Dei er der lenge.,Ralph hjelper mamma si med å lasta og lossa matvarer.,Mamma til Ralph straffar han fordi han nektar å hjelpa.,Han er overraska når mamma hans gjev han pengar for å hjelpa.,2
747,Kayla lånte ei bok frå syster si.,Ho tok boka med seg til ein kaffebar for å lesa.,Kayla spilde ved ein feil litt av vaniljelatte på boka.,Ho gjekk straks heim for å fortelja det til syster si.,Kayla var einebarn.,Søsteren hennar var gal!,2
748,Lenny ville sjå på ein film.,Han køyrde til den lokale Hollywood-videoen.,Lenny leigde tre skrekkfilmar.,Lenny gjekk til naboen og kjøpte ein pizza frå ein butikk.,"Han gjekk heim og såg på alle dei filmane han hadde gjort, og han sa:","Då han kom heim, var han klar til å returnere dei tre filmane sine.",1
749,Laura fortalde ei historie om brennande bhar på 60-talet.,Folkemengda vart gal etter å ha fått vita denne personlege opplysinga.,Laura forsikra publikum om at det var lenge sidan.,Ho gav seg ut til å bli president.,Laura blei deretter avsagt av landet.,Laura blei deretter vald av landet.,2
750,Charlie ville bli ein politioffiser på Hawaii.,Han gjekk gjennom prøva og fekk ein jobb i Honolulu.,Charlie likte å samhandle med samfunnet.,Charlie likte ikkje korrupsjon i styrken.,Charlie byrja å ta imot bestikkelser.,Charlie svor at han ville endra ting om han blei gjort til sjef.,2
751,Eg hadde to hundar som var veldig nære.,Den eldre hunden vart veldig sjuk og blei sett til å sovna.,Den yngste hunden var veldig einsam.,Vi har ein nabohund som er komen for å leika.,Hunden vår likte verkeleg å ha huset for seg sjølv.,Hunden vår føler seg mykje betre når han leikar med ein annan hund.,2
752,Romsamkarane til Sean merkar at kleda hans og senga hans byrjar å lukta.,Dei seier at han må vaske opp skiten snart.,"Sean protesterer i byrjinga, men til slutt vaskar han vasket.",Båe romkameratane hans er glade fordi dei ikkje luktar like mykje.,Båra romkameratane hans vart veldig sinte fordi han ikkje høyrde på.,Dei seier at han aldri må vente så lenge med å vaska igjen.,2
753,"Vennen min vil bli lege, så ho tok ein MCAT.","Den fyrste gongen ho tok det, fekk ho ikkje eit godt nok resultat.",Ho studerte veldig hardt og tok det igjen.,Denne gongen klarte ho seg veldig godt!,"Ho snakka aldri om det igjen, og ho blei ikkje lege.",Vi tok henne med ut på eit par drinkar for å feira.,2
754,Kelly gjekk ned til havet for å slappa av.,Ho gjekk straks og sette føtene inn.,"Då ho sette føtene inn i sjøen, fekk han henne.",Kledingane hennar vart våte.,Kelly gjekk heim for å byta på seg tørre klede.,Kelly var veldig glad for å ha våte klede.,1
755,Ben var spent på å gå på fisketur med bestefaren sin for første gong.,Men han fann det stygt å setja ormene på kroken.,Han stikk av ei vonde gong på fingeren sin med ein av hookane.,Ben innsåg snart at fisking ikkje var for han.,Ben spurde bestefaren sin når dei kunne gå på fisking neste gong.,Ben spurde bestefaren om dei kunne sjå på ein film i staden.,2
756,Amelia var klar for ein date på ein italiensk restaurant.,Amelia hadde fått ein venn som hadde sett henne på ein blind date ein veke før.,Ho kom til restauranten tidlegare og venta på daten sin.,"Tretti minuttar hadde gått, og daten hennar kom ikkje.",Amelia gjekk heim att.,Amelia var svært glad.,1
757,Moren hennar ville verkeleg få eit bilde av barnet sitt med Santa.,Drengen var redd og sa nei.,Mamma sa til gutten at nissen hadde ansvar for å bringa gåver.,Dette endra tankane til gutten.,Gutten håpa å få mange gåver frå Santa!,Gutten gjekk utan å få ta bilde av seg.,1
758,Stewart prøvde å fullføra favorittoppgåva si før han gjekk til sengs.,Han var så oppteken at han gløymde å halde på med å laga fyr.,Rystande drog han ein haug med tepper rundt seg.,Han vart veldig varm og tilfreds.,Då han vakna var det froststilt.,Stewart var glad for at han hadde hugsja på å halda elden i gang.,1
759,Anthony ville læra å tala spansk.,"Han fann ein spansk kurs på nettet, og han melde seg på.","Anthony studerte hardt, og til slutt lærte han språket.",Anthony snakkar spansk flytande no.,Anthony fekk suksess på grunn av språklege evner.,Anthony kunne ikkje få språket ned rett.,1
760,Amy gjekk til matbutikken etter jobb.,Ho hadde ei lita liste over ting å kjøpa.,Butikken hadde ikkje meir enn halvparten av artiklane.,Amy måtte gå til ein annan matbutikk.,Ho kjøpte to kjortlar og ein bluse.,Etter det kunne ho gå heim og laga eit godt måltid.,2
761,Joanie var klar til å tørka håret sitt for ein date.,Ho vart opprørt over at bløytørkeren hennar ikkje var der.,Då høyrde Joanie ein kjend lyd utanfor.,Ho såg broren sin bruka tørketrommel.,Joanie var glad for broren sin.,Joanie sprang ut for å konfrontera broren sin.,2
762,Cornelia bestemde seg for at ho ville omorganisera leiligheten si.,Sova hennar har stått ved veggen i mange år.,Cornelia flyttar senga si for å sitja ved vinduet.,"Når venene hennar ser det nye arrangementet hennar, elskar dei det.",Cornelia flytta då senga si tilbake dit ho var.,Det var ikkje lenge før alle venene hennar hadde gjort senga si på same måte.,2
763,Tim elska motorsykkelen sin.,Han reiste på den kvar gong han kunne.,"Han sa: ""Eg gjekk ut av Auschwitz ut til livet og eg avga eit løfte.",No er det nesten aldri han riar på den.,Tim følgjer seg trygg når han ri på motorsykkel.,Tim er redd for å ri motorcykelen sin.,2
764,Wendy fekk sitt første jobb som sykepleiar på eit sykehjem.,Ho elska jobben sin og fekk gode kontakter med beboarane.,Ho likte verkeleg å snakke med ein gamal dame.,Ein dag viste ho henne bilete av borna sine.,Wendy sprang gråtande ut av rommet.,Wendy likte å sjå desse bileta.,2
765,Tom og Jake gjekk på konsert.,Dei såg eit band dei elskar.,Dei gjekk inn i den almene inntaksloka.,"Nokre svært lange menneske stod der, så dei kunne ikkje sjå noko.",Tom og Jake kunne ikkje sjå sitt favorittband.,Tom og Jake likte den fine utsikten.,1
766,Lester var stolt av at han hadde vore utan mobil i fleire år.,Han likte å trudde han var mindre avhengig av teknologi enn dei andre.,"Men ein dag hadde bilen hans eit flat dekk, og han ønskte han hadde hatt ein telefon.",Han ville ikkje ha ei slik oppleving att.,Lester heldt fram med livet utan mobiltelefon.,Lester gjekk ut og kjøpte den beste mobiltelefonen han hadde råd til.,2
767,Ben trengte ein oljebytte i bilen sin.,Han visste at dei var ganske dyre.,Så såg han ein kupong i avisa.,Ben hauke det ut og tok det med seg til garasjen.,Ben fekk oljen bytta.,Ben selde nyra si for å få crack.,1
768,Eg vakna opp sult.,"Eg helte ein skål med cereal, men fann ut at eg ikkje hadde mjølk.",Etter å ha vurdert å bruka vatn bestemte eg meg for å gå til butikken.,Eg gjekk ut i gongen og fekk ein halv liter med to prosent.,Eg kom heim og åt fløsk.,Eg kom heim og åt pizza.,1
769,Anna hadde ein saltvatnstank.,Ho heldt berre på korallet.,Så bestemte ho seg for at ho ville ha litt fisk òg.,Ho kjøpte nokre små klovnfiskar og avløysarar.,Anna gav snart fisken tilbake til butikken.,No har Anna ein mangfoldig tank med fisk og koraller.,2
770,Holly var ein vakker svart katt som Lee elska mykje.,"Dessverre vart Holy sjuk, og Lee måtte avliva henne.",Lee var veldig trist fordi han savna Holly kvar dag.,"Ein dag, like etter at han hadde gått på fest, kom det opp ein liten svart kattunge ved heime.",Lee bestemte seg for å adoptera ein valp.,Lee bestemte seg for å adoptera kattungen.,2
771,Bob trong eit nytt par sokkar.,Han gjekk til det lokale varehuset for å kjøpa dei.,Butikken hadde eit stort utsalgsprogram.,Han fann ut at han kjøpte mykje bra ting.,Bob likte verkeleg handlespringa si.,Bob gav alt tilbake dagen etter.,1
772,Den unge Reggie likte å spela og sjå på American football.,Favorittpelaren hans var Jamal Lewis.,Han var på Salt Lake flyplassen med familien og såg helten sin.,Han gjekk bort til han og sa at han òg ville spela profesjonell fotball.,Jamal Lewis gav han eit godt råd og ønskte det beste for han.,Ung Reggie sa til han at han skulle halda seg borte frå han.,1
773,Ella fann ein liten robin på jorda.,Ho visste at ho måtte ha fall frå reiret.,Ho pakka det omhyggeleg og gjorde det til eit trygt hus.,Så gav ho han orme med handa.,Ho likte å ta vare på robin.,Men ho ville ikkje ha hamsteret sitt lenger.,1
774,Eg tok ei avgjerd om å gå frå jobben min.,Eg skreiv oppsigelsesbrevet mitt.,Eg gjekk stille og gav dei dei tilbake.,Eg gav opp jobben min.,No er eg fri til å gjera ein karriere som gjer meg lykkelig.,Eg går tilbake til jobben min i morgon.,1
775,Eg la den svarte plastrosa i ein vase med vatn.,Eg la den på hylla mi i nokre veker.,Ti menneske spurde meg om det.,Dei ville vite kvifor eg hadde ein skuffande avlasting.,Eg visste verkeleg ikkje hvorfor eg gjorde det.,Etter nokre veker døydde blomen.,1
776,Ben bestemte seg for å trekta seg sjølv med ein kaffi.,Han betalte for kaffen med kredittkortet sitt.,Seinare ringte banken og sa at han hadde gått for langt.,Dei forklarte at han måtte betala ein avgift på tretti dollar.,Ben var frustrert over den ekstra ladinga.,Ben var glad etter å ha fått telefonen frå banken.,1
777,Chris var på sin andre stopover denne uken.,Han gjekk rundt på flyplassen og bestemte seg for å nyttast tida.,Han installerte ei app på telefonen sin og byrja å øva på fransk.,Ein annan kunde på flyplassen overhørte han og sa han kunne hjelpa han.,Patronen hjelpte Chris med å læra seg å tala grunnleggjande fransk.,Mottakaren forstod ikkje Chris fordi han berre snakka kinesisk.,1
778,Google starta med dette barnet då eg var liten.,Eg kan minna meg på ein gong eg spurde far min korleis han brukte nettområdet.,Han lærte meg å skrive og leita på kva som helst.,"Eg blei verkeleg imponert, og eg brukte kvar dag på skrivebordet mitt til å verkeleg bry meg om det.",Eg lærte mykje frå Google.,Eg vert fort veldig sint på det.,1
779,"Jeff var i ferd med å bli forfremja, og han måtte gå på intervjua.",Han gjekk heim og studerte veldig hardt og lærte alle svarane sine utanfor.,Han førebudde seg i mange dagar til han følde seg klar for intervjua.,"Han gjekk på intervjua, og det gjekk bra!",Han var glad då han fekk forfremminga.,Han innsåg at han måtte gå frå jobben sin.,1
780,Ritz vart fødd i eit stort kuld med 12 andre valpar.,Då han var åtte veker gamal blei han fødd i ein veletablert hus.,"Dei oppveksa han vel, og han levde eit lykkelig liv.",Ting endra seg for Ritz ein dag då eigaren hans fekk kreft.,Ritz blei foreldreløs og måtte send til eit tilhald.,Eigaren hans gjekk 12 mil kvar dag.,1
781,Mia elska å vere utendørs.,Ein sommer bestemte ho seg for å gå på fjellklatring.,Ho vart med i ein klubb av folk som klatrer fjell saman.,Dei klatret på det høgaste fjellet i området hennar.,Mia hadde det så gøy.,Mia ønskte at ho kunne vera innendørs.,1
782,Bossen hans kalla han inn på kontoret hans på bensinstasjonen.,"Han fortalde Fred at tida var hard, og at han måtte få ein oppsigelse.",Fred vart veldig sint på dette.,Han tok sjefen sin i kragen og kasta han ned.,Fred sin sjef gav han eit stort klem.,Ein kollega av Fred som såg han slå sjefen ringte politiet.,2
783,Sysken min prøver å spara pengar.,Ho er nyleg enkje og lever på pensjon.,Ho fortalde nyleg to av tre kabel- og fjernsynslåtar.,Eg sa at antenna fungerte fint no som TV-samtalarane er i HD.,Ho kjøpte fleire kabel-TV-stasjonar.,Ho vart glad for å høyra det.,2
784,Victor har alltid vore stolt av å smaka på nye matvarer.,Men han har aldri ete ein pistacio.,Ein dag kjøpte han ein krukke med pistaciar for å eta der heime.,Han elskar korleis dei smakar.,Victor bestemmer seg for å byrja å kjøpa pistaciar regelmessig.,Victor merkar at han har gløymt sweatshirten sin på gymmet.,1
785,Sharon hadde gøymt ei pose med ukjende frø i fleire år.,Og ein dag bestemte ho seg for å planta eit nytt stykke av frukt.,"Sharon la dei i planter, fordi ho trudde dei var små plantar.",Sharon kunne ikkje ha vore meir feil i sin forutseining!,Ho sprang opp ein øl og tok ein slurk.,Dei enda opp i store planter.,2
786,Det var ein fantastisk dag ute.,Emily ville utnytte det fine været.,Ho bestemte seg for å gå i parken.,Emily vart skuffa då ho fekk vita at bilen hennar ikkje starta.,Ho bad naboen stela henne opp.,Ho køyrde bilen sin til mekanikeren for å få han til å sjå på han.,1
787,Tom var trøytt av kvardagslivet.,Så han bestemte seg for å flytte til ein annan stad.,"Den første uken var det greit, men så hadde han ikkje vatn til å drikka.",Han hadde lidt i to dagar og fekk ikkje noko.,Til slutt gjekk Tom tilbake på nettet.,Tom elska ideen om ein fast.,1
788,Tim ville læra astronomi.,Han ville reise ut i rommet.,Men han var for ung til å bli astronaut.,Dette gjorde han sorgleg.,Tim arbeidde hardt på skulen for å bli ein.,Tim hata Mars.,1
789,Sysken min arbeider på eit pleiehus.,Ho er servitris.,Ho gav oss ein kalender frå senteret.,Ho var utsmykka for å ha høgt opp på St. Patrick's Day.,Me synest ho såg for gamal ut.,Søsteren min gøymde noko for oss.,1
790,Fred bestemte seg for å kjøpa nokre aksjer i Apple.,Aktiekursen var 90 dollar når han kjøpte den.,Heldigvis hadde dei ein god inntekt i går.,Deretter gjekk aksjen opp til 100 dollar.,Fred angra på at han hadde kjøpt aksjer.,Fred var svært glad.,2
791,Jen var så sikker på at ho var klar for å stå på ein spelling konkurranse,Ho hadde brukt den siste månaden på å studera ordboka kvar kveld.,"Då Bi byrja, overlevde Jen medan dei andre vart slått ut.","Det gjekk utover to og ein halv sjanse, og det var ein kamp mellom dei to som var mest sårbare.",Jen vann stavekapping!,Jen mista stavekappingane.,1
792,Kelly har ikkje forlate leilegheita si på mange år.,Eg gjekk opp til henne heime i dag for å seie hej.,Eg kunne sjå at ho ikkje ville lata meg in.,Me snakka litt om korleis ho hadde det.,Kelly elskar å ha besøk.,Kelly er agoraphobic.,2
793,Emily var på stranden.,Veiret byrja ut stille.,Brått byrja det å blåsa sterkt.,Anna vart fanga i ein skumle sandstorm!,Ho hadde ei fantastisk tid på stranden.,Heldigvis klarte ho å koma trygt tilbake til strandhuset.,2
794,Andrew har aldri vore i trøbbel med noko.,Foreldra hans var utanfor byen denne uken.,Vennene til Andrew kom over og ville ha ein drink.,Så Andrew tok ut den hemmelege lagringa av alkohol frå foreldra sine.,Andrew ønskte at foreldra hans hadde alkohol.,Dei drakk alkoholen og vart fulle.,2
795,Ellen levde på landet.,Ho savnar dei dagane utan strøm.,Ein dag førte ein isstorm til at strømmen gjekk ut i huset hennar i byen.,Ho vart veldig kald.,Ho var glad då strømmen gjekk tilbake.,Ellen hadde det perfekt.,1
796,Jose var opprømt.,Han hadde nettopp kjøpt eit nytt skateboard og ville prøve det ut.,Han gjekk direkte til skateparken.,Han skøyte heile dagen.,Jose hadde det moro på skateparken.,Jose kasta bort skateboarden sin.,1
797,Mike sat ved skrivebordet sitt.,"Men plutseleg følte han eit merkeleg, krassende slag av kløe på armen.",Han følde at beina hans vart kløende òg.,Og så hans ansikte.,Mike fekk eit slag.,Mike byrja å le hysterisk.,1
798,Jill gjekk på ein biltur i fjor.,Ho ville reise frå Boston til Seattle.,"Då var ho ein halv gong på vegen, og bilen hennar braut.",Ho sat på vegen i fleire timar og venta på ein telefon.,Jill var glad at dei kom så fort.,Dei laga bilen hennar og sende henne på veg.,2
799,Rektoren kunngjorde at det skulle vera ein skoledans den fredagen.,Mary vart spent på dansen.,Ho ville Dan inviterte henne til skoledansen.,Dan såg Mary i hallen og sa at han måtte snakke med henne.,Han gav henne skulda for å ha stjålet sykkelen hans.,Ho var glad at han inviterte henne til dans.,2
800,"Det var eit nytt tilegdom på Organic Avenue i New York, og eg hadde gøymt det.",Eg var verkeleg opprømt fordi eg aldri hadde prøvd det.,"Då eg gjekk inn, hadde dei dei dei flotte salatane og saftane til å prøve.",Eg prøvde å lage ein sommersalat og kokosnøtt.,Eg bestemte meg for aldri å gå tilbake til den restauranten.,Dette var den nye favorittrestaurantane mine.,2
801,Romet til Cindy hadde kvite veggar.,Men ho klaga at dei reflekterte for mykje lys.,Så ho bestemte seg for å måla veggene sine blå.,Ho synest rommet hennar var rolegare.,Ho hata det og bytte til svart maling.,Ho var fornøyd med resultatet.,2
802,Eg vart med i ein fantasy-fotball-liga for fyrste gong i år.,Eg drog med på ein fest med venene mine fordi dei trengde ein til.,Eg har aldri spelet dette før.,Eg enda opp med å vinna førsteplassen!,Eg var veldig opprømt.,Eg var svært skuffa.,1
803,Helen stod opp tidleg til jobb.,"Det snøet i natta før, så ho måtte skopa bilen sin ut.",Det tok henne ein time å rydde snøen.,"Då ho gjekk heim for å gjera seg ferdig, høyrde ho ein kjend lyd.",Ho hadde late dusjen ståande.,Helen gjekk ned til sjøen for å leiga ein jet-ski.,1
804,"Etter at dei hadde vunne basketball-VM i USA, intervjue teamet.",Dan spurde om dette var live eller oppteken.,Journalisten sa at det var eit livespill.,Dan sa til kameraet at faren hans var hans inspirasjon.,Dan beundra far sin.,Dan skamma seg for denne faren.,1
805,Jeremy har ein sterk personlighet.,Han hadde ein dårleg tid med jobben sin og vart kasta.,Han sa nokre ikkje-flatterande ting til sjefen sin og medarbeidarane.,Sidan dess har han hatt vanskar med å finna ein jobb.,Jeremy har ein vanskeleg måte å vere på på arbeidsplassen.,Jeremy er perfekt for å arbeide med.,1
806,Fran kjøpte eit hus på stranda.,Kvar dag fôrst kranane på insektane på hagen hennar.,Men ein dag heldt ikkje dei på med å koma.,"Det gjekk fleire månader, og endå ingen kranar",Fran sitt hage er no overfylt med insekter.,Fran fekk eit dødleg hjertestop medan ho laga blomar.,1
807,Teamet vårt hadde ein fotballkamp i dag.,Me fekk lyst til å vinna.,Vi gjekk på banen og øvde før kampen.,"Teamet vårt var eit einamest, og arbeidde saman.",Teamet vårt skamma seg for framføringa si.,Teamet vårt vart svært nøyde.,2
808,Kelly hata matematikk og hadde det vanskeleg med å læra konseptet.,Ho streva mykje med arbeidet og leita ofte hjelp frå lærarane.,"Ho arbeidde veldig hardt, og det gav henne gode karakterar.",Ho skulle på college i haust.,Ho gjekk ikkje på college.,Kelly tok eksamen med gode karakterar.,2
809,Sofias bestemor var dødssjåken.,Sophie vitja henne på sykehuset for å ta farvel.,Nana hennar gav Sophie den dyre gullmyntelen sin.,Ho sa til Sophie at ho skulle halde på med det til minne om ho.,Sophie gret.,Sophie lat henne i andletet.,1
810,Kelly hadde eit nytt jobbsamtale i dag.,Ho gjorde seg klar om ti minuttar og sprang ut døra.,"Då ho kom dit og møtte kvinna, svara ho på spørsmål.",Då intervjua var over sa dei at dei ville kalla henne tilbake.,Kelly håpa at ho snart ville få ein samtale.,Kelly håpa at ho ikkje skulle få ein telefonsamtale.,1
811,Don la merke til at det var ein fluga som gjekk inn i stua.,Han bestemte seg for å ta det opp.,"Han prøvde i ein halv time, men det gjekk ikkje.",Til slutt flaug fluen ut av seg sjølv.,Don stengde døra det flaug ut av.,Don gjekk aldri til sjøen att.,1
812,Zack og venene hans gjekk forbi eit skumle hus på vegen til skulen.,Ein dag bestemte dei seg for å gå inn i den.,Zack og venene hans gjekk inn i kvar rom.,Husa var gammal og forlat.,Dei bestemte seg for å spela baseball der.,Dei gjekk av stad og gjekk på skule.,2
813,Mia gjekk til kasinoet i natt.,Ho byrja kvelden med å spela poker.,"Etter å ha tapt ein stor mengd pengar, spelte ho på spilleautomater.",Ho var nesten tom for pengar då ho fekk ein dusør.,Mia vann ein jackpot!,Mia tapte fleire pengar.,1
