,input_sentence_1,input_sentence_2,input_sentence_3,input_sentence_4,sentence_quiz1,sentence_quiz2,answer_right_ending
386,जोन क्रिसमसको लागि घर जान घृणा गर्थिन्।,उनलाई थाहा थियो कि उनकी आमाले उनको प्रेम जीवनको बारेमा उनलाई सताउनेछन्।,यस वर्ष घर जाँदै गर्दा उनी कार दुर्घटनामा परेकी थिइन्।,[पृष्ठ २३-मा भएको चित्र],जोनकी आमाले उनीसँग कुरा गरेनन् किनभने उनी अविवाहित थिइन्।,जोनले आफ्नी आमाको अनुहार देखेर खुसी महसुस गरिन्।,2
387,म आफ्नो सबै समय आफ्नो लेखनमा काम गर्दै बिताउँछु।,[पृष्ठ २३-मा भएको चित्र],मैले अनलाइन डेटिङ समुदायमा सामेल हुने निर्णय गरेको छु।,मैले पनि अरूलाई मन पराउँदिनँ।,मैले थप लेख्न सुरु गरें।,म धेरै डेटमा गएँ।,1
388,मेरी छोरी प्राथमिक विद्यालयमा स्काउट थिइन्।,एक दिन उनी रातभरको फिल्ड ट्रिपमा गइन्।,मेरो श्रीमती पनि सँगै गएकी थिइन्।,सबैले न्यू ह्याम्पशायरको एउटा केबिनमा सप्ताहन्त बिताए।,मेरी छोरीले आफ्नो फिल्ड ट्रिप कहिल्यै बिर्सेकी थिइनन्।,मेरी श्रीमती र मैले त्यो रात खाना खाएका थियौं।,1
389,आज एउटा नयाँ क्लबको उद्घाटन समारोह थियो।,म उपस्थित हुन पर्ख्न सकिरहेको थिइनँ।,जब हामी क्लबमा गयौं त्यो सुन्दर थियो।,[पृष्ठ २३-मा भएको चित्र],हामी कल क्लब मा प्राप्त गर्न भनेर हामी bouncer संग मित्रता.,ब्वाइजेरले हामीलाई क्लबमा प्रवेश गर्न दिएनन्।,1
390,हिजो म एउटा नयाँ गिलास भान्सामा लिएर गइरहेको थिएँ।,[पृष्ठ २-मा भएको चित्र],गिलास भत्कियो।,मैले यसलाई उठाउनुपर्यो।,मैले एउटा सानो टुक्रामा आफूलाई काटेको छु।,मलाई अहिलेको गिलासको रूप मन पर्यो।,1
391,बिलको परिवार एउटा पहाडमा बस्थे।,त्यहाँ कहिल्यै वर्षा वा आँधीबेहरी भएन।,एक दिन आँधीबेहरी त्यस क्षेत्रमा आइरहेको थियो।,"बिलको घरमा आक्रमण भयो, र छत फालियो।",बीमा कम्पनीले नयाँ छतको लागि शुल्कहरू तिरेको थियो।,"उनीहरूले निर्णय गरे कि उनीहरूलाई यसको आवश्यकता छैन, र सरे।",1
392,एलिसनले आफ्नो क्षेत्रको इतिहासबारे अझ धेरै सिक्ने निर्णय गरिन्।,उनी यस विषयमा किताब हेर्न पुस्तकालय गएकी थिइन्।,उनी भित्र गए र किताबहरू कसरी क्रमबद्ध गरिएका थिए भन्ने कुरा बुझ्न सकिनन्।,उनले एक पुस्तकालयकार भेटिन् जसले डेवी दशमलव प्रणालीको व्याख्या गरे।,यसले कुन कार चाहँदैन भन्ने कुरा पत्ता लगाउन मद्दत गर्यो।,[पृष्ठ २३-मा भएको चित्र],2
393,सेबस्टियन आफ्नो साथीको टिममा फुटबल खेल्न चाहन्थे।,उनले आफ्नो साथीसँग कुरा गरे र उनलाई अभ्यासमा जानुपर्ने भयो।,उनले घरमै एक हप्ता फुटबल खेल्ने अभ्यास गरे।,उनी अर्को अभ्यासमा गए र टचडाउन गरे।,सेबस्टियन हिट प्रदर्शनमा निराश थिए।,सेबस्टियन आफ्नो अभ्यासको फल पाउँदा खुसी थिए।,2
394,एक पटक एक आमा थिइन् जसले आफ्नो बच्चालाई निद्रामा राख्नको लागि हतास थिइन्।,उनले उनलाई घुमाइन् तर उनी अझै निदाएनन्।,उनले उसलाई खाना खुवाइन् तर पनि उसलाई निद्रा लागेन।,"अन्ततः, उनले आफ्नी आमाले गाएको निन्द्रा गीत सम्झिन्।",आमाले आफ्नो बच्चालाई नम्रतापूर्वक निद्रा गीत गाइन्।,आमाले आफ्नो बच्चाको लागि केही हिप हप बजाइन्।,1
395,जोनी बच्चा हुँदा पौडी पोखरीमा पिसाब हाल्थे।,उनले सोचे कि उनी वयस्क भए पनि यो काम गर्न सक्छन्।,उनले आफ्ना बच्चाहरूलाई पानी पार्कमा लगे।,त्यसपछि उनले पानीको पोखरीमा पिसाब गरे।,केही मानिसहरूले ध्यान दिए र जोनी समस्यामा परे।,जोनीको व्यवहारले गर्दा सबैजना खुसी थिए।,1
396,एमीले अरू बच्चाहरूलाई खेलिरहेको देखिन र आफ्नो इन्हेलरलाई हेरिरहेकी थिइन्।,दमका कारण उनी खेल खेल्न सक्दैनथिन्।,उनले आफ्नो काँधमा आफ्नो कला शिक्षकको हात महसुस गरे।,उनको शिक्षक मुस्कुराउँदै एमीलाई भन्छिन् कि उनी एक दिन एक महान कलाकार बन्नेछिन्।,एमीलाई धेरै राम्रो लाग्यो।,एमीलाई नराम्रो लाग्यो।,1
397,जो र उनका साथीहरूको आज फुटबल खेल थियो।,जो नर्भस थिए।,उनी जित्ने वा नजित्नेमा चिन्तित थिए।,[पृष्ठ २३-मा भएको चित्र],जो आफ्नो टोलीमा धेरै गर्व गर्थे।,जो आफ्नो टोलीमा धेरै निराश थिए।,1
398,मार्कले नयाँ कामको लागि एउटा महत्त्वपूर्ण अन्तर्वार्ता लिएका थिए।,[पृष्ठ २-मा भएको चित्र],[पृष्ठ २३-मा भएको चित्र],अन्तर्वार्ता लिने व्यक्तिले मार्कलाई जागिर पाएको जानकारी दिए।,मार्क धेरै खुसी थिए।,[पृष्ठ २-मा भएको चित्र],1
399,इलेनलाई आज खाना पकाउने मन थिएन।,[पृष्ठ २३-मा भएको चित्र],[पृष्ठ २३-मा भएको चित्र],इलेनले लगभग एक घण्टासम्म कहाँ जानुपर्छ भनेर सोचविचार गरिन्।,[पृष्ठ २३-मा भएको चित्र],[पृष्ठ २३-मा भएको चित्र],2
400,साम आफ्नो सपनाको कलेजमा भर्ना हुन खोजिरहेको थियो।,उनले आवेदन भर्ने क्रममा लामो समय बिताए।,यसले उनलाई आफ्नो शैक्षिक उपलब्धिहरूको बारेमा राम्रो महसुस गरायो।,उनले आवेदन बुझाए।,तीन महिनापछि उनले स्वीकृति पत्र पाए ।,उनले फेरि कहिल्यै सोधेनन्।,1
401,म्याटले एक रात आफ्ना दुई साथीहरूसँग बार हाप्पिङ गर्ने निर्णय गरे।,उनीहरूले एउटा बारमा तीनवटा चक्की खाए ।,"उनीहरू चारवटामा गए, प्रत्येकमा तीन-तीनवटा चक्की खाए।",म्याट धेरै रक्सी पिएर आफ्नो फोन हराए।,मट्ट र साथीहरू घर गए र रात बिताए।,म्याटलाई हराएको फोनको कुनै चिन्ता थिएन।,1
402,बिन्दुले आफ्ना साथीहरूसँग एउटा पार्टीको योजना बनाइन्।,उनीहरूले कुन खाना र ब्यान्ड प्रयोग गर्ने भन्ने विषयमा छलफल गर्न उनको घरमा भेला भए।,बिन्दुका एक जना साथीले समोसा र दुग्गा ल्याएका थिए।,चारजना साथीहरूले पार्टीमा संगीत बजाए।,सबैलाई रमाइलो लाग्यो।,बिन्दु आफ्ना साथीहरू र पार्टीहरू घृणा गर्छिन्।,1
403,टायलर उठे र स्कुल जानुअघि नुहाउन चाहन्थे।,उसको सानो भाइले नुहाइरहेको छ।,टायलरलाई डर छ कि उसले बस छुट्नेछ।,अन्ततः टायलरको पनि नुहाउने पालो आयो।,टायलरले आफ्नो बेकिङ कौशल देखाउनका लागि केक बनाएका थिए।,टायलरले तुरुन्तै नुहाए र बस स्टपमा समयमै पुगे।,2
404,थॉमसले पछिल्लो समय आफूलाई राडारको दृष्टिमा बेवास्ता गर्दै आएका थिए।,उनी आफ्नो डाक्टरकहाँ जाँच गराउन गए।,उनका डाक्टरले उनलाई भनेका थिए कि उनको कोलेस्ट्रोलको स्तर अलि बढी थियो।,थॉमसले स्वस्थ खाना खान र घुम्न थाले।,४० पाउण्ड तौल बढेपछि उनलाई मधुमेह भएको पत्ता लाग्यो।,[पृष्ठ २३-मा भएको चित्र],2
405,ढोकाको घण्टी बज्यो तर त्यहाँ कोही थिएन।,उनी ढोका खोल्नुपर्छ कि पर्दैन भन्नेमा निश्चित थिइनन्।,ढोका ढिलो ढिलो खोलिन् र बाहिर हेर्दै गइन् ।,उनको भाइ उनको बाहिर leapt र उनको राम्रो डर दिए.,उनले नेटफ्लिक्समा आफ्नो मनपर्ने कमेडी शो हेर्न निर्णय गरिन्।,उनले चिच्याएर भाइलाई धकेलिन्।,2
406,स्टेफनीले स्याउको मसला बनाउन चाहन्थिन्।,[पृष्ठ २३-मा भएको चित्र],"उनी बगैंचामा हिँडिरहेकी थिइन्, उनी ठेस खाएर खसेकी थिइन्।",उनले दुवै हातको कलाई भाँचेकी थिइन्।,स्टेफनीले हातले आफूलाई माथि धकेलिन्।,स्टेफनीले कसैले भेटेसम्म उठ्न सकिनन्।,2
407,रोयले आफ्नो घर किन यति नराम्रो गन्ध आइरहेको थियो भनेर बुझ्न सकेनन्।,उनका साथीहरूले त्यहाँ गएर यसबारे टिप्पणी गरे।,[पृष्ठ २३-मा भएको चित्र],यो फ्रिजमा एउटा पुरानो माछा थियो।,रोयले माछा फ्रिजमा राख्ने निर्णय गरे।,रोयले पुरानो माछावालालाई बाहिर फ्याँक्यो र सबै कुरा राम्रो गन्ध आयो।,2
408,जिमी धेरै गरिब हुर्किए।,[पृष्ठ २३-मा भएको चित्र],"जब उनी राम्रो कलेजमा भर्ना भए, उनीहरूले दुईवटा काम गरेर पढ्न पाए।",स्नातकोत्तर गर्दा उहाँले आफ्नो कृतज्ञता व्यक्त गर्न चाहनुभएको थियो।,त्यसैले उनले कलेजको लागि तिर्ने पैसा दिए।,जिमीले आफ्ना आमाबाबुलाई बोलाएर उनीहरूलाई गाली गरे।,1
409,"जब एक सुन्दर केटाले कलेजको नृत्यमा उनलाई निम्तो दिए, तब जिल चकित भइन्।",[पृष्ठ २३-मा भएको चित्र],जिल् को रूममेटले उनीहरूलाई सहयोग गर्न सक्ने बताएका थिए।,जिल्ले आफ्नो सेतो पोशाक लगाएर सुतेकी थिई।,[पृष्ठ २३-मा भएको चित्र],जिल् र उनका साथीहरूले राती बाहिर रमाइलो गरे।,1
410,एउटा बारको मालिकले आफ्नो बारको विज्ञापन गर्न एउटा ठूलो ब्यानर लगायो।,आँधी बलियो थियो र ब्यानर उडायो।,मालिकले आफ्नो निषेधितलाई शहरभरि नै पछ्याए।,यो एउटा वृद्ध महिलाको पछाडिको आँगनमा खस्यो।,ती वृद्ध महिलाले ब्यानर फिर्ता गर्न अस्वीकार गरिन्।,बुढी महिला फरको कोट भेट्दा खुसी भएकी थिइन्।,1
411,"मेरी आमाको एक यस्तो नुस्खा छ, जसलाई म धेरै मन पराउँछु।",एकपटक उनले मलाई एउटा खराब दिन भएकोले बनाएकी थिइन्।,मैले कद्दूका बारहरू खाएँ र मलाई धेरै राम्रो लाग्यो।,[पृष्ठ २३-मा भएको चित्र],त्यस दिनदेखि मैले कहिल्यै पनि कद्दूको बार खाइनँ।,मैले जीवनमा पछि कद्दूको बार बनाएको थिएँ र त्यसले मलाई मेरी आमाको याद दिलायो।,2
412,टिमले आफ्नो हजुरबुबासँग बढी समय बिताउने निर्णय गरे।,टिमले आफ्नो हजुरबुबालाई पनि चिडिया हेर्न मन पराउँथे।,तिनीहरूका आँखाले देखेका कुराहरू एउटा नोटबुकमा लेखिएका थिए।,[पृष्ठ २-मा भएको चित्र],टिमले निर्णय गरे कि अब उसलाई चराहरूमा रुचि छैन।,टिम र उनका हजुरबुबाले एउटा शौक पाए जुन उनीहरू दुवैलाई मनपर्छ।,2
413,ड्यानीले यो गर्मी स्थानीय आइसक्रिम पसलमा काम गरिरहेका थिए।,पहिलो काम सुरु गरेकोमा उनी निकै उत्साहित थिए।,पहिलो दिन एउटा सानो केटाले आफ्नो आइसक्रिम भुइँमा खसालेको थियो।,[पृष्ठ २३-मा भएको चित्र],उनले उसलाई अर्को स्कुप आइसक्रिम दिए।,उनले उसलाई अर्को स्कुप दिन अस्वीकार गरे।,1
414,घडी २ बजेको बेला स्कुलको घण्टी बज्यो।,जिनाले दिनको अन्त्यमा यति खुसी कहिल्यै थिइनन्।,[पृष्ठ २३-मा भएको चित्र],तर तामी रिटा र मेरीसँग जाँदै थिइन्।,जिना घर फर्केपछि एक्लो महसुस गर्थिन्।,जिनाले अर्को दिन तामीलाई धन्यवाद दिइन्।,1
415,[पृष्ठ २३-मा भएको चित्र],पहिलो तिनीहरूले आफ्नो फर्नीचर प्याक.,[पृष्ठ २-मा भएको चित्र],तिनीहरूको सबै सामानहरू भ्यानमा लगियो।,लरेन्स र तिनको परिवार नयाँ घरतिर गए।,लरेन्सले उनीहरूको सबै सामानहरू घरभित्रै राखे।,1
416,जोयले आफ्नो भिक्षुणका लागि उत्तम छाल खोज्न चाहन्थिन्।,"उनले एउटा किन्न सक्छिन्, तर यदि उनले त्यो भेटे भने त्यो अझ विशेष हुनेछ।",उनले पूरै बिहान समुद्र तटको छानबिन गरिन्।,काम गर्ने सबै कुरा बिग्रिएको थियो!,उनले एउटा शेल किन्नु पर्ने थियो।,[पृष्ठ २३-मा भएको चित्र],1
417,वेस्टिन विवाह गर्दै थिए!,उनले आफ्नो विवाह एकदमै राम्रो होस् भन्ने चाहेका थिए।,साँझसम्म सबै कुरा राम्रैसँग चल्यो।,कसैले धेरै नशा गरेको छ र केकमा खसेको छ!,वेस्टिनले केकबाट एउटा उत्तम टुक्रा काट्यो।,वेस्टन र उनकी श्रीमतीले नशामा परेका व्यक्तिलाई घरबाट निकाले।,2
418,जो आफ्नो बुबालाई आफ्नो घरको पछाडिको जंगल सफा गर्न मद्दत गर्दै थिए।,अचानक उनले ठूलो आवाज सुने।,उनले एउटा मधुमक्खीको घोंसले हल्लाएका थिए।,उनी भाग्न सक्नु भन्दा पहिले ६ पटक उसलाई डसेको थियो।,[पृष्ठ २३-मा भएको चित्र],जोलाई चोट लागेको थियो।,2
419,यो शरद ऋतु थियो।,टोडको आँगनमा पातहरू भरिएका थिए।,उनले निर्णय गरे कि उनीहरूलाई सबै माथि उचाल्न आवश्यक छ।,"एक पटक उनले काम सकेपछि, उनीहरूलाई एउटा झोलामा हाले।",टोडले त्यसलाई फोहोरमा फालिदिए।,टोडले झोला खोलेर पातहरू फैलाए।,1
420,टिमको ठूलो बडिबिल्डर बन्ने सपना थियो।,उनले आफ्नो लक्ष्य प्राप्त गर्न हरेक रात कसरत गरे।,[पृष्ठ २३-मा भएको चित्र],"उनले आफ्नो क्षमता देखाए, २५० पाउण्डभन्दा बढी उठाए।",टिम धेरै दृढ निश्चयका थिए।,टिममा दृढता थिएन।,1
421,हेनरी आफ्नो कक्षामा हिँडिरहेका थिए।,त्यही समयमा उनले आफ्नो फोनको स्क्रिनलाई कपडाले सफा गर्ने प्रयास गरेका थिए।,"दुर्भाग्यवश, कसैले उसलाई ठक्कर दियो।",उनको फोन हातबाट खसेर भुइँमा खस्यो।,त्यो व्यक्तिले हेनरीसँग माफी माग्यो।,हेनरी खुसी र कृतज्ञ थिए।,1
422,तामीले भलिबल ट्रायलमा भाग लिने निर्णय गरिन्।,उनी आठ कक्षामा मात्र पढ्थिन् तर उनी जान्थिन् कि उनी असल छिन्।,उनले कडा खेल्थिन् र आफ्नो सबैथोक दिइन्।,उनले अन्य खेलाडीहरू उनी जत्तिकै राम्रो हुनेछन् भन्ने अनुमान गरेकी थिइनन्।,तामी बास्केटबल टोलीमा प्रवेश गरेकी थिई।,सबै खेलाडीहरू राम्रो थिए तर उनी टोलीमा आएकी थिइन्।,2
