,input_sentence_1,input_sentence_2,input_sentence_3,input_sentence_4,sentence_quiz1,sentence_quiz2,answer_right_ending
0,म सन् २०११ मा कानून र व्यवस्थाको प्रशंसक बनेँ।,म स्ट्रोकबाट निको हुँदै थिएँ।,घर पुगेपछि मैले हरेक एपिसोड हेर्ने प्रयास गरेँ।,२० वर्षसम्मको शो हेर्नका लागि ब्यङ गर्न कठिन थियो।,मलाई लाग्छ कि कानून र व्यवस्था अहिलेसम्म बनेका सबैभन्दा खराब शोहरू मध्ये एक हो।,[पृष्ठ २३-मा भएको चित्र],2
1,सबैजनाले बोबलाई मन पराए किनभने उनले चलचित्रमा लोकप्रिय पात्रको भूमिका निर्वाह गरे।,बबलाई यो कुरा मन पर्दैनथ्यो किनकि उनी त्यस पात्र जस्तो केही पनि थिएनन्।,जिमले बोबलाई आफ्नो पात्रको क्याच फ्रेज भन्न आग्रह गरे।,यो कुरा बोबलाई धेरै गाह्रो लाग्यो र उनी क्रोधले उफ्रिन्थे।,बोबले त्यो मानिसलाई उसलाई एक्लै छोड्न भने।,बोबले त्यस मानिसलाई चियाको लागि आग्रह गरे।,1
2,लिटाले टेलिभिजनमा आफ्नो मनपर्ने कार्यक्रम हेर्न चाहन्थिन्।,[पृष्ठ २३-मा भएको चित्र],लिटाले उनीहरूलाई केही कामहरू गर्नुपर्ने बताएकी थिइन्।,उनका छोराछोरीले उनको लुगाफाटाको टोकरीलाई लिभिङ रुममा तानेर लगे।,लिटाले खाजाको लागि पिज्जा अर्डर गरिन्।,लिटाले टिभी हेर्दै गर्दा लुगाहरू पङ्क्ति गरेकी थिइन्।,2
3,ठूलो आवाजले झस्काउँदा लिभले हाम फालिन्।,उनले महसुस गरिन् कि यो उनको भान्साको बल्ब थियो जुन जलेर नष्ट भएको थियो।,[पृष्ठ २३-मा भएको चित्र],यो उनको मुनिबाट झर्दै थियो र उनी झन्डै खसेकी थिइन्।,लिभले बाथरूममा बल्ब बदल्ने निर्णय गरिन्।,लिभले बल्ब परिवर्तन गरिन्।,2
4,आमाले आफ्ना बच्चाहरूलाई पन्ध्र मिनेटमा खाना खाने समय हुन्छ भन्नुभयो।,[पृष्ठ २३-मा भएको चित्र],"जब उनी कुरा गर्दै थिइन्, कुकुरले भान्साको सबै भागमा बालुवा तानेर लगेको थियो।","छोराछोरीले आमालाई सताउन थाले, जो अझै पनि फोनमा थिइन्।",आमा निराश भएकी थिइन्,छोराछोरीको व्यवहारले आमालाई शान्त बनायो।,1
5,हेक्टरले काम गर्नुअघि स्थानीय पसलबाट कफी किन्ने गरेको छ।,कफीको मूल्य कति छ भनेर सोध्दा,एक दिन हेक्टरले घरमा कफी बनाउने निर्णय गरे।,उनी घरमै बनाएको कफी यति राम्रो छ भनेर गर्व गर्छन्।,हेक्टरले आफ्नै कफी बनाउँदै पैसा बचत गरे।,हेक्टरले स्टारबक्सबाट कफी किन्न थाले।,1
6,केलीले स्कुलमा नयाँ केटी आएको थाहा पायो।,जब उनी स्कुलमा आएकी थिइन् उनी उनलाई खोज्दै गएकी थिइन्।,[पृष्ठ २३-मा भएको चित्र],खाना खाएपछि केटीहरू साथी भए।,केलीले फेरि उनीसँग कुरा गरेकी थिइनन्।,केली नयाँ साथी पाएकोमा खुसी थिइन्।,2
7,टमीले आफ्नो पहिलो ५ किलोमिटर दौडका लागि कडा प्रशिक्षण गरे।,[पृष्ठ २३-मा भएको चित्र],पुरस्कार वितरणको समयमा आफ्नो नाम बोलाइएपछि उनी स्तब्ध भए।,उनलाई थाहा थिएन कि उमेर समूह अनुसार पुरस्कार दिने गरिन्छ।,उनी कुनै पनि मान्यता नपाएकोमा लज्जित थिए।,उमेर समूहमा पहिलो भए पनि समग्रमा दशौं स्थानमा रहँदा उनी गर्व गर्थे।,2
8,लरी आज राति आफ्नो पहिलो औपचारिक नृत्यमा जाँदैछिन्।,उनको डेटले उनलाई उठाएर एउटा सुन्दर गुलाब दिए।,लोरीले लामो चम्किलो पोशाक लगाइन्।,उनीहरू नाच्थे र आफ्ना सबै साथीहरूसँग रमाइलो गर्थे।,लरी रोइरहेकी घर गइन्।,[पृष्ठ २३-मा भएको चित्र],2
9,नील ऐतिहासिक रेलमार्गको अन्वेषण गर्दै थिए।,उनी पेन्सिलभेनियाको स्क्रानटनमा गए।,उनले यो एउटा सुन्दर पुरानो रेल डिपो भएको महसुस गरे।,त्यहाँ हुँदा उनले धेरै फोटो खिचे।,नीलले आफ्ना सबै फोटोहरू मेटाए।,नीलले आफ्नो कम्प्युटरमा फोटोहरू सुरक्षित गरेका थिए।,2
10,बोबले फास्ट फूड माछाको पसलमा काम गर्ने पहिलो दिनदेखि डराएका थिए।,[पृष्ठ २३-मा भएको चित्र],बोबले युनिफर्म लगाइसकेपछि माछाको बर्गर बनाउने काममा लागे ।,उनी यति व्यस्त थिए कि उनले आफ्नो सडकको कपडामा फर्कन बिर्सिए,बोबलाई यो पोशाक यति मन पर्यो कि उनले आफ्ना साथीहरूलाई देखाए।,बोब काम पछि नाविकको पोशाक लगाएर बाहिर गए।,2
11,एकजना साथी भेट्न आए।,मैले उसलाई भनें कि मेरो कुकुरले टोक्छ।,उनले सुनेनन्।,उनले उसलाई गाली गर्ने र खेल्ने प्रयास गरिन्।,मेरो कुकुरले उसलाई टोकेको थियो।,मेरो कुकुर भाग्यो।,1
12,लेस्टर सधैं बढी कलात्मक हुन चाहन्थे।,एक दिन उनले फूलको चित्र बनाउने निर्णय गरे।,एउटा सुन्दर अर्किडको अगाडि बसेर चित्र बनाउन थाल्छ।,लेस्टरको चित्र निकै राम्रो देखिन्छ।,उनले आफ्नो कोठाको भित्तामा त्यो चित्र टाँसे।,उनले फेरि कहिल्यै पनि कुनै पनि चित्र नचित्र्ने निर्णय गरे।,1
13,पाब्लोलाई कीरा खान मन पर्छ।,उनले विद्यालयमा यो कसरी गर्ने भन्ने बारेमा एउटा पुस्तक पढेका थिए।,उनी तिनीहरूलाई जैतुनको तेलमा तान्दछन्।,उनी महिनामा कम्तीमा एक पटक यस्तो गर्न रुचाउँछन्।,[पृष्ठ २३-मा भएको चित्र],पाब्लोले कीराहरू खान मन पराउँदैनन्।,1
14,किरालाई जापानी संस्कृति मन पर्छ।,उनको धेरै मनपर्ने चलचित्रहरू जापानी भाषामा थिए।,उनले त्यहाँ यात्रा गर्ने निर्णय गरिन्।,यात्राको लागि वर्षौंदेखि उनले पैसा बचत गरिन्।,उनले सबै पैसा जुत्तामा खर्च गरिन्।,यो उनको जीवनको सबैभन्दा राम्रो यात्रा थियो।,2
15,ग्लेन हिँडडुल गर्ने मनस्थितिमा थिए।,उनले ज्याकेट लगाएर बाहिर गए।,[पृष्ठ २३-मा भएको चित्र],[पृष्ठ २३-मा भएको चित्र],ग्लेनले आफ्नो अहिलेसम्मकै सबैभन्दा राम्रो समय दौडे।,ग्लेनले कसम खाएका थिए कि उनी फेरि कहिल्यै हिँड्न सक्दैनन्।,2
16,येशूले दिनभरि फर्निचर पोलिश गर्दै बिताउनुभयो।,रात नजिकिंदै जाँदा उनले गरेको कामको समीक्षा गरे।,सबै कुरा नयाँ र चम्किलो देखिन्थ्यो।,येशूले आफ्ना सबै साथीहरूलाई त्यो साँझ भोजमा बोलाउनुभयो।,उनीहरूले भने कि उनको फर्निचर राम्रो देखिन्थ्यो।,उनका साथीहरूले उनको फर्निचरलाई पलिश गरे।,1
17,म हालै पसलमा हिँडिरहेको थिएँ।,"म एक निकासबाट गुज्रिरहेको थिएँ, मेरो हातमा कडा र चिसो फलामको महसुस भयो।",म चकित भएँ,ममाथि दुर्घटना भएको देखेर चालकले माफी मागे।,मैले तिनीहरूलाई ठीक छ भनेँ र पछि गएँ।,[पृष्ठ २३-मा भएको चित्र],1
18,जिनाकी बहिनीले आफ्नो खुट्टाको पाखुरा काँचोमा काटेर मारेकी थिइन्।,रगत उनको खुट्टाबाट तल झर्दै उनको जुत्तामा पुग्यो।,जब उनले रगत देखे उनी घरतिर दौडिन्।,जिना उनको पछि दौडिन् तर उनको पछि लाग्न सकिनन्।,"जब उनीहरू घर आइपुगे, सबैले आइसक्रिम खाए।",जिनाकी बहिनी डाक्टरकहाँ गइन्।,2
19,एउटा सानो केटा तेस्रो कक्षामा पढ्थ्यो।,[पृष्ठ २३-मा भएको चित्र],[पृष्ठ २३-मा भएको चित्र],उनले हरेक दिन पढ्ने अभ्यास गर्न थाले।,[पृष्ठ २-मा भएको चित्र],[पृष्ठ २३-मा भएको चित्र],2
20,रोसीको कक्षामा एउटा सानो पार्टी थियो।,उनले सबैलाई फलफूलको सलाद बनाउने निर्णय गरिन्।,[पृष्ठ २३-मा भएको चित्र],पार्टीको दिन उनले फलफूलको सलादको एउटा ठूलो कचौरा उठाइन्।,रोसीको कक्षाले फलफूलको सलाद खाए।,रोसीले घरमा फ्रिजमा फलफूलको सलाद राखेकी थिइन्।,1
21,केली नयाँ फोन पाउँदा खुसी थिइन्।,उनले हरेक ठाउँमा यो साथमा लिएर गइन्।,दुर्भाग्यवश उनले यसलाई तोडिदिएकी छिन्।,"तर, भाग्यवस उनले त्यसलाई ठीक गर्न सके।",पसलले त्यसलाई ठीक गर्नको लागि उचित मूल्य दियो।,केलीले नयाँ फोन किनिन्।,1
22,कलेज पढ्दा मैले एक जना वृद्धलाई भेटेको थिएँ।,म २२ र उनी ३८ वर्षका थिए।,हामीबीच राम्रो समझदारी थियो र सँगै रमाइलो पनि भयो।,म त्यहाँ हुँदासम्म हामी सँगै थियौं।,[पृष्ठ २३-मा भएको चित्र],मसँग त्यस समयको नकारात्मक सम्झनाहरू छन्।,1
23,बब स्कुल नाटकमा हुन चाहन्थे।,उनले यो भूमिकालाई ध्यानपूर्वक अध्ययन गरे।,उनले प्रायः आफ्नो लाइनको अभ्यास गर्थे।,अडिशनको दिन उनले राम्रो काम गरे।,बबलाई धेरै गर्व थियो।,बोब धेरै लज्जित थिए।,1
24,ज्याकीलाई आठौं कक्षाको हल मनिटर नियुक्त गरिएको छ।,उनी कक्षामा सबैको ईर्ष्याको पात्र हुन्।,[पृष्ठ २-मा भएको चित्र],तिनीहरूले ज्याकीको प्रवेश-पत्रहरू चोर्ने थिए।,[पृष्ठ २३-मा भएको चित्र],[पृष्ठ २३-मा भएको चित्र],1
25,मेरो बुबाले भर्खरै एउटा नयाँ कार किनेका थिए।,यो उत्सव मनाउन हामी सबै गाडीमा गयौं।,[पृष्ठ २३-मा भएको चित्र],मैले झ्याललाई यति बलियोसँग ठक्कर दिएँ कि त्यो भाँचियो।,म बाहिर निस्किएँ र म र मेरो बुबा ठीक थियौं।,हामी दुवैजना गाडीले ठक्कर दियौं।,1
26,मेरी भान्जीलाई फ्रोजन चलचित्र मन पर्छ।,उनी सधैं यसलाई लगाउन चाहन्छिन्।,उनी घरको चारैतिर गीत गाउँदै हिँड्छिन्।,"उनी चिच्याउन मन पराउँछिन्, 'यसलाई छोड'",उनी यो गीत बारम्बार गाइरहेकी छिन्।,उनी खेलकुदलाई प्रेम गर्छिन् र राजकुमारीको कुरालाई घृणा गर्छिन्।,1
27,एलेक्सले आफ्नो टिम दुई अंकले पछाडि रहेको अवस्थामा मैदानमा ड्रिबल गर्दै थिए।,"उनले स्कोरबोर्डमा एक नजर लगाए, र देखे कि त्यहाँ केवल ५ सेकेन्ड बाँकी थियो।",एकजना खुला मानिस खोज्दा खोज्दै उनको दिमाग द्रुत गतिमा दौड्यो।,डिफेन्डरहरू उनको टोलीका साथीहरूसँग गोंद जस्तै टाँसिएका थिए।,बज्जर बज्यो र उनको टोलीले खेल जित्यो।,उनले तीन-पोइन्टको प्रयास गरे र मिस गरे।,2
28,म पुस्तकालयमा आएर बसेँ।,"मैले वरिपरि हेरेँ, मैले एउटा बच्चा देखेँ।",उनी केही समयसम्म मलाई हेरिरहेका थिए।,[पृष्ठ २३-मा भएको चित्र],मलाई बच्चाले के गरिरहेको छ भन्ने कुराले फरक पार्दैनथ्यो।,मैले उसलाई उसको समस्या के हो भनेर सोधेँ।,2
29,इभा र ब्रान्ट बच्चा जन्माउने प्रयास गरिरहेका थिए।,[पृष्ठ २३-मा भएको चित्र],[पृष्ठ २३-मा भएको चित्र],[पृष्ठ २३-मा भएको चित्र],ब्रान्टले बच्चा अपहरण गर्ने योजना रद्द गर्नेछन्।,दम्पतीले बच्चा जन्माउने आशामा खुशी हुनेछन्।,2
30,क्याथरिनलाई कर्लिङ खेल सधैं मनपर्छ।,क्याथरीनलाई टेलिभिजनमा खेलाडीहरू खेलिरहेको हेर्न मन पर्छ।,एक दिन क्याथरिनले कर्लिङ अभ्यासमा जाने निर्णय गरिन्।,प्रशिक्षणमा एक जना खेलाडीले क्याथरिनलाई खेल्न निम्तो दिए।,[पृष्ठ २३-मा भएको चित्र],क्याथरीनले कर्लिङलाई उबाऊ लाग्यो।,1
31,फ्रान्सिसले सधैं ड्राइभिङ सिक्नको लागि उत्सुकता देखाएका छन्।,अन्ततः उसको उमेर ड्राइभिङ लाइसेन्स लिनको लागि पुग्यो।,फ्रान्सिसले लाइसेन्स लिनका लागि धेरै मेहनत गर्छन्।,उनी सजिलैसँग आफ्नो ड्राइभिङको परीक्षा पास गर्छन्।,फ्रान्सिस आफ्नो उपलब्धिप्रति साँच्चै नै गर्व गर्छन्।,फ्रान्सिसले सार्वजनिक यातायात प्रयोग गर्ने निर्णय गरे।,1
32,हिजो मैले द नटक्र्याकर हेर्दा निकै रमाइलो गरेँ।,मलाई यो एकदमै मन पर्यो।,नृत्यको सौन्दर्य,म यो कार्यक्रम हेर्न पाउँदा सम्मानित महसुस गर्छु।,मैले यो फेरि कहिल्यै नदेखेको कसम खाएँ।,म यसलाई फेरि हेर्न चाहन्थेँ।,2
33,म बिहान ८ः३० बजे कक्षाको लागि उठेँ।,म निन्द्राले झर्दै ओछ्यानबाट उठें र नुहाएँ।,म छिटो बिहानको खाना खाएर कक्षामा हिँड्न थालें।,५० मिनेटको कक्षापछि म आफ्नो छात्रावासतिर फर्किएँ।,मैले फेरि कक्षामा जाने निर्णय गरेँ।,म त्यहाँ पुगेपछि झपक्किएँ।,2
34,ग्यारी लिसाको ध्यान खिच्न चाहन्थे।,एक दिन उनले लिसालाई एउटा कविता लेख्ने निर्णय गरे।,[पृष्ठ २३-मा भएको चित्र],ग्यारीले लिसालाई ठूलो मुस्कान दिन्छन् र उनलाई कविता दिन्छन्।,ग्यारीले लिसालाई कडा थप्पड हानेर हिँड्छ।,लिसाले पनि ग्यारीलाई मन पराएको स्वीकार्छिन्।,2
35,कार्लोस सधैं फ्रान्स भ्रमण गर्न चाहन्थे।,उनले जाने अघि फ्रेन्च भाषा सिक्नुपर्छ भन्ने निर्णय गरे।,रातीको कक्षामा भर्ना भएर उनी कडा परिश्रम गर्छन्।,कार्लोसले अन्ततः राम्ररी फ्रान्सेली बोल्न सक्छ।,कार्लोसले अष्ट्रेलियाको उडान बुक गरे।,कार्लोसले आफ्नो फ्रान्सेली भाषाको सबैभन्दा धेरै प्रयोग पेरिसको यात्रामा गर्छन्।,2
36,लार्सले सधैँ फोटोग्राफीको अनुभव गर्न चाहन्थे।,उनका साथी उत्कृष्ट फोटोग्राफर थिए तर उनले कहिल्यै प्रयास गरेका थिएनन्।,एक दिन उनले एउटा साधारण तर उच्च गुणस्तरको क्यामेरा किने।,त्यस दिनदेखि लार्सले हरेक दिन प्रकृतिका तस्बिर खिच्न थाले।,लार्सलाई फोटोग्राफीको प्रेम भयो।,लार्सले फोटोग्राफीलाई घृणा गर्थे।,1
