,input_sentence_1,input_sentence_2,input_sentence_3,input_sentence_4,sentence_quiz1,sentence_quiz2,answer_right_ending
765,टम र जेक एउटा कन्सर्टमा गए।,उनीहरू एउटा ब्यान्ड हेर्दै थिए जसलाई उनीहरू प्रेम गर्छन्।,तिनीहरू सामान्य प्रवेश क्षेत्रमा गए।,केही धेरै अग्ला मानिसहरू उभिरहेका थिए त्यसैले तिनीहरूले केही देख्न सकेनन्।,टम र जेकले आफ्नो मनपर्ने ब्यान्डलाई देख्न पाएनन्।,टम र जेकले सुन्दर दृश्यको आनन्द उठाए।,1
766,लेस्टरलाई आफ्नो मोबाइल फोन बिना वर्षौं बिताएकोमा गर्व थियो।,उनी सोच्न चाहन्थे कि उनी अरूभन्दा कम टेक्नोलोजीमा निर्भर छन्।,[पृष्ठ २३-मा भएको चित्र],[पृष्ठ २-मा भएको चित्र],लेस्टरले आफ्नो जीवन मोबाइल बिना नै बिताए।,लेस्टरले आफ्नो पैसाले किन्न सक्ने सबैभन्दा राम्रो मोबाइल किने।,2
767,बेनलाई आफ्नो गाडीको तेल परिवर्तन गर्न आवश्यक थियो।,उनलाई थाहा थियो कि ती धेरै महँगा छन्।,समाचारपत्रमा एउटा कूपन देखेपछि,बेनले त्यसलाई काटेर ग्यारेजमा लगे।,बेनले आफ्नो तेल परिवर्तन गर्न सफल भए।,बेनले आफ्नो मृगौलालाई क्र्याकको लागि बेचे।,1
768,म भोको उठेँ।,म एक कचौरामा दाना हालेँ तर मलाई दूध पनि थिएन।,पानीको प्रयोग गर्ने विचार गरेपछि मैले पसलमा जाने निर्णय गरेँ।,म कुनामा गएँ र आधा ग्यालुन २ प्रतिशत पाइयो।,म घर आएँ र मसुरो खाएँ।,म घर आएँ र पिज्जा खाएँ।,1
769,अन्नाको एउटा नुनपानीको माछाको ट्यांक थियो।,उनले यसमा केवल कोरल मात्र राखेकी थिइन्।,त्यसपछि उनले पनि केही माछा चाहने निर्णय गरिन्।,उनले केही साना माछाहरू र ट्रिगरहरू किनिन्।,[पृष्ठ २३-मा भएको चित्र],[पृष्ठ २३-मा भएको चित्र],2
770,होली एउटा सुन्दर कालो बिरालो थियो जसलाई लीले धेरै माया गर्थे।,"दुःखको कुरा, होली एकदमै बिरामी भइन् र लीले उनलाई सुत्न लगाउनु पर्यो।",लीले हरेक दिन होलीलाई सम्झेर दुःखी हुन्थिन्।,त्यसको केही दिनपछि एउटा सानो कालो बिरालो लीको पछाडिको ढोकामा देखा पर्यो।,लीले एउटा कुकुर पाल्ने निर्णय गरे।,लीले बिरालोलाई गोद लिने निर्णय गरे।,2
771,बोबलाई नयाँ जुत्ता चाहिएको थियो।,[पृष्ठ २३-मा भएको चित्र],पसलमा ठूलो बिक्री भइरहेको थियो।,उनले धेरै राम्रा सामानहरू किनेका थिए।,बबले आफ्नो किनमेल यात्रालाई साँच्चै रमाइलो मान्थे।,बोबले अर्को दिन सबै कुरा फिर्ता गरे।,1
772,युवा रेजीलाई फुटबल खेल्न र हेर्ने मन थियो।,उनको मनपर्ने खेलाडी रन ब्याक जमाल लुईस थिए।,उनी आफ्नो परिवारसँग साल्ट लेक विमानस्थलमा थिए र उनले आफ्नो नायकलाई देखे।,उनी उनीकहाँ गएर भने कि उनी पनि प्रोफेशनल फुटबल खेल्नेछन्।,जमाल लुईसले उनलाई व्यक्तिगत सल्लाह दिए र उनको शुभकामना दिए।,युवा रेजीले उनलाई उनीबाट टाढा रहन भने।,1
773,एल्लाले एउटा सानो रोबिन जमीनमा भेटिन्।,[पृष्ठ २३-मा भएको चित्र],[पृष्ठ २३-मा भएको चित्र],त्यसपछि उनले हातले कृमि खुवाइन्।,उनी रोबिनको हेरचाह गर्न मन पराउँथिन्।,तर अब उनी रोबिन चाहँदैनथिन्।,1
774,म आफ्नो काम छोड्ने संकल्प गरें।,मैले राजीनामा पत्र लेखिसकेको छु।,म चुपचाप कार्यालय गएँ र त्यो कुरा बुझाएँ।,मैले आफ्नो काम छोडें।,[पृष्ठ २३-मा भएको चित्र],म भोलि आफ्नो काममा फर्किएर काम गर्नेछु।,1
775,मैले कालो प्लास्टिकको गुलाबलाई पानीको भाँडोमा राखेँ।,मैले यसलाई केही हप्तासम्म मेरो किताबको शेल्फमा राखेको थिएँ।,दश जनाले मलाई सोधे।,उनीहरू जान्न चाहन्थे कि मैले किन पानी हालेर बनाएको फूल लगाएको थिएँ।,"साँचो कुरा भन्नुपर्दा, मलाई पनि किन हो भन्ने थाहा थिएन।",केही हप्तापछि फूल मरे।,1
776,बेनले कफीको लागि आफूलाई उपचार गर्ने निर्णय गरे।,उनले आफ्नो डेबिट कार्ड प्रयोग गरेर कफीको लागि भुक्तानी गरे।,"पछि, बैंकले उनलाई फोन गरेर उसले धेरै पैसा निकालेको बतायो।",[पृष्ठ २३-मा भएको चित्र],[पृष्ठ २३-मा भएको चित्र],बेन बैंकबाट फोन आएपछि खुसी थिए।,1
777,क्रिस यस हप्ताको दोस्रो पटक रोकिएका थिए।,[पृष्ठ २३-मा भएको चित्र],उनले आफ्नो फोनमा एउटा एप स्थापना गरेर फ्रेन्च भाषाको अभ्यास गर्न थाले।,विमानस्थलका अन्य एक व्यक्तिले उनको कुरा सुनेर सहयोगको प्रस्ताव गरे,संरक्षकले क्रिसलाई आधारभूत फ्रान्सेली कसरी बोल्ने भनेर सिकाउन मद्दत गरे।,मालिकले क्रिसलाई बुझ्न सकेनन् किनकि उसले चिनियाँ मात्र बोल्थ्यो।,1
778,"जब म बच्चा थिएँ, गुगल पहिलो पटक सुरु भयो।",मलाई याद छ मैले मेरो बुबालाई साइट कसरी प्रयोग गर्ने भनेर सोधेको थिएँ।,उनले मलाई कसरी टाइप गर्ने र खोज गर्ने भनेर सिकाए।,"म मोहित भएँ, र हरेक दिन आफ्नो डेस्कमा रमाइलो गर्दै बिताएँ।",मैले गुगलबाट धेरै कुरा सिकें।,म छिट्टै नै धेरै रिसाउँछु।,1
779,जेफ पदोन्नतिको लागि अन्तर्वार्तामा सहभागी हुन चाहन्थे।,[पृष्ठ २३-मा भएको चित्र],अन्तर्वार्ताको लागि तयार,उहाँ अन्तर्वार्तामा जानुभयो र उत्कृष्ट पास गर्नुभयो!,पदोन्नति पाउँदा उनी खुसी थिए।,उनले आफ्नो जागिर छोड्नुपर्ने महसुस गरे।,1
780,[पृष्ठ २३-मा भएको चित्र],जब उनी आठ हप्ताका थिए उनलाई एउटा प्यारा परिवारलाई दिइएको थियो।,तिनीहरूले उनलाई राम्ररी हुर्काए र उनले धेरै खुसी जीवन बिताए।,रिट्जको लागि एक दिन सबै कुरा परिवर्तन भयो जब उसको मालिकलाई क्यान्सर भयो।,[पृष्ठ २३-मा भएको चित्र],उसको मालिकले हरेक दिन १२ माइल दौडिन थाल्यो।,1
781,मियालाई बाहिरी वातावरणमा बस्न मन लाग्थ्यो।,"एक गर्मीमा, उनले पहाड चढ्ने निर्णय गरिन्।",उनी पहाड चढ्ने मानिसहरूको एउटा क्लबमा सामेल भइन्।,उनीहरू उनको क्षेत्रको सबैभन्दा अग्लो पहाडमा चढे।,मियालाई रमाइलो लाग्यो।,मियाले घरभित्रै बस्न चाहेकी थिइन्।,1
782,फ्रेडको मालिकले उनलाई प्रोपेन ग्याँस भर्ने स्टेशनको कार्यालयमा बोलाए।,उनले फ्रेडलाई भने कि समय कठिन छ र उनलाई कामबाट निकाल्नु पर्छ।,[पृष्ठ २३-मा भएको चित्र],उनले आफ्नो मालिकलाई कॉलरबाट उठाए र तल फ्याँकिदिए।,फ्रेडको मालिकले उनलाई ठूलो अंगालो हालेर समाते।,"फ्रेडको सहकर्मी जसले उनलाई आफ्नो मालिकमाथि आक्रमण गरेको देखेका थिए, पुलिसलाई बोलाए।",2
783,मेरी सासू पैसा बचत गर्न खोजिरहेकी छिन्।,[पृष्ठ २३-मा भएको चित्र],हालै उनले तीनवटा केबल बक्समध्ये दुईवटा फर्काएकी थिइन्।,मैले उनलाई भनें कि एन्टेनाहरू राम्रोसँग काम गर्छन् अब प्रसारणहरू एचडीमा छन्।,उनले थप केबल बक्सहरू किनिन्।,उनी यो सुनेर खुसी भए।,2
784,भिक्टर नयाँ खानेकुराहरू प्रयोग गर्नमा गर्व गर्छन्।,"तर, उनले कहिल्यै पिस्ता खाएका छैनन्।",एक दिन उनले घरमै खाने पिस्ताको भाँडो किने।,उसलाई यसको स्वाद मन पर्छ।,विक्टरले नियमित पिस्ता खरिद गर्ने निर्णय गरे।,विक्टरले आफ्नो स्वेटर जिममा छोडेको महसुस गर्छन्।,1
785,शेरोनले वर्षौंसम्म अज्ञात बीउको एउटा झोला राखेकी थिइन्।,एक दिन उनले बीउ रोप्ने निर्णय गरिन्।,स्यारोनले ती बिरुवाहरूलाई सानो बिरुवा हुने विश्वास गरेर रोप्ने भाँडामा राखेकी थिइन्।,स्यारोनले आफ्नो धारणामा अझ बढी गलत हुन सकेन!,उनले बियर खोलिन् र एक चुस्की लिइन्।,ती विशाल बिरुवाहरू भए।,2
786,बाहिरको दिन एकदमै सुन्दर थियो।,एमिलीले राम्रो मौसमको फाइदा उठाउन चाहन्थिन्।,उनले पार्क जाने निर्णय गरिन्।,एमिलीलाई आफ्नो कार चल्न नसक्दा निराश बनायो।,उनले आफ्नो छिमेकीलाई जम्प-स्टार्टको लागि सोधिन्।,उनले आफ्नो कार म्यानेज गर्नका लागि म्यानेजमा गएकी थिइन्।,1
787,टम दैनिक जीवनबाट थकित थिए।,"त्यसैले, उनले आफ्नो पहिचान लुकाउने निर्णय गरे।","पहिलो हप्ता त ठीक थियो, तर पानी सकियो ।",उनले दुई दिनसम्म दुःख भोगे तर अझै पनि कुनै पनि भेट्टाउन सकेनन्।,अन्ततः टम फेरि ग्रिडमा गए।,टमलाई उपवासको विचार मन पर्यो।,1
788,टिमले खगोल विज्ञान सिक्न चाहन्थे।,उनी बाहिरी अन्तरिक्षमा जान चाहन्थे।,यद्यपि उनी अन्तरिक्ष यात्री हुनका लागि धेरै युवा थिए।,यो समाचारले उनलाई दुःखी बनायो।,[पृष्ठ २-मा भएको चित्र],टिमलाई मार्स मन पर्दैनथ्यो।,1
789,मेरो सासू एउटा वृद्ध-गृहमा काम गर्छिन्।,उनी एक वेटरसिप हुन्।,उनले हामीलाई केन्द्रले जारी गरेको क्यालेन्डर दिइन्।,यसमा उनी सेन्ट प्याट्रिक डेको लागि सजिएको देखिएको थियो।,हामी सबैले सोचेकी थियौं कि मेरी बहिनी त्यसरी पहिरिएर एकदमै हास्यास्पद देखिन्थिन्।,मेरी बहिनीले हामीबाट केही कुरा लुकाउँदै थिइन्।,1
790,फ्रेडले एप्पलका केही सेयर किन्ने निर्णय गरे।,जब उनले यो किने त्यो शेयरको मूल्य ९० डलर थियो।,"भाग्यवस, उनीहरूले हिजो ठूलो कमाई गरे।",त्यसपछि शेयर १०० डलर पुगेको थियो।,फ्रेडले आफ्नो शेयर खरिदमा पछुतो व्यक्त गरे।,फ्रेड धेरै खुसी थिए।,2
791,जेन काउन्टीको वर्तनी प्रतियोगिताको तयारीमा निकै विश्वस्त थिइन्।,उनले विगत एक महिनादेखि हरेक रात शब्दकोश अध्ययन गर्दै आएकी थिइन्।,"जब मधुमक्खी सुरु भयो, जेन बाँचेकी थिइन् जबकि अरूलाई हराइदिएको थियो।",यो सबै अन्तिम दुईमा आयो र जेनको प्रतिद्वन्द्वीले गडबडी गर्यो।,जेनले हिज्जे प्रतियोगिता जितेकी थिई!,जेनले हिज्जे प्रतियोगिता हारेकी थिइन्।,1
792,केलीले वर्षौदेखि आफ्नो अपार्टमेन्ट छोडेकी छैन।,म आज उनको घर गएर नमस्कार गर्न गएँ।,म भन्न सक्थे कि उनी मलाई भित्र पस्न दिन्नन्।,हामीले केही समयसम्म उनको अवस्थाबारे कुरा गर्यौं।,केलीलाई आगन्तुकहरू मनपर्छ।,केलीलाई अगोरफोबिया छ।,2
793,एमिली समुद्र तटमा थिइन्।,मौसम सुरुमा शान्त थियो।,[पृष्ठ २-मा भएको चित्र],अन्ना एउटा डरलाग्दो बालुवाको आँधीमा फसेकी थिइन्!,समुद्र तटमा उनको रमाइलो समय थियो।,"भाग्यवस, उनी सुरक्षित रूपमा समुद्र तटको घर पुग्न सफल भइन्।",2
794,एन्ड्रयूले कहिल्यै कुनै कुराको लागि समस्या भोगेको थिएन।,उनका आमाबुबा यो हप्ताका लागि शहर बाहिर थिए।,एन्ड्रयूका साथीहरू आए र पिउन चाहन्थे।,एन्ड्रयूले आफ्ना आमाबाबुको लुकेको रक्सी निकाले।,एन्ड्रयूले आफ्ना आमाबाबुलाई मदिरा खान दिए हुन्थ्यो भन्ने चाहन्थे।,उनीहरूले रक्सी पिए र रक्सीले तातो भए।,2
795,एलेन गाउँमा बस्ने गर्थिन्।,उनी बिजुली नहुँदा बिताउने दिनहरू सम्झिन्छिन्।,[पृष्ठ २३-मा भएको चित्र],उनी धेरै चिसो भएकी थिइन्।,"जब बिजुली फेरि आयो, उनी खुसी भएकी थिइन्।",एलेन एकदमै सहज थिइन्।,1
796,जोसे उत्साहित थिए।,[पृष्ठ २३-मा भएको चित्र],उनले यसलाई सिधै स्केटपार्कमा लगे।,उनी दिनभर स्केटिङ गर्थे।,जोसे स्केटपार्कमा रमाइलो गर्थे।,जोसेले आफ्नो स्केटबोर्ड फ्याँक्यो।,1
797,माइक आफ्नो डेस्कमा बसिरहेका थिए।,"तर अचानक, उनको हातमा एउटा अनौठो खुजलीको अनुभूति भयो।",उनको खुट्टा पनि खुजली भएको थियो।,अनि उसको अनुहार पनि।,माइकलाई स्ट्रोक भएको थियो।,माइकले हाँस्न थाले।,1
798,जिल् गत महिना एउटा रोड ट्रिपमा गएकी थिइन्।,उनी बोस्टनबाट सिएटलसम्म यात्रा गर्न चाहन्थिन्।,आधा बाटोमा उनको गाडी बिग्रियो।,उनी एएएको प्रतीक्षामा सडकको छेउमा घण्टौ बसेकी थिइन्।,जिल्लाई उनीहरू छिट्टै आइपुगेकोमा खुसी लाग्यो।,उनीहरूले उनको गाडी मर्मत गरे र उनलाई आफ्नो बाटोमा पठाए।,2
799,विद्यालयको प्रमुखले शुक्रबार विद्यालय नृत्यको घोषणा गरे।,मेरी नृत्यको बारेमा उत्साहित भएकी थिइन्।,उनी डेनलाई स्कुलको नृत्यमा बोलाउन चाहन्थिन्।,डानले मेरीलाई हलमा देखे र उनलाई उनीसँग कुरा गर्न चाहेको बताए।,उनले आफ्नो बाइक चोरेकोमा उसलाई दोष दिए।,उनी खुसी थिइन् कि उनले उनलाई नाचमा बोलाए।,2
800,न्यूयोर्कमा अर्गानिक एभिन्यूको एउटा नयाँ पसल खुलेको थियो र मैले त्यहाँ गएर जाँच गरेँ।,म यसलाई प्रयोग गर्न एकदम उत्साहित थिएँ किनकि म पहिले कहिल्यै गएको थिइनँ।,म भित्र पस्दा त्यहाँ अद्भुत सलाद र रसहरू थिए।,मैले ग्रीष्मकालीन सलाद र नरिवलको पानी खाएँ।,मैले त्यो रेस्टुरेन्टमा फेरि कहिल्यै नजाउने निर्णय गरेँ।,यो मेरो नयाँ मनपर्ने रेस्टुरेन्ट थियो।,2
801,सिन्डीको कोठाको पर्खाल सेतो थियो।,[पृष्ठ २३-मा भएको चित्र],[पृष्ठ २३-मा भएको चित्र],उनले आफ्नो कोठामा बढी आरामदायक भएको महसुस गरिन्।,उनले यसलाई घृणा गरे र कालो रंगमा परिवर्तन गरिन्।,उनी परिणामबाट खुसी थिइन्।,2
