,input_sentence_1,input_sentence_2,input_sentence_3,input_sentence_4,sentence_quiz1,sentence_quiz2,answer_right_ending
1108,डेनले हेलोवीनमा शैतानको पोशाक लगाएर स्कूल जान चाहन्थे।,उनी आफ्नो बुबालाई पोशाक माग्न डराएका थिए।,उनले आफ्नो हजुरआमालाई सोधे।,उनले उसलाई शैतानको रूपमा जानु नराम्रो हो भनेकी थिइन्।,डानकी हजुरआमा पहिले नै शैतानको रूपमा पहिरिएका थिए।,डानले आफ्नै शैतानको पोशाक बनाए।,2
1109,फ्रांजले आफ्नो परिवारसँग नजिक हुन चाहेको निर्णय गरे।,उनले आफ्नो भान्जालाई भेट्न फिलाडेल्फियाको यात्रा बुक गरे।,फ्रान्ज र उनका भान्जा संग्रहालय घुम्न र कफी पिउन जान्छन्।,उनीहरूसँग एकसाथ शानदार भेटघाट हुन्छ।,फ्रांजले आफ्नो भान्जालाई फेरि कहिल्यै भेट्ने प्रतिज्ञा गरेनन्।,फ्रांज आफ्नो भान्जालाई भेट्न गएकामा खुसी छन्।,2
1110,मैले १० वर्षको हुँदा एउटा सींग भएको भ्यागुता किनेको थिएँ।,यो एउटा डिपार्टमेन्ट स्टोरमा थियो।,त्यो भ्यागुता एकदमै क्रुर देखिन्थ्यो।,हामीले त्यसलाई खुवाउने प्रयास गर्यौं तर त्यसले खान मानेन।,[पृष्ठ २३-मा भएको चित्र],"केही हप्तापछि, सिङ भएको भ्यागुता एकदम मोटो भयो।",1
1111,मैले आज नैन्सीलाई पहिलो पटक भेटेँ।,उनी जानुअघि हामीले फोन नम्बर आदानप्रदान गर्यौं।,"एक क्षणको लागि हिँड्न सके पनि, उनले मलाई निरन्तर सन्देश पठाइरहेकी थिइन्।",मैले उसलाई फोन गरेर मलाई फोन नगर्न भनेँ।,उनलाई केरा खान मन थियो।,मैले फेरि उनको खबर पाइनँ।,2
1112,हिजो केली केही चकलेट किन्न सीवीएस गएकी थिइन्।,उनी आफूले चाहेको कुरा खोज्नको लागि माथि-तल हिंड्थिन्।,[पृष्ठ २३-मा भएको चित्र],उनीहरूबीच केही समय कुराकानी भयो।,दुवै पक्राउ परे।,[पृष्ठ २३-मा भएको चित्र],2
1113,डोनको पहिलो दिनको काममा केही समस्याहरू थिए।,उनी भारी मेसिनरीको वरिपरि हुँदा चिन्तित थिए।,एक पटक उनले एउटा भारी सामान ल्याए।,यसले लगभग एक सहकर्मीलाई ठक्कर दियो।,डनलाई काममा नर्भस नहुँदा खुसी लाग्यो।,[पृष्ठ २३-मा भएको चित्र],2
1114,डेललाई कलेज पढ्न पैसा चाहिएको थियो।,उनले एक स्थानीय गिरोहको लेखाको काम गर्न थाले।,"जब फेडरलले गिरोहमा छापा मारे, उनी उनीहरूको खातामा जाँदै थिए।",उनी दुर्घटनामा परेर गोली हानी मारिएका थिए।,डेलले गलत निर्णय गरे।,डेलले एउटा बुद्धिमानी निर्णय गरे।,1
1115,आज स्कुलमा चित्र दिवस थियो।,एलिस यति उत्साहित थिइन् किनभने उनको आमाले उनलाई नयाँ पोशाक किन्नुभएको थियो।,"उनी उठिन्, लुगा लगाइन् र आमाले उनको कपाल मिलाइदिए।",फोटोग्राफरले उनी धेरै सुन्दर थिइन् भने।,एलिसलाई फोटोग्राफरले उनको प्रशंसा गरेपछि राम्रो लाग्यो।,एलिसले आफ्नो तस्वीरको समयमा अनुहारमा कम्मर ठोकेकी थिइन्।,1
1116,निलाकी आमालाई चौथो चरणको क्यान्सर भएको थियो।,निलालाई थाहा थियो कि उनको आमाको जीवन धेरै लामो छैन।,निलाले आफ्नो आमाको मृत्युसम्म राम्रो जीवनको सुनिश्चितता गरिन्।,निलाले आफ्नी आमासँग धेरै राम्रा सम्झनाहरु पोख्छिन् र उनीहरु खुसी थिए।,निलाले आफ्नी आमाको ख्याल गर्दिनथिन्।,निलाले आफ्नी आमालाई माया गर्थिन्।,2
1117,नयाँ जन्मेको छोरा,उनले उनीहरूको सँगैको भविष्यको सपना देखेकी थिइन्।,उनको सपना थियो कि उनीलाई नदिएको बाल्यकाल उनीलाई दिऊँ ।,[पृष्ठ २३-मा भएको चित्र],छोराले बाल्यकालमा धेरै दुःख भोग्यो।,त्यो केटाको बाल्यकाल एकदमै खुसी थियो।,2
1118,जेसिका र उनका भाइहरू क्रिसमसको लागि धेरै उत्साहित थिए।,उनीहरू बिहानै सुत्थे ताकि बिहानै उठ्न सकून्।,तिनीहरू उठे र क्रिसमस ट्रीतिर दौडे।,त्यहाँ रूखमुनि एउटा मात्र बक्स थियो।,जेसिकाले सोचिन् कि के उनीहरू धेरै चाँडै उठेका थिए?,तिनका भाइहरूले क्रिसमसको उपहार खोले।,1
1119,जान र किम दुवैले मोन्टेस्सोरी शिक्षा मोडेल प्रयोग गरिरहेका थिए।,किमले आफ्नो बच्चाबाट सबै ड्र्यागन र फ्यान्टेसी पुस्तकहरू लिन निर्णय गरेकी थिइन्।,किमले यो निर्णय गरेपछि जान निकै दुःखी भएकी थिइन्।,जनले तर्क गरे कि कल्पना र कल्पना महत्वपूर्ण थियो।,जानले किताबहरू फालिदिए।,जनले पुस्तकहरू फिर्ता ल्याए।,2
1120,स्कुलको पहिलो दिन म त्यहाँ दुई जना नजिकका साथीहरूसँग गएँ।,हामी सबै धेरै चिन्तित थियौं।,जब हामी स्कुलमा आइपुग्यौं हामीले कक्षाको सूची जाँच गर्यौं तेस्रो कक्षाको लागि।,[पृष्ठ २३-मा भएको चित्र],हामी आफ्नो भाग्यमा विश्वास गर्न सकेनौं।,[पृष्ठ २-मा भएको चित्र],1
1121,जेफ आफ्नो छिमेकीको कुकुरले सधैं बिहान हास्ने गरेकोमा क्रोधित थिए।,र भौंकने आवाजले जेफलाई सधैं बिहानै उठायो।,"एक दिन, उसको छिमेकीले आफ्नो कुकुरलाई अरूलाई दिए।",अनि जेफ खुसी भए कि उनले अरू कुनै बार्ने आवाज सुनेनन्।,जेफले अन्ततः शान्ति र शान्ती पाउने थिए।,जेफले त्यो कुकुरलाई मिस गर्न लागेका थिए।,1
1122,होलीले आफ्नो भाइलाई आफ्नो पछाडि सनटान लोसन लगाउन भन्यो।,[पृष्ठ २३-मा भएको चित्र],"त्यस दिनको अन्तमा, होलीले मानिसहरूले किन हाँस्दैछन् भनेर सोच्न थालिन्।",पछि उनले थाहा पाएकी थिइन् कि उनका भाइले लोसनको प्रयोग गरेर एउटा डिजाइन बनाएका थिए।,होलीले आफ्नो भाइलाई बदला लिनको लागि चिच्याइन्।,होलीले भाइलाई क्षतिपूर्तिको रूपमा पैसा दिएकी थिइन्।,1
1123,म मेरी श्रीमतीको रातीको बत्ती भएकोमा मजाक गर्थें।,उनी केही दिनका लागि शहर बाहिर थिइन् र म उनी बिना सुत्न गएँ।,मध्यरातमा पानी लिन उठ्दा मैले ठेस खाएँ।,मैले भुइँमा लुगाहरू देख्न सकिनँ र एउटा नराम्रो चोट लाग्यो।,मैले रातको बत्तीलाई स्थायी रूपमा हटाउने निर्णय गरेँ।,मैले फेरि मेरी श्रीमती र उनको रातको बत्तीको मजाक कहिल्यै गरेन।,2
1124,एमीले विस्कन्सिनबाट फ्लोरिडा जाने निर्णय गरिन्।,[पृष्ठ २३-मा भएको चित्र],सार्ने दिन उनले आफ्ना साथीहरूलाई बिदाइ गरिन्।,उनी एक्लै फ्लोरिडासम्म आइन्।,"तर, उनले अलास्कामा रमाइलो गर्न पाइन्।","तर, ती साथीहरू बिना यो अनुभव रमाइलो थिएन।",2
1125,क्याथी किनमेल गर्न गएकी थिइन्।,उनले एउटा राम्रो जुत्ता पाएकी थिइन्।,ती जुत्ता ३०० डलरका थिए।,उनले जुत्ता किनिन्।,क्याथीलाई जुत्ता किन्न मन लाग्दैनथ्यो।,उनले खरिद गरेपछि खरिदकर्ताको पश्चाताप महसुस गरिन्।,2
1126,अमायाको जन्मदिन आउँदैछ।,उनी पाँच वर्षकी हुनेछिन।,उसकी आमाले उसको लागि राजकुमारीको पार्टी दिदैछिन्।,उनी आफ्ना धेरै साथीहरूलाई स्कूलबाट बोलाउँछिन्।,अमाया आफ्नो पार्टीमा राजकुमारी हुन पाउँदा खुसी छिन्।,अमाया उदास छिन् किनकि उनी चियापान चाहँदैनन्।,1
1127,आज म र मेरा साथीहरू समुद्र तटमा गयौं।,हामीसँग फ्रिस्बी र बल थियो।,पानीमा खेल्दा केही अन्य मानिस पनि यसमा सामेल भए।,नयाँ साथीहरू भेट्नु राम्रो थियो।,नयाँ केटाहरूसँग भेटघाट गर्न पाउँदा म साँच्चै खुसी भएँ।,"समग्रमा, यो पैदल यात्राको एउटा उत्कृष्ट दिन थियो।",1
1128,यो शुक्रबारको रात थियो त्यसैले मैले एउटा चलचित्र भाडामा लिने निर्णय गरें।,म एउटा लिन रेडबक्समा गएँ।,"निर्णय गर्न एक घण्टा लाग्यो, अन्ततः मैले द डिपार्टेडलाई रोजें।","म घर पुगें र केही खाजा बनाएँ, त्यसपछि फिल्म राख्न गएँ।",यो मैले लामो समयदेखि हेरेको सबैभन्दा राम्रो चलचित्र थियो।,मैले नुहाएँ र काममा गएँ।,1
1129,पाउलाले धेरै बोलेको शब्द कविता लेखिन्।,"उनका साथीहरूले उनलाई सहयोग गरे, यद्यपि यो खराब थियो।",तिनीहरूले उनलाई एउटा पार्टीमा निम्तो दिए।,पाउलाले केही बोलेको शब्दहरू सुनाउन थालिन्।,उनका साथीहरूले उनको कविताको प्रशंसा गरे।,पाउलाले आफ्नो कविता फालिदिएकी थिइन्।,1
1130,स्कुल बसबाट उत्रिएपछि मैले मेरो फोन हराएको महसुस गरेँ।,मैले यसलाई रद्द गर्ने निर्णय गरें।,ग्राहक सेवा प्रतिनिधिले मेरो लागि यो गरे।,यसका अतिरिक्त उनले जमैकामा फोन गरिएको पनि बताए।,मलाई थाहा थियो कि कसैले यसलाई चोरेको थियो।,मलाई थाहा थियो कि कसैले चाँडै नै फोन फिर्ता गर्नेछ।,1
1131,आइरिसको आज पाँचौं जन्मदिन थियो!,उनकी आमाले उनको लागि एउटा सरप्राइज पार्टीको योजना बनाएकी थिइन्।,उनका सबै साथीहरू त्यहाँ थिए।,उनले उपहार खोलिन् र केक खाइन्।,आइरिसले आफ्नो पार्टीमा धेरै रमाइलो गरेकी थिइन्।,आइरिसले फेरि केक नखाने निर्णय गरिन्।,1
1132,टिना समुद्र तटमा जाँदा सधैं रातो बिकिनी लगाउँथिन्।,उनी यसका लागि परिचित थिइन् र सबैले उनलाई एउटामा देख्ने अपेक्षा गरेका थिए।,एक दिन उनले नीलो बिकिनीमा आफ्ना साथीहरूलाई भेटिन् र उनीहरूलाई आश्चर्यचकित गरिन्।,उनीहरूले बुझ्न सकेनन् कि उनले किन फरक पहिरन लगाइन्।,"तर, नयाँ बिकिनी मन पर्यो।",टिनाका साथीहरूलाई थाहा थियो कि उनी कति अप्रत्याशित थिइन्।,1
1133,टेडले घरको मालिक बन्ने सपना देखेका थिए।,[पृष्ठ २३-मा भएको चित्र],टेडको जीवन,टेडका पिताले टेडसँग घरको लागि अग्रिम रकम बाँड्न सहयोग गरे।,टेडले अब घर मालिक हुन नचाहेको बताएका थिए।,टेडले आफ्नो बुबालाई सहयोग गरेकोमा धन्यवाद दिए।,2
1134,इवी घण्टासम्म महलको वरिपरि घुमिरहेकी थिइन्।,उनले भवनको हरेक कुनाको जाँच गरिन्।,[पृष्ठ २३-मा भएको चित्र],उनले ती प्रश्नहरूको सरल र सरल जवाफ दिइन्।,उनी आफैमा गर्व गर्थिन्।,उनी आतंकित भएर भागेकी थिइन्।,1
1135,एड र उनका जुम्ल्याहा भाइ इथनले अनलाइनमा महिलाहरू खोजिरहेका थिए।,त्यसपछि उनीहरूले दुई जुम्ल्याहा महिलाको प्रोफाइल देखे।,उनीहरुले सामी र सारालाई फोन गरेर भेटघाटको व्यवस्था गरे।,[पृष्ठ २३-मा भएको चित्र],[पृष्ठ २३-मा भएको चित्र],उनीहरूले एक अर्कालाई फेरि नदेख्ने निर्णय गरे।,1
1136,मार्कोले आज नयाँ काम सुरु गर्दैछ।,पहिलो दिन राम्रो देखिने चाहना छ।,मार्कोले टाई लगाउने निर्णय गरे।,नयाँ मालिकले उनी कत्ति राम्रो देखिन्छन् भनेर चकित छन्।,[पृष्ठ २-मा भएको चित्र],मार्को आफ्नो मालिकको प्रतिक्रियाबाट भयभीत छन्।,1
1137,टिमले विदेश यात्रा गर्न चाहन्थे।,उनी पहिला कहिल्यै विमानमा चढेका थिएनन्।,उनले हवाई यात्रा गरेर चीन जाने निर्णय गरे।,[पृष्ठ २३-मा भएको चित्र],टिमले फेरि अर्को विमानमा नउठ्ने कसम खाए।,टिमले हवाईजहाजबाट धेरै ठाउँको यात्रा गर्न थाले।,2
1138,लुसीको भोलि स्कुलमा एउटा परीक्षा थियो र उनले मुश्किलले पढेकी थिइन्।,यो पहिले नै धेरै ढिलो थियो र त्यो ओछ्यानमा प्राप्त थियो.,हिउँका कारण अर्को बिहानको विद्यालय लुकेको थियो।,लुसी भाग्यमानी थिइन र उनले आफ्नो पूरा दिन परीक्षाको लागि अध्ययन गर्न बिताइन्।,लुसीले परीक्षामा उत्कृष्ट अंक ल्याएकी थिइन्।,लुसी परीक्षामा असफल भइन् किनभने उनले अध्ययन गरेकी थिइनन्।,1
1139,फ्रेडलाई रहस्यमय उपन्यासहरू मन पर्दथ्यो।,हरेक महिना कम्तीमा एउटा पढ्थे।,"जब उनका साथीहरूले थाहा पाए, सबैले उनको जन्मदिनको लागि एउटा उपहार दिए।","तर दुर्भाग्यवश, उनी ध्यानबाट चिढिन थाले।",फ्रेडले आफ्ना साथीहरूलाई भने कि उनी रहस्य उपन्यासबाट विश्राम लिइरहेका छन्।,फ्रेडले आफ्ना साथीहरूको लागि रहस्य उपन्यास पुस्तक क्लब सुरु गरे।,1
1140,टिआको आफ्नै बेकरी थियो।,उनले आफ्नो बेकरीमा सुन्दर केकहरू बनाएकी थिइन्।,[पृष्ठ २३-मा भएको चित्र],उनले शहरभरि फोन गरिन् र अन्ततः केही भेटिन्।,टिआ निराश भएकी थिइन्।,टिआलाई राहत मिल्यो।,2
1141,सारा आफ्ना साथीहरूसँग पानी पार्कमा गइन्।,उनीहरूले टिकट तिरे र पौडी पोशाक लगाए।,तिनीहरू सबैभन्दा ठूलो स्लाइडको लागि लाइनमा पर्खिरहेका थिए।,उनीहरू स्लाइडमा तल गए र धेरै रमाइलो गरे।,तिनीहरूले कहिल्यै फर्केर नआउने कसम खाए।,अर्को दिन उनीहरू फेरि गए।,2
1142,जेबले ढुङ्गाबाट मूर्तिहरू बनाउँदै थिए।,उनले एउटा यस्तो बनाए जुन कछुवा जस्तो देखिन्थ्यो।,साम आएर त्यसलाई भत्काए।,जेब रोए।,साम हाँसे र भागे।,जेब नयाँ निर्माण गर्न उत्साहित थिए।,1
1143,जेफ आफ्नो कक्षाका साथीहरूसँग वर्षाको जंगलको भ्रमणमा जाँदैछन्।,जेफ उत्साहित छन् र उनी जान चाहन्छन्।,जब जेफ आइपुगे उनी निकै निराश थिए।,वर्षा वन रमाइलो थिएन र त्यहाँ गर्न केही पनि थिएन।,जेफले रमाइलो गरे।,जेफ बोरिस र निराश थिए।,2
1144,डैनी सघन उपचार कक्षमा नर्स थिइन्।,एक रात उनको बिछोडिएका पिता उनको एक बिरामी थिए।,"डैनीले चाहेकी थिइनन्, तर उनले आफ्नो बुबाको उपचार गरिन्।",[पृष्ठ २३-मा भएको चित्र],दानी त्यस दिनको घटनाबाट आश्चर्यचकित भएनन्।,डैनीले आफ्नो बुबालाई अझ राम्ररी चिन्न थालिन्।,2
